,title,text,link,publish_date
11,GOP lawmakers would strip citizenship from terrorists after attacks tied to naturalized citizens,"<p>Rep. Riley Moore, R-W.Va., announced plans Thursday to introduce legislation allowing the U.S. to denaturalize and deport naturalized citizens who <a href=""https://www.foxnews.com/category/world/terrorism"" rel=""noopener"" target=""_blank"">commit or support terrorism</a> after a recent string of attacks involving immigrants who obtained citizenship.</p><p>On Thursday, Moore called out the ""horrific pattern"" of naturalized citizens committing acts of terror against the American people, saying it ""must end.""</p><p>Moore announced he will be introducing a bill in <a href=""https://www.foxnews.com/category/us/congress"" rel=""noopener"" target=""_blank"">Congress</a> to denaturalize and deport any naturalized citizen who commits an act of terror, plots to unleash terror, joins a terrorist group or otherwise aids and abets terrorism.</p><p>Almost immediately, Rep. Brandon Gill, R-Texas, and Rep. Randy Fine, R-Fla., vowed to support the bill.</p><p><a href=""https://www.foxnews.com/us/old-dominion-university-rotc-cadets-disarm-isis-supporter-shouting-allahu-akbar-during-shooting-officials"" rel=""noopener"" target=""_blank""><strong>OLD DOMINION UNIVERSITY ROTC CADETS DISARM ISIS SUPPORTER SHOUTING 'ALLAHU AKBAR' DURING SHOOTING: OFFICIALS</strong></a></p><p>This week, Ayman Mohamad Ghazali, a naturalized U.S. citizen originally from Lebanon, allegedly attempted to ram his vehicle into a Michigan synagogue filled with children and teachers. The same day at Old Dominion University in Norfolk, Virginia, Mohamed Bailor Jalloh, a naturalized citizen from Sierra Leone, opened fire on a class of Reserve Officer Training Corps (ROTC) students, killing Lt. Col. Brandon Shah.</p><p>Days before, Emir Balat and Ibrahim Kayumi, the children of naturalized citizens from Turkey and Afghanistan, allegedly attempted to bomb an anti-Islam demonstration outside the mayor’s mansion in New York City. At the start of the month, Senegalese-born naturalized citizen Ndiaga Diagne killed three people and injured over a dozen in a shooting in Austin.</p><p>After this week’s attacks, Sen. Eric Schmitt, R-Mo., renewed his call to pass another bill known as the Stop Citizenship Abuse and Misrepresentation (SCAM) Act. </p><p>Schmitt is the Senate sponsor of the bill, which, if passed, would expand and clarify grounds for denaturalization if an individual participates in fraud against a government program, joins a terrorist organization or is convicted of an aggravated felony or espionage. </p><p>The bill was introduced in the House in January by Majority Whip Tom Emmer, R-Minn., amid widespread outrage over the rampant Medicaid and children's services fraud scandal, which heavily involved the Somali immigrant community.</p><p><a href=""https://www.foxnews.com/world/trump-warns-iranian-sleeper-cells-canada-accused-harboring-regime-operatives"" rel=""noopener"" target=""_blank""><strong>TRUMP WARNS OF IRANIAN 'SLEEPER CELLS' AS CANADA IS ACCUSED OF HARBORING REGIME OPERATIVES</strong></a></p><p>On Thursday, Schmitt posted on X that ""after the <a href=""https://www.foxnews.com/politics/senate-gop-eyes-blame-game-trump-backed-save-act-heads-defeat"" rel=""noopener"" target=""_blank"">SAVE America Act</a>, we must pass the SCAM Act so we can denaturalize &amp; deport those who are here to hurt Americans. We must denaturalize those who shouldn't be here.""</p><p>Under current laws, the U.S. government may strip citizenship from a naturalized individual only in very limited circumstances, such as when it was obtained through fraud. There is also a very high standard of proof on the government to show that fraud occurred during the process of obtaining citizenship.</p><p>The SCAM Act, however, would expand the government’s ability to denaturalize, allowing it to revoke citizenship from a person who engages in terrorism, commits fraud, commits espionage or commits felonies within 10 years of becoming a citizen.</p><p><a href=""https://www.foxnews.com/video/6390767455112"" rel=""noopener"" target=""_blank""><strong>WE'RE IN DANGER OF MORE TERROR ATTACKS — AND THIS IS THE MOST INDEFENSIBLE PART OF IT ALL: SEN TED CRUZ</strong></a></p><p>In another post, Schmitt emphasized ""we need to give the Trump admin the SCAM Act. Under current law, it is practically impossible to denaturalize these terrorists.""</p><p>He said the SCAM Act ""will allow the Trump admin to denaturalize and deport those who should never have been granted citizenship in the first place.""</p>",https://www.foxnews.com/politics/gop-lawmakers-promise-bill-strip-citizenship-from-terrorists-after-attacks-tied-naturalized-citizens,2026-03-13
12,Trump says US ‘obliterated’ military targets in strike on key Iranian oil hub: 'Powerful bombing raids',"<p>President <a href=""https://www.foxnews.com/category/person/donald-trump"" rel=""noopener"" target=""_blank"">Donald Trump</a> said Friday that the U.S. had carried out a bombing raid on Iran’s Kharg Island, a strategically vital island in the Persian Gulf that serves as the country’s largest oil terminal and a crucial hub for its crude exports.</p><p>""Moments ago, at my direction, the United States Central Command executed one of the most powerful bombing raids in the history of the Middle East, and totally obliterated every MILITARY target in Iran’s crown jewel, Kharg Island,"" Trump wrote on <a href=""https://truthsocial.com/@realDonaldTrump/posts/116224324444349237"" rel=""nofollow noopener"" target=""_blank"">Truth Social</a>.</p><p>The island, located roughly 35 miles off Iran’s Bushehr province in the country’s southwest, is about the size of New York City’s Central Park but carries huge importance for Iran’s economy.</p><p>It has a loading capacity of about 7 million barrels per day, and roughly 90% of Iran’s crude oil exports pass through it. Most of those exports are shipped to China and India, underscoring the island’s importance not only to Iran’s <a href=""https://www.foxnews.com/category/energy"" rel=""noopener"" target=""_blank"">energy</a> trade but also to broader global oil markets.</p><p><a href=""https://www.foxnews.com/politics/new-satellite-images-reveal-fires-damage-iranian-naval-bases-after-us-israeli-strikes"" rel=""noopener"" target=""_blank""><strong><u>BEFORE-AND-AFTER SATELLITE IMAGERY OFFERS A RARE LOOK AT DAMAGE INSIDE IRAN</u></strong></a></p><p>That makes Kharg Island one of Iran’s most sensitive and strategically important pieces of infrastructure. Any military action there could have consequences well beyond Iran, raising the risk of disruptions to crude flows, shipping traffic and energy prices across the region.</p><p>Trump said the U.S. had deliberately avoided targeting the island’s oil infrastructure, while warning that could change if Iran moved to disrupt shipping through the Strait of Hormuz.</p><p>""Our Weapons are the most powerful and sophisticated that the World has ever known but, for reasons of decency, I have chosen NOT to wipe out the Oil Infrastructure on the Island. However, should Iran, or anyone else, do anything to interfere with the Free and Safe Passage of Ships through the Strait of Hormuz, I will immediately reconsider this decision,"" Trump added.</p><p><a href=""https://www.foxnews.com/politics/unlikely-tool-trump-eyeing-tackle-rising-oil-prices-amid-iran-conflict"" rel=""noopener"" target=""_blank""><strong><u>THE UNLIKELY TOOL TRUMP IS EYEING TO TACKLE RISING OIL PRICES AMID THE IRAN CONFLICT</u></strong></a></p><p>The latest revelation comes as the widening conflict in the Middle East rattles global energy markets and raises fresh fears about the security of the Strait of Hormuz, the world’s most important oil choke point.</p><p>The Strait of Hormuz, a narrow passage between Iran, the United Arab Emirates and Oman, carries roughly 20 million barrels of oil a day and about one-fifth of the global supply of liquefied natural gas (LNG). When conflict flares in the region, even the threat of disruption can rattle markets because so much of the world’s energy moves through that single corridor.</p><p>That threat is already rippling through energy markets.</p><p>This week, benchmark oil prices punched back above $100 a barrel for the first time since 2022, underscoring how quickly geopolitical shocks can ripple through the energy complex.<br /><br />That jump is showing up at the pump. As oil prices climb, <a href=""https://www.foxnews.com/politics/gas-prices-could-jump-middle-east-tensions-threaten-global-oil-supply"" rel=""noopener"" target=""_blank"">gasoline and diesel prices</a> are rising fast — especially diesel, which can move quickly because it’s tied closely to freight and industrial demand.<br /><br />On Friday, the national average for regular gasoline rose to about $3.63 a gallon, according to AAA.  Diesel prices have also jumped, with the national average up $1.23 to $4.89 a gallon.</p><p>As energy costs accelerate, the White House is weighing steps to safeguard commercial shipping through the Strait of Hormuz and leaning on emergency stockpiles to cushion the blow.</p><p>Before boarding Air Force One for Mar-a-Lago late Friday, Trump told reporters the U.S. Navy may start escorting tankers through the Strait ""very soon.""</p><p>Asked about the risk of disruptions, Trump said Monday evening he would keep the route open and threatened retaliation if Iran tried to interfere.</p><p>""I will not allow a terrorist regime to hold the world hostage and attempt to stop the globe's oil supply. And if Iran does anything to do that, they'll get hit at a much, much harder level,"" Trump said during a news conference in Florida.</p><p>""In the long run, oil supplies will be dramatically more secure without the threat of Iranian ships, drones, missiles,"" he added.</p>",https://www.foxnews.com/politics/trump-says-u-s-obliterated-targets-strike-key-iranian-oil-hub,2026-03-13
13,Dem senators in the hot seat as Republicans rip their DHS vote amid terror threats: 'Under attack',"<p>Sen. <a href=""https://www.foxnews.com/category/person/adam-schiff"" rel=""noopener"" target=""_blank"">Adam Schiff,</a> D-Calif., claimed he offered Republicans a chance to spare the Federal Emergency Management Agency (FEMA) from the ongoing government shutdown that’s poised to hit the one-month mark on Saturday after another failed DHS vote on Thursday.</p><p>Republicans believe the offer was little more than political theater that ignored the core of the funding gridlock as concerns about Iranian sleeper cell threats and airport chaos rise. </p><p>""I just offered a UC to fund FEMA and Republicans shot it down,"" Schiff said, referring to the Senate process to pass legislation on the spot, known as ""unanimous consent.""</p><p>Sen. Katie Britt, R-Ala., a lawmaker who has blocked UCs on the shutdown in the past, blasted Democrats for, in her view, trying to punt the negotiations on larger DHS disagreements.</p><p><a href=""https://www.foxnews.com/live-news/homeland-security-shutdown-march-12-live-updates""><strong>SENATE TO TAKE TEST VOTE TO END 27-DAY DHS SHUTDOWN</strong></a></p><p>""We would like that opportunity to continue funding the Department of Homeland Security in its entirety. Look, the people who sent us here expect more,"" Britt said in remarks on the Senate floor.</p><p>""They expect us to have tough conversations. They expect us to figure out a pathway forward. And that’s exactly what we’re trying to do today.""</p><p>A fired-up Senate Majority Whip John Barrasso, R-Wyo., accused Senate Democrats of trying to rip the agency apart at a moment it was designed for, as the war in Iran has spurred threats of retaliation in the U.S. by sleeper cells.</p><p>""And that’s at a time when our homeland is under attack, all warning lights are flashing red, and they want to peel apart, piece by piece, the Department of Homeland Security, the comprehensive department of our government to protect the American people, because they want to stand with illegal immigrant criminals,"" Barrasso said.</p><p>Schumer declared that Senate Democrats would continue to provide piecemeal funding bills to reopen certain portions of the agency, like the Transportation Security Administration (TSA) and the Federal Emergency Management Agency (FEMA), while negotiations continued.</p><p>Funding for the Department of Homeland Security lapsed on February 14 over gridlock of a set of demands Democrats made regarding operational reforms for Immigration and Customs Enforcement (ICE) — reforms Republicans believe will handcuff President <a href=""https://www.foxnews.com/category/person/donald-trump"" rel=""noopener"" target=""_blank"">Donald Trump's</a> immigration crackdown.</p><p>FEMA was slated to receive $32 billion in 2026, according to the <a href=""https://www.appropriations.senate.gov/imo/media/doc/fy26_homeland_bill_summary_conferenced.pdf"" rel=""noopener noreferrer nofollow"" target=""_blank"">Senate Appropriations Committee.</a></p><p>Among other items, Democrats have demanded a no-mask policy, an end to roaming patrols, stiffer warrant requirements for detentions and clearly visible identification for <a href=""https://www.foxnews.com/category/topic/government-shutdown"" rel=""noopener"" target=""_blank"">ICE agents.</a></p><p><a href=""https://www.foxnews.com/politics/dhs-shutdown-drags-week-two-iran-threat-sotu-clash-complicate-hill-talks"" rel=""noopener"" target=""_blank""><strong>DHS SHUTDOWN DRAGS INTO WEEK TWO AS IRAN THREAT, SOTU CLASH COMPLICATE HILL TALKS</strong></a></p><p>Although talks are ongoing, lawmakers have said critical disagreements remain.</p><p>Like ICE, the Federal Emergency Management Agency (FEMA) operates under DHS alongside other agencies like the Coast Guard, the Secret Service and the Transportation Security Administration (TSA).</p><p>Lawmakers on both sides of the aisle have voiced concern that the unrelated reforms to ICE that Democrats have demanded are threatening the country’s readiness to respond to natural disasters.</p><p>Sen. Maria Cantwell, D-Wash., hinted that <a href=""https://www.foxnews.com/category/democrats"" rel=""noopener"" target=""_blank"">Democrats would like</a> to eliminate that possibility.</p><p>""We just asked for a UC to get it done… so,"" Cantwell said on the <a href=""https://www.foxnews.com/category/politics/executive/homeland-security"" rel=""noopener"" target=""_blank"">DHS funding dispute.</a></p><p><a href=""https://www.foxnews.com/politics/tsa-workers-brace-missed-paychecks-democrats-hold-firm-dhs-funding"" rel=""noopener"" target=""_blank""><strong>TSA WORKERS BRACE FOR MISSED PAYCHECKS AS DEMOCRATS HOLD FIRM ON DHS FUNDING</strong></a></p><p>According to Sens. Susan Collins, R-Maine, and Katie Britt, R-Ala., DHS employees missed their first full paycheck this week. Additionally, FEMA reserve funding has dropped to $4 billion, the primary account used to coordinate <a href=""https://www.foxnews.com/politics/dhs-shutdown-leaves-local-emergency-responders-own-amid-extreme-weather-expert-warns"" rel=""noopener"" target=""_blank"">disaster response and recovery</a> efforts.</p><p><i>Fox News Digital's Alex Miller contributed to this report.</i></p>",https://www.foxnews.com/politics/dem-senators-hot-seat-republicans-rip-dhs-vote-terror-threats-under-attack,2026-03-13
14,Charges dropped against teens after teacher dies in senior prank incident outside his home,"<p>A widow whose <a href=""https://www.foxnews.com/category/us/education/teachers"" rel=""noopener"" target=""_blank"">teacher-husband</a> was killed in a senior prank gone terribly wrong has been granted her unusual request to drop the charges against the teens involved.</p><p>According to the Hall County Magistrate Court, a judge has approved paperwork requesting dismissal <a href=""https://www.foxnews.com/us/wife-teacher-killed-senior-prank-makes-unexpected-request-charged-students"" rel=""noopener"" target=""_blank"">of the charges</a> against Jayden Wallace, Aiden Hucks, Ana Katherine Luque, Ariana Cruz, and Elijah Tate Owens.</p><p>The five teens, who are all 18, went to math teacher Jason Hughes’ house on the night of March 6 to roll toilet paper on his trees, according to authorities in Gainesville, Georgia.</p><p><a href=""https://www.foxnews.com/us"" rel=""noopener"" target=""_blank""><strong>CLICK HERE FOR MORE US NEWS</strong></a></p><p>As the group tried to leave in two separate vehicles, Hughes was walking toward the street when he tripped and fell into the slippery roadway, the Hall County Sheriff's Office said.</p><p>He was then run over by a car driven by Wallace.</p><p>Rather than an angry confrontation, the father of two was ""excited and waiting to catch them in the act,"" his wife, Laura, <a href=""https://www.nytimes.com/2026/03/08/us/georgia-teacher-killed-prank.html"" rel=""nofollow noopener"" target=""_blank""><u>told The New York Times</u></a>.</p><p>""This is a terrible tragedy, and our family is determined to prevent a separate tragedy from occurring, ruining the lives of these students,"" Hughes said. ""This would be counter to Jason’s lifelong dedication of investing in the lives of these children.""</p><p>The Hugheses were both teachers at the public school and devoted their lives to teaching.</p><p><a href=""https://www.foxnews.com/tips"" rel=""noopener"" target=""_blank""><strong>GOT A TIP?</strong></a></p><p>In a statement, the Wallace family thanked Laura for her ""<a href=""https://www.foxnews.com/category/entertainment/genres/family"" rel=""noopener"" target=""_blank"">remarkable compassion and spirit of forgiveness</a> in the face of the tremendous loss of her husband.""</p><p>""As the family’s attorney, I join them in thanking the District Attorney’s office of the Northeastern Judicial Circuit for completing a thorough investigation and for the prompt decision to dismiss all criminal charges against Jayden and the other students who were present,"" X said in a statement to Fox News Digital.</p><p><a href=""https://x.com/FoxUSNews"" rel=""noopener"" target=""_blank""><strong>FOLLOW US ON X</strong></a></p><p>""District Attorney Lee Darragh was able to act swiftly because the facts and circumstances are not in dispute,"" he said. ""<a href=""https://www.foxnews.com/category/person/jayden-daniels"" rel=""noopener"" target=""_blank"">Jayden and his friends</a> were participating in a competitive game outside the home of their beloved teacher as part of a longtime junior-senior tradition at North Hall High School. As he was leaving the home, Jayden never saw Mr. Hughes, and Jayden’s vehicle had only traveled a few feet when the accident occurred.</p><p>""Vehicular Homicide charges were not warranted because Jayden never operated his truck in a dangerous, improper, or unsafe manner. In the end, there was no crime — only an extremely sad and devastating accident.</p><p><a href=""https://www.foxnews.com/newsletters"" rel=""noopener"" target=""_blank""><strong>GET BREAKING NEWS BY EMAIL</strong></a></p><p>""Jayden is still grieving deeply but is <a href=""https://www.foxnews.com/us/teen-charged-senior-prank-gone-wrong-makes-vow-after-teachers-death"" rel=""noopener"" target=""_blank"">determined to move forward</a> eventually to live a life that would make Jason Hughes proud. The Wallace family would also like to thank the North Hall community for the prayers and loving support that have been offered to the Hughes and Wallace families. </p><p>""Parents Jeremy and Kristen Wallace, along with their son Jayden, also encourage donations to the GoFundMe account established for the Hughes family as well as your continued prayers for Laura Hughes and her children.""</p><p>Along with being a math teacher at the high school, the school's Fellowship of Christian Athletes posted on its Facebook that Hughes was a <a href=""https://www.foxnews.com/category/sports/golf"" rel=""noopener"" target=""_blank"">golf coach</a> at the school.</p><p>In a statement to <a href=""https://www.fox5atlanta.com/news/hall-county-man-run-over-teen-after-rolling-house"" rel=""noopener"" target=""_blank""><u>FOX 5</u></a>, the school said, ""Our hearts are broken. Jason Hughes was a loving husband, a devoted father; a passionate teacher, mentor, and coach who was loved and respected by students and colleagues. He gave so much to so many in numerous ways. Our hearts and prayers go out to his wife and family. We ask that the media and the public respect their privacy as they grieve.""</p><p>In a GoFundMe, a family friend asked for funds to help with future planning for his two children.</p><p>""Jason’s life was a blessing to so many, and his untimely passing will be indescribably difficult for his wife and two young boys for years to come,"" the fundraiser said.</p>",https://www.foxnews.com/us/charges-dropped-against-teens-after-teacher-dies-senior-prank-incident-outside-his-home,2026-03-13
15,Nine convicted in North Texas ICE attack as Kash Patel issues warning to those who target federal officers,"<p>Jurors delivered a mixed verdict Friday in the federal trial of nine people accused of carrying out a 2025 ""ambush"" attack on an <a href=""https://www.foxnews.com/us/mistrial-declared-texas-ice-detention-center-ambush-trial-defense-lawyers-t-shirt"" rel=""noopener"" target=""_blank"">ICE detention facility in North Texas</a>.</p><p>Nine defendants accused of being part of a North Texas ""Antifa cell"" were convicted by a federal jury in Fort Worth for their roles in the July 4, 2025, attack on the Prairieland ICE Detention Center, according to the U.S. Department of Justice (DOJ).</p><p>Jurors delivered the verdict around 2:30 p.m. Friday at the federal courthouse in Fort Worth following roughly a day and a half of deliberations, <a href=""https://www.fox4news.com/news/north-texas-ice-center-antifa-terror-attack-trial-verdict"" rel=""nofollow noopener"" target=""_blank"">FOX 4 News reported</a>.</p><p>""The guilty verdicts in today’s case go to show this FBI’s 24/7 commitment to identifying, locating, and dismantling ANTIFA members and their networks,"" <a href=""https://www.foxnews.com/category/person/kash-patel"" rel=""noopener"" target=""_blank"">Kash Patel</a> told Fox News Digital. ""I want to thank our Dallas field office and great partners for delivering justice. If you attack federal law enforcement this FBI will use every resource at our disposal to hunt you down.""</p><p><a href=""https://www.foxnews.com/us/federal-agents-deploy-tear-gas-rubber-bullets-protesters-outside-minneapolis-federal-building"" rel=""noopener"" target=""_blank""><strong>FEDERAL AGENTS DEPLOY TEAR GAS, RUBBER BULLETS ON PROTESTERS OUTSIDE MINNEAPOLIS FEDERAL BUILDING</strong></a></p><p>During the 12-day trial, which began Feb. 23, 2026, jurors heard testimony from more than 45 witnesses and reviewed over 210 exhibits tied to the charges against the nine defendants, the DOJ said.</p><p>Benjamin Song was convicted of the most serious charge — <a href=""https://www.foxnews.com/us/man-charged-attempted-murder-after-allegedly-shooting-victim-face-crossbow-police"" rel=""noopener"" target=""_blank"">attempted murder</a> — for shooting Alvarado Police Lt. Thomas Gross, according to FOX 4.</p><p>All but one of the nine defendants — Daniel Estrada — were found guilty of providing material support to terrorists, rioting, conspiring to use and carry explosives, and using explosives during a riot, FOX 4 reported.</p><p><a href=""https://www.foxnews.com/politics/ice-re-arrests-two-venezuelan-men-after-federal-judges-release-order"" rel=""noopener"" target=""_blank""><strong>ICE RE-ARRESTS TWO VENEZUELAN MEN AFTER FEDERAL JUDGE'S RELEASE ORDER</strong></a></p><p>Daniel Estrada, who was not present the night of the incident, was convicted of concealing records and conspiracy to conceal documents, according to FOX 4.</p><p>Maricela Rueda was also convicted of conspiracy to conceal documents.</p><p>""Antifa is a domestic terrorist organization that has been allowed to flourish in Democrat-led cities — not under President Trump,"" Attorney General Pamela Bondi said in a statement. ""Today’s verdict on terrorism charges will not be the last as the Trump administration systematically dismantles Antifa and finally halts their violence on America’s streets.""</p><p><a href=""https://www.foxnews.com/politics/left-insists-antifa-isnt-real-organization-despite-multiple-violent-public-incidents-made-up"" rel=""noopener"" target=""_blank""><strong>LEFT INSISTS ANTIFA ISN’T A REAL ORGANIZATION DESPITE MULTIPLE VIOLENT, PUBLIC INCIDENTS: 'MADE UP'</strong></a></p><p>Authorities say the July 4, 2025, attack outside the <a href=""https://www.foxnews.com/category/us/us-regions/southwest/texas"" rel=""noopener"" target=""_blank"">Prairieland ICE Detention Facility in Alvarado</a> involved fireworks, damage to buildings and vehicles, and gunfire directed at officers. </p><p>Prosecutors argued the attack was orchestrated by Song and carried out by members of a <a href=""https://www.foxnews.com/category/us/crime/antifa"" rel=""noopener"" target=""_blank"">North Texas Antifa cell</a>, FOX 4 reported.</p><p>Defense attorneys argued there was no ambush and said the defendants did not intend for any violence to occur.</p><p>""The calculated, violent attack at ICE’s Prairieland facility was an abhorrent way for antifa terrorists to ‘protest’ the way this agency enforces the law — but these verdicts make clear that those who choose violence over lawful expression will face the full force of the American justice system,"" ICE Director Todd Lyons said in a statement.</p>",https://www.foxnews.com/politics/nine-convicted-north-texas-ice-attack-kash-patel-issues-warning-target-federal-officers,2026-03-13
