,title,text,link,publish_date
12,"Plane door opens in midair moments after takeoff, leaving flight passengers stunned and social media buzzing","<p>A <a href=""https://www.foxnews.com/category/travel/general/airlines"" rel=""noopener"" target=""_blank"">Cape Air flight</a> was forced to return to Nantucket, Massachusetts, on Monday shortly after takeoff when part of its cabin door opened in midair.</p><p>The small plane had just departed from Nantucket Memorial Airport (ACK) and was on its way to Boston when the issue occurred, according to news outlet Nantucket Current.</p><p>An <a href=""https://https://www.instagram.com/p/DWzIvbJkYr_/?utm_source=ig_embed&amp;utm_campaign=loading&amp;img_index=1"" rel=""noopener nofollow"" target=""_blank"">Instagram video</a> recorded by a passenger on board shows the upper section of the main cabin door partially opening mid-flight — with plenty of commenters immediately weighing in on the incident. </p><p><a href=""https://https://www.foxnews.com/travel/flight-attendants-costly-error-leads-grounding-delta-flight-long-passenger-delays"" rel=""noopener"" target=""_blank""><strong>FLIGHT ATTENDANT'S COSTLY ERROR LEADS TO GROUNDING OF DELTA FLIGHT, LONG PASSENGER DELAYS</strong></a></p><p>Despite what happened, the aircraft remained stable and continued to operate normally.</p><p>Fox News Digital reached out to Cape Air for comment about the incident. </p><p>The pilot turned the plane around and landed back in Nantucket, without any reported injuries, the outlet noted.</p><p><a href=""https://www.foxnews.com/newsletters?cmpid=fnfirstnl"" rel=""noopener"" target=""_blank""><strong><u>CLICK HERE TO SIGN UP FOR OUR LIFESTYLE NEWSLETTER</u></strong></a></p><p>Passengers were later transferred to another aircraft to complete their trip to Boston, with several praising the pilot for remaining calm under pressure.</p><p>""The pilot was amazing,"" a passenger <a href=""https://nantucketcurrent.com/news/cape-air-plane-returns-to-nantucket-after-cabin-door-opens-mid-flight"" rel=""nofollow noopener"" target=""_blank"">told the Current</a>. ""The pilot did not panic but safely brought us back around the island to land. Probably flew for about 6 to 8 minutes with the door open.""</p><p>The airline confirmed the incident to the local outlet. </p><p><a href=""https://www.foxnews.com/lifestyle"" rel=""noopener"" target=""_blank""><strong><u>CLICK HERE FOR MORE LIFESTYLE STORIES</u></strong></a></p><p>""The aircraft was at a stable altitude and operated normally. The flight crew returned to ACK, and the aircraft landed safely without further incident,"" the airline's statement said.</p><p>That particular  aircraft has since been <a href=""https://www.foxnews.com/category/travel/general/travel-safety"" rel=""noopener"" target=""_blank"">taken out of service</a> as the company investigates what caused the issue.</p><p>""We are following all established safety procedures and will take any necessary actions based on our findings,"" the company said — adding that passenger safety remains its top priority.</p><p><a href=""https://www.foxnews.com/category/lifestyle/quizzes"" rel=""noopener"" target=""_blank""><strong><u>TEST YOURSELF WITH OUR LATEST LIFESTYLE QUIZ</u></strong></a></p><p>Users commented on the video the passenger posted — with many striking a lighter note about the situation.</p><p>""Isn't it a little cold for the window to be open at this time of the year?"" one user wrote.</p><p>Another user commented, ""A little fresh air can't hurt.""</p><p>Fox News Digital previously reported on <a href=""https://www.foxnews.com/category/travel"" rel=""noopener"" target=""_blank"">another airline situation</a> that caused disruptions.</p><p>A Delta flight at Pittsburgh International was left waiting on the tarmac after a flight attendant accidentally deployed the aircraft's emergency slide — delaying passengers onboard.</p><p>The mistake required maintenance crews to remove the slide before passengers could safely exit. Such incidents can cause airlines tens of thousands of dollars.</p><p><i>Khloe Quill of Fox News Digital contributed reporting.</i></p>",https://www.foxnews.com/travel/plane-door-opens-midair-moments-takeoff-flight-passengers-stunned-social-media-buzzing,2026-04-09
13,Federal appeals court rejects Anthropic bid to block Pentagon blacklist in AI dispute,"<p>The <a href=""https://www.foxnews.com/category/politics/judiciary/appeals"" rel=""noopener"" target=""_blank"">U.S. Court of Appeals</a> for the District of Columbia Circuit on Wednesday rejected Anthropic's request to block the Department of War from blacklisting use of the AI company's technology, a move that conflicts with an order a different federal court issued last month in a separate lawsuit regarding the same issues.</p><p>""In our view, the equitable balance here cuts in favor of the government. On one side is a relatively contained risk of financial harm to a single private company. On the other side is judicial management of how, and through whom, the Department of War secures vital AI technology during an active military conflict. For that reason, we deny Anthropic’s motion for a stay pending review on the merits,"" the April 8 <a href=""https://storage.courtlistener.com/recap/gov.uscourts.cadc.42923/gov.uscourts.cadc.42923.01208838678.0_1.pdf"" rel=""noopener nofollow"" target=""_blank"">order</a> states. ""Nonetheless, because Anthropic raises substantial challenges to the determination and will likely suffer some irreparable harm during the pendency of this litigation, we agree with Anthropic that substantial expedition is warranted.""</p><p>In a statement provided to Fox News Digital on Thursday, an Anthropic spokesperson noted, ""We're grateful the court recognized these issues need to be resolved quickly and remain confident the courts will ultimately agree that these supply chain designations were unlawful. While this case was necessary to protect Anthropic, our customers, and our partners, our focus remains on working productively with the government to ensure all Americans benefit from safe, reliable AI.""</p><p><a href=""https://www.foxnews.com/media/anthropics-political-footprint-emerges-after-trump-blacklisting"" rel=""noopener"" target=""_blank""><strong>ANTHROPIC'S DEMOCRATIC TIES UNDER FIRE AS TRUMP ADMIN SEVERS PENTAGON CONTRACTS</strong></a></p><p>The War Department referred Fox News Digital to a Wednesday social media post from Acting U.S. Attorney General Todd Blanche.</p><p>""Today’s D.C. Circuit stay allowing the government to designate Anthropic as a supply chain risk is a resounding victory for military readiness. Our position has been clear from the start — our military needs full access to Anthropic’s models if its technology is integrated into our sensitive systems. Military authority and operational control belong to the Commander-in-Chief and Department of War, not a tech company,"" Blanche noted in the <a href=""https://x.com/DAGToddBlanche/status/2042007295731622234"" rel=""noopener nofollow"" target=""_blank"">post</a> on X.</p><p>The War Department in January requested ""unrestricted use"" of Anthropic for ""all lawful purposes,"" but the AI company drew two red lines, saying it would not be used for domestic surveillance or lethal autonomous weapons.</p><p>The administration framed the refusal as corporate insubordination, and <a href=""https://www.foxnews.com/category/politics/defense/pentagon"" rel=""noopener"" target=""_blank"">Pentagon</a> spokesperson Sean Parnell <a href=""https://x.com/SeanParnellASW/status/2027072228777734474"" rel=""noopener nofollow"" target=""_blank"">said in February</a> that the War Department ""has no interest in using AI to conduct mass surveillance of Americans (which is illegal) nor do we want to use AI to develop autonomous weapons that operate without human involvement.""</p><p>President Donald Trump said in February that the U.S. would never allow ""the radical left, woke company to dictate how our great military fights and wins wars.""</p><p>In a February 27 Truth Social <a href=""https://truthsocial.com/@realDonaldTrump/posts/116144552969293195"" rel=""noopener nofollow"" target=""_blank"">post</a>, Trump said he was ""directing EVERY Federal Agency in the United States Government to IMMEDIATELY CEASE all use of Anthropic’s technology.""</p><p>""There will be a Six Month phase out period for Agencies like the Department of War who are using Anthropic’s products, at various levels,"" Trump indicated in the post.</p><p><a href=""https://www.foxnews.com/politics/dc-court-rulings-stall-trump-agenda-across-immigration-policing-fed-raising-stakes-executive-power"" rel=""noopener"" target=""_blank""><strong>DC COURT RULINGS STALL TRUMP AGENDA ACROSS IMMIGRATION, POLICING, FED — RAISING STAKES ON EXECUTIVE POWER</strong></a></p><p>War Secretary Pete Hegseth slammed Anthropic in a <a href=""https://x.com/SecWar/status/2027507717469049070?s=20"" rel=""noopener nofollow"" target=""_blank"">post</a> on X the same day, declaring that he was ""directing the Department of War to designate Anthropic a Supply-Chain Risk to National Security.""</p><p>A letter in March notified Anthropic that the War Department had determined that use of the company's products posed a ""supply chain risk,"" according to a copy of the letter attached to a <a href=""https://storage.courtlistener.com/recap/gov.uscourts.cadc.42923/gov.uscourts.cadc.42923.01208828684.0_5.pdf"" rel=""noopener nofollow"" target=""_blank"">court filing</a>.</p><p>But then in a case in the <a href=""https://www.foxnews.com/category/politics/judiciary/federal-courts"" rel=""noopener"" target=""_blank"">U.S. District Court</a> for the Northern District of California, a judge issued a preliminary injunction order last month blocking the government from implementing those moves against Anthropic.</p><p><a href=""https://www.foxnews.com/politics/tech-company-refuses-pentagon-demands-unrestricted-use-its-ai"" rel=""noopener"" target=""_blank""><strong>TECH COMPANY REFUSES PENTAGON DEMANDS ON UNRESTRICTED USE OF ITS AI</strong></a></p><p>""This Order restores the status quo. It does not bar any Defendant from taking any lawful action that would have been available to it on February 27, 2026, prior to the issuances of the Presidential Directive and the Hegseth Directive and entry of the Supply Chain Designation. For example, this Order does not require the Department of War to use Anthropic’s products or services and does not prevent the Department of War from transitioning to other artificial intelligence providers, so long as those actions are consistent with applicable regulations, statutes, and constitutional provisions,"" the March <a href=""https://storage.courtlistener.com/recap/gov.uscourts.cand.465515/gov.uscourts.cand.465515.135.0_2.pdf"" rel=""noopener nofollow"" target=""_blank"">order</a> from U.S. District Judge Rita Lin stated.</p>",https://www.foxnews.com/politics/federal-appeals-court-rejects-anthropic-bid-block-pentagon-blacklist-ai-dispute,2026-04-09
14,NATO chief says world is ‘absolutely’ safer under Trump,"<p>NATO Secretary-General Mark Rutte said Wednesday that the world is ""safer"" under President <a href=""https://www.foxnews.com/category/person/donald-trump"" rel=""noopener"" target=""_blank"">Donald Trump</a>, pointing to recent U.S. military actions targeting Iran's capabilities.</p><p>""Absolutely, because this is thanks to President Trump’s leadership,"" Rutte said during an interview on ""The Lead with Jake Tapper"" when Tapper asked if the world was safer. ""Degrading these capabilities is really, really very important for your and my safety here in the U.S., in Europe, in the Middle East,"" he added.</p><p>Rutte described a <a href=""https://www.foxnews.com/politics/trump-rubio-face-nato-chief-us-moves-reexamine-alliance-after-iran-clash"" rel=""noopener"" target=""_blank"">recent meeting with Trump</a> as candid but cooperative despite the president's disagreements with NATO allies.</p><p>""There is a disappointment, clearly, but at the same time he was also listening carefully to my arguments of what is happening,"" he said. ""This was a very frank, very open discussion, but also a discussion between two good friends.""</p><p><a href=""https://www.foxnews.com/media/jack-keane-calls-out-nato-allies-failing-step-up-strait-hormuz-crisis"" rel=""noopener"" target=""_blank""><strong>JACK KEANE CALLS OUT NATO'S WEAKNESS AS SHIPPING CRISIS GRIPS STRAIT OF HORMUZ</strong></a></p><p>Rutte acknowledged that some European nations <a href=""https://www.foxnews.com/world/trump-warns-nato-very-bad-future-allies-dont-help-secure-strait-hormuz"" rel=""noopener"" target=""_blank"">declined to fully support</a> U.S. operations in Iran, while emphasizing that most allies followed through on prior commitments.</p><p>""Some specifically said, 'You can’t use our bases, you can’t even fly over our airspace,'"" he said. ""But the large majority — including France — of European nations has been doing what they committed before they would do in a case like this.""</p><p>Rutte added that European cooperation enabled the United States to project military power during the operation.</p><p>""Europe as a platform of power projection for the United States was in full play over the last six weeks,"" he continued. ""Not all European nations lived up to those commitments, and I totally understand that he is disappointed.""</p><p><a href=""https://www.foxnews.com/media/economist-editor-says-european-leaders-fear-true-nato-divorce-trump-pullout-threat"" rel=""noopener"" target=""_blank""><strong>ECONOMIST EDITOR SAYS EUROPEAN LEADERS NOW FEAR A TRUE NATO 'DIVORCE' AFTER TRUMP PULLOUT THREAT</strong></a></p><p>Rutte also pointed to Trump's influence with NATO, particularly on defense spending among member nations.</p><p>""It was his leadership which brought about the Hague spending commitment, the 5%, which is a transformational change in NATO,"" he said. ""Without him, we would never have gotten there.""</p><p>The NATO chief argued that military action was necessary to prevent Iran from developing nuclear weapons, warning that prolonged diplomacy could have allowed the situation to escalate beyond control.</p><p>Rutte said there is widespread agreement among NATO allies that preventing Iran from obtaining nuclear and ballistic missile capabilities remains a priority.</p><p>""NATO has always taken the position that degrading these capabilities is crucial, and that Iran can never get its hands on those two capabilities,"" he said.</p><p><a href=""https://www.foxnews.com/media"" rel=""noopener"" target=""_blank""><strong><u>CLICK HERE FOR MORE COVERAGE OF MEDIA AND CULTURE</u></strong></a></p><p>Rutte also expressed support for Trump’s broader approach to countering Iran’s role in global conflicts.</p><p>""I support the president and I know large parts of Europe do when it comes to taking out the capacity of Iran to create chaos to the region, to Europe, to the whole world,"" he said.</p><p>""Let’s not be naive,"" he added. ""There is Russia, North Korea, Belarus, China, Iran working together. These theaters are getting more and more interconnected.""</p>",https://www.foxnews.com/media/nato-chief-says-world-absolutely-safer-trump,2026-04-09
15,"NATO chief signals allies may act on Hormuz, warns of ‘unhealthy codependence’ on US","<p>NATO’s chief signaled Thursday that European allies may move to help secure the Strait of Hormuz following talks with President <a href=""https://www.foxnews.com/category/person/donald-trump"" rel=""noopener"" target=""_blank"">Donald Trump</a> — even as the White House declared the alliance had already ""failed"" and was not being asked to assist.</p><p>Secretary-General Mark Rutte, speaking at The Ronald Reagan Presidential Foundation and Institute in Washington a day after meeting Trump at the White House, pointed to a potential coalition effort among allied nations to keep the critical waterway open.</p><p>""If NATO can help, obviously, then there is no reason not to be helpful,"" Rutte said.</p><p>But a White House official pushed back sharply on the notion that the alliance would play any role.</p><p><a href=""https://www.foxnews.com/world/trump-seeks-warships-from-other-countries-help-secure-strait-hormuz"" rel=""noopener"" target=""_blank""><strong>TRUMP SEEKS WARSHIPS FROM OTHER COUNTRIES TO HELP SECURE STRAIT OF HORMUZ</strong></a></p><p>""As President Trump said yesterday, NATO was tested, and they failed,"" the official told Fox News Digital Thursday. ""He has zero expectations for NATO at this point and did not ask them for anything, even though it's a fact that they benefit from the Strait of Hormuz far more than the United States.""</p><p>The split messaging underscores a growing rift between Washington and its European allies over how — or whether — NATO should be involved in the escalating Iran conflict.</p><p>Rutte framed the tension as part of a deeper structural imbalance, warning Europe’s reliance on U.S. military power had created what he called an ""unhealthy codependence.""</p><p><a href=""https://www.foxnews.com/world/more-key-us-allies-block-military-flights-iran-war-rift-widens-trump"" rel=""noopener"" target=""_blank""><strong>MORE KEY US ALLIES BLOCK MILITARY FLIGHTS AS IRAN WAR RIFT WIDENS WITH TRUMP</strong></a></p><p>A European diplomat confirmed to Fox News Digital that Rutte conveyed Trump expects a plan from allies within days, underscoring the urgency behind U.S. demands — even as the White House publicly denies seeking NATO’s involvement.</p><p>NATO also signaled the U.S. is pressing for concrete commitments.</p><p>""The secretary-general is in contact with allies about his discussions in Washington,"" NATO spokesperson Allison Hart told Fox News Digital. ""It’s clear that the United States expects concrete commitments and action to ensure the freedom of navigation in the Strait of Hormuz.""</p><p>Rutte suggested the disagreement reflects a broader divide among allies rather than a failure of NATO as an institution.</p><p>""It’s not so much NATO, it is the allies,"" he said, pointing to what he described as obligations by individual countries to support U.S. operations when prior agreements are in place.</p><p>The dispute highlights a deeper clash over NATO’s role, with the Trump administration pressing allies to back U.S.-led military action against Iran while several European governments have resisted, arguing the conflict falls outside the alliance’s core collective defense mission.</p><p><a href=""https://www.foxnews.com/politics/nato-heavyweights-balk-hormuz-mission-trump-warns-alliance-risk"" rel=""noopener"" target=""_blank""><strong>NATO HEAVYWEIGHTS BALK AT HORMUZ MISSION AS TRUMP WARNS ALLIANCE AT RISK</strong></a></p><p>That friction had already surfaced during the early stages of the conflict. </p><p>Spain denied Washington access to key military bases at Rota and Morón and blocked U.S. aircraft involved in strikes against Iran from using its airspace, complicating American operations. France also restricted some airspace access tied to military logistics during the conflict, including denying Israeli aircraft permission to transport U.S. weapons, drawing pushback from U.S. and Israeli officials. </p><p>French officials said overflight requests are handled case by case.</p><p>Several European countries also have said the Iran conflict is ""not our war,"" declining to deploy naval forces to reopen the Strait of Hormuz during active fighting and instead signaling support for maritime security efforts only after hostilities ease.</p><p>Trump repeatedly has criticized NATO allies for what he sees as insufficient support, warning the alliance risks becoming a ""one-way street.""</p><p>""You’ll have to start learning how to fight for yourself, the U.S.A. won’t be there to help you anymore,"" Trump said in a Truth Social post in March. </p><p>Secretary of State <a href=""https://www.foxnews.com/category/person/marco-rubio"" rel=""noopener"" target=""_blank"">Marco Rubio</a> has similarly warned that Washington may ""reexamine the value of NATO"" following the conflict, citing frustration over European restrictions on U.S. basing and operational access.</p><p>Despite the tensions, Rutte emphasized that many European allies have provided support — including access to bases, logistics and overflights.</p><p>""He is clearly disappointed with many NATO allies, and I can see his point,"" Rutte said. ""But… the large majority of European nations has been helpful with basing, with logistics, with overflights, with making sure that they lived up to the commitments.""</p><p>Rutte also pointed to an emerging coalition model outside NATO’s formal structure, with countries coordinating directly to maintain security in the Strait of Hormuz.</p><p>""When it comes to the Strait of Hormuz, what you see now is countries coming together to make sure that the strait stays open,"" he said. ""If countries work together with the United States, that is a shared commitment that we cannot accept the strait being closed.""</p><p>He said the United Kingdom has taken a leading role in organizing that effort.</p><p>""This is about practical support,"" Rutte added. ""Each country is now looking at what they can do to contribute — whether that is minehunters, frigates, or surveillance and technology.""</p><p>Rutte returned to that broader critique of Europe’s defense posture, arguing the alliance had grown too dependent on Washington.</p><p>""Western European forces shrank, and <a href=""https://www.foxnews.com/category/politics/defense/spending"" rel=""noopener"" target=""_blank"">defense budgets</a> shriveled… in favor of what I would call an unhealthy codependence,"" he said.</p><p>Still, he argued that the alliance is beginning to shift.</p><p>""This is a move from codependence to a transatlantic alliance grounded in true partnership,"" Rutte said. ""There will be no going back.""</p>",https://www.foxnews.com/politics/nato-chief-signals-allies-may-act-hormuz-warns-unhealthy-codependence-us,2026-04-09
