,title,text,link,publish_date
9,"JD Vance says he was 'obsessed' with UFOs, believes aliens are actually 'demons'","<p>While discussing the mystery surrounding UFOs, Vice President <a href=""https://www.foxnews.com/category/person/jd-vance"" rel=""noopener"" target=""_blank"">JD Vance</a>, who is Catholic, said he believes what people think of as aliens are actually ""demons.""</p><p>While interviewing Vance, conservative commentator Benny Johnson asked the vice president, ""You gonna release all the UFO files?""</p><p>""Ah, we're workin' on it,"" Vance said. </p><p>He explained that when he took office he ""was obsessed with the <a href=""https://www.foxnews.com/category/science/air-and-space/ufos"" rel=""noopener"" target=""_blank"">UFO files</a>"" but ended up being busy with other issues.</p><p>Vance asserted that he will ""get to the bottom"" of the matter.</p><p><a href=""https://www.foxnews.com/us/jd-vance-says-ufos-aliens-could-be-spiritual-forces-vp-vows-get-bottom-mystery-skies"" rel=""noopener"" target=""_blank""><strong>JD VANCE SAYS UFOS, ALIENS COULD BE ‘SPIRITUAL FORCES’ AS VP VOWS TO ‘GET TO THE BOTTOM’ OF MYSTERY IN SKIES</strong></a></p><p>""I don't think they're aliens. I think they're demons anyway,"" Vance noted.</p><p>Prompted by Johnson, Vance later elaborated on his view.</p><p>""Well, look, I, I think that celestial beings who fly around, who do weird things to people — I think that the desire to describe everything celestial… to describe it as aliens — I mean every great world religion, including Christianity, the one that I believe in, has understood that there are weird things out there, and there are things that are very difficult to explain,"" he said.</p><p>""And I naturally go — when I hear about, sort of, extra-natural phenomenon — that's where I go to is the Christian understanding that, you know, there's a lotta good out there, but there's also some evil out there,"" he continued.</p><p><a href=""https://www.foxnews.com/us/ufo-secret-files-drone-swarms-nuclear-linked-sightings-stun-experts-2025"" rel=""noopener"" target=""_blank""><strong>UFO SECRET FILES, DRONE SWARMS AND NUCLEAR-LINKED SIGHTINGS STUN EXPERTS IN 2025</strong></a></p><p>He added that he believes that among ""the devil's great tricks is to convince people he never existed.""</p><p>Last month, President <a href=""https://www.foxnews.com/category/person/donald-trump"" rel=""noopener"" target=""_blank"">Donald Trump</a> said he would order the release of files pertaining to the issue of aliens and UFOs.</p><p><a href=""https://www.foxnews.com/politics/the-age-disclosure-new-documentary-explores-claims-80-year-cover-up-non-human-life"" rel=""noopener"" target=""_blank""><strong>EXPLOSIVE NEW DOCUMENTARY PROBES ‘80-YEAR GLOBAL COVERUP’ OF UFO SECRETS</strong></a></p><p>""Based on the tremendous interest shown, I will be directing the Secretary of War, and other relevant Departments and Agencies, to begin the process of identifying and releasing Government files related to alien and extraterrestrial life, unidentified aerial phenomena (UAP), and unidentified flying objects (UFOs), and any and all other information connected to these highly complex, but extremely interesting and important, matters. GOD BLESS AMERICA!"" the president declared in a February Truth Social <a href=""https://truthsocial.com/@realDonaldTrump/posts/116100300268316472"" rel=""nofollow noopener"" target=""_blank"">post</a>.</p>",https://www.foxnews.com/politics/jd-vance-says-he-was-obsessed-ufos-believes-aliens-actually-demons,2026-03-28
10,"Trump critics Kathy Griffin and Rosie O'Donnell 'threw it all away' to fight president, Adam Carolla says","<p>Adam Carolla thinks some people simply pay <a href=""https://www.foxnews.com/category/person/donald-trump"" rel=""noopener"" target=""_blank"">President Donald Trump</a> too much mind.</p><p>The comedian spoke about certain public figures' apparent fixation on Trump during a conversation with Dr. Drew Pinsky on a recent episode of ""<a href=""https://www.youtube.com/watch?v=__BRgGFKKiE&amp;t=7s"" rel=""nofollow noopener"" target=""_blank"">The Adam &amp; Dr. Drew Show</a>,"" saying that some politicians and celebrities have given up too much just to argue with the president.</p><p>""You're a politician, and you think, ‘I’m going to make change, and I'm going to stand up for this and I'm going to fix that,' and all you're doing is fighting with Trump,"" he said.</p><p><a href=""https://www.foxnews.com/entertainment/rosie-odonnell-quietly-returns-us-after-abandoning-country-over-trumps-victory"" rel=""noopener"" target=""_blank""><strong>ROSIE O'DONNELL QUIETLY RETURNS TO US AFTER ABANDONING COUNTRY OVER TRUMP'S VICTORY</strong></a></p><p>""That's all you do. Gavin Newsom, Karen Bass – their full-time job is just fighting Trump … it's no longer what they want to do, it's ‘what does Trump want to do?’, then ‘I’m going to go fight Trump.'""</p><p>Pinsky agreed, and Carolla continued, ""<a href=""https://www.foxnews.com/category/person/rosie-odonnell"" rel=""noopener"" target=""_blank"">Rosie O'Donnell</a>, you wanted to do comedy at some point, right? Now you sit and you fight Trump. And Kathy Griffin, you wanted to do comedy, and you both could do it at a high level, but you threw it all away to fight Trump. Could you imagine?""</p><p>The ""Man Show"" host remarked, ""It's like, I didn't like Obama, but I didn't give up on life to fight Obama.""</p><p>Pinsky said that the kinds of people Carolla mentioned might not have a person in their lives who would say, ""Hey, hey, what are you doing?"" because otherwise, he suggested, ""it would be hard to keep doing it month after month.""</p><p><a href=""https://www.foxnews.com/entertainment"" rel=""noopener"" target=""_blank""><strong><u>LIKE WHAT YOU’RE READING? CLICK HERE FOR MORE ENTERTAINMENT NEWS</u></strong></a></p><p>Carolla theorized that that kind of person ""would be expelled from that person's life if they started asking questions.""</p><p>He imagined a conversation between O'Donnell and this kind of friend, in which the theoretical friend asks O'Donnell what she has planned for the day, and she answers, ""I'm going to go hit my vlog and do a <a href=""https://www.foxnews.com/entertainment/rosie-odonnell-trumps-removal-office-kennedy-center-honor-tirade"" rel=""noopener"" target=""_blank"">tirade against Trump</a>."" </p><p>""How about we play pickleball instead?"" he imagined the friend saying, then, as O'Donnell, responded, ""Get out of here.""</p><p>""It's got to be so unhealthy, unpleasant,"" Pinsky said. ""But it must be rewarding in some way because they keep doing it, right? It gives them meaning.""</p><p>Carolla went on to make an argument that because comedians use their brains instead of their brawn, they can sometimes find their thoughts going in ""a bad direction.""</p><p>""If you're a comedian, and you have some downtime, and you're no longer hitting the boards, you know what I mean?"" he said. ""You got money in the bank, and you can kind of have your afternoons off, and you don't need to go out and hit mics that night, then that mind will start wandering on you.""</p><p>He continued, ""What you need to do at that point is go build a gazebo. You need to get up and get out … you need a project.""</p><p>Carolla explained, ""When the brain is not constantly working in some sort of support of some goal … it starts turning. And that's a problem.""</p><p>O'Donnell has consistently spoken out against Trump on social media and in interviews she's given after moving from the U.S. to Ireland following the 2024 presidential election.</p><p>She's demanded his removal from office numerous times, and in a 2025 interview, she admitted that she'd <a href=""https://www.foxnews.com/entertainment/rosie-odonnells-trump-obsession-continues-unabated-from-ireland-friends-beg-her-disconnect"" rel=""noopener"" target=""_blank"">promised her therapist</a> she'd quit making posts about Trump on social media, but she wasn't able to follow through.</p><p>Griffin recently declared herself ""uncanceled"" nearly 10 years after creating a firestorm when she shared a photo of herself holding a bloody mask designed to look like Trump's head.</p><p><a href=""https://www.foxnews.com/newsletters?cmpid=fnfirstnl"" rel=""noopener"" target=""_blank""><strong><u>CLICK HERE TO SIGN UP FOR THE ENTERTAINMENT NEWSLETTER</u></strong></a></p><p>She previously told her podcast listeners to take the time to <a href=""https://www.foxnews.com/media/kathy-griffin-tells-fans-find-out-which-neighbors-maga-organize-ice-resistance"" rel=""noopener"" target=""_blank"">speak to neighbors</a> and to ""find out if they're MAGA or not,"" because it's important to know ""who's on our team.""</p><p>Fox News Digital has reached out to O'Donnell, Griffin and Newsom.</p><p>Bass' office told Fox News Digital, ""Mayor Bass will always fight for L.A. — against ICE’s cruel raids and against the status quo, which is why after decades of rising homelessness, she delivered historic reductions, reversing the trendline in L.A. and bucking the national trend.""</p>",https://www.foxnews.com/entertainment/trump-critics-kathy-griffin-rosie-odonnell-threw-all-away-fight-president-adam-carolla-says,2026-03-28
11,7 costly mistakes to avoid at the pump right now as gas prices surge nationwide,"<p>Gas prices are climbing again just as spring travel ramps up, putting added pressure on drivers <a href=""https://www.foxnews.com/category/special/sponsored/road-trip"" rel=""noopener"" target=""_blank"">from road trips</a> to simply commuting to work.</p><p>The national average price for regular gas has jumped in recent weeks, climbing to about $3.98 per gallon — up roughly $1 in just the past month, <a href=""https://gasprices.aaa.com/national-gas-average-jumps-one-dollar-in-one-month/"" rel=""noopener"" target=""_blank"">according to AAA.</a> With seasonal demand increasing and oil prices remaining elevated, experts say drivers should expect continued volatility at the pump.</p><p><a href=""https://www.foxnews.com/travel/plane-seat-location-critical-emergencies-experts-warn-row-impacts-survival-odds"" rel=""noopener"" target=""_blank""><strong>PLANE SEAT LOCATION CRITICAL IN EMERGENCIES AS EXPERTS WARN ROW POSITION IMPACTS SURVIVAL ODDS</strong></a></p><p>Luckily, experts say <a href=""https://www.foxnews.com/category/travel/general/travel-tips"" rel=""noopener"" target=""_blank"">small changes behind the wheel</a> and simple maintenance habits can help stretch every tank further. </p><p>Here are 7 of their best tips.</p><p>Speeding, rapid acceleration and hard braking are some of the biggest fuel drains. </p><p>Fuel efficiency drops quickly above about 50 mph, <a href=""https://thepointsguy.com/news/most-out-of-a-tank-of-gas/"" rel=""nofollow noopener"" target=""_blank"">The Points Guy</a> recently reported, and federal data shows aggressive driving can cut gas mileage by up to 40% in stop-and-go traffic.</p><p><a href=""https://www.foxnews.com/travel/americas-airport-affordability-gap-cities-where-travel-costs-crushing-families"" rel=""noopener"" target=""_blank""><strong>AMERICA’S AIRPORT AFFORDABILITY GAP: CITIES WHERE TRAVEL COSTS ARE CRUSHING FAMILIES</strong></a></p><p>Cruise control can also help keep your speed steady, but experts warn not to use it in slick conditions.</p><p>Using premium gas won’t improve fuel economy unless your vehicle specifically requires it.</p><p>Most cars are designed to run on regular 87-octane fuel, making it the most cost-effective option, <a href=""https://newsroom.aaa.com/2017/12/dont-fueled-premium-not-always-worth-price/"" rel=""nofollow noopener"" target=""_blank"">according to AAA.</a> </p><p>Using a higher octane than recommended won’t improve mileage or efficiency and typically isn’t worth the added cost.</p><p>Underinflated tires increase resistance on the road, forcing the engine to work harder and burn more fuel, experts say. </p><p><a href=""https://www.foxnews.com/newsletters?cmpid=fnfirstnl"" rel=""noopener"" target=""_blank""><strong>CLICK HERE TO SIGN UP FOR OUR LIFESTYLE NEWSLETTER</strong></a></p><p>Tires naturally lose about 1 to 3 psi per month, and a 10 psi drop can reduce fuel economy by up to 4%. Pressure can fall even further with colder temperatures or small leaks, making regular pressure checks especially important.</p><p>Many drivers believe it’s more fuel-efficient to <a href=""https://www.foxnews.com/category/travel"" rel=""noopener"" target=""_blank"">let a car idle</a> than to turn it off and restart it, but experts say that’s a myth.</p><p>A warm engine uses only about 10 seconds’ worth of fuel to restart, meaning idling longer than that wastes gas, and engines can burn up to a half-gallon per hour while idling, according to AAA and government agencies. </p><p><a href=""https://www.foxnews.com/lifestyle"" rel=""noopener"" target=""_blank""><strong>CLICK HERE FOR MORE LIFESTYLE STORIES</strong></a></p><p>Letting a car warm up for long periods is also unnecessary, as most vehicles need only about 30 seconds before driving.</p><p>Extra weight — especially roof racks and cargo boxes — can significantly reduce fuel efficiency.</p><p>Drivers can lose about 1% of fuel economy for every 100 pounds added to a vehicle, and cargo mounted on the roof creates additional wind resistance that can cut mileage by up to 8% in the city and as much as 25% on the highway, according to the <a href=""https://www.energy.gov/energysaver/driving-more-efficiently#:~:text=Avoid%20Hauling%20Cargo%20on%20the,1%25/100%20lbs."" rel=""nofollow noopener"" target=""_blank"">U.S. Department of Energy.</a></p><p><a href=""https://www.foxnews.com/category/lifestyle/quizzes"" rel=""noopener"" target=""_blank""><strong>TEST YOURSELF WITH OUR LATEST LIFESTYLE QUIZ</strong></a></p><p>Clearing out your trunk or removing unused carriers can help your car go farther on each tank, while rear-mounted cargo options tend to have a smaller impact on fuel economy.</p><p>Plan <a href=""https://www.foxnews.com/category/deals/travel-deals/travel-hacks-deals"" rel=""noopener"" target=""_blank"">fuel-efficient routes</a> using apps like Google Maps to avoid backtracking and unnecessary stops. </p><p>Combining errands into one trip and opting for ""one-stop"" locations when possible can reduce driving time, especially if you avoid peak traffic and stop-and-go conditions. </p><p>Fewer trips also mean fewer cold starts, which use more fuel, helping drivers save gas over time, according to federal guidance.</p><p>Air conditioning can increase fuel use — by up to 10%, in some cases — while open windows also reduce efficiency by creating drag, so experts recommend adjusting based on speed. </p><p>At lower speeds, windows can be more efficient, but on highways it’s better to close them and use A/C, ideally after airing out a hot car to reduce the strain on the system.</p>",https://www.foxnews.com/travel/7-costly-mistakes-avoid-pump-right-now-gas-prices-surge-nationwide,2026-03-28
12,Chicago moves toward reparations with bus tours and town halls as $150M deficit looms,"<p><a href=""https://www.foxnews.com/category/us/chicago"" rel=""noopener"" target=""_blank"">Chicago</a> took its first step after establishing a reparations task force two years ago.</p><p>And now, Chicago Mayor Brandon Johnson plans to hold a public engagement forum called ""<a href=""https://www.chicago.gov/city/en/depts/mayor/press_room/press_releases/2026/march/repair-chicago-launch.html"" rel=""nofollow noopener"" target=""_blank"">Repair Chicago</a>"" to ""gather lived experiences of harm of Black Chicagoans"" as part of an effort to implement reparations for Black residents.</p><p>""Your experience is evidence and we’ve placed it at the center of our work,"" Johnson said. ""By engaging directly with residents, we are grounding this work in the voices and lived realities of the people it is meant to serve.""</p><p><a href=""https://www.foxnews.com/politics/far-left-house-dem-pushes-land-reparations-descendants-american-slaves"" rel=""noopener"" target=""_blank""><strong>FAR-LEFT HOUSE DEM PUSHES LAND REPARATIONS FOR DESCENDANTS OF AMERICAN SLAVES</strong></a></p><p>The first event took place on Tuesday and two more events are scheduled through April.</p><p>Johnson’s office announced that the ""Repair Chicago"" effort would involve ""bus tours, panel discussions, town halls, and hearings,"" helping the task force members gather input for the administration’s reparations study. </p><p>""The community engagement process will gather input from Chicagoans across the city to better understand Black Chicagoans’ experiences across generations and how systemic racism has shaped their lives, opportunities, and well-being,"" Johnson said.</p><p>The move comes two years after Johnson named his chief equity officer, Carla Kupe, to lead the reparations <a href=""https://www.chicago.gov/city/en/depts/mayor/press_room/press_releases/2025/april/Mayor-Johnson-Reparations-Task-Force-Applications.html"" rel=""nofollow noopener"" target=""_blank"">task force with $500,000 in funding</a>. In 2024, Johnson signed an executive order establishing a reparations Task Force, comprising 40 members, that addresses ""historical harms committed against Black Chicagoans and their ancestors through the form of reparations.""</p><p><a href=""https://www.foxnews.com/media/reparations-advocates-pushing-effort-forward-despite-pushback"" rel=""noopener"" target=""_blank""><strong>REPARATIONS ADVOCATES PUSH FOR PAYMENTS TO BLACK AMERICANS DESPITE BUDGET AND LEGAL CHALLENGES</strong></a></p><p>Johnson’s effort to implement reparations comes while the <a href=""https://www.foxnews.com/politics/chicagos-teetering-debt-stark-warning-left-wing-mayor-fueling-pay-later-doom-cycle-expert"" rel=""noopener"" target=""_blank""><u>city endures financial strains</u></a>. Fox News Digital previously reported that Chicago, the nation’s third-largest city, is facing a corporate fund budget gap of more than $1 billion, while its 2025 fiscal year is projected to close with an approximately $150 million deficit and about two-fifths of the budget going toward debt service and pension costs.</p><p><a href=""https://news.wttw.com/2025/04/21/mayor-brandon-johnson-sounds-alarm-city-budget-decries-trump-s-threats"" rel=""nofollow noopener"" target=""_blank""><u>Johnson said</u></a> in April the city was ""at a crossroads"" and had to ""essentially do more with less,"" while simultaneously slamming the Trump administration for reportedly threatening federal funding, calling it a ""different scenario we weren’t under before.""</p><p><a href=""https://www.foxnews.com/media/illinois-reparations-commission-releases-lengthy-report-states-harms-against-black-citizens"" rel=""noopener"" target=""_blank""><strong>ILLINOIS REPARATIONS COMMISSION RELEASES LENGTHY REPORT OF STATE'S 'HARMS' AGAINST BLACK CITIZENS</strong></a></p><p>Chicago could follow several states and local municipalities looking to implement reparations to some degree. On the state level, <a href=""https://www.foxnews.com/media/illinois-reparations-commission-releases-lengthy-report-states-harms-against-black-citizens"" rel=""noopener"" target=""_blank""><u>Illinois’s reparations commission</u></a> released a report laying out what it called the state's history of harms against Black residents. </p><p>Evanston, Illinois, a Chicago suburb, was the first to pay Black residents in reparations to cover <a href=""https://www.foxnews.com/category/us/economy/housing"" rel=""noopener"" target=""_blank""><u>housing</u></a> expenses. The program issues $25,000 direct cash payments to Black residents and descendants of Black residents who lived in Evanston between 1919 and 1969.</p><p>Many have proposed compensation to rectify historical harms to Blacks. Some of these programs have <a href=""https://www.foxnews.com/media/san-francisco-residents-band-together-shut-down-reparations-fund-claiming-its-dividing-city"" rel=""noopener"" target=""_blank""><u>faced legal challenges</u></a> considering that they have race-based implications. </p><p>For instance, a San Francisco resident is claiming that the city's Reparations Fund is <a href=""https://www.foxnews.com/media/san-francisco-sued-over-reparations-fund-grounds-unlawful-use-taxpayer-money"" rel=""noopener"" target=""_blank""><u>dividing the city</u></a>. </p><p>The mayor's office did not respond to <a href=""https://www.foxnews.com/media"" rel=""noopener"" target=""_blank"">Fox News Digital</a>'s request for comment.</p>",https://www.foxnews.com/media/chicago-moves-toward-reparations-bus-tours-town-halls-150m-deficit-looms,2026-03-28
13,"Alex Vesia, Dodgers pitcher who lost infant daughter, gets standing ovation after scoreless return to mound","<p>Perhaps for the first time in 2026, <a href=""https://www.foxnews.com/category/sports/mlb"" rel=""noopener"" target=""_blank"">Alex Vesia</a> felt some normalcy on Friday night.</p><p>The <a href=""https://www.foxnews.com/category/sports/mlb/los-angeles-dodgers"" rel=""noopener"" target=""_blank"">Los Angeles Dodgers</a> pitcher made his return to the pitcher's mound in his first Major League outing since his infant daughter died just five days after she was born.</p><p>Before the World Series, the left-hander left the team to deal with a ""deeply personal matter"" and did not pitch in the Fall Classic. </p><p><a href=""https://www.foxnews.com/sports"" rel=""noopener"" target=""_blank""><strong>CLICK HERE FOR MORE SPORTS COVERAGE ON FOXNEWS.COM</strong></a><i><strong> </strong></i></p><p>Days after the Dodgers won the World Series, he and his wife <a href=""https://www.foxnews.com/sports/dodgers-alex-vesia-reveals-death-infant-daughter-no-words-describe-pain-were-going-through"" rel=""noopener"" target=""_blank""><u>announced their infant daughter</u></a> had died.</p><p>Vesia returned to the team during spring training and then entered the Dodgers' game against the Arizona Diamondbacks in the seventh inning of a 4-4 tie.</p><p>It was quite the spot for Vesia to return, but given his 2.36 ERA over the last two seasons, it was no sweat. He left a runner stranded on second base and kept the D-Backs scoreless en route to the team's 5-4 win over their division rival.</p><p>Vesia let out a yell and pointed toward the Dodgers' family section while getting a standing ovation from the crowd.</p><p>Vesia was wearing a customized pink glove with his daughter's name, Sterling Sol, stitched on it, along with her birthday and his wife's first initial, K for Kayla, embroidered on the glove's ring finger.</p><p><a href=""https://www.foxnews.com/sports/dodgers-pitchers-wife-lives-through-bitter-sweet-opening-day-months-after-infant-daughters-death"" rel=""noopener"" target=""_blank""><strong>DODGERS PITCHER'S WIFE LIVES THROUGH 'BITTER SWEET' OPENING DAY MONTHS AFTER INFANT DAUGHTER'S DEATH</strong></a></p><p>""What I would give to have my Sterling girl here, carrying her in my heart always,"" Kayla said in an Instagram post earlier this week to celebrate a ""bitter-sweet"" opening day.</p><p>Sterling passed between Game 2 and Game 3 when the series was tied at one game apiece. During the Fall Classic, relievers from the <a href=""https://www.foxnews.com/category/sports/mlb/toronto-blue-jays"" rel=""noopener"" target=""_blank""><u>Toronto Blue Jays</u></a> wrote Vesia's jersey number, 51, on their hats.</p><p>In his first news conference of the year in spring training, Vesia called his wife ""the strongest person that I know"" and ""a support system for me every bit as much as I am for her.""</p><p>""Life can change in an instant. For us, 10 minutes is all it took,"" Vesia said in February. ""Sterling Sol was the most beautiful girl in the world. We got to hold her, change her diaper, read to her and love her. Our time together was far too short. Kay and I will keep those precious moments and memories to ourselves.</p><p>""Stepping away from the team, the brothers that I go to war with every day, was difficult, but it was also an easy decision because my family needed me. We still watched every pitch of the World Series, and for us in so many ways, that was a light in our darkness.</p><p>""I was not prepared to not bring my baby girl home, but we're carrying her with us every day. It's been hard, but we're doing OK.""</p><p>The back-to-back reigning World Series champions are 2-0 to start the MLB season.</p><p><i><strong>Follow Fox News Digital’s </strong></i><a href=""https://twitter.com/FoxNewsSports_"" rel=""nofollow noopener"" target=""_blank""><i><strong>sports coverage on X</strong></i></a><i><strong>, and subscribe to </strong></i><a href=""https://www.foxnews.com/newsletters"" rel=""noopener"" target=""_blank""><i><strong>the Fox News Sports Huddle newsletter.</strong></i></a></p>",https://www.foxnews.com/sports/alex-vesia-dodgers-pitcher-who-lost-infant-daughter-gets-standing-ovation-after-scoreless-return-mound,2026-03-28
