,title,text,link,publish_date
0,Spanberger ripped after taking credit for billions in investments secured under GOP predecessor: 'Pathetic',"<p>Virginia's Democratic Governor, Abigail Spanberger, took credit for billions in economic achievements secured under her GOP predecessor, earning her backlash from Republican leaders and their representatives running the state before she got there. </p><p>Spanberger touted signing legislation that authorized four separate investments from the aerospace, energy, and pharmaceutical industries earlier this week. The investments, according to a press release from Spanberger's office, would welcome 3,250 new jobs and $7.1 billion in business investment to the state. </p><p>""From my very first day in office, I have been working to create a stable business environment so companies can hire, expand, and continue to invest in our Commonwealth,"" Spanberger said in her press release. ""I am signing these bills into law so we can continue to grow Virginia’s economy and create opportunities for Virginians.""</p><p>However, Spanberger's signature was effectively just a formality, as the deals she touted were part of Youngkin's broader push to spur <a href=""https://www.foxnews.com/category/us/economy"" rel=""noopener"" target=""_blank"">economic development</a> as governor of Virginia, which included a record of $156 billion in total CEO commitments during his term. As he was exiting office, the former GOP governor garnered more than the previous six gubernatorial administrations combined,  according to a press release from Youngkin's team.</p><p><a href=""https://www.foxnews.com/politics/biden-ally-tells-spanberger-exit-bunker-ex-gov-renews-debate-push"" rel=""noopener"" target=""_blank""><strong>BIDEN ALLY TELLS SPANBERGER TO EXIT ‘BUNKER’ AS EX-GOV RENEWS DEBATE PUSH</strong></a></p><p>""She's trying to take credit for somebody else's work,"" former Virginia Attorney General <a href=""https://www.foxnews.com/politics/dem-backed-social-justice-law-put-virginias-odu-campus-risk-before-attack-former-ag-argues"" rel=""noopener"" target=""_blank"">Jason Miyares</a> told Fox News Digital. ""In grade school we call that cheating.""</p><p>""The last three months have been nothing but horrible news for Virginians as <a href=""https://www.foxnews.com/person/s/rep-abigail-spanberger"" rel=""noopener"" target=""_blank"">Abigail Spanberger</a> broke every single promise she made on the campaign trail and now has the lowest approval rating of any Virginia governor this century,"" added Youngkin spokesperson Justin Discigil. ""Governor Youngkin is happy that Virginians are being reminded of some good news, even if it means Gov. Spanberger taking credit for the economic deals he secured for the Commonwealth.""</p><p>Spanberger did not respond to Fox News Digital's requests for comment on the matter. </p><p><a href=""https://www.foxnews.com/politics/who-abigail-spanberger-why-did-democrats-choose-her-state-union-response"" rel=""noopener"" target=""_blank""><strong><u>WHO IS ABIGAIL SPANBERGER, AND WHY DID DEMOCRATS CHOOSE HER FOR TO THEIR STATE OF THE UNION RESPONSE?</u></strong></a></p><p>The four bills she signed, which with her signature authorized the awards, were announced during Youngkin's term <a href=""https://www.foxnews.com/category/politics/state-and-local/governors"" rel=""noopener"" target=""_blank"">as governor.</a> </p><p>The first, HB 1531, allocates $537 million to aerospace company Avio USA and is expected to create over 1,500 jobs. The award, according to public reports at the time, was announced in December 2025. The next bill, HB 799, will allocate $457 million and is expected to create over 825 jobs. This award was announced by Youngkin in September 2025. HB 800, allocating over $2 billion to pharmacuetical manufacturer Eli Lilly and expected to create more than 450 jobs to manufacture the active ingredient in major cancer, autoimmune and other advanced drugs, was announced in September 2025 as well. Meanwhile, rounding out the handful of investments touted by Spanberger this week was HB 1076, which invested $4 billion into pharmaceutical company AstraZeneca and is expected to create around 500 jobs. That commitment was announced in October 2025.</p><p>""Attracting new businesses and jobs to Virginia is a core focus of my administration — and I’m proud of the hundreds of millions of dollars in investment we have already announced this year,"" Spanberger continued in her press release this week announcing the Virginia investments. ""I look forward to continuing to work with legislators, local communities, and business leaders as we make clear that Virginia is the top state in the nation to grow or start a business.""</p><p>In a background section of the press release, the announcement continues touting Spanberger's commitment to growing Virginia's economy.</p><p><a href=""https://www.foxnews.com/media/former-virginia-gov-glenn-youngkin-hints-political-future-says-hes-chomping-bit-exit"" rel=""noopener"" target=""_blank""><strong>FORMER VIRGINIA GOV GLENN YOUNGKIN HINTS AT POLITICAL FUTURE, SAYS HE'S 'CHOMPING AT THE BIT' AFTER EXIT</strong></a></p><p>""My simple message for Abigail Spanberger is, to quote Elizabeth Warren, ‘You didn’t build that!’"" Sean Kennedy, president of Virginians for Safe Communities, said. ""Spanberger has to take credit for her Republican predecessor’s accomplishments bringing jobs <a href=""https://www.foxnews.com/category/us/us-regions/southeast/virginia"" rel=""noopener"" target=""_blank"">to Virginia</a> because her policies are actually raising taxes, killing jobs, and hiking energy costs. Spanberger has to play make believe that she is delivering on her affordability agenda to impress the 2028 Democratic Party kingmakers. I expect that Spanberger will nevertheless persist in her false claims.""</p><p>Critics of Spanberger have questioned the moderate campaign message she campaigned on, as well as her economic strategy, which has included ushering in <a href=""https://www.foxnews.com/politics/virginia-democrats-seek-dozens-new-tax-hikes-dog-walking-dry-cleaning"" rel=""noopener"" target=""_blank"">new taxes in the state</a> despite campaigning on a message of affordability.</p><p>""Abigail Spanberger's first 100 days in office have been a disaster when it comes to economic development, argued Miyares, who lost to <a href=""https://www.foxnews.com/politics/newly-minted-virginia-ag-who-fantasized-about-opponents-family-dying-roasted-over-glaring-typo"" rel=""noopener"" target=""_blank"">current Democratic Attorney General Jay Jones</a> in November. Jones infamously called for the murder of his GOP rival, something that ultimately did not matter enough for voters as he and Spanberger came out victorious in November. </p><p>""Three pillars of a good business environment is a good tax environment, a good regulatory environment and an environment that – from a litigation perspective – is not anti-business. Spanberger has already indicated and done a rash of bills that will make Virginia less competitive. Virginia does not compete by itself, we compete with 49 other sates, and Spanberger seems hellbent to hurt us with her tax, regulatory and litigation."" </p><p>Miyares added that he was aware of multiple Virginia businesses that former Governor Youngkin had recruited and were thinking about expanding in Virginia, but will no longer do so as a result of Spanberger's policies. </p><p>He also pointed out that Spanberger ""does not believe in energy abundance"" despite touting energy infrastructure investments this week. ""I find it in some ways laughable and pathetic what she is attempting to do,"" Miyares said.</p><p>""Abigail Spanberger inherited a $2.7 billion surplus and benefitted from hundreds of thousands of new jobs created under Republican leadership,"" the Virginia GOP added in February, in response to headlines about rising Virginia unemployment numbers. ""Her and her Democrat allies are squandering it all in a matter of weeks while breaking every promise they made on ‘affordability.’""</p>",https://www.foxnews.com/politics/spanberger-ripped-after-taking-credit-billions-investments-secured-under-gop-predecessor-pathetic,2026-04-09
1,Bryson DeChambeau adds 3D-printed club to bag for Masters,"<p>Bryson DeChambeau is putting together a solid season at <a href=""https://www.foxnews.com/category/sports/golf/liv-golf"" rel=""noopener"" target=""_blank"">LIV Golf</a>, and is looking to carry some of that momentum into the Masters this week in search of the first green jacket of his career.</p><p>DeChambeau is second in the LIV Golf standings behind Jon Rahm. But he enters <a href=""https://www.foxnews.com/category/sports/golf/the-masters"" rel=""noopener"" target=""_blank"">Augusta National</a> with back-to-back wins in Singapore and South Africa. As he heads into the first major of the golf season, DeChambeau is carrying something new in his bag.</p><p><a href=""https://www.foxnews.com/sports"" rel=""noopener"" target=""_blank""><strong>CLICK HERE FOR MORE SPORTS COVERAGE ON FOXNEWS.COM</strong></a></p><p>He will use a 5-iron made with a 3D printer. It’s a club he built himself.</p><p>""There's this nature that I have about myself where innovation is a habit of mine, and I really find and take pride in that ability to learn — even through failure, even through making a bad decision or a good decision — what I can get from that,"" he <a href=""https://www.espn.com/golf/story/_/id/48431238/bryson-dechambeau-using-iron-made-3d-printer-masters"" rel=""noopener nofollow"" target=""_blank"">told ESPN</a>.</p><p>""We'll see where it goes. We'll see where it takes me. All I could say now is, if I don't put them in the bag, it's my fault now.""</p><p>DeChambeau had manufacturing deals with LA Golf and Cobra. According to ESPN, his deal with Cobra ended in February.</p><p>Tinkering with his clubs isn’t a new strategy for DeChambeau. He said he had been tinkering with the idea of building his own clubs for a few years and tried a new wedge as he won in South Africa.</p><p><a href=""https://www.foxnews.com/sports/bryson-dechambeau-talks-ryder-cup-squashing-rivalries-pga-players-lack-resolution-liv"" rel=""noopener"" target=""_blank""><strong>BRYSON DECHAMBEAU TALKS RYDER CUP, SQUASHING RIVALRIES WITH PGA PLAYERS AND LACK OF RESOLUTION WITH LIV</strong></a></p><p>DeChambeau has had progressively better finishes at Augusta National since he made his first appearance in 2019. Since missing the cut in 2023, he finished tied for sixth in 2024 and tied for fifth in 2025. He missed the cut in 2022 and 2023.</p><p>""I feel like my game’s in the best place of its career, outside of maybe Greenbrier (in 2023) when I shot 58,"" he said. ""I’m excited to get the week going and see where I can put myself.""</p><p>He said his recent performances at the Masters were attributed to a <a href=""https://www.foxnews.com/category/sports/golf/liv-golf"" rel=""noopener"" target=""_blank"">more measured approach</a>.</p><p>""More patience, like not as aggressive all the time. Knowing where to be aggressive and when not to be aggressive,"" he said. ""Making better decisions, having a caddie that reins me in sometimes.""</p><p><i>The Associated Press contributed to this report.</i></p><p><i><strong>Follow Fox News Digital’s</strong></i><a href=""https://twitter.com/FoxNewsSports_"" rel=""noopener noreferrer nofollow"" target=""_blank""><i><strong> </strong></i></a><a href=""https://twitter.com/FoxNewsSports_"" rel=""noopener"" target=""_blank""><i><strong><u>sports coverage on X</u></strong></i></a><i><strong> and subscribe to</strong></i><a href=""https://www.foxnews.com/newsletters"" rel=""noopener"" target=""_blank""><i><strong><u> the Fox News Sports Huddle newsletter</u></strong></i></a><i><strong>.</strong></i></p>",https://www.foxnews.com/sports/bryson-dechambeau-adds-3d-printed-club-bag-masters,2026-04-09
2,Trump trashes MTG after Republican wins contest to fill her old seat 'despite the stench left by Greene',"<p>President <a href=""https://www.foxnews.com/category/person/donald-trump"" rel=""noopener"" target=""_blank"">Donald Trump</a> blasted former Rep. Marjorie Taylor Greene on Wednesday after Republican Clay Fuller won the special election runoff on Tuesday to fill Greene's old seat in Georgia's 14th Congressional District.</p><p>""Marjorie 'Traitor' Brown’s (GREEN TURNS TO BROWN UNDER STRESS!) seat in Congress has been taken over by a wonderful and talented man, Clay Fuller, who won convincingly, and right from the beginning, despite many people running for that 'TRUMP' +37 seat, and despite the stench left by Greene,"" Trump declared in a Wednesday Truth Social <a href=""https://truthsocial.com/@realDonaldTrump/posts/116369995519355709"" rel=""noopener nofollow"" target=""_blank"">post</a>.</p><p>""Congratulations to Clay Fuller, a very large improvement over his deranged predecessor!"" the president added.</p><p><a href=""https://www.foxnews.com/politics/marjorie-taylor-greene-trump-gop-midterms-loss-warning"" rel=""noopener"" target=""_blank""><strong>MARJORIE TAYLOR GREENE SAYS TRUMP, GOP ‘GOVERNED AMERICA LAST,’ PREDICTS MIDTERM LOSSES</strong></a></p><p>While Greene won re-election to the district by more than 28% in 2024, <a href=""https://results.sos.ga.gov/results/public/Georgia/elections/40726SpecialElection"" rel=""noopener nofollow"" target=""_blank"">unofficial results</a> for the April 7 contest indicate that Fuller won by more than 11%.</p><p>It also appears that far fewer people voted in the <a href=""https://www.foxnews.com/category/politics/elections"" rel=""noopener"" target=""_blank"">recent contest</a> compared to the 2024 race, which occurred during a presidential election cycle.</p><p>Greene declared in a <a href=""https://x.com/FmrRepMTG/status/2041921238335926285"" rel=""noopener nofollow"" target=""_blank"">post</a> on X that the district ""was never in danger of flipping blue, but the results speak for themselves. Trump flipping MAGA from America First to America Last, covering up for the Epstein files, and betraying key campaign promises of no more foreign wars has been the best help for the Democrats. Sad!""</p><p>Greene, who was previously an ardent Trump supporter, had a falling out with the president last year and left office early this year in the middle of her two-year term.</p><p><a href=""https://www.foxnews.com/politics/ex-trump-ally-marjorie-taylor-greene-joins-left-wing-calls-25th-amendment-iran-deadline-nears"" rel=""noopener"" target=""_blank""><strong>EX-TRUMP ALLY MARJORIE TAYLOR GREENE JOINS LEFT-WING CALLS FOR THE 25TH AMENDMENT AS IRAN DEADLINE NEARS</strong></a></p><p>On Easter Sunday after Trump's controversial Truth Social post <a href=""https://www.foxnews.com/category/world/conflicts/iran"" rel=""noopener"" target=""_blank"">threatening Iranian power plants</a> and bridges, Greene blasted the president in a post on X, saying he had ""gone insane.""</p><p>""Tuesday will be Power Plant Day, and Bridge Day, all wrapped up in one, in Iran. There will be nothing like it!!! Open the F[---]in’ Strait, you crazy bastards, or you’ll be living in Hell - JUST WATCH! Praise be to Allah,"" Trump said in the <a href=""https://truthsocial.com/@realDonaldTrump/posts/116351998782539414"" rel=""noopener nofollow"" target=""_blank"">post</a> on Sunday.</p><p>In part of a lengthy <a href=""https://x.com/FmrRepMTG/status/2040789438494585175"" rel=""noopener nofollow"" target=""_blank"">post</a> on X, Greene asserted, ""Everyone in his administration that claims to be a Christian needs to fall on their knees and beg forgiveness from God and stop worshipping the President and intervene in Trump’s madness. I know all of you and him and he has gone insane, and all of you are complicit.""</p><p>Then on Tuesday, after Trump threatened that an entire ""civilization will die tonight, never to be brought back again,"" Greene called for removing the president from office via the 25th Amendment.</p><p><a href=""https://www.foxnews.com/politics/republicans-win-democrats-also-claim-victory-ballot-box-surge-trump-territory"" rel=""noopener"" target=""_blank""><strong>REPUBLICANS WIN BUT DEMOCRATS ALSO CLAIM VICTORY WITH BALLOT BOX SURGE IN TRUMP TERRITORY</strong></a></p><p>""25TH AMENDMENT!!! Not a single bomb has dropped on America. We cannot kill an entire civilization. This is evil and madness,"" she wrote in a <a href=""https://x.com/FmrRepMTG/status/2041499550012084690"" rel=""noopener nofollow"" target=""_blank"">post</a> on X.</p>",https://www.foxnews.com/politics/trump-trashes-mtg-republican-wins-contest-fill-old-seat-despite-stench-left-greene,2026-04-09
3,Masters fans cheer low prices as Augusta National concessions 'feel unreal' with $1.50 sandwiches,"<p>As prices soar across stadiums and arenas nationwide, Augusta National — home of the Masters <a href=""https://www.foxnews.com/category/sports/golf"" rel=""noopener"" target=""_blank"">golf tournament</a> — is once again standing out for its low prices.</p><p>The famed golf club in Augusta, Georgia, went viral on social media after journalist Claire Rogers shared a photo of its concession menu during the Augusta National Women's Amateur (ANWA).</p><p>Rogers' post, shared March 31, highlighted <a href=""https://www.foxnews.com/category/food-drink"" rel=""noopener"" target=""_blank"">food prices</a> that remain low in 2026.</p><p><a href=""https://www.foxnews.com/food-drink/leftover-hacks-explode-social-media-americans-fight-high-prices-scrap-food-feasts"" rel=""noopener"" target=""_blank""><strong><u>LEFTOVER HACKS EXPLODE ON SOCIAL MEDIA AS AMERICANS FIGHT HIGH PRICES WITH SCRAP FOOD FEASTS</u></strong></a></p><p>The stand offered sandwiches ranging from $1.50 to $3, including egg salad and pimento cheese at the low end, and club and ham-and-cheese options at $3.</p><p>Muffins were priced at $2.50, while <a href=""https://www.foxnews.com/category/food-drink/food/snack-foods"" rel=""noopener"" target=""_blank"">cookies and chips</a> were sold for $1.50. </p><p>A Georgia peach ice cream sandwich was listed at $3.</p><p><a href=""https://www.foxnews.com/category/lifestyle/quizzes"" rel=""noopener"" target=""_blank""><strong><u>TEST YOURSELF WITH OUR LATEST LIFESTYLE QUIZ</u></strong></a></p><p>Popcorn and candy were each priced at $2 — while over-the-counter pain relievers like Advil or Aleve cost 75 cents.</p><p>The low prices drew widespread praise on social media.</p><p>""One of the best parts of Augusta,"" an X user said. ""The food prices still feel unreal compared to everything else in sports.""</p><p>""@McDonalds, this used to be what your <a href=""https://www.foxnews.com/food-drink/chilis-trolls-fast-food-giants-value-meals-face-backlash-price-weary-consumers"" rel=""noopener"" target=""_blank"">value menu</a> used to look like,"" another wrote.</p><p><a href=""https://www.foxnews.com/newsletters?cmpid=fnfirstnl"" rel=""noopener"" target=""_blank""><strong><u>CLICK HERE TO SIGN UP FOR OUR LIFESTYLE NEWSLETTER</u></strong></a></p><p>The women's tournament serves as a lead-in event ahead of <a href=""https://www.foxnews.com/category/sports/golf/the-masters"" rel=""noopener"" target=""_blank"">the Masters</a>, which begins Thursday with the opening round.</p><p>While Augusta National has not released official concession prices for the Masters, the ANWA menu suggests prices are expected to remain low.</p><p>That pricing stands in sharp contrast to the overall cost of attending the Masters, one of the most in-demand sporting events in the world, where tickets are notoriously difficult to obtain.</p><p>The concession prices are low because Augusta National is ""making so much money on everything else,"" said Cody Moore, a wealth management advisor in Alpharetta, Georgia.</p><p><a href=""https://www.foxnews.com/lifestyle"" rel=""noopener"" target=""_blank""><strong><u>CLICK HERE FOR MORE LIFESTYLE STORIES</u></strong></a></p><p>A self-described Masters fan, Moore told Fox News Digital the tournaments bring in as much as $250 million a year, which offsets the <a href=""https://www.foxnews.com/category/food-drink/food"" rel=""noopener"" target=""_blank"">cost of food</a>.</p><p>""They're likely not turning a profit at all on their concession prices — but when you're buying food, you're very likely to buy apparel, memorabilia and other items at a significant margin,"" he said. </p><p>Moore expected similar prices at the Masters, as it's become ""one of the trademarks"" of the tournament.</p><p>""Augusta has kept them that way intentionally for years, and it's become a big part of what makes the experience unique, in my opinion,"" he said. </p><p>It's ""less about profits and more about <a href=""https://www.foxnews.com/category/good-news"" rel=""noopener"" target=""_blank"">respect and admiration</a> for the immense tradition of the tournament and course.""</p><p>Fox News Digital reached out to Augusta National for comment.</p>",https://www.foxnews.com/food-drink/masters-fans-cheer-low-prices-augusta-national-concessions-feel-unreal-1-50-sandwiches,2026-04-09
