,title,text,link,publish_date
9,California-based coffee shop Philz Coffee to pull LGBTQ pride flags despite progressive backlash,"<p>The <a href=""https://www.foxnews.com/category/us/san-francisco"" rel=""noopener"" target=""_blank"">San Francisco coffee shop</a> Philz Coffee is removing LGBTQ pride flags from its stores despite growing progressive backlash.</p><p>Reports that the <a href=""https://www.foxnews.com/category/us/us-regions/west/california"" rel=""noopener"" target=""_blank"">California coffee chain</a> would be removing Pride flags from its stores came after a Change.org petition circulated from a group known as ""Philz Coffee Baristas"" demanding the company reconsider the decision.</p><p>""Philz Coffee's recent decision to remove pride flags from their stores has left many team members and customers feeling confounded and unsupported,"" <a href=""https://www.change.org/p/urge-philz-coffee-to-keep-pride-flags-up"" rel=""nofollow noopener"" target=""_blank"">the petition</a> says. </p><p>""Within Philz's expressed core values, the company emphasizes its goal to create a 'customer and team-member focused' experience. The pride flags within the stores hold deep meaning and value to both staff and visitors, symbolizing that these locations are safe and welcoming spaces for all individuals, regardless of sexual orientation or gender identity.</p><p><a href=""https://www.foxnews.com/media/fired-yosemite-worker-sues-national-park-service-after-hanging-massive-transgender-flag-across-el-capitan"" rel=""noopener"" target=""_blank""><strong>FIRED YOSEMITE WORKER SUES NATIONAL PARK SERVICE AFTER HANGING MASSIVE TRANSGENDER FLAG ACROSS EL CAPITAN</strong></a></p><p>""In todays [sic] society, businesses have an essential role in fostering inclusivity and support, and displaying the pride flag is a simple yet remarkably powerful demonstration of that role. Removing these flags risks alienating a core group of team members and loyal customers who see Philz not just as a coffee shop, but as a place where they are embraced and celebrated for who they are.""</p><p>Philz Coffee confirmed the decision in a statement from CEO Mahesh Sadarangani to <a href=""https://www.foxnews.com/media"" rel=""noopener"" target=""_blank"">Fox News Digital</a> Thursday, adding that stores will remove other flags as well.</p><p>""At Philz, we have always believed everyone who walks through our doors deserves to feel welcome and safe, and that belief is at the core of everything we do,"" Sadarangani said. </p><p>""Our longstanding support of the LGBTQIA+ community is unchanged. We are working toward creating a more consistent, inclusive experience across all our stores, including removing a variety of flags and other decor.</p><p><a href=""https://www.foxnews.com/media/la-business-owner-fed-city-repeatedly-targets-stores-sidewalk-sign-instead-homeless-camps"" rel=""noopener"" target=""_blank""><strong>LA BUSINESS OWNER FED UP AS CITY REPEATEDLY TARGETS STORE'S SIDEWALK SIGN INSTEAD OF HOMELESS CAMPS</strong></a></p><p>""This is a change in how our stores look, not in who we are. Our allyship runs deeper than what is on our walls. It shows up in who we hire, how we treat one another and in our annual Pride Month Unity celebration, which returns this June as it has every year. Unity is fundamental to how we operate.""</p><p>It is unclear when all the flags will be removed.</p><p>This is not the first time a Philz Coffee store has faced backlash due to the political environment. In 2020, the company reportedly fired four employees who took issue with the company's <a href=""https://www.foxnews.com/us/philz-coffee-fired-employees-police-policies"" rel=""noopener"" target=""_blank"">policies toward community police</a>. One employee posted an image on the company's Instagram account demanding an end to 20% police discounts after the death of Breonna Taylor.</p><p><a href=""https://www.foxnews.com/opinion/corporate-america-has-decided-dei-needs-die"" rel=""noopener"" target=""_blank""><strong>CORPORATE AMERICA HAS DECIDED THAT DEI NEEDS TO DIE</strong></a></p><p>""What’s your favorite iced coffee drink because ours is arrest the cops who killed Breonna Taylor,"" the employee wrote.</p><p>In 2023, five Philz Coffee employees were also sent home after <a href=""https://www.dailycal.org/news/city/local-businesses/gilman-st-philz-coffee-employees-sent-home-for-free-palestine-pins/article_b1ca3008-a137-11ee-b023-67c1a731c576.html"" rel=""nofollow noopener"" target=""_blank"">refusing to remove ""Free Palestine"" pins</a>.</p>",https://www.foxnews.com/media/california-based-coffee-shop-philz-coffee-pull-lgbtq-pride-flags-despite-progressive-backlash,2026-04-09
10,"Inside Tehran after strikes: Iranian woman describes fear, checkpoints and people used as ‘human shields’","<p>An anonymous Iranian woman has bravely stepped forward on the international stage to describe what's really happening on the ground in Tehran as President <a href=""https://www.foxnews.com/category/person/donald-trump"" rel=""noopener"" target=""_blank"">Donald Trump</a>'s two-week ceasefire with Iran tentatively began Tuesday.</p><p>In an essay published in <a href=""https://www.theaustralian.com.au/commentary/everyday-life-inside-tehran-a-fine-line-between-hope-and-abandonment/news-story/af6072abe39584bd4e3c701ed19c0606"" rel=""nofollow noopener"" target=""_blank"">The Australian</a>, the anonymous author details nightly explosions, sweeping checkpoints and communications blackouts as a part of Iranian daily life since the beginning of operations <a href=""https://www.foxnews.com/category/politics/defense/wars/war-with-iran"" rel=""noopener"" target=""_blank"">launched</a> by the United States and Israel in February.</p><p>""In effect, ordinary people have been turned into human shields within a vast militarized landscape,"" she wrote. ""A pervasive sense of anger, paranoia and exhaustion has taken hold.""</p><p>Flagrant public executions of protesters by the thousands by the Iranian regime in January moved residents to cheer on the initial days of attacks by U.S. and Israeli forces as <a href=""https://www.foxnews.com/opinion/one-month-at-war-with-iran-can-washington-define-victory"" rel=""noopener"" target=""_blank"">Operation Epic Fury began</a> on Feb. 28.</p><p><a href=""https://www.foxnews.com/media/why-trump-iran-seem-light-years-apart-any-possible-deal-end-war"" rel=""noopener"" target=""_blank""><strong>WHY TRUMP, IRAN SEEM LIGHT-YEARS APART ON ANY POSSIBLE DEAL TO END THE WAR</strong></a></p><p>""They say they’ve hit the leader’s residence,"" the author's daughter was quoted saying. ""All the children were screaming and cheering. … Even our teacher was quietly snapping their fingers and dancing.""</p><p>The author described everyday Iranians celebrating the death of Supreme Leader <a href=""https://www.foxnews.com/category/person/ali-khamenei"" rel=""noopener"" target=""_blank"">Ayatollah Khamenei</a> that same Saturday, and the streets of Tehran filling with cheers of ""death to the dictator.""</p><p>""Perhaps for the first time,"" the anonymous author recalled, ""we allowed ourselves to believe our long-held dream was beginning to take shape.""</p><p><a href=""https://www.foxnews.com/world/red-cross-shares-audio-iranian-civilian-explaining-situation-ground-tehran-no-respite"" rel=""noopener"" target=""_blank""><strong>RED CROSS SHARES AUDIO OF IRANIAN CIVILIAN EXPLAINING SITUATION ON THE GROUND IN TEHRAN: 'NO RESPITE'</strong></a></p><p>But soon enough, the reality of day-to-day life under a threatened, crumbling regime and ongoing attacks took a toll. One of the harshest realities those on the ground <a href=""https://www.foxnews.com/category/world/conflicts/iran"" rel=""noopener"" target=""_blank"">in Iran</a> face is the internet blackout, effectively ending communications with the outside world and leading to great uncertainty at the hands of the regime.</p><p>""So far, none of those close to us have suffered physical harm, but no night is calm,"" the Iranian woman wrote. ""What weighs most heavily is not only the war itself, but the possibility that it may end leaving behind a regime even more authoritarian, more repressive and more violent.""</p><p>According to the author, a stubborn faction of regime supporters remain, blasting propaganda on loudspeakers nightly through the streets of Tehran and reinforcing its authority to those who support the revolution.</p><p><a href=""https://www.foxnews.com/politics/trumps-iran-ceasefire-rocked-within-hours-amid-reported-missile-drone-attacks"" rel=""noopener"" target=""_blank""><strong>TRUMP’S IRAN CEASEFIRE ROCKED WITHIN HOURS AMID REPORTED MISSILE, DRONE ATTACKS</strong></a></p><p>""The streets are now covered with checkpoints,"" she wrote. ""Under bridges and along main roads, movement is restricted. Long traffic lines form. Young people are stopped, their phones inspected under the pretext of routine checks.""</p><p>After the <a href=""https://www.foxnews.com/politics/trump-agrees-2-week-ceasefire-iran-opens-strait-hormuz"" rel=""noopener"" target=""_blank"">announcement of the ceasefire</a> between U.S. forces and the Iranian regime Tuesday, the author said, most of her country went to sleep that night in a ""state of deep anxiety.""</p><p>""What weighs most heavily is not only the war itself, but the possibility that it may end up leaving behind a regime even more authoritarian, more repressive, and more violent,"" the author notes.</p><p>She urged a ceasefire that is not ""abandonment,"" but peace, destabilizing the Iranian regime.</p><p>""A ceasefire that stabilizes the current order, without addressing the demands that have brought <a href=""https://www.foxnews.com/category/world/world-protests"" rel=""noopener"" target=""_blank"">Iranians into the streets</a> for years, risks being experienced not as peace, but as abandonment,"" the author wrote.</p><p>Negotiations between Iran and the U.S. are scheduled to begin Friday <a href=""https://www.foxnews.com/category/world/world-regions/pakistan"" rel=""noopener"" target=""_blank"">in Pakistan</a>.</p><p>""We wait, and we continue, in whatever ways possible, to insist that light will eventually overcome this darkness,"" she concluded.</p><p><i>The Australian notes the author remains anonymous for ""fear of retribution.""</i></p>",https://www.foxnews.com/world/inside-tehran-after-strikes-iranian-woman-describes-fear-checkpoints-people-human-shields,2026-04-09
11,Bruce Springsteen blasts rich men in America as critics call out his billions,"<p>Bruce Springsteen is turning up the volume — not with music, but with a <a href=""https://www.foxnews.com/category/politics"" rel=""noopener"" target=""_blank"">fiery political speech</a> that’s putting him back at the center of controversy.</p><p>The billionaire rocker is <a href=""https://x.com/olilondontv/status/2042220088691208418?s=46&amp;t=04zPYe3OqeXZDefU6iCnlg"" rel=""nofollow noopener"" target=""_blank"">facing backlash</a> after recently blasting America’s richest and most powerful in a scathing speech, one that critics say rings differently given his reported $1.2 billion fortune.</p><p>According to <a href=""https://www.forbes.com/sites/idonnkanga/2026/03/10/the-worlds-celebrity-billionaires-2026/"" rel=""nofollow noopener"" target=""_blank"">Forbes’ March 2026</a> report, ""The World’s Celebrity Billionaires,"" Springsteen lands at No. 15 with a staggering net worth of $1.2 billion.</p><p><a href=""https://www.foxnews.com/entertainment/bruce-springsteen-slammed-traitor-after-ripping-america-during-minneapolis-concert-rant"" rel=""noopener"" target=""_blank""><strong>BRUCE SPRINGSTEEN SLAMMED AS 'TRAITOR' AFTER RIPPING AMERICA DURING MINNEAPOLIS CONCERT RANT</strong></a></p><p>Springsteen began to address an audience, saying, ""The richest men in America have abandoned the world’s poorest children to death and disease through dismantling of U.S. aid. This is happening now. We're <a href=""https://www.foxnews.com/category/world/nato"" rel=""noopener"" target=""_blank"">undermining NATO</a> and the world order that kept us safe and at global peace for 80 years. This is happening now.""</p><p>Springsteen widened his attack to U.S. alliances and global standing.</p><p><a href=""https://www.foxnews.com/media/bruce-springsteen-doubles-down-anti-trump-anti-ice-stance-says-blowback-just-part-it"" rel=""noopener"" target=""_blank""><strong>BRUCE SPRINGSTEEN DOUBLES DOWN ON ANTI-TRUMP, ANTI-ICE STANCE, SAYS 'BLOWBACK IS JUST PART OF IT'</strong></a></p><p>""We threaten our good neighbors and our allies — Canada, the Netherlands whose sons and daughters have fought alongside of us in American wars with predatory annexation of their lands. This is happening now.""</p><p>The ""Born in the U.S.A."" singer continued to take aim at cultural institutions and the current administration under President <a href=""https://www.foxnews.com/category/person/donald-trump"" rel=""noopener"" target=""_blank"">Donald Trump</a>.</p><p>""Our museums are told to whitewash American history of any unpleasant or inconvenient facts like the full history of the brutality of slavery. If you want to talk about snowflakes, we have a president who can't handle the truth. This is happening now.""</p><p><a href=""https://www.foxnews.com/media/kiss-icon-gene-simmons-tells-celebrities-mark-ruffalo-ben-stiller-shut-f-up-about-politics"" rel=""noopener"" target=""_blank""><strong>KISS ICON GENE SIMMONS TELLS CELEBRITIES MARK RUFFALO, BEN STILLER TO 'SHUT THE F--- UP' ABOUT POLITICS</strong></a></p><p>He then shifted to accusations of corruption at the <a href=""https://www.foxnews.com/category/corruption"" rel=""noopener"" target=""_blank"">highest levels of government</a>.</p><p>""While working Americans struggle, our president and his family enrich themselves by billions of dollars trading on the people's office in corruption unmatched in American history. This is happening now.""</p><p>Springsteen argued that America’s global reputation is collapsing.</p><p>""The White House, <a href=""https://www.foxnews.com/category/us/education/administration"" rel=""noopener"" target=""_blank"">this White House</a> is destroying the American idea and our reputation around the world. To many, we are no longer looked upon as an often imperfect but strong defender of democracy standing for the global good.</p><p>""We are no longer the land of the free and the home of the brave. We are now America, the reckless, unpredictable, predatory, rogue nation. That is this administration's and it will be this president's legacy. And that's happening now.""</p><p>He concluded with a call to core values as backlash intensified online.</p><p>""Honesty, honor, humility, truth, compassion, thoughtfulness, morality, true strength and decency. Don't let anyone tell you that these things don't matter anymore. They do.""</p><p><a href=""https://www.foxnews.com/newsletters?cmpid=fnfirstnl"" rel=""noopener"" target=""_blank""><strong>CLICK HERE TO SIGN UP FOR THE ENTERTAINMENT NEWSLETTER</strong></a></p><p>Critics were quick to fire back at Springsteen's controversial speech.</p><p>""Let's see him give his fortune to the poor. He won't. He just gets paid to be an influencer for the socialists on the left,"" one commenter wrote.</p><p><a href=""https://www.foxnews.com/entertainment"" rel=""noopener"" target=""_blank""><strong>LIKE WHAT YOU’RE READING? CLICK HERE FOR MORE ENTERTAINMENT NEWS</strong></a></p><p>""People buying tickets buy them to hear his music, but now he just makes political statements. Never went to his concert, definitely will not now,"" another added.</p><p>Another comment said, ""Hypocrisy is nothing new in Hollywood! They have no knowledge of the life of the average American!""</p><p>The 76-year-old Rock &amp; Roll Hall of Famer has built his fortune over decades in the spotlight.</p><p>Springsteen has sold more than 140 million albums globally over his 50 years of touring and recording, according to Forbes.</p><p>But it wasn’t just album sales that pushed Springsteen into billionaire territory.</p><p>His biggest check came from selling his music catalog to Sony Music Entertainment for a $500 million lump sum in 2021.</p><p>Last week, Springsteen also stirred outrage during his Minneapolis show with additional remarks on <a href=""https://www.foxnews.com/category/us/immigration"" rel=""noopener"" target=""_blank"">immigration and U.S. policy</a>.</p><p>""There are immigrants being held in detention centers around the country and being deported without due process of law to alien countries and foreign gulags,"" he said. ""This is happening now.""</p><p>Fox News Digital has reached out to Springsteen for comment.</p>",https://www.foxnews.com/entertainment/bruce-springsteen-blasts-rich-men-america-critics-call-out-his-billions,2026-04-09
12,Suspect who killed California deputy run over by armored vehicle after hours-long firefight standoff: sheriff,"<p>A California <a href=""https://www.foxnews.com/category/us/crime/police-and-law-enforcement"" rel=""noopener"" target=""_blank"">sheriff’s detective</a> was shot and killed Thursday while serving an eviction notice after an armed suspect opened fire on deputies in what authorities described as an apparent ambush that led to an hours-long standoff.</p><p>The suspect, identified as David Eric Morales, was ultimately killed when a law enforcement BearCat armored vehicle ran over him after he continued firing and refused to surrender, authorities said.</p><p>""The suspect was lying prone on the ground, in camouflage clothing, continuing to pose a threat,"" Tulare County Sheriff Mike Boudreaux said later during a news conference. ""The situation was resolved, and the suspect is now dead. He was not shot. One of the BearCats ran over him and killed him.""</p><p>Boudreaux said the shooting happened around 10:40 a.m. in Porterville, where deputies encountered Morales, who allegedly fired at them with a high-powered rifle.</p><p>Authorities said Morales remained barricaded in his home for hours after the shooting, firing repeatedly as <a href=""https://www.foxnews.com/category/us/crime/police-and-law-enforcement"" rel=""noopener"" target=""_blank"">deputies and assisting agencies</a> worked to contain the scene.</p><p><a href=""https://www.foxnews.com/us/repeat-offender-kills-2-deputies-days-after-50k-bond-despite-long-violent-record-police"" rel=""noopener"" target=""_blank""><strong>REPEAT OFFENDER KILLS 2 DEPUTIES DAYS AFTER $50K BOND DESPITE LONG VIOLENT RECORD: POLICE</strong></a></p><p>Boudreaux said Morales eventually exited the home through a window and was later found outside, lying in brush while wearing camouflage and continuing to pose a threat.</p><p>The detective, identified by Boudreaux as Deputy Randy Hoppert, was struck by gunfire and transported to Sierra View District Hospital, where he died at 11:57 a.m.</p><p>Hoppert was a Navy corpsman who served from 2010 to 2015 and joined the Tulare County Sheriff’s Office on Jan. 5, 2020, Boudreaux said.</p><p>""This situation went from a civil order of removal to where our officer was shot and killed. This is senseless,"" Boudreaux said.</p><p><a href=""https://www.foxnews.com/media/tim-tebow-wife-demi-leigh-partner-company-convicts-second-chance-grace"" rel=""noopener"" target=""_blank""><strong><u>TIM TEBOW AND WIFE DEMI-LEIGH PARTNER WITH COMPANY GIVING EX-CONVICTS SECOND CHANCE: 'WHAT GRACE IS ALL ABOUT'</u></strong></a></p><p>Authorities considered airlifting the Hoppert to Fresno, but his condition was too unstable for transport.</p><p>Boudreaux said Morales had not paid rent for 35 days, and deputies were serving a <a href=""https://www.foxnews.com/category/us/economy/housing"" rel=""noopener"" target=""_blank"">final eviction notice</a> when the shooting occurred.</p><p>The sheriff said Morales appeared to have been waiting for deputies and ""laid in wait"" before opening fire, prompting a call for additional units.</p><p>Boudreaux described the outcome in blunt terms.</p><p>""Don’t shoot at cops. You shoot at cops, we’re going to run you over. He got run over. He got what he deserved,"" the sheriff said.</p><p><a href=""https://www.foxnews.com/us/six-dead-including-teen-mom-infant-believed-gang-related-shooting"" rel=""noopener"" target=""_blank""><strong><u>SIX DEAD, INCLUDING TEEN MOM AND INFANT, IN BELIEVED GANG-RELATED SHOOTING</u></strong></a></p><p>He added that the suspect had ""chosen this ending.""</p><p>The sheriff also told reporters he spent time with Hoppert's wife and mother earlier this afternoon.</p><p>""I sat down at the hospital and met with the wife and his mom, and I can tell you there is no consoling that family at this point,"" Boudreaux said. ""Attacks on law enforcement of this nature must stop.""</p><p>During the standoff, Morales allegedly fired at law enforcement vehicles and equipment, including a drone that was shot out of the air, while multiple tactical vehicles took gunfire, according to Boudreaux.</p><p>Law enforcement agencies across the region responded to assist, and an escort was being organized to accompany Hoppert's body from the hospital to the coroner’s office, Boudreaux said.</p>",https://www.foxnews.com/us/california-detective-killed-ambush-serving-eviction-suspect-barricaded-standoff,2026-04-09
