,title,text,link,publish_date
0,Los Angeles schools may close as nearly 85% of district’s workers plan to strike,"<p><a href=""https://www.foxnews.com/category/us/los-angeles"" rel=""noopener"" target=""_blank"">Los Angeles</a> schools could close next week because nearly 85% of the district’s workers plan to strike, demanding higher pay as the district reportedly holds on to $5 billion in reserves.</p><p>""During spring break, the district met with the United Teachers Los Angeles (UTLA), the Associated Administrators of Los Angeles (AALA), and Trades labor partners, successfully reaching an agreement with Trades,"" a Los Angeles Unified School District (LAUSD) spokesperson told <a href=""https://www.foxnews.com/category/media"" rel=""noopener"" target=""_blank"">Fox News Digital</a> Friday.</p><p>""The District has made extensive efforts to responsibly respond to labor partners’ proposals, and its offers remain among the most generous in the state.""</p><p>But the three unions are clearly not satisfied with the proposals as they gear up to go on strike Tuesday.</p><p><a href=""https://www.foxnews.com/us/la-united-school-district-scandal-leads-charges-22m-scheme-allegedly-drained-funds-meant-students"" rel=""noopener"" target=""_blank""><strong>LA UNITED SCHOOL DISTRICT SCANDAL LEADS TO CHARGES AS $22M SCHEME ALLEGEDLY DRAINED FUNDS MEANT FOR STUDENTS</strong></a></p><p>LAUSD, comprising hundreds of K-12 schools and more than half a million students, has until Tuesday to come to an agreement. Otherwise, a strike will proceed. <a href=""https://www.foxla.com/news/lausd-strike-resource-website-negotiations-update-2026?link_source=ta_first_comment&amp;taid=69d94c3d3d7eb000018bf94a&amp;fbclid=IwY2xjawRGTSpleHRuA2FlbQIxMABicmlkETFQdzFWaTM3SVZac0xGaEtCc3J0YwZhcHBfaWQQMjIyMDM5MTc4ODIwMDg5MgABHpoUX2aAf4hN_hzyXSWVDC4xqvDhC86DqmorowAuYuD-7iN_0UbI9mKGcte3_aem_lHbkAuGxCewk2SBOJTTUaQ"" rel=""noopener"" target=""_blank"">According to a local Fox affiliate</a>, district officials launched a website Friday to assist families with food distribution and mental health services in case schools are closed.</p><p>""We don’t want to strike,"" Charmell Lee, a special education assistant and a member of Local 99 of Service Employees International Union, told the Los Angeles Times Thursday. ""But we will if that’s what it takes to ensure our families can survive and our students have all the support they need — inside and outside the classroom."" </p><p>""There is no question that schools will be closed if any two of the three unions walk out, district officials have confirmed,"" <a href=""https://www.latimes.com/california/story/2026-04-09/three-unions-unite-in-massive-lausd-strike-threat-whats-at-stake-for-workers-families"" rel=""nofollow noopener"" target=""_blank"">the LA Times reported</a>.</p><p>The frustrated union members believe the district is holding on to billions in reserves.</p><p>""With over 5 BILLION dollars in reserves, we know that LAUSD can absolutely provide all of its employees with a fair contract,"" said incoming UTLA Vice President Jessica Rodarte. </p><p>A district spokesperson told Fox News Digital ""all available reserve dollars are currently being allocated for ongoing expenditures.""</p><p><a href=""https://www.foxnews.com/us/fbi-raid-involving-la-schools-superintendent-possibly-tied-failed-6m-ai-deal-potential-conflict"" rel=""noopener"" target=""_blank""><strong>FBI RAID INVOLVING LA SCHOOLS SUPERINTENDENT POSSIBLY TIED TO FAILED $6M AI DEAL, POTENTIAL CONFLICT</strong></a></p><p>""Current estimates place this year’s ending balance in June 2026 at $3.8 billion, and this includes funds that are restricted by law and must be used for specific purposes,"" a district spokesperson said.</p><p>The spokesperson added, ""Los Angeles Unified is engaged in deficit spending, which means we are spending more money than we bring in. At the current rate of spending, we will have depleted all remaining unrestricted reserves within two years.""</p><p>The three unions, which have different priorities and separate contracts, represent about 70,000 of the district’s 83,000 employees across a range of positions from food workers to principals, the Times noted.</p><p>""The district continues meeting with labor partners this week and remains available to meet until agreements are reached with all groups. For the latest updates, families and staff are encouraged to visit the district’s labor updates webpage,"" the district spokesperson told Fox News Digital.</p><p><a href=""https://www.foxnews.com/us/fbi-raids-home-offices-major-los-angeles-school-district-superintendent"" rel=""noopener"" target=""_blank""><strong>FBI RAIDS HOME AND OFFICES OF MAJOR LOS ANGELES SCHOOL DISTRICT SUPERINTENDENT</strong></a></p><p>None of the unions responded to Fox News Digital's request for comment.</p><p>The threat of a strike comes as the district faces a <a href=""https://edsource.org/2026/lausd-workers-strike-april/755569"" rel=""nofollow noopener"" target=""_blank"">$191 million deficit</a> and declining enrollment that prompted LAUSD officials to warn about layoffs and staff reductions. </p><p>The budget woes come while the Trump administration is <a href=""https://oag.ca.gov/news/press-releases/attorney-general-bonta-sues-trump-administration-block-unlawful-threat-terminate"" rel=""nofollow noopener"" target=""_blank"">threatening California education funding</a> over issues related to parental notification policies that are intended to disclose a student’s gender identity and transgender athlete policies. </p><p>Most recently, LAUSD has <a href=""https://www.foxnews.com/politics/nations-second-largest-school-district-targeted-trump-over-secretive-trans-policy"" rel=""noopener"" target=""_blank"">been under federal scrutiny</a> for a policy allowing staff to hide students’ gender identity from parents.</p><p>""The district remains committed to reaching agreements that support employees while also protecting the long-term financial stability of the district,"" the district spokesperson said.</p><p>""Avoiding a strike will require all parties to continue engaging in good-faith negotiations and working toward a solution that is fair and sustainable. To date, the district has reached agreements with five of its eight labor partners and is prepared to work around the clock to reach agreements with teachers, administrators and service workers.""</p><p>Teachers and San Francisco school district staff <a href=""https://www.foxnews.com/us/san-francisco-teachers-union-strike-leaves-50000-children-out-school"" rel=""noopener"" target=""_blank"">went on strike in February</a> for the first time in nearly 50 years, demanding better wages and health benefits.</p>",https://www.foxnews.com/media/los-angeles-schools-may-close-nearly-85-districts-workers-plan-strike,2026-04-10
1,PETER NAVARRO: Trump's Artemis vision is now flying — and China is paying attention,"<p>Now that <a href=""https://www.foxnews.com/category/science/air-and-space/nasa"" rel=""noopener"" target=""_blank"">Artemis II</a> has completed its lunar flyby and returned to Earth, Artemis is no longer a concept or a promise. It is a working American deep space architecture.</p><p>In a single mission, the Artemis II crew executed manual piloting and proximity operations, while the Orion spacecraft operated at lunar distance and proved the life support, propulsion, power, thermal, navigation and reentry systems that generated the operational data NASA says will shape the missions that follow.</p><p>As we celebrate this achievement, it is worth remembering how this mission began <strong>—</strong> and why it matters.</p><p><a href=""https://www.foxnews.com/us/artemis-ii-nears-end-historic-mission-splashdown-off-california-coast"" rel=""noopener"" target=""_blank""><strong>ARTEMIS II NEARS END OF HISTORIC MISSION WITH SPLASHDOWN OFF CALIFORNIA COAST</strong></a></p><p>Early in his first term, <a href=""https://www.foxnews.com/category/person/donald-trump"" rel=""noopener"" target=""_blank"">Donald Trump</a> saw what no president since Richard Nixon had seen clearly enough: returning to the Moon is not some relic of the last century’s glory days. It is the strategic high ground of this one.</p><p>The triumph of Artemis II began on Dec. 11, 2017, with the signing of Space Policy Directive-1. It redirected NASA away from two dead ends.</p><p>The first was the Obama-era asteroid pathway, in which NASA planned to retrieve a boulder from a near-Earth asteroid, place it in lunar orbit and send astronauts there as a steppingstone to Mars. It was the kind of fool’s errand only Washington could love — expensive, convoluted and utterly lacking the geopolitical clarity of a return to the moon.</p><p>The second was America’s long low-Earth-orbit holding pattern. Years of useful work aboard the International Space Station, to be sure, but no serious strategy for pushing outward into deep space and reclaiming leadership beyond it.</p><p>In the Trump doctrine, the moon is not just a destination. It is the next great platform of national power — a logistics hub, a science outpost, a proving ground for deep-space industry and a potential source of water ice for drinking water, oxygen and rocket fuel. </p><p>It is also where the technologies of in-space manufacturing, power generation, navigation, extraction and transport will be tested and refined and where military advantage, industrial capacity, technological leadership and geopolitical influence all converge.</p><p>That is exactly why <a href=""https://www.foxnews.com/category/world/world-regions/china"" rel=""noopener"" target=""_blank"">Communist China</a> is openly targeting a crewed lunar landing by 2030 and an International Lunar Research Station with Russia by 2035. This is a contest for position. The nation that gets there first will shape far more than headlines. It will shape the future balance of power.</p><p>The genius of Artemis is that it is not a purely governmental effort. It is a public-private partnership designed to harness exactly what America does best: entrepreneurial innovation, private-sector speed and allied cooperation.</p><p><a href=""https://www.foxnews.com/media/astronaut-tells-cnn-entire-trump-administration-deserves-credit-artemis-mission-success"" rel=""noopener"" target=""_blank""><strong>ASTRONAUT TELLS CNN 'ENTIRE' TRUMP ADMINISTRATION DESERVES CREDIT FOR ARTEMIS MISSION SUCCESS</strong></a></p><p>NASA provides the anchor mission and strategic architecture. The broader design relies on commercial firms and friendly nations, and SpaceX and Blue Origin are central to the landing architecture.</p><p>In the first space race, Apollo demonstrated to the world that America could outbuild, outthink and outlast its authoritarian rival. It also accelerated key technologies — microelectronics, computing, materials science, telecommunications, precision manufacturing, propulsion and guidance systems — strengthened our defense industrial base and renewed confidence in the nation’s capacity to build and win.</p><p>In this second contest, Artemis is teaching us something essential about the nature of deep space exploration. Human beings still matter.</p><p><a href=""https://www.foxnews.com/us/artemis-ii-launches-astronauts-around-moon-first-deep-space-mission-since-apollo"" rel=""noopener"" target=""_blank""><strong>ARTEMIS II LAUNCHES ASTRONAUTS AROUND THE MOON IN FIRST DEEP SPACE MISSION SINCE APOLLO</strong></a></p><p>NASA did not send four passengers around the moon. It sent trained observers — the eyes of our lunar scientists on Earth. During the <a href=""https://www.foxnews.com/politics/artemis-ii-astronaut-tells-trump-communication-blackout-like-said-little-prayer"" rel=""noopener"" target=""_blank"">far-side flyby, the crew</a> photographed and described impact craters, ancient lava flows, cracks and ridges and subtle differences in color, brightness and texture that help scientists read the moon’s geologic history.</p><p>Artemis II proved something larger than engineering as well. It reminded the world that America can still do difficult things in full public view. Fox’s own coverage gravitated to the defining images of the mission — <a href=""https://www.foxnews.com/us/first-ever-photo-earth-moons-far-side-unveiled-artemis-ii-begins-journey-home-trump-weighs"" rel=""noopener"" target=""_blank"">Earthset, the far-side blackout</a> and Trump’s call hailing the crew as ""modern-day pioneers.""</p><p>Artemis is not just exploration. It is strategic theater, alliance management and rule-setting in real time. In that sense, it is Trumpian.</p><p><a href=""https://www.foxnews.com/opinion"" rel=""noopener"" target=""_blank""><strong>CLICK HERE FOR MORE FOX NEWS OPINION</strong></a></p><p>The mission also underscored a harder truth: <a href=""https://www.foxnews.com/category/science/air-and-space/spaceflight"" rel=""noopener"" target=""_blank"">serious space programs</a> are built on mastery of the unglamorous. Coverage lingered on the <a href=""https://www.foxnews.com/science/artemis-astronauts-brace-eerie-40-minute-communication-blackout-moons-far-side"" rel=""noopener"" target=""_blank"">blackout behind the moon</a>. But a permanent lunar presence will depend less on spectacle than on whether America can master sanitation, stowage, cabin atmosphere, suit operations, radiation sheltering, emergency procedures, precise communications, reentry and recovery.</p><p>Great powers do not stay on the moon by getting the photo. They stay there by making the plumbing, the procedures and the ride home work.</p><p>What’s next? Bank the data, incorporate the lessons of the flight and move fast. Fly Artemis III in 2027 as the Earth-orbit systems test for the commercial landers and the new lunar suits. Then use Artemis IV in 2028 to put Americans back on the lunar surface. After that, keep a real cadence — at least one surface mission every year and eventually faster if the architecture holds and reusable commercial hardware matures as planned.</p><p><a href=""https://www.foxnews.com/category/us/washington-dc"" rel=""noopener"" target=""_blank"">What Washington must supply</a> is speed, money and resolve. Because if America treats Artemis like just another program to be managed, we may yet live to see a red moon rising. </p><p>Peter Navarro is co-author with Greg Autry of ""<strong><u>Red Moon Rising</u></strong><strong>.""</strong></p><p><a href=""https://www.foxnews.com/person/n/peter-navarro"" rel=""noopener"" target=""_blank""><strong>CLICK HERE TO READ MORE FROM PETER NAVARRO</strong></a></p>",https://www.foxnews.com/opinion/peter-navarro-trumps-artemis-vision-flying-china-paying-attention,2026-04-10
2,Sen Tim Sheehy makes emergency landing after in-flight engine failure,"<p><a href=""https://www.foxnews.com/category/us/us-regions/west/montana"" rel=""noopener"" target=""_blank"">Sen. Tim Sheehy, R-Mont.</a>, was forced to make an emergency landing Friday after experiencing in-flight engine failure while piloting a plane.</p><p>According to Sheehy’s chief of staff, Mike Berg, the senator was conducting a routine flight training exercise that he completes twice a year.</p><p>""This afternoon, Sen. Sheehy was engaged in a routine flight training exercise which he completes twice a year,"" Berg said in a statement. ""The aircraft experienced a mechanical engine failure.""</p><p>Berg said Sheehy and his co-pilot made an emergency landing in a field.</p><p><a href=""https://www.foxnews.com/us/emergency-landing-ends-tragedy-plane-crashes-new-mexico-golf-course"" rel=""noopener"" target=""_blank""><strong>EMERGENCY LANDING ENDS IN TRAGEDY AS PLANE CRASHES ON NEW MEXICO GOLF COURSE</strong></a></p><p><a href=""https://www.foxnews.com/category/travel/general/travel-safety"" rel=""noopener"" target=""_blank"">""Neither pilot was injured</a>,"" he added.</p><p><a href=""https://www.foxnews.com/travel/plane-door-opens-midair-moments-takeoff-flight-passengers-stunned-social-media-buzzing"" rel=""noopener"" target=""_blank""><strong>PLANE DOOR OPENS IN MIDAIR MOMENTS AFTER TAKEOFF, LEAVING FLIGHT PASSENGERS STUNNED AND SOCIAL MEDIA BUZZING</strong></a></p><p>The plane landed in a field in Ennis, Montana, according to KBZK.</p><p>The outlet reported that Sheehy is an <a href=""https://www.foxnews.com/category/science/air-and-space"" rel=""noopener"" target=""_blank"">FAA-certified commercial pilot</a> and certified flight instructor.</p><p>Reached for comment, Sheehy’s office referred Fox News Digital to Berg’s statement.</p><p><i>This is a developing story. Please check back for updates.</i></p>",https://www.foxnews.com/politics/sen-tim-sheehy-makes-emergency-landing-in-flight-engine-failure,2026-04-10
3,"Pelosi, California Dems slam Swalwell over bombshell sexual assault allegations: 'Indefensible'","<p>California Democrats, including former House Speaker Nancy Pelosi, D-Calif., and Sen. Adam Schiff, D-Calif., have come out against Democratic gubernatorial candidate Eric Swalwell after multiple bombshell reports were published Friday accusing Swalwell of sexually assaulting a former female staffer and allegedly sexually harassing other female staffers.</p><p>Amid repeated denials and cease and desist letters sent by Swalwell's lawyer Thursday, one of the alleged victims shared her story publicly for the first time, accusing Swalwell of taking advantage of her while she was intoxicated. </p><p>The alleged victim's story also included claims Swalwell pressured her to send naked pictures of herself and sent sexually explicit photos of his own, pulled out his private parts while driving in a car with her and requested she perform oral sex on him. </p><p>She said these and other incidents affected how Swalwell treated her professionally.</p><p><a href=""https://www.foxnews.com/politics/swalwells-former-female-staffer-drops-bombshell-allegations-sexual-assault-exposing-himself-report"" rel=""noopener"" target=""_blank""><strong>SWALWELL'S FORMER FEMALE STAFFER DROPS BOMBSHELL ALLEGATIONS OF SEXUAL ASSAULT, EXPOSING HIMSELF: REPORT</strong></a></p><p>On multiple occasions, the young staffer recalls blacking out from alcohol consumption, before waking up naked in Swalwell's hotel bed with signs she had engaged in intercourse. Swalwell allegedly distanced himself after the incident. Their relationship faded before they reunited when she no longer worked for him, and another incident allegedly took place. </p><p>After the <a href=""https://www.foxnews.com/politics/swalwells-former-female-staffer-drops-bombshell-allegations-sexual-assault-exposing-himself-report"" rel=""noopener"" target=""_blank""><u>bombshell report</u></a> from the San Francisco Chronicle surfaced Friday, Swalwell's campaign website displayed an error page for endorsements, and a slew of Democrats withdrew their endorsements and called for Swalwell to drop out of the race for governor. </p><p>""The young woman who has made serious allegations against Congressman Swalwell must be respected and heard,"" Pelosi told media outlets. ""As I discussed with Swalwell, it is clear that is best done outside of a gubernatorial campaign.""</p><p>""I have read the San Francisco Chronicle’s account, and I am deeply distressed by its allegations,"" added Schiff. ""This woman was brave to come forward, and we should take her story seriously. I am withdrawing my endorsement immediately and believe that he should withdraw from the race.""</p><p><a href=""https://www.foxnews.com/politics/swalwells-campaign-sets-off-alarm-bells-accepting-25k-donation-from-ccp-tied-lawyer"" rel=""noopener"" target=""_blank""><strong><u>ERIC SWALWELL CAMPAIGN SETS OFF ALARM BELLS AFTER ACCEPTING $25K DONATION FROM CCP-TIED LAWYER: ‘OUTRAGEOUS’</u></strong></a> </p><p>""To the survivor who risked everything to come forward – I believe you. To the <a href=""https://www.foxnews.com/category/us/democratic-party"" rel=""noopener"" target=""_blank"">Democratic Party</a> – you’d better hold him accountable,"" Matt Mahan, a former San Jose mayor and fellow Democrat gubernatorial candidate in California said Friday. </p><p>""If we don’t, we have no credibility asking anyone else to do the same. To Eric Swalwell – drop out.""</p><p>""The allegations against Congressmember Swalwell are deeply disturbing,"" California Democratic Party Chairman Rusty Hicks said in a statement. ""First, the stories of victims and survivors should be heard and believed. Period. </p><p>""Second, any person engaged in misconduct must take responsibility and be held accountable for their actions – including a member of Congress and candidate for Governor. Finally, my call for all — repeat, all — candidates for Governor to ‘honestly assess the viability of their candidacy and campaign’ still stands. In fact, that call is more important now than ever before."" </p><p>""The allegations are incredibly disturbing and unacceptable against Rep. Swalwell,"" the California Teachers Association said on X. ""We are immediately suspending our support. Our elected board will be meeting as soon as possible to follow our union’s democratic process to determine next steps.""</p><p>Sen. Ruben Gallego, D-Ariz., a longtime friend and former campaign chair for Swalwell's failed presidential campaign, is now backing away from his initial support for Swalwell amid the sexual misconduct allegations he is facing as the California congressman runs for governor.</p><p>Earlier this week, Gallego faced blowback for attempting to discredit a user on X who said sexual misconduct allegations against Swalwell will end up ""kick[ing] his a--."" Gallego also defended Swalwell for being ""targeted"" in a separate post on social media, arguing he is the subject of sexual misconduct allegations because he is ""in first place.""</p><p>However, after the report released by the San Francisco Chronicle, Gallego changed his tune dramatically.  </p><p><a href=""https://www.foxnews.com/politics/swalwell-threatens-fbi-legal-action-patel-reportedly-weighs-fang-fang-files-release"" rel=""noopener"" target=""_blank""><strong><u>SWALWELL THREATENS FBI WITH LEGAL ACTION AS PATEL REPORTEDLY WEIGHS 'FANG FANG' FILES RELEASE</u></strong></a></p><p>""I’ve read the San Francisco Chronicle’s reporting and I take it seriously. What is described is indefensible,"" Gallego posted on social media Friday after the report. ""Women who come forward with accounts like this deserve to be heard with respect, not questioned or dismissed. I regret having come to his defense on social media prior to knowing all the information. I am equally as shocked and upset about what has transpired.""</p><p>Swalwell has <a href=""https://www.foxnews.com/politics/swalwell-campaign-rejects-outrageous-allegations-sexual-misconduct-dem-activists-issue-viral-warning"" rel=""noopener"" target=""_blank""><u>fiercely denied the allegations</u></a> that were first being elevated on social media by Democratically-aligned politicos, including Cheyenne Hunt<a href=""https://www.foxnews.com/politics/swalwell-campaign-rejects-outrageous-allegations-sexual-misconduct-dem-activists-issue-viral-warning"" rel=""noopener"" target=""_blank""><u>,</u></a> a former Capitol Hill staffer who is a nonprofit director at the group Gen-Z for Change, and Arielle Fodor, a ""political content creator,"" teacher and mother who refers to herself ""Mrs. Frazzled"" online. On Friday, the first first-hand account of these allegations surfaced. </p><p>Neither Swalwell nor his attorney responded to Fox News Digital's inquiries about the first-hand allegations of sexual misconduct against him. </p><p>Following the San Francisco Chronicle's report Friday, <a href=""https://www.cnn.com/2026/04/10/us/eric-swalwell-sexual-misconduct-allegations-invs"" rel=""nofollow noopener"" target=""_blank"">CNN</a> published a separate report indicating three other women it had spoken to also alleged various kinds of sexual misconduct by the Democratic congressman, including Swalwell sending them unsolicited explicit messages or nude photos.   </p>",https://www.foxnews.com/politics/pelosi-california-dems-slam-swalwell-bombshell-sexual-assault-allegations-indefensible,2026-04-10
