,title,text,link,publish_date
3,Fox News Poll: Sour voters say Washington is out of touch,"<p>Voters are not only dissatisfied with the direction of the country but also pessimistic about the economic outlook, financially strained in their own lives and unconvinced Washington leaders are in touch or will offer solutions. </p><p>That’s according to a new Fox News national survey released Thursday. </p><p>Nearly two-thirds, 64%, are dissatisfied with how things are going in the U.S. </p><p>While that’s the highest dissatisfaction rating of <a href=""https://www.foxnews.com/category/person/donald-trump"" rel=""noopener"" target=""_blank"">President Trump’s</a> second term, it’s also a small improvement from the 68% who were unhappy at the end of the Biden administration in December 2024.</p><p><a href=""https://www.foxnews.com/politics/fox-news-poll-voters-oppose-action-iran-give-u-s-military-positive-marks"" rel=""noopener"" target=""_blank""><strong>FOX NEWS POLL: VOTERS OPPOSE ACTION IN IRAN BUT GIVE US MILITARY POSITIVE MARKS</strong></a> </p><p>At the same time, majorities say national leaders are out of touch with people like them. Six in 10 voters say the White House is out of touch (60%), and similar shares say the same about congressional Republicans (61%) and congressional Democrats (58%). </p><p>A quarter of both Democrats and Republicans think their respective party’s lawmakers are out of touch. Half of non-MAGA Republicans say the White House is out of touch.</p><p><a href=""https://www.foxnews.com/politics/fox-news-poll-voters-expect-ai-transform-our-lives-today-not-day"" rel=""noopener"" target=""_blank""><strong>FOX NEWS POLL: VOTERS EXPECT AI TO TRANSFORM OUR LIVES — BUT TODAY IS NOT THAT DAY</strong></a></p><p>Trump receives negative marks across issues. His worst numbers are on inflation, with a new low of 28% approving. That’s down 7 points since January and 12 points since March 2025.</p><p>His 34% approval for the economy is another new low, down 6 points since January and 9 points from a year ago. Other ratings are also well underwater: healthcare (36 approve, 64 disapprove), <a href=""https://www.foxnews.com/category/politics/defense/wars/war-with-iran"" rel=""noopener"" target=""_blank"">Iran</a> (36-64), taxes (36-64), foreign policy (38-62), and immigration (44-56). His best issue is border security (50-50), where equal numbers approve and disapprove.</p><p>The president’s overall job rating stands at 41% approve and 59% disapprove. Former President Obama had similar ratings at a comparable point in his second term, 40%-53% in March 2014.</p><p>Trump’s 59% disapproval is the highest of either term. Last month, 43% approved and 57% disapproved. A year ago, views were nearly evenly divided, 49-51%.</p><p>Current approval of Trump among Republicans is 84%, a second-term low (down from 92% last March), while disapproval has reached a high of 16%. Approval among non-MAGA Republicans dropped 11 points over the past year (70% to 59%). MAGA Republicans remain nearly unanimous with 97% approval, little changed from 98% a year ago. Fully 95% of Democrats disapprove, tying a record high this term. Independents are also negative, 75% disapprove.</p><p>The <a href=""https://www.foxnews.com/category/us/economy"" rel=""noopener"" target=""_blank"">economy</a> remains central to dissatisfaction. Large numbers of Democrats (91%) and independents (90%) rate it negatively, as do more than half of Republicans (52%).</p><p>Overall, 75% of voters say the economy is in bad shape, up 4 points since last month (71%). The number giving the economy negative marks has ranged from 67% to 79% since Trump took office in January 2025.</p><p>Personal financial assessments are similarly downbeat, with nearly half, 46%, saying they are falling behind. That’s up from 44% in December and just one point below the record high of 47% in June 2022.</p><p>That strain is reflected by 61% saying they could not miss more than two paychecks and still pay their bills. That’s up from 54% in both 2023 and 2019.</p><p>Two years ago, 17% lived paycheck-to-paycheck. Now, 27% say they couldn’t miss even one payday. That number climbs to 37% for those with annual household income below $50,000.</p><p>Neither major party has convinced voters it has a clear plan to address costs. Some 68% say the Democratic Party lacks a clear plan for bringing prices down, while 70% say the same about the GOP. More than 4 in 10 say neither party has a plan. Equal numbers of Democrats and Republicans, 59%, say their respective party has a clear plan.</p><p>""The issue environment in 2026 has almost completely flipped from 2022 and 2024,"" says Daron Shaw, a Republican who conducts the survey with Democrat Chris Anderson. ""Voters don’t think either side has a plan, of course, but since the GOP is in charge, they shoulder the blame.""</p><p>To top things off, voters don’t see the economy getting better anytime soon. A 53% majority anticipates economic conditions will worsen in the next year, up from 45% in January and more than double the share who see improvement (25%).</p><p>Republicans are alone in their optimism, expecting the economy to improve by a 19-point margin. Both independents (by 44 points) and Democrats (by 68 points) see the economy declining next year by wide margins. </p><p>Concerns about the economy — day-to-day costs in particular — top the list of what worries voters most. A large majority of 86% is concerned about inflation and high prices, including 57% who are extremely concerned. Around 8 in 10 express concerns about <a href=""https://www.foxnews.com/category/health/health-care"" rel=""noopener"" target=""_blank"">healthcare</a> (81%), gas prices (80%), and political divisions in the country (80%).</p><p>Seven in ten or more are worried about unemployment (73%), potential attacks in the United States (73% by Islamic terrorists and 70% non-Islamic terrorists) and their ability to pay their bills (70%). Concern also extends to gun violence (69%), Iran obtaining nukes (66%), AI technology (66%), antisemitism (63%) and detentions and deportations by ICE (62%).</p><p>Inflation is the top concern for Democrats, Republicans and independents. Healthcare is second for Democrats and independents, while Islamic terrorist attacks are second for Republicans. There is a consensus that political divisions within the country are a problem, with most Democrats (85%), Republicans (80%), and independents (70%) expressing concern.  </p><p>Worry about gas prices is widespread, with about 8 in 10 across all income levels — including $100,000 and above — saying they are concerned.</p><p>CLICK HERE FOR <a href=""https://static.foxnews.com/foxnews.com/content/uploads/2026/03/fox_march-20-23-2026_national_cross-tabs_march-26-release.pdf"" rel=""noopener"" target=""_blank""><strong>CROSSTABS</strong></a> AND<strong> </strong><a href=""https://static.foxnews.com/foxnews.com/content/uploads/2026/03/fox_march-20-23-2026_national_topline_march-26-release.pdf"" rel=""noopener"" target=""_blank""><strong>TOPLINE</strong></a></p><p><strong>Poll-pourri</strong></p><p>Sixty-nine percent of voters support birthright citizenship for children born in the United States to illegal immigrants. That’s up from 67% in 2025 and from 45% when Fox News first asked the question in 2006. Current support stands at 91% among <a href=""https://www.foxnews.com/category/us/democratic-party"" rel=""noopener"" target=""_blank"">Democrats</a>, 75% among independents and 44% among Republicans. The U.S. Supreme Court will hear a birthright citizenship case April 1.</p><p><i>Conducted March 20-23, 2026, under the direction of Beacon Research (D) and Shaw &amp; Company Research (R), this Fox News survey includes interviews with a sample of 1,001 registered voters randomly selected from a national voter file. Respondents spoke with live interviewers on landlines (104) and cellphones (641) or completed the survey online after receiving a text (256). Results based on the full sample have a margin of sampling error of ±3 percentage points. Sampling error for results among subgroups is higher. In addition to sampling error, question wording and order can influence results. Weights are generally applied to age, race, education and area variables to ensure the demographics are representative of the registered voter population. Sources for developing weight targets include the most recent American Community Survey, Fox News Voter Analysis, and voter file data.</i></p><p><i>Fox News’ Victoria Balara contributed to this report.</i></p>",https://www.foxnews.com/politics/fox-news-poll-sour-voters-say-washington-out-touch,2026-03-26
4,Judge lets ex-police officer walk after she denied pointing gun at fellow cop who shot her in home standoff,"<p><i>This story discusses suicide. If you or someone you know is having thoughts of suicide, please contact the Suicide &amp; Crisis Lifeline at 988 or 1-800-273-TALK (8255).</i></p><p>A former <a href=""https://www.foxnews.com/category/us/us-regions/northeast/massachusetts"" rel=""noopener"" target=""_blank"">Massachusetts police officer</a> has been found not guilty of attempting to shoot a brother in blue after she testified she was trying to kill herself as officers arrived at her home to serve a restraining order filed by her ex-fiancé. </p><p>Kelsey Fitzsimmons, a 29-year-old former North Andover police officer, went to trial after she was charged with a single count of assault with a dangerous weapon after <a href=""https://www.foxnews.com/us/police-officer-shot-colleague-armed-showdown-home-could-have-killed-brothers-blue-prosecutors"" rel=""noopener"" target=""_blank"">prosecutors alleged she pointed</a> a gun at a fellow officer, Patrick Noonan, and attempted to fire it on June 25, 2025. </p><p>However, Fitzsimmons vehemently denied the allegations, instead insisting she was attempting to kill herself when officers arrived at her home to serve a restraining order obtained by her fiancé, Justin Aylaian, and take custody of her young child. </p><p><a href=""https://www.foxnews.com/us/cop-trial-denies-gunning-fellow-officer-clash-home-prosecutors-argue-lethal-risk-real"" rel=""noopener"" target=""_blank""><strong>COP ON TRIAL DENIES GUNNING FOR FELLOW OFFICER IN CLASH AT HOME; PROSECUTORS ARGUE LETHAL RISK WAS REAL</strong></a></p><p>""I didn't want to involve anybody. I wanted to take my own life,"" she said earlier this week. ""I never pointed the gun at a fellow police officer. It never happened.""</p><p>The verdict was handed down by Judge Jeffrey Karp after nearly four hours of deliberations on Thursday, <a href=""https://www.wcvb.com/article/kelsey-fitzsimmons-trial-north-andover-verdict/70855824"" rel=""nofollow noopener"" target=""_blank""><u>according to</u></a> WCVB. </p><p><a href=""https://www.foxnews.com/us/police-officer-shot-colleague-armed-showdown-home-could-have-killed-brothers-blue-prosecutors"" rel=""noopener"" target=""_blank""><strong><u>POLICE OFFICER SHOT BY COLLEAGUE IN ARMED SHOWDOWN AT HOME COULD HAVE KILLED BROTHERS IN BLUE: PROSECUTORS</u></strong></a></p><p>Karp decided <a href=""https://www.foxnews.com/category/us/crime/trials"" rel=""noopener"" target=""_blank"">the case</a> because Fitzsimmons reportedly waived her right to a trial by jury. </p><p>""I think that Ms. Fitzsimmons, Officer Noonan and all the people involved in the tragic events of June 30, 2025, deserve an explanation,"" Karp said before delivering his decision, according to WCVB.</p><p>""I am left with a reasonable doubt, and I am duty-bound to find that the Commonwealth has not met its burden to prove that Ms. Fitzsimmons committed an assault by means of a dangerous weapon,"" he said. ""My verdict is, and must be, not guilty.""</p><p>Karp added he found no evidence Fitzsimmons had been the victim of a conspiracy. </p><p><a href=""https://www.foxnews.com/us/family-slain-chicago-officer-sues-city-says-department-ignored-warnings-about-dangerous-partner"" rel=""noopener"" target=""_blank""><strong>FAMILY OF SLAIN CHICAGO OFFICER SUES CITY, SAYS DEPARTMENT IGNORED WARNINGS ABOUT DANGEROUS PARTNER</strong></a></p><p>""I saw no evidence of a conspiracy in this case. What I saw was dedicated public servants, like Officer Noonan and his <a href=""https://www.foxnews.com/category/us/crime/police-and-law-enforcement"" rel=""noopener"" target=""_blank"">fellow officers</a>, doing the best they could under rapidly evolving, emotional circumstances,"" Karp said.</p><p>Fitzsimmons was shot by Noonan after allegedly pointing a gun at him and was later arrested and arraigned on one count of armed assault with intent to murder and two counts of assault with a dangerous weapon.</p><p><a href=""https://www.foxnews.com/tips"" rel=""noopener"" target=""_blank""><strong>GOT A TIP?</strong></a></p><p>She was indicted in Essex Superior Court, but a grand jury ultimately chose to maintain just one count of assault with a dangerous weapon. </p><p>Upon taking the stand Wednesday, <a href=""https://www.foxnews.com/us/ex-cop-trial-denies-gunning-fellow-officer-clash-home-prosecutors-argue-lethal-risk-real"" rel=""noopener"" target=""_blank"">Fitzsimmons recalled the moment</a> she was shot by Noonan.</p><p><a href=""https://x.com/FoxUSNews"" rel=""noopener"" target=""_blank""><strong>FOLLOW US ON X</strong></a></p><p>""I went into like a huge adrenaline shock. It didn't feel like normal pain. It almost felt like absent pain, but it felt like my entire body was burning, and I was completely alert, completely awake the whole time,"" Fitzsimmons said.</p><p>""I was speaking as much as I could. My lung was punctured, so that's why I was having trouble breathing, but other than that, I was <a href=""https://www.foxnews.com/category/health/mental-health"" rel=""noopener"" target=""_blank"">very alert and aware</a> of my surroundings.""</p><p><a href=""https://www.foxnews.com/newsletters"" rel=""noopener"" target=""_blank""><strong>GET BREAKING NEWS BY EMAIL</strong></a></p><p>Immediately after the shooting, Fitzsimmons reportedly said the fire department and additional resources transported her from her home to a hospital, where she repeatedly told them she ""wanted to die"" after authorities arrived to serve the restraining order and take custody of her 4-month-old child. </p><p>""They brought me outside, and I think when I was still in my house, one of the firefighters was trying to put oxygen on my face, and I was taking it off and just saying, 'I want to die, I want to die, I want to die.'""</p><p><a href=""https://www.foxnews.com/us"" rel=""noopener"" target=""_blank""><strong>CLICK HERE FOR MORE US NEWS</strong></a></p><p>In closing statements, defense attorney Tim Bradl pointed to the possibility that Noonan made the decision to shoot Fitzsimmons too quickly, according to the outlet. </p><p>""He's the only one with the Rambo story,"" Bradl said. ""Everyone else has what Kelsey says. He walks into a suicide in progress. He sees it. He reacts. 'Kelsey no, Kelsey no.' Bam. Bam. Brain freeze. Mistake. He has to cover it up.""</p><p>However, prosecuting attorney James Gubitose reportedly held up Fitzsimmons' empty gun during his closing, insisting that evidence contradicted Fitzsimmons' testimony while praising Noonan’s police training. </p><p>""It's impossible to have happened the way she said it,"" Gubitose said. ""It is scientifically, mechanically impossible for it to happen the way she said.""</p><p>In a statement to Fox News Digital, the Essex County District Attorney's Office added that the indictment ""was brought in good faith, supported by credible police testimony and corroborated by the physical evidence,"" and ""while respecting the judge's verdict, we disagree."" </p><p>""We also commend the professionalism and civility of prosecutors involved in this highly public and emotionally charged case as well as this being an instance of police officers acting to the best of their ability during a tragic and rapidly evolving incident. The work of police officers, particularly in cases involving restraining orders, is extremely dangerous, and I recognize their dedication, courage and willingness to serve.""</p><p>Fitzsimmons' attorney did not immediately respond to Fox News Digital's request for comment. </p><p><i>Fox News Digital's Sarah Rumpf-Whitten contributed to this report. </i></p>",https://www.foxnews.com/us/judge-lets-ex-police-officer-walk-after-she-denied-pointing-gun-fellow-cop-who-shot-her-home-standoff,2026-03-26
5,Fox News ‘Antisemitism Exposed’ Newsletter: Harvard 'indifferent to hostility' toward Jewish students: lawsuit,"<p><i><strong>Fox News' ""Antisemitism Exposed"" newsletter brings you stories on the rising anti-Jewish prejudice across the U.S. and the world.</strong></i></p><p><strong>IN TODAY’S NEWSLETTER:</strong><br />- Trump administration sues Harvard over alleged failure to protect Jewish and Israeli students<br />- Rams star Puka Nacua accused of biting woman, making antisemitic remark<br />- UC Berkeley to pay $1M, overhaul policies after antisemitism lawsuit settlement</p><p><strong>TOP STORY:</strong> The Trump administration has filed a massive <a href=""https://www.foxnews.com/politics/trump-administration-sues-harvard-over-alleged-failure-protect-jewish-israeli-students-seeks-billions"" rel=""noopener"" target=""_blank""><strong>44-page lawsuit against Harvard</strong></a>, seeking to claw back billions in federal funding. The DOJ alleges the university enabled a culture of antisemitism and failed to protect Jewish students following the October 7 attacks. Officials call it a crackdown on ""deliberate indifference,"" while Harvard blasts the move as a pretext for federal control.</p><p><a href=""https://www.foxnews.com/video/6360723922112"" rel=""noopener"" target=""_blank""><strong>VIDEO:</strong></a><strong> </strong>Israeli Ambassador to the U.N. Danny Danon discusses the Michigan synagogue attack, Israel’s targeted strikes in Lebanon and more on ‘Fox News Live.’ <a href=""https://www.foxbusiness.com/media/linda-mcmahon-secures-monumental-victory-against-columbia-university-antisemitism-crackdown"" rel=""noopener"" target=""_blank""><strong>WATCH HERE</strong></a>:</p><p><strong>RED ZONE:</strong> Los Angeles Rams star receiver Puka Nacua is facing a <a href=""https://www.foxnews.com/sports/rams-star-puka-nacua-accused-biting-woman-making-antisemitic-remarks-report"" rel=""noopener"" target=""_blank""><strong>civil lawsuit for assault, battery, and gender violence</strong></a> following a New Year's Eve incident in Century City. The plaintiff, Madison Atiabi, alleges the Pro Bowler shouted, ""f*** all the Jews,"" before ""forcibly"" biting her shoulder and her friend's thumb during a van ride. Nacua’s attorney has blasted the claims as a ""shakedown"" and ""blackmail,"" characterizing the biting as mutual ""horseplay"" and citing video of the group partying later that night as evidence of a ""blatant lie.""</p><p><strong>PRICE OF HATE: </strong>UC Berkeley has agreed to a <a href=""https://www.foxnews.com/media/uc-berkeley-pay-1m-overhaul-policies-after-antisemitism-lawsuit-settlement"" rel=""noopener"" target=""_blank""><strong>$1 million settlement</strong></a> and a sweeping policy overhaul to resolve a landmark antisemitism lawsuit. The university will adopt the International Holocaust Remembrance Alliance definition of antisemitism and ban discrimination against Jewish and Israeli students. The Brandeis Center hailed the deal as a ""major milestone"" against campus bigotry previously masked as political activism.</p><p><strong>AMBULANCES ABLAZE:</strong> UK counterterrorism police are hunting three suspects after an <a href=""https://www.foxnews.com/world/uk-counterterrorism-police-probe-antisemitic-arson-attack-iran-linked-group-claims-responsibility"" rel=""noopener"" target=""_blank""><strong>antisemitic arson attack</strong></a> gutted four Jewish community ambulances in London. An Iran-linked group, Harakat Ashab al-Yamin, reportedly claimed responsibility for the ""sickening"" strike. Experts warn the incident marks a dangerous escalation of Tehran-backed terror on British soil, fueled by years of government failure to ban the IRGC.</p><p><strong>GUEST EDITORIAL: </strong>Zoya Fakhoury is the co-founder and executive director of the Amer Foundation, highlights how the unlawful 2019 detention of her father, Amer Fakhoury, by Hezbollah exposed the terror group's <a href=""https://www.foxnews.com/opinion/one-americans-detention-lebanon-exposed-truth-now-devastating-entire-country"" rel=""noopener"" target=""_blank""><strong>total subversion of Lebanese sovereignty</strong></a>. She argues that the same Iranian-backed forces that kidnapped an American are now dragging a victimized Lebanese population into a catastrophic war with Israel.</p><p><strong>QUOTE OF THE WEEK:</strong> ""Harvard University has failed to protect its Jewish students from harassment and has allowed discrimination to wreak havoc on its campus."" - White House spokesperson.</p><p><i>- Looking for more on this topic? </i>Find more <strong>antisemitism coverage </strong>from Fox News <a href=""https://www.foxnews.com/category/topic/anti-semitism"" rel=""noopener"" target=""_blank"">here</a>.</p><p>- <i>Did someone forward you this email? </i>Subscribe to<strong> additional newsletters</strong> from Fox News <a href=""https://www.foxnews.com/newsletters"" rel=""noopener"" target=""_blank"">here</a>.</p>",https://www.foxnews.com/us/fox-news-antisemitism-exposed-newsletter-harvard-indifferent-hostility-toward-jewish-students-lawsuit,2026-03-26
6,Department of Education to leave building after 40 years as part of effort to eliminate government agency,"<p><strong>FIRST ON FOX</strong> - The Department of Education (ED) announced Thursday it will move to a smaller building to reduce the agency's footprint as part of its broader <a href=""https://www.foxnews.com/media/department-education-under-trump-just-took-big-step-closer-shutting-down-expert-says"" rel=""noopener"" target=""_blank"">effort to dismantle itself.</a></p><p>Department staff will move out of the Lyndon B. Johnson headquarters building so the Department of Energy can eventually move in by August. </p><p>The move is what the officials call ""a prudent step to save hundreds of millions of taxpayer dollars and further reduce the federal education bureaucracy.""</p><p>The ED said its relocation will save taxpayers approximately $4.8 million annually in operating costs and eliminate wasted space in a building that is about 70% vacant. </p><p><a href=""https://www.foxnews.com/media/trump-admin-cuts-red-tape-iowa-joins-effort-return-education-states"" rel=""noopener"" target=""_blank""><strong><u>TRUMP ADMIN CUTS RED TAPE AS IOWA JOINS EFFORT TO RETURN EDUCATION TO STATES</u></strong></a></p><p>""One year ago, President Trump signed one of the most consequential executive orders of his presidency to break up the federal education bureaucracy and return education to the states,"" Education Secretary Linda McMahon said. </p><p>The Trump <a href=""https://www.foxnews.com/category/us/education/administration"" rel=""noopener"" target=""_blank"">administration</a> announced last week an interagency agreement between the ED and the Department of Treasury, with an official calling it the ""largest"" step to shutting the agency down.</p><p>The official previously told Fox News Digital that staff is <a href=""https://www.foxnews.com/media/department-education-under-trump-just-took-big-step-closer-shutting-down-expert-says"" rel=""noopener"" target=""_blank""><u>working to put themselves out of a job</u></a> under President Donald Trump's orders because the agency is not needed.</p><p>This agreement follows nine agency <a href=""https://www.ed.gov/about/news/press-release/us-department-of-education-announces-six-new-agency-partnerships-break-federal-bureaucracy"" rel=""nofollow noopener"" target=""_blank""><u>partnerships</u></a> over the past year as the Department of Education seeks to minimize itself, shifting power from some of its offices and programs to other federal agencies.</p><p><a href=""https://www.foxnews.com/media/mcmahon-says-government-shutdown-proved-schools-dont-need-federal-oversight-all"" rel=""noopener"" target=""_blank""><strong>MCMAHON SAYS GOVERNMENT SHUTDOWN PROVED SCHOOLS DON'T NEED FEDERAL OVERSIGHT AT ALL</strong></a></p><p>While Congress holds the key to shutting the operation down for good, McMahon plans to show legislators that the interagency agreements are ""proof of concept"" that the ED is not needed for federal grant aid and federal student loans to continue flowing to borrowers.</p><p>Throughout the 2024 campaign, candidate Trump promised to eliminate the Department of Education and signed an executive order directing his administration to <a href=""https://www.foxnews.com/politics/trump-sign-executive-order-abolish-department-education"" rel=""noopener"" target=""_blank""><u>start disbanding it</u></a>. </p><p><a href=""https://www.foxnews.com/media/mcmahon-recounts-story-reassuring-parent-special-needs-funding-continue-department-shrinks"" rel=""noopener"" target=""_blank""><strong><u>MCMAHON RECOUNTS STORY OF REASSURING PARENT OF SPECIAL NEEDS THAT FUNDING WILL CONTINUE AS DEPARTMENT SHRINKS</u></strong></a></p>",https://www.foxnews.com/media/department-education-leave-building-after-40-years-part-effort-eliminate-government-agency,2026-03-26
