,title,text,link,publish_date
0,Spanish government's Jimmy Gracey autopsy claims stump forensic expert: 'problem for me',"<p>A forensic scientist with decades of experience in his craft remains skeptical about pronouncements from the <a href=""https://www.foxnews.com/category/world/world-regions/spain"" rel=""noopener"" target=""_blank"">Spanish government</a> regarding the death of American college student James ""Jimmy"" Gracey.</p><p>""So you've got a young man that leaves a bar in the middle of the night, or certainly after midnight,"" Joseph Scott Morgan, associate professor of applied forensics at <a href=""https://www.jsu.edu/criminaljustice/index.html"" rel=""noopener nofollow"" target=""_blank"">Jacksonville State University,</a> told Fox News Digital. </p><p>""He's allegedly seen leaving with someone initially, and now we're not really clear about that.<i> </i>He's adjacent to a very, let's just say, slippery area with rocks jetting out into the water. Did he fall off of the rocks? Well, I guess that's certainly plausible.""</p><p>Gracey, a 20-year-old junior at the University of Alabama, vanished in the early morning hours of March 17 after clubbing with friends at a popular tourist bar in Barcelona. His body was found two days later close to a nearby pier.</p><p>Almost immediately, Spanish authorities told the press that Gracey's death was accidental and that he wandered toward the water while under the influence of drugs or alcohol. They said his <a href=""https://www.foxnews.com/us/jimmy-gracey-wallet-found-intact-drugging-not-ruled-out-death-alabama-student-barcelona"" rel=""noopener"" target=""_blank"">wallet was recovered intact</a>, with cash, credit cards and identification all inside.</p><p>A chain necklace worn by Gracey remains unaccounted for. </p><p><a href=""https://www.foxnews.com/us/university-alabama-student-james-gracey-disappears-barcelona-after-visiting-friends-studying-abroad"" rel=""noopener"" target=""_blank""><strong>UNIVERSITY OF ALABAMA STUDENT JAMES GRACEY DISAPPEARS IN BARCELONA AFTER VISITING FRIENDS STUDYING ABROAD</strong></a></p><p>Authorities later said they retrieved Gracey's phone from a suspect in a crime unrelated to Gracey.</p><p>""The Spanish government, or at least their newspaper, is actually saying that he sustained multiple injuries over the course — and they're framing these injuries as bruises — over a number of hours, and scientifically, that's implausible,"" said Morgan. ""You can be insulted [by] bouncing off of rocks in a post-mortem state or deceased, and you get little dings on the body, little injuries, if you will, artifacts, as we refer to them as, off of these sharp rocks, but you're not gonna bruise. That's a problem for me.""</p><p>Morgan argues that all the statements made by authorities were done so too early — especially in the way of toxicology.</p><p><a href=""https://www.foxnews.com/us/police-investigating-alabama-student-jimmy-gracey-death-pursue-no-charges-await-toxicology-autopsy"" rel=""noopener"" target=""_blank""><strong>POLICE INVESTIGATING ALABAMA STUDENT JIMMY GRACEY’S DEATH PURSUE NO CHARGES AS THEY AWAIT TOXICOLOGY, AUTOPSY</strong></a></p><p>""The government, I guess through the newspaper, are making statements relative to their conclusions about his death, and they're missing a big piece of the puzzle here because everybody wants to know, did he have anything <a href=""https://www.foxnews.com/media/alabama-students-death-leads-ex-detective-reveal-how-investigators-probe-possible-drugging-cases"" rel=""noopener"" target=""_blank"">placed in his drink</a>?"" asked Morgan. ""Was he plied with something? Let's say like a <a href=""https://www.foxnews.com/category/health/mental-health/drug-and-substance-abuse"" rel=""noopener"" target=""_blank"">date rape drug</a>, something that would knock down inhibitions and make him certainly more controllable.<i>""</i></p><p>The professor, who began his career with the Jefferson Parish Coroner’s Office in New Orleans in 1985 before becoming the senior investigator with the Fulton County Medical Examiner in Atlanta, thinks the Gracey family should have a <a href=""https://www.foxnews.com/category/health/medical-research"" rel=""noopener"" target=""_blank"">private autopsy</a> completed, though he's not sure whether that's still possible.</p><p><i>""</i>It's my opinion that the family would… they would be well-served by having their own examination of Jimmy's remains at the hands of a board-certified forensic pathologist that they should contract with to do this,"" he said.</p><p><a href=""https://www.foxnews.com/media/mystery-deepens-nancy-grace-questions-accidental-death-alabama-student-barcelona"" rel=""noopener"" target=""_blank""><strong>MYSTERY DEEPENS AS NANCY GRACE QUESTIONS 'ACCIDENTAL' DEATH OF ALABAMA STUDENT IN BARCELONA</strong></a></p><p>But, as confirmed by Fox News Digital, Chief Communication Officer Harles Valles of Mossos d’Esquadra, Catalan’s provincial-level police, said Gracey's body was returned to the United States on Tuesday.</p><p><i>""</i>Now, here's the big problem, is that his body would have been prepared prior to leaving Spain to travel over here, OK? We don't know what organ samples they could still avail themselves of,"" Morgan said. ""The big piece to this is that there's no toxicology you could do here. Those toxicology samples that were drawn in Spain are gonna be key.""</p><p>Ultimately, Morgan worries that Spanish authorities could have jumped to the conclusion of accidental death, given that Barcelona is a major tourist hub. He said he has seen many such cases.</p><p>""Barcelona is a vacation destination,"" he said. ""There are millions of people there right now, and a goodly portion of that population right now are there on holiday. I've got friends in Great Britain that love to go to Spain, they love to go to Barcelona. And so yeah, that's their life's blood.""</p><p>""So yeah, I can see, you know, you don't want to drive off the customer, and the fact that they were trying to defuse it so early, it makes me raise an eyebrow, I've gotta tell you.""</p>",https://www.foxnews.com/us/spanish-governments-jimmy-gracey-autopsy-claims-stump-forensic-expert-problem-me,2026-03-28
1,JONATHAN TURLEY: USC abandons governor debate after Dems whine about White candidates,"<p>The University of Southern California (USC) is under fire after <a href=""https://www.foxnews.com/media/california-university-cancels-gubernatorial-debate-after-backlash-all-white-candidates"" rel=""noopener"" target=""_blank"">canceling the California gubernatorial debate</a> with less than 24 hours' notice. The reason? None of the polling candidates are people of color. It was a crushingly revealing moment in a state where universities have long defied voters who demanded an end to affirmative action in admissions.</p><p>USC Dornsife Center for the Political Future and ABC/KABC Los Angeles were scheduled to co-host the debate at Bovard Auditorium on Tuesday evening. Then it was canceled on Monday.</p><p>Former Biden Health and Human Services Secretary and California Attorney General Xavier Becerra had sent a letter to President Beong-Soo Kim, alleging ""election rigging"" and objecting ""you disqualified all of the candidates of color from participating.""</p><p>For many, USC succeeded in beclowning itself by first defending USC Professor Christian Grose's ""data-driven"" selection process and then abruptly canceling the debate lineup selected through that process. If that seems incomprehensible, welcome to American higher education.</p><p><a href=""https://www.foxnews.com/media/jon-stewart-blasts-california-dems-warning-eight-candidates-may-split-vote-lead-gop-victory"" rel=""noopener"" target=""_blank""><strong>JON STEWART BLASTS CALIFORNIA DEMS, WARNING THEIR EIGHT CANDIDATES MAY SPLIT VOTE, LEAD TO GOP VICTORY</strong></a></p><p>The cancellation is only the latest unexpected turn in the election, where the two top vote-getters will face each other in a runoff election.</p><p>California Democrats are in a panic as two Republicans currently top the polling: Riverside County Sheriff Chad Bianco and commentator Steve Hilton.</p><p>At the same time, the leading Democrats include controversial candidates such as former Rep. Katie Porter and Rep. Eric Swalwell. Porter is <a href=""https://www.foxnews.com/politics/katie-porter-caught-video-screaming-get-out-my-shot-staffer-during-2021-call"" rel=""noopener noreferrer nofollow"" target=""_blank"">best known nationally for spewing profanity</a> and abuse at staff members. Last year, Swalwell was outvoted by Rep. Raul Grijalva, who died in March 2025. However, they are still doing markedly better than Becerra with voters.</p><p><a href=""https://www.foxnews.com/politics/bianco-says-democrat-policy-indefensible-gop-candidates-top-california-governor-polling"" rel=""noopener"" target=""_blank""><strong>BIANCO SAYS ‘DEMOCRAT POLICY IS INDEFENSIBLE’ AS GOP CANDIDATES TOP CALIFORNIA GOVERNOR POLLING</strong></a></p><p>USC insisted that it ""vigorously defends the independence, objectivity, and integrity of USC Professor Christian Grose, whose data-driven candidate viability formula is based on extensive research and enjoys broad academic support.""</p><p>That ""data-driven system"" produced a lineup of Bianco and Hilton as well as Democrats billionaire <a href=""https://www.foxnews.com/category/person/tom-steyer"" rel=""noopener"" target=""_blank"">Tom Steyer</a>, San Jose Mayor Matt Mahan, Porter and Swalwell.</p><p>Advocates then went into full rage, <a href=""https://www.foxnews.com/politics/california-dems-unleashed-pressure-campaign-against-usc-prior-debate-cancellation"" rel=""noopener"" target=""_blank"">calling the process racist</a> and rigged. Becerra declared:</p><p><a href=""https://www.foxnews.com/sports/chad-bianco-reveals-his-california-sports-vision-saving-la-olympics-trans-athlete-crisis-consequences"" rel=""noopener"" target=""_blank""><strong>CHAD BIANCO REVEALS HIS CALIFORNIA SPORTS VISION: SAVING THE LA OLYMPICS AND TRANS ATHLETE CRISIS CONSEQUENCES</strong></a></p><p>""USC goes to great lengths to justify its exclusionary candidate formula. But you can’t escape the detestable outcome: you disqualified all of the candidates of color from participating while you invited a white candidate who has NEVER polled higher than some of the candidates of color, including me.""</p><p>However, the methodology considered both polling percentage and fundraising with the polling given greater weight.</p><p>Becerra has been shown at 3%, notably within the statistical margin of error for most polls. In other words, he could be closer to zero. (He is shown as tied with Mahan, who Becerra appears to be referencing in his letter as lacking higher polling).</p><p><a href=""https://www.foxnews.com/politics/california-dems-lash-out-ice-during-gubernatorial-debate"" rel=""noopener"" target=""_blank""><strong>CALIFORNIA DEMS LASH OUT AT ICE DURING GUBERNATORIAL DEBATE</strong></a></p><p>USC then yielded after trying to expand the number of participants to appease objectors. In a statement, USC stated:</p><p>""We recognize that concerns about the <a href=""https://www.foxnews.com/category/controversies"" rel=""noopener"" target=""_blank"">selection criteria</a> for tomorrow’s gubernatorial debate have created a significant distraction from the issues that matter to voters. Unfortunately, USC and [debate co-sponsor] KABC have not been able to reach an agreement on expanding the number of candidates at tomorrow’s debate. As a result, USC has made the difficult decision to cancel tomorrow’s debate and will look for other opportunities to educate voters on the candidates and issues.""</p><p>Becerra took a victory lap: ""We fought. We won! ... Thank you to everyone who stood up, raised hell and demanded justice. Never give up when you’re fighting for fairness!""</p><p><a href=""https://www.foxnews.com/media/no-clear-champion-cash-payment-reparations-effort-california-gubernatorial-race"" rel=""noopener"" target=""_blank""><strong>NO CLEAR CHAMPION OF CASH PAYMENT REPARATIONS AMONG DEMOCRATS IN CALIFORNIA GUBERNATORIAL RACE</strong></a></p><p>At least Becerra's position is comprehensible. He has long defended <a href=""https://www.foxnews.com/category/us/education/diversity"" rel=""noopener"" target=""_blank"">affirmative action in California</a>. Indeed, despite statewide votes against the practice, California universities continue to be accused of applying racial criteria in admissions. Becerra is effectively demanding such action for himself as a ""candidate of color.""</p><p>USC was left stumbling in search of a place to hide. USC scholars defended the process that USC affectively scuttled:</p><p>""All of us expect and welcome critical engagement from inside and outside the academy. What Professor Grose has faced, however, is not substantive or methodological debate. Attacks and insinuations from members of the political classes include completely baseless allegations of election-rigging, inconsistency, bias and data manipulation. These are harmful character assassinations, not substantive debate. They are of a piece with other attempts to strong-arm or malign scholars that have become all too common in America.</p><p>Whatever their intent, the effect of these attacks is to diminish academic freedom and chill scholarly willingness to add their voices to the public square. It is imperative that universities defend their faculties’ integrity when it is unfairly attacked.""</p><p>That is a powerful statement if one does not then consider that the university caved, cancelled the debate, and meekly said that it will ""look for other opportunities to educate voters on the candidates and issues."" The ""strong-arming"" succeeded.</p><p>What is particularly disappointing is that I just spoke at USC and was impressed with the <a href=""https://www.foxnews.com/category/us/los-angeles"" rel=""noopener"" target=""_blank"">members of the USC community</a> seeking to restore a diversity of viewpoints. The event was sponsored by The Center for the Political Future, which was the sponsor of the debate. It was also organized by the USC Open Dialogue Project and the USC chapter of the Heterodox Academy. Both have written in defense of this process.</p><p>Professor Morris Levy with Heterodox wrote: ""[USC's] message is unmistakable: USC was allowing ‘concerns’ and a public ‘distraction’ to override its own institutional conviction that the selection formula was data-driven and backed by research.""</p><p><a href=""https://www.foxnews.com/opinion"" rel=""noopener"" target=""_blank""><strong>CLICK HERE FOR MORE FOX NEWS OPINION</strong></a></p><p>So Heterodox, The Center for the Political Future, and ABC7 issued statements indicating that they were prepared to go forward and also defended the process of selection. That left only USC.</p><p>In this controversy, USC succeeded in finding the least defensible ground to make its stand. It denounced the cancel campaign but then effectively yielded to it.</p><p>The alternative is to stand by your race-blind, data-driven process and hold the debate for all invited candidates willing to attend.</p><p>Where USC was criticized recently for its fake punt in the game with Northwestern, it actually punted in this play and left the field.</p><p><a href=""https://www.foxnews.com/person/t/jonathan-turley"" rel=""noopener"" target=""_blank""><strong><u>CLICK HERE TO READ MORE FROM JONATHAN TURLEY</u></strong></a></p>",https://www.foxnews.com/opinion/jonathan-turley-usc-abandons-governor-debate-after-dems-whine-about-white-candidates,2026-03-28
2,Plane seat location critical in emergencies as experts warn row position impacts survival odds,"<p>In the wake of the recent deadly collision at LaGuardia Airport that killed both pilots and injured dozens of passengers, questions about <a href=""https://www.foxnews.com/category/travel/general/airlines"" rel=""noopener"" target=""_blank"">airline safety</a> are once again on people's minds. </p><p>The aircraft, carrying 72 passengers and four crew members, struck a Port Authority vehicle while landing Sunday night.</p><p>As investigators continue to piece together what went wrong, many travelers are discussing whether <a href=""https://www.foxnews.com/category/travel/general/travel-safety"" rel=""noopener"" target=""_blank"">seat location</a> can influence passenger safety and survival.</p><p><a href=""https://www.foxnews.com/travel/airlines-told-reevaluate-emergency-evacuation-procedures-after-carry-on-concerns"" rel=""noopener"" target=""_blank""><strong>AIRLINES TOLD TO REEVALUATE EMERGENCY EVACUATION PROCEDURES AFTER CARRY-ON CONCERNS</strong></a></p><p>Daniel Bubb, a former airline pilot and commercial aviation expert at the University of Nevada, Las Vegas, told Fox News Digital there is no guarantee about the safest seat on an airplane.</p><p>He also said some seats could be better than others.</p><p>""Sitting toward the back of the plane gives passengers the best chance of survival,"" said Bubb. ""This is because the front and middle parts absorb most of the impact if it is a head-on collision, as was the case of <a href=""https://www.foxnews.com/video/6391628112112"" rel=""noopener"" target=""_blank"">the Jazz Air crash at LGA</a>.""</p><p>He went on, ""In this crash, we saw the front of the aircraft absorb most of the impact. Perhaps what was an anomaly — but <a href=""https://www.foxnews.com/category/good-news"" rel=""noopener"" target=""_blank"">thank goodness miraculous</a> — was the flight attendant, who was seated in her jumpseat with her seat belt and harness on, surviving the crash when she was ejected 300 feet.""</p><p><a href=""https://www.foxnews.com/newsletters?cmpid=fnfirstnl"" rel=""noopener"" target=""_blank""><strong>CLICK HERE TO SIGN UP FOR OUR LIFESTYLE NEWSLETTER</strong></a></p><p>Motley Rice aviation attorney Jim Brauchle, based in South Carolina, told Fox News Digital the safest location in an emergency evacuation would first be the emergency exit row. </p><p>Then, he said, the closer passengers are seated toward an exit, the quicker they'll be able to evacuate.</p><p>""In the event of an evacuation, it’s important not to retrieve your personal belongings,"" said Rice. ""In many of the recent evacuations, we continually see people evacuating with their carry-on bags.""</p><p>Travelers, he said, should carefully <a href=""https://www.foxnews.com/category/style-and-beauty"" rel=""noopener"" target=""_blank"">consider which shoes</a> they are wearing. </p><p>""People should wear comfortable footwear when flying, preferably closed toe — and high heels are not conducive to an emergency evacuation.""</p><p><a href=""https://www.foxnews.com/lifestyle"" rel=""noopener"" target=""_blank""><strong>CLICK HERE FOR MORE LIFESTYLE STORIES</strong></a></p><p>Though most airline passengers zone out ""when the crew is going over their emergency instructions at the beginning of a flight, it is important to note the closest exit and also the next closest exit, should the primary exit be blocked,"" said Brauchle.</p><p>In 2015, Time magazine reviewed aircraft accidents that involved fatalities and survivors over the previous 35 years. </p><p><a href=""https://www.foxnews.com/category/lifestyle/quizzes"" rel=""noopener"" target=""_blank""><strong>TEST YOURSELF WITH OUR LATEST LIFESTYLE QUIZ</strong></a></p><p>The publication's analysis showed that seats in the rear third of the plane had a 32% fatality rate, compared with 39% in the middle section and 38% in the front.</p><p>It also found that middle seats in the rear offered a 28% fatality rate, which was the highest survival rate.</p><p>Aisle seats in the middle section had the poorest outcomes — with a 44% fatality rate.</p>",https://www.foxnews.com/travel/plane-seat-location-critical-emergencies-experts-warn-row-impacts-survival-odds,2026-03-28
3,FCC chairman questions NFL’s antitrust protection as league shifts to streaming services,"<p><a href=""https://www.foxnews.com/category/sports/nfl"" rel=""noopener"" target=""_blank"">NFL</a> fans will likely have to spend more to watch the league’s full slate of games each week in 2026. </p><p>A YouTube TV ""NFL Sunday Ticket"" subscription can cost several hundred dollars, but does not provide access to every game. Fans must also subscribe to Amazon Prime, Peacock and Netflix to watch the full slate. All-in costs for these packages exceed $1,500, but that figure does not include fees or internet costs.</p><p><a href=""https://www.foxnews.com/media/fcc-takes-notice-americas-most-popular-sport-becomes-increasingly-costly-frustrating-consume"" rel=""noopener"" target=""_blank"">Federal Communications Commission</a> (FCC) Chairman Brendan Carr has made it a priority to support American sports fans as the NFL, NBA, MLB and other leagues move key games from broadcast and cable television to costly streaming services. However, the NFL could lose its antitrust exemption if too many games are placed behind a paywall, Carr said this week.</p><p><a href=""https://www.foxnews.com/sports"" rel=""noopener"" target=""_blank""><strong>CLICK HERE FOR MORE SPORTS COVERAGE ON FOXNEWS.COM</strong></a></p><p>""Does the NFL still benefit from the antitrust exemption when they’re negotiating for carriage of games not on a sponsored telecast, but on a streaming service?"" Carr said at an event in Washington, D.C., on Thursday, <a href=""https://www.semafor.com/article/03/26/2026/tipping-point-nfls-streaming-shift-could-put-leagues-antitrust-shield-at-risk-fccs-carr-says"" rel=""nofollow noopener"" target=""_blank"">via Semafor</a>. ""That’s a very live, very ripe question.""</p><p>Carr cautioned there is ""a point at which you sort of tip the scale, and they’ve just put too many games behind a paywall, and then that whole exemption collapses.""</p><p><a href=""https://www.foxnews.com/sports/nfl-fans-call-leagues-streaming-strategy-money-grab-costs-spiral-out-control"" rel=""noopener"" target=""_blank""><strong>NFL FANS CALL THE LEAGUE'S STREAMING STRATEGY A 'MONEY GRAB' AS COSTS SPIRAL OUT OF CONTROL</strong></a></p><p>A 1961 law allows the NFL to negotiate leaguewide TV deals without violating U.S. antitrust rules, provided it meets certain conditions, including protecting customer access. The stakes are high if the NFL's antitrust exemption goes away, particularly if individual franchises begin selling their TV rights separately.</p><p>Carr pointed to broader implications for media rights negotiations. ""If the NFL teams were able to collectively negotiate,"" he said, ""should the broadcasters, perhaps, be able to collectively negotiate as well?""</p><p>Fox News Digital contacted the NFL for comment, but league officials did not immediately respond.</p><p>Last month, the FCC said it would <a href=""https://www.foxnews.com/media/fcc-boss-wants-make-life-less-frustrating-sports-fans-says-streaming-shift-real-pain-consumers"" rel=""noopener"" target=""_blank""><u>seek public comment</u></a> on the shift of live sports from broadcast channels to streaming platforms. The comment period runs through March 27, and replies are due April 13.</p><p>Carr acknowledged that the rising cost and sometimes inconvenient nature of sports streaming are frustrating fans, arguing the drawbacks ultimately outweigh the benefits.</p><p>Carr acknowledged the rising cost and sometimes inconvenient nature of sports streaming are frustrating fans, arguing the drawbacks ultimately outweigh the benefits.</p><p>""Americans are frustrated when they sit down and can’t find the game they want to watch. And that feeling grows only worse when they realize that they might need to sign up for another streaming service to watch the game,"" Carr previously told Fox News Digital. </p><p>""There has long been a strong and mutually beneficial relationship between sports leagues and broadcasters, and consumers will benefit if that continues,"" Carr continued. ""I want to see Americans continue to benefit from free over-the-air sports programming.""</p><p><i>Fox News' Brian Flood contributed to this report.</i></p><p><i><strong>Follow Fox News Digital’s</strong></i><a href=""https://twitter.com/FoxNewsSports_"" rel=""nofollow noopener"" target=""_blank""><i><strong> sports coverage on X</strong></i></a><i><strong>, and subscribe to</strong></i><a href=""https://www.foxnews.com/newsletters"" rel=""noopener"" target=""_blank""><i><strong> the Fox News Sports Huddle newsletter</strong></i></a><i><strong>.</strong></i></p>",https://www.foxnews.com/sports/fcc-chairman-questions-nfls-antitrust-protection-league-shifts-streaming-services,2026-03-28
