,title,text,link,publish_date
0,MLB top prospect shares hilarious moment with veteran who robbed his home run after four-hit MLB debut,"<p><a href=""https://www.foxnews.com/category/sports/mlb/detroit-tigers"" rel=""noopener"" target=""_blank"">Detroit Tigers</a> top prospect Kevin McGonigle seems pretty comfortable at the major league level, but one veteran doesn't want him too comfortable.</p><p>McGonigle made the Tigers' <a href=""https://www.foxnews.com/category/sports/mlb"" rel=""noopener"" target=""_blank"">Opening Day</a> roster, and he showed why he deserved it by notching four hits in his MLB debut.</p><p>McGonigle was back in action on Friday in San Diego against the Padres, and in the top of the second inning, he launched a ball to deep center field that traveled 403 feet. However, Jackson Merrill leaped and robbed McGonigle of his first home run.</p><p><a href=""https://www.foxnews.com/sports"" rel=""noopener"" target=""_blank""><strong>CLICK HERE FOR MORE SPORTS COVERAGE ON FOXNEWS.COM</strong></a><i><strong> </strong></i></p><p>In the bottom half of the inning, after Merrill doubled, McGonigle appeared to compliment Merrill on his catch, which Merrill thanked him for.</p><p>But that did not come before Merrill joked about McGonigle's big Opening Day.</p><p>""You got four yesterday!"" Merrill said to the rookie.</p><p>McGonigle became the 21st player in MLB history to have four hits in his MLB debut and the first to do it since J.P. Arancibia in 2010.</p><p><a href=""https://www.foxnews.com/sports/alex-vesia-dodgers-pitcher-who-lost-infant-daughter-gets-standing-ovation-after-scoreless-return-mound"" rel=""noopener"" target=""_blank""><strong>ALEX VESIA, DODGERS PITCHER WHO LOST INFANT DAUGHTER, GETS STANDING OVATION AFTER SCORELESS RETURN TO MOUND</strong></a></p><p>Merrill's home run robbery provided a boost early on, but McGonigle got revenge with a game-winning two-run single in a four-run eighth inning for Detroit en route to a 5-2 victory.</p><p>The Tigers choked a double-digit AL Central lead last season but still managed to get to the <a href=""https://www.foxnews.com/category/sports/mlb-postseason"" rel=""noopener"" target=""_blank"">American League Division Series</a> after defeating the same team who overtook them in the standings in the Cleveland Guardians.</p><p>The Padres played more October baseball as a wild-card team as the <a href=""https://www.foxnews.com/category/sports/mlb/los-angeles-dodgers"" rel=""noopener"" target=""_blank"">Los Angeles Dodgers</a> took another NL West title before repeating as World Series Champions.</p><p><i><strong>Follow Fox News Digital’s </strong></i><a href=""https://twitter.com/FoxNewsSports_"" rel=""nofollow noopener"" target=""_blank""><i><strong>sports coverage on X</strong></i></a><i><strong>, and subscribe to </strong></i><a href=""https://www.foxnews.com/newsletters"" rel=""noopener"" target=""_blank""><i><strong>the Fox News Sports Huddle newsletter.</strong></i></a></p>",https://www.foxnews.com/sports/mlb-top-prospect-shares-hilarious-moment-veteran-who-robbed-his-home-run-after-four-hit-mlb-debut,2026-03-28
1,Father of slain 20-year-old killed by illegal immigrant issues stark warning after Sheridan Gorman killing,"<p>The father of a 20-year-old woman killed by an illegal immigrant <a href=""https://www.foxnews.com/category/us/us-regions/midwest/illinois"" rel=""noopener"" target=""_blank"">in Illinois</a> warns more innocent people will die if policies don’t change following the death of Sheridan Gorman.</p><p>Loyola University Chicago freshman Sheridan Gorman, 18, was shot and killed while she was with a group of friends at a Rogers Park pier on March 19. 25-year-old Jose Medina-Medina, the suspect in her death, is an illegal immigrant who the Department of Homeland Security says entered the country in 2023, and apprehended then <a href=""https://www.foxnews.com/us/chicago-mayor-asked-about-citys-immigration-policies-after-illegal-immigrant-allegedly-killed-college-student"" rel=""noopener"" target=""_blank"">released into the U.S.</a> under the Biden administration.</p><p>During a court hearing on Friday, prosecutors revealed that Gorman found Medina-Medina hiding behind a lighthouse. When she alerted her friends about the man behind the lighthouse, Medina-Medina began chasing them, and that's when prosecutors say he fired the gun, which struck Gorman in the upper back.</p><p>In January 2025, Joe Abraham's daughter, Katie, was killed in a hit-and-run crash that involved an illegal immigrant in 2025 in Urbana, Illinois. Katie Abraham was killed when Julio Cucul-Bol, an illegal immigrant, crashed into her car and then left the scene. Cucul-Bol was sentenced to 30 years in prison.</p><p><a href=""https://www.foxnews.com/politics/college-students-alleged-murder-illegal-went-exactly-dems-intended-house-speaker-says"" rel=""noopener"" target=""_blank""><strong>COLLEGE STUDENT'S ALLEGED MURDER BY ILLEGAL WENT EXACTLY AS DEMS ‘INTENDED,’ HOUSE SPEAKER SAYS</strong></a></p><p>Joe Abraham told Fox News Digital that there will be more victims dead if Illinois doesn't change its <a href=""https://www.foxnews.com/category/us"" rel=""noopener"" target=""_blank"">immigration policies</a>.</p><p>""I am speaking out because I know there will be more deaths and more victims. Not everyone dies, but there are innocent victims every day. And that's why I'm speaking out. Because these policies are so reckless, so radical, so extreme,"" he said. ""There's no balance to it. There is no consideration for anything.""</p><p><a href=""https://twitter.com/FoxTrueCrime"" rel=""noopener"" target=""_blank""><strong>FOLLOW THE FOX TRUE CRIME TEAM ON X</strong></a></p><p>He said that the murder of Gorman and his daughter, Katie Abraham, are ""very parallel"" and show how immigration policy in Illinois needs to be changed.</p><p>""One was a point-blank murder shooting. The other one was a reckless person who was driving on the influence. But the difference is they were both violent. They were both done by people who shouldn't be here. They were done by clearly people who were not here to better their lives,"" Joe Abraham said. ""They were clearly done by people who had severe diseases, like in Katie's case. Her killer has HIV and is being treated now that he's incarcerated, but Illinois did nothing to help him.""</p><p><a href=""https://www.foxnews.com/newsletters"" rel=""noopener"" target=""_blank""><strong>SIGN UP TO GET TRUE CRIME NEWSLETTER</strong></a></p><p>Joe Abraham says his daughter was a ""beautiful person"" with a ""sharp wit.""</p><p>""She was so personable. Her personality was so engaging, made everyone feel seen, heard, cared for, compassionate, fair-minded. She loved the water. She was a water polo player. She was a competitive swimmer. Did that all through high school. She had her whole life ahead of her. And see, you know, like a sponge, she soaked in life, every piece of it, and she was only 20. We still had so many plans ahead of us that were, you know, that are just gone because of reckless policies,"" he added.</p><p><a href=""https://www.foxnews.com/tips"" rel=""noopener"" target=""_blank""><strong>SEND US A TIP HERE</strong></a></p><p>Similarly, Gorman was described in an obituary as someone who ""had a way of making people feel seen, valued and believed in.""</p><p>""People often say someone 'lit up a room' or had ‘inner and outer beauty,’ but in Sheridan’s case, those phrases fall way too short. She radiated something even greater—a rare and unmistakable warmth, a spirit that was vibrant, compassionate, and full of life. She was funny, kind and deeply loving, with a heart that made space for everyone,"" her obituary states. ""She loved fiercely—her family, her friends, her community and her faith. She brought people together, lifted them up and made the ordinary moments feel extraordinary simply by being in them.""</p><p><a href=""https://link.podtrac.com/cjdr_fnd_article"" rel=""noopener"" target=""_blank""><strong>LISTEN TO THE NEW 'CRIME &amp; JUSTICE WITH DONNA ROTUNNO' PODCAST</strong></a></p><p>A <a href=""https://www.foxnews.com/category/us/crime/police-and-law-enforcement"" rel=""noopener"" target=""_blank"">police source</a> told Fox News earlier that <a href=""https://www.foxnews.com/us/slain-loyola-chicago-students-family-fumes-over-murder-manhunt-masked-gunman-attack-near-campus"" rel=""noopener"" target=""_blank"">the </a>shooting was an apparent ambush<a href=""https://www.foxnews.com/us/slain-loyola-chicago-students-family-fumes-over-murder-manhunt-masked-gunman-attack-near-campus"" rel=""noopener"" target=""_blank"">,</a> adding that the suspect was reportedly wearing some kind of face mask or covering.</p><p>After the shooting, Medina-Medina was spotted on security camera in his apartment building lobby waiting for an elevator, and wasn't masked. A building engineer told police he knew the suspect who had a ""very distinct limp and gait.""</p><p><a href=""https://www.foxnews.com/category/us/true-crime"" rel=""noopener"" target=""_blank""><strong>LIKE WHAT YOU'RE READING? FIND MORE ON THE TRUE CRIME HUB</strong></a></p><p>Pictures of the suspect's face were sent to a police database, and information from <a href=""https://www.foxnews.com/category/us/immigration"" rel=""noopener"" target=""_blank"">U.S. Customs and Border Protection</a> identified the suspect as Medina-Medina. </p><p>When Medina-Medina was <a href=""https://www.foxnews.com/category/world/colombia"" rel=""noopener"" target=""_blank"">in Colombia</a> after his mother moved there with him from Venezuela, he was shot in the head, which resulted in the loss of a portion of his brain and skull, leaving him to relearn basic functions, his attorney said. Medina-Medina's attorney said that he has the brain development of a child and cannot read or write.</p><p>Medina-Medina's attorney also said that he suffers from epilepsy and still has bullet fragments lodged in his brain. The murder suspect turned himself in at the <a href=""https://www.foxnews.com/category/us/us-regions/southwest/texas"" rel=""noopener"" target=""_blank"">Texas border</a> in 2023, where he was held in detention before being released. His attorney said that Medina-Medina requested to be sent back to Colombia, where his mother had moved to, but was transported by bus to Chicago. </p><p>During Medina-Medina's time in a shelter, he contracted tuberculosis, according to his attorney.</p>",https://www.foxnews.com/us/father-slain-20-year-old-killed-illegal-immigrant-issues-stark-warning-after-sheridan-gorman-killing,2026-03-28
2,Iran-backed Houthis open third front against Israel as Tehran seeks leverage ahead of talks,"<p>The Iranian regime-backed Houthi movement launched two missiles at <a href=""https://www.foxnews.com/category/world/world-regions/israel"" rel=""noopener"" target=""_blank"">Israel</a> on Saturday, creating a third front for the Jewish state in its current war against the Islamic Republic and its other terror-proxy Hezbollah in Lebanon.</p><p>The Houthis said they ""targeted sensitive Israeli military sites"" with a ""barrage of ballistic missiles."" The IDF, according to YNET, said it intercepted both a cruise and ballistic missile fired by the Houthis on Saturday morning.</p><p>Nadwa Al-Dawsari, an expert on Yemen and an associate fellow at the Middle East Institute, told Fox News Digital, ""This is now fundamentally about the survival of the Iranian regime. The intervention of the Houthis and other Axis members is determined by the IRGC-run Axis of Resistance Operations Room. The Houthis have already demonstrated their ability to withstand intense U.S. and Israeli airstrikes. For both Iran and the Houthis, ‘winning’ is defined by survival, not decisive victory.""</p><p><a href=""https://www.foxnews.com/world/iran-continues-firing-missiles-drones-neighboring-states-multiple-interceptions-reported"" rel=""noopener"" target=""_blank""><strong>IRAN CONTINUES FIRING MISSILES, DRONES AT NEIGHBORING STATES, WITH MULTIPLE INTERCEPTIONS REPORTED</strong></a></p><p>She continued, ""The strategy is to prolong the conflict and raise the cost. The Houthis are uniquely positioned to do that, given their ability to disrupt critical maritime routes and open additional pressure fronts. If escalation continues, they will likely resume Red Sea attacks and could <a href=""https://www.foxnews.com/world/irans-last-line-resistance-holds-back-houthi-terror-group-warns-its-ready-act"" rel=""noopener"" target=""_blank"">expand pressure toward KSA</a> [Kingdom of Saudi Arabia].""</p><p>The <a href=""https://www.foxnews.com/category/world/world-regions/saudi-arabia"" rel=""noopener"" target=""_blank"">Kingdom of Saudi Arabia</a> and the Houthis were engaged in a war before the Biden administration reportedly forced the Saudi government to stop its military strikes on the Houthis. Biden had also delisted the Houthis as a foreign terrorist organization only for the Trump administration to swiftly reimpose the terror designation on the Houthis in the early days of his second term.</p><p>Salman Al-Ansari, a Saudi geopolitical analyst, told Fox News Digital that ""The Houthis appear to be acting under heavy pressure from Tehran. Iran wanted them involved two weeks ago, and this attack looks more symbolic than strategic. It is part of Tehran’s effort to improve its position in negotiations with the U.S. by showing that it still has cards to play beyond Hormuz.""</p><p>He added, ""The Houthis do not control the Bab el-Mandeb Strait, but they can still disrupt shipping in the Red Sea. At the same time, they seem to <a href=""https://www.foxnews.com/category/world/conflicts/iran"" rel=""noopener"" target=""_blank"">view Iran as a dead horse</a> and are cautious about betting too heavily on it.""</p><p><a href=""https://www.foxnews.com/world/future-war-us-israel-blitz-iran-unveils-next-gen-allied-combat"" rel=""noopener"" target=""_blank""><strong>THE FUTURE OF WAR? US-ISRAEL BLITZ ON IRAN UNVEILS NEXT-GEN ALLIED COMBAT</strong></a></p><p>The Houthis are fanatically anti-American and anti-Israel. The official slogan of the Houthi movement (Ansar Allah) reads, ""Allah is Greater. Death to America. Death to Israel. Curse on the Jews. Victory to Islam."" </p><p>The Houthis control most of <a href=""https://www.foxnews.com/category/world/world-regions/middle-east"" rel=""noopener"" target=""_blank"">northwest Yemen</a>. They expelled the internationally recognized government from the capital, Sanaa in 2015.</p><p>The Houthis joined <a href=""https://www.foxnews.com/category/world/hamas"" rel=""noopener"" target=""_blank"">Hamas in its war</a> against Israel in mid-October 2023, after the terrorist movement in Gaza invaded Israel and murdered over 1,200 people, including more than 40 Americans. A Houthi drone killed an Israeli civilian in Tel Aviv in 2024.</p><p>Michael Szanto, an international relations expert, told Fox News Digital that, ""Iran has already been badly hit by the United States and Israel and all supply routes between Iran and Yemen will be cut off by U.S. forces. This means that Yemen will lack the supply lines to maintain a sustained offensive against Israel, though it still likely has large stockpile of missiles and drones.""</p><p>He added, ""The Houthis are making a major strategic mistake by once again provoking Israel, which will try to finish off the terrorist threat in Yemen. The Houthis have proven themselves to also be a menace to the Saudis, the Emiratis, the U.S., and the world.""</p><p>Saturday's attack happened hours before a spokesman for the terrorist group threatened that it's ""fingers were on the trigger."" </p>",https://www.foxnews.com/world/iran-backed-houthis-open-third-front-against-israel-tehran-seeks-leverage-ahead-talks,2026-03-28
3,Arnold Schwarzenegger passes bodybuilding torch to lookalike son Joseph Baena,"<p>Like father, like son — and a bodybuilding legacy in the making.</p><p><a href=""https://www.foxnews.com/category/person/arnold-schwarzenegger"" rel=""noopener"" target=""_blank"">Arnold Schwarzenegger</a> was spotted stepping back into coach mode as he trained his son, Joseph Baena, ahead of his first bodybuilding competition — signaling the next generation may be ready to carry the torch.</p><p>The seven-time Mr. Olympia winner, 78, was seen working closely with Baena, 28, inside the iconic Gold’s Gym in <a href=""https://www.foxnews.com/category/us/us-regions/west/california"" rel=""noopener"" target=""_blank"">Venice Beach, California</a>, where the bodybuilding legend once built his empire.</p><p><a href=""https://www.foxnews.com/entertainment/patrick-schwarzenegger-credits-daily-prayer-strengthening-his-marriage-amid-hollywood-pressures"" rel=""noopener"" target=""_blank""><strong>PATRICK SCHWARZENEGGER CREDITS PRAYING WITH WIFE AS DAILY ANCHOR IN HOLLYWOOD ‘ROLLER COASTER'</strong></a></p><p>But this time, Schwarzenegger wasn’t the one posing under pressure — he was fine-tuning every detail from the sidelines.</p><p>In the video obtained by Fox News Digital, the ""Terminator"" star carefully adjusted Baena’s positioning, ensuring each <a href=""https://www.foxnews.com/category/health/nutrition-and-fitness/fitness"" rel=""noopener"" target=""_blank"">muscle hit just right</a>.</p><p>After a session of <a href=""https://www.foxnews.com/category/health/nutrition-and-fitness"" rel=""noopener"" target=""_blank"">pumping iron</a>, Baena went shirtless to show off his increasingly sculpted physique, flexing his biceps as his father corrected his angles and form — even helping him lock in one of Schwarzenegger’s signature poses.</p><p><a href=""https://www.foxnews.com/newsletters?cmpid=fnfirstnl"" rel=""noopener"" target=""_blank""><strong>CLICK HERE TO SIGN UP FOR THE ENTERTAINMENT NEWSLETTER</strong></a></p><p>Schwarzenegger, dressed casually in a black T-shirt, shorts and knee-high socks, watched closely as he <a href=""https://www.foxnews.com/category/lifestyle/parenting/family"" rel=""noopener"" target=""_blank"">coached his son</a>.</p><p>Onlookers quickly gathered as the pair moved through each pose with precision, drawing a crowd inside the gym famously dubbed ""the mecca of bodybuilding.""</p><p>The ""Dancing with the Stars"" alum has recently showed off his fit physique and fitness routines in behind-the-scenes training videos on his <a href=""https://www.instagram.com/joebaena/?hl=en"" rel=""nofollow noopener"" target=""_blank"">social media.</a></p><p><strong>WATCH: ARNOLD SCHWARZENEGGER TRAINS LOOKALIKE SON JOSEPH BAENA AT GYM AS BODYBUILDING BUZZ GROWS</strong></p><p><a href=""https://www.foxnews.com/entertainment"" rel=""noopener"" target=""_blank""><strong>LIKE WHAT YOU’RE READING? CLICK HERE FOR MORE ENTERTAINMENT NEWS</strong></a></p><p>Baena has been carving out his own path — from acting roles, including the 2024 action thriller ""Gunner,"" to landing a Men’s Health cover — while navigating inevitable comparisons to his father.</p><p>""It's been a huge growth year of me finding out who I am and really being secure… confident… no matter what the challenges are, what the comparisons are,"" Baena previously told Fox News Digital.</p><p>Still, he’s acknowledged the <a href=""https://www.foxnews.com/category/topic/family-traditions"" rel=""noopener"" target=""_blank"">pressure that comes with the name</a>.</p><p>""The message that I wanted to get across was, there’s a lot of people out there with very accomplished parents… and it’s scary. It’s scary to get compared to these giants, and to have the feeling like you need to live up to these expectations.""</p>",https://www.foxnews.com/entertainment/arnold-schwarzenegger-bodybuilding-lookalike-son-joseph-baena,2026-03-28
4,Tiger Woods' DUI arrest sparks demands for accountability,"<p><a href=""https://www.foxnews.com/category/person/tiger-woods"" rel=""noopener"" target=""_blank"">Tiger Woods'</a> arrest on DUI-related charges has prompted debate over whether the champion golfer should face a suspension.</p><p>Woods' Friday crash is the <a href=""https://www.foxsports.com/articles/golf/tiger-woods-a-timeline-of-significant-moments-on-and-off-the-golf-course"" rel=""noopener"" target=""_blank"">fourth major car incident</a> for the professional golfer since 2009. In 2017, he was found driving under the influence of multiple prescription drugs and asleep in his car, stopped in the road. He said it was due to a reaction to the pills.</p><p>""I don't like sugar-coating things. And the way I look at it, there's got to be some sort of punishment or withdrawal or some sort of a suspension from the game,"" Mark Lye, a former <a href=""https://www.foxnews.com/category/sports/golf"" rel=""noopener"" target=""_blank"">PGA golfer</a>, said Saturday on ""Fox &amp; Friends Weekend.""</p><p>Woods was taken into custody in <a href=""https://www.foxnews.com/category/us/us-regions/southeast/florida"" rel=""noopener"" target=""_blank"">Jupiter Island, Florida</a>, where police said he was driving at a ""high rate of speed"" when he clipped another car, causing his vehicle to roll over. Authorities said he registered a 0.00 on a breathalyzer, ruling out alcohol impairment, but refused a urine test and was charged with DUI and property damage.</p><p><a href=""https://www.foxnews.com/sports/tiger-woods-offers-first-public-comments-since-latest-back-surgery-amid-growing-concern-over-golf-return"" rel=""noopener"" target=""_blank""><strong>TIGER WOODS OFFERS FIRST PUBLIC COMMENTS SINCE LATEST BACK SURGERY AMID GROWING CONCERN OVER GOLF RETURN</strong></a></p><p>""I’m just wondering where that discipline that he's learned to convey on the golf course is [going to] take hold in his personal life. Obviously, he's got <a href=""https://www.foxnews.com/category/health/mental-health/addiction"" rel=""noopener"" target=""_blank"">demons going on</a>,"" Lye said.</p><p>Lye called for ""accountability"" for Woods and questioned whether it is time for a stricter suspension from the game. Lye noted that contracts for professional golfers often include a ""morals clause"" and warned Woods could face further consequences if no action is taken.</p><p>Lye isn’t alone in his concern for Woods and those around him, however. Doug Bell, a <a href=""https://www.foxnews.com/category/sports/golf/pga-tour"" rel=""noopener"" target=""_blank"">PGA Tour announcer</a>, said he’s thankful no one was hurt.</p><p><a href=""https://www.foxnews.com/sports/tiger-woods-stepping-back-competitive-golf-masters-loom"" rel=""noopener"" target=""_blank""><strong>TIGER WOODS STEPPING BACK INTO COMPETITIVE GOLF AS MASTERS LOOM</strong></a></p><p>""It's troublesome to see what happened yesterday. It is a pattern that has developed,"" Bell said. </p><p>""Let’s hope this leads to something positive for one of the great athletes and figures in this world that we've seen in a long, long time,"" he added. </p><p><a href=""https://www.foxnews.com/sports/sportscaster-jim-gray-says-tiger-woods-dui-arrest-a-cry-help"" rel=""noopener"" target=""_blank""><strong>SPORTSCASTER JIM GRAY SAYS TIGER WOODS' DUI ARREST IS 'ANOTHER CRY FOR HELP'</strong></a></p><p>Bell suggested Woods take some time away from golf as a productive next step in recovery.</p><p>""He’s dealing with something that we don't know what's going on inside his head, the pain that he's in from all the surgeries,"" Bell said, adding that stepping away from the game ""might be the best thing.""</p><p>Woods was released from jail Friday night. In a <a href=""https://www.foxnews.com/sports/tiger-woods-mugshot-released-eyes-appear-bloodshot-after-dui-arrest"" rel=""noopener"" target=""_blank"">mugshot released</a> hours after his arrest, his eyes appeared red. </p><p><a href=""https://www.foxnews.com/sports/trump-reacts-tiger-woods-rollover-crash-golfer-faces-dui-charge-close-friend-mine"" rel=""noopener"" target=""_blank"">President Donald Trump weighed in</a> on the arrest of his ""very close friend,"" noting the star athlete has had some ""difficulty.""</p><p>Woods’ team did not immediately respond to a request for comment from <a href=""https://www.foxnews.com/category/media"" rel=""noopener"" target=""_blank"">Fox News Digital.</a></p>",https://www.foxnews.com/media/demands-accountability-grow-after-tiger-woods-latest-florida-dui-crash,2026-03-28
