,title,text,link,publish_date
18,"Veteran, 83, allegedly shoved onto NYC subway tracks dies from injuries; illegal migrant charged with murder","<p><a href=""https://www.foxnews.com/category/us/military/veterans"" rel=""noopener"" target=""_blank"">An 83-year-old veteran</a> who was allegedly shoved onto subway tracks in New York City by an illegal immigrant with a long criminal history has died from his injuries, the Department of Homeland Security said Thursday.</p><p>Richard Williams, a retired <a href=""https://www.foxnews.com/category/tech/topics/us-air-force"" rel=""noopener"" target=""_blank"">Air Force</a> pilot, died March 17 after he and another man were allegedly pushed onto the tracks at the Lexington Avenue-63rd Station days earlier.</p><p>The alleged attacker, Honduran national Bairon Posada-Hernandez, 34, was arrested March 10 and faces a murder charge. </p><p><a href=""https://www.foxnews.com/us/dhs-touts-ice-nabbing-illegal-migrant-accused-raping-5-year-old-girl-ny-sanctuary-laws"" rel=""noopener"" target=""_blank""><strong><u>DHS TOUTS ICE NABBING ILLEGAL MIGRANT ACCUSED OF RAPING 5-YEAR-OLD GIRL DESPITE NY SANCTUARY LAWS</u></strong></a></p><p>John Pena, 30, the other man allegedly pushed onto the tracks, helped pull Williams back onto the platform moments before a train rolled into the station, the New York Post reported.</p><p>After the attack, Williams was taken to a hospital, where doctors said he suffered a <a href=""https://www.foxnews.com/category/health/nervous-system-health/head-injury"" rel=""noopener"" target=""_blank"">brain bleed</a> and underwent surgery. He had no brain activity after the procedure, doctors said. </p><p>Williams' death has been ruled a homicide. </p><p>""I want him to go to the Venezuela prison, the worst place he could go to,"" his daughter, Debbie Williams, previously told the newspaper. ""I want him to suffer for the rest of his life. Prison justice would be appropriate.""</p><p>She said her father had recently won a five-year battle with prostate cancer six months ago. </p><p>Hernandez's public defender, Mitchell Schuman, declined ot comment on the charges against his client. </p><p>""We have yet to see the indictment, concluded our investigation or reviewed the expected voluminous discovery materials,"" he said. </p><p><a href=""https://www.foxnews.com/politics/child-rapists-gang-members-domestic-abusers-helped-evading-deportation-anti-ice-agitators-dhs"" rel=""noopener"" target=""_blank""><strong><u>DHS SAYS ANTI-ICE AGITATORS HELPED CHILD RAPISTS, GANG MEMBERS EVADE DEPORTATION</u></strong></a></p><p>Posada-Hernandez, whom the Department of Homeland Security called a ""serial criminal,"" has been deported from the United States four times, the agency said. </p><p>""Bairon Posada-Hernandez is a serial criminal and four-time deported illegal alien from Honduras who should never have been able to walk our streets and harm innocent Americans,"" said Deputy Assistant Secretary Lauren Bis. </p><p>Federal authorities are asking New York not to release Posada-Hernandez back onto the streets. New York has adopted sanctuary policies limiting cooperation between local and federal authorities. </p><p>U.S. Immigration and Custioms Enforcement has lodged a detainer for Posada-Hernandez. Fox News Digital has reached out to Mayor Zohran Mamdani's office and the New York Public Defenders office. </p><p>Posada-Hernandez's criminal history includes 15 prior charges, including simple assault, domestic violence, obstruction of police, possession of a weapon, drug possession and aggravated assault. </p><p>He first entered the country Jan. 2, 2008, and has been deported four different times, most recently in 2020. It was unclear when he reentered the U.S. for a fifth time, DHS said. </p>",https://www.foxnews.com/us/veteran-83-shoved-onto-nyc-subway-tracks-dies-from-injuries-illegal-migrant-charged-murder,2026-03-26
19,"Pirates ace Paul Skenes has nightmare opening day start vs Mets, leaves before first inning ends","<p><a href=""https://www.foxnews.com/category/sports/mlb/pittsburgh-pirates"" rel=""noopener"" target=""_blank"">Pittsburgh Pirates</a> ace Paul Skenes, the reigning NL Cy Young Award winner, couldn't have had a more disastrous start to the 2026 MLB season after not making it out of the first inning against the New York Mets.</p><p>Pirates manager Don Kelly took a stroll out to the Citi Field mound to pull Skenes after <a href=""https://www.foxnews.com/category/sports/mlb/new-york-mets"" rel=""noopener"" target=""_blank"">the Mets</a> put together a five-run first inning that wasn't all on the phenom right-hander.</p><p>But some soft contact, inconsistent accuracy, and two bad plays in center field by O'Neil Cruz had Skenes’ final line read just two-thirds of an inning, five runs allowed on four hits and two walks, and he’ll have to look at an inflated 67.50 ERA to start the year on the wrong foot. </p><p><a href=""https://www.foxnews.com/sports"" rel=""noopener"" target=""_blank""><strong>CLICK HERE FOR MORE SPORTS COVERAGE ON FOXNEWS.COM</strong></a></p><p>The five runs earned tied a career high allowed for Skenes, who found himself in early trouble when Juan Soto’s single allowed Francisco Lindor, who walked to start the bottom of the first inning, to get to third base. </p><p>With runners on the corners, Bo Bichette’s first at-bat with the Mets wound up a sacrifice fly to get New York on the board, making it a 2-1 ball game. </p><p><a href=""https://www.foxnews.com/sports/mlb-star-paul-skenes-set-rep-team-usa-world-baseball-classic-i-love-america"" rel=""noopener"" target=""_blank""><strong>MLB STAR PAUL SKENES SET TO REP TEAM USA AT WORLD BASEBALL CLASSIC: ‘I LOVE AMERICA’</strong></a></p><p>Things started to unravel for Skenes after that. Jorge Polanco’s first Mets at-bat was a swinging bunt, as he reached first base with no throw. Then, after a hard-fought at-bat by Luis Robert Jr. ended with a walk, Skenes found the bases loaded and one out. </p><p>Brett Baty came to the plate for the Mets with the opportunity to take the lead with a base knock, not just tie the game at two apiece. He caught a changeup from Skenes and hit it hard to center field, but the ball appeared playable for Cruz. </p><p>That is until Cruz’s first step was in, and he stopped moving, as he looked up into the sky. When he realized his error, he started to sprint backwards and the ball landed over his head and rolled to the deep center field wall. The misplay allowed all three Mets baserunners to score, making it a 5-2 game as Skenes looked exasperated on the mound. </p><p>The next at-bat was Marcus Semien who, like his other new teammates in blue and orange, got a timely hit, but it should've been caught if not for Cruz's second blunder. He lost the pop up to center field in the sun, fighting it with his glove before the ball landed next to him, as Baty scored from third to make it 5-2.</p><p>Skenes would last only two more batters, hitting catcher Francisco Alvarez in the arm. Kelly came out of the dugout after that, pulling his ace after 37 pitches. </p><p>During an in-game interview with NBC, he said the early exit was ""pitch count related,"" as it isn’t very rare for a single frame to get higher than 30 pitches. Being that it’s the start of the season, and Skenes had a full workload during the World Baseball Classic, which saw him over 70 pitches in his semifinal start against the Dominican Republic, the Pirates made sure to be cautious.</p><p>The 23-year-old Skenes came into this season with a career 1.96 ERA across 55 starts for the Pirates (320.2 innings), as he’s quickly asserted himself among the best pitchers in the game. </p><p>But even the best have their off days, and a combination of all the things that could go wrong resulted in an opening day start to forget in Queens.</p><p><i><strong>Follow Fox News Digital’s</strong></i><a href=""https://twitter.com/FoxNewsSports_"" rel=""noopener"" target=""_blank""><i><strong> sports coverage on X</strong></i></a><i><strong> and subscribe to</strong></i><a href=""https://www.foxnews.com/newsletters"" rel=""noopener"" target=""_blank""><i><strong> the Fox News Sports Huddle newsletter</strong></i></a><i><strong>.</strong></i></p>",https://www.foxnews.com/sports/pirates-ace-paul-skenes-has-nightmare-opening-day-start-vs-mets-leaves-before-first-inning-ends,2026-03-26
20,Stephen A Smith tells progressive left to ‘shut the hell up’ over voter ID laws,"<p>Stephen A. Smith said Americans should support voter ID laws while criticizing both the progressive left and political leaders, including President Donald Trump and California Gov. Gavin Newsom, during his broadcast of ""<a href=""https://youtu.be/9f9BbLkS-b8?si=xER5cxNVD7ul9786"" rel=""nofollow noopener"" target=""_blank"">Straight Shooter</a>"" on SiriusXM Wednesday.</p><p>""Let me state for the record, you should have a damn ID,"" Smith said. ""I have no problem with the demand for an ID to vote. You need an ID for every damn thing else.</p><p>""To the progressive left, shut the hell up.""</p><p><a href=""https://www.foxnews.com/media/stephen-a-smith-stunned-after-rep-kevin-kiley-educates-california-voter-id-ban"" rel=""noopener"" target=""_blank""><strong>STEPHEN A SMITH STUNNED AFTER REP KEVIN KILEY EDUCATES HIM ON CALIFORNIA VOTER ID BAN</strong></a></p><p>The remarks come as the House of Representatives has already passed the <a href=""https://www.foxnews.com/category/politics/senate/bills"" rel=""noopener"" target=""_blank"">Safeguard American Voter Eligibility (SAVE) Act</a>, a Republican-backed proposal that would require proof of U.S. citizenship to register and vote in federal elections. The Senate is debating and offering amendments to the legislation. </p><p>Smith pointed to what he described as inconsistencies in how identification requirements are applied in daily life compared to voting, referencing local policies that require multiple forms of ID for routine activities.</p><p>""You got a mayor in <a href=""https://www.foxnews.com/category/us/new-york-city"" rel=""noopener"" target=""_blank"">New York City</a> that required two IDs for you to shovel snow,"" Smith noted.</p><p><a href=""https://www.foxnews.com/media/whoopi-goldbergs-voter-id-claim-draws-correction-from-co-hosts-during-save-act-discussion"" rel=""noopener"" target=""_blank""><strong>WHOOPI GOLDBERG'S VOTER ID CLAIM DRAWS CORRECTION FROM CO-HOSTS DURING SAVE ACT DISCUSSION</strong></a></p><p>Mayor <a href=""https://www.foxnews.com/category/person/zohran-mamdani"" rel=""noopener"" target=""_blank"">Zohran Mamdani</a> did not respond to Fox News Digital's request for comment.</p><p>""You ain’t in no position to be b------- about how he wants IDs and the GOP wants IDs for votes. Shut up. Nobody wants to hear that,"" Smith said.</p><p>Smith also raised concerns about how some voter ID proposals are structured, arguing that requiring multiple forms of identification beyond commonly held documents can be excessive.</p><p>""When even a Real ID or a driver’s license or a Social Security card ain’t enough … and if you show up and present your passport, even then they want a second form of ID,"" Smith noted.</p><p><a href=""https://www.foxnews.com/politics/house-conservatives-erupt-over-senate-gop-white-house-deal-amid-save-act-fight"" rel=""noopener"" target=""_blank""><strong>HOUSE CONSERVATIVES ERUPT OVER SENATE GOP, WHITE HOUSE DEAL AMID SAVE ACT FIGHT</strong></a></p><p>He cited what he described as minimal instances of voter fraud, referencing election data from Utah to argue the issue is often overstated in political messaging.</p><p>""They found one illegitimate vote out of 2 million. … You know it’s not a problem. It’s exaggerated. It’s embellished,"" Smith claimed.</p><p>The commentary went beyond elections when Smith addressed global tensions and their economic impact, including rising energy costs tied to instability in the Middle East.</p><p>""And now we got the war in Iran. ... Oil prices have risen,"" Smith said. ""In the state of California, it’s approaching $6 a gallon. That’s not just because of this, that’s damn sure because of Gavin Newsom and the local government."" </p><p>Smith also raised concerns about federal spending and the national debt, criticizing leaders in Washington for high deficits. He then turned his focus to President Donald Trump, questioning previous campaign promises related to foreign policy and economic outcomes as conflicts abroad continue.</p><p><a href=""https://www.foxnews.com/media"" rel=""noopener"" target=""_blank""><strong><u>CLICK HERE FOR MORE COVERAGE OF MEDIA AND CULTURE</u></strong></a></p><p>""And no matter how bad the Democrats and the Republicans are, nobody at this moment in time is worse than President Trump,"" Smith continued. ""I thought you were that dude.""</p><p>Smith also challenged claims about tariff-driven revenue and economic gains.</p><p>""Where’s the evidence? Where’s these trillions of dollars that were supposed to come pouring into the United States of America?"" Smith asked. ""If folks roll up on Capitol Hill … don’t say I didn’t warn you,"" Smith said.</p><p>Fox News Digital reached out to the White House and Newsom's office for comment.</p>",https://www.foxnews.com/media/stephen-smith-tells-progressive-left-shut-hell-up-over-voter-id-laws,2026-03-26
21,Heather Graham slams ‘awkward’ new reality of Hollywood sex scenes,"<p><a href=""https://www.foxnews.com/category/person/heather-graham"" rel=""noopener"" target=""_blank"">Heather Graham</a> shared mixed feelings about Hollywood's ""awkward"" new approach to filming sex scenes.</p><p>Graham opened up about working with intimacy coordinators in the wake of the #MeToo Movement.</p><p>""I think the MeToo movement was amazing [and] I think there is a very good intention behind intimacy coordinators. But it is odd when you come up without having them, and suddenly there’s this random person in the room just staring at you when you’re, like, pretending you have sex,"" she told <a href=""https://www.usmagazine.com/celebrity-news/news/heather-graham-says-intimacy-coordinators-can-be-awkward/"" rel=""nofollow noopener"" target=""_blank"">Us Weekly</a>. ""It's kind of awkward.""</p><p>""I know that they have a beautiful intention, and they really want to help and protect actors,"" Graham continued. ""But as the actor, sometimes I’m like, ‘Can you just get all these people out of the room?’""</p><p><a href=""https://www.foxnews.com/entertainment/fran-drescher-says-feared-hollywood-blacklist-after-taking-industry-power-players"" rel=""noopener"" target=""_blank""><strong>FRAN DRESCHER SAYS SHE FEARED HOLLYWOOD ‘BLACKLIST’ AFTER TAKING ON INDUSTRY POWER PLAYERS</strong></a></p><p>Graham, who starred in <a href=""https://www.foxnews.com/entertainment/heather-graham-defied-familys-religious-beliefs-do-nude-scene-boogie-nights"" rel=""noopener"" target=""_blank"">""Boogie Nights,""</a> slammed the ""confusing"" new reality of filming sex scenes. She recalled a moment on set when she felt an intimacy coordinator overstepped.</p><p>""One time, I had an intimacy coordinator, and they started directing me on, like, how to have sex in a scene,"" Graham remembered. ""They were like, ‘When you do this, you can do this.’ And I was like, ‘You’re not the director, OK? I’m not asking for notes on how to have sex in the scene.'""</p><p>""I just felt, like, ‘Shut up,’"" she added. ""I’m like, ‘You can just tell this to the director… because I don’t want to have two different people directing me.’ It’s confusing.""</p><p><a href=""https://www.foxnews.com/entertainment"" rel=""noopener"" target=""_blank""><strong>LIKE WHAT YOU’RE READING? CLICK HERE FOR MORE ENTERTAINMENT NEWS</strong></a></p><p>Graham said there was also a time when she felt she had to protect an intimacy coordinator while filming a particularly intense horror scene.</p><p>""I just did this other horror movie, and there was this adorable intimacy coordinator. She was in her 20s, super sweet. We were doing this scary scene, and I felt like I had to take care of her,"" she noted. ""She’s like, ‘This is really disturbing.’ And I’m like, ‘I know, I’m sorry,’"" she added with a laugh. ""It’s kind of awkward.""</p><p><a href=""https://www.foxnews.com/newsletters?cmpid=fnfirstnl"" rel=""noopener"" target=""_blank""><strong>CLICK HERE TO SIGN UP FOR THE ENTERTAINMENT NEWSLETTER</strong></a></p><p>Graham began her career with small roles in commercials and TV before landing teen films such as ""License to Drive"" and ""Drugstore Cowboy.""</p><p>She saw her breakthrough with ""Boogie Nights,"" ""Austin Powers: The Spy Who Shagged Me"" and ""Bowfinger.""</p><p>Graham landed a role in the blockbuster film ""The Hangover"" in 2009. She has since continued acting in films and TV while also expanding into writing and directing projects. Her latest film, ""They Will Kill You,"" will be released on March 27.</p><p>The ""Killing Me Softly"" star explained she feels confident enough after a decades-long career to not need the help of an <a href=""https://www.foxnews.com/entertainment/florence-pugh-completely-inappropriate-requests-sex-scenes-movie-sets"" rel=""noopener"" target=""_blank"">intimacy coordinator.</a></p><p>""It might be better if you’re younger and don’t know how to stand for yourself and speak up for yourself,"" the 56-year-old actress said. ""At this point, I feel like I’m strong enough.""</p><p>""So I just don’t want a lot of extra people in the room.""</p>",https://www.foxnews.com/entertainment/heather-graham-slams-awkward-new-reality-hollywood-sex-scenes,2026-03-26
22,"Dementia risk signals could lie in simple blood pressure readings, researchers say","<p>Simple measurements taken during routine <a href=""https://www.foxnews.com/category/health/heart-health/high-blood-pressure"" rel=""noopener"" target=""_blank"">blood pressure checks</a> could predict dementia risk years before symptoms appear.</p><p>That's according to new research presented this week at the American College of Cardiology’s Annual Scientific Session in Louisiana.</p><p>The findings draw on two studies led by researchers at Georgetown University, which suggest that monitoring how blood vessels age and stiffen over time can provide a window into future <a href=""https://www.foxnews.com/category/health/brain-health"" rel=""noopener"" target=""_blank"">cognitive health</a>.</p><p><a href=""https://www.foxnews.com/health/lurking-dementia-risk-exposed-breakthrough-test-25-years-before-symptoms"" rel=""noopener"" target=""_blank""><strong>LURKING DEMENTIA RISK EXPOSED BY BREAKTHROUGH TEST 25 YEARS BEFORE SYMPTOMS</strong></a></p><p>Data shows rates of dementia and aging-related cognitive decline are expected to increase as populations age, and half of U.S. adults have high blood pressure (hypertension).</p><p>Scientists believe that efforts to better address hypertension, a key contributor to <a href=""https://www.foxnews.com/category/health/heart-health"" rel=""noopener"" target=""_blank"">heart disease</a> and a risk factor for dementia, could affect both cardiac and brain health.</p><p>""Blood pressure management isn’t just about preventing heart attacks <a href=""https://www.foxnews.com/category/health/nervous-system-health/stroke"" rel=""noopener"" target=""_blank"">and strokes</a>; it may also be one of the most actionable strategies for preserving cognitive health,"" Dr. Newton Nyirenda, the study's lead author and an epidemiologist at Georgetown University in Washington, said in a press release.</p><p>The research focused on two metrics, the pulse pressure-heart rate index and estimated pulse wave velocity. Both were calculated using data collected during standard <a href=""https://www.foxnews.com/category/health/health-care"" rel=""noopener"" target=""_blank"">doctor visits</a>, such as heart rate, age and blood pressure.</p><p>Researchers examined five years of data patterns for more than 8,500 people in the SPRINT trial, a large study of adults 50 years and older with hypertension. In the follow-up, 323 of the participants developed probable dementia.</p><p><a href=""https://www.foxnews.com/health/little-known-disorder-could-quadruple-your-dementia-risk-new-study-warns"" rel=""noopener"" target=""_blank""><strong>HIDDEN BRAIN CONDITION MAY QUADRUPLE DEMENTIA RISK IN OLDER ADULTS, STUDY SUGGESTS</strong></a></p><p>In one study, the team found the pulse pressure-heart rate index was a strong independent predictor of dementia risk in adults over 50. For participants under 65, every one-unit increase was associated with a 76% higher risk of developing dementia.</p><p>The second study found that adults with consistently elevated or rapidly increasing pulse wave velocity were more likely to develop dementia than those with stable velocity, even after accounting for factors like smoking, gender and cardiovascular history.</p><p><a href=""http://www.foxnews.com/health"" rel=""noopener"" target=""_blank""><strong><u>CLICK HERE FOR MORE HEALTH STORIES</u></strong></a></p><p>""Our findings suggest that vascular aging patterns may provide <a href=""https://www.foxnews.com/category/health/medical-research"" rel=""noopener"" target=""_blank"">meaningful insight</a> into future dementia risk,"" said Nyirenda. ""This reinforces the idea that managing vascular health earlier in life may influence long-term brain health.""</p><p><a href=""https://www.foxnews.com/newsletters?cmpid=fnfirstnl"" rel=""noopener"" target=""_blank""><strong><u>CLICK HERE TO SIGN UP FOR OUR HEALTH NEWSLETTER</u></strong></a></p><p>The team emphasized that clinicians should tailor risk assessments and treatment strategies to the individual.</p><p>""You don’t want to wait until a patient starts manifesting cognitive decline before you act,"" said senior study author Sula Mazimba, an associate professor at the University of Virginia.</p><p>Researchers noted the study could not establish causation. Other limitations included the fact that participants already <a href=""https://www.foxnews.com/category/health/heart-health/high-blood-pressure"" rel=""noopener"" target=""_blank"">had hypertension</a> and elevated cardiovascular risk, meaning the findings may not apply to people without those conditions.</p><p><a href=""https://www.foxnews.com/category/lifestyle/quizzes"" rel=""noopener"" target=""_blank""><strong><u>TEST YOURSELF WITH OUR LATEST LIFESTYLE QUIZ</u></strong></a></p><p>Further studies are needed to confirm these findings and to determine whether improving blood vessel health over time could reduce dementia risk.</p>",https://www.foxnews.com/health/dementia-risk-signals-could-lie-simple-blood-pressure-readings-say-researchers,2026-03-26
