,title,text,link,publish_date
15,AI needs more power: Offices could be the answer,"<p>If your office cranks up the AC on a hot afternoon, you are part of a much bigger story. <a href=""https://www.foxnews.com/category/energy"" rel=""noopener"" target=""_blank"">Energy demand</a> is climbing fast. Data centers and AI systems are using more electricity than ever. At the same time, extreme weather is putting added <a href=""https://www.foxnews.com/category/us/infrastructure-across-america"" rel=""noopener"" target=""_blank"">stress on the grid.</a> That pressure has utilities looking for relief in an unexpected place. Not a new plant. Not a massive battery installation. Instead, they are turning to buildings that already exist. A Seattle startup called Edo is betting your office can help keep the lights on.</p><p><strong>Sign up for my FREE CyberGuy Report</strong><br />Get my best tech tips, urgent security alerts, and exclusive deals delivered straight to your inbox. For simple, real-world ways to spot scams early and stay protected, <strong>visit </strong><i><strong>CyberGuy.com</strong></i><strong> -  trusted by millions who watch CyberGuy on TV daily</strong>. Plus, you’ll get instant access to my <i>Ultimate Scam Survival Guide</i> free when you join. </p><p><a href=""https://www.foxnews.com/politics/basic-monthly-bill-americans-cant-dodge-becoming-midterm-flashpoint"" rel=""noopener"" target=""_blank""><strong>A BASIC MONTHLY BILL AMERICANS CAN’T DODGE IS BECOMING A MIDTERM FLASH POINT</strong></a><br /> </p><p>A virtual power plant, often called a VPP, connects many buildings and devices so they can act like one coordinated energy resource. Instead of generating new electricity, these systems adjust when and how energy gets used.</p><p>Here is the idea in plain terms. When demand spikes, a building can temporarily reduce non-essential power use. That might mean cooling a space earlier in the day or delaying equipment that does not need to run right away. Across thousands of buildings, those small shifts add up quickly.</p><p>Edo focuses on commercial buildings, which make up a large share of U.S. electricity use. The company installs technology that connects to existing building systems like HVAC, batteries, solar and <a href=""https://www.foxnews.com/category/auto/attributes/electric"" rel=""noopener"" target=""_blank"">EV charging.</a> It links these systems through standard communication protocols and manages them from a central platform. That allows everything to work together instead of operating in silos. Edo then maps out where energy is being used and when. From there, building operators get a clearer picture of what can be adjusted without disrupting daily operations.</p><p>For example:</p><p>These changes happen with coordination, not guesswork. Utilities can then tap into that flexibility when demand spikes.</p><p><a href=""https://www.foxnews.com/politics/ny-house-gop-launches-pressure-campaign-hochul-scrap-climate-law-over-soaring-energy-costs"" rel=""noopener"" target=""_blank""><strong>NY HOUSE GOP LAUNCHES PRESSURE CAMPAIGN ON HOCHUL TO SCRAP CLIMATE LAW OVER SOARING ENERGY COSTS</strong></a><br /> </p><p>This approach solves a real problem. When demand surges, utilities usually face tough choices. They can build new power plants, install large-scale batteries or reduce power through blackouts. All of those options come with high costs or major disruptions. Virtual power plants offer another path. They reduce strain on the grid without building new infrastructure. According to the U.S. Department of Energy, VPPs could provide up to 160 gigawatts of flexible capacity by 2030 if adoption ramps up.</p><p>Virtual power plants have been around for years, mostly in residential settings. Companies <a href=""https://www.foxnews.com/category/auto/make/tesla"" rel=""noopener"" target=""_blank"">like Tesla,</a> Sunrun and EnergyHub already connect home batteries and smart devices.</p><p>At the same time, firms like Voltus and CPower Energy focus on large industrial users. Commercial buildings, however, have been largely overlooked. That is where Edo sees opportunity.</p><p>AI is not just a software story. It is an energy story. Massive data centers require huge amounts of electricity. As more companies adopt <a href=""https://www.foxnews.com/category/tech/artificial-intelligence"" rel=""noopener"" target=""_blank"">AI tools,</a> demand will continue to rise.</p><p>That makes flexible energy strategies more important than ever. Instead of racing to build new plants, utilities are rethinking how existing power gets used. Virtual power plants are becoming part of that solution.</p><p><strong>Take my quiz: How safe is your online security?</strong></p><p>Think your devices and data are truly protected? Take this quick quiz to see where your digital habits stand. From passwords to Wi-Fi settings, you’ll get a personalized breakdown of what you’re doing right and what needs improvement. Take my Quiz here: <i><strong><u>Cyberguy.com.</u></strong></i></p><p><a href=""https://www.foxnews.com/media/oil-ceo-urges-newsom-do-math-california-governor-vows-stop-offshore-drilling"" rel=""noopener"" target=""_blank""><strong>OIL CEO URGES NEWSOM TO DO THE 'MATH' AS CALIFORNIA GOVERNOR VOWS TO STOP OFFSHORE DRILLING</strong></a><br /> </p><p>Office buildings are already being used to support the grid. Companies like Edo are working with thousands of properties to adjust energy use in real time when demand spikes. What makes this shift important is how quickly it can scale. Instead of waiting years for new infrastructure, utilities can tap into systems that already exist. As AI demand grows and energy pressure builds, that flexibility could become one of the most practical tools available.</p><p>As AI drives up electricity demand, who should take the lead in keeping the grid stable: utilities or the companies using the most power? Let us know by writing to us at <i><strong><u>Cyberguy.com.</u></strong></i></p><p><strong>Sign up for my FREE CyberGuy Report</strong><br />Get my best tech tips, urgent security alerts, and exclusive deals delivered straight to your inbox. For simple, real-world ways to spot scams early and stay protected, <strong>visit </strong><i><strong>CyberGuy.com</strong></i><strong> - trusted by millions who watch CyberGuy on TV daily</strong>. Plus, you’ll get instant access to my <i>Ultimate Scam Survival Guide</i> free when you join.</p><p>Copyright 2026 CyberGuy.com.  All rights reserved.</p>",https://www.foxnews.com/tech/ai-needs-more-power-offices-could-answer,2026-04-06
16,Angels’ Mike Trout calls out Mariners' risky strategy after getting hit by pitch,"<p>Los Angeles Angels star <a href=""https://www.foxnews.com/category/person/mike-trout"" rel=""noopener"" target=""_blank"">Mike Trout</a> was hit by a pitch in Sunday’s game against the Seattle Mariners and was forced to leave, sparking fears from fans that he will have to miss time.</p><p>Fortunately, for Trout and Angels fans, Los Angeles manager Kurt Suzuki said after the game that X-rays were negative, and he was going to be day-to-day. Trout said he was worried there was damage because of how swollen his wrist got, but added he was ""relieved"" it was not broken.</p><p><a href=""https://www.foxnews.com/sports"" rel=""noopener"" target=""_blank""><strong>CLICK HERE FOR MORE SPORTS COVERAGE ON FOXNEWS.COM</strong></a></p><p>Trout did express some frustration with Mariners pitcher Casey Legumina.</p><p>Legumina threw the 94 mph fastball that hit Trout. The 11-time All-Star and three-time MVP was also hit by a pitch in Friday’s game from Bryan Woo’s sinker.</p><p>Trout said the Mariners pitchers need to locate the zone better if they were going to continue to throw inside.</p><p>""We know where they're trying to get me out, fastballs up and in, so it's just frustrating,"" Trout said, <a href=""https://www.mlb.com/news/mike-trout-exits-after-hit-by-pitch-on-hand"" rel=""noopener nofollow"" target=""_blank"">via MLB.com</a>. ""You know, if you can't control it up there, you shouldn't do it. So it is what it is.""</p><p><a href=""https://www.foxnews.com/sports/mike-trout-gives-35-million-reason-why-he-not-play-team-usa-world-baseball-classic"" rel=""noopener"" target=""_blank""><strong>MIKE TROUT GIVES THE $35 MILLION REASON WHY HE WILL NOT PLAY FOR TEAM USA IN WORLD BASEBALL CLASSIC</strong></a></p><p>Suzuki brushed off any notion there were bubbling tensions between the two clubs.</p><p>""Balls slip,"" the first-year manager said. ""<a href=""https://www.foxnews.com/category/sports/mlb/los-angeles-angels"" rel=""noopener"" target=""_blank"">It's baseball</a>. Like I said the other night, it's part of the game. Obviously, you don't want him to get hit. Or see Mike get hurt. But at the same time, you understand, I was a catcher, that they’re trying to get guys out.""</p><p>The Angels won the game, 8-7, in 11 innings.</p><p>Since 2021, Trout has been a bit of a <a href=""https://www.foxnews.com/category/sports/injuries"" rel=""noopener"" target=""_blank"">mainstay on the injured list</a>. He’s only played more than 100 games twice since then and only at least 130 games once – last season.</p><p>Through 10 games this year, Trout is batting .212 with two home runs and three RBI.</p><p><i>The Associated Press contributed to this report.</i></p><p><i><strong>Follow Fox News Digital’s</strong></i><a href=""https://twitter.com/FoxNewsSports_"" rel=""noopener noreferrer nofollow"" target=""_blank""><i><strong> </strong></i></a><a href=""https://twitter.com/FoxNewsSports_"" rel=""noopener"" target=""_blank""><i><strong><u>sports coverage on X</u></strong></i></a><i><strong> and subscribe to</strong></i><a href=""https://www.foxnews.com/newsletters"" rel=""noopener"" target=""_blank""><i><strong><u> the Fox News Sports Huddle newsletter</u></strong></i></a><i><strong>.</strong></i></p>",https://www.foxnews.com/sports/angels-mike-trout-calls-mariners-risky-strategy-getting-hit-pitch,2026-04-06
17,Construction crew unearths surprising 300-year-old cannon while digging in historic city,"<p>Construction workers in the <a href=""https://www.foxnews.com/travel"" rel=""noopener"" target=""_blank"">United Kingdom</a> recently unearthed a 300-year-old cannon during a routine day on the job.</p><p>The find was made during work in Kingston upon Hull, a city in East Yorkshire, according to an announcement earlier this year from the Hull City Council.</p><p>After the cannon was found, archaeologists from Humber Field Archaeology, a unit of Hull City Council, examined it. </p><p><a href=""https://www.foxnews.com/travel/worlds-largest-medieval-cargo-ship-emerges-from-its-underwater-grave-off-one-countrys-coast"" rel=""noopener"" target=""_blank""><strong>WORLD'S LARGEST MEDIEVAL CARGO SHIP EMERGES FROM ITS UNDERWATER GRAVE OFF ONE COUNTRY'S COAST</strong></a></p><p>The <a href=""https://www.foxnews.com/category/science/archaeology/history"" rel=""noopener"" target=""_blank"">cast-iron cannon</a> likely dates to the late 17th century or early 18th century. </p><p>The artifact measures nearly nine feet long and weighs over a ton, officials said.</p><p>""Initial observations indicate the cannon had been decommissioned, with the nozzle deliberately capped,"" the announcement said. </p><p>""<a href=""https://www.foxnews.com/category/science/archaeology"" rel=""noopener"" target=""_blank"">Archaeologists believe</a> it was likely repurposed as a mooring post, a common practice in the late 19th and early 20th centuries, before being pushed into the dock area prior to it being infilled in the 1930s,"" the council noted.</p><p>Pictures show the iron cannon heavily encrusted with dirt and corrosion after being unearthed at the site.</p><p><a href=""https://www.foxnews.com/category/lifestyle/quizzes"" rel=""noopener"" target=""_blank""><strong><u>TEST YOURSELF WITH OUR LATEST LIFESTYLE QUIZ</u></strong></a></p><p>The discovery was ""very unexpected,"" said Peter Connelly, archaeology manager for Humber Field Archaeology.</p><p>Connelly told Fox News Digital the contractors ""certainly weren’t expecting a cannon to turn up"" — and didn't even realize it was a cannon at first.</p><p>""The archaeologists weren't expecting it because they knew that the deposit being dug into was dock backfill,"" he said.</p><p>He observed, ""This discovery just goes to show that people will deposit anything in a conveniently large hole in the ground when it is being backfilled.""</p><p><a href=""https://www.foxnews.com/newsletters?cmpid=fnfirstnl"" rel=""noopener"" target=""_blank""><strong><u>CLICK HERE TO SIGN UP FOR OUR LIFESTYLE NEWSLETTER</u></strong></a></p><p>While such finds are not unheard of, Connelly described the find as ""definitely very rare.""</p><p>Hull archaeologists previously found a Henry VIII-era cannon in the late 1990s, as well as a fragment of a cannon from just before the <a href=""https://www.foxnews.com/category/us/military"" rel=""noopener"" target=""_blank"">English Civil War</a>.</p><p>""This new cannon discovery is <a href=""https://www.foxnews.com/category/odd-news"" rel=""noopener"" target=""_blank"">only the third of its kind</a> in 30 years,"" said Connelly.</p><p>Archaeologists were instead expecting typical 20th-century ""domestic refuse,"" he added, as well as the ""occasional accidental loss.""</p><p><a href=""https://www.foxnews.com/lifestyle"" rel=""noopener"" target=""_blank""><strong><u>CLICK HERE FOR MORE LIFESTYLE STORIES</u></strong></a></p><p>""For example, a complete late 19th century glass decanter was recovered from the dock backfill — somebody was probably quite upset when they lost this,"" Connelly recalled.</p><p>The archaeologist said the cannon showed clear signs of being deliberately decommissioned before being reused.</p><p>""After the dock fell out of use, and as it was being backfilled and converted to a garden, this mooring post no longer had a function and the cannon was tipped with the backfill,"" he said.</p><p>Researchers will analyze the cannon to see whether it was made in Hull, as the city had its own cannon makers in the <a href=""https://www.foxnews.com/travel/lost-18th-century-spanish-mission-unearthed-decades-searching-offers-rare-snapshot"" rel=""noopener"" target=""_blank"">late 18th century</a>.</p><p>""Further work is still to be carried out on the cannon to focus on when exactly it was cast, where it was made and hopefully find out who made it,"" Connelly said.</p>",https://www.foxnews.com/travel/construction-crew-unearths-surprising-300-year-old-cannon-digging-historic-city,2026-04-06
18,King Charles sparks backlash from UK Christians by not delivering an Easter message this year,"<p>U.K. Christians are shocked by <a href=""https://www.foxnews.com/category/person/king-charles-iii"" rel=""noopener"" target=""_blank"">King Charles</a> opting to not give an Easter message, according to experts.</p><p>Buckingham Palace previously confirmed that Charles would not be giving an Easter message. The palace told GB News that an Easter message from the monarch is not an annual statement, like the Christmas message.</p><p>It is expected that Charles's silence would upset some Christians as he wished Islamic practicing people a ""blessed and happy Ramadan"" on <a href=""https://https://www.instagram.com/p/DU3tEpHDoEE/?utm_source=ig_web_copy_link&amp;igsh=NTc4MTIwNjQ2YQ=="" rel=""noopener nofollow"" target=""_blank"">social media</a> in February.</p><p>""This came as a shock to most U.K. Christians here in the United Kingdom… we expect a message from the Monarch,"" Neil Sean, a royal commentator, told Fox News Digital.</p><p><a href=""https://www.foxnews.com/entertainment/former-prince-andrews-daughters-wont-attend-easter-service-york-brand-deemed-toxic-expert"" rel=""noopener"" target=""_blank""><strong>FORMER PRINCE ANDREW’S DAUGHTERS WON’T ATTEND EASTER SERVICE AS ‘YORK BRAND’ DEEMED ‘TOXIC’: EXPERT</strong></a></p><p>He added, ""It’s not clear why he’s decided to not offer a message up, which is why the British people are angry… but more so when he made video contributions filmed inside Royal palaces for Eid and Ramadan."" Sean noted that Charles is being accused in the United Kingdom as being a ""secret Muslim.""</p><p>The Royal Family <a href=""https://www.instagram.com/theroyalfamily/p/DWvaaA_jbfE/?hl=en"" rel=""nofollow noopener"" target=""_blank"">Instagram</a>, however, did share a message in honor of Easter Sunday.</p><p>An image of a cross with ""Happy Easter. He is risen!"" was posted to the Royal Family Instagram page.</p><p>The caption said: ""Wishing you a joyous Easter Sunday to Christians celebrating in the Uk, the Commonwealth and around the world today.""</p><p>Ian Pelham Turner, a royals expert, echoed Sean's sentiments and explained that this was an easy way for Charles to start another scandal overseas.</p><p>""How do you turn a Royal drama into a crisis? Simply do not follow decades of tradition and decide not to write an Easter message even though King Charles is head of the Church and swore an oath at his Coronation to uphold the faith,"" Turner said.</p><p><a href=""https://www.foxnews.com/world/king-charles-address-increasing-pressures-conflict-speech-trump-criticizes-british-pm-iran"" rel=""noopener"" target=""_blank""><strong>KING CHARLES TO ADDRESS 'INCREASING PRESSURES OF CONFLICT' IN SPEECH AS TRUMP CRITICIZES BRITISH PM ON IRAN</strong></a></p><p>""At a time when there are tensions in the country over the further evolution of Islam and the beliefs many believe that Charles is a closet Muslim add on to the fact that the newly ordained Archbishop of Canterbury is the first woman in centuries and this will cause controversy for her to deal with it just leaves William no doubt to fulfill a plan already orchestrated to fill the gap,"" he continued.</p><p>Richard Fitzwilliams, a royal expert, told Fox News Digital that there has never been a royal tradition to put out an Easter message.</p><p>""<a href=""https://www.foxnews.com/category/world/personalities/queen"" rel=""noopener"" target=""_blank"">Queen Elizabeth</a> only gave one Easter message, during the COVID pandemic, which has justly become famous, as it was so beautifully crafted,"" he said. ""The king did give an Easter message last year and a Royal Maundy message in 2024.""</p><p>Fitzwilliams's said that Charles's decision to not give a message is not unusual, however, he believes skipping out on delivering an Easter message is ""a mistake.""</p><p><a href=""https://www.foxnews.com/newsletters?cmpid=fnfirstnl"" rel=""noopener"" target=""_blank""><strong>CLICK HERE TO SIGN UP FOR THE ENTERTAINMENT NEWSLETTER</strong></a></p><p>""The king did give a special message to celebrate Ramadan this year. It would therefore surely have been appropriate to have delivered one for Easter, as the controversy over this is one which could and should have been avoided,"" he noted. ""The king's contribution to <a href=""https://www.foxnews.com/category/faith-values"" rel=""noopener"" target=""_blank"">inter-religious understanding</a> over the years has been considerable, but the absence of a message celebrating the very special significance of this weekend, when one was delivered which celebrated Ramadan earlier in the year, is surely a mistake.""</p><p>Helena Chard, royal broadcaster and photographer, told Fox News Digital that this is just another royal crisis for the monarchy.</p><p><a href=""https://www.foxnews.com/entertainment"" rel=""noopener"" target=""_blank""><strong>LIKE WHAT YOU’RE READING? CLICK HERE FOR MORE ENTERTAINMENT NEWS</strong></a></p><p>""King Charles began releasing Easter messages when he was a Prince. An Easter message has never been set in stone like the yearly Christmas message. He continues a centuries-old Royal tradition, the yearly Royal Maundy tradition where the monarch hands out Maundy Money to recognise those that who have given outstanding service to their communities,"" Chard said.</p><p>She explained that this year's Easter tradition was handled differently. ""This year the Easter tradition was carried out in Asaphs Cathederal in Wales. 77 men and 77 women were given specially minted silver coins symbolising humility, charity and the Monarchs duty to serve others,"" Chard said.</p><p>Chard said that people are sharing too ""many grumbles"" with Charles not delivering an Easter message.</p><p>""I’m surprised there hasn’t been more backlash with Dame Sarah Mullally making history as the first female Archbishop of Canterbury in the Church of England’s 1,400-year history! People are sharing far too many grumbles and conspiracy theories… Love is the way forward,"" she concluded.</p>",https://www.foxnews.com/entertainment/king-charles-sparks-backlash-uk-christians-delivering-easter-message-year,2026-04-06
