,title,text,link,publish_date
4,Chinese fishing 'militia' formations signal rising gray-zone pressure on Taiwan,"<p><strong>KAOHSIUNG, Taiwan: </strong>Last Christmas Eve, satellite tracking and ship-transponder data revealed an unusual maritime event in the East China Sea: thousands of Chinese fishing vessels gathered into tight, linear formations and holding position for extended periods. It happened again two weeks later.</p><p>Analysts from a geospatial analytical firm were the first to identify two large stationary formations involving roughly 1,400 and 2,000 fishing vessels. Cargo ships in the area were forced to reroute or carefully thread between thousands of stationary vessels that had ceased normal fishing activity. This flotilla behavior by Chinese fishing boats, analysts believe, was a ""gray zone"" exercise.</p><p>""There have been proposals by defense experts in the United States that the <a href=""https://www.foxnews.com/category/us/military/navy"" rel=""noopener"" target=""_blank"">U.S. Navy</a> should treat China’s maritime militia as a real naval force,"" Holmes Liao, a defense expert who is currently a senior advisor for the Taiwan Space Agency (TASA), told Fox News Digital.</p><p><a href=""https://www.foxnews.com/world/china-launches-largest-military-drills-taiwan-8-months-live-fire-exercises-caught-camera"" rel=""noopener"" target=""_blank""><strong>CHINA LAUNCHES LARGEST MILITARY DRILLS OFF TAIWAN IN 8 MONTHS WITH LIVE-FIRE EXERCISES CAUGHT ON CAMERA</strong></a></p><p>""I think Taiwan may need to adhere to that mentality and mindset,"" said Liao. ""If these Chinese vessels are operating under clear military direction, then their status under the law of armed conflict could be subject to reassessment, potentially affecting claims of civilian immunity.""</p><p>Liao said that <a href=""https://www.foxnews.com/category/world/world-regions/taiwan"" rel=""noopener"" target=""_blank"">Taiwan should consider</a> deploying surveillance drones or air patrols over maritime militia formations to demonstrate presence and reinforce deterrence. ""Taiwan has so far been very timid in response to PRC aggression,"" said Liao. ""They may be fishing boats, but they are actually under the PLA’s command… part of the maritime militia."" </p><p>Indeed, several editions of the U.S. Department of Defense’s annual ""Military and Security Developments involving the People's Republic of China,"" describe the People’s Armed Forces Maritime Militia (PAFMM) as a ""state-organized, trained, and equipped"" force that actively supports China’s navy and coast guard.</p><p>Analysts at the Center for Strategic and International Studies’ Asia Maritime Transparency Initiative have previously documented swarms of dozens or even hundreds of Chinese vessels in the South China Sea near contested reefs, often remaining stationary for long periods. But the incidents late last year and early this year highlight how the scale of this fishing militia appears to be expanding.</p><p>Fishing vessels are inexpensive, numerous and legally ambiguous. When deployed in mass, they complicate navigation, create radar clutter and raise operational risks for commercial shipping. The civilian status of these boats also conveniently allows Beijing to frame any incidents as ""rogue actions not sanctioned by authorities,"" or as accidents.</p><p><a href=""https://www.foxnews.com/politics/bipartisan-house-china-panel-slams-beijings-taiwan-drills-deliberate-escalation"" rel=""noopener"" target=""_blank""><strong>BIPARTISAN HOUSE CHINA PANEL SLAMS BEIJING’S TAIWAN DRILLS AS ‘DELIBERATE ESCALATION’</strong></a></p><p>The United States frequently cites freedom of navigation as the reason for navy patrols in the Indo-Pacific, with a U.S. State Department <a href=""https://2021-2025.state.gov/wp-content/uploads/2024/02/Indo-Pacific-Strategy-Second-Anniversary-Fact-Sheet.pdf?safe=1"" rel=""nofollow noopener"" target=""_blank"">fact sheet</a> noting that the region ""accounts for 60% of global GDP."" The area around Taiwan is already treated by maritime insurers and shipping firms as a ""higher-risk environment,"" meaning even temporary flotilla formations could influence shipping decisions and significantly affect both <a href=""https://www.foxnews.com/category/world/global-economy/trade"" rel=""noopener"" target=""_blank"">regional and global economies</a>.</p><p>Taipei-based security analyst Sasha Chhabra, however, warned of the risks China would face should it deploy civilian fishing vessels in an active conflict. ""A U.S. Navy convoy could easily break through these lines, and the large commercial vessels that carry Taiwan’s much-needed imports would easily splinter most fishing vessels in a ramming incident.""</p><p>He noted that there is precedent for Beijing using Chinese fisherman as ""live bait"" during a conflict. ""In 1973, China used civilian fishing vessels to bait the South Vietnamese Navy into conflict and seize full control over the Paracels (islands),"" said Chhabra. ""But what worked against teetering South Vietnam in 1973 won’t work against the U.S. Navy."" </p><p>However, for independently ruled Taiwan, the concern could be cumulative pressure rather than a single dramatic incident. Encounters between Taiwanese patrol vessels and Chinese fishing boats have grown more frequent around outlying islands and in parts of the Taiwan Strait, with vessels sometimes operating in coordinated groups that shadow or crowd Taiwanese ships. The maritime militia could also be used as a tool to discourage the global shipping industry from doing business with Taiwan.</p><p>Taiwan’s major ports are the <a href=""https://www.foxnews.com/politics/chinas-energy-siege-taiwan-could-cripple-us-supply-chains-report-warns"" rel=""noopener"" target=""_blank"">energy and industrial lifelines</a> for this de facto independent state. The port of Kaohsiung in the south, for example, handles large volumes of LNG imports and petrochemical shipments. Even partial disruption or perceived instability in surrounding sea lanes could ripple through supply chains and sharply raise costs for the global economy.</p><p>Jason Wang, CEO of ingeniSPACE, the company that revealed the fishing fleets on their satellite systems, told Fox News Digital that despite Taiwan’s semiconductor advantage, China is winning in space. Wang said data fusion and satellite-based maritime awareness are now strategic necessities. ""Intelligence is deterrence without provocation. Intelligence ensures efficient targeted spending and is a force multiplier by shaping a more effective military force,"" he said. ""Taiwan, like all First Island Chain nations, must be prepared for a new kind of warfare.""</p><p>Wang and other experts note that <a href=""https://www.foxnews.com/category/world/world-regions/japan"" rel=""noopener"" target=""_blank"">countries like Japan</a> and South Korea have, for roughly a decade, aggressively augmented their satellite spy constellations with commercial satellites to ""ensure sufficient coverage and revisit rates so that their leadership has the capability to distinguish both overt military and gray zone activity.""</p><p>Analysts say the broader lesson is that sea control no longer depends solely on destroyers and submarines. In the immediate future, the most consequential maritime pressure may come not from warships, but from vessels that look, at first glance, entirely harmless.</p>",https://www.foxnews.com/world/chinese-fishing-militia-formations-signal-rising-gray-zone-pressure-taiwan,2026-03-15
5,Kate Middleton reveals she rarely drinks alcohol after her cancer diagnosis during brewery visit: reports,"<p>Kate Middleton this week admitted she rarely drinks alcohol after her cancer diagnosis two years ago.</p><p>""Since my diagnosis I haven't had much alcohol,"" the Princess of Wales said when offered a pint at Fabal Beerhall while touring <a href=""https://www.foxnews.com/category/lifestyle/drinks/beer"" rel=""noopener"" target=""_blank"">London’s Bermondsey Beer Mile</a> on Thursday, according to several U.K. outlets. ""It's something I have to be a lot more conscious of now.""</p><p>The princess asked owner Hannah Rhodes if the beerhall had any <a href=""https://www.foxnews.com/category/non-alcoholic"" rel=""noopener"" target=""_blank"">non-alcoholic brews</a>.</p><p>""We don’t yet, I’m afraid,"" Rhodes told her, The Independent <a href=""https://www.the-independent.com/news/uk/home-news/kate-middleton-cancer-alcohol-b2937399.html"" rel=""noopener"" target=""_blank"">reported</a>. ""I would love to do that one day, but we would need quite a bit of tech to do it properly.""</p><p><a href=""https://www.foxnews.com/entertainment/prince-william-says-royal-family-blindsided-cancer-pulled-rug-from-under-our-feet-rare-interview"" rel=""noopener"" target=""_blank""><strong>PRINCE WILLIAM SAYS ROYAL FAMILY BLINDSIDED AS CANCER ‘PULLED THE RUG FROM UNDER OUR FEET’ IN RARE INTERVIEW</strong></a></p><p>The 44-year-old drank a soda instead, but said of Prince William, who was touring the breweries with her, ""You like cider,"" according to a reporter from <a href=""https://www.the-sun.com/royals/16076015/princess-kate-cuts-booze-since-cancer-diagnosis/"" rel=""noopener"" target=""_blank"">The Sun</a>.</p><p>""I’m a cider man,"" William agreed, according to <a href=""https://www.eonline.com/news/1429644/kate-middleton-not-drinking-alcohol-after-cancer-diagnosis"" rel=""noopener"" target=""_blank"">E News</a>. ""I like cider. I grew up on cider in the West Country.""</p><p>Middleton revealed in 2024 that <a href=""https://www.foxnews.com/entertainment/kate-middletons-cancer-diagnosis-rekindled-her-marriage-prince-william-expert"" rel=""noopener"" target=""_blank"">she had been diagnosed</a> with an undisclosed type of cancer.</p><p><a href=""https://www.foxnews.com/health/doctors-reveal-what-reasonable-drinking-looks-like-who-should-avoid-alcohol"" rel=""noopener"" target=""_blank""><strong>DOCTORS REVEAL WHAT ‘REASONABLE’ DRINKING LOOKS LIKE — AND WHO SHOULD AVOID ALCOHOL</strong></a></p><p>""In January, I underwent major abdominal surgery in London, and at the time, it was thought that my condition was noncancerous,"" Middleton said in a video in March 2024 following <a href=""https://www.foxnews.com/entertainment/prince-william-kate-middleton-prioritize-family-over-duty-shown-handling-cancer-diagnosis-author"" rel=""noopener"" target=""_blank"">speculation about her health</a>. ""The surgery was successful. However, tests after the operation found cancer had been present. My medical team therefore advised that I should undergo a course of preventive chemotherapy, and I am now in the early stages of that treatment.""</p><p>In January of last year, the princess announced, after finishing her treatment in the fall of 2024, that her cancer was in remission.</p><p><a href=""https://www.foxnews.com/newsletters?cmpid=fnfirstnl"" rel=""noopener"" target=""_blank""><strong>CLICK HERE TO SIGN UP FOR THE ENTERTAINMENT NEWSLETTER</strong></a></p><p><a href=""https://www.instagram.com/p/DVy6ctBDZS-/?hl=en"" rel=""noopener"" target=""_blank""><strong>APP USERS CLICK HERE FOR POST</strong></a></p><p><a href=""https://www.foxnews.com/category/beer"" rel=""noopener"" target=""_blank"">Alcohol is classified as</a> a Group 1 carcinogen, meaning it raises the risk for cancer.</p><p>""You can lower your risk for cancer by drinking less alcohol or not drinking at all,"" the U.S. Centers for Disease Control and Prevention says on its website. ""All drinks that contain alcohol, including red and white wine, beer, and liquor, increase the risk of cancer.""</p><p><a href=""https://www.foxnews.com/entertainment"" rel=""noopener"" target=""_blank""><strong>LIKE WHAT YOU’RE READING? CLICK HERE FOR MORE ENTERTAINMENT NEWS</strong></a></p><p>The CDC says that several cancers are linked to alcohol consumption, including mouth, throat, voice box, esophagus, colon and rectum, liver and breast.</p><p>""Some studies show that drinking three or more drinks that contain alcohol per day increases the risk of stomach and pancreatic cancers,"" the CDC adds. ""Drinking alcohol may also increase <a href=""https://www.foxnews.com/category/health/cancer/prostate-cancer"" rel=""noopener"" target=""_blank"">prostate cancer risk</a>. All kinds of drinks that contain alcohol increase the risk of cancer. Drinking less alcohol is better for your health than drinking more.""</p><p>The royal couple shared a video montage of their day at several breweries on their official Instagram.  </p><p>""Stopping along Bermondsey Beer Mile learning about Southwark’s long history as the centre of London’s beer production and the breweries that keep the tradition alive today,"" they wrote. ""Great to see innovation, craftsmanship and community coming together.""</p>",https://www.foxnews.com/entertainment/kate-middleton-reveals-rarely-drinks-alcohol-after-cancer-diagnosis-brewery-visit,2026-03-15
6,Japan suffers shocking collapse to Venezuela in World Baseball Classic,"<p><a href=""https://www.foxnews.com/category/person/shohei-ohtani"" rel=""noopener"" target=""_blank"">Shohei Ohtani</a> and his Japanese teammates will not repeat as World Baseball Classic champions after falling apart against Venezuela in the quarterfinal round.</p><p>Ohtani’s third home run of the tournament was wasted as Japan saw its 11-game WBC winning streak snapped.</p><p>Wilyer Abreu hit a go-ahead, three-run homer after Maikel Garcia sparked the comeback with a two-run shot, and Venezuela beat the defending champions 8-5 on Saturday night.</p><p>Venezuela reached its first <a href=""https://www.foxnews.com/category/sports/world-baseball-classic"" rel=""noopener"" target=""_blank"">WBC semis</a> since 2009 and clinched a spot in the six-nation field for the 2028 Olympic baseball tournament, along with the United States and the Dominican Republic.</p><p><a href=""https://www.foxnews.com/sports"" rel=""noopener"" target=""_blank""><strong><u>CLICK HERE FOR MORE SPORTS COVERAGE ON FOXNEWS.COM</u></strong></a></p><p>Venezuela will face <a href=""https://www.foxnews.com/category/world/world-regions/italy"" rel=""noopener"" target=""_blank"">unbeaten Italy</a> on Monday, a day after the U.S. plays the Dominicans.</p><p>Abreu gave Venezuela a 7-5 lead when he homered off loser Hiromi Itoh in the sixth, driving a 2-1 four-seam fastball 409 feet to right for his first home run of the tournament. Ezequiel Tovar made it 8-5 in the eighth, leading off with a double then scoring on a throwing error by Atsuki Taneichi on a pickoff attempt.</p><p>Ohtani, the 2023 WBC MVP, led off the bottom of the first by lifting a 2-1 slider from Ranger Suárez 427 feet to center after Ronald Acuña Jr. homered on the second pitch from Yoshinobu Yamamoto, driving a fastball 401 feet to right-center for his second home run of the WBC.</p><p><a href=""https://www.foxnews.com/sports/shohei-ohtani-opens-world-baseball-classic-explosive-grand-slam-japan-annihilates-taiwan"" rel=""noopener"" target=""_blank""><strong>SHOHEI OHTANI OPENS WORLD BASEBALL CLASSIC WITH EXPLOSIVE GRAND SLAM AS JAPAN ANNIHILATES TAIWAN</strong></a></p><p>Enmanuel De Jesus pitched 2 1/3 scoreless innings for the win, and Daniel Palencia got the save, ending Japan’s fate by getting Ohtani to pop out for the final out.</p><p>Japan led 5-2 after a four-run third in which Shota Morishita, who replaced the injured Seiya Suzuki at center field, hit a tiebreaking, three-run homer off Suárez. The veteran left-hander who picked up a win in a group stage game against the Netherlands pitched 2 2/3 innings on Saturday, allowing three hits, five runs and two home runs.</p><p>Garcia homered on the eighth pitch against Chihiro Sumida to pull Venezuela within 5-4 in the fifth.</p><p><a href=""https://www.foxnews.com/category/person/jordan-yamamoto"" rel=""noopener"" target=""_blank"">World Series MVP Yamamoto</a> allowed four hits and two runs while striking out five in four innings.</p><p><i>The Associated Press contributed to this report. </i></p><p><i><strong>Follow Fox News Digital’s </strong></i><a href=""https://twitter.com/FoxNewsSports_"" rel=""nofollow noopener"" target=""_blank""><i><strong><u>sports coverage on X</u></strong></i></a><i><strong>, and subscribe to </strong></i><a href=""https://www.foxnews.com/newsletters"" rel=""noopener"" target=""_blank""><i><strong><u>the Fox News Sports Huddle newsletter</u></strong></i></a><i><strong>.</strong></i></p>",https://www.foxnews.com/sports/venezuela-japan-wbc-quarterfinal-upset,2026-03-15
7,State Department urges Americans to leave Middle East as airspace closures disrupt travel,"<p>The U.S. State Department is urging Americans in the Middle East to leave the region immediately as escalating conflict and widespread airspace closures disrupt travel and evacuation efforts. However, <a href=""https://www.foxnews.com/category/politics/defense/wars/war-with-iran"" rel=""noopener"" target=""_blank"">attacks from Iran</a>, closed embassies and shuttered airspace have created difficulties for Americans who find themselves trapped with few options.</p><p>Shanice Day was one of thousands of Americans who said they found themselves stranded in the Middle East after the conflict began. She and her best friend had traveled to Dubai to celebrate her 30th birthday. </p><p>""We did like a whole desert day,"" Day said, ""They started calling me their ‘habibi,’ and they let me play with the falcon.""</p><p>Once airspace closed, only a limited number of flights began leaving the region as safety allowed.</p><p><a href=""https://www.foxnews.com/sports/state-department-uses-patriots-team-plane-evacuate-americans-middle-east"" rel=""noopener"" target=""_blank""><strong>STATE DEPARTMENT USES PATRIOTS TEAM PLANE TO EVACUATE AMERICANS FROM MIDDLE EAST</strong></a></p><p>Day only had a few days of vacation, before the U.S. and Israel struck <a href=""https://www.foxnews.com/category/world/conflicts/iran"" rel=""noopener"" target=""_blank"">Iran</a> on February 28. Even though the airstrikes began that Saturday morning, Day didn’t realize there was an issue until that afternoon. By the time Day realized what had happened, Iran was already sending missiles towards the Gulf.</p><p>""As soon as I got open my phone, it says like ‘U.S., Israel strikes Iran.’ So, I told my friend that’s back at the hotel, and she’s at the beach at the moment. So, I’m actually like, ‘Hey, have you seen what’s going on?"" Day recounted, ""She explains that she sees like a missile, almost go across the sky.""</p><p>Iran responded to the American and Israeli attacks almost immediately, raining missile and drone strikes across the United Arab Emirates, even hitting Dubai International Airport, one of the busiest in the world. With their return flights canceled as the UAE closed its airspace, Day and her friend scrambled to find a way home while also trying to process the seriousness of the situation.</p><p>""We just kind of cried. That first 48 hours was so tough for us. Just having to break the news to our parents, because it was so early here. To hear my friend’s mom be so devastated, and then to hear my own mom’s voice crack like that. I would not wish this on anyone,"" Day said.</p><p><a href=""https://www.foxnews.com/media/americans-stranded-dubai-face-repeated-flight-cancellations-amid-escalating-middle-east-conflict"" rel=""noopener"" target=""_blank""><strong>AMERICANS STRANDED IN DUBAI FACE REPEATED FLIGHT CANCELLATIONS AMID IRAN ESCALATION</strong></a></p><p>Emirati airspace would continue to open intermittently to limited flights, but every rebooked flight would eventually get canceled. Day and her friend eventually made it home to Houston, Texas, by first flying to Australia.</p><p>Unlike the UAE, which has long marked itself as a safe oasis for foreigners, travel to Israel has always brought the possibility of conflict.</p><p>Jenna Fonberg and Jetlyn Toledo landed at Ben Gurion Airport the day before Israel and the U.S. hit Iran. The friends had planned to celebrate the Jewish holiday of Purim with Fonberg’s older brother, Blake, who lives in Tel Aviv. </p><p>By the time Fonberg and Toledo landed in Israel, there were already talks of a conflict breaking out in the region.</p><p>""The thing about Israel is there’s always talk about war breaking out or always talk about conflict. So, if you cancel every single trip based on, I guess rumors of violence coming, you would essentially never come,"" Toledo said.</p><p>The next day, the trio woke up to sirens telling them to get to the nearest bomb shelter. They said, overtime, they made friends with the familiar faces who repeatedly showed up to the same shelters.</p><p>""There’s a lot of new faces today, because it’s kind of close to the beach, so a lot of people just walking on the boardwalk run in here,"" Fonberg said while taking cover during a missile threat.</p><p>Blake said he lost his home to a strike during a 12-day conflict with Iran in 2025. He said this time, he’s focusing on staying positive.</p><p>""We have to stay positive. If we are not positive, we lose. And, I think I really tried to instill that into them [Fonberg and Toledo] day one. I was like, ‘Everything’s going to be fine,’"" Blake said.</p><p>Throughout the sirens and strikes, the trio said they kept faith that both the U.S. and Israel’s militaries would keep them safe. They said it was most important to stay calm through it all.</p><p>Fonberg and Toledo looked at options to leave the country, but with Israeli airspace completely closed at the start of the conflict, they were left with few options. Instead of driving to another country with open airspace, they chose to wait to see if the skies would open in time for their scheduled flight on March 8.</p><p><a href=""https://www.foxnews.com/politics/state-department-defends-proactive-evacuation-efforts-against-dems-claims-diplomatic-chaos"" rel=""noopener"" target=""_blank""><strong>STATE DEPARTMENT DEFENDS ‘PROACTIVE’ EVACUATION EFFORTS AGAINST DEMS' CLAIMS OF DIPLOMATIC CHAOS</strong></a></p><p>""I feel safer being by a bomb shelter and being able to run in if I need it. Rather than driving 3 hours, 5 hours to Jordan or Egypt and just covering my head if I hear a siren,"" Fonberg said.</p><p>Israeli airspace slowly began opening on March 4. Fonberg and Toledo returned to the U.S. on their originally scheduled flights.</p><p>Ben Suster and his wife were at the end of their honeymoon in Israel when the U.S. and Israel struck Iran. Similar to Fonberg and Toledo, the newlyweds knew there was a possibility of conflict but felt safe in Israel. Suster and his wife landed in the country days before the strikes began.</p><p>""Our flight was for Saturday night. We woke up Saturday morning, and literally we had a minute of peace, and we thought, ‘Oh my goodness,’ like we made it through the night, like we’re in the clear and our flights should be good tonight,"" Suster said.</p><p>The first sirens began moments later.</p><p>Without a bomb shelter inside their Airbnb, the couple made a home out of a nearby public shelter.</p><p>""Obviously, sitting in a gloomy garage was not how we expected to end our honeymoon,"" Suster said.</p><p>They stayed in the garage full-time, before meeting up with friends in another shelter.</p><p>""We spent the entire day and night in this garage, making friends, you know, Israelis making the most of the situation,"" Suster said.</p><p>After a few days, Suster and his wife left Tel Aviv to join their family in Geva Binyamin, an Israeli settlement in the West Bank near Jerusalem. The couple eventually evacuated with the non-profit Grey Bull Rescue. For security reasons, Suster could not share details about the operation. </p><p>""We don’t even know what tomorrow’s going to look like. We were told what the final destination would be, but when that happens, how we’re getting there, not a clue,"" Suster said.</p><p>Similar to Fonberg and Toledo, Suster said he felt safe and was sad to leave. He only left because they were on a time crunch, getting home to Florida in time for his sister’s wedding.</p><p>According to the <a href=""https://www.foxnews.com/category/politics/foreign-policy/state-department"" rel=""noopener"" target=""_blank"">State Department</a>, more than 32,000 Americans have returned to the United States since the U.S. strikes on Iran began on February 28. </p>",https://www.foxnews.com/us/americans-stranded-middle-east-airspace-closures-conflict,2026-03-15
