,title,text,link,publish_date
8,Republicans target Spanberger as ‘Governor Bait and Switch’ in bid to defeat Dems redistricting push,"<p>Former Virginia Attorney General Jason Miyares is taking aim at Democratic Gov. <a href=""https://www.foxnews.com/category/person/abigail-spanberger"" rel=""noopener"" target=""_blank"">Abigail Spanberger</a> as he helps steer Republican efforts to defeat a Democrat-backed congressional redistricting referendum that would create up to four additional left-leaning U.S. House seats ahead of the midterm elections.</p><p>""She told voters in August of 2025 that she had no plans, no intention to do redistricting. And then the very first bill that she signed into law was the enabling legislation for this monstrosity of gerrymandering to go forward,"" Miyares told Fox News Digital on Thursday, as he pointed to Spanberger.</p><p>Miyares’ comments come as early voting is underway in Virginia ahead of an April 21 election on the ballot initiative, which, if passed, would give the Democrat-controlled legislature — rather than the current nonpartisan commission — redistricting power through the 2030 election. It could result in a 10-1 advantage for Democrats in the state’s congressional delegation, up from their current 6-5 edge.</p><p>Republicans call the Democrats' redistricting effort an ""unconstitutional power grab."" Democrats counter that it's a necessary step to balance out partisan gerrymandering already implemented by Republicans in other states under the urging of President <a href=""https://www.foxnews.com/category/person/donald-trump"" rel=""noopener"" target=""_blank"">Donald Trump</a>.</p><p><a href=""https://www.foxnews.com/politics/spanberger-blasted-gerrymandering-backs-amendment-critics-say-could-erase-virginia-gop"" rel=""noopener"" target=""_blank""><strong>SPANBERGER ONCE BLASTED GERRYMANDERING AND NOW BACKS AMENDMENT CRITICS SAY COULD ERASE VIRGINIA GOP</strong></a></p><p>Spanberger, a former CIA officer who served three terms in Congress, won election last year by a larger-than-expected 15-point margin in a state that is usually competitive between Democrats and Republicans.</p><p>But a poll last week from The Washington Post indicated that the new governor's approval rating was barely above water, with the highest unfavorable rating for a <a href=""https://www.foxnews.com/category/us/us-regions/southeast/virginia"" rel=""noopener"" target=""_blank"">new Virginia governor</a> in two decades.</p><p>Miyares, speaking with Fox News Digital, argued that Spanberger ""is the most unpopular governor in modern Virginia political history.""</p><p><a href=""https://www.foxnews.com/politics/obama-endorses-virginia-redistricting-constitutional-amendment-could-help-dems-gain-4-seats"" rel=""noopener"" target=""_blank""><strong>OBAMA ENDORSES VIRGINIA REDISTRICTING CONSTITUTIONAL AMENDMENT THAT COULD HELP DEMS GAIN 4 SEATS</strong></a></p><p>""She's an unpopular governor with an unpopular agenda and she lied to the voters,"" he charged as he pointed to her comments on the gubernatorial campaign trail last year regarding redistricting.</p><p>And in a social media post on Wednesday, Miyares took aim at Spanberger, writing, ""Governor 'Bait and Switch' is what people hate about self serving politicians.""</p><p>Miyares is co-chair for Virginians for Fair Maps, a GOP-aligned group that is working to defeat the redistricting referendum.</p><p>The group is currently running an ad statewide on TV and online that uses a 2019 quote from Spanberger, in which she wrote, ""gerrymandering is detrimental to our democracy.""</p><p>""Trust me, we will be putting your face on a bunch of mailers reminding voters how you lied &amp; previously stated you wouldn’t gerrymander Virginia into oblivion and then promptly did the opposite,"" Miyares wrote in his social media post.</p><p><a href=""https://www.foxnews.com/politics/soros-backed-group-among-liberal-orgs-pumping-eye-popping-virginia-gerrymandering-effort"" rel=""noopener"" target=""_blank""><strong>SOROS-BACKED GROUP AMONG LIBERAL ORGS PUMPING EYE-POPPING CASH INTO VIRGINIA GERRYMANDERING EFFORT</strong></a></p><p>Along with former President <a href=""https://www.foxnews.com/category/person/barack-obama"" rel=""noopener"" target=""_blank"">Barack Obama</a>, Spanberger has become one of the most visible faces in support of the amendment.</p><p>""I'm voting yes on Virginia's redistricting amendment,"" the governor says in an ad by Democratic-aligned Virginians for Fair Elections, the top political group backing the ballot initiative. The group is spending seven figures to run the ad statewide.</p><p>In the spot, Spanberger says she's supporting the referendum because ""it's directly in response to what other states decide to do and a president who says he's quote entitled to more Republican seats before this year's midterms. Our approach is different. It's temporary. It preserves Virginia's fair redistricting process into the future.""</p><p>And Spanberger, in a statement last month, emphasized, ""I supported the formation of Virginia’s bipartisan redistricting commission in 2020, and that support has not changed.""</p><p>Virginia is the latest battleground in the high-stakes fight between Trump and the GOP versus Democrats over congressional redistricting.</p><p><a href=""https://www.foxnews.com/politics/battle-house-runs-through-virginia-court-oks-high-stakes-redistricting-vote"" rel=""noopener"" target=""_blank""><strong>BATTLE FOR THE HOUSE RUNS THROUGH VIRGINIA AS COURT OKS HIGH-STAKES REDISTRICTING VOTE</strong></a></p><p>Aiming to prevent what happened during his first term in the White House when Democrats reclaimed the House majority in the <a href=""https://www.foxnews.com/category/politics/elections/midterm-elections"" rel=""noopener"" target=""_blank"">2018 midterms</a>, Trump last spring first floated the idea of rare, but not unheard of, mid-decade congressional redistricting.</p><p>The mission was simple: redraw congressional district maps in red states to pad the GOP's razor-thin House majority to keep control of the chamber in <a href=""https://www.foxnews.com/elections"" rel=""noopener"" target=""_blank""><u>the midterms</u></a>, when the party in power traditionally faces political headwinds and loses seats.</p><p>Trump's first target was Texas.</p><p>When asked by reporters last summer about his plan to add Republican-leaning House seats across the country, the president said, ""Texas will be the biggest one. And that’ll be five.""</p><p>Republican Gov. <a href=""https://www.foxnews.com/category/person/greg-abbott"" rel=""noopener"" target=""_blank"">Greg Abbott</a> of Texas called a special session of the GOP-dominated state legislature to pass the new map.</p><p>But Democratic state lawmakers, who broke quorum for two weeks as they fled Texas in a bid to delay the passage of the redistricting bill, energized Democrats across the country.</p><p><a href=""https://www.foxnews.com/politics/spanberger-denies-deal-swing-district-democrat-gerrymandering-claims-abound-statewide"" rel=""noopener"" target=""_blank""><strong>SPANBERGER DENIES ‘DEAL’ WITH SWING-DISTRICT DEMOCRAT AS GERRYMANDERING CLAIMS ABOUND STATEWIDE</strong></a></p><p>Among those leading the fight against Trump's redistricting was Democratic Gov. <a href=""https://www.foxnews.com/category/person/gavin-newsom"" rel=""noopener"" target=""_blank"">Gavin Newsom</a> of California.</p><p>California voters in November overwhelmingly passed Proposition 50, a ballot initiative that temporarily sidetracked the left-leaning state's nonpartisan redistricting commission and returned the power to draw the congressional maps to the Democratic-dominated legislature.</p><p>That is expected to result in five more Democratic-leaning congressional districts in California, which aimed to counter the move by Texas to redraw their maps.</p><p>The fight quickly spread beyond Texas and California.</p><p>Republican-controlled Missouri and Ohio, and swing state North Carolina, where the GOP dominates the legislature, have drawn new maps as part of the president's push.</p><p>In blows to Republicans, a Utah district judge late last year rejected a congressional district map drawn up by the state's GOP-dominated legislature and instead approved an alternate that will create a Democratic-leaning district ahead of the midterms.</p><p>Meanwhile, Republicans in Indiana's Senate in December defied Trump, shooting down a redistricting bill that had passed the state House. The showdown in the Indiana statehouse grabbed plenty of national attention.</p><p>Florida's next up.</p><p>Two-term Republican Gov. <a href=""https://www.foxnews.com/category/person/ron-desantis"" rel=""noopener"" target=""_blank"">Ron DeSantis</a> and state lawmakers in the GOP-dominated legislature are hoping to pick up an additional three to five right-leaning seats through a redistricting push during a special legislative session that kicks off on April 20.</p><p>Hovering over the redistricting wars is the <a href=""https://www.foxnews.com/category/politics/judiciary/supreme-court"" rel=""noopener"" target=""_blank"">Supreme Court</a>, which is expected to rule in Louisiana v. Callais, a crucial case that may lead to the overturning of a key provision in the Voting Rights Act.</p><p>If the ruling goes the way of the conservatives on the high court, it could lead to the redrawing of a slew of majority-minority districts across the county, which would greatly favor Republicans.</p><p>But it is very much up in the air — when the court will rule, and what it will actually do.</p>",https://www.foxnews.com/politics/republicans-target-spanberger-governor-bait-switch-bid-defeat-dems-redistricting-push,2026-04-09
9,Charlotte train stabbing suspect’s state case stalls amid mind control claims — but Uncle Sam says not so fast,"<p>The homeless man accused of stabbing 23-year-old Iryna Zarutska on a <a href=""https://www.foxnews.com/category/us/us-regions/southeast/north-carolina"" rel=""noopener"" target=""_blank"">North Carolina light-rail train</a> has been deemed incompetent to stand trial in his state case, but federal authorities vowed the decision will not impact their own case against him.</p><p>Decarlos Brown Jr., 34, is charged with fatally stabbing Zarutska while the pair were aboard the light-rail Lynx Blue Line in Charlotte on Aug. 22, 2025. </p><p>In court documents filed earlier this week and obtained by Fox News, Brown’s attorney revealed a Central Regional Hospital evaluation determined his client was ""incapable to proceed"" in his upcoming state criminal trial, effectively halting prosecution. </p><p>However, authorities within the Department of Justice have revealed the ruling is ""completely separate"" from Brown’s <a href=""https://www.foxnews.com/category/politics/state-and-local/federal-relations"" rel=""noopener"" target=""_blank"">federal proceedings</a>, according to the U.S. attorney for the Western District of North Carolina.</p><p><a href=""https://www.foxnews.com/politics/whatley-links-cooper-transit-killing-accuses-dem-freeing-rapists-murderers"" rel=""noopener"" target=""_blank""><strong>WHATLEY LINKS COOPER TO TRANSIT KILLING, ACCUSES DEM OF FREEING ‘RAPISTS AND MURDERERS’</strong></a></p><p>""I had a great call this morning with our U.S. Attorney in Charlotte,"" Assistant Attorney General for the Civil Rights Division Harmeet Dhillon <a href=""https://x.com/aagdhillon/status/2042264826139857013?s=46&amp;t=SH1z7L2_tF0JMEGyVToksg"" rel=""noopener noreferrer nofollow"" target=""_blank""><u>said in a post</u></a> on X. </p><p>""Brown remains in federal custody and so the parallel state proceedings are in no way dispositive.""</p><p>A separate competency determination will be conducted in relation to the <a href=""https://www.foxnews.com/category/us/crime/trials"" rel=""noopener"" target=""_blank"">federal case</a> against Brown, who remains in federal custody, according to Dhillon.</p><p><a href=""https://www.foxnews.com/us/charlotte-light-rail-murder-suspect-ruled-incompetent-stand-trial-history-crazed-claims-trails-case"" rel=""noopener"" target=""_blank""><strong>CHARLOTTE LIGHT RAIL MURDER SUSPECT RULED INCOMPETENT TO STAND TRIAL AS HISTORY OF CRAZED CLAIMS TRAILS CASE</strong></a></p><p>In lieu of the delay in Brown’s state proceedings, officials must conduct a separate psychiatric evaluation to determine if he is competent to stand trial – a process that cannot be initiated while he is in federal custody, according to court documents. </p><p>Surveillance video shows Zarutska, a Ukrainian refugee, entering the train car and taking a seat in front of Brown. </p><p>Approximately four minutes later, Brown allegedly pulled a knife from his pocket and <a href=""https://www.foxnews.com/category/us/crime/homicide"" rel=""noopener"" target=""_blank"">stabbed her three times</a> before walking off the train.</p><p><a href=""https://www.foxnews.com/tips"" rel=""noopener"" target=""_blank""><strong>GOT A TIP?</strong></a></p><p>He was taken into custody moments later on the light-rail platform, while Zarutska was pronounced dead at the scene. </p><p>Brown, a parolee with <a href=""https://www.foxnews.com/us/violent-repeat-offender-accused-charlotte-knife-attack-free-despite-decade-long-rap-sheet"" rel=""noopener"" target=""_blank"">multiple documented run-ins</a> with the law, has a long reported <a href=""https://www.foxnews.com/category/health/mental-health"" rel=""noopener"" target=""_blank"">history of mental illness</a>, according to family members.</p><p><a href=""https://x.com/FoxUSNews"" rel=""noopener"" target=""_blank""><strong>FOLLOW US ON X</strong></a></p><p>By March 2024, authorities had logged six prior encounters with Brown, including multiple welfare checks triggered by his repeated 911 calls, <a href=""https://www.nytimes.com/2025/09/28/us/nc-stabbing-suspect-police-mental-health-history.html"" rel=""noopener noreferrer nofollow"" target=""_blank""><u>according to</u></a> The New York Times.</p><p>Just a year later, Brown called 911 from Novant Presbyterian Hospital, saying he needed help removing a ""man-made"" material he claimed was controlling him, the Charlotte Observer <a href=""https://www.charlotteobserver.com/news/local/crime/article315340121.html"" rel=""noopener noreferrer nofollow"" target=""_blank""><u>reported</u></a>.</p><p><a href=""https://www.foxnews.com/newsletters"" rel=""noopener"" target=""_blank""><strong>GET BREAKING NEWS BY EMAIL</strong></a></p><p>When officers arrived on scene, they reportedly told him they were unable to help. </p><p>In a jailhouse phone call to his sister just days after Zarutska’s alleged killing, Brown made similar claims regarding ""man-made"" material controlling his mind.</p><p><a href=""https://www.foxnews.com/us"" rel=""noopener"" target=""_blank""><strong>CLICK HERE FOR MORE US NEWS</strong></a></p><p>Brown said he did not understand why he stabbed the 23-year-old refugee and claimed the government had implanted ""materials"" in his brain that were controlling his actions, in the call obtained by <a href=""https://www.foxnews.com/us/charlotte-light-rail-murder-suspect-ruled-incompetent-stand-trial-history-crazed-claims-trails-case"" rel=""noopener noreferrer nofollow"" target=""_blank""><u>the Daily Mail</u></a>.</p><p>""They just lashed out on her, that's what happened,"" Brown said. ""Whoever was working the materials they lashed out on her. That's all there is to it. Now they really gotta investigate what my body was exposed to... Now they gotta do an investigation as to who was the motive behind what happened.""</p><p>Brown remains in federal custody while he <a href=""https://www.foxnews.com/us/twice-deported-honduran-accused-stabbing-passenger-charlotte-light-rail-faces-federal-charges"" rel=""noopener"" target=""_blank"">awaits trial on both state</a> and federal charges. </p><p>The DOJ did not immediately respond to Fox News Digital’s request for comment. </p>",https://www.foxnews.com/us/charlotte-train-stabbing-suspects-state-case-stalls-amid-mind-control-claims-uncle-sam-says-fast,2026-04-09
10,Nick Lachey recalls 98 Degrees tour bus having a book listing age of consent in every US state,"<p>Nick Lachey is reminiscing on a ""super shady"" memory from his <a href=""https://www.foxnews.com/category/entertainment/genres/pop"" rel=""noopener"" target=""_blank"">boy band days</a>.</p><p>""This is going to sound super shady, but when we first went out — I remember in our first tour — someone at the label gave us a book,"" the 98 Degrees singer recalled in Investigation Discovery’s upcoming documentary, ""Boy Band Confidential."" ""It was the age of consent in every state in the country.""</p><p>""We kept that book on the tour bus. Unfortunately, there were people out there looking to tear you down.""</p><p><a href=""https://www.foxnews.com/entertainment/nick-lachey-ordered-attend-anger-management-classes-alcoholics-anonymous-incident-photographer"" rel=""noopener"" target=""_blank""><strong>NICK LACHEY ORDERED TO ATTEND ANGER MANAGEMENT CLASSES, ALCOHOLICS ANONYMOUS AFTER INCIDENT WITH PHOTOGRAPHER</strong></a></p><p>Lachey first rose to fame as the band's lead singer, alongside his brother Drew Lachey, Jeff Timmons and Justin Jeffre. As the boy band wave began to sizzle out in the early 2000s, however, Lachey began to gain recognition for his marriage to <a href=""https://www.foxnews.com/category/person/jessica-simpson"" rel=""noopener"" target=""_blank"">Jessica Simpson</a>.</p><p><a href=""https://www.foxnews.com/newsletters?cmpid=fnfirstnl"" rel=""noopener"" target=""_blank""><strong>CLICK HERE TO SIGN UP FOR THE ENTERTAINMENT NEWSLETTER</strong></a></p><p>The former couple, who starred in the MTV series ""Newlyweds"" from 2003 to 2005, first met when Simpson was 18 and Lachey was 24. After four years of dating, they eventually tied the knot in 2002, but <a href=""https://www.foxnews.com/category/entertainment/events/divorce"" rel=""noopener"" target=""_blank"">divorced in 2006</a>.</p><p>Lachey went on to marry <a href=""https://www.foxnews.com/category/entertainment/events/marriage"" rel=""noopener"" target=""_blank"">the now-mother of his three children</a>, Vanessa Lachey, in 2011.</p><p><a href=""https://www.foxnews.com/entertainment"" rel=""noopener"" target=""_blank""><strong>LIKE WHAT YOU’RE READING? CLICK HERE FOR MORE ENTERTAINMENT NEWS</strong></a></p><p>In 2024, during an episode of Netflix's ""The Ultimatum: Marry or Move On,"" Lachey opened up to the contestants about his past and how prior relationships impacted his life.</p><p>""I, too, was <a href=""https://www.foxnews.com/entertainment/jessica-simpson-details-marriage-nick-lachey"" rel=""noopener"" target=""_blank""><u>previously married</u></a>. Divorced. So I understand the hurt, the scars that exist from that,"" Lachey told the cast at a dinner table while seated next to Vanessa.</p><p>""I just want to encourage you all, don't let your past define your future,"" he continued. ""What I truly always wanted in my life was to have a beautiful marriage and a beautiful family. If I hadn't retained my belief in that, I wouldn't have ever realized the beautiful life that I have with this woman. And we sit up here, we don't have it figured out.""</p><p>""But when you <a href=""https://www.foxnews.com/category/lifestyle/relationships"" rel=""noopener"" target=""_blank"">love each other</a>, you believe in each other, and you're aligned.""</p>",https://www.foxnews.com/entertainment/nick-lachey-recalls-98-degrees-tour-bus-book-listing-age-consent-every-us-state,2026-04-09
11,UK defense minister warns Putin of 'serious consequences' after covert underwater military operation,"<p>U.K. Defense Minister John Healey warned Russian President Vladimir Putin of ""serious consequences"" Thursday after revealing a weeks-long military operation to deter Russian meddling in the North Sea.</p><p>""To President Putin I say we see you, we see your activity over our cables and our pipelines, and you should know that any attempt to damage them will not be tolerated and will have serious consequences,"" he cautioned. </p><p>The defense minister detailed an operation involving a Royal Navy frigate, a Royal Air Force patrol plane and hundreds of personnel deployed to deter a trio of Russian submarines that were detected near underwater cables in Britain’s economic exclusionary zone.</p><p><a href=""https://www.foxnews.com/world/russia-china-veto-un-resolution-aimed-reopening-strait-hormuz-hours-trump-deadline"" rel=""noopener noreferrer"" target=""_blank""><strong><u>RUSSIA, CHINA VETO UN RESOLUTION AIMED AT REOPENING STRAIT OF HORMUZ, HOURS BEFORE TRUMP DEADLINE</u></strong></a></p><p>One of the submarines, Healey announced, was a <a href=""https://www.foxnews.com/world/putin-hails-successful-test-nuclear-powered-underwater-torpedo"" rel=""noopener noreferrer"" target=""_blank""><u>nuclear-powered</u></a> Akula-class submarine, while the other two were spy submarines from Russia’s Main Directorate of Deep Sea Research, also known as GUGI. Subs from this unit were directed specifically by Putin ""to conduct hybrid warfare activities against the UK"" and its allies, Healey said.</p><p>At least one of those allies, Norway, was involved in the deterrent operation, Healey revealed. Norway’s Defense Minister Tore O Sandvik confirmed the cooperation in a Thursday statement. </p><p>""Norway has participated in a coordinated military operation with our allies to send a clear message: covert activities in our waters will not be tolerated,"" <a href=""https://www.regjeringen.no/en/whats-new/statement-from-the-norwegian-defence-minister-tore-o.-sandvik/id3155829/"" rel=""noopener"" target=""_blank"">Sandvik <u>wrote</u>.</a></p><p>The submarines left U.K. waters after a protracted period of monitoring from the U.K. and Norway, and there is no evidence of damage to any underwater infrastructure, Healey said. </p><p>Fox News Digital has reached out to the U.K.’s Defense Department for more information. </p><p>The Russian incursion marked the second time in less than six months that the U.K. detected Russian seacraft near its territorial waters. <a href=""https://www.foxnews.com/world/britain-says-russian-spy-ship-edge-uk-waters-defense-secretary-issues-warning-putin"" rel=""noopener"" target=""_blank"">Healey <u>announced</u></a> a similar military operation in November after Russia deployed the spy ship Yantar to the North Sea in 2025.</p><p><a href=""https://www.foxnews.com/world/trump-starmer-agree-strait-hormuz-must-reopen-middle-east-conflict-escalates"" rel=""noopener"" target=""_blank""><strong><u>TRUMP, STARMER AGREE STRAIT OF HORMUZ MUST REOPEN AS MIDDLE EAST CONFLICT ESCALATES</u></strong></a></p><p>Healey also cited this year’s incident as an example of why the U.K. hasn’t sent troops to the Strait of Hormuz, the narrow waterway in the Persian Gulf key to global energy markets that Iran has choked off in recent weeks.</p><p>""I understand people questioning why all UK military assets and personnel have not been deployed to deal with it. But that is not in Britain’s national interest,"" he said, later calling Russia ""the primary threat to the UK and to NATO."" </p><p>President Donald Trump has criticized NATO allies and the organization itself for not acceding to requests to help open the Strait of Hormuz. </p><p>""NATO WASN’T THERE WHEN WE NEEDED THEM, AND THEY WON’T BE THERE IF WE NEED THEM AGAIN,"" he wrote in a Thursday morning Truth Social post.</p><p>The U.K., while holding a planning meeting on how to reopen the Strait of Hormuz after the Iran War is over, <a href=""https://www.foxnews.com/world/uks-nato-show-force-ends-docked-destroyer-mediterranean-after-technical-issue"" rel=""noopener noreferrer"" target=""_blank""><u>initially refused</u></a> to let the U.S. use a British air base to launch military strikes against Iran. </p><p>British Prime Minister Keir Starmer eventually allowed the U.S. to launch ""defensive strikes"" from Royal Air Force bases after Trump <a href=""https://www.foxnews.com/politics/trump-slams-starmer-not-winston-churchill-refusal-back-iran-strikes"" rel=""noopener noreferrer"" target=""_blank""><u>slammed him</u></a> as ""not Winston Churchill.""</p>",https://www.foxnews.com/world/uk-defense-minister-warns-putin-serious-consequences-after-covert-underwater-military-operation,2026-04-09
