,title,text,link,publish_date
10,Tennessee school board member censured after calling student ‘hot’ at meeting,"<p>A school board member in <a href=""https://www.foxnews.com/category/us/us-regions/southeast/tennessee"" rel=""noopener"" target=""_blank"">Tennessee</a> has been censured after telling a high school student she was ""hot"" at a public board meeting last week.</p><p>During the April 2 <a href=""https://www.youtube.com/live/977US_SUGg8"" rel=""nofollow noopener"" target=""_blank"">livestreamed</a> meeting, Washington County Board of Education member Keith Ervin told a female student, ""God, you’re hot."" </p><p>The board in northeastern Tennessee passed the censure Wednesday during an emergency meeting after calls to remove Ervin and Superintendent Jerry Boyd.</p><p>The student, who is a student representative of the board, had just finished inquiring about career and technical education when Ervin hugged her from the side and made the remark, NBC News <a href=""https://www.nbcnews.com/news/us-news/tennessee-school-board-member-called-student-hot-censured-rcna267331"" rel=""nofollow noopener"" target=""_blank""><u>reported</u></a>.</p><p><a href=""https://www.foxnews.com/politics/gop-lawmaker-vows-give-parents-more-power-schools-blatantly-violate-students-rights"" rel=""noopener"" target=""_blank""><strong><u>GOP LAWMAKER VOWS TO GIVE PARENTS MORE POWER AS SCHOOLS ‘BLATANTLY' VIOLATE STUDENTS’ RIGHTS</u></strong></a></p><p>""God, you’re hot. Do you know that? Damn. Where do you go to school at?"" he said as the meeting continued.</p><p>Ervin defended his remarks on Wednesday and said his ""hot"" comment was taken out of context. </p><p>""Obviously, I’ve seen the clip. Look, I get it, if that’s all you’re seeing, I understand why people are reacting the way they are,"" he said. ""But that’s not the full conversation, not even close. Last week at the board meeting I wanted to congratulate a student who did a great job sharing thoughts with all that was in the room.</p><p>""When I mentioned she was hot, I meant she was on a roll. It was nothing to do with her appearance. As a lifetime supporter of David Crockett High School, I was especially surprised to learn that’s where she went to school."" </p><p>He also added that the clip of his comments that went viral was only a few seconds out of the <a href=""https://www.foxnews.com/category/news-events"" rel=""noopener"" target=""_blank"">two-hour meeting</a> and that the entire video would provide the full context. </p><p><a href=""https://www.foxnews.com/politics/trump-admin-squashes-controversial-biden-rule-forcing-foster-homes-affirm-childrens-lgbtq-status"" rel=""noopener"" target=""_blank""><strong><u>TRUMP ADMIN SQUASHES CONTROVERSIAL BIDEN RULE FORCING FOSTER HOMES TO AFFIRM CHILDREN'S LGBTQ+ STATUS</u></strong></a></p><p>""There was no disrespect meant, and I apologize to her and her family for my comment reacting in the public for the incredible job she did as a <a href=""https://www.foxnews.com/category/us/education/high-school"" rel=""noopener"" target=""_blank"">student board member</a>,"" Ervin said.</p><p><a href=""https://www.wafb.com/2026/04/10/school-board-member-censured-telling-student-god-youre-hot-says-it-was-taken-out-context/"" rel=""nofollow noopener"" target=""_blank"">He apologized</a> that his remark had ""overshadowed what would have been a bright moment for one of our students.""</p><p>NBC News reported that as Ervin was finishing his remarks, a man yelled, ""I watched it; you’re a liar!"" </p><p>""I’d just like folks to take a look at it before jumping to conclusions. The video speaks for itself,"" Ervin said, finishing his speech.</p><p><a href=""https://www.foxnews.com/politics/power-stripped-from-education-department-latest-trump-administration-move-dismantle"" rel=""noopener"" target=""_blank""><strong><u>POWER STRIPPED FROM EDUCATION DEPARTMENT IN LATEST TRUMP ADMINISTRATION MOVE TO DISMANTLE IT</u></strong></a></p><p>""It sure does!"" a woman in the room replied.</p><p><a href=""https://foxnews.com/media"" rel=""noopener"" target=""_blank"">Fox News Digital</a> reached out to Superintendent Boyd and Ervin for additional comment. </p>",https://www.foxnews.com/media/tennessee-school-board-member-censured-after-calling-student-hot-meeting,2026-04-10
11,Kylie Jenner dances in face mask and sports bra with friends as Coachella weekend kicks off in the desert,"<p><a href=""https://www.foxnews.com/category/person/kylie-jenner"" rel=""noopener"" target=""_blank"">Kylie Jenner</a> is partying in a sports bra and a face mask as she prepares for Coachella.</p><p>On Monday morning, Jenner took to Instagram and shared a video with friends Anastasia ""Stassie"" Karanikolaou and Victoria Villarroel. </p><p>The trio wore pink face masks as they danced to Frankie Valli's ""Can't Take My Eyes Off You.""</p><p><a href=""https://www.foxnews.com/entertainment/kylie-jenner-dazzles-daring-white-string-bikini-poolside-photos"" rel=""noopener"" target=""_blank""><strong>KYLIE JENNER DAZZLES IN DARING WHITE STRING BIKINI FOR POOLSIDE PHOTOS</strong></a></p><p>The 28-year-old was wearing yoga pants with one leg rolled up and a shirt with <a href=""https://www.foxnews.com/category/person/justin-bieber"" rel=""noopener"" target=""_blank"">Justin Bieber's</a> face half on. </p><p>""its just not clocking to you,"" Jenner captioned her post, referring to the viral video of Bieber confronting paparazzi.</p><p>Prior to the dancing video, Jenner shared a picture of herself in the same outfit, holding an iced coffee and several bags. </p><p>""chelly day 1!!!!!"" she captioned <a href=""https://www.instagram.com/p/DW9dNRgiYTE/?utm_source=ig_web_copy_link&amp;igsh=MzRlODBiNWFlZA=="" rel=""nofollow noopener"" target=""_blank"">the post.</a></p><p><a href=""https://www.foxnews.com/newsletters?cmpid=fnfirstnl"" rel=""noopener"" target=""_blank""><strong>CLICK HERE TO SIGN UP FOR THE ENTERTAINMENT NEWSLETTER</strong></a></p><p>Jenner also shared a photo with Karanikolaou in a home gym. She held a water bottle and posed for the photo while Karanikolaou wore a bikini top and shorts.</p><p>Jenner is not the only star in the desert preparing for the weekend ahead.</p><p>Influencer Alix Earle shared a picture of herself in a black bikini top and white pants, sitting in the backyard of the Reale Actives house at Coachella.</p><p><a href=""https://www.foxnews.com/category/person/hailey-baldwin"" rel=""noopener"" target=""_blank"">Hailey Bieber</a>'s friend Fai Khadra shared a video of Hailey and Justine Skye in a blue golf cart. </p><p>""The First Lady of Coachella,"" Khadra captioned the video and tagged Hailey.</p><p><a href=""https://www.foxnews.com/entertainment"" rel=""noopener"" target=""_blank""><strong>LIKE WHAT YOU’RE READING? CLICK HERE FOR MORE ENTERTAINMENT NEWS</strong></a></p><p>Hailey's husband is <a href=""https://www.foxnews.com/category/entertainment/music"" rel=""noopener"" target=""_blank"">headlining Coachella</a> for the first time Saturday night. Fans have coined this year's Coachella ""Bieberchella.""</p><p>Sabrina Carpenter is headlining Friday night. Ahead of her big performance, the star shared a picture of two pups on her Instagram story wearing ""Sabchella"" neck bands.</p>",https://www.foxnews.com/entertainment/kylie-jenner-dances-face-mask-sports-bra-friends-coachella-weekend-kicks-desert,2026-04-10
12,Lexie Hull reveals most rewarding part about playing for Fever during Caitlin Clark era,"<p>Lexie Hull led the Indiana Fever to the brink of the WNBA Finals last season. </p><p>She did it without <a href=""https://www.foxnews.com/category/person/caitlin-clark"" rel=""noopener"" target=""_blank"">Caitlin Clark</a> on the floor after the superstar was injured.</p><p>Now, with Clark returning in 2026, Hull believes and expects they can win a championship and promote the game for the next generation of fans and aspiring players.</p><p>""Seeing girls, seeing boys show up every day and being able to give them aspirations and show them what they can do and show them the possibilities,"" Hull told Fox News Digital of the rewards of playing in the WNBA.</p><p>""Growing up, I didn't necessarily watch the WNBA as much, didn't have dreams of playing in the league at a young age. And now girls have the ability to watch us, see us, dream about being professional athletes. And that's what's been the most rewarding part about it.</p><p><a href=""https://www.foxnews.com/sports"" rel=""noopener"" target=""_blank""><strong>CLICK HERE FOR MORE SPORTS COVERAGE ON FOXNEWS.COM</strong></a></p><p>""I love the game, and I love when [the fans] show up. And that's part of the reason why I love doing what I do, is to see fans in the stands, see little girls and being able to be a role model for them on and off the court. I think that's really what drives me and fuels me.""</p><p>Hull, who was drafted by the Fever in 2022, played her first two WNBA seasons without the massive spotlight that Clark brought in 2024.</p><p>They got the Fever to the playoffs together for the first time since 2016 that year before Hull led the team on a playoff run while <a href=""https://www.foxnews.com/sports/fever-lose-caitlin-clark-remainder-2025-season"" rel=""noopener"" target=""_blank"">Clark and teammate Sophie Cunningham</a> were on the bench with injuries in 2026.</p><p>In a <a href=""https://www.foxnews.com/category/sports/wnba"" rel=""noopener"" target=""_blank"">career-best year in 2025</a>, Hull averaged career highs in points (7.2), rebounds (4.3) and assists (1.8) while shooting 36.7% from 3-point range and appearing in all 44 games.</p><p><a href=""https://www.foxnews.com/sports/fevers-lexie-hull-speaks-attacks-players-teams-popularity-grows-caitlin-clark-era"" rel=""noopener"" target=""_blank""><strong>FEVER'S LEXIE HULL SPEAKS OUT AGAINST ATTACKS ON PLAYERS AS TEAM'S POPULARITY GROWS DURING CAITLIN CLARK ERA</strong></a></p><p>In the playoffs, she averaged<strong> </strong>10.3 points, five rebounds and two assists in eight games. It all came to an end in a 107-98 overtime loss to the <a href=""https://www.foxnews.com/category/sports/wnba/las-vegas-aces"" rel=""noopener"" target=""_blank"">Las Vegas Aces</a> in Game 5 of the WNBA semifinals.</p><p>But Hull says she believes the 2026 team, in year three of the Clark era, will be a different show and one that is gunning for the title.</p><p>""I think it's because we made it where we made it last year without some of our key pieces, and with a lot of injuries, and a lot of, like, this adversity. … Our bench was longer than every other bench. We had more people in the training room getting treatment than any other team, and we still almost made it to the Finals,"" Hull said.</p><p>""Tasting that and being so close and feeling like we have so much more to give, I think that just changes our mindset a little bit. And it's not necessarily overconfident, but confident in the fact that we really do have a chance. And we should be playing like every game matters, and we're preparing for that last one.</p><p>""I think it's very achievable with what we're going to be able to do with free agency.""</p><p><i><strong>Follow Fox News Digital’s </strong></i><a href=""https://twitter.com/FoxNewsSports_"" rel=""noopener"" target=""_blank""><i><strong><u>sports coverage on X</u></strong></i></a><i><strong> and subscribe to</strong></i><a href=""https://www.foxnews.com/newsletters"" rel=""noopener"" target=""_blank""><i><strong><u> the Fox News Sports Huddle newsletter</u></strong></i></a><i><strong>.</strong></i></p>",https://www.foxnews.com/sports/lexie-hull-reveals-rewarding-part-playing-fever-caitlin-clark-era,2026-04-10
13,"Swalwell's former female staffer drops bombshell allegations of sexual assault, exposing himself: report","<p>Sexual harassment allegations have been <a href=""https://www.foxnews.com/politics/misconduct-allegations-dog-swalwell-dem-rivals-seize-opening-california-governors-race"" rel=""noopener"" target=""_blank"">amplified online</a> by Democrat-aligned politicos targeting Rep. Eric Swalwell, D-Calif., one of the leading Democratic candidates in California's gubernatorial race<strong>.</strong><br /><br />Amid repeated denials and cease-and-desist letters sent by Swalwell's lawyer, one of the alleged victims shared her story publicly for the first time, accusing Swalwell of taking advantage of her while she was intoxicated on multiple occasions, according to a <a href=""https://www.sfchronicle.com/politics/article/eric-swalwell-allegations-22198271.php"" rel=""nofollow noopener"" target=""_blank"">bombshell report published</a> by the San Francisco Chronicle Friday. </p><p>The alleged victim's story also included claims that Swalwell pressured her to send naked pictures of herself and sent sexually explicit photos of his own, pulled out his private parts while driving in a car with her and requested she perform oral sex on him, among other incidents the victim said affected how Swalwell treated her professionally.</p><p><a href=""https://www.foxnews.com/politics/dem-senator-ripped-smear-female-activist-advocating-swalwell-accusers-very-bad-look"" rel=""noopener"" target=""_blank""><strong>DEM SENATOR RIPPED FOR ‘SMEAR’ OF FEMALE ACTIVIST ADVOCATING FOR SWALWELL'S ACCUSERS</strong></a> </p><p>The unnamed female accuser, who spoke to the San Francisco Chronicle, reportedly worked for Swalwell for about two years and revealed that he started pursuing her, despite being married, shortly after she was hired as a 21-year-old staffer in his district office. </p><p>On multiple occasions, the young staffer recalls blacking out from alcohol consumption, before waking up naked in Swalwell's hotel bed with signs she had engaged in intercourse. Swalwell allegedly distanced himself after the incident, and their relationship faded, before they reunited when she no longer worked for him when another incident allegedly took place. </p><p>""Eric Swalwell should immediately drop out,"" Democratic strategist Bhavik Lathia said after the San Francisco Chronicle's report dropped. ""It is damning."" </p><p>Matt Mahan, a former San Jose Mayor and fellow Democratic Party gubernatorial candidate in California, also called on Swalwell to ""drop out.""</p><p>""To the survivor who risked everything to come forward – I believe you,"" Mahan said. ""To the Democratic Party – you’d better hold him accountable.</p><p> ""If we don’t, we have no credibility asking anyone else to do the same.""</p><p>Sen. Ruben Gallego, D-Ariz., a longtime friend of Swalwell who<a href=""https://www.foxnews.com/politics/dem-senator-ripped-smear-female-activist-advocating-swalwell-accusers-very-bad-look"" rel=""noopener"" target=""_blank""> faced backlash</a> earlier this week for trying to discredit allegations against the California Democrat, posted on Friday that he ""regret[s] having come to his defense on social media prior to knowing all the information. I am equally as shocked and upset about what has transpired.""</p><p>""What is described is indefensible. Women who come forward with accounts like this deserve to be heard with respect, not questioned or dismissed,"" Gallego said. ""I am withdrawing my endorsement of Congressman Swalwell, effective immediately.""</p><p>Swalwell's team did not respond to Fox News' request for comment, but he recently said during a press gaggle that the allegations are ""false,"" including allegations that Swalwell previously pressured female staffers to sign non-disclosure agreements so they cannot speak out or that he was involved in an alleged hush money settlement. </p><p>""It's false. And also some of the allegations I've seen, which is that we've had NDAs in the office – never. There's never been an allegation, and there's never been a settlement,"" Swalwell insisted this week.</p><p>""This false, outrageous rumor is being spread 27 days before an election begins by flailing opponents who have sadly teamed up with MAGA conspiracy theorists because they know Eric Swalwell is the frontrunner in this race,"" Micah Beasley, a spokesperson for Swalwell, <a href=""https://www.foxnews.com/politics/swalwell-campaign-rejects-outrageous-allegations-sexual-misconduct-dem-activists-issue-viral-warning"" rel=""noopener"" target=""_blank"">also said</a> Tuesday.</p><p>Cheyenne Hunt, a former Capitol Hill staffer who is a nonprofit director at the group Gen-Z for Change, is among the voices acting as a proxy for alleged Swalwell accusers and has been helping amplify their stories. </p><p>On Friday, she blasted Swalwell for ""tak[ing] a page out of the Trump playbook by attempting to silence women"" with cease-and-desist letters he allegedly sent out late Thursday night ahead of the San Francisco Chronicle's report sharing a first-hand account from one of Swalwell's alleged accusers. </p><p>Fox News Digital has not independently verified the allegations from the report.</p><p>The alleged victim, who began working for Swalwell during his short-lived presidential campaign in 2019, said a married Swalwell, who was 38, began pursuing her, including through messages on Snapchat, which allows users to send photos that subsequently disappear after someone has looked at them. </p><p>She claimed the relationship rapidly progressed as Swalwell began asking for pictures of her face, then her naked body and eventually her genitalia. When messaging, the victim alleged Swalwell would sometimes send shirtless selfies or other images of his own genitalia.</p><p><a href=""https://www.foxnews.com/politics/swalwell-threatens-fbi-legal-action-patel-reportedly-weighs-fang-fang-files-release"" rel=""noopener"" target=""_blank""><strong>SWALWELL THREATENS FBI WITH LEGAL ACTION AS PATEL REPORTEDLY WEIGHS 'FANG FANG' FILES RELEASE</strong></a></p><p>Swalwell then allegedly tried to kiss the victim in her car when she drove him home from a donor meeting one night. On another occasion, he allegedly pulled out his penis while in the vehicle and asked her to perform oral sex on him. She admitted to doing so in a parking lot but soon stopped out of fear someone might see them.  </p><p>In September 2019, the alleged victim, who was then working in Swalwell's Castro Valley district office, reportedly said Swalwell invited her out for dinner and drinks when she drank too much and blacked out. </p><p>She claimed to have not even remembered leaving the restaurant but woke up in Swalwell's hotel room the next day with vaginal soreness indicative of sexual intercourse. She also reportedly had a brief memory of Swalwell sucking her toes.</p><p>After the alleged September 2019 incident in Swalwell's hotel room, the victim said the pair's relationship faded as Swalwell distanced himself from her and began treating her more formally during public interactions. She eventually stopped working for Swalwell but stayed in politics and noted Swalwell would occasionally remain in touch with her, including reaching out when she was looking for a job. </p><p>However, she claimed that, five years later, while attending an April 2024 charity event Swalwell was being honored at, the pair reunited. She was not working for Swalwell at this later date, according to the San Francisco Chronicle. The woman indicated that she and Swalwell went out for drinks after the event, during which she once again became inebriated and could only remember bits and pieces about the night. </p><p>""Even though he had hurt me in the past, I felt like he was someone I could trust,"" the alleged victim said, according to the San Francisco Chronicle. ""Because we shared this secret together, it pulled me closer to him.""</p><p>According to the San Francisco Chronicle's reporting on the alleged victim's experiences, one moment she did remember from the night was pushing Swalwell away and telling him ""no"" as he allegedly tried to force her to have sex with him. The woman reportedly texted a friend after the incident telling her she had been sexually assaulted by Swalwell. Other messages reviewed by the San Francisco Chronicle reportedly showed the victim indicating she had ""blacked out"" but ""woke up once during it and even told him to stop at one point.""</p><p>""This happened one other time when I was working with him, but I convinced myself I was an equal party in it even though same pattern: I blacked out and he had sex with me,"" the alleged victim wrote, referring to the 2019 incident, according to the San Francisco Chronicle's reporting.</p><p><a href=""https://www.foxnews.com/politics/swalwells-campaign-sets-off-alarm-bells-accepting-25k-donation-from-ccp-tied-lawyer"" rel=""noopener"" target=""_blank""><strong>ERIC SWALWELL CAMPAIGN SETS OFF ALARM BELLS AFTER ACCEPTING $25K DONATION FROM CCP-TIED LAWYER: ‘OUTRAGEOUS’</strong></a> </p><p>The outlet also indicated it spoke with the friend the victim was allegedly texting and the woman's boyfriend whom she reportedly told about the assault the next day. The boyfriend reportedly encouraged her to report Swalwell at the time. </p><p>However, she did not go to the authorities at the time, according to the San Francisco Chronicle, because she was afraid she would not be believed. Medical records reportedly showed she did obtain a pregnancy and STD test a week after the incident.</p><p>Swalwell subsequently messaged the alleged victim after the 2024 incident and told her not to tell anyone about their interaction that night, according to the San Francisco Chronicle. </p><p>""He even sent me a message: you said you didn’t remember anything last time i hope you do now,"" the alleged victim reportedly texted her friend three days after the incident. ""And i said: yeah I’m trying to forget thanks."" </p><p>""He was sending messages like we just had a romantic encounter like he knows what he’s doing,"" the alleged victim also allegedly wrote to her friend at the time. ""He was gaslighting me into thinking it was consensual.""</p><p>Swalwell's alleged victim began talking to the San Francisco news outlet roughly a month ago, while weighing whether to go public with her allegations as they began anonymously surfacing online. </p><p>The victim was confused how the rumors began, considering she only told family and a small group of friends about the incident. The victim reportedly called the Swalwell campaign in March to see if her name had surfaced among the rumored victims, and one of Swalwell's staffers reportedly asked her to vouch for Swalwell. </p><p>""He was so confident that I would stay silent that he wasn’t scared,"" she said of Swalwell.</p><p>""I have no skin in the game of who becomes governor of California, but I feel people have a right to know whether the person who leads a state that is a safe haven for so many women actually treats women with dignity and will protect their rights,"" the woman, who still works on Capitol Hill, said, according to the San Francisco Chronicle. </p><p>""No one protected me from him, and so I have to protect the other young women like me who aspire to work in this field and he could prey upon.""</p><p>Late Thursday night, Swalwell's attorney, Elias Dabaie, sent a cease-and-desist letter that Hunt, one of the individuals amplifying Swalwell's accuser's claims, argues is an effort to intimidate those trying to speak up about Swalwell's history with women. </p><p>""Today we learned [Swalwell] is intimidating survivors, serving cease and desist letters on those coming forward with stories of sexual harassment and abuse. He sent this threat in the dead of night — another attempt to delay the truth,"" Hunt wrote on social media, attaching a copy of the first letter of the cease and desist letter she claimed to have obtained.</p><p>""This is what it looks like when powerful men get caught,"" Hunt continued. ""These cease and desists are a disgusting abuse of power against brave women who are courageously working together to share their stories. It begs the question: if Swalwell has done nothing wrong, as his campaign claims, why not let the women tell their stories in the light of day? Our team remains steadfast. We will not relent. The women will not recant.""</p><p>The Los Angeles Times reported Friday that it had confirmed the authenticity of the letter. Fox News Digital reached out to the attorney who sent the letter to confirm the authenticity of the letter independently but did not immediately receive a response. </p><p>After the San Francisco Chronicle's report Friday, CNN <a href=""https://www.cnn.com/2026/04/10/us/eric-swalwell-sexual-misconduct-allegations-invs"" rel=""nofollow noopener"" target=""_blank"">published a separate report</a> indicating three other women it had spoken to also alleged various kinds of sexual misconduct by the Democratic congressman, including Swalwell sending them unsolicited explicit messages or nude photos.</p>",https://www.foxnews.com/politics/swalwells-former-female-staffer-drops-bombshell-allegations-sexual-assault-exposing-himself-report,2026-04-10
