,title,text,link,publish_date
17,"Minor league team plates 10 runs in one inning on just one hit, zero errors in frigid conditions","<p>The New Hampshire Fisher Cats, the <a href=""https://www.foxnews.com/category/sports/mlb/toronto-blue-jays"" rel=""noopener"" target=""_blank"">Toronto Blue Jays’</a> Double-A affiliate, achieved a rare feat not seen in the post-expansion era. </p><p>Portland’s pitchers — New Hampshire’s opponent for a six-game series — combined for walks, wild pitches and hit batters, paving the way for the Fisher Cats to pull off the feat.</p><p>The Fisher Cats fell behind 2-0 early in Tuesday's game against the Sea Dogs, the Eastern League affiliate of the <a href=""https://www.foxnews.com/category/sports/mlb/boston-red-sox"" rel=""noopener"" target=""_blank"">Boston Red Sox.</a></p><p>But New Hampshire scored its first eight runs in the second inning without recording a single base hit.</p><p><a href=""https://www.foxnews.com/sports"" rel=""noopener"" target=""_blank""><strong>CLICK HERE FOR MORE SPORTS COVERAGE ON FOXNEWS.COM</strong></a></p><p>The Fisher Cats exploded for 10 runs in the inning — nine with two outs — on just one hit and no errors, the final <a href=""https://www.milb.com/gameday/fisher-cats-vs-sea-dogs/2026/04/07/818494/final/box"" rel=""nofollow noopener"" target=""_blank"">box score</a> in New Hampshire's 12-7 win showed. The feat was fueled by Portland pitchers issuing eight walks and hitting two batters. Sea Dogs pitchers also uncorked four wild pitches and allowed a sacrifice fly and the inning’s lone hit.</p><p><a href=""https://www.foxnews.com/sports/braves-ace-chris-sale-slams-baseball-head-walking-bases-loaded-wild-scene"" rel=""noopener"" target=""_blank""><strong>BRAVES ACE CHRIS SALE SLAMS BASEBALL AGAINST HIS HEAD AFTER WALKING THE BASES LOADED IN WILD SCENE</strong></a></p><p>Sea Dogs president Geoff Iacuessa couldn’t believe what unfolded.</p><p>""I don't ever remember seeing that here or any other game I've ever seen,"" Iacuessa told Portland's WGME Channel 13. ""It was crazy. I thought maybe something was going on with the scoreboard, and then I checked the GameChanger, and it was correct.""</p><p>The rare moment happened amid frigid conditions that prompted the stadium's ground crew to clear the playing grass and infield after heavy snow fell earlier in the day. Temperatures were just a few degrees above freezing at first pitch.</p><p>The inning unraveled quickly after a quiet start, when Portland starter Hayden Mullins issued two walks and uncorked a wild pitch despite striking out the side in the first. New Hampshire then broke through with a sacrifice fly.</p><p>Mullins eventually managed to record two outs, but then lost control, walking three straight to tie the game. Jorge Juan came on in relief but hit the first batter he faced with the bases loaded.</p><p>A wild pitch made it a 4-2 score, and a walk loaded the bases again for the Fisher Cats. Juan then hit a batter, making it 5-2, before firing another wild pitch to push the Sea Dogs deficit to four runs. Juan walked two more to push it to 7-2 before leaving the mound with a runner at each base again.</p><p>Cade Feeney took the hill next and finally stopped the leaking, but not before a wild pitch made it 8-2 and New Hampshire outfielder Ismael Munguia’s two-run single pushed the lead to 10-2.</p><p>Munguia represented his native Nicaragua in last month’s <a href=""https://www.foxnews.com/category/sports/world-baseball-classic"" rel=""noopener"" target=""_blank"">World Baseball Classic</a>, appearing in four games.</p><p>Not even a team at the major league level has scored more than four runs in an inning without recording its first hit, according to the Elias Sports Bureau. </p><p><a href=""https://www.mlb.com/news/new-hampshire-10-runs-on-one-hit?adobe_mc=TS%3D1775659931%7CMCMID%3D75314232977687002338933530101800692146%7CMCORGID%3DA65F776A5245B01B0A490D44@AdobeOrg&amp;affiliateId=mlbapp-ios_webview_news-index&amp;rsid=mlbios.at.bat.new.implementation"" rel=""nofollow noopener"" target=""_blank"">MLB.com</a> reports it has happened just 16 times in American League and National League history that a pitcher allowed five runs without surrendering a hit in 1⅔ innings or fewer.</p><p><i><strong>Follow Fox News Digital’s </strong></i><a href=""https://twitter.com/FoxNewsSports_"" rel=""noopener"" target=""_blank""><i><strong>sports coverage on X</strong></i></a><i><strong>, and subscribe to</strong></i><a href=""https://www.foxnews.com/newsletters"" rel=""noopener"" target=""_blank""><i><strong> the Fox News Sports Huddle newsletter</strong></i></a><i><strong>.</strong></i></p>",https://www.foxnews.com/sports/minor-league-team-plates-10-runs-one-inning-one-hit-zero-errors-frigid-conditions,2026-04-10
18,No retreat at Hormuz — Iran must not control the world’s energy lifeline,"<p>The Strait of Hormuz is often described as a Gulf choke point. That is too narrow a frame for too large a fact. Hormuz is not simply a regional waterway between Iran and the Arab Gulf states. </p><p>It is a piece of global economic infrastructure, a narrow corridor through which a vast share of the world’s oil and gas trade passes. It is also a route on which shipping, insurance, fertilizer supply, industrial production and food security in much of the world depend. This is not a local matter. It is part of the operating system of global growth.</p><p>That is why one principle has to be absolute: There can be no negotiation over freedom of passage in Hormuz. If President <a href=""https://www.foxnews.com/category/person/donald-trump"" rel=""noopener"" target=""_blank"">Donald Trump</a> were to accept any restriction on transit through the strait, whether in the form of tolls, quotas, selective permissions, inspections manipulated for political ends or any de facto Iranian right to decide who passes and on what terms, it would be a major defeat for the United States and for the world economy. It would mean that Washington had accepted the conversion of a global artery into an instrument of coercion.</p><p>That cannot be dismissed as a temporary compromise. Once the principle is conceded, the damage is lasting. The issue is not simply the immediate cost of a few <a href=""https://www.foxnews.com/world/iran-chokes-strait-hormuz-reported-2m-tanker-toll-regime-threatens-global-oil-supply"" rel=""noopener"" target=""_blank"">delayed shipments</a>. It is the precedent that the world’s most important maritime choke points can be politically priced, selectively restricted and used as bargaining chips by the power that threatens them. If the United States accepts that in Hormuz, every revisionist state will take note.</p><p><a href=""https://www.foxnews.com/politics/iran-war-nears-completion-trump-eyes-deadline-what-endgame-could-look-like"" rel=""noopener"" target=""_blank""><strong>IRAN WAR NEARS ‘COMPLETION’ AS TRUMP EYES DEADLINE — WHAT THE ENDGAME COULD LOOK LIKE</strong></a></p><p>The dependence on Hormuz is greatest in Asia. Much of the oil and LNG passing through the strait is destined for Asian markets, above all China, India, Japan and South Korea. A <a href=""https://www.foxnews.com/politics/hormuz-choke-point-persists-iran-halts-oil-traffic-despite-trump-ceasefire"" rel=""noopener"" target=""_blank"">closure of the waterway</a>, or even an Iranian claim to regulate access, would therefore do much more than inconvenience Gulf exporters. It would strike directly at the industrial heartlands of Asia. Chinese manufacturing, Indian refining, <a href=""https://www.foxnews.com/category/world/world-regions/japan"" rel=""noopener"" target=""_blank"">Japanese utilities</a> and Korean industry would all feel the shock quickly through fuel prices, factory output, inflation and investor confidence.</p><p>On the gas side, the vulnerability is sharper still. LNG exports from Qatar and the UAE are overwhelmingly dependent on the strait. For countries such as <a href=""https://www.foxnews.com/category/world/world-regions/india"" rel=""noopener"" target=""_blank"">Bangladesh, India and Pakistan</a>, disruption would not simply be an energy problem. It would become a power problem, an industry problem and then a food problem. Gas shortages do not stop at the power plant. They spill into fertilizer production, factory output and household budgets.</p><p>Europe is less exposed directly, but far from insulated. In a tight market, marginal supply sets the price. Europe would be drawn into fiercer bidding wars for replacement gas, much as it was after Russia’s invasion of Ukraine. The secondary effects would extend well beyond Europe. Higher energy prices feed into transport, insurance, fertilizer and food. </p><p>The result is <a href=""https://www.foxnews.com/category/us/economy/inflation"" rel=""noopener"" target=""_blank"">inflation in advanced economies</a> and fiscal stress in poorer and more import-dependent ones. Countries far from the Gulf would still pay a steep price for any attempt to weaponize Hormuz.</p><p>That is why Hormuz cannot be treated as a Gulf security problem to be subcontracted to Gulf states. Its disruption radiates through power markets, shipping costs, fertilizer supply chains and food security across the global south as well as the industrial world. This is not a regional dispute with international consequences. It is an attack on a <a href=""https://www.foxnews.com/category/world/global-economy/trade"" rel=""noopener"" target=""_blank"">shared economic artery</a>.</p><p><a href=""https://www.foxnews.com/media/why-trump-faces-agonizing-decision-obliterating-irans-oil-supply-he-cant-get-deal"" rel=""noopener"" target=""_blank""><strong>WHY TRUMP FACES AN AGONIZING DECISION ON OBLITERATING IRAN’S OIL SUPPLY IF HE CAN’T GET A DEAL</strong></a></p><p>For that reason, the response should not be framed primarily as a question of whose navy escorts which tanker. Force may at times be necessary to deter immediate aggression, but it is not the sustainable answer. Even limited violence, or the <a href=""https://www.foxnews.com/politics/trumps-apocalyptic-warning-iran-raises-questions-about-scope-potential-us-strikes"" rel=""noopener"" target=""_blank"">credible threat of it</a>, can send insurance costs soaring and effectively seal the strait commercially. </p><p>A militarized Hormuz is, in practice, a partially closed Hormuz. The more durable answer is economic and global: a <a href=""https://www.foxnews.com/category/politics/finance/sanctions"" rel=""noopener"" target=""_blank"">sanctions mechanism</a> so comprehensive and so credible that Iran concludes it has more to lose from threatening Hormuz than it could ever gain from coercing the world through it.</p><p><a href=""https://www.foxnews.com/opinion"" rel=""noopener"" target=""_blank""><strong><u>CLICK HERE FOR MORE FOX NEWS OPINION</u></strong></a></p><p>That means not another Western sanctions package with familiar loopholes, but a true economic quarantine prepared in advance: no Iranian oil purchases, no shipping services, no insurance, no port access, no banking channels, no petrochemical trade, no barter arrangements and no back-door facilitation through third countries. </p><p>More important, it means stating clearly in advance that these measures would follow automatically from any blockade, systematic harassment of commercial traffic or attempt to impose de facto access fees.</p><p>Such a regime would have to <a href=""https://www.foxnews.com/category/world/world-regions/china"" rel=""noopener"" target=""_blank"">include China</a>. Without Chinese participation, the exercise would be strategically unserious. A sanctions coalition that excludes one of the principal end markets for Gulf energy would amount to announcing that the world is prepared to tolerate coercion so long as it is selectively monetized. </p><p>The same logic applies to India, Japan and South Korea. They are not bystanders. They are among the principal beneficiaries of the waterway’s continued openness and among the major victims of any disruption.</p><p>The same principle applies to <a href=""https://www.foxnews.com/category/world/world-regions/russia"" rel=""noopener"" target=""_blank"">Russia and to any other state</a> tempted to help Iran evade pressure. The purpose of a genuine sanctions regime is to force a choice: Is shielding Iran worth jeopardizing more valuable relationships with Gulf states, India and other countries across the global south? A serious global sanctions threat should make that calculation unavoidable.</p><p>Hormuz is not Iran’s lever, still less its toll road. It is part of the basic infrastructure of global commerce. If Tehran tries to weaponize that fact, the world should ensure in advance that the peaceful cost to Iran would be overwhelming. </p><p>But the first thing that must be rejected is the idea that America can bargain over access. If Trump agrees to any restrictions at Hormuz, the United States will have legitimized extortion at one of the world’s central economic arteries. That would not be a deal. It would be a strategic defeat.</p>",https://www.foxnews.com/opinion/retreat-hormuz-iran-must-control-worlds-energy-lifeline,2026-04-10
19,"Fox News Campus Radicals Newsletter: Antifa-tied group's plan for chaos, school probe over transgender policy","<p><strong>RADICAL PLAYBOOK:</strong> Far-left group's training manual to <a href=""https://www.foxnews.com/politics/inside-antifa-linked-groups-plan-structurally-change-us-may-day-unrest-approaches"" rel=""noopener"" target=""_blank"">cause chaos</a> at upcoming event revealed in leaked doc</p><p><strong>WOKE SHOWDOWN:</strong> Feds launch <a href=""https://www.foxnews.com/us/department-education-investigates-massachusetts-school-district-transgender-bathroom-policy"" rel=""noopener"" target=""_blank"">Title IX probe</a> into K-12 school district over gender identity policy</p><p><strong>RECORD REVERSAL: </strong>School <a href=""https://www.foxnews.com/media/san-diego-high-school-reverses-student-suspension-over-pro-ice-flyers-deemed-harassment"" rel=""noopener"" target=""_blank"">clears student suspension</a> over pro-ICE flyers it deemed 'harassment'</p><p><strong>SIGN UP TO GET THE </strong><a href=""https://www.foxnews.com/newsletters"" rel=""noopener"" target=""_blank""><strong><u>CAMPUS RADICALS NEWSLETTER</u></strong></a></p><p><strong>‘DESERVE THE TRUTH’: </strong>Conservative group urges crackdown on <a href=""https://www.foxnews.com/politics/conservative-group-urges-crackdown-on-hidden-campus-crime-with-govt-filing-to-expose-the-true-scope"" rel=""noopener"" target=""_blank"">hidden campus crime</a></p><p><strong>‘DEEPLY INAPPROPRIATE’: </strong>GOP rep demands answers after university hosts <a href=""https://www.foxnews.com/media/gop-rep-demands-answers-after-unc-charlotte-hosts-abortion-support-training-teens-young-14"" rel=""noopener"" target=""_blank"">abortion-support training</a> for teens as young as 14</p>",https://www.foxnews.com/politics/fox-news-campus-radicals-newsletter-antifa-tied-groups-plan-chaos-school-probe-over-transgender-policy,2026-04-10
20,Streamer who said Rick Scott should be ‘killed’ invited to Yale as lawmaker demands funding cut,"<p>A Senate Republican wants federal funding revoked from Yale for a forthcoming speech from a controversial streamer who once called for him to be ""killed.""</p><p>Sen. Rick Scott, R-Fla., blasted an upcoming event at the <a href=""https://www.foxnews.com/category/us/campus-controversy"" rel=""noopener"" target=""_blank"">Ivy League university</a> featuring Twitch streamer and political commentator Hasan Piker, who has become a flashpoint for Democrats and fodder for conservatives because of his views and alignment with the far-left of the party.</p><p>Piker, who has come under fire for his previous comments that <a href=""https://www.foxnews.com/politics/democrats-team-up-with-far-left-streamer-said-america-deserved-9-11"" rel=""noopener"" target=""_blank"">""America deserved 9/11""</a> and for excusing sexual violence committed on Oct. 7, 2023, when Hamas launched a surprise attack against Israel, is set to appear at the Yale Political Union for an event dubbed ""Resolved: End the American Empire"" Tuesday.</p><p><a href=""https://www.foxnews.com/politics/senate-gop-vows-go-alone-ice-funding-dems-double-shutdown"" rel=""noopener"" target=""_blank""><strong>SENATE GOP VOWS TO ‘GO IT ALONE’ ON ICE FUNDING AS DEMS DOUBLE DOWN ON SHUTDOWN</strong></a></p><p>""This is WILD,"" Scott said on X. ""I spoke at the Yale Political Union last year on why we need to buy made in America products. Now, they are hosting a guy who said I should be killed.""</p><p>""Yale receives billions from the federal government — President Trump and Congress need to IMMEDIATELY revoke it,"" he continued. ""An elite private university that hosts an antisemite who says a Senator should be killed, capitalists should be killed, and the U.S. deserved 9/11, shouldn’t get ONE CENT from taxpayers.""</p><p>The Yale Political Union did not respond to a request for comment on Scott's push to nix funding for the university.</p><p>Scott and Piker have had a run-in, indirectly, before.</p><p><a href=""https://www.foxnews.com/media/michigan-democrat-defends-appearing-hasan-piker-distances-podcasters-controversial-remarks"" rel=""noopener"" target=""_blank""><strong>MICHIGAN DEMOCRAT DEFENDS APPEARING WITH HASAN PIKER, DISTANCES HIMSELF FROM PODCASTER'S CONTROVERSIAL REMARKS</strong></a></p><p>When Republicans were crafting President <a href=""https://www.foxnews.com/category/person/donald-trump"" rel=""noopener"" target=""_blank"">Donald Trump's</a> ""big, beautiful bill"" in 2025, Piker said during a stream — in reaction to comments from House Speaker Mike Johnson, R-La., that Republicans were targeting Medicaid fraud — that Scott should be killed.</p><p>""The reason why I'm saying, if you cared about Medicare or Medicaid fraud, you would kill Rick Scott is because — and not make him a prominent part of the Republican Party — is because he, to this day, is still also known as committing the largest Medicare fraud in U.S. history,"" Piker said.</p><p>At the time, Republicans were trying to include several provisions in the <a href=""https://www.foxnews.com/category/budget"" rel=""noopener"" target=""_blank"">budget reconciliation process</a> that they pitched as reforms to Medicaid designed to cut costs and root out fraud in the system.</p><p><a href=""https://www.foxnews.com/politics/squad-member-summer-lee-calls-upper-class-enemy-el-sayed-rally"" rel=""noopener"" target=""_blank""><strong>SQUAD MEMBER SUMMER LEE CALLS 'UPPER CLASS' THE 'ENEMY' AT EL-SAYED RALLY</strong></a></p><p>A provider rate crackdown; denying states Medicaid funding for having illegal immigrants on the benefit rolls; preventing illegal immigrants from participating in Medicaid and the Children’s Health Insurance Program (CHIP); and preventing <a href=""https://www.foxnews.com/category/politics/senate/health-care"" rel=""noopener"" target=""_blank"">Medicaid and CHIP funding</a> from going toward gender-affirming care were all on the table.</p><p>However, those provisions were gutted from the bill for not complying with the strict guardrails that dictate the reconciliation process. Still, Republicans were able to include stringent work requirements for the healthcare program.</p><p>Scott’s office didn’t comment on Piker’s Medicare fraud accusation but told Fox News Digital that ""no <a href=""https://www.foxnews.com/category/politics"" rel=""noopener"" target=""_blank"">Democrat elected official</a> calls this guy out and the press seems to give all the Democrats a pass for actively campaigning with him.""</p><p>Piker's management team and Yale did not immediately respond to a request for comment. </p>",https://www.foxnews.com/politics/streamer-who-said-rick-scott-should-killed-invited-yale-lawmaker-demands-funding-cut,2026-04-10
