,title,text,link,publish_date
0,Travel experts warn against one tipping habit while visiting popular vacation spots,"<p>For American travelers, tipping may feel second nature — but <a href=""https://www.foxnews.com/category/world/world-regions/europe"" rel=""noopener"" target=""_blank"">in Europe</a>, that instinct can backfire.</p><p>While navigating new currencies and customs, small gestures like leaving loose change on the table may not translate well, travel expert Rick Steves warns.</p><p>""You're just raising the bar and messing up the <a href=""https://www.foxnews.com/category/travel/regions/europe"" rel=""noopener"" target=""_blank"">local balance</a>,"" Steves <a href=""https://www.ricksteves.com/travel-tips/money/tipping-in-europe"" rel=""noopener nofollow"" target=""_blank"">wrote in a blog post.</a> ""And it's bad style.""</p><p>And in busy settings, ""the wrong party might pocket the change,"" Steves warned.</p><p><a href=""https://www.foxnews.com/food-drink/bartenders-say-one-common-request-costs-them-tips-customers-have-no-idea"" rel=""noopener"" target=""_blank""><strong>BARTENDERS SAY ONE COMMON REQUEST COSTS THEM TIPS — AND SOME CUSTOMERS HAVE NO IDEA</strong></a></p><p>In countries like Germany, Austria, Belgium and Luxembourg, plus parts of Switzerland and Liechtenstein, tipping with coins can even be perceived as rude, <a href=""https://www.mashed.com/2121231/rick-steves-warns-tipping-coins-european-countries/"" rel=""noopener nofollow"" target=""_blank"">according to Mashed.</a></p><p>The expectation differs from the U.S., where servers often rely on tips to supplement low base wages — a dynamic that, along with constant digital tipping prompts, has fueled growing frustration. Nearly nine in 10 Americans say tipping culture is ""out of control,"" <a href=""https://www.foxnews.com/food-drink/americans-fed-up-tipping-culture-nearly-9-10-say-its-completely-out-control"" rel=""noopener"" target=""_blank"">Fox News Digital recently reported.</a></p><p>But in Europe, where servers are paid a living wage, tipping is not a necessity and handing over a handful of small coins may come across as dismissive.</p><p><a href=""https://www.foxnews.com/food-drink/restaurants-warn-tipped-wage-changes-could-raise-prices-cut-jobs-reshape-dining-experience"" rel=""noopener"" target=""_blank""><strong>RESTAURANTS WARN TIPPED WAGE CHANGES COULD RAISE PRICES, CUT JOBS, RESHAPE DINING EXPERIENCE</strong></a></p><p>""It is not always the amount alone that shapes the impression,"" said LaDell Carter, founding partner of Royal Expression Travels in Maryland. ""It is the presentation and the intention behind it,"" she told Fox News Digital.</p><p>Carter added that <a href=""https://www.foxnews.com/category/lifestyle/social-etiquette"" rel=""noopener"" target=""_blank"">in more refined settings</a>, particularly, scattered coins can feel like an afterthought.</p><p>That doesn’t mean travelers should abandon tipping altogether.</p><p><a href=""https://www.foxnews.com/newsletters?cmpid=fnfirstnl"" rel=""noopener"" target=""_blank""><strong>CLICK HERE TO SIGN UP FOR OUR LIFESTYLE NEWSLETTER</strong></a></p><p>Steves advises a simple, face-to-face approach that is especially appropriate in <a href=""https://www.foxnews.com/category/world/world-regions/germany"" rel=""noopener"" target=""_blank"">Germanic countries</a>, where leaving coins behind is frowned upon. When settling a 10-euro bill with a 20-euro note, say ""Eleven, please,"" signaling the server to keep 1 euro as a tip and return the rest in change.</p><p>When percentages are used, they’re modest by American standards. Around 5% is considered adequate, while 10% is generous, according to Steves. In fact, tipping 15% to 20% can be seen as excessive. ""Resist the urge to tip American-style,"" he advises.</p><p><a href=""https://www.foxnews.com/lifestyle"" rel=""noopener"" target=""_blank""><strong>CLICK HERE FOR MORE LIFESTYLE STORIES</strong></a></p><p>Payment method also matters. While card payments are widely accepted, tips are often best given in cash to ensure they go directly to the server, as some businesses may not pass along card-based gratuities in full.</p><p>Steves also recommends skipping tips at casual counter-service spots, rounding up taxi fares and giving small <a href=""https://www.foxnews.com/category/travel/general/hotels"" rel=""noopener"" target=""_blank"">tips to guides and hotel staff</a>.</p><p>It's important to keep in mind that a one-size-fits-all approach won't work in Europe, said Steve Schwab, Arizona-based CEO of Casago, a vacation rental and property management company.</p><p>""It can vary from one country to the next, so we can’t exactly generalize it as 'European tipping culture,'"" Schwab told Fox News Digital.</p><p>""In general, the Nordic countries are the ones where tipping is least expected, largely because they are known for paying high wages and/or including service charges in their bills already,"" he added.</p><p><a href=""https://www.foxnews.com/category/lifestyle/quizzes"" rel=""noopener"" target=""_blank""><strong>TEST YOURSELF WITH OUR LATEST LIFESTYLE QUIZ</strong></a></p><p>Experts also recommend reviewing the bill carefully, checking for built-in service charges and observing local customs before deciding what to leave. When it doubt, don't be afraid to ask the locals for country-specific norms.</p>",https://www.foxnews.com/travel/travel-experts-warn-one-tipping-habit-visiting-popular-vacation-spots,2026-04-04
1,"Archaeologists find 2,100-year-old bullet that sent 'sarcastic' message to enemy forces","<p>Archaeologists have uncovered a 2,100-year-old sling bullet <a href=""https://www.foxnews.com/travel"" rel=""noopener"" target=""_blank"">in Israel</a> — inscribed with a sarcastic message aimed at enemy forces.</p><p>The scientists found the bullet in a necropolis area along an ancient road <a href=""https://www.foxnews.com/category/travel/general/historic-sites"" rel=""noopener"" target=""_blank"">at Hippos</a>, once a prominent bishop's seat during the Byzantine era. The city was known as Susita during the Hellenistic period, which lasted from 323 B.C. to about 31 B.C.</p><p>The projectile, which officials date to the second century B.C., was carved with the Greek word, ""Learn,"" according to a press release obtained by Fox News Digital.</p><p><a href=""https://www.foxnews.com/travel/coin-used-bus-fare-turns-out-2000-year-old-relic-its-journey-mystery"" rel=""noopener"" target=""_blank""><strong>COIN USED AS BUS FARE TURNS OUT TO BE 2,000-YEAR-OLD RELIC, ITS JOURNEY STILL A MYSTERY</strong></a></p><p>A picture of the ancient, oval-shaped <a href=""https://www.foxnews.com/category/science/archaeology"" rel=""noopener"" target=""_blank"">lead sling bullet</a> shows faint traces of the Greek script.</p><p>Michael Eisenberg, Ph.D., a University of Haifa archaeologist who recently published his findings in the journal PEQ, along with colleague Arleta Kowalewska, believes the phrase was a sarcastic taunt.</p><p>""At Hippos alone, 69 such projectiles have been identified so far, but this is <a href=""https://www.foxnews.com/category/odd-news"" rel=""noopener"" target=""_blank"">the first in the world</a> to bear the inscription 'Learn,'"" said Eisenberg, per the March release.</p><p>""This represents local sarcastic humor on the part of the city's defenders, who wished to teach their enemies a lesson with a wink: ‘Learn your lesson!’""</p><p>The artifact is roughly 3.2 centimeters long and 1.95 centimeters wide, weighing 38 grams.</p><p><a href=""https://www.foxnews.com/category/lifestyle/quizzes"" rel=""noopener"" target=""_blank""><strong><u>TEST YOURSELF WITH OUR LATEST LIFESTYLE QUIZ</u></strong></a></p><p>Excavators observed signs of impact damage on the projectile and believe it once weighed 45 grams.</p><p>The projectile was likely ""fired by the city’s defenders from the city walls toward the enemy advancing to besiege the city,"" officials said.</p><p>Lead bullets were considered a cheap but lethal form of ammunition at the time.</p><p>""Sling bullets were produced by casting lead in stone molds in a relatively simple process that could be carried out even <a href=""https://www.foxnews.com/category/us/military"" rel=""noopener"" target=""_blank"">during a military campaign</a>,"" the release noted.</p><p><a href=""https://www.foxnews.com/newsletters?cmpid=fnfirstnl"" rel=""noopener"" target=""_blank""><strong><u>CLICK HERE TO SIGN UP FOR OUR LIFESTYLE NEWSLETTER</u></strong></a></p><p>Officials said that ""many projectiles were decorated with the name of a military commander, the name of a city, sarcastic humor similar to ‘Catch!' or symbols intended to imbue them with power, such as a trident, lightning bolt or scorpion.""</p><p>The artifact represents an unusual and unprecedented find, said Eisenberg.</p><p>""To find a sling bullet with an inscription is very rare; to find this <a href=""https://www.foxnews.com/travel/long-lost-sanctuary-greek-god-discovered-archaeologists-larger-than-life"" rel=""noopener"" target=""_blank"">Greek word</a> on a sling bullet is the first time in the world,"" Eisenberg told Fox News Digital.</p><p>""We know of similar mocking or sarcastic humor directed at the enemy, but this specific example was unknown and reveals the humorous local trend among the Hellenistic defenders of Hippos.""</p><p><a href=""https://www.foxnews.com/lifestyle"" rel=""noopener"" target=""_blank""><strong><u>CLICK HERE FOR MORE LIFESTYLE STORIES</u></strong></a></p><p>He also noted the significance of where it was found — which strongly suggests it was fired during a siege. </p><p>""The bullet's location near the ancient main road below the city's fortifications, in addition to the impact mark on the bullet, supplies a colorful reconstruction of the defenders shooting the bullet toward the besieging forces advancing towards the city,"" said Eisenberg.</p><p>The discovery adds to a growing list of major archaeological finds at Hippos.</p><p>Excavations unearthed a <a href=""https://www.foxnews.com/travel/worlds-oldest-known-nursing-home-discovered-ruins-ancient-christian-city-dates-back-1600-years"" rel=""noopener"" target=""_blank"">1,600-year-old Christian care facility</a> for the elderly at Hippos last year, possibly the world's oldest nursing home.</p><p>Also at Hippos, archaeologists found a <a href=""https://www.foxnews.com/travel/treasure-trove-gold-coins-ancient-jewelry-unearthed-christian-city-sea-galilee"" rel=""noopener"" target=""_blank"">trove of ancient jewelry</a> and gold coins last year, thanks to metal detectors.</p>",https://www.foxnews.com/travel/archaeologists-find-2100-year-old-bullet-sent-sarcastic-message-enemy-forces,2026-04-04
2,At least 13 people injured after vehicle slams into Louisiana parade: sheriff's office,"<p>More than a dozen people have been <a href=""https://www.foxnews.com/category/health/health-care"" rel=""noopener"" target=""_blank"">taken to the hospital</a> after a vehicle struck multiple parade participants on Saturday in New Iberia, Louisiana.</p><p>The <a href=""https://www.foxnews.com/category/us/us-regions/southeast/louisiana"" rel=""noopener"" target=""_blank"">Iberia Parish</a> Sheriff's Office said the crash happened at an intersection and multiple people were injured.</p><p>Acadian Ambulance, a local ambulance service, reported it took 11 patients to the hospital by ambulance and two patients by medical helicopter.</p><p>The sheriff's office said some of the injuries are believed to be serious.</p><p><a href=""https://www.foxnews.com/us/car-barrels-crowd-outside-california-bar-gunfire-erupts-chaotic-scene-caught-video"" rel=""noopener"" target=""_blank""><strong>CAR BARRELS INTO CROWD OUTSIDE CALIFORNIA BAR, GUNFIRE ERUPTS IN CHAOTIC SCENE CAUGHT ON VIDEO</strong></a></p><p>Ten ambulances and two helicopters responded to the scene, according to Acadian.</p><p>Deputies confirmed the driver, who has not yet been publicly identified, is <a href=""https://www.foxnews.com/category/us/crime/police-and-law-enforcement"" rel=""noopener"" target=""_blank"">in custody</a>.</p><p>Based on the preliminary investigation, officials said the wreck ""does not appear to be an intentional act.""</p><p>It is unclear what led to the incident.</p><p>New Iberia is a small Cajun town located in southern Louisiana, about 30 minutes away from Lafayette.</p><p><i>This is a developing story. Please check back for updates.</i></p>",https://www.foxnews.com/us/people-injured-vehicle-slams-louisiana-parade-sheriffs-office,2026-04-04
3,Vince McMahon faces graphic sexual abuse allegations in new court filing from ex-WWE employee,"<p>A <a href=""https://www.foxnews.com/category/organization/wwe"" rel=""noopener"" target=""_blank"">former WWE employee</a> who is suing the company and its former CEO, Vince McMahon, made new and graphic allegations in a filing in the U.S. District Court of Connecticut earlier this week.</p><p>Janel Grant, who filed her initial lawsuit against WWE, McMahon and former executive John Laurinaitis, detailed more claims about how she was allegedly recruited to work for WWE, the alleged ""abuse"" she received while WWE leaders allegedly did nothing and other assertions.</p><p><a href=""https://www.foxnews.com/sports"" rel=""noopener"" target=""_blank""><strong>CLICK HERE FOR MORE SPORTS COVERAGE ON FOXNEWS.COM</strong></a></p><p>Laurinaitis was previously removed from the lawsuit.</p><p>Fox News Digital reached out to McMahon’s lawyer and WWE for comment.</p><p>Grant, who worked at WWE from June 2019 to 2022, alleged that she was ""subjected to repeated physical and emotional abuse, sexual assault, and <a href=""https://www.foxnews.com/sports/wwe-fans-react-brock-lesnars-return-amid-sex-trafficking-case-involvement-just-coward-stuff"" rel=""noopener"" target=""_blank"">sexual trafficking perpetrated</a>"" by McMahon and ""most senior officials and talent, knew about and facilitated the abuse"" she experienced.</p><p>""Instead of protecting Ms. Grant, WWE and McMahon conspired to use his coercive control over her to conceal its leaders’ wrongdoing and bar Ms. Grant from speaking out or seeking help,"" the lawsuit read.</p><p>Grant made allegations of having ""violent"" sexual encounters with McMahon and others.</p><p>""Throughout the three years, sex was violent, invasive, degrading, and produced injuries that could not heal because there would consistently be subsequent violent encounters, often involving other men or objects,"" the lawsuit read. ""Ms. Grant did not raise a complaint concerning her abuse because she lived in a state of duress and was fully under McMahon’s control, her survival ultimately depending on her complete submission to McMahon.""</p><p><a href=""https://www.foxnews.com/sports/dashcam-video-shows-former-wwe-executive-vince-mcmahon-rear-ending-vehicle-connecticut-highway"" rel=""noopener"" target=""_blank""><strong>DASHCAM VIDEO SHOWS FORMER WWE EXECUTIVE VINCE MCMAHON REAR-ENDING VEHICLE ON CONNECTICUT HIGHWAY</strong></a></p><p>Grant claimed in the lawsuit that McMahon pressured her to sign a non-disclosure agreement (NDA) and that he allegedly sexually assaulted after she signed the document.</p><p>The sordid allegations are a part of an <a href=""https://www.foxnews.com/category/us/crime/trials"" rel=""noopener"" target=""_blank"">ongoing lawsuit</a> between the parties.</p><p>McMahon stepped down as the CEO of WWE in 2022, and stepped down from TKO in 2024 after the initial lawsuit was filed. He has maintained his innocence through the process.</p><p>""The Complaint’s outrageous claims of sexual abuse and coercion are pure fiction—plainly intended to garner publicity—and are flatly contradicted by Plaintiff’s own contemporaneous statements,"" McMahon said in an April 2024 filing. ""Contrary to Plaintiff’s false allegations, Plaintiff and Defendant (collectively, the ‘Parties’) engaged in a consensual relationship during which Defendant never coerced Plaintiff into doing anything and never mistreated her in any way.</p><p>""In fact, in a love letter Plaintiff wrote to Defendant shortly before the Parties ended their relationship, Plaintiff described Defendant as ‘[m]y best friend, my love and my everything,’ praising him for being the ‘wonderful, tender, vulnerable, heart-on-your-sleeve soul you really are.’ It is incredulous that Plaintiff, a then 42-year-old woman who claims on her resume to have a law degree from Pace University, would have written these words to Defendant months after all the events in the Complaint of alleged abuse, coercion, and ‘sex-trafficking’ took place.""</p><p>TKO Group told The Associated Press in January 2024 it took Grant’s allegations ""very seriously.""</p><p>""Mr. McMahon does not control TKO nor does he oversee the day-to-day operations of WWE,"" the company said at the time. ""While this matter pre-dates our TKO executive team’s tenure at the company, we take Ms. Grant’s horrific allegations very seriously and are addressing this matter internally.""</p><p><strong><em>Follow Fox News Digital’s</em></strong><a href=""https://twitter.com/FoxNewsSports_"" rel=""noopener noreferrer nofollow"" target=""_blank""><strong><em> </em></strong></a><a href=""https://twitter.com/FoxNewsSports_"" rel=""noopener"" target=""_blank""><strong><em><u>sports coverage on X</u></em></strong></a><strong><em> and subscribe to</em></strong><a href=""https://www.foxnews.com/newsletters"" rel=""noopener"" target=""_blank""><strong><em><u> the Fox News Sports Huddle newsletter</u></em></strong></a><strong><em>.</em></strong></p>",https://www.foxnews.com/sports/vince-mcmahon-faces-graphic-sexual-abuse-allegations-new-court-filing-ex-wwe-employee,2026-04-04
4,New York Jets own the longest playoff drought in major North American pro sports after the Sabres clinched,"<p>Misery loves company, but unfortunately for the <a href=""https://www.foxnews.com/category/sports/nfl/new-york-jets"" rel=""noopener"" target=""_blank"">New York Jets</a>, they don’t have any more company.</p><p>With the <a href=""https://www.foxnews.com/category/sports/nhl/buffalo-sabres%20"" rel=""noopener"" target=""_blank"">Buffalo Sabres</a> clinching a playoff berth for the first time in 14 seasons and ending the longest playoff drought in NHL history, the Jets now have sole possession of the longest playoff drought among any team in major North American professional sports.</p><p>The last time the Jets made the playoffs was the 2010 season, when they lost in the AFC Championship Game to the Pittsburgh Steelers. Barring a miraculous turnaround, it seems unlikely the Jets will make the playoffs next season.</p><p><a href=""https://www.foxnews.com/sports"" rel=""noopener"" target=""_blank""><strong>CLICK HERE FOR MORE SPORTS COVERAGE ON FOXNEWS.COM</strong></a></p><p>In Aaron Glenn’s first season as head coach, the team went 3-14 and became the first team in NFL history not to record an interception over the course of the season. At the trade deadline, they traded away star defenders Sauce Gardner and Quinnen Williams in exchange for draft picks.</p><p><a href=""https://www.foxnews.com/category/person/justin-fields"" rel=""noopener"" target=""_blank"">Justin Fields</a> only started nine games for the Jets due to injury after being signed last offseason with hopes he could blossom into a starting quarterback. Backup Tyrod Taylor started four games before he was injured, and the team was forced to start undrafted rookie Brady Cook for four games.</p><p>The Jets overhauled their quarterback room as they look to retool. They traded Fields to the <a href=""https://www.foxnews.com/category/sports/nfl"" rel=""noopener"" target=""_blank"">Kansas City Chiefs;</a> Taylor remains a free agent, while Cook remains on the roster.</p><p><a href=""https://www.foxnews.com/sports/sabres-end-longest-playoff-drought-nhl-history-clinching-berth-first-time-since-2011"" rel=""noopener"" target=""_blank""><strong>SABRES END LONGEST PLAYOFF DROUGHT IN NHL HISTORY, CLINCHING BERTH FOR FIRST TIME SINCE 2011</strong></a></p><p>The Jets acquired Geno Smith, who spent four seasons with the franchise after being drafted in 2013, from the Las Vegas Raiders to be their starting quarterback.</p><p>Smith had a rough season with the Raiders, leading the <a href=""https://www.foxnews.com/category/sports/nfl"" rel=""noopener noreferrer nofollow"" target=""_blank"">NFL</a> with 17 interceptions despite missing two games due to injury. He completed 67.4% of his passes for 3,205 yards with 19 touchdowns and 17 interceptions.</p><p>For the Jets to end their playoff drought, they hope their two first-round picks in <a href=""https://www.foxnews.com/category/sports/nfl-draft"" rel=""noopener"" target=""_blank"">this year’s draft</a>, No. 2 overall and No. 16 overall, along with Smith and the rest of their free agent class, can turn things around.</p><p>If they don’t turn it around, the longest playoff drought in major North American pro sports will continue for another year.</p><p><strong><em>Follow Fox News Digital’s</em></strong><a href=""https://twitter.com/FoxNewsSports_"" rel=""noopener noreferrer nofollow"" target=""_blank""><strong><em> sports coverage on X</em></strong></a><strong><em>, and subscribe to</em></strong><a href=""https://www.foxnews.com/newsletters"" rel=""noopener"" target=""_blank""><strong><em> the Fox News Sports Huddle newsletter</em></strong></a><strong><em>.</em></strong></p>",https://www.foxnews.com/sports/new-york-jets-longest-playoff-drought-major-north-american-pro-sports-sabres-clinched,2026-04-04
5,"LeBron James reiterates displeasure playing in Memphis, Milwaukee; adds Cleveland to list","<p><a href=""https://www.foxnews.com/category/person/lebron-james"" rel=""noopener"" target=""_blank"">LeBron James</a> on Saturday doubled down on his comments about his dislike for playing in the cities of Memphis and Milwaukee, and threw Cleveland into the mix as well.</p><p>The Los Angeles Lakers star appeared on <a href=""https://www.youtube.com/watch?v=1-TBB3y88QQ"" rel=""noopener nofollow"" target=""_blank"">""Bob Does Sports""</a> and criticized Memphis. He said the league would be better off if the team moved to Nashville – a city that already has the NFL’s Tennessee Titans and the NHL’s Nashville Predators playing there with hopes of a future MLB team.</p><p><a href=""https://www.foxnews.com/sports"" rel=""noopener"" target=""_blank""><strong>CLICK HERE FOR MORE SPORTS COVERAGE ON FOXNEWS.COM</strong></a></p><p>He also appeared to take issue with playing on a ""<a href=""https://www.foxnews.com/category/sports/nba/milwaukee-bucks"" rel=""noopener"" target=""_blank"">random f---ing Tuesday in Milwaukee</a>.""</p><p>James received backlash on social media for his remarks and was asked about his comments during practice.</p><p>""Milwaukee was, too. Did they miss that one, too? They didn’t see that?"" he said when asked about the Memphis remarks, <a href=""https://www.nytimes.com/athletic/7172108/2026/04/04/lebron-james-memphis-milwaukee-comments/"" rel=""noopener nofollow"" target=""_blank"">via The Athletic</a>. ""Forty-one years old. It’s two cities I do not like playing in right now. That’s Milwaukee, and that’s Memphis. What is the problem?</p><p>""I don’t like going home either. S---, and I’m from there. People are ridiculous. They also get mad at my son (Bronny) being on the team, too. So what are we talking about? People need to figure out other ways to put their energy to other things that’s important. Like seriously? I’m not talking about the city, like the people in Memphis. I don’t like staying at the Hyatt Centric. What’s wrong with that? Nothing. What are we talking about? What are we talking about? People need to chill the hell out.""</p><p><a href=""https://www.foxnews.com/sports/lebron-james-dodges-retirement-questions-after-making-record-22nd-all-star-game-appearance"" rel=""noopener"" target=""_blank""><strong>LEBRON JAMES DODGES RETIREMENT QUESTIONS AFTER MAKING RECORD 22ND ALL-STAR GAME APPEARANCE</strong></a></p><p>Memphis Grizzlies head coach Tuomas Iisalo and <a href=""https://www.foxnews.com/category/sports/nba/toronto-raptors"" rel=""noopener"" target=""_blank"">Toronto Raptors</a> head coach Darko Rajakovic responded to James’ remarks. Rajakovic was an assistant with the Grizzlies before he took the Raptors’ job.</p><p>""I can say from my own perspective that I have the complete opposite — 180-degree perspective on that,"" Iisalo said. ""The Memphis where we have arrived less than two years ago has been very warm. Very welcoming.""</p><p>Rajakovic suggested he didn’t really care about what other people said about the city.</p><p>""I don't care what the rest of the world thinks. I love the people of Memphis,"" he said. ""I love the food. I love every single time I come over here.""</p><p><em>The Associated Press contributed to this report.</em></p><p><strong><em>Follow Fox News Digital’s</em></strong><a href=""https://twitter.com/FoxNewsSports_"" rel=""noopener noreferrer nofollow"" target=""_blank""><strong><em> </em></strong></a><a href=""https://twitter.com/FoxNewsSports_"" rel=""noopener"" target=""_blank""><strong><em><u>sports coverage on X</u></em></strong></a><strong><em> and subscribe to</em></strong><a href=""https://www.foxnews.com/newsletters"" rel=""noopener nofollow"" target=""_blank""><strong><em><u> the Fox News Sports Huddle newsletter</u></em></strong></a><strong><em>.</em></strong></p>",https://www.foxnews.com/sports/lebron-james-reiterates-displeasure-playing-memphis-milwaukee-adds-cleveland-list,2026-04-04
