,title,text,link,publish_date
0,Trump blasts Biden admin for releasing illegal immigrant now charged in fatal hammer attack on Florida mother,"<p>President Donald Trump on Thursday condemned a violent video allegedly showing a Haitian illegal alien fatally attacking a Florida mother with a hammer last week, blasting the Biden administration for releasing the suspect in 2022.</p><p>Rolbert Joachim, 40, is charged with <a href=""https://www.foxnews.com/category/us/crime/homicide"" rel=""noopener"" target=""_blank""><u>second-degree murder</u></a> and criminal damage to property after he was caught on camera bludgeoning the mother of two in broad daylight last Friday outside a <a href=""https://www.foxnews.com/category/us/us-regions/southeast/florida"" rel=""noopener"" target=""_blank"">Fort Myers</a> gas station.</p><p>""An Illegal Alien Criminal from Haiti, who was released into our Country by the WORST President in History, Crooked Joe Biden, and the Radical Democrats in Congress, just beat an innocent woman to death with a hammer at a gas station in Florida,"" Trump wrote in a Truth Social post. ""The video of her brutal slaying is one of the most vicious things you will ever see.</p><p>""This one killing should be enough for these Radical Judges to STOP impeding my Administration’s Immigration Policies, and allow us to END THIS SCAM ONCE AND FOR ALL,"" he added. </p><p><a href=""https://www.foxnews.com/us/daylight-hammer-attack-suspect-illegal-alien-released-under-biden-policies-dhs"" rel=""noopener"" target=""_blank""><strong>DAYLIGHT HAMMER ATTACK SUSPECT IS ILLEGAL ALIEN RELEASED UNDER BIDEN POLICIES: DHS</strong></a></p><p>Joachim first entered the U.S. in August 2022, and was released into the country under former President Joe Biden, according to the Department of Homeland Security (<a href=""https://www.foxnews.com/category/us/immigration/enforcement"" rel=""noopener"" target=""_blank"">DHS</a>).</p><p>A federal judge later issued a final order of removal against Joachim, but he was granted Temporary Protected Status, which Trump has described as ""a massively abused and fraudulent program."" He has also blamed what he called ""radical liberal district court judges"" for blocking efforts by his administration to end it.</p><p>While a federal judge issued a final order of removal against him, Joachim was reportedly granted Temporary Protected Status, a program Trump called ""massively abused and fraudulent"" and difficult to eliminate due to Democratic support.</p><p>The suspect then remained in the country after his status expired in 2024.</p><p><a href=""https://www.foxnews.com/us/suspect-fatal-new-jersey-hit-run-crash-illegal-alien-fugitive-dhs"" rel=""noopener"" target=""_blank""><strong><u>SUSPECT IN FATAL NEW JERSEY HIT-AND-RUN CRASH IS ILLEGAL ALIEN, FUGITIVE: DHS</u></strong></a></p><p>Trump further said Democrats are turning the United States into what he called a ""dumping ground,"" flooded with tens of millions of unvetted and ""mentally insane"" individuals.</p><p>""To my fellow Republicans, and frankly all Common Sense Americans, NEVER FORGET that Joe Biden and the Democrat Party turned the United States of America into a dumping ground, allowing Tens of MILLIONS of Criminals, Lunatics, and the Mentally Insane from all over the World to pour into our Country, totally unvetted and unchecked through our wide Open Borders,"" he said. </p><p>""As I’ve said all along, if you import the Third World, you become the Third World, and that is what happened over the four years of Democrat Control.""</p><p>In the attack, the female victim was reportedly a store clerk at the gas station.</p><p>According to the footage, she was repeatedly struck in the head with a hammer after confronting the suspect for smashing her car window.</p><p>Trump urged prayers for the victim, who was the mother of two teenage daughters, according to <a href=""https://www.gulfcoastnewsnow.com/article/fort-myers-community-mourns-mother-killed-gas-station/70930881""><u>a </u></a><a href=""https://www.gulfcoastnewsnow.com/article/fort-myers-community-mourns-mother-killed-gas-station/70930881"" rel=""nofollow""><u>report</u> </a>from local outlet Gulf Coast News.</p><p>""Please say a prayer for this innocent woman’s family. We will ensure quick and severe JUSTICE is served in this case!"" Trump said. </p><p><i>Fox News' Alexandra Koch and Bill Melugin contributed to this report. </i></p>",https://www.foxnews.com/politics/trump-blasts-biden-admin-releasing-haitian-immigrant-charged-fatal-hammer-attack-florida-mother,2026-04-09
1,"Coast Guard seizes over 4,500 pounds of cocaine worth $34M from suspected narco-terrorist vessel on Easter","<p>The <a href=""https://www.foxnews.com/category/us/military/coast-guard"" rel=""noopener"" target=""_blank"">U.S. Coast Guard</a> seized more than 4,500 pounds of cocaine worth nearly $34 million what officials described as a suspected ""narco-terrorist"" vessel in the Eastern Pacific on Easter Sunday, according to DHS.</p><p>According to the Department of Homeland Security (DHS), the Coast Guard cutter Escanaba was alerted by a maritime patrol aircraft that the crew of a suspected narco-terrorist vessel was throwing contraband overboard.</p><p>The Coast Guard deployed an MH-65 Dolphin helicopter aircrew to investigate the vessel, which was operating off the coast of Manta, Ecuador.</p><p>DHS said the Escanaba crew deployed a cutter pursuit boat and recovered more than 4,510 pounds of cocaine.</p><p><a href=""https://www.foxnews.com/politics/hegseth-cartel-operations-halt-us-strikes"" rel=""noopener"" target=""_blank""><strong>HEGSETH SAYS US STRIKES FORCE SOME CARTEL LEADERS TO HALT DRUG OPERATIONS</strong></a></p><p>DHS Secretary <a href=""https://www.foxnews.com/category/person/markwayne-mullin"" rel=""noopener"" target=""_blank"">Markwayne Mullin</a> said the recovery was part of Operation Pacific Viper, a Coast Guard counter-drug operation launched in August 2025 in the Eastern Pacific.</p><p>""Operation Pacific Viper plays a central part of President Trump’s fight against the cartels at sea, cutting off their ability to make money by trafficking their poison into our country,"" Mullin said in a statement. ""This operation has already <a href=""https://www.foxnews.com/category/us/crime/drugs"" rel=""noopener"" target=""_blank"">seized over 215,000 pounds of cocaine</a> and has arrested over 160 suspected narco-traffickers.""</p><p>He added, ""The brave men and women of the Coast Guard are saving American lives by keeping these deadly drugs out of our communities and off our streets.""</p><p><a href=""https://www.foxnews.com/us/video-captures-us-strike-suspected-narco-vessel-eastern-pacific-coast-guard-searches-3-survivors"" rel=""noopener"" target=""_blank""><strong>VIDEO CAPTURES US STRIKE ON SUSPECTED NARCO VESSEL IN EASTERN PACIFIC, COAST GUARD SEARCHES FOR 3 SURVIVORS</strong></a></p><p>DHS said the Coast Guard’s efforts to disrupt drug trafficking in the Eastern Pacific are a key part of the <a href=""https://www.foxnews.com/category/politics/executive/homeland-security"" rel=""noopener"" target=""_blank"">Trump administration’s initiative</a> to combat narco-terrorism and dismantle transnational criminal organizations.</p><p>Through Operation Pacific Viper, the Coast Guard has seized more than 215,000 pounds of cocaine and apprehended more than 160 suspected narco-traffickers, according to DHS.</p><p>According to DHS, the operation included the Coast Guard's largest drug seizure in its history, when it recovered more than 76,000 pounds of illegal drugs in August 2025, valued at $473 million. The total reflects multiple interdictions combined into a single offload.</p><p>The Coast Guard also seized nearly 50,000 pounds of illicit drugs in November 2025, valued at $362 million — one of the largest totals attributed to a Coast Guard cutter from multiple interdictions, according to DHS.</p>",https://www.foxnews.com/us/coast-guard-seizes-4500-pounds-cocaine-worth-34m-suspected-narco-terrorist-vessel-easter,2026-04-09
2,ICE says more criminal migrants arrested on 1-year anniversary of program to support victims of migrant crime,"<p>Immigration and Customs Enforcement announced on Thursday it had arrested more alleged illegal migrants who have been convicted of various crimes, which coincides with the one-year anniversary of the agency reopening its program to support victims of <a href=""https://www.foxnews.com/category/us/immigration/migrant-crime"" rel=""noopener"" target=""_blank"">migrant crime</a>. The arrests and convictions described by ICE have not been independently verified.</p><p>ICE's Victims of Immigration Crime Engagement (VOICE) Office was relaunched on April 10, 2025, aiming to offer resources to victims of crimes committed by illegal migrants and the victims' families.</p><p>The program was first launched in 2017 under President <a href=""https://www.foxnews.com/category/person/donald-trump"" rel=""noopener"" target=""_blank"">Donald Trump's</a> first administration but was replaced in 2021 by the Victims Engagement and Services Line, a different program under the Biden administration before it was relaunched last year after Trump returned to office.</p><p>ICE said the anniversary of the program's reopening comes just after multiple arrests were made on Wednesday of suspected illegal migrants convicted of crimes such as injury to a child, assault and robbery. ICE did not specify whether the individuals were newly arrested or transferred from local custody following prior convictions, nor did it provide dates for the underlying convictions.</p><p><a href=""https://www.foxnews.com/us/ice-detainer-lodged-illegal-migrant-accused-murdering-15-year-old-missouri-boy-begged-life"" rel=""noopener"" target=""_blank""><strong>ICE DETAINER LODGED FOR ILLEGAL MIGRANT ACCUSED OF MURDERING 15-YEAR-OLD MISSOURI BOY WHO BEGGED FOR HIS LIFE</strong></a></p><p>""The brave men and women of ICE law enforcement continue to target criminal illegal aliens in our communities to prevent another American from being raped, maimed, or murdered by an illegal alien who should have NEVER been in our country. The American victims are [why] we fight,"" Department of Homeland Security Acting Assistant Secretary of Public Affairs Lauren Bis said in a statement to Fox News Digital.</p><p>""Yesterday, ICE arrested multiple violent assailants, including one depraved monster who injured a CHILD. With every arrest, ICE is making American communities safer. We will never stop fighting for justice for the victims of illegal alien crime,"" Bis continued.</p><p>The agency offered a sample of <a href=""https://www.foxnews.com/category/crime"" rel=""noopener"" target=""_blank"">some of the arrests</a>. ICE did not say how many total individuals were arrested nationwide as part of this announcement.</p><p><a href=""https://www.foxnews.com/politics/dhs-preps-deportation-alleged-ms-13-gang-member-wanted-pastors-murder-el-salvador"" rel=""noopener"" target=""_blank""><strong><u>DHS PREPS DEPORTATION OF ALLEGED MS-13 GANG MEMBER WANTED FOR PASTOR'S MURDER IN EL SALVADOR</u></strong></a></p><p>Juan Lorenzo Hurtado-Flores, from Peru, was convicted of criminal obstruction of breathing or blood circulation and injury to a child in White Plains, New York, according to ICE.</p><p>Vu Nguyen, from Vietnam, was convicted of assault with a semiautomatic firearm in Pasadena, California, the agency said.</p><p>The agency said Omar Alexander Rodriguez-Grande, from El Salvador, was convicted of aggravated assault with a deadly weapon in Harris County, Texas.</p><p>Oscar Fransisco, from Guatemala, was convicted of aggravated assault with a deadly weapon in Palm Beach, Florida, according to the agency.</p><p>ICE said Josue Coreas-Chavez, from El Salvador, was convicted of robbery in Riverhead, New York.</p><p>""Illegal aliens harming American citizens is unconscionable. But now, thanks to President Trump, we're able to help people victimized by criminal aliens through the VOICE Office,"" ICE Acting Director Todd Lyons said when the relaunch of the program was announced last year. ""I'm extremely proud of ICE’s entire workforce — the officers and agents on the ground who are enforcing immigration law fairly, the support staff who pull these operations together and handle logistics, and those who help shine a light on those who have suffered harm at illegal aliens’ hands.""</p><p>VOICE was replaced in 2021 during the Biden administration with the Victims Engagement and Services Line to ""serve as a more comprehensive and inclusive victim support system offered by ICE that will ensure services are offered to all victims regardless of immigration status of the victim or perpetrator.""</p><p>""Providing assistance to society’s most vulnerable is a core American value. All people, regardless of their immigration status, should be able to access victim services without fear,"" then-DHS Secretary Alejandro Mayorkas said at the time.</p>",https://www.foxnews.com/politics/ice-says-more-criminal-migrants-arrested-1-year-anniversary-program-support-victims-migrant-crime,2026-04-09
3,Supreme Court blocks candidate after alleged GOP infiltration scheme exposed,"<p>The Supreme Court on Thursday rejected a self-described ""progressive"" candidate’s bid to enter <a href=""https://www.foxnews.com/category/politics/elections"" rel=""noopener"" target=""_blank"">Ohio’s Republican primary</a>, leaving in place a decision by state election officials to disqualify him for misrepresenting his party affiliation.</p><p>Samuel Ronan, a former Democratic state and national candidate, attempted to run as a Republican in Ohio’s 15th Congressional District against GOP incumbent Rep. Mike Carey. To do so, he signed a declaration of candidacy — under penalty of election falsification — swearing he was a member of the Republican Party.</p><p>However, court documents filed in U.S. District Court note Ronan was caught publicly admitting that his candidacy was part of a calculated strategy to run Democrats as Republicans in ""deep red districts"" to ""get a foot in the door.""</p><p>A Republican voter, Mark Schare, filed a protest with the <a href=""https://www.foxnews.com/category/politics/state-and-local/elections-disputes"" rel=""noopener"" target=""_blank"">Franklin County Board of Elections</a>, presenting social media posts and interviews as evidence of Ronan's scheme to ""trick"" GOP voters.</p><p><a href=""https://www.foxnews.com/politics/gop-house-candidate-admits-shes-actually-progressive-viral-video-telling-people-truth"" rel=""noopener"" target=""_blank""><strong>'GOP' HOUSE CANDIDATE ADMITS SHE'S ACTUALLY A PROGRESSIVE IN VIRAL VIDEO: 'TELLING PEOPLE THE TRUTH'</strong></a></p><p>Ronan claimed in his application he did not lie about his affiliation, citing similar party deviations by politicians, including former President Ronald Reagan, President Donald Trump and ""hundreds of others,"" according to <a href=""https://www.courthousenews.com/supreme-court-keeps-former-dnc-candidate-off-ohio-gop-primary-ballot/"" rel=""nofollow noopener"" target=""_blank"">a report</a> from Courthouse News Service.</p><p>After the election board tied along party lines, Ohio Secretary of State Frank LaRose stepped in to toss Ronan off the ballot.</p><p>LaRose said the case was a matter of ""the integrity of the electoral process,"" slamming Ronan's alleged mission to infiltrate the party, according to court filings.</p><p><a href=""https://www.foxnews.com/politics/flashback-dem-sen-candidate-was-critical-vote-in-confirming-judge-who-tied-voter-id-to-white-supremacy"" rel=""noopener"" target=""_blank""><strong>FLASHBACK: DEM SENATE CANDIDATE WAS CRITICAL VOTE IN CONFIRMING JUDGE WHO TIED VOTER ID TO 'WHITE SUPREMACY'</strong></a></p><p>In response, Ronan filed a federal lawsuit claiming his <a href=""https://www.foxnews.com/category/us/personal-freedoms/first-amendment"" rel=""noopener"" target=""_blank"">First Amendment rights</a> were violated because the state used his core political speech against him to remove him from the ballot.</p><p>Chief <a href=""https://www.foxnews.com/category/politics/federal-judges"" rel=""noopener"" target=""_blank"">U.S. District Judge Sarah D. Morrison</a> swiftly rejected Ronan's arguments, ruling the First Amendment does not protect a candidate who submits a fraudulent declaration of candidacy.</p><p>""It cannot be the case that a State must allow a candidate on a partisan ballot even if he lied about his party affiliation simply because the First Amendment is implicated,"" Morrison wrote in her opinion.</p><p><a href=""https://www.foxnews.com/politics/gop-texas-candidate-hot-seat-after-rival-exposes-familys-dem-donations-doesnt-make-sense"" rel=""noopener"" target=""_blank""><strong>GOP TEXAS CANDIDATE IN THE HOT SEAT AFTER RIVAL EXPOSES FAMILY'S DEM DONATIONS: 'DOESN'T MAKE SENSE'</strong></a></p><p>She noted that while Ohio allows <a href=""https://www.foxnews.com/category/us/us-regions/midwest/ohio"" rel=""noopener"" target=""_blank"">candidates to legally change</a> their political affiliation, election officials are not required to ignore a candidate's public statements that directly contradict their sworn oath.</p><p>The court emphasized <a href=""https://www.foxnews.com/category/politics/executive/law"" rel=""noopener"" target=""_blank"">the state has a ""substantial interest""</a> in barring candidates from fraudulently attesting they belong to a political party when they do not.</p><p>Morrison also dismissed Ronan's claims that a Republican elections board member was unconstitutionally biased against him, finding that political association does not prove a risk of bias.</p><p>After the legal loss, Ronan asked the Supreme Court Monday to intervene prior to early voting.</p><p>Justice Brett Kavanaugh, a Trump appointee, referred the application to the full court, which denied Ronan’s request without explanation, according to Courthouse News Service.</p>",https://www.foxnews.com/politics/supreme-court-blocks-candidate-after-alleged-gop-infiltration-scheme-exposed,2026-04-09
4,MAN VS MACHINE: Philadelphians aren't taking kindly to sharing sidewalks with delivery robots,"<p>Philadelphia residents have been sharing sidewalks with robot delivery drivers for about a month, and they're not thrilled with the change. Uber Eats held a demo March 10 showing off Avride <a href=""https://www.foxnews.com/category/tech/technologies/robots"" rel=""noopener"" target=""_blank"">autonomous delivery robots</a>, which officially launched in the city of brotherly love that same week.</p><p>The robots were described as ""the future of delivery,"" but the humans around them quickly began resenting the automated couriers. In late March, an Uber Eats delivery robot in Philadelphia's Center City neighborhood was kicked multiple times. </p><p>The second time the autonomous delivery bot was kicked it toppled over, <a href=""https://6abc.com/post/uber-eats-delivery-robot-gets-kicked-center-city-philadelphia/18817649/"" rel=""nofollow noopener"" target=""_blank"">according to WPVI-TV</a>, which noted that the people who attacked the robot put it on its wheels. </p><p>The kicking incident occurred just after another viral incident in which someone <a href=""https://6abc.com/post/center-city-philadelphia-puts-ubers-delivery-bot-test/18743488/"" rel=""nofollow noopener"" target=""_blank"">sat on one</a> of the robots.</p><p><a href=""https://www.foxnews.com/tech/robotaxi-price-war-has-started-heres-everything-you-need-know"" rel=""noopener"" target=""_blank""><strong>THE ROBOTAXI PRICE WAR HAS STARTED. HERE’S EVERYTHING YOU NEED TO KNOW.</strong></a></p><p>""When delivery robots are introduced in a new area, it’s quite common to see heightened curiosity from people around them. Some may try to ‘test’ how the robot reacts — for example, by stepping in front of it or attempting to interact with it directly,"" Avride, the company that makes the robots, said in a statement provided to Fox News Digital.</p><p>""This is a known and expected phase as people get used to the technology. These few cases of vandalism in Philadelphia did not affect our service area expansion plans.</p><p>""The robots are designed to respond conservatively. In most cases, they will simply stop and wait if someone approaches or interferes, resuming their route only once the interaction has ended. In practice, these moments are usually brief — people tend to satisfy their curiosity within a minute or so and then move on. At the same time, we do not condone intentional damage or unsafe behavior toward the robots.""</p><p>Lindsay Ouellette, a third year PhD student in social psychology who is part of Temple University's Robot Social Navigation Amongst Pedestrians (roboSNAP) team, <a href=""https://billypenn.com/2026/04/09/uber-eats-delivery-robot-abuse-ethics-philadelphia-temple/"" rel=""nofollow noopener"" target=""_blank"">told BillyPenn</a> the frustration with the robots is not new, just aimed at a new target. She said that just as pedestrians can be frustrated with fellow humans who walk slowly or are looking at their phones, they can also take issue with the delivery robots.</p><p>The delivery robots have been deployed to dozens of cities across the U.S., including Austin, Dallas and Jersey City. The robots keep the orders secure by requiring customers to unlock the cargo hatch through the Uber Eats app. Additionally, Avride is immediately notified if someone tampers with or tries to steal the device.</p><p>""The cargo compartment of each delivery robot is securely locked and can only be opened by the intended recipient through a mobile app. If anyone attempts unauthorized access or tries to steal the robot, it triggers an alert to our remote operator. The operator will immediately connect to the robot’s sensory feed to evaluate the situation and take appropriate action to secure it,"" <a href=""https://www.avride.ai/robot#faq"" rel=""nofollow noopener"" target=""_blank"">Avride said</a> on its website.</p><p><a href=""https://www.foxnews.com/us/waymo-autonomous-car-blocks-ambulance-crew-responding-deadly-austin-mass-shooting"" rel=""noopener"" target=""_blank""><strong>WAYMO AUTONOMOUS CAR BLOCKS AMBULANCE CREW RESPONDING TO DEADLY AUSTIN MASS SHOOTING</strong></a></p><p>While the robots are able to navigate without human intervention, Avride has a remote support team that is able to control the robots in the case of ""an extraordinary situation arises.""</p><p>The robotic delivery service is available from 10 a.m. to 10 p.m. in the <a href=""https://www.foxnews.com/category/us/philadelphia"" rel=""noopener"" target=""_blank"">Philadelphia neighborhoods</a> of Center City, Chinatown and Old City. The robots use LIDAR sensors and cameras to navigate and are able to travel about 5 miles per hour.</p><p>Avride says its robots are able to operate in a variety of weather conditions, including rain and snow. Additionally, the company said its bots can interpret and recognize traffic light signals, giving them the ability to safely navigate busy city streets.</p><p>While customers have shown skepticism, business owners see robot delivery as an opportunity.</p><p>""I think more ability to deliver food is better for us,"" Jeff Newman, owner of Hi-Lo Taco Company <a href=""https://www.fox29.com/news/uber-eats-launches-robot-food-delivery-service-phillys-center-city-what-we-know"" rel=""nofollow noopener"" target=""_blank"">told WTXF-TV</a>. </p><p>""And certainly, right now, it started raining, and we see that we have a higher demand for takeout and delivery, but we also have <a href=""https://www.foxnews.com/category/tech/companies/amazon"" rel=""noopener"" target=""_blank"">fewer drivers</a>.""</p><p>Uber forwarded Fox News Digital's request for comment to Avride.</p>",https://www.foxnews.com/media/man-vs-machine-philadelphians-arent-taking-kindly-sharing-sidewalks-delivery-robots,2026-04-09
