,title,text,link,publish_date
9,Oprah Winfrey fires back at internet trolls mocking her '90-year-old' walk at Paris Fashion Week,"<p><a href=""https://www.foxnews.com/category/person/oprah-winfrey"" rel=""noopener"" target=""_blank"">Oprah Winfrey</a> is clapping back at online haters who trolled the longtime talk show host for walking like she was ""90 years old"" during an appearance at Paris Fashion Week earlier this month. </p><p>""On the internet, somebody was, you know how people drag you on the internet. So they were dragging me and Gayle [King] saying, ‘Look at them walking like they’re 90 years old,'"" Oprah said, per a video clip on <a href=""https://www.instagram.com/reels/DVzXnavDsCB/"" rel=""nofollow noopener"" target=""_blank"">Instagram</a> posted on Friday. </p><p>""And so there was a moment where we’re walking into the Chloe fashion show and my [assistant] had just handed me the <a href=""https://www.foxnews.com/category/entertainment/style"" rel=""noopener"" target=""_blank"">Chloe sunglasses</a> before I got out of the car,"" she added, clarifying that those glasses were not prescription glasses. </p><p><a href=""https://www.foxnews.com/entertainment/oprah-winfrey-stuns-paris-fashion-week-dramatic-new-look-after-weight-loss"" rel=""noopener"" target=""_blank""><strong>OPRAH WINFREY STUNS AT PARIS FASHION WEEK WITH DRAMATIC NEW LOOK AFTER WEIGHT LOSS</strong></a></p><p>""I didn’t know where I was walking, I could not see,"" she explained while chuckling. ""So everybody who’s saying ‘you’re walking like you’re 90,’ I could not see! I told security, 'I can’t see. I can’t see. Tell me, tell me where I’m walking. I can’t see.'""</p><p><a href=""https://www.foxnews.com/media/oprah-accepted-being-subject-jokes-about-her-weight-due-self-blame-says-i-felt-were-right"" rel=""noopener"" target=""_blank""><strong>OPRAH ACCEPTED BEING SUBJECT OF JOKES ABOUT HER WEIGHT DUE TO SELF-BLAME, SAYS 'I FELT THEY WERE RIGHT'</strong></a></p><p>""And Gayle's like, 'I got <a href=""https://www.foxnews.com/category/sports/injuries"" rel=""noopener"" target=""_blank"">two broken toes</a>. I can’t walk,'"" she mentioned. ""And that’s the reason we looked like we were 90 years old is because I couldn't see and Gayle's got two broken toes!""</p><p>Fans were quick to join in on the laugh. </p><p>""She is ABSOLUTELY AMAZING and funny,"" one user commented on <a href=""https://www.foxnews.com/category/entertainment/genres/viral"" rel=""noopener"" target=""_blank"">the clip</a>.</p><p><a href=""https://www.foxnews.com/opinion/dr-marc-siegel-america-beware-false-weight-loss-gods"" rel=""noopener"" target=""_blank""><strong>DR MARC SIEGEL: AMERICA, BEWARE OF FALSE WEIGHT LOSS GODS</strong></a></p><p>""Watching the video after Oprah’s explanation makes it funnier. She couldn't see!"" another quipped. </p><p>Earlier this month, Winfrey stunned when she <a href=""https://www.foxnews.com/entertainment/oprah-winfrey-stuns-paris-fashion-week-dramatic-new-look-after-weight-loss"" rel=""noopener"" target=""_blank"">arrived at Paris Fashion Week</a> with her <a href=""https://www.foxnews.com/category/health/nutrition-and-fitness/weight-loss"" rel=""noopener"" target=""_blank"">new slimmed-down figure</a>.</p><p><a href=""https://www.foxnews.com/newsletters?cmpid=fnfirstnl"" rel=""noopener"" target=""_blank""><strong>CLICK HERE TO SIGN UP FOR THE ENTERTAINMENT NEWSLETTER</strong></a></p><p>The 72-year-old media personality was spotted arriving at the <a href=""https://www.instagram.com/p/DVfB_m3iJwv/"" rel=""nofollow noopener"" target=""_blank""><u>Chloe runway show</u></a> looking noticeably thinner in a pair of high-waisted jeans, a cream-colored top and a brown jacket.</p><p>She paired the look with the Chloe sunglasses, a white purse and closed-toed pointy high-heeled shoes, and wore her hair in a high ponytail.</p><p><a href=""https://www.foxnews.com/entertainment"" rel=""noopener"" target=""_blank""><strong>LIKE WHAT YOU’RE READING? CLICK HERE FOR MORE ENTERTAINMENT NEWS</strong></a></p><p>After trying many different diets, joining Weight Watchers and trying a holistic approach, Winfrey shared in 2023 that she began taking <a href=""https://www.foxnews.com/health/oprah-winfrey-reveals-shame-weight-loss-drugs-what-happened-when-she-quit"" rel=""noopener"" target=""_blank"">GLP-1 weight loss medication</a>, telling <a href=""https://people.com/oprah-opens-up-about-obesity-glp-1s-and-her-new-life-exclusive-11877105"" rel=""nofollow noopener"" target=""_blank""><u>People</u></a> in December 2025, she made the decision when she realized her lifelong struggle with her weight was <a href=""https://www.foxnews.com/category/health/nutrition-and-fitness/obesity"" rel=""noopener"" target=""_blank"">due to obesity</a>, a word she ""avoided"" before.</p><p>""If you have obesity in your gene pool, I want people to know it’s not your fault,"" Winfrey said. ""I want people to stop blaming yourself for <a href=""https://www.foxnews.com/category/genetics"" rel=""noopener"" target=""_blank"">genes and an environment</a> you can’t control. I want people to have the information, whatever you choose to do with it, whether you get the medications, or whether you want to keep dieting.""</p><p>Winfrey shared that after she began taking the GLP-1 medication, she began feeling like ""everything is just calmer and stronger"" since she has help controlling ""the messages that are being sent to your brain about overeating.""</p><p><i>Fox News Digital's Lori Bashian contributed to this post. </i></p>",https://www.foxnews.com/entertainment/oprah-winfrey-fires-back-internet-trolls-mocking-her-90-year-old-walk-paris-fashion-week,2026-03-15
10,Tori Spelling sets the record straight on 30 years of plastic surgery rumors,"<p><a href=""https://www.foxnews.com/category/person/tori-spelling"" rel=""noopener"" target=""_blank"">Tori Spelling</a> said this week that throughout her career, tabloids and fans have made ""horrific"" claims that she’s had plastic surgery she didn’t get done.</p><p>""Since I was 17, since before there was internet, wow, there was the Enquirer, The Globe, it was like the tabloid paper magazines,"" the 52-year-old told Dr. Terry Dubrow while they were discussing plastic surgery on her <a href=""https://open.spotify.com/episode/2anL9bX48tPdp1qpQ366bC"" rel=""nofollow noopener"" target=""_blank"">""MisSpelling"" podcast </a>on Monday.  </p><p>""And the Globe came out with something when I was 17,"" she said. ""I had started ‘90210’ and gotten famous. And they were like, ‘She’s had all this plastic surgery.’ So, they did something like that to a 17-year-old.""</p><p>Spelling said the Globe claimed she had gotten a new chin and cheek implants, but all she had actually gotten was a <a href=""https://www.foxnews.com/category/health/beauty-and-skin/cosmetic-surgery"" rel=""noopener"" target=""_blank"">nose job</a>.</p><p><a href=""https://www.foxnews.com/entertainment/rose-mcgowan-says-charmed-execs-would-circle-around-me-check-my-weight-between-seasons"" rel=""noopener"" target=""_blank""><strong>ROSE MCGOWAN SAYS 'CHARMED' EXECS WOULD SCRUTINIZE HER WEIGHT BETWEEN SEASONS</strong></a></p><p>She remembered her dad, producer Aaron Spelling, told her not to worry about the story, saying the tabloids would move on to another celebrity next week, but she said it’s stung her whole life.</p><p>""At 17, it crushed my whole soul,"" she said. ""I never unsaw that. I never unheard it. I was like a 17-year-old girl that was like 'OK, am I pretty? I’m trying to find myself in this world, but I’m on TV.' I was in high school for real.""</p><p>In the age of social media, Spelling admitted it still hurts her feelings when people speculate about her.</p><p><a href=""https://www.foxnews.com/entertainment/mormon-wives-star-says-plastic-surgery-nightmare-ruined-life-reality-tv-career"" rel=""noopener"" target=""_blank""><strong>'MORMON WIVES' STAR SAYS PLASTIC SURGERY NIGHTMARE RUINED HER LIFE AND REALITY TV CAREER</strong></a></p><p>""It’s horrific. I’m 52, I’ll be 53 in May, and I purposefully go the other way because everyone says — every photo I put up, people say, ‘Stop with the filler!’ I’m like, 'I’m not!'"" she said. ""I don’t know — I guess at this point, I should be like f--- it and have my whole face done because they already say I’ve had it done. So, it’s like I can’t win, but I don’t know why that keeps me from doing stuff.""</p><p>Spelling said she usually doesn’t respond when people make untrue comments, but can’t always help herself.</p><p>""I find myself sometimes, though, being like, ‘No! it’s not true! Have I had filler in the past? Yes — I don’t have filler right now. I have Botox,' and like telling them what I have. Like why am I — it’s like I’m scared to like — like, ‘No, I haven’t had all that done.’""</p><p><a href=""https://www.foxnews.com/newsletters?cmpid=fnfirstnl"" rel=""noopener"" target=""_blank""><strong>CLICK HERE TO SIGN UP FOR THE ENTERTAINMENT NEWSLETTER</strong></a></p><p>Spelling has previously detailed her experience getting breast implants at a strip mall after a recommendation from a friend who was a stripper.</p><p>""I was 19, so I was like, ‘This isn’t Beverly Hills, what’s happening?’ I was confused. I was best friends with Alicia Silverstone and Carmen Electra, and they were taking care of me [after the surgery]. I can’t even make this stuff up.""</p><p><a href=""https://www.foxnews.com/entertainment"" rel=""noopener"" target=""_blank""><strong>LIKE WHAT YOU’RE READING? CLICK HERE FOR MORE ENTERTAINMENT NEWS</strong></a></p><p>She added, ""He was a fine doctor, it was just like an outpatient center in a strip mall.""</p><p>She described her natural breasts as an A plus to a B-cup, adding that she had ""just wanted to make them fuller.""</p><p>Spelling said she had just gotten them done again, joking, ""Third time will be the charm.""</p><p>""I think my body doesn’t like to take foreign things,"" she explained. ""I think they’re OK now. My whole intention of getting them redone was to go smaller ‘cause, like looking back to the ‘90s, I was like, 'I liked my boobs. I wish I had just kept them. They’re really great.'""</p>",https://www.foxnews.com/entertainment/tori-spelling-sets-record-straight-30-years-plastic-surgery-rumors,2026-03-15
11,FCC chair Brendan Carr warns broadcasters must 'correct course' on 'news distortions' before license renewals,"<p>Federal Communications Commission (FCC) chair Brendan Carr <a href=""https://x.com/brendancarrfcc/status/2032855414233047172?s=46&amp;t=9QA7_aOhzLq8ejST7bnqZA"" rel=""nofollow noopener"" target=""_blank"">issued a warning</a> to the media on Saturday calling on networks to ""correct course"" before their license renewals come up. </p><p>""Broadcasters that are running hoaxes and news distortions - also known as the fake news - have a chance now to correct course before their license renewals come up,"" he wrote on X, in response to a Truth Social post from President <a href=""https://www.foxnews.com/category/person/donald-trump"" rel=""noopener"" target=""_blank"">Donald Trump</a> about coverage of the war in Iran. ""The law is clear. Broadcasters must operate in the public interest, and they will lose their licenses if they do not.""</p><p>He went on, ""And frankly, changing course is in their own business interests since trust in legacy media has now fallen to an all time low of just 9% and are ratings disasters.""</p><p>In his Truth Social post, Trump took issue with reporting from newspapers about tanker planes and said the claim that they were ""struck"" and ""destroyed"" was untrue. </p><p>Carr appeared to reference the controversy surrounding CBS and <a href=""https://www.foxnews.com/category/person/stephen-colbert"" rel=""noopener"" target=""_blank"">Stephen Colbert</a> in his statement on X. Colbert interviewed Democratic Texas Senate candidate James Talarico and did not air the interview on the show, citing pushback from CBS.</p><p><a href=""https://www.foxnews.com/media/republicans-virtually-shut-out-dem-dominated-talk-shows-fcc-aims-reform-network-bias"" rel=""noopener"" target=""_blank""><strong><u>REPUBLICANS VIRTUALLY SHUT OUT OF DEM-DOMINATED TALK SHOWS AS FCC AIMS TO REFORM NETWORK BIAS</u></strong></a></p><p>CBS said that it did not stop <a href=""https://www.foxnews.com/category/entertainment/politics-on-late-night"" rel=""noopener"" target=""_blank"">Colbert from airing the Talarico interview</a>, which the late-night host posted to the show's YouTube channel, and said the show just needed to offer equal time to his then-opponent, Rep. Jasmine Crockett, D-Texas. Crockett placed the <a href=""https://www.foxnews.com/media/jasmine-crockett-pushes-back-texas-opponents-claim-trump-fcc-killed-interview-puts-blame-cbs"" rel=""noopener"" target=""_blank"">blame on CBS and Colbert</a>, who she said did not offer equal time, rather than the government.</p><p>Talarico placed blame squarely on Trump and the FCC.</p><p><a href=""https://www.foxnews.com/media""><strong>CLICK HERE FOR MORE COVERAGE OF MEDIA AND CULTURE</strong></a></p><p>""When a political candidate is able to <a href=""https://www.foxnews.com/category/politics/elections"" rel=""noopener"" target=""_blank"">win a landslide election victory</a> after in the face of hoaxes and distortions, there is something very wrong. It means the public has lost faith and confidence in the media. And we can’t allow that to happen,"" Carr wrote in his post on Saturday.</p><p>Talarico defeated Crockett in the Democratic primary after raising millions following the Colbert interview.</p><p>Trump's <a href=""https://truthsocial.com/@realDonaldTrump/posts/116227789768118115"" rel=""noopener"" target=""_blank"">post to Truth Social,</a> which Carr responded to with the threats, called out The New York Times and the Wall Street Journal specifically over misleading headlines.</p><p>""Yet again, an intentionally misleading headline by the Fake News Media about the five tanker planes that were supposedly struck down at an Airport in Saudi Arabia, and of no further use. In actuality, the Base was hit a few days ago, but the planes were not ""struck"" or ""destroyed."" Four of the five had virtually no damage, and are already back in service. One had slightly more damage, but will be in the air shortly. None were destroyed, or close to that, as the Fake News said in headlines,"" the president wrote.</p>",https://www.foxnews.com/media/fcc-chair-brendan-carr-warns-broadcasters-must-correct-course-news-distortions-before-license-renewals,2026-03-15
12,String of attacks connected to naturalized citizens raises national security questions,"<p>The United States is <a href=""https://www.foxnews.com/category/politics/executive/national-security"" rel=""noopener"" target=""_blank"">left vulnerable</a> even by its own naturalized U.S. citizens from hostile foreign lands, proving a free country can be exposed to security risks by the very freedoms the Constitution endows, an expert warned on Fox News.</p><p>""That's partially because of legal reasons: They can't just monitor constitutionally protected free speech and opinions after they become a naturalized citizen, indefinitely, just to keep tabs on them,"" Mauro Institute president Ryan Mauro told Fox News on Saturday.</p><p>""They legally can't do it, and they also don't have the resources to do it.""</p><p>Just this month alone, the U.S. has experienced four attacks with ties to naturalized citizenship.</p><p><a href=""https://www.foxnews.com/media/tulsi-gabbard-warns-direct-threat-from-suspected-terrorists-now-living-united-states"" rel=""noopener"" target=""_blank""><strong>TULSI GABBARD WARNS OF 'DIRECT THREAT' FROM SUSPECTED TERRORISTS NOW LIVING IN UNITED STATES</strong></a></p><p>""There's a bit of a jihad olympics going on, which is where you have the <a href=""https://www.foxnews.com/category/world/terrorism"" rel=""noopener"" target=""_blank"">Sunni radicals like ISIS</a> competing with the Shiite radicals of the Iranian regime because they need attention in order to survive and in order settle the argument of who has Allah's blessing so that they can trigger the apocalypse,"" Mauro said.</p><p>""That's what they both want to do,"" Mauro said.</p><p><a href=""https://www.foxnews.com/media/national-security-expert-urges-dhs-raise-terror-threat-level-warns-sleeper-cell-risks-us"" rel=""noopener"" target=""_blank""><strong>NATIONAL SECURITY EXPERT URGES DHS TO RAISE TERROR THREAT LEVEL, WARNS OF SLEEPER CELL RISKS IN US</strong></a></p><p>The process of citizenship revocation has been a hotly debated topic during the second Trump administration, and the spate of four terror attacks amid the latest Israel-U.S. war on Iran may increase scrutiny on the vetting process.</p><p>""A person is subject to revocation of naturalization if the person becomes a member of, or affiliated with, the Communist party, other totalitarian party, or terrorist organization within five years of his or her naturalization,"" the U.S. <a href=""https://www.uscis.gov/policy-manual/volume-12-part-l-chapter-2"" rel=""noopener"" target=""_blank"">Grounds for Revocation of Naturalization</a> reads.</p><p><a href=""https://www.foxnews.com/politics/odu-gunman-who-killed-rotc-instructor-had-prior-isis-conviction-released-early"" rel=""noopener"" target=""_blank""><strong>ODU GUNMAN WHO KILLED ROTC INSTRUCTOR HAD PRIOR ISIS CONVICTION, WAS RELEASED EARLY</strong></a></p><p>Mauro's institute is not constrained by federal law in vetting potential terrorist ideology of naturalized citizens like the Justice Department is, he noted.</p><p>""That's why I personally have set up a civilian intelligence team that does do that type of thing,"" Mauro said. ""And why we've been so successful is because whereas the government has to be very careful not to launch investigations based off of just a mere suspicion or an unpopular opinion, civilians are free to comb through social media and just find people and report them.""</p><p><a href=""https://www.foxnews.com/category/us/personal-freedoms/first-amendment"" rel=""noopener"" target=""_blank"">U.S. freedoms</a> even protect suspected terrorists, he added.</p><p>""If they do come across someone who is expressing support for a terrorist organization, it still gets tricky,"" he lamented. ""You would think, oh, at that point you can revoke it and just get rid of the people because that would make sense, but the question is membership and affiliation.</p><p>""I mean, there'll be a lot of headaches just over those words. At what point does it go from, oh, I agree with them, versus actually being affiliated with them as like a unit?""</p><p>Fox News Digital reached out to the <a href=""https://www.foxnews.com/category/politics/foreign-policy/state-department"" rel=""noopener"" target=""_blank"">State Department</a>, the FBI and multiple agencies within the Department of Homeland Security for comment on this story. The State Department redirected us to the latter two federal departments.</p>",https://www.foxnews.com/politics/string-attacks-connected-naturalized-citizens-raises-national-security-questions,2026-03-15
13,Iran arrests dozens accused of spying for Israel in new internal crackdown,"<p>Iranian authorities say they have arrested dozens of people accused of <a href=""https://www.foxnews.com/category/world/world-regions/israel"" rel=""noopener"" target=""_blank"">spying for Israel</a> across several provinces, according to state media reports over the weekend.</p><p>Fars, a news agency affiliated with Iran’s Islamic Revolutionary Guard Corps (IRGC), reported Sunday the West Azerbaijan prosecutor’s office had arrested 20 individuals in the northwestern city of Urmia for allegedly providing Israel with information about military, police and security sites.</p><p>On Saturday, <a href=""https://www.foxnews.com/category/world/conflicts/iran"" rel=""noopener"" target=""_blank"">Iran’s Ministry of Intelligence</a> said it had arrested several ""enemy operatives"" across the country, including a 10-member group in Mazandaran province and another 10-member network in Khorasan Razavi province, according to Tasnim, a semi-official news agency.</p><p>Authorities said the suspects transferred the locations of military installations and economic infrastructure and shared coordinates of public places, academic institutions and research centers with Israel.</p><p><a href=""https://www.foxnews.com/media/iranian-regime-spreading-anti-israel-propaganda-across-dozens-social-media-accounts-report"" rel=""noopener"" target=""_blank""><strong>IRANIAN REGIME SPREADING ANTI-ISRAEL PROPAGANDA ACROSS DOZENS OF SOCIAL MEDIA ACCOUNTS: REPORT</strong></a></p><p>In southern Khuzestan province, intelligence officials also reported arresting a three-person ""<a href=""https://www.foxnews.com/category/world/terrorism"" rel=""noopener"" target=""_blank"">terrorist team</a>"" accused of carrying out armed attacks against security forces and government facilities. </p><p><a href=""https://www.wsj.com/livecoverage/us-israel-iran-war-2026/card/israel-relying-on-ordinary-iranians-for-drone-strike-targets-cG5TorYxcFvRCJlbFnDq"" rel=""noopener noreferrer nofollow"" target=""_blank""><u>The Wall Street Journal reported</u></a> last week that Israel has relied on tips from ordinary Iranians to identify targets for strikes inside Iran, citing a senior Israeli security official.</p><p>The newspaper said information about potential targets is sent through Israeli Persian-language social media accounts and is verified by Israeli authorities before strikes are carried out.</p><p><a href=""https://www.foxnews.com/world/cia-persian-language-video-urging-iranians-use-burner-phones-tor-contact-us"" rel=""noopener"" target=""_blank""><strong>CIA URGES IRANIANS TO USE BURNER PHONES, TOR TO CONTACT US IN PERSIAN-LANGUAGE VIDEO</strong></a></p><p>In a separate development, Bahraini authorities said Sunday they arrested five people accused of passing sensitive information to the IRGC and <a href=""https://www.foxnews.com/category/politics/defense/recruitment"" rel=""noopener"" target=""_blank"">helping recruit operatives</a> for potential attacks inside the country.</p><p>According to a statement from Bahrain’s Police Media Center, the suspects allegedly collected and transmitted coordinates and images of sensitive locations, including hotels, to the IRGC.</p><p><a href=""https://www.foxnews.com/media/iranian-regime-spreading-anti-israel-propaganda-across-dozens-social-media-accounts-report"" rel=""noopener"" target=""_blank""><strong>IRANIAN REGIME SPREADING ANTI-ISRAEL PROPAGANDA ACROSS DOZENS OF SOCIAL MEDIA ACCOUNTS: REPORT</strong></a></p><p>Officials said one suspect previously received training at IRGC camps in ""trafficking persons and recruiting operatives to participate in implementing terrorist plots.""</p><p>The five detainees were referred to Bahrain’s Public Prosecution, while a sixth suspect identified in the case is believed to be a fugitive abroad.</p>",https://www.foxnews.com/world/iran-arrests-dozens-accused-spying-israel-new-internal-crackdown,2026-03-15
