,title,text,link,publish_date
3,"Colorado highway descends into chaos after massive 75-vehicle pileup, amid hazardous winter weather","<p>At least 75 vehicles were ensnared in a massive, chain-reaction pileup on a Colorado highway Tuesday, authorities said.</p><p>The crashes unfolded in the Rocky Mountains west of Denver, specifically near <a href=""https://www.foxnews.com/category/travel/general/resorts"" rel=""noopener"" target=""_blank"">Loveland Ski Area</a>, and followed a chaotic morning that saw six separate wrecks, mostly along the same highway, according to the Clear Creek County Sheriff's Office. </p><p>Officials said the latest crash forced a two-way lane shutdown on Interstate 70, as photos released by the authorities showed emergency crews assisting drivers at the scene.  </p><p>""The closure is due to a severe multi-vehicle crash on the east side of Eisenhower-Johnson Memorial Tunnel that took place this afternoon,"" the Colorado Department of Transportation (CODOT) said. ""There is currently no estimated time for reopening."" </p><p><a href=""https://www.foxnews.com/us/driver-hops-curb-strikes-9-students-during-after-school-pickup-iowa"" rel=""noopener"" target=""_blank""><strong><u>DRIVER HOPS CURB, STRIKES 9 STUDENTS DURING AFTER SCHOOL PICKUP IN IOWA</u></strong></a></p><p>According to the photos, the crashes appeared to have occurred on a snow-blanketed roadway, as winter weather may have created hazardous driving conditions in the mountain corridor.</p><p>The area near Loveland Ski Area has also long been known as a major bottleneck on I-70, particularly as ski traffic converges with Denver-area commuters during the spring season.</p><p>Officials have not yet reported any injuries.</p><p><a href=""https://www.foxnews.com/us/least-2-students-killed-several-injured-school-bus-crash-tennessee-parents-worst-nightmare"" rel=""noopener"" target=""_blank""><strong><u>AT LEAST 2 STUDENTS KILLED, SEVERAL INJURED IN SCHOOL BUS CRASH IN TENNESSEE: 'A PARENT'S WORST NIGHTMARE'</u></strong></a></p><p>Earlier in the day, officials reported six crashes during the morning hours, with some involving single vehicles and others <a href=""https://www.foxbusiness.com/category/transportation"" rel=""noopener"" target=""_blank"">multi-vehicle collisions</a>. Five of the crashes occurred on I-70 westbound near mile marker 221, with another reported on U.S. Highway 40. </p><p>The sheriff’s office indicated that all of those earlier incidents had been cleared before the major 75-vehicle pileup unfolded nearby on I-70 eastbound near mile marker 216.</p><p>An hour later, the authorities shut down both lanes of the highway. </p><p>""Due to the severity of the crash, drivers approaching the Eisenhower-Johnson Memorial Tunnel should expect to be turned around for the next several hours,"" CODOT said. </p><p>""Bottom line, we need folks to slow down, increase following distance, and make it to their destination safely,"" the sheriff’s office said. </p><p><a href=""https://www.foxnews.com/category/us/us-regions/west/colorado"" rel=""noopener"" target=""_blank"">Colorado State Patrol</a> is leading the crash investigation. </p>",https://www.foxnews.com/us/colorado-highway-descends-chaos-massive-75-vehicle-pileup-hazardous-winter-weather,2026-04-14
4,Former UCLA gynecologist sentenced after pleading guilty to sexually assaulting patients at school,"<p>A former doctor at the University of California, Los Angeles (UCLA), was sentenced to 11 years in prison Tuesday, after he was accused of <a href=""https://https://www.foxnews.com/category/us/crime/sex-crimes"" rel=""noopener"" target=""_blank"">sexually assaulting</a> his patients as an obstetrician-gynecologist at the school.</p><p>James Heaps, 69, pleaded guilty to 13 counts, the Los Angeles County District Attorney's Office announced in a news release, including six felony counts of sexual penetration of an unconscious person, five felony counts of sexual battery by fraud, and two felony counts of sexual exploitation of a patient.</p><p>Throughout his 35-year career at UCLA, the university spent nearly $700 million to settle civil claims made against him.</p><p>He will also be required to register as a sex offender for life.</p><p><a href=""https://https://www.foxnews.com/us/appeals-court-overturns-conviction-ucla-gynecologist-over-issue-trial"" rel=""noopener"" target=""_blank""><strong>APPEALS COURT OVERTURNS CONVICTION OF UCLA GYNECOLOGIST OVER ISSUE AT TRIAL</strong></a></p><p>Heaps's plea comes after <a href=""https://www.foxnews.com/us/appeals-court-overturns-conviction-ucla-gynecologist-over-issue-trial"" rel=""noopener"" target=""_blank"">an appeals court in California</a> determined he was denied a fair trial in 2023 due to concerns that one juror did not speak enough English to adequately carry out their responsibilities.</p><p>At the time, his attorney, Leonard Levine, told The Associated Press that, ""justice is slow, but it’s finally been done.""</p><p>""I believe it's just a matter of time before he is totally exonerated,"" he added.</p><p>Levine did not immediately respond to Fox News Digital's request for comment.</p><p><a href=""https://www.foxnews.com/health/patients-ucla-gynecologist-sexual-assault-hearing"" rel=""noopener"" target=""_blank""><strong><u>FLASHBACK: EX-PATIENTS OF UCLA GYNECOLOGIST ACCUSED OF SEXUALLY ASSAULTING THEM ARE ‘VOICE FOR SO MANY,’ LAWYERS SAY</u></strong></a></p><p>Prosecutors, however, framed the outcome differently.</p><p>""Today marks the second time that we’re holding James Heaps responsible for the unconscionable crimes he committed while being entrusted with the safety of his patients,"" <a href=""https://www.foxnews.com/category/us/los-angeles"" rel=""noopener"" target=""_blank"">Los Angeles District Attorney</a> Nathan J. Hochman said, according to the release.</p><p>""For years, Heaps exploited the sacred trust between a doctor and patient to prey on vulnerable victims during medical procedures. This sentence ensures that Heaps will finally be held accountable for the harm he inflicted under the guise of care. To the survivors: I hope today brings you closure knowing that the individual who violated your trust has been definitively brought to justice. To all survivors, please know that we believe you and we will fight for you.""</p><p>The Los Angeles District Attorney's Office did not immediately respond to Fox News Digital's request for comment.</p><p>In 2023, the doctor's former patients claimed he groped them, made suggestive comments, or conducted unnecessarily invasive exams at the college's student health center, the Ronald Reagan UCLA Medical Center, or in his campus office.</p><p>The women who filed lawsuits against Heaps claimed the school ignored their comments and allowed the abuse to continue.</p><p><i>Fox News Digital's Greg Normand-Diamond contributed to this report.</i></p>",https://www.foxnews.com/us/former-ucla-gynecologist-sentenced-pleading-guilty-sexually-assaulting-patients-school,2026-04-14
5,Raiders GM John Spytek admits to getting 'a few calls' about the No 1 pick ahead of next week's NFL Draft,"<p>The <a href=""https://www.foxnews.com/category/sports/nfl/las-vegas-raiders"" rel=""noopener"" target=""_blank"">Las Vegas Raiders</a> are expected to make Fernando Mendoza, the national championship-winning quarterback from Indiana, the first overall pick in the NFL Draft next Thursday.</p><p>But that hasn’t stopped teams below the Raiders at No. 1 overall from calling their phone about a possible trade up scenario.</p><p>Raiders GM John Spytek spoke during a pre-NFL Draft news conference, during which he admitted to getting a ""few calls"" about the first overall selection his team owns.</p><p><a href=""https://www.foxnews.com/sports"" rel=""noopener"" target=""_blank""><strong>CLICK HERE FOR MORE SPORTS COVERAGE ON FOXNEWS.COM</strong></a></p><p>""Those teams know where they stand,"" Spytek said, <a href=""https://www.espn.com/nfl/story/_/id/48488757/raiders-spytek-says-teams-inquired-no-1-draft-pick"" rel=""noopener nofollow"" target=""_blank"">via ESPN</a>.</p><p>Spytek said during the news conference that good trades can always materialize on draft night, sometimes even right before the pick. However, if a player stands out to the team, as Mendoza is believed to have done, the Raiders will turn down an offer.</p><p><a href=""https://www.foxnews.com/sports/kirk-cousins-declares-raiders-uniforms-best-jerseys-pro-sports"" rel=""noopener"" target=""_blank""><strong>KIRK COUSINS DECLARES THE RAIDERS' UNIFORMS THE 'BEST JERSEYS IN PRO SPORTS'</strong></a></p><p>""If there’s a player that stands out that we feel it’s not worth losing, it’s not worth even picking up the phone, then we’ll just make the pick,"" Spytek added. ""But if it’s a player that we’re not as excited about, or there’s a group of players that we would love to pick from, and we can get value for that, we’re certainly open to listening to that.""</p><p>All signs point to Mendoza, who has cemented himself as the best quarterback in this draft after an undefeated season at Indiana. It also became more apparent that a quarterback was needed for Las Vegas after reaching a <a href=""https://www.foxnews.com/sports/jets-reunite-geno-smith-after-raiders-gain-draft-pick-trade-deal-reports"" rel=""noopener"" target=""_blank"">deal with the New York Jets</a> to reunite them with Geno Smith, who was their starter in 2025 following a prior deal with the Seattle Seahawks.</p><p>The Raiders, however, did bring in <a href=""https://www.foxnews.com/category/person/kirk-cousins"" rel=""noopener"" target=""_blank"">Kirk Cousins</a> after his release from the Atlanta Falcons, though his $20 million in guaranteed money on a whopping $172 million deal indicates he will serve as a mentor for whoever the Raiders bring in the building through the draft . Aidan O’Connell is also on the Raiders’ roster under new head coach Klint Kubiak.</p><p>Kubiak is fresh off a Super Bowl victory with the Seahawks, serving as their offensive coordinator before taking this promotion following a one-year stint by Pete Carroll in Sin City. It didn’t go according to plan for Las Vegas, resulting in the first overall selection.</p><p>But things are looking up for the silver and black, as Spytek used the team’s vast free agent cap room to sign the likes of center Tyler Linderbaum, linebackers Nakobe Dean and Quay Walker, and wide receiver Jalen Nailor, among others.</p><p>Now, Spytek and the franchise have their eyes set on improving the roster even more with potential cornerstone pieces through the NFL Draft. The Raiders possess 10 total picks, including the first overall selection, which is the first time they’ve had that slot since 2007.</p><p>And those picks, if it's Mendoza or anyone else in the draft, will have to earn their roster spot and playing time like everyone else across the league.</p><p>""Ultimately, this is a meritocracy, and the best guy will play,"" Spytek explained. ""It’s just really hard to play really well at a young age. But we’ve seen plenty of quarterbacks do it recently. We added Kirk, we have Aidan, and we’ll see how it goes.""</p><p>The NFL Draft begins with the Raiders on the clock next Thursday in Pittsburgh.</p>",https://www.foxnews.com/sports/raiders-gm-john-spytek-admits-getting-calls-1-pick-ahead-next-weeks-nfl-draft,2026-04-14
6,"Suspect arrested after housekeeper tied up, attacked in Massachusetts mansion heist","<p>A suspect was arrested after a $20 million oceanfront <a href=""https://www.foxnews.com/category/us/us-regions/northeast/massachusetts"" rel=""noopener"" target=""_blank"">Massachusetts</a> mansion was broken into by two masked men, who allegedly attacked a housekeeper, tied her up and held her at gunpoint while reportedly stealing hundreds of thousands of dollars in valuables.</p><p>Emajae Brown, 25, was charged with home invasion, kidnapping, assault and battery with a dangerous weapon, witness intimidation, armed assault in a dwelling, larceny over $1,200, breaking into a building at nighttime with the intent to commit a felony, larceny of a motor vehicle and armed burglary.</p><p>Brown was taken into custody in Gloucester and prosecutors argued he was a danger to the community, according to Boston 25 News.</p><p>On the morning of March 28, a neighbor on Paine Avenue in Beverly, Massachusetts, called 911 to report a home invasion.</p><p><a href=""https://www.foxnews.com/us/police-hunt-armed-suspect-after-housekeeper-bound-attacked-luxury-mansion-heist-report"" rel=""noopener"" target=""_blank""><strong>POLICE HUNT ARMED SUSPECT AFTER HOUSEKEEPER BOUND, ATTACKED IN LUXURY MANSION HEIST: REPORT</strong></a></p><p>Investigators learned that two armed suspects had broken into the mansion and assaulted and tied up a housekeeper who was inside the home before leaving with several valuable items. The housekeeper was the only person home at the time of the incident.</p><p>During the burglary, the suspects allegedly grabbed the housekeeper's phone and tossed it in the ocean, according to CBS Boston. They also allegedly made her find bleach and place valuable items in trash bags.</p><p>""What they did to my housekeeper was just horrendous,"" homeowner Thomas Swan III told WCVB last month after the heist.</p><p>""She was held at gunpoint, sometimes dragged by her hair, ultimately tied up and left in the garage. She’s really, really special, but truly traumatized by this, truly traumatized,"" he added.</p><p><a href=""https://www.foxnews.com/us/former-fbi-agent-suggests-inside-job-massachusetts-mansion-heist-specific-valuable-items-stolen"" rel=""noopener"" target=""_blank""><strong>FORMER FBI AGENT SUGGESTS INSIDE JOB IN MASSACHUSETTS MANSION HEIST AS 'SPECIFIC AND VALUABLE' ITEMS STOLEN</strong></a></p><p>After the suspects left, the housekeeper escaped and went to a neighbor’s home to call for help. She was taken to a hospital with non-life-threatening injuries and later released.</p><p>""She went on to tell investigators the suspect was pointing a firearm at her head and escorting her around the home,"" a prosecutor said in court on Tuesday, according to CBS Boston.</p><p><a href=""https://www.foxnews.com/category/us/crime/robbery-theft"" rel=""noopener"" target=""_blank"">One robber</a> fled the scene with several valuables, including money and gold, in a Porsche stolen from the home. That vehicle was later located by police several miles away near a cemetery in Lynn.</p><p>Ring cameras were able to locate Brown, who was tracked through phone surveillance to New York City, where he was allegedly meeting with a jewelry dealer, according to Boston 25 News.</p><p>Local and federal authorities eventually found more than $300,000 and numerous gold items in his car, the outlet reported.</p><p><a href=""https://www.foxnews.com/category/us/crime/police-and-law-enforcement"" rel=""noopener"" target=""_blank"">Police also said</a> Brown was the ex-boyfriend of another housekeeper who worked at the home. The prosecutor said they learned that Brown had an open domestic charge from an incident at the Encore Boston Harbor casino.</p><p>Brown was ordered held without bail until the next hearing on April 21.</p>",https://www.foxnews.com/us/suspect-arrested-after-housekeeper-tied-up-attacked-massachusetts-mansion-heist,2026-04-14
7,US military kills four alleged narco-terrorists in lethal strike on drug-trafficking vessel in Eastern Pacific,"<p>The U.S. military carried out a lethal strike on a suspected drug-trafficking vessel in the Eastern Pacific, killing four alleged narco-terrorists, according to <a href=""https://www.foxnews.com/category/us/military"" rel=""noopener"" target=""_blank"">U.S. Southern Command</a> (SOUTHCOM).</p><p>""On April 14, at the direction of #SOUTHCOM commander Gen. Francis L. Donovan, Joint Task Force Southern Spear conducted a lethal kinetic strike on a vessel operated by Designated Terrorist Organizations,"" SOUTHCOM said in a post on X. ""Intelligence confirmed the vessel was transiting along known <a href=""https://www.foxnews.com/category/us/crime/drugs"" rel=""noopener"" target=""_blank"">narco-trafficking routes</a> in the Eastern Pacific and was engaged in narco-trafficking operations.""</p><p>""<a href=""https://www.foxnews.com/category/world/terrorism/narco-terror"" rel=""noopener"" target=""_blank"">Four male narco-terrorists</a> were killed during this action,"" SOUTHCOM said.</p><p><a href=""https://www.foxnews.com/us/alleged-narco-terrorists-killed-us-forces-strike-suspected-drug-trafficking-vessel-caribbean"" rel=""noopener"" target=""_blank""><strong>ALLEGED NARCO-TERRORISTS KILLED AS US FORCES STRIKE SUSPECTED DRUG-TRAFFICKING VESSEL IN CARIBBEAN</strong></a></p><p>No U.S. military forces were harmed, the command added.</p><p>SOUTHCOM did not immediately provide additional details about the identities of those killed or the specific groups involved.</p><p><a href=""https://www.foxnews.com/us/coast-guard-seizes-4500-pounds-cocaine-worth-34m-suspected-narco-terrorist-vessel-easter"" rel=""noopener"" target=""_blank""><strong>COAST GUARD SEIZES OVER 4,500 POUNDS OF COCAINE WORTH $34M FROM SUSPECTED NARCO-TERRORIST VESSEL ON EASTER</strong></a></p><p>The strike came after SOUTHCOM said Monday that it conducted <a href=""https://www.foxnews.com/us/us-military-kills-2-suspected-cartel-operatives-latest-eastern-pacific-lethal-strike-southcom-says"" rel=""noopener"" target=""_blank"">another strike in the Eastern Pacific</a>, killing two individuals believed to be involved in narcotics trafficking.</p><p>The U.S. military has carried out <a href=""https://www.foxnews.com/politics/us-military-strikes-narco-terrorist-vessels"" rel=""noopener"" target=""_blank"">dozens of strikes in recent months</a> on suspected drug-smuggling vessels as part of a broader campaign to dismantle cartel-linked trafficking operations.</p><p>SOUTHCOM is responsible for military operations in Central and South America and <a href=""https://www.foxnews.com/category/travel/regions/caribbean"" rel=""noopener"" target=""_blank"">the Caribbean</a>, including counter-narcotics missions aimed at disrupting drug trafficking networks that threaten U.S. interests.</p><p><i>Fox News Digital's Greg Wehner contributed to this report.</i></p>",https://www.foxnews.com/us/us-military-kills-four-alleged-narco-terrorists-lethal-strike-drug-trafficking-vessel-eastern-pacific,2026-04-14
8,Docs show migrant accused of killing Loyola student was flagged as flight risk before release,"<p>The House Judiciary Committee released internal Border Patrol documents on Tuesday, showing that a Venezuelan migrant now charged in the killing of Loyola University student Sheridan Gorman was flagged as a flight risk and had no valid asylum claim before being <a href=""https://www.foxnews.com/category/us/immigration"" rel=""noopener"" target=""_blank"">released into the U.S.</a> in 2023.</p><p>Jose Medina-Medina, 25, <a href=""https://www.foxnews.com/us/illegal-immigrant-accused-killing-chicago-college-student-face-court-after-tuberculosis-delay"" rel=""noopener"" target=""_blank"">is accused of fatally shooting</a> 18-year-old Gorman in Chicago in March.</p><p>Fox News Digital previously reported that Medina-Medina, an illegal immigrant from Venezuela, was apprehended at the southern border in 2023 and later released into the country under the Biden administration.</p><p>In a post on X, House Judiciary Republicans said the documents show officials released a migrant they described as dangerous despite warning signs.</p><p><a href=""https://www.foxnews.com/us/sheridan-gorman-university-newspaper-touts-ice-tracker-after-freshman-allegedly-murdered-illegal-alien"" rel=""noopener"" target=""_blank""><strong>SHERIDAN GORMAN'S UNIVERSITY NEWSPAPER TOUTS ICE TRACKER AFTER FRESHMAN ALLEGEDLY MURDERED BY ILLEGAL ALIEN</strong></a></p><p>""The subject is a native and citizen of Venezuela by virtue of birth,"" the document reads. ""The subject is a migrant illegally present in the United States, have no immigration documents in their possession nor have or anyone else filed a petition on their behalf. Subject has close family ties or roots in this country yet are likely to abscond.""</p><p>Additional records state the subject had no valid U.S. address or identification and was unable to provide a verifiable point of contact.</p><p>The documents also detail the circumstances of Medina-Medina’s <a href=""https://www.foxnews.com/category/us/immigration/border-security"" rel=""noopener"" target=""_blank"">apprehension at the border</a>.</p><p><a href=""https://www.foxnews.com/us/facial-recognition-helped-crack-alleged-student-murder-illegal-migrant-new-bill-could-ban-it-ret-cop"" rel=""noopener"" target=""_blank""><strong>FACIAL RECOGNITION HELPED CRACK ALLEGED STUDENT MURDER BY ILLEGAL MIGRANT – NEW BILL COULD BAN IT: RET. COP</strong></a></p><p>""A Border Patrol Agent encountered subject in the El Paso Border Patrol Sector area of responsibility,"" the document read. ""A Border Patrol Agent determined this subject had unlawfully entered the United States from Mexico, at a time and place other than as designated by the Secretary of the Department of Homeland Security of the United States.</p><p>""After determining that the subject was an undocumented migrant who illegally entered the United States, the subject was arrested and transported to the Central Processing Center (CPC) in El Paso, Texas for further processing using the [redacted] Systems,"" the document continued. ""The subject was asked and responded that they do not fear harm or persecution should they be returned to their native country.""</p><p>Despite those findings, the documents show he was processed for a Notice to Appear and released on recognizance ""due to lack of space,"" under the Immigration and Nationality Act.</p><p><a href=""https://www.foxnews.com/us/slain-dc-interns-mom-urges-sheridan-gorman-family-fight-back-after-obituary-olive-branch"" rel=""noopener"" target=""_blank""><strong>SLAIN DC INTERN'S MOM URGES SHERIDAN GORMAN'S FAMILY TO 'FIGHT BACK' AFTER OBITUARY OLIVE BRANCH</strong></a></p><p><a href=""https://www.foxnews.com/us/feds-charge-illegal-immigrant-loyola-student-killing-attorney-says-prosecutors-lack-faith-state"" rel=""noopener"" target=""_blank"">Federal prosecutors on April 2</a> charged Medina-Medina with illegally possessing a firearm, which carries a maximum sentence of 10 years in prison. In addition to the federal charge, he faces state-level charges including murder, attempted murder, aggravated assault and illegal possession of a weapon.</p><p><a href=""https://www.foxnews.com/us/slain-college-freshmans-mother-vows-fight-justice-illegal-immigrant-charged-chicago-killing"" rel=""noopener"" target=""_blank"">Prosecutors said Gorman was</a> with friends at a Rogers Park pier in the early morning hours of March 19 when she spotted Medina-Medina near a lighthouse and warned others. Authorities said Medina-Medina then chased the group and shot Gorman in the upper back as they fled.</p><p>In a statement after charges were filed, the Gorman family said, ""Sheridan was a real person—she had a future, a family, and a life full of promise.""</p><p><em>Fox News Digital’s Adam Sabes contributed to this report.</em></p>",https://www.foxnews.com/politics/docs-show-migrant-accused-killing-loyola-student-flagged-flight-risk-before-release,2026-04-14
