,title,text,link,publish_date
5,Child among 4 dead as accused arsonist allegedly drank beer during chaos,"<p>A <a href=""https://www.foxnews.com/category/us/us-regions/northeast/new-york"" rel=""noopener"" target=""_blank"">New York City man</a> is facing murder charges after allegedly randomly setting a fire in a Queens apartment building that killed four people, including a 3-year-old girl, and injured seven others, authorities announced.</p><p>Roman Amatitla, 38, of Maspeth, was arrested Wednesday and arraigned on multiple charges, including eight counts of second-degree murder and first-degree arson, for the March 16 blaze at a three-story building in Flushing. </p><p>He faces up to 25 years to life in prison if convicted.</p><p>Queens District Attorney Melinda Katz called the incident an ""<a href=""https://www.foxnews.com/category/us/crime/mass-murder"" rel=""noopener"" target=""_blank"">act of mass murder</a>,"" noting Amatitla's chilling lack of motive.</p><p><a href=""https://www.foxnews.com/us/wave-alleged-migrant-murders-ignites-fury-across-us-officials-warn-carnage-crackdown-needed"" rel=""noopener"" target=""_blank""><strong>WAVE OF ALLEGED MIGRANT MURDERS IGNITES FURY ACROSS US AS OFFICIALS WARN OF MORE CARNAGE, CRACKDOWN NEEDED</strong></a></p><p>""Shockingly, the defendant had no known connection to the building or any of its occupants and selected the building at random,"" Katz wrote in a statement.</p><p>According to prosecutors, Amatitla entered and exited the Avery Avenue building multiple times late that morning, at one point urinating in front of the apartments. </p><p>He then went to a nearby gas station, where he bought a beer, stole a second one and took a pack of matches after refusing to pay for a lighter, authorities allege.</p><p><a href=""https://www.foxnews.com/politics/four-time-deported-honduran-arrested-after-shoving-elderly-air-force-vet-onto-nyc-subway-tracks-dhs-reveals"" rel=""noopener"" target=""_blank""><strong>FOUR-TIME DEPORTED HONDURAN ARRESTED AFTER SHOVING ELDERLY AIR FORCE VET ONTO NYC SUBWAY TRACKS, DHS REVEALS</strong></a></p><p>He then entered the apartment building for a fourth and final time, authorities said, allegedly lighting a <a href=""https://www.foxnews.com/category/fires"" rel=""noopener"" target=""_blank"">piece of paper on fire</a> and tossing it onto trash near a stairwell. </p><p>As smoke engulfed the street, he stayed in the immediate area to watch the building burn.</p><p>During a <a href=""https://www.foxnews.com/category/entertainment/events/in-court"" rel=""noopener"" target=""_blank"">court hearing</a> Thursday, Queens Assistant District Attorney Gabriel Reale said Amatitla ""watched as people jumped from various windows, some of them living, one of them dying"" while sipping on a beer, according to <a href=""https://nypost.com/2026/04/09/us-news/immigrant-sent-random-nyc-fire-that-killed-toddler-three-others-in-rage-after-getting-fired-da/"" rel=""noopener"" target=""_blank"">a report</a> from the New York Post.</p><p><a href=""https://www.foxnews.com/us/veteran-83-shoved-onto-nyc-subway-tracks-dies-from-injuries-illegal-migrant-charged-murder"" rel=""noopener"" target=""_blank""><strong>VETERAN, 83, SHOVED ONTO NYC SUBWAY TRACKS DIES FROM INJURIES, ILLEGAL MIGRANT CHARGED WITH MURDER</strong></a></p><p>Three of the people killed in the blaze, identified as Sihan Yang, 3, Chengri Cui, 49, and Chie Shin Ming, 61, were found in the building and pronounced dead from smoke inhalation. </p><p>A fourth victim, Hong Zhao, 64, died at a hospital after suffering multiple broken bones and brain trauma when he leaped from a window to escape the flames.</p><p>Among those injured were a New York City Fire Department (FDNY) lieutenant and a firefighter who plunged into the basement when a staircase collapsed during rescue operations, resulting in thermal burns and smoke inhalation.</p><p>Four other occupants were injured jumping from the building to flee the fire, while a fifth was rescued from a second-story window by firefighters.</p><p>Prosecutors said Amatitla ""had to get his rage out on someone or something,"" though no official motive has been released.</p><p>New York City Police Department records note <a href=""https://www.foxnews.com/category/world/world-regions/location-mexico"" rel=""noopener"" target=""_blank"">he is from Mexico</a>, though his immigration status has not been confirmed.</p><p>The <a href=""https://www.foxnews.com/category/politics/executive/homeland-security"" rel=""noopener"" target=""_blank"">Department of Homeland Security</a> and Immigration and Customs Enforcement did not immediately respond to inquiries from Fox News Digital.</p><p>Amatitla was ordered to remain in custody by Criminal Court Judge Thomas Wright-Fernandez and is scheduled to return to court April 13.</p>",https://www.foxnews.com/us/child-among-4-dead-accused-arsonist-allegedly-drank-beer-during-chaos,2026-04-09
6,Neighbor fatally shoots alleged gunman after 2 women shot in domestic dispute,"<p>A <a href=""https://www.foxnews.com/category/us/us-regions/west/washington"" rel=""noopener"" target=""_blank"">Washington state</a> man was shot and killed by a neighbor after allegedly opening fire on two women during a domestic dispute that spilled into a nearby driveway, police said.</p><p>Officers with the <a href=""https://www.foxnews.com/category/us/crime/police-and-law-enforcement"" rel=""noopener"" target=""_blank"">Puyallup Police Department</a> (PPD) responded around 9:10 a.m. April 2, when investigators allege 47-year-old Arnino Guanlao shot two adult female relatives after a family argument escalated outside the home.</p><p>A neighbor, who had been inside at the time, went outside and intervened, fatally shooting Guanlao, according to police.</p><p>One of the victims, 23-year-old Christiannel Lyle Macapagal Maningat, died at the scene. The second woman was transported to a hospital with life-threatening injuries, authorities said.</p><p><a href=""https://www.foxnews.com/us/good-samaritan-describes-tackling-trans-shooter-rhode-island-ice-rink-went-gun"" rel=""noopener"" target=""_blank""><strong>‘GOOD SAMARITAN’ DESCRIBES TACKLING TRANS SHOOTER AT RHODE ISLAND ICE RINK: ‘WENT FOR THE GUN’</strong></a></p><p>Authorities said the case remains under investigation, including a review of the neighbor’s use of force.</p><p>Washington law allows a person to use force to protect himself or others if he reasonably believes it is necessary, but deadly force is only justified when facing an immediate threat of serious injury or death.</p><p>""That’s under investigation as to exactly how the circumstances took place,"" PPD Capt. Kevin Gill said during a press briefing.</p><p><a href=""https://www.foxnews.com/us/man-accused-timed-beatings-now-charged-murder-after-woman-found-dead-river-report"" rel=""noopener"" target=""_blank""><strong>MAN ACCUSED OF TIMED BEATINGS NOW CHARGED WITH MURDER AFTER WOMAN FOUND DEAD IN RIVER: REPORT</strong></a></p><p>Witnesses described a chaotic scene as gunfire erupted in the neighborhood.</p><p>""There was a girl here who was face down, and she was still breathing a little and trying to move a little, but she wasn't doing much. And then pretty quick a cop came on scene, and he and I pulled her out, turned her over and found her gunshot wound on her abdomen,"" neighbor Michelle Weingarden-Bandes told <a href=""https://www.fox13seattle.com/news/puyallup-wa-domestic-violence-shooting"" rel=""noopener"" target=""_blank"">FOX 13 Seattle</a>.</p><p>""We are all not just in shock about what we saw, those of us who were out here this morning, but that this has happened in our neighborhood.""</p><p><a href=""https://www.foxnews.com/us/rhode-island-ice-rink-shooting-victims-confirmed-shooters-daughter-alleges-vendetta-against-family"" rel=""noopener"" target=""_blank""><strong>RHODE ISLAND ICE RINK SHOOTING VICTIMS CONFIRMED AS SHOOTER'S DAUGHTER ALLEGES 'VENDETTA' AGAINST FAMILY</strong></a></p><p>Investigators said the neighbor who shot the suspect is cooperating as detectives work to determine the circumstances of the use of force, according to FOX 13 Seattle.</p><p>Detectives are also working to determine what led to the dispute and are processing multiple sites linked to the incident, the outlet reported.</p><p>Residents reported hearing multiple gunshots during the incident.</p><p><a href=""https://www.foxnews.com/us/family-speaks-profound-pain-after-trans-dad-guns-down-ex-wife-son-high-school-hockey-game"" rel=""noopener"" target=""_blank""><strong>FAMILY SPEAKS OF 'PROFOUND PAIN' AFTER TRANS DAD GUNS DOWN EX-WIFE, SON AT HIGH SCHOOL HOCKEY GAME</strong></a></p><p>Law enforcement officials said detectives are continuing to interview witnesses, many of whom were left distraught by the violence.</p><p>Additional reporting by <a href=""https://lawandcrime.com/crime/he-was-going-to-shoot-the-kids-stepfather-gunned-down-by-next-door-neighbor-while-trying-to-kill-his-stepdaughters-during-family-fight-that-spilled-outside-cops-say/"" rel=""nofollow noopener"" target=""_blank"">Law &amp; Crime</a> identified Guanlao as the victims’ stepfather and said he had been firing at his adult stepdaughters when the neighbor intervened.</p><p>Authorities have not said what sparked the initial dispute.</p><p><a href=""https://www.foxnews.com/us/washington-state-stabbing-rampage-leaves-5-dead-including-suspect-shot-deputies"" rel=""noopener"" target=""_blank""><strong>WASHINGTON STATE STABBING RAMPAGE LEAVES 5 DEAD, INCLUDING SUSPECT SHOT BY DEPUTIES</strong></a></p><p>The PPD said detectives with its Criminal Investigations Division, along with the Metro Cities Crime Response Unit, are continuing to investigate the incident.</p><p>Fox News Digital has reached out to police for additional information.</p><p>The violence has left the <a href=""https://www.foxnews.com/category/us/education/parents"" rel=""noopener"" target=""_blank"">victims’ family reeling</a>.</p><p>A GoFundMe created for the family says the victims’ mother is now caring for her surviving daughters while grieving the loss of one child and remaining at the bedside of another who is still hospitalized.</p><p>The fundraiser, which has raised nearly $19,000, says the family’s lives ""changed in a matter of moments"" and describes the emotional toll on the two other daughters now coping with the aftermath of the violence.</p><p>Organizers said the funds will help cover funeral costs, medical expenses and basic living needs as the family navigates the aftermath of the shooting.</p>",https://www.foxnews.com/us/neighbor-fatally-shoots-alleged-gunman-two-women-shot-domestic-dispute,2026-04-09
7,"California school board member refuses to follow state’s sanctuary policies, citing 'rule of law'","<p>A <a href=""https://www.foxnews.com/category/us/us-regions/west/california"" rel=""noopener"" target=""_blank"">California</a> school district told Fox News Digital Thursday it is not following the state’s updated guidance on handling immigration enforcement.</p><p>Districts across the state were expected to update <a href=""https://www.cde.ca.gov/nr/el/le/yr25ltr1209.asp"" rel=""nofollow noopener"" target=""_blank"">state guidance by March 1</a> to ensure students are shielded from immigration enforcement. </p><p>California Attorney General Rob Bonta <a href=""https://oag.ca.gov/news/press-releases/attorney-general-bonta-releases-updated-guidance-help-california-schools"" rel=""nofollow noopener"" target=""_blank""><u>announced in December 2025</u></a> that ""approximately 133,000 undocumented children attend California’s public K-12 schools, and many more have parents or relatives who do not have legal status.""</p><p>However, Lakeside Union School District in southern California believes the effort is merely political.</p><p><a href=""https://www.foxnews.com/politics/dhs-slams-california-sanctuary-county-after-mom-allegedly-murdered-2-honduran-nationals"" rel=""noopener"" target=""_blank""><strong>DHS SLAMS CALIFORNIA 'SANCTUARY' COUNTY AFTER MOM ALLEGEDLY MURDERED BY 2 HONDURAN NATIONALS</strong></a></p><p>""In Lakeside, we believe in the rule of law. I refuse to put my district's federal funding and the students it serves at risk by opposing federal law enforcement. It’s not our teachers or school secretaries' job to oppose law enforcement. That’s wrong,"" Lakeside Unified School District Trustee Andrew Hayes told <a href=""https://www.foxnews.com/media"" rel=""noopener"" target=""_blank""><u>Fox News Digital</u></a>.</p><p>State Superintendent of Public Instruction Tony Thurmond <a href=""https://www.cde.ca.gov/nr/el/le/yr25ltr1209.asp"" rel=""nofollow noopener"" target=""_blank"">mandated school districts</a> update their policies ""limiting assistance with immigration enforcement at public schools, to the fullest extent possible consistent with federal and state law, and ensuring that public schools remain safe and accessible to all California residents, regardless of immigration status.""</p><p>In February, Hayes joined the chorus of California school board members accusing California education officials and teachers unions of ""<a href=""https://www.foxnews.com/media/california-school-board-members-slam-fearmongering-over-ice-driving-down-student-attendance"" rel=""noopener"" target=""_blank"">fearmongering</a>"" over immigration enforcement as U.S. Immigration and Customs Enforcement (ICE) was criticized over the killing of Renee Good and Alex Pretti.</p><p><a href=""https://www.foxnews.com/politics/ignored-ice-detainers-put-lives-risk-dhs-says-targeting-newsom-pritzker-healey"" rel=""noopener"" target=""_blank""><strong>IGNORED ICE DETAINERS ‘PUT LIVES AT RISK,’ DHS SAYS, TARGETING NEWSOM, PRITZKER, HEALEY</strong></a></p><p>The school board members reacted to Los Angeles Unified School District Superintendent Alberto Carvalho <a href=""https://www.foxnews.com/media/los-angeles-students-staying-home-fear-deportation-superintendent-says"" rel=""noopener"" target=""_blank"">reporting earlier this year that students</a> were not showing up to class in the second semester of the 2025-2026 school year due to concerns over immigration enforcement.</p><p>Responding to fearmongering claims from school board members, the Department of <a href=""https://www.foxnews.com/category/politics/executive/homeland-security"" rel=""noopener"" target=""_blank""><u>Homeland Security</u></a> (DHS) told Fox News Digital Thursday it had not entered schools to arrest children.</p><p>""ICE is not going to schools to arrest children. We are protecting children. Criminals are no longer able to hide in America’s schools to avoid arrest,"" the spokesperson said. </p><p>""The Trump administration will not tie the hands of our brave law enforcement and instead trusts them to use common sense. If a dangerous illegal alien felon were to flee into a school or a child sex offender is working as an employee, there may be a situation where an arrest is made to protect public safety.""</p><p>Hayes doubled down in a statement to Fox News Digital, saying that the guidance issued by the state was all fanfare.</p><p>""This ‘model’ policy is purely political and not about kids. It’s all fanfare to advance Gavin Newsom’s political agenda. The fact is ICE isn’t coming to schools,"" Hayes said. </p><p>""That’s a narrative created by left-wing activists to instill fear and decrease enrollment so that the Sacramento education bureaucracy can go beg Newsom for more money to cover up their failure to educate our kids properly.""</p><p>The trustee claimed his statement ""reflects the opinion"" of his colleagues.</p><p>The school district told Fox News Digital it ""doesn’t have any comments regarding Board member Hayes’ statements.""</p><p><a href=""https://www.foxnews.com/politics/california-allocating-35m-support-illegal-immigrants-amid-trumps-mass-deportation-agenda"" rel=""noopener"" target=""_blank""><strong>CALIFORNIA ALLOCATING $35M TO SUPPORT ILLEGAL IMMIGRANTS AMID TRUMP'S MASS DEPORTATION AGENDA</strong></a></p><p>The Trump administration's crackdown on illegal immigration and ramping up of deportation efforts have caused some schools to take action. </p><p>Oceanside Unified School District in San Diego County <a href=""https://www.foxnews.com/media/san-diego-school-district-beefs-up-security-provide-scripts-keep-ice-away-report"" rel=""noopener"" target=""_blank""><u>beefed up security and provided scripts</u></a> for staff to ""keep ICE out of schools."" Visitors must be buzzed in to enter the front office. Front office signs were updated, and signs were put up to identify areas restricted to students and staff.</p><p>""OUSD is following updated state laws on this topic, though practices on law enforcement on campus have been part of our board policy since before 2020,"" a spokesperson told Fox News Digital in January.</p><p>Newsom's office did not respond to requests for comment.</p><p><i>The article was updated to include a statement from Lakeside Union School District.</i></p>",https://www.foxnews.com/media/california-school-board-member-refuses-follow-states-sanctuary-policies-citing-rule-law,2026-04-09
8,Melania Trump's forceful Epstein denial draws bipartisan support from lawmakers,"<p>Reactions poured in Thursday after first lady Melania Trump issued a rare on-camera statement forcefully rebuking allegations linking her to disgraced financier and convicted sex trafficker Jeffrey Epstein.</p><p>Speaking earlier in the day, Melania Trump said she was never friends with Epstein or his associate, Ghislaine Maxwell, and stressed that neither played any role in her introduction to her husband, President <a href=""https://www.foxnews.com/category/person/donald-trump"" rel=""noopener"" target=""_blank"">Donald Trump</a>.</p><p>""The lies linking me with the disgraceful Jeffrey Epstein need to end today,"" she said. ""The individuals lying about me are devoid of ethical standards, humility and respect. I do not object to their ignorance, but rather, I reject their mean-spirited attempts to defame my reputation."" </p><p>As she emphasized that her name never appeared in court documents related to Epstein, several political figures quickly took to social media to publicly rally in support of the first lady.</p><p><a href=""https://www.foxnews.com/politics/melania-trump-denounces-lies-connecting-her-disgraced-financier-jeffrey-epstein-white-house-event"" rel=""noopener"" target=""_blank""><strong>MELANIA TRUMP DENOUNCES 'LIES' CONNECTING HER WITH DISGRACED FINANCIER JEFFREY EPSTEIN IN WHITE HOUSE EVENT</strong></a></p><p>Rep. Nancy Mace, R-S.C., a leading congressional voice calling for the release of the Epstein files, praised Melania on X with a photo saying, ""<a href=""https://www.foxnews.com/category/person/melania-trump"" rel=""noopener"" target=""_blank"">Melania Trump</a> stands with Epstein victims."" </p><p>She also applauded Melania for championing legislation that criminalizes the sharing of fake intimate images of women.</p><p>""Thank you to our First Lady for being a voice for victims across the country. From her work on the Take It Down Act to publicly standing for the survivors of Jeffrey Epstein and calling for action and the truth,"" she said. </p><p>""The truth will prevail. America is strong when strong women stand up for what is right.""</p><p><a href=""https://www.foxnews.com/media/vogues-anna-wintour-takes-swipe-melania-trumps-style-while-praising-liberal-favorites"" rel=""noopener"" target=""_blank""><strong><u>VOGUE’S ANNA WINTOUR TAKES SWIPE AT MELANIA TRUMP’S STYLE WHILE PRAISING LIBERAL FAVORITES</u></strong></a></p><p>Rep. Thomas Massie, R-Ky., who has pushed for the release of documents through the Epstein Files Transparency Act, which he co-authored with Rep. Ro Khanna, D-Calif., addressed Melania’s effort to bring survivors in for congressional testimony and said leadership should face consequences over their handling of the files, including recently ousted Attorney General <a href=""https://www.foxnews.com/category/person/pam-bondi"" rel=""noopener"" target=""_blank"">Pam Bondi</a>.  </p><p>""First Lady asks Congress to bring Epstein survivors in for testimony. With all due respect, that’s @DAGToddBlanche’s job!,"" he said. </p><p>""@RepRoKhanna &amp; I already gave brave survivors a chance to tell their horrific stories on Capitol Hill. @PamBondi wouldn’t even acknowledge them. PROSECUTE!""</p><p><a href=""https://www.foxnews.com/media/daily-beast-apologizes-melania-trump-over-retracted-epstein-allegations-article"" rel=""noopener"" target=""_blank""><strong>DAILY BEAST APOLOGIZES TO MELANIA TRUMP OVER RETRACTED EPSTEIN ALLEGATIONS ARTICLE</strong></a></p><p>Former Rep. <a href=""https://www.foxnews.com/politics/trump-trashes-mtg-republican-wins-contest-fill-old-seat-despite-stench-left-greene"" rel=""noopener"" target=""_blank"">Marjorie Taylor Greene</a>, R-Ga., once a fierce Trump supporter before a public falling out with the president, also posted on X aligning with Melania’s remarks.</p><p>""I am grateful to the First Lady for her brave statement today about Epstein and his victims,"" she said. ""I agree with her that the victims should be heard. I also agree with Thomas Massie. The DOJ needs to PROSECUTE!!! And the role of Congress is to legislate, not prosecute.""</p><p><a href=""https://www.foxnews.com/media/daily-beast-pulls-story-alleging-melania-epstein-connection-after-lawyers-dispute-framing"" rel=""noopener"" target=""_blank""><strong><u>DAILY BEAST PULLS STORY ALLEGING MELANIA-EPSTEIN CONNECTION AFTER LAWYERS DISPUTE FRAMING</u></strong></a></p><p>Democrats also took to social media after her fiery remarks.</p><p>Rep. Robert Garcia, D-Calif., called on House Oversight Committee Chairman James Comer, R-Ky., to schedule a public hearing ""immediately.""</p><p>""We agree with First Lady Melania Trump’s call for a public hearing with the survivors of <a href=""https://www.foxnews.com/category/person/jeffrey-epstein"" rel=""noopener"" target=""_blank"">Jeffrey Epstein</a>. We encourage Chairman Comer to respond to the First Lady’s request and schedule a public hearing immediately,"" he said in a post on X.</p><p>He also characterized the first lady’s speech as a significant moment, saying her remarks drew renewed attention to an investigation some critics argue has not progressed far enough.</p><p><a href=""https://www.foxnews.com/download"" rel=""noopener"" target=""_blank""><strong><u>CLICK HERE TO GET THE FOX NEWS APP</u></strong></a></p><p>""The First Lady said two things,"" Garcia said. ""1) She pushed back on Acting AG Todd Blanche &amp; her husband’s efforts to kill this investigation. 2) She joined our efforts to call for a public hearing where survivors who choose to do so have an opportunity to testify."" </p>",https://www.foxnews.com/politics/melania-trumps-forceful-epstein-denial-draws-bipartisan-support-lawmakers,2026-04-09
