,title,text,link,publish_date
8,Exiled Iranian crown prince says he’s ready to lead Iran ‘as soon as the Islamic Republic falls’,"<p>Exiled Iranian Crown Prince Reza Pahlavi said Saturday he is ready to <a href=""https://www.foxnews.com/category/world/conflicts/iran"" rel=""noopener"" target=""_blank"">lead Iran</a>’s transition ""as soon as the Islamic Republic falls.""</p><p>As the war in Iran entered its third week, Pahlavi — the son of the late Shah Mohammad Reza Pahlavi — said he has been working in recent months to develop a transition plan should the Iranian regime collapse to ensure the country does not experience a disruption in governance.</p><p>Pahlavi said in a social media post that ""capable individuals"" have been identified both inside and outside Iran to lead what he called a ""transitional system.""</p><p>""The transitional system, <a href=""https://www.foxnews.com/category/politics/senate/leadership"" rel=""noopener"" target=""_blank"">under my leadership</a>, will be ready to assume governance of the country as soon as the Islamic Republic falls and, in the shortest possible time, establish order, security, freedom and the conditions for Iran’s prosperity and flourishing,"" he said.</p><p><a href=""https://www.foxnews.com/opinion/mike-pompeo-operation-epic-fury-righteous-regime-change-must-follow"" rel=""noopener"" target=""_blank""><strong>MIKE POMPEO: OPERATION EPIC FURY IS RIGHTEOUS — AND REGIME CHANGE MUST FOLLOW</strong></a></p><p>Pahlavi has lived in exile since the 1979 Islamic Revolution toppled Iran’s monarchy and established the Islamic Republic.</p><p>He has in recent years sought to position himself as a unifying opposition figure and has said he would help guide a transition of power from theocracy to democracy in Iran.</p><p>In a message addressed to his ""compatriots,"" Pahlavi said his plan for governing the country would fall within the framework of the ""Iran Prosperity Project.""</p><p><a href=""https://www.foxnews.com/world/irans-new-supreme-leader-his-father-steroids-experts-warn-hardline-rule"" rel=""noopener"" target=""_blank""><strong>IRAN’S NEW SUPREME LEADER IS ‘HIS FATHER ON STEROIDS,’ EXPERTS WARN OF HARDLINE RULE</strong></a></p><p>He said that many compatriots with valuable experience and expertise have declared ""their readiness to participate in the rebuilding of the country and to serve the homeland.""</p><p>Since joint operations between the U.S. and Israel began, nearly 50 regime figures have been killed, including Supreme Leader Ayatollah <a href=""https://www.foxnews.com/category/person/ali-khamenei"" rel=""noopener"" target=""_blank"">Ali Khamenei</a>.</p><p>His son, <a href=""https://www.foxnews.com/category/person/mojtaba-khamenei"" rel=""noopener"" target=""_blank"">Mojtaba Khamenei</a>, was elected this week by Iran’s Assembly of Experts as the country’s new supreme leader.</p><p><a href=""https://www.foxnews.com/politics/trump-exploring-backing-militias-iran-topple-weakened-regime-following-strikes-reports"" rel=""noopener"" target=""_blank""><strong>TRUMP EXPLORING BACKING MILITIAS IN IRAN TO TOPPLE WEAKENED REGIME FOLLOWING STRIKES: REPORTS</strong></a></p><p>In an appearance last week on Fox News’ ""My View with Lara Trump,"" Pahlavi said the Iranian people would not accept any outcome moving forward tied to the current regime.</p><p>""Only a clean break will ensure that not only we achieve a <a href=""https://www.foxnews.com/category/politics/elections"" rel=""noopener"" target=""_blank"">democratic solution</a> and alternative to this regime, but there will be people who are not in any form or shape directly associated with this regime,"" he said.</p><p>Pahlavi said the Iranian people must decide their country’s leadership and that ""only the ballot box should determine the outcome and who will be responsible for our country in the future.""</p><p>""I think what we will expect any government, including, of course, <a href=""https://www.foxnews.com/category/politics/elections/presidential/trump-transition"" rel=""noopener"" target=""_blank"">the current Trump administration</a> to recognize that indeed the best way to help the Iranian people is to allow them to make that choice freely and to support that choice as a Western democracy, as the leading democracy in the world,"" he said.</p>",https://www.foxnews.com/world/iranian-crown-prince-reza-pahlavi-announces-readiness-lead-irans-post-regime-transition,2026-03-15
9,Kim Jong Un appears with teenage daughter at live-fire rocket test in North Korea,"<p>North Korean leader <a href=""https://www.foxnews.com/category/person/kim-jong-un"" rel=""noopener"" target=""_blank"">Kim Jong Un</a> watched a live-fire test of multiple rocket launch systems alongside his teenage daughter Saturday, as the regime escalates weapons demonstrations amid joint U.S.–South Korea military exercises, state media reported.</p><p>The Korean Central News Agency (KCNA) said Kim oversaw a strike drill involving twelve 600mm ultra-precision multiple rocket launchers along <a href=""https://www.foxnews.com/category/world/conflicts/north-korea"" rel=""noopener"" target=""_blank"">North Korea’s east coast</a>, according to The Associated Press.</p><p>South Korea’s military said it detected about 10 ballistic missiles launched from an area near the North Korean capital of Pyongyang.</p><p><a href=""https://www.foxnews.com/world/kim-jong-un-appears-daughter-mausoleum-fueling-succession-speculation"" rel=""noopener"" target=""_blank""><strong>KIM JONG UN APPEARS WITH DAUGHTER AT MAUSOLEUM, FUELING SUCCESSION SPECULATION</strong></a></p><p>South Korea’s National Security Council condemned the launches as a provocation and said they violated <a href=""https://www.foxnews.com/category/world/united-nations/security-council"" rel=""noopener"" target=""_blank"">United Nations Security Council</a> resolutions that prohibit North Korea from conducting ballistic missile tests, The Associated Press reported.</p><p>Kim said the drill was meant to demonstrate the destructive capability of the <a href=""https://www.foxnews.com/category/politics/foreign-policy/nuclear-proliferation"" rel=""noopener"" target=""_blank"">country’s tactical nuclear forces</a>, according to state media.</p><p>""If this weapon is used, the opponent’s military infrastructure within its striking range can never survive,"" Kim said.</p><p><a href=""https://www.foxnews.com/world/kim-jong-un-calls-south-korea-most-hostile-enemy-says-north-could-completely-destroy"" rel=""noopener"" target=""_blank""><strong>KIM JONG UN CALLS SOUTH KOREA ‘MOST HOSTILE ENEMY,’ SAYS NORTH COULD ‘COMPLETELY DESTROY’ IT</strong></a></p><p>Photos released by state media showed Kim and his daughter — believed to be named Kim Ju Ae, about 13 or 14 years old — walking near launch trucks, The Associated Press reported.</p><p>Kim's daughter has appeared alongside him at numerous military events, missile tests and parades since late 2022, fueling speculation that he may be positioning her as a future successor.</p><p><a href=""https://www.foxnews.com/world/north-koreas-kim-jong-un-re-elected-ruling-party-leader"" rel=""noopener"" target=""_blank""><strong>NORTH KOREA’S KIM JONG UN RE-ELECTED AS RULING PARTY LEADER</strong></a></p><p>The live-fire test followed annual military drills by the U.S. and South Korea earlier this week, which North Korea routinely condemns as rehearsals for an invasion. </p><p>Last month, Kim reportedly gave his teenage daughter a <a href=""https://www.foxnews.com/world/kim-jong-un-taps-teenage-daughter-missile-general-north-korea-nuclear-program"" rel=""noopener"" target=""_blank"">leadership role in the regime</a>’s powerful ""Missile Administration,"" the body that oversees Pyongyang’s nuclear forces.</p><p><i>The Associated Press and Fox News Digital's Emma Bussey contributed to this report.</i></p>",https://www.foxnews.com/world/kim-jong-un-appears-teenage-daughter-live-fire-rocket-test-north-korea,2026-03-14
10,Seahawks GM warns Washington’s new 'millionaire tax' could hurt free agent recruiting,"<p>Seattle Seahawks general manager John Schneider highlighted a recent decision by Washington state lawmakers that he believes could pose problems as the reigning <a href=""https://www.foxnews.com/sports/seahawks-win-super-bowl-lx-after-dominant-defensive-performance-against-patriots"" rel=""noopener"" target=""_blank"">Super Bowl champions</a> look to add players to sustain long-term success.</p><p>Washington’s long-standing status as a largely tax-free state is set to change in 2028 after lawmakers approved a ""millionaire tax"" that would levy a 9.9% rate on high earners. </p><p>The tax will apply to individuals earning more than $1 million annually. Gov. Bob Ferguson has indicated he will sign the bill. It is unclear whether the legislation will face legal challenges. Schneider projected the new tax deduction could hinder <a href=""https://www.foxnews.com/category/sports/nfl/seattle-seahawks"" rel=""noopener"" target=""_blank"">the Seahawks'</a> ability to recruit and ultimately sign free agents.</p><p><a href=""https://www.foxnews.com/sports"" rel=""noopener"" target=""_blank""><strong>CLICK HERE FOR MORE SPORTS COVERAGE ON FOXNEWS.COM</strong></a></p><p>Schneider suggested that part of the team’s pitch to free agents over the years has highlighted Washington’s tax exemptions. </p><p>""There were a bunch of agents texting me the other day like, ‘Hey, can’t use that anymore, buddy,’"" Schneider said this week on his Seattle Sports 710-AM radio show.</p><p><a href=""https://www.foxnews.com/sports/seahawks-gm-john-schneider-goes-viral-after-awkward-kenneth-walker-contract-talk-super-bowl-lx-parade"" rel=""noopener"" target=""_blank""><strong>SEAHAWKS GM JOHN SCHNEIDER GOES VIRAL AFTER AWKWARD KENNETH WALKER III CONTRACT TALK AT SUPER BOWL LX PARADE</strong></a></p><p>""I think it is for all the pro teams here in town. It's always been a huge attraction, especially competing with the California teams. It's been a big deal for us. So, it's going to sting, from a recruiting standpoint and what that looks like. I'm sure Mike Reinfeldt and Mickey Loomis and all the cap guys that have been here before, too, are looking at this like, ‘Dang.’""</p><p>As of 2026, the Seahawks are one of eight <a href=""https://www.foxnews.com/category/sports/nfl"" rel=""noopener"" target=""_blank"">NFL</a> clubs based in a state that does not impose income tax on personal wages.</p><p>Two of those teams, the Texans and Cowboys, are based in Texas, while three of those teams play home games in Florida: the Jaguars, Buccaneers and Dolphins. The Raiders relocated from California to the neighboring tax-free Nevada in 2020, while the Titans are set to open a multibillion-dollar domed stadium in Nashville, Tennessee, in 2027.</p><p>""It's going to be a problem, and hopefully it doesn't happen,"" an unnamed NFL agent told ESPN when asked about thoughts on the potential impact the new taxes could have on the Seahawks.</p><p>While it remains unclear whether the new taxes will influence NFL players’ decisions about signing with the Seahawks, an MLB player recently cited California’s higher tax rates in his decision to turn down a deal with the San Diego Padres.</p><p><a href=""https://www.foxnews.com/sports/mlb-pitcher-merrill-kelly-california-tax-rate-swayed-decision-reject-padres-free-agency-offer"" rel=""noopener"" target=""_blank"">Merrill Kelly</a>, who entered the free agent market after pitching in 10 games with the Texas Rangers in 2025, last month agreed to a deal to return to the Arizona Diamondbacks.</p><p>Kelly agreed to a two-year contract worth an estimated $40 million with the Diamondbacks, according to ESPN. Although the Padres offered a comparable deal at three years instead of two, California’s 13% tax rate on income above $1 million proved a key difference.</p><p>""I don’t think it’s any secret on how much money you get taken out of your pocket when you go to California,"" the right-hander told <a href=""https://x.com/FoulTerritoryTV/status/2027106391694127456"" rel=""nofollow noopener"" target=""_blank""><u>""Foul Territory.""</u></a></p><p><i><strong>Follow Fox News Digital’s </strong></i><a href=""https://twitter.com/FoxNewsSports_"" rel=""nofollow noopener"" target=""_blank""><i><strong>sports coverage on X</strong></i></a><i><strong>, and subscribe to </strong></i><a href=""https://www.foxnews.com/newsletters"" rel=""noopener"" target=""_blank""><i><strong>the Fox News Sports Huddle newsletter</strong></i></a><i><strong>.</strong></i></p>",https://www.foxnews.com/sports/seahawks-gm-warns-washingtons-new-millionaire-tax-could-hurt-free-agent-recruiting,2026-03-14
11,"Headless, handless body found on New York road 56 years ago identified through DNA; killer remains unknown","<p>The headless, handless body of a man found on the side of a lonely road in <a href=""https://www.foxnews.com/category/us/us-regions/northeast/new-york"" rel=""noopener"" target=""_blank"">New York’s Allegany County</a> 56 years ago has been identified through DNA advancements, officials announced this week.</p><p>Still, his killer hasn’t been caught.</p><p>The body of Clyde A. Coppage, 35, was discovered along a road in Andover in upstate New York in March 1970.</p><p><a href=""https://www.foxnews.com/us/star-murdaugh-trial-witness-probes-mysterious-death-busters-former-classmate"" rel=""noopener"" target=""_blank""><strong>STAR MURDAUGH TRIAL WITNESS PROBES MYSTERIOUS DEATH OF BUSTER'S FORMER CLASSMATE</strong></a></p><p>""Over the course of nearly 56 years, investigating members of the New York State Police continued to track down every lead, but the identity of the male remained unknown,"" New York State Police said in a news release Thursday.</p><p>Coppage was originally <a href=""https://www.foxnews.com/category/us/us-regions/northeast/pennsylvania"" rel=""noopener"" target=""_blank"">from Pennsylvania</a> and hadn’t been reported missing.</p><p>He didn’t have any clothes on or any other way to identify him, <a href=""https://www.foxnews.com/category/us/crime/police-and-law-enforcement"" rel=""noopener"" target=""_blank"">Trooper James O’Callaghan</a> said Friday, according to the Albany Times Union.</p><p><a href=""https://www.foxnews.com/us/man-confesses-killing-7-year-old-while-lam-after-dna-links-him-30-year-cold-case-authorities"" rel=""noopener"" target=""_blank""><strong>MAN CONFESSES TO KILLING 7-YEAR-OLD WHILE ON THE LAM AFTER DNA LINKS HIM TO 30-YEAR-OLD COLD CASE: AUTHORITIES</strong></a></p><p>O’Callaghan said the evidence suggested Coppage was <a href=""https://www.foxnews.com/category/us/crime/homicide"" rel=""noopener"" target=""_blank"">killed and dismembered</a> somewhere else before his body was left on the rural Davis Hill Road in Andover.</p><p>In June 2022, his body was exhumed for a DNA profile, and, with the <a href=""https://www.foxnews.com/category/tech/topics/fbi"" rel=""noopener"" target=""_blank"">help of the FBI</a>, he was finally identified.</p><p>State police said the Bureau of Criminal Investigation out of NYSP Amity is asking for the public’s help for any information about Coppage or his killer.</p><p>The investigation into his death remains active, police said.</p>",https://www.foxnews.com/us/headless-handless-body-found-new-york-road-56-years-ago-identified-through-dna-killer-remains-unknown,2026-03-14
12,Speech to US baseball team by Navy SEAL who killed Osama bin Laden prompts liberal backlash,"<p>Former Navy SEAL Robert J. O'Neill, who was part of the 2011 raid that killed Osama bin Laden, delivered a pregame speech to <a href=""https://www.foxnews.com/category/sports/world-baseball-classic"" rel=""noopener"" target=""_blank"">Team USA</a> players ahead of their World Baseball Classic quarterfinal game against Canada Friday. </p><p>Team USA <a href=""https://www.foxnews.com/sports/usa-beats-canada-world-baseball-classic-maintain-american-sports-dominance-over-northern-neighbor"" rel=""noopener"" target=""_blank"">beat Canada 5-3</a> to advance to the semifinals after O'Neill's pep talk. But the speech also received criticism from left-wing social media users within and beyond the U.S. </p><p>Many who criticized the speech condemned its pro-war messaging and association of war with American values. </p><p><a href=""https://www.foxnews.com/sports"" rel=""noopener"" target=""_blank""><strong><u>CLICK HERE FOR MORE SPORTS COVERAGE ON FOXNEWS.COM</u></strong></a></p><p>Other Americans praised the speech and fired back at the critics. </p><p>""It’s unfathomable that the comment section is filled with people upset about an <a href=""https://www.foxnews.com/category/us/military/navy"" rel=""noopener"" target=""_blank"">American hero</a> telling a team representing America about a heroic story about a mission his team accomplished. We went from a patriotic country post 9/11 to a country full of terrorist sympathizers,"" one X user wrote.</p><p>Another user wrote, ""Epic! Well played by <a class=""css-1jxf684 r-bcqeeo r-1ttztb7 r-qvutc0 r-poiln3 r-1wvb978 r-1loqt21"" href=""https://x.com/USABaseball"">@USABaseball.</a> American hero and legend in the clubhouse."" </p><p><a href=""https://www.foxnews.com/sports/team-usa-baseball-manager-mark-derosa-responds-criticism-amid-mounting-controversy"" rel=""noopener"" target=""_blank""><strong>TEAM USA BASEBALL MANAGER MARK DEROSA RESPONDS TO CRITICISM AMID MOUNTING CONTROVERSY</strong></a></p><p>The U.S. will play the Dominican Republic in a WBC semifinal Sunday. </p><p>The win over Canada marked the third time in less than a month that Americans have crushed <a href=""https://www.foxnews.com/category/sports/world-baseball-classic"" rel=""noopener"" target=""_blank""><u>Canadian sports dreams</u></a> on the world stage after dramatic victories over Canada in both the men’s and women’s Olympic hockey gold medal games last month. </p><p>O'Neill wasn't the only one to hype up Team USA before the game. </p><p>Team USA manager Mark DeRosa revealed that USA hockey hero Jack Hughes, who scored the winning goal in the gold medal game against Canada at the Olympics, reached out to the American baseball players before Friday's game. </p><p>""Jack Hughes sent the boys a nice little fire-up message that I put out on their group chat,"" DeRosa said during a press conference Thursday ahead of the game.</p><p>""I know there are some talks about some hockey jerseys being sent in tomorrow for the guys to wear during BP or out and about in the clubhouse.""</p><p><i><strong>Follow Fox News Digital’s </strong></i><a href=""https://twitter.com/FoxNewsSports_"" rel=""nofollow noopener"" target=""_blank""><i><strong><u>sports coverage on X</u></strong></i></a><i><strong>, and subscribe to </strong></i><a href=""https://www.foxnews.com/newsletters"" rel=""noopener"" target=""_blank""><i><strong><u>the Fox News Sports Huddle newsletter</u></strong></i></a><i><strong>.</strong></i></p>",https://www.foxnews.com/sports/speech-us-baseball-team-from-navy-seal-who-killed-osama-bin-laden-prompts-liberal-backlash,2026-03-14
13,Late Colts owner Jim Irsay’s memorabilia collection brings record prices at auction,"<p><a href=""https://www.foxnews.com/sports/colts-owner-jim-irsay-dead-65"" rel=""noopener"" target=""_blank"">Jim Irsay</a> collected several pieces of iconic sports memorabilia during his lifetime.</p><p>The late <a href=""https://www.foxnews.com/category/sports/nfl/indianapolis-colts"" rel=""noopener"" target=""_blank"">Indianapolis Colts</a> owner’s collection was offered in a live online auction at Christie’s, an art and luxury auction house. From Thursday through Saturday, the collection generated more than $93 million at auction, far exceeding its pre-auction $40 million estimate.</p><p>Aside from the coveted music pieces, the sports-themed items in Irsay’s collection sold at auction included Secretariat’s 1973 Triple Crown saddle, Wayne Gretzky’s Edmonton Oilers jersey he wore when he scored his NHL record 500th goal and one of Jackie Robinson’s bats from the 1953 season. </p><p><a href=""https://www.foxnews.com/sports"" rel=""noopener"" target=""_blank""><strong>CLICK HERE FOR MORE SPORTS COVERAGE ON FOXNEWS.COM</strong></a></p><p>The saddle commanded a horse racing item record price of $1.524 million, <a href=""https://www.foxnews.com/category/sports/nhl/edmonton-oilers"" rel=""noopener"" target=""_blank"">the Oilers’</a> jersey drew $952,500 and Robinson’s bat brought in $406,400.</p><p>""The Irsay sale did justice to the brilliance of the collector and of the monumental pieces he brought together, iconic objects that tell the story of our culture and our times,"" Julien Pradels, president of Christie's Americas, said in a statement.</p><p><a href=""https://www.foxnews.com/sports/peyton-manning-pat-mcafee-other-sports-stars-mourn-colts-owner-jim-irsay-after-death-65"" rel=""noopener"" target=""_blank""><strong>PEYTON MANNING, PAT MCAFEE, OTHER SPORTS STARS MOURN COLTS OWNER JIM IRSAY AFTER DEATH AT 65</strong></a></p><p>""The Irsay collection is singular, but Christie's will have other amazing sales in the space moving forward.""</p><p>The auction of Irsay’s memorabilia set 23 world records, including a Pink Floyd guitar becoming the most expensive ever sold at auction. Pink Floyd guitarist David Gilmour played the black Fender Stratocaster on six of the band's albums.</p><p>A portion of the proceeds from the sale of Irsay’s collection will be donated to the philanthropic causes the late NFL owner championed during his lifetime, according to Christie’s.</p><p><a href=""https://www.foxnews.com/sports/fbi-probes-jim-irsay-death-over-prescription-drugs-ketamine-use-doctor-relationship-report"" rel=""noopener"" target=""_blank"">The FBI launched a probe</a> into the circumstances of Irsay’s death, including a possible connection to his relationship with Dr. Harry Haroutunian, an addiction specialist based in California who reportedly prescribed him pain pills and ketamine.</p><p><i><strong>Follow Fox News Digital’s </strong></i><a href=""https://twitter.com/FoxNewsSports_"" rel=""nofollow noopener"" target=""_blank""><i><strong>sports coverage on X</strong></i></a><i><strong>, and subscribe to </strong></i><a href=""https://www.foxnews.com/newsletters"" rel=""noopener"" target=""_blank""><i><strong>the Fox News Sports Huddle newsletter</strong></i></a><i><strong>.</strong></i></p>",https://www.foxnews.com/sports/late-colts-owner-jim-irsays-memorabilia-collection-brings-record-prices-auction,2026-03-14
