,title,text,link,publish_date
0,Misconduct allegations dog Swalwell as Dem rivals seize opening in California governor’s race,"<p><a href=""https://www.foxnews.com/category/person/eric-swalwell"" rel=""noopener"" target=""_blank"">Rep. Eric Swalwell, D-Calif.,</a> is facing increased scrutiny over allegations that he engaged in sexual misconduct with female staffers and other women, as several rivals take swipes at him ahead of the state’s June gubernatorial primary election.</p><p>""I’m very disappointed in Eric Swalwell,"" former Los Angeles Mayor Antonio Villaraigosa said on social media Wednesday. ""As more and more women come forward with sexual harassment allegations, Swalwell skipped town to avoid facing tough questions about these allegations.""</p><p>""If Swalwell wants voters to trust him, he needs to show up, stop hiding behind his campaign staff and social media accounts, and answer every question from reporters and the public. Voters deserve nothing less,"" he added. </p><p>The Swalwell campaign fired back in a statement to Fox News Digital, calling Villaraigosa’s claims that the Democratic lawmaker is inaccessible ""false"" and ""absurd.""</p><p><a href=""https://www.foxnews.com/politics/adam-schiff-endorses-eric-swalwell-california-governor"" rel=""noopener"" target=""_blank""><strong>ADAM SCHIFF MAKES ENDORSEMENT IN CALIFORNIA GUBERNATORIAL RACE</strong></a></p><p>""Congressman Swalwell spoke to more than 1,000 town hall attendees for nearly 90 minutes Tuesday in Sacramento,"" Micah Beasley, a spokesperson for the Swalwell campaign, said. ""Afterward, he met with members of the media to answer their questions.""</p><p>Beasley added that Swalwell was unable to attend Wednesday’s candidate forum due to prior commitments, but had met with the group previously.</p><p>Villaraigosa’s social media post referenced a series of accusations circulated by former Democratic congressional staffer and attorney Cheyenne Hunt and other left-leaning politicos who have alleged, without evidence, that Swalwell made sexual advances toward women employed in his office.</p><p>The allegations threaten to shake up California’s gubernatorial primary, where Swalwell is vying to be among the top two vote-getters who will advance to the November general election. The crowded field also includes Trump-backed former Fox News host Steve Hilton, Riverside County Sheriff Chad Bianco and progressive billionaire <a href=""https://www.foxnews.com/category/person/tom-steyer"" rel=""noopener"" target=""_blank"">Tom Steyer.</a></p><p>Former Rep. Katie Porter, D-Calif., another candidate in the race, has described the allegations as ""troubling"" and said she is committed to supporting the accusers, who have yet to go public.</p><p>""It is those women's stories to tell when they are ready, and I hope that they feel safe and supported if they choose to do so,"" Porter told CNN on Tuesday. ""I believe women. I think that has to be the starting place here. So when those women speak up, I will be there, helping to amplify their truths.""</p><p><a href=""https://www.foxnews.com/politics/swalwells-i-should-working-gym-pool-videos-resurface-rival-hammers-missed-house-votes"" rel=""noopener"" target=""_blank""><strong>SWALWELL'S 'I SHOULD BE WORKING' GYM, POOL VIDEOS RESURFACE AS DEM RIVAL HAMMERS HIS MISSED HOUSE VOTES</strong></a></p><p>Swalwell has denied any wrongdoing, and his campaign has characterized the <a href=""https://www.foxnews.com/politics/swalwell-campaign-rejects-outrageous-allegations-sexual-misconduct-dem-activists-issue-viral-warning"" rel=""noopener"" target=""_blank"">sexual misconduct allegations as ""outrageous""</a> and implied that the accusers are tied to MAGA.</p><p>Hunt, executive director of Gen-Z for Change, said she is working with multiple women to go public with their allegations against Swalwell. Hunt has not provided verifiable evidence to support the allegations, and no woman has yet come forward.</p><p>""The Democratic candidate currently leading in the California governor’s race has a known history of being predatory towards women,"" Hunt claimed <a href=""https://www.instagram.com/cheyenne.l.hunt/reel/DWjgJEAETWI/"" rel=""noopener noreferrer nofollow"" target=""_blank""><u>in a post to social media</u></a> in March.</p><p>She posted an image of a direct message sent to her privately containing an allegation against Swalwell. </p><p>""You know, Eric Swalwell has slept with many of his interns and makes them all sign [non-disclosure agreements] so they don’t speak up, right? And when I was 19, he tried hitting on me and sliding into my DMs,"" the quote read.</p><p>Bhavik Lathia, a Democratic operative, has also called on his party to take the allegations against Swalwell ""seriously.""</p><p>""Hey, I just got off the phone with a trusted friend. This is real. Take it seriously. Eric Swallwell cannot be our nominee. There is going to be a lot more coming out soon. I can’t say more right now, but stay tuned,"" Lathia wrote on social media Monday.</p><p>Swalwell, 45, has served in the House of Representatives since 2013, where he has emerged as a frequent Trump critic. He launched a campaign in late 2025 to succeed <a href=""https://www.foxnews.com/category/person/gavin-newsom"" rel=""noopener"" target=""_blank"">Gov. Gavin Newsom, D-Calif.,</a> as the Golden State’s next governor.</p>",https://www.foxnews.com/politics/misconduct-allegations-dog-swalwell-dem-rivals-seize-opening-california-governors-race,2026-04-09
1,Foreign fugitive wanted for woman’s killing lived undetected in US for possibly years before ICE arrest,"<p>A foreign fugitive who illegally <a href=""https://www.foxnews.com/category/us/immigration"" rel=""noopener"" target=""_blank"">entered the U.S</a>. and is wanted for killing a woman in Mexico was caught near the southern border after evading notice for possibly years.</p><p>U.S. Immigration and Customs Enforcement (ICE) arrested Mexican illegal immigrant Jose Gustavo Angulo Bernal outside a residence in Lake Havasu City, Arizona, last week. Though Angulo Bernal had no criminal record in the U.S., he is wanted in the Mexican state of Sinaloa on homicide charges connected to the 2018 murder of a woman. He was arrested during a targeted traffic stop while driving a vehicle registered in his name.</p><p>In a public statement, the <a href=""https://www.foxnews.com/category/politics/executive/homeland-security"" rel=""noopener"" target=""_blank"">Department of Homeland Security</a> mockingly referred to Angulo Bernal as ""one of the Media’s ‘Non-Criminals.’"" The agency emphasized that while nearly 70% of ICE arrests are of illegal aliens charged or convicted of crimes in the country, those with foreign charges are not part of that statistic.</p><p>DHS Acting Assistant Secretary Lauren Bis commented that while ""nearly 70% of ICE arrests have been convicted or charged with a crime in the United States,"" the ""actual arrests of public safety threats and criminals is much higher.""</p><p><a href=""https://www.foxnews.com/politics/homeland-security-vows-deportation-operations-will-continue-ice-agents-help-tsa-agency-defunded"" rel=""noopener"" target=""_blank""><strong>HOMELAND SECURITY VOWS DEPORTATION OPERATIONS ‘WILL CONTINUE’ AS ICE AGENTS HELP TSA, AGENCY DEFUNDED</strong></a></p><p>""Jose Gustavo Angulo Bernal is a cold-blooded killer and an example of who the media often refer to as a ‘non-criminals,’ [sic] because they only have heinous convictions in their home country,"" said Bis.</p><p>According to DHS, Angulo Bernal is charged with participating in the murder of a woman alongside two other accomplices in Nov. 2018. The agency said that after killing her, the trio allegedly dumped the woman’s body in the town of El Tamarindo, Sinaloa.</p><p>Then, Angulo Bernal entered the U.S. at an unknown date and time.</p><p>He evaded detection until recently. On March 31, <a href=""https://www.foxnews.com/category/us/crime/police-and-law-enforcement"" rel=""noopener"" target=""_blank"">ICE officers</a> staking out a residence in Lake Havasu City observed Angulo Bernal entering his vehicle around 5:50 a.m. The federal officers conducted a targeted vehicle stop, during which Angulo Bernal was positively identified through his Mexican identification card. He was arrested and taken to ICE’s field office in Phoenix for processing.</p><p><a href=""https://www.foxnews.com/video/6392819209112"" rel=""noopener noreferrer nofollow"" target=""_blank""><strong>VICTIM'S FAMILY THANKS TRUMP FOR DEPORTING MIGRANT CRIMINAL</strong></a></p><p>DHS said he will remain in ICE custody pending the outcome of his immigration proceedings.</p><p>""Thanks to ICE law enforcement, this monster wanted for murdering a woman in Mexico is off our streets.</p><p>From foreign fugitives, gang members, and terrorists, ICE is getting the worst of the worst off our streets and out of our country.""</p><p><a href=""https://www.foxnews.com/politics/meet-fairfax-killers-top-violent-illegal-alien-criminals-wreaking-havoc-major-american-suburb"" rel=""noopener noreferrer nofollow"" target=""_blank""><strong>MEET THE FAIRFAX KILLERS: TOP VIOLENT ILLEGAL ALIEN CRIMINALS WREAKING HAVOC ON MAJOR AMERICAN SUBURB</strong></a></p><p>This comes as DHS continues to undergo a lapse in funding due to a <a href=""https://www.foxnews.com/category/topic/government-shutdown"" rel=""noopener"" target=""_blank"">partial government shutdown</a>. The shutdown has been brought on by disagreements in Congress over ICE and Border Patrol enforcement tactics, with Democrats making renewed funding contingent on significant changes to the agency’s current posture.</p>",https://www.foxnews.com/politics/foreign-fugitive-wanted-womans-killing-lived-undetected-us-years-before-ice-arrest,2026-04-09
2,"Florida woman who posed as nurse and treated more than 4,400 patients without a license avoids jail time","<p>A <a href=""https://www.foxnews.com/category/us/us-regions/southeast/florida"" rel=""noopener"" target=""_blank"">Florida woman</a> who posed as a nurse and treated more than 4,400 patients without a license was sentenced this week to probation and community service after pleading no contest, avoiding jail time in a case authorities once called deeply disturbing.</p><p>The Flagler County Sheriff’s Office said Wednesday that 29-year-old Autumn Bardisa, of Palm Coast, entered the guilty plea on Tuesday to unlicensed practice of healthcare and fraudulent use of identification.</p><p>Circuit Judge Dawn Nichols withheld adjudication and sentenced Bardisa to five years of probation and 50 hours of community service as part of the agreement.</p><p>She must also write a letter of apology to the nurse whose license number she used.</p><p>As part of the plea deal, Bardisa forfeited a nursing license she obtained after her arrest to the Florida Department of Health and is barred from working in the medical field during her probation.</p><p><a href=""https://www.foxnews.com/us/medicare-fraud-azerbaijan-suspect-90m-doj"" rel=""noopener"" target=""_blank""><strong>MAN CHARGED IN $90M MEDICARE FRAUD SCHEME; DOJ SAYS SUSPECT MAY HAVE ENTERED US ILLEGALLY</strong></a></p><p>Bardisa was originally charged with seven counts of unlicensed practice of health care and seven counts of fraudulent use of personal identification information following a seven-month investigation.</p><p>Authorities said she treated more than 4,400 patients between June 2024 and January 2025, while falsely presenting herself as a licensed nurse at AdventHealth.</p><p>Investigators determined Bardisa never held a valid nursing license during that time and instead used the license number of another nurse who shared her first name.</p><p><a href=""https://www.foxnews.com/politics/florida-execs-sentenced-233m-obamacare-fraud-targeted-homeless-hurricane-victims"" rel=""noopener"" target=""_blank""><strong>FLORIDA EXECS SENTENCED IN $233M OBAMACARE FRAUD THAT TARGETED HOMELESS, HURRICANE VICTIMS</strong></a></p><p>The case stemmed from a months-long investigation involving state and federal health agencies after hospital officials discovered Bardisa had allegedly used another nurse’s license number and falsified records to land a job as an <a href=""https://www.foxnews.com/category/health/health-care"" rel=""noopener"" target=""_blank"">advanced nurse technician</a>.</p><p>Investigators said Bardisa initially applied under an ""education first"" designation, typically used for nursing graduates who have not yet passed their licensing exam. She later claimed she had completed the exam and provided a license number belonging to a different nurse with the same first name.</p><p>To explain inconsistencies, Bardisa told hospital staff she had recently changed her last name after getting married but never produced documentation when asked to verify the claim.</p><p><a href=""https://www.foxnews.com/media/los-angeles-county-faces-scrutiny-after-alleged-widespread-hospice-fraud-exposed"" rel=""noopener"" target=""_blank""><strong>LOS ANGELES COUNTY FACES SCRUTINY AFTER ALLEGED WIDESPREAD HOSPICE FRAUD EXPOSED</strong></a></p><p>Despite the missing paperwork, Bardisa was promoted in January 2025, according to investigators. Concerns surfaced when a coworker independently checked her credentials and found she only held an expired certified nursing assistant license, prompting hospital officials to notify authorities.</p><p>The scheme unraveled after that discovery, leading to her termination and a broader <a href=""https://www.foxnews.com/category/politics/finance/investigations"" rel=""noopener"" target=""_blank"">criminal investigation</a> involving multiple agencies.</p><p>Flagler County Sheriff Rick Staly said Bardisa’s actions put patients at risk and undermined trust in the medical profession.</p><p><a href=""https://www.foxnews.com/us/la-medicare-fraud-doctor-provider-number-billing-probe"" rel=""noopener"" target=""_blank""><strong>DOCTOR DENIES KNOWING ABOUT RAMPANT LA-AREA MEDICARE FRAUD USING HIS PROVIDER NUMBER</strong></a></p><p>""Nursing is a noble profession about caring for those in need, but there is a right way and wrong way to go about it, and she chose the wrong way by using a real nurse's license,"" Staly said, adding that her actions ""potentially endangered patients.""</p><p>Staly said Bardisa ""ruined her career"" and will be unable to work in the medical field for at least three years and up to five years under the <a href=""https://www.foxnews.com/category/us/crime/trials"" rel=""noopener"" target=""_blank"">terms of her probation</a>.</p><p>Authorities previously described the case as one of the most significant incidents of medical fraud investigated by the agency.</p><p>Officials said anyone who believes they may have been treated by Bardisa can contact the Flagler County Sheriff’s Office.</p><p><i>Fox News Digital’s Stepheny Price contributed to this report.</i></p>",https://www.foxnews.com/us/florida-woman-posed-nurse-treated-4400-patients-without-license-avoids-jail-time,2026-04-09
3,'Who's the Boss?' star Danny Pintauro trades Hollywood fame for delivery routes as industry stalls,"<p>Danny Pintauro is getting brutally honest about life after child stardom.</p><p>The <a href=""https://www.foxnews.com/category/entertainment/child-stars"" rel=""noopener"" target=""_blank"">former ""Who's the Boss?"" star</a>, now 50, shared what his life is like after fame as he posted a selfie from his latest side hustle — delivering packages.</p><p>In a candid Instagram post, Pintauro shared a photo of himself sitting behind the wheel with a car full of deliveries.</p><p><a href=""http://foxnews.com/entertainment/whos-boss-star-hospitalized-emergency-surgery-thanksgiving-accident"" rel=""noopener"" target=""_blank""><strong>'WHO'S THE BOSS?' STAR HOSPITALIZED FOR EMERGENCY SURGERY AFTER THANKSGIVING ACCIDENT</strong></a></p><p>""Working hard while ‘not working.’ The entertainment business has been soooo slow, so I’ve been doing what a lot of people do — figuring it out, showing up, and taking the work that’s there while I keep building the work I really want. 38 packages today! There’s no shame in staying in motion,"" Pintauro captioned the post.</p><p><a href=""https://www.instagram.com/p/DW4bJwCD1K6/?utm_source=ig_embed&amp;ig_rid=ce7bfc4f-143e-4cb0-b0e3-9783f59624a8"" rel=""nofollow noopener"" target=""_blank""><strong>APP USERS CLICK HERE TO VIEW POST</strong></a></p><p>Pintauro shot to fame on ""Who's the Boss?"", starring opposite Tony Danza, Judith Light and <a href=""https://www.foxnews.com/category/person/alyssa-milano"" rel=""noopener"" target=""_blank"">Alyssa Milano</a>. As Jonathan Bower, he became a fan favorite during the show’s eight-season run from 1984 to 1992.</p><p>His candid post comes after a frightening health scare that nearly turned deadly.</p><p>In December 2024, Pintauro revealed he was <a href=""https://www.foxnews.com/category/health/medical-research/surgery"" rel=""noopener"" target=""_blank"">rushed to the hospital</a> following a Thanksgiving scooter accident.</p><p><a href=""https://www.foxnews.com/newsletters?cmpid=fnfirstnl"" rel=""noopener"" target=""_blank""><strong>CLICK HERE TO SIGN UP FOR THE ENTERTAINMENT NEWSLETTER</strong></a></p><p>Sharing a video slideshow on Instagram, the actor detailed how a bike lane he was riding in was ""suddenly blocked with cones,"" leading to a serious crash.</p><p>His husband, Wil Tabares, drove him to the hospital, where doctors discovered the accident had caused a tear in his stomach lining — a life-threatening injury.</p><p><a href=""https://www.foxnews.com/entertainment"" rel=""noopener"" target=""_blank""><strong>LIKE WHAT YOU’RE READING? CLICK HERE FOR MORE ENTERTAINMENT NEWS</strong></a></p><p>According to Pintauro, the damage triggered ""an infection in my bloodstream,"" while ""air and stomach acid, etc, were escaping into my abdomen.""</p><p>Calling it ""the most excruciating pain I’ve ever felt in my whole life,"" he revealed the diagnosis led to ""emergency surgery last night to repair the tear.""</p><p>""If I had waited any longer, I could have died,"" Pintauro shared at the time, adding that listening to his body ultimately saved his life. He said it ""was the one who told me something was absolutely wrong.""</p><p>Since his early success, Pintauro has largely stepped away from the Hollywood spotlight, <a href=""https://www.foxnews.com/category/us/us-regions/west/california"" rel=""noopener"" target=""_blank"">relocating from California</a> and pursuing a different path while still taking on occasional acting roles, including appearances in projects like ""The Quarantine Bunch"" and ""A Country Christmas Harmony.""</p>",https://www.foxnews.com/entertainment/whos-boss-danny-pintauro-trades-hollywood-fame-delivery,2026-04-09
4,In-N-Out CEO says no to delivery and East Coast expansion: 'We won't compromise',"<p><a href=""https://www.foxnews.com/food-drink/in-n-out-crowned-americas-favorite-burger-chain-yelp-rankings"" rel=""noopener"" target=""_blank"">America's favorite burger chain</a> isn't bowing to delivery trends and app-based ordering preferences any time soon.</p><p>In-N-Out Burger's chief executive officer recently said the California-based fast-food restaurant chain does not intend to offer online ordering or delivery.</p><p><a href=""https://www.foxnews.com/category/food-drink/food/restaurants"" rel=""noopener"" target=""_blank"">The restaurants</a>, which are mostly located on the West Coast and in the Southwest, are best known for their fresh, made-to-order burgers, upbeat employees and Bible verses printed on the packaging — a formula that's helped build a loyal fan base.</p><p><a href=""https://www.foxnews.com/food-drink/fast-food-shocker-texas-chain-beats-mcdonalds-burger-king-value"" rel=""noopener"" target=""_blank""><strong>FAST-FOOD SHOCKER: TEXAS CHAIN BEATS MCDONALD'S, BURGER KING ON VALUE</strong></a></p><p>In-N-Out CEO Lynsi Snyder-Ellingson made the remarks while speaking at Pepperdine University on March 31 when the moderator asked if the <a href=""https://www.foxnews.com/category/food-drink/food/fast-food"" rel=""noopener"" target=""_blank"">fast-food chain</a> would introduce things like mobile order pickup and app ordering.</p><p>""We have, for sure, had that put in front of us — and the answer is no,"" Snyder-Ellingson said.</p><p>""The main reason is part of what makes In-N-Out and <a href=""https://www.foxnews.com/category/fast-food"" rel=""noopener"" target=""_blank"">the experience</a> so special — [it's] the interaction and the customer service that we're able to give, the smile, the greeting, just that warmth and feeling, that culture.""</p><p>The CEO added, ""And so, the mobile ordering will definitely take a piece of that away and there's also the freshness factor.""</p><p><a href=""https://www.foxnews.com/category/lifestyle/quizzes"" rel=""noopener"" target=""_blank""><strong><u>TEST YOURSELF WITH OUR LATEST LIFESTYLE QUIZ</u></strong></a></p><p>Snyder-Ellingson, 43, also said she doesn't see In-N-Out ""being on the East Coast in my lifetime.</p><p>""We won't compromise on quality just to expand,"" she said.</p><p>In-N-Out's branding is ""intentional and central to its strategy,"" said Amore Philip, a public relations strategist based in New York.</p><p><a href=""https://www.foxnews.com/newsletters?cmpid=fnfirstnl"" rel=""noopener"" target=""_blank""><strong><u>CLICK HERE TO SIGN UP FOR OUR LIFESTYLE NEWSLETTER</u></strong></a></p><p>Philip told Fox News Digital that In-N-Out's in-person experience, atmosphere and fresh food are all qualities that delivery services might compromise. (She is not affiliated with the brand.)</p><p>""Brands with strong followings do not need to be available everywhere. they create destinations,"" she said. ""In-N-Out has fostered loyalty through scarcity and consistency, achieving more than most brands that rely on widespread convenience.""</p><p>Philip added, ""This approach is not nostalgia, but deliberate positioning.""</p><p><a href=""https://www.foxnews.com/lifestyle"" rel=""noopener"" target=""_blank""><strong><u>CLICK HERE FOR MORE LIFESTYLE STORIES</u></strong></a></p><p>There's something ""psychologically powerful"" about the In-N-Out ordering experience, said Jonathan Alpert, a psychotherapist based in New York City.</p><p>Alpert told Fox News Digital the chain's consistency ""builds loyalty over time.""</p><p>""There's also something to the fact that not everything should be instantly available,"" he noted. ""When people have to seek something out, it can feel more special and more tied to habit, ritual and even identity.""</p><p>Alpert said it's about more than just people <a href=""https://www.foxnews.com/category/food-drink/recipes/meals/lunch"" rel=""noopener"" target=""_blank"">ordering lunch</a>.</p><p>""For a lot of customers, going to In-N-Out is part of the experience people have come to associate with the brand,"" he said.</p><p>Fox News Digital reached out to In-N-Out for comment.</p>",https://www.foxnews.com/food-drink/in-n-out-ceo-says-no-delivery-east-coast-expansion-we-wont-compromise,2026-04-09
