,title,text,link,publish_date
20,"Archaeologists unearth 1,600-year-old Christian monastic site with paintings, mysterious inscription","<p>Egyptian archaeologists recently unearthed the remnants of a <a href=""https://www.foxnews.com/category/science/archaeology"" rel=""noopener"" target=""_blank"">Christian monastic site</a> from the 5th century — some 400 years after the time of Jesus Christ.</p><p>The <a href=""https://www.foxnews.com/category/science/archaeology/ancient-egypt"" rel=""noopener"" target=""_blank"">Egyptian Ministry of Tourism</a> and Antiquities wrote in a translated statement on March 23 that a building was recently found in the Qallaya area in Egypt's Beheira Governorate.</p><p>The structure, likely a guesthouse used to host visitors, is a remnant of the ""early beginnings of Coptic monasticism,"" the release said. </p><p><a href=""https://www.foxnews.com/travel/archaeologists-uncover-gold-laden-tomb-filled-elite-burial-treasures-from-1000-years-ago"" rel=""noopener"" target=""_blank""><strong>ARCHAEOLOGISTS UNCOVER GOLD-LADEN TOMB FILLED WITH ELITE BURIAL TREASURES FROM OVER 1,000 YEARS AGO</strong></a></p><p>Previous buildings have also been found at the site, and the newly discovered structure had 13 multipurpose rooms used for ""hospitality and teaching … in addition to service facilities <a href=""https://www.foxnews.com/food-drink"" rel=""noopener"" target=""_blank"">such as a kitchen</a> and storage areas,"" officials said.</p><p>The area is considered one of Egypt's significant early monastic centers. </p><p>Coptic monasticism was one of the oldest forms of organized <a href=""https://www.foxnews.com/faith-values"" rel=""noopener"" target=""_blank"">Christian monasticism</a>, laying the groundwork for traditions that endure to this day.</p><p><a href=""https://www.foxnews.com/travel/dog-walkers-trigger-archaeological-race-preserve-2000-year-old-footprints-shifting-sands"" rel=""noopener"" target=""_blank""><strong><u>DOG WALKERS TRIGGER ARCHAEOLOGICAL RACE TO PRESERVE 2,000-YEAR-OLD FOOTPRINTS IN SHIFTING SANDS</u></strong></a></p><p>Pictures from the site show ancient structures in remarkable condition, with walls and other architectural features still intact.</p><p>The tourism ministry also shared photographs of art recently found <a href=""https://www.foxnews.com/category/travel/general/historic-sites"" rel=""noopener"" target=""_blank"">at the site</a>, including paintings, as well as an inscription in early Greek.</p><p><a href=""https://www.foxnews.com/category/lifestyle/quizzes"" rel=""noopener"" target=""_blank""><strong><u>TEST YOURSELF WITH OUR LATEST LIFESTYLE QUIZ</u></strong></a></p><p>Officials believe the Greek inscription may read ""Abba Kir, son of Shenouda"" — suggesting it was a tombstone.</p><p>""Excavations also revealed several architectural elements added to the building during later historical phases, reflecting the evolution of its use over successive periods,"" the statement said.</p><p>In addition to the paintings, officials also noted that a ""complete marble column"" was found, along with ""a large number of pottery shards.""</p><p><a href=""https://www.foxnews.com/newsletters?cmpid=fnfirstnl"" rel=""noopener"" target=""_blank""><strong><u>CLICK HERE TO SIGN UP FOR OUR LIFESTYLE NEWSLETTER</u></strong></a></p><p>""Some of these bear plant and geometric decorations, while others include Coptic letters. … Some are undecorated,"" the statement said.</p><p>Hisham El-Leithy, Ph.D., secretary-general of the Supreme Council of Antiquities, said the decorations and wall paintings are ""among the most significant sources for studying early Coptic art in Egypt,"" per the translated release.</p><p>The discovery also highlights ""the development of ascetic, simple monastic architecture, showing a functional progression from individual cells to semi-communal housing,"" the statement added.</p><p><a href=""https://www.foxnews.com/lifestyle"" rel=""noopener"" target=""_blank""><strong><u>CLICK HERE FOR MORE LIFESTYLE STORIES</u></strong></a></p><p>Archaeologists also found <a href=""https://www.foxnews.com/category/science/wild-nature"" rel=""noopener"" target=""_blank"">bird and animal bones</a>, as well as ""several oyster shells,"" inside one of the rooms — all pointing to everyday dietary practices.</p><p>Excavations in Egypt continue to yield many fascinating remnants of ancient Christianity — and the Qallaya discovery is one of many recent finds.</p><p>In January, archaeologists unearthed another <a href=""https://www.foxnews.com/travel/ancient-christian-monastery-complex-reveals-lives-byzantine-monks-arab-conquest"" rel=""noopener"" target=""_blank""><u>ancient Christian monastic complex</u></a> in the village of Al-Duwair, located in the Sohag Governorate.</p><p>At Kharga Oasis, excavators found two 1,500-year-old churches and an <a href=""https://www.foxnews.com/travel/archaeologists-find-1600-year-old-churches-mural-jesus-egyptian-desert-settlement"" rel=""noopener"" target=""_blank"">ancient mural of Jesus</a>.</p>",https://www.foxnews.com/travel/archaeologists-unearth-1600-year-old-christian-monastic-site-paintings-mysterious-inscription,2026-03-28
21,DR. MARC SIEGEL: What I admire most about Shannon Bream’s powerful stories of faith and healing,"<p>In her new bestselling book, ""<a href=""https://www.amazon.com/Nothing-Impossible-God-Heroes-Overcoming/dp/0063487659"" rel=""nofollow noopener"" target=""_blank"">Nothing Is Impossible with God,</a>"" Fox News anchor, attorney and author Shannon Bream tells the story of 11 heroes of the Bible, including two of everyone’s favorites: Joseph and Moses.</p><p>But she begins the book with a story of her own, overcoming, at the age of 39, <a href=""https://www.foxnews.com/category/health"" rel=""noopener"" target=""_blank"">severe, persistent eye pain</a> that was causing her to become quite depressed. With her hope petering out, message boards led her to seek out one last cornea specialist, Dr. Thomas Clinch of Eye Doctors of Washington.</p><p>The fact that she only got in to see him right away because he had a cancellation was another sign from God. Indeed, Clinch was himself one of God’s messengers, as he diagnosed her with a condition other doctors had missed: map-dot-fingerprint dystrophy, also known as Cogan’s dystrophy. </p><p>This condition involves tiny erosive scratches on the surface of the cornea. The outer cornea sticks to the lower layers and begins to rub off, especially during deep sleep. Clinch’s treatment was Muro 128 ointment to use at night, eye drops, and tear duct plugs to help her eyes retain moisture.</p><p><a href=""https://www.foxnews.com/opinion/dr-marc-siegel-medical-miracle-modern-science-both-can-signs-god-work"" rel=""noopener"" target=""_blank""><strong>DR MARC SIEGEL: MEDICAL MIRACLE OR MODERN SCIENCE? BOTH CAN BE SIGNS OF GOD AT WORK</strong></a></p><p>Shannon Bream is one of the kindest, most sincere, humble yet intelligent anchors, authors and lawyers you could ever meet. Her gratitude to God for her reclaimed life following her successful treatment is palpable. It also leads directly to the stories of this important book, where her strong faith motivates her to seek and explore the biblical heroes who inspire her the most.</p><p>She has an important take on Moses, a story that began ""with a bold, brave mother who defied the law of the day requiring all Hebrew male babies to be thrown into the Nile River — a certain death.""</p><p>Of course, <a href=""https://www.foxnews.com/category/faith-values"" rel=""noopener"" target=""_blank"">Moses’s mother</a> and the midwives didn’t comply. He was hidden and then placed in a basket, which Pharaoh’s daughter famously found, and he went on to become her adopted son. But as Bream points out, he never lost the link to his own people, killing an Egyptian for beating a Hebrew.</p><p>When Pharaoh learned of this, he tried to kill Moses, who became a fugitive. Shannon’s analysis of Moses’s life is filled with insight: ""Moses was faithful, working for his father-in-law as a shepherd. We see no grumbling about how great life used to be at the palace, no daydreaming about going back to the life of a prince — just the methodical work of a dutiful man. God can and will show up whenever you are laboring, whether or not you think anyone else is aware of your diligence.""</p><p><a href=""https://www.foxnews.com/media/minnie-driver-says-playing-sarah-foxs-bible-epic-took-leap-faith"" rel=""noopener"" target=""_blank""><strong>MINNIE DRIVER SAYS PLAYING SARAH IN FOX’S BIBLE EPIC TOOK 'BIG LEAPS OF FAITH'</strong></a></p><p>Here, Bream is referring to the burning bush, and as she does throughout the book, she quotes from the Bible: ""God called to him from within the bush, ‘Moses! Moses!’ And Moses said, ‘Here I am.’"" (Exodus 3:1-4)</p><p>""I am nearly 100 percent certain I would not have had such a calm reaction,"" Bream writes, combining her personal irony with a reverence for scripture, as she does throughout the book. She does it again with the Exodus itself, writing: ""But the Lord had a plan that wouldn’t look like any other rebellion in history. It would start with what any strategist would tell you is a terrible mistake — letting your enemy know you’re coming.""</p><p>Indeed, as <a href=""https://www.foxnews.com/category/christianity"" rel=""noopener"" target=""_blank"">God told Moses</a>: ""So now, go. I am sending you to Pharaoh to bring my people the Israelites out of Egypt."" (Exodus 3:10)</p><p><a href=""https://www.foxnews.com/opinion"" rel=""noopener"" target=""_blank""><strong>CLICK HERE FOR MORE FOX NEWS OPINION</strong></a></p><p>When it comes to her chapter on Joseph in Genesis, Bream again personalizes a section of the Bible. When his brothers (who kidnapped him and sold him into slavery) came to visit Egypt to get grain in the legendary famine, they didn’t recognize him.</p><p>Bream describes Joseph’s weeping because he understood what his brothers were saying in Hebrew, of course, despite his show of using an interpreter and speaking Egyptian as his primary language to preserve his disguise. And despite Joseph’s mistrust and hurt, he still treated them with hesed (loving kindness). But their own guilty consciences made Joseph’s kindness seem sinister to them.</p><p>And quoting Genesis 42:28 — ""Their hearts sank, and they turned to each other, trembling, and said, ‘What is this that God has done to us?’""</p><p>Above all, Shannon Bream preserves the sense of the Bible as the great narrative it is, filled with inspirational heroes, leaders and prophets.</p><p>Her own life of overcoming makes her the perfect person to write this <a href=""https://www.foxnews.com/category/entertainment/genres/books"" rel=""noopener"" target=""_blank"">compelling book</a>.</p><p><a href=""https://www.foxnews.com/person/s/marc-siegel"" rel=""noopener"" target=""_blank""><strong>CLICK HERE TO READ MORE FROM DR. MARC SIEGEL</strong></a></p>",https://www.foxnews.com/opinion/dr-marc-siegel-what-admire-most-about-shannon-breams-powerful-stories-faith-healing,2026-03-28
22,‘Goodbye California’ anthem sparks firestorm as country star hits back at critics: ‘Right is right’,"<p><a href=""https://www.foxnews.com/category/entertainment/genres/country"" rel=""noopener"" target=""_blank"">Country star Annie Bosko</a> is speaking out about the criticism that she has faced after releasing her new song ""Goodbye California"" earlier this year.</p><p>During an interview with Fox News Digital, the 40-year-old singer explained that the bittersweet country ballad has resonated with the majority of listeners but struck a nerve with others, who have tried to frame the song as political, which she insists was not her intention.  </p><p>""I have gotten some backlash on the song, and I'm OK with it,"" Bosko shared ahead of her March 5 concert at the famed West Hollywood music venue the Troubadour. </p><p>""I think anytime you put yourself out there to make a statement and to say something, people will take any shot at turning something political,"" she continued.</p><p><a href=""https://www.foxnews.com/entertainment/riley-green-chooses-alabama-farm-over-nashville-fame-despite-having-every-reason-make-move"" rel=""noopener"" target=""_blank""><strong>RILEY GREEN CHOOSES ALABAMA FARM OVER NASHVILLE FAME DESPITE HAVING 'EVERY REASON' TO MAKE THE MOVE</strong></a></p><p>""I don't believe in <a href=""https://www.foxnews.com/category/politics"" rel=""noopener"" target=""_blank"">getting involved in politics</a> — I care about the state that I grew up in,"" Bosko added. ""I <a href=""https://www.foxnews.com/category/us/us-regions/west/california"" rel=""noopener"" target=""_blank"">love California</a>. So that's where I stand on things. And there comes a point where right is right and wrong is wrong, and it feels like there's too much wrong going on."" </p><p>""So, you know what, if 1% of people are upset with me, then so be it, right?"" Bosko added. ""You can't please them all.""</p><p>""So therefore you’re forced to leave,"" she continued. ""Not because you want to leave, but because you feel like you don’t have any other option. And I feel like a lot of people, and myself included, have felt that way in both love relationships and geographically in locations. I think most people would say ‘Why would you want to leave here?’ Like look at the weather, look at everything. I mean it’s beautiful, right? You got everything: the desert, mountains, ocean, farm, ranch, everything.' I just think sometimes people, for financial reasons or other reasons, feel like they’ve been forced to leave.""</p><p>The ""Levitating"" singer explained that many people she knows in the entertainment industry have also moved on to other states due to a sharp decline in projects filming in Los Angeles. </p><p>""This was the epicenter of all entertainment,"" Bosko said. ""And I feel like so many people have left because the jobs aren’t here. And so I feel like — I wouldn’t say there’s a specific moment in time — I just feel like, gradually over the years, every time I’ve come back, it feels like little things have kind of been chipped away.""</p><p>""It just feels like so much of that dynamic and community has changed,"" she continued. ""So many of my actor friends are leaving. And that’s what makes LA and Hollywood so special are the artists. Without the artists, this town is not the same. You need artists. And so I feel like it’s kind of been a combination honestly of all those things.""</p><p><strong>WATCH: COUNTRY STAR ANNIE BOSKO DEFENDS ‘GOODBYE CALIFORNIA’ AFTER CRITICS SPEAK OUT</strong></p><p>Bosko told Fox News Digital that she has spent a lot of time in Nashville, Tennessee in recent years and believes that it would make the most sense for her to relocate to Music City. </p><p>""So much of the music industry is there,"" she said. ""And so many of my collaborators and business partners are there. So that would kind of be the obvious answer."" </p><p>""But I feel like <a href=""https://www.foxnews.com/category/us/us-regions/west/california"" rel=""noopener"" target=""_blank"">California’s my heart and soul</a>,"" she continued. ""I’d like to end up here just because I love it and this is my home.""</p><p>Bosko shared that she remains optimistic California could one day return to the state she remembers from earlier years.</p><p>""I’m hopeful that there’s a bright future,"" she said. ""The world always changes, but I almost feel as though people have to get so fed up that everyone wants a change. And I do feel as though so many people across the board — doesn’t matter where you are on the political spectrum — I think so many people across the board are fed up with just the way things have been and that there’s a better way to lead this state.""</p><p>The singer explained that California holds a special meaning for her because her grandparents were able to build successful lives in the state after emigrating from Croatia. </p><p><strong>WATCH: COUNTRY STAR ANNIE BOSKO SAYS ‘99%’ OF PEOPLE RESONATE WITH HER SONG ‘GOODBYE CALIFORNIA’ DESPITE BACKLASH</strong></p><p>""I guess that's why I feel so passionately about California, in particular, because <a href=""https://www.foxnews.com/category/topic/family-traditions"" rel=""noopener"" target=""_blank"">my family</a> did come here and live the American Dream,"" she said. ""They were able to come here, start a farm, build a business, buy homes. And I think about this next generation and I don’t know that they’re in the same position."" </p><p>""It’s like to buy a home here, right? It’s just everything is difficult,"" Bosko continued. ""I think families are paying <a href=""https://www.foxnews.com/media/newsom-confronted-california-being-highest-cost-living-state-us-amid-affordability-crisis"" rel=""noopener"" target=""_blank"">astronomical money in taxes</a> to not feel safe walking their own kids outside in a stroller on the road. And at some point, it's just not fair anymore.""</p><p>""This next generation will be impacted the most,"" she added. ""I think I read a statistic that more kids now than ever in their 30s are living with their parents just because they can't afford to start a new life here. And so I really hope that that changes. And I'm hopeful it could change, but like I said, people have got to be so upset and be aggravated by it to make that change.""</p><p>Bosko recalled that her grandmother sold her only car so her husband could buy a Ford tractor and start a small farm, which later grew into her family's successful Boskovich Farms.</p><p><a href=""https://www.foxnews.com/newsletters?cmpid=fnfirstnl"" rel=""noopener"" target=""_blank""><strong>CLICK HERE TO SIGN UP FOR THE ENTERTAINMENT NEWSLETTER</strong></a></p><p>""Kudos to my grandmother, that’s what you call blind faith,"" she said. ""I don’t know that I would have been that hopeful in any guy.""</p><p>""But she had faith in him, and she knew that he worked really hard, and he was relentless, and he started a farm on four acres of land himself,"" Bosko said. ""And then his sons ended up helping him grow the company. It was a smart move.""</p><p><a href=""https://www.foxnews.com/entertainment"" rel=""noopener"" target=""_blank""><strong>LIKE WHAT YOU’RE READING? CLICK HERE FOR MORE ENTERTAINMENT NEWS</strong></a></p><p><strong>COUNTRY STAR ANNIE BOSKO SAYS PEOPLE ARE ‘FED UP’ WITH CURRENT STATE OF CALIFORNIA</strong></p><p>Bosko shared that she was concerned since she had seen many farmers — particularly small farmers — were facing major challenges due to <a href=""https://www.foxnews.com/category/us/environment/water"" rel=""noopener"" target=""_blank"">water shortages</a>.</p><p>""This doesn't so much impact the large farming companies,"" she said. ""But multi-generational farmers are struggling big time right now. And California grows, I think, nearly 75% of the nation's produce, so that's huge. It's really important. I think we need to protect farmers, protect farmland, make sure they're getting adequate water supply and that we do everything we can to help.""</p><p>""Goodbye California"" is available to stream <a href=""https://urldefense.proofpoint.com/v2/url?u=https-3A__t.e2ma.net_click_jyfkcq_z2d2lupd_fjh4fjc&amp;d=DwMGaQ&amp;c=euGZstcaTDllvimEN8b7jXrwqOf-v5A_CdpgnVfiiMM&amp;r=zBJ0Dv7EqzNE2U_kQYFPF55IFzqsr9X5ro-q0hESGa8&amp;m=P5be_RfplbIuamO3oxJ5_jOE23Ua2WT4UrMKUBeB4Jk5nj1S7Hw5-v-62Uxd2_gw&amp;s=wKXCJ3IGELyD9AEpYGY1Dv5N_-Y8SAGINByg6S0qnQY&amp;e="" rel=""nofollow noopener"" target=""_blank""><u>HERE</u></a> and the official visualizer can be watched <a href=""https://urldefense.proofpoint.com/v2/url?u=https-3A__t.e2ma.net_click_jyfkcq_z2d2lupd_vbi4fjc&amp;d=DwMGaQ&amp;c=euGZstcaTDllvimEN8b7jXrwqOf-v5A_CdpgnVfiiMM&amp;r=zBJ0Dv7EqzNE2U_kQYFPF55IFzqsr9X5ro-q0hESGa8&amp;m=P5be_RfplbIuamO3oxJ5_jOE23Ua2WT4UrMKUBeB4Jk5nj1S7Hw5-v-62Uxd2_gw&amp;s=9tQDc4qUl2lSXn1KO8g-xa1O6fUKYZ6lSmHtHKvzXVU&amp;e="" rel=""nofollow noopener"" target=""_blank""><u>HERE</u></a>. </p>",https://www.foxnews.com/entertainment/goodbye-california-anthem-sparks-firestorm-country-star-hits-back-critics-right-right,2026-03-28
23,"Move over, New York and Chicago — one Midwest pizza style is taking over","<p><a href=""https://www.foxnews.com/food-drink/americas-most-overpriced-pizza-chain-revealed-its-not-one-you-think"" rel=""noopener"" target=""_blank"">Pizza lovers</a> often flock to New York and Chicago — but one Midwest city is carving out its own place on the map as it gains national attention for its unique pizza style.</p><p>Ohio's state capital, Columbus, is home to a <a href=""https://www.foxnews.com/food-drink/pizza-before-tomatoes-ancient-romes-version-americas-favorite-food-looked-nothing-like-todays"" rel=""noopener"" target=""_blank"">distinct type of pizza</a> known as Columbus-style pizza.</p><p>The regional specialty features a thin crust, a slightly sweet tomato sauce and loads of cheese — provolone-and-mozzarella or just provolone.</p><p><a href=""https://www.foxnews.com/food-drink/family-exposes-insanely-expensive-airport-food-pizza-igniting-online-backlash"" rel=""noopener"" target=""_blank""><strong>FAMILY OF 6 EXPOSES 'INSANELY EXPENSIVE' AIRPORT FOOD WITH PIZZA ORDER, IGNITING ONLINE BACKLASH</strong></a></p><p>The pizza is also packed with edge-to-edge toppings, <a href=""https://www.foxnews.com/food-drink/americas-5-best-fast-food-pepperoni-pizzas-ranked-national-pizza-day"" rel=""noopener"" target=""_blank"">often pepperoni</a> — and is baked into a round pie with little to no exposed crust.</p><p>Columbus-style pizza is cut tavern style, into squares and rectangles rather than slices, making it easy to share and popular in group settings.</p><p>It's somewhat similar to St. Louis-style pizza, though Gateway City pizza has a cracker-like crust and signature Provel cheese that sets it apart.</p><p>The Columbus favorite dates back to the mid-20th century, as the style began to take shape in local restaurants, according to <a href=""https://cbustoday.6amcity.com/food/learn-about-the-origins-of-columbus-style-pizza-and-where-to-grab-a-slice"" rel=""nofollow noopener"" target=""_blank"">CBUS Today.</a></p><p><a href=""https://www.foxnews.com/category/lifestyle/quizzes"" rel=""noopener"" target=""_blank""><strong><u>TEST YOURSELF WITH OUR LATEST LIFESTYLE QUIZ</u></strong></a></p><p>The local outlet credited brothers Dan and Jimmy Massucci, who opened Romeo's Italian Restaurant and Massey's Pizza in 1949, with helping to shape the style and popularize it across Columbus.</p><p>A distinct characteristic of Columbus-style pizza is that it doesn't have a ""dough ring,"" said Kevin King, the CEO and president of Donatos Pizza in Columbus.</p><p>""We make sure the sauce, cheese and toppings cover the entire surface of the pizza,"" he told Fox News Digital. </p><p>""We are even known for putting 100 pieces of pepperoni on our large pizzas.""</p><p><a href=""https://www.foxnews.com/newsletters?cmpid=fnfirstnl"" rel=""noopener"" target=""_blank""><strong><u>CLICK HERE TO SIGN UP FOR OUR LIFESTYLE NEWSLETTER</u></strong></a></p><p>Donatos was founded in 1963 and has helped ""grow and popularize Columbus-style pizza,"" the CEO noted. It's become one of the city's most recognizable pizza brands.</p><p>The brand uses smoked Wisconsin-made provolone to give it a ""sharper flavor profile"" that distinguishes it from other regional styles.</p><p>The pizza's unique characteristics are helping Columbus to gain national recognition as ""one of the best pizza destinations,"" King said, as the city continues to build its reputation among <a href=""https://www.foxnews.com/food-drink"" rel=""noopener"" target=""_blank"">food lovers.</a></p><p>King cited a recent study that found Columbus was the fourth most pizza-obsessed city in the world, ahead of Chicago and Rome. Publications such as USA Today and Eater have said Columbus is one of the best pizza cities in the country.</p><p>""<a href=""https://www.foxnews.com/category/food-drink/food/restaurants"" rel=""noopener"" target=""_blank"">Donatos Pizza</a> hopes to spread the word across the country by providing consistently high-quality pizza in all our locations across 28 states,"" he said.</p><p>The executive also credited the pizza's enduring popularity to tradition and <a href=""https://www.foxnews.com/category/food-drink/food/food-prep"" rel=""noopener"" target=""_blank"">consistency in preparation.</a></p><p><a href=""https://www.foxnews.com/lifestyle"" rel=""noopener"" target=""_blank""><strong><u>CLICK HERE FOR MORE LIFESTYLE STORIES</u></strong></a></p><p>""Our founder, Jim Grote, is an innovator at heart,"" he noted. ""He set out to create pizza equipment that would always provide customers with a consistent pizza experience.""</p><p>For example, Donatos has created machines that provide ""the right amount of sauce and the optimal sliced pepperoni,"" to help the pizzas stay consistent, he said.</p><p>If pepperoni doesn't interest some customers, King said Columbus-style goes beyond traditional toppings with more experimental options.</p><p>""You can find a plethora of different combinations of toppings — and even sauces — on Columbus-style pizza,"" he said.</p><p>""Donatos recently released a line of white sauce pizzas with the creamy parm sauce as the base … [and the] <a href=""https://www.foxnews.com/category/food-drink/food/food-trends"" rel=""noopener"" target=""_blank"">hot honey trend</a> on pizza has been proliferated with Columbus-style pizzas as well.""</p>",https://www.foxnews.com/food-drink/move-over-new-york-chicago-one-midwest-pizza-style-taking-over,2026-03-28
