,title,text,link,publish_date
6,FBI's Patel delivers blunt warning to law enforcement attackers: 'We're going to put you down',"<p>FBI Director <a href=""https://www.foxnews.com/category/person/kash-patel"" rel=""noopener"" target=""_blank"">Kash Patel</a> issued a direct warning to anyone who attacks law enforcement, vowing Saturday that those who ""touch a cop"" will be tracked down and arrested amid growing concerns over violence against officers.</p><p>The comments came while Patel was speaking on SiriusXM Patriot's ""Breitbart News Saturday,"" discussing <a href=""https://www.foxnews.com/category/us/crime/police-and-law-enforcement"" rel=""noopener"" target=""_blank"">violence against federal officers</a>.</p><p>""You have to back the blue,"" Patel said. ""I say the following to as many officers and Americans that I get in front of: If you touch a cop, we're going to put you down. And that's what we're doing.""</p><p>He said the FBI is ""going to back our partners,"" noting that any criminal who assaults or impedes law enforcement is ""going to face the <a href=""https://www.foxnews.com/us/fbi-director-kash-patel-vows-justice-after-dhs-agents-vehicle-rammed-chicago"" rel=""noopener"" target=""_blank"">full force of law enforcement</a>.""</p><p><a href=""https://www.foxnews.com/us/chicago-police-chief-puts-criminals-notice-after-federal-agents-targeted-weekend-confrontations"" rel=""noopener"" target=""_blank""><strong>CHICAGO'S POLICE CHIEF PUTS CRIMINALS ON NOTICE AFTER FEDERAL AGENTS TARGETED IN WEEKEND CONFRONTATIONS</strong></a></p><p>""We're not saying that you can't go out there and peacefully protest,"" Patel said. ""We are simply saying, ... you cannot interfere with [an officer in their] lawful execution of [their] lawful duty.</p><p>Since the start of the Trump administration's immigration enforcement crackdown, the <a href=""https://www.foxnews.com/category/politics/executive/homeland-security"" rel=""noopener"" target=""_blank"">Department of Homeland Security</a> has reported violence against federal agents spiked to a record high.</p><p><a href=""https://www.foxnews.com/politics/dhs-shutdown-putting-americans-risk-world-cup-security-significantly-behind-fetterman"" rel=""noopener"" target=""_blank""><strong><u>DHS SHUTDOWN PUTTING AMERICANS AT RISK AS WORLD CUP SECURITY PREP ‘SIGNIFICANTLY BEHIND’: SEN FETTERMAN</u></strong></a></p><p>The director added police around the country are ""so empowered by the fact that we are backing the blue, that they know they have that backing.""</p><p>""They also know that if they are physically harmed, they're just not going to have some perp get away with it,"" he said. ""We're going to go find them and we're going to arrest them.""</p><p>Patel's stance on the issue has remained consistent throughout his time serving in the administration; In June, he posted a similar statement on social media.</p><p>""Hit a cop, you’re going to jail… doesn’t matter where you came from, how you got here, or what movement speaks to you,"" Patel wrote in a June 7 X post. ""If the local police force won’t back our men and women on the thin blue line, we @FBI will.""</p><p>The FBI did not immediately respond to Fox News Digital's request for comment.</p>",https://www.foxnews.com/politics/fbi-patel-delivers-blunt-warning-law-enforcement-attackers,2026-04-04
7,Dan Hurley’s wife calls out St John’s fans for rooting against UConn in March Madness,"<p>The <a href=""https://www.foxnews.com/category/sports/ncaa/connecticut-huskies"" rel=""noopener"" target=""_blank"">UConn Huskies men’s basketball team</a> is one win away from reaching their third national championship in the last four years.</p><p>The Huskies got to the Final Four after a stunning Elite Eight win over the Duke Blue Devils when Braylon Mullins nailed a long 3-pointer to give them the lead right before the final buzzer. Duke reached the game with a victory over the St. John’s Red Storm.</p><p><a href=""https://www.foxnews.com/sports"" rel=""noopener"" target=""_blank""><strong>CLICK HERE FOR MORE SPORTS COVERAGE ON FOXNEWS.COM</strong></a></p><p>Dan Hurley’s wife, Andrea, weighed in on <a href=""https://www.foxnews.com/category/sports/ncaa/st-johns-red-storm"" rel=""noopener"" target=""_blank"">St. John’s fans</a> seemingly rooting against the Huskies as they took on the Michigan State Spartans in the other Sweet 16 matchup on that side of the bracket. It appeared the rivalry between the two schools is alive and well.</p><p>""OK, I’m gonna say it. St. John’s fans … When we went to the game, all those St. John’s fans were rooting against us,"" Andrea Hurley said on <a href=""https://www.youtube.com/watch?v=QyadtxNtTrs"" rel=""noopener nofollow"" target=""_blank"">""The Field of 68: After Dark.""</a> ""And that just broke my heart. … It’s really sad. … That’s crappy … That was crappy.""</p><p><a href=""https://www.foxnews.com/sports/2026-ncaa-mens-tournament-last-time-final-four-teams-made-national-championship"" rel=""noopener"" target=""_blank""><strong>2026 NCAA MEN'S TOURNAMENT: LAST TIME FINAL FOUR TEAMS MADE NATIONAL CHAMPIONSHIP</strong></a></p><p>Hurley said she was talking to Rick Pitino’s wife during the Big East Championship and asked her how she did it, seemingly forming a bond with the family over the rival school.She added that she may not have wanted to see the Red Storm in the tournament, but didn’t necessarily want to face the Blue Devils either.</p><p>Dan Hurley had praise for his wife earlier in the week after he said she was able to keep players from storming the court after Mullins’ shot went in against Duke. UConn may have received a technical foul for going on the court too early, which may have presented a different conversation from the media going into Final Four.</p><p>UConn will <a href=""https://www.foxnews.com/sports/illinois-knocks-off-iowa-reach-final-four-after-buzzer-malfunction-delay"" rel=""noopener"" target=""_blank"">take on Illinois</a> in their Final Four matchup. The winner will either play Arizona or Michigan.</p><p><strong><em>Follow Fox News Digital’s</em></strong><a href=""https://twitter.com/FoxNewsSports_"" rel=""noopener noreferrer nofollow"" target=""_blank""><strong><em> </em></strong></a><a href=""https://twitter.com/FoxNewsSports_"" rel=""noopener"" target=""_blank""><strong><em><u>sports coverage on X</u></em></strong></a><strong><em> and subscribe to</em></strong><a href=""https://www.foxnews.com/newsletters"" rel=""noopener"" target=""_blank""><strong><em><u> the Fox News Sports Huddle newsletter</u></em></strong></a><strong><em>.</em></strong></p>",https://www.foxnews.com/sports/dan-hurleys-wife-calls-st-johns-fans-rooting-uconn-march-madness,2026-04-04
8,Ex-NATO ambassador warns US and allies must 'stop the sniping' and unite to end Iran conflict,"<p>Former <a href=""https://www.foxnews.com/category/world/nato"" rel=""noopener"" target=""_blank"">U.S. Amb. to NATO</a> Kurt Volker warned the United States and its allies must ""stop the sniping"" and come together to end the conflict with Iran during a Saturday interview on Fox News.</p><p>Volker appeared on ""Fox News Live"" to discuss the Trump administration’s comments about reevaluating its relationship with NATO.</p><p>""I think this is completely wrong,"" Volker told <a href=""https://www.foxnews.com/media"" rel=""noopener"" target=""_blank"">Fox News</a> anchor Aishah Hasnie of the friction with NATO.</p><p>""We did not inform allies. We did not consult with allies. We did not set up a clear goal, a common operation. We didn't ask them. So, this went off the rails from the very beginning.""</p><p><a href=""https://www.foxnews.com/world/more-key-us-allies-block-military-flights-iran-war-rift-widens-trump"" rel=""noopener"" target=""_blank""><strong>MORE KEY US ALLIES BLOCK MILITARY FLIGHTS AS IRAN WAR RIFT WIDENS WITH TRUMP</strong></a></p><p>Operation Epic Fury has strained some relationships between the United States and its allies. <a href=""https://www.foxnews.com/politics/key-us-ally-blocks-airspace-military-flights-over-iran-escalating-standoff-trump"" rel=""noopener"" target=""_blank"">Spain and other allies</a> have denied the use of jointly operated bases for these operations. The <a href=""https://www.foxnews.com/world/us-cleared-use-british-bases-limited-strikes-iranian-missile-capabilities"" rel=""noopener"" target=""_blank"">United Kingdom</a> also granted limited use of its bases for strict defensive purposes.</p><p>Volker argued that both sides need to pause before making any major decisions.</p><p>""We both need to take a breath, realize that NATO has a very important purpose, which is peace in Europe,"" Volker said.</p><p><a href=""https://www.foxnews.com/media/nato-chief-praises-trumps-iran-strikes-says-key-allies-all-one-one-all"" rel=""noopener"" target=""_blank""><strong>NATO CHIEF PRAISES TRUMP’S IRAN STRIKES, SAYS KEY ALLIES ‘ALL FOR ONE, ONE FOR ALL’</strong></a></p><p>""We need to stop the rhetoric, talk to each other and come up with a way forward on actually <a href=""https://www.foxnews.com/category/politics/defense/wars/war-with-iran"" rel=""noopener"" target=""_blank"">opening up the Persian Gulf</a> and ending the war with Iran and restoring security in Europe,"" he added.</p><p>President Donald Trump has signaled the White House might be rethinking its relationship with some European allies in the wake of the conflict.</p><p>He <a href=""https://www.foxnews.com/politics/trump-nato-withdrawal-iran-war-allies"" rel=""noopener"" target=""_blank"">spoke to The Telegraph</a> in an article published Wednesday, saying, ""Oh yes, I would say [it’s] beyond reconsideration. I was never swayed by NATO. I always knew they were a paper tiger, and Putin knows that too, by the way.""</p><p><a href=""https://www.foxnews.com/media/marco-rubio-says-us-can-see-finish-line-iran-he-warns-next-north-korea"" rel=""noopener"" target=""_blank""><strong>MARCO RUBIO WARNS IRAN WANTED TO BE THE 'NEXT NORTH KOREA' AS HE SEES 'FINISH LINE' IN CONFLICT</strong></a></p><p>Trump is expected to meet with NATO Secretary General Mark Rutte next week for a planned visit. Volker said he believes he and Trump will have a better discussion about U.S. goals in Iran.</p><p>""I think with Rutte behind closed doors with President Trump, we have to talk about what's the way forward,"" Volker said. ""What is the goal here now with Iran? Is it regime change or is it negotiating with the regime?""</p><p>""We’ve got to put together a viable plan, and work together on that and stop the sniping,"" he added.</p>",https://www.foxnews.com/media/ex-nato-ambassador-warns-us-allies-must-stop-sniping-unite-end-iran-conflict,2026-04-04
9,"Sabres end longest playoff drought in NHL history, clinching berth for first time since 2011","<p>The <a href=""https://www.foxnews.com/category/sports/nhl/buffalo-sabres"" rel=""noopener"" target=""_blank"">Buffalo Sabres</a> have done it.</p><p>They ended the longest playoff drought in NHL history on Saturday.</p><p>With the <a href=""https://www.foxnews.com/category/sports/nhl/new-york-rangers"" rel=""noopener"" target=""_blank"">New York Rangers'</a> 4-1 victory over the Detroit Red Wings on Saturday afternoon at Madison Square Garden, the Sabres clinched a playoff berth for the first time since 2011.</p><p>It has been a long stretch of bad hockey in Buffalo prior to this season. Just once in the last 14 seasons, they have had more than 90 points once in a season.</p><p><a href=""https://www.foxnews.com/sports"" rel=""noopener"" target=""_blank""><strong>CLICK HERE FOR MORE SPORTS COVERAGE ON FOXNEWS.COM</strong></a></p><p>They have been a mainstay at the top of the <a href=""https://www.foxnews.com/category/sports/nhl"" rel=""noopener"" target=""_blank"">NHL</a> Draft, owning the respective No. 1 and No. 2 selections twice while owning a top 10 pick in 11 different drafts.</p><p>In the beginning of December, it looked like this season would be no different than the others, as the team started out with an 11-14-4 record. However, the team rattled off a 10-game winning streak after beating the <a href=""https://www.foxnews.com/category/sports/nhl/edmonton-oilers%20"" rel=""noopener"" target=""_blank"">Edmonton Oilers.</a></p><p><a href=""https://www.foxnews.com/sports/jack-hughes-debuts-new-smile-yankees-home-opener-losing-teeth-olympic-gold-medal-game"" rel=""noopener"" target=""_blank""><strong>JACK HUGHES DEBUTS NEW SMILE AT YANKEES HOME OPENER AFTER LOSING TEETH IN OLYMPIC GOLD MEDAL GAME</strong></a></p><p>After winning the third game of that streak, they fired general manager Kevyn Adams and hired Jarmo Kekäläinen. Since hiring Kekäläinen, the Sabres have been an NHL-best 32-8-4.</p><p>While the team has clinched a playoff berth, the Sabres still have to play for playoff seeding.</p><p>They currently are tied for the first place in the Atlantic Division with the <a href=""https://www.foxnews.com/category/sports/nhl/tampa-bay-lightning"" rel=""noopener"" target=""_blank"">Tampa Bay Lightning</a>, as they each have 100 points, but the Sabres have played one more game. The Montreal Canadiens, currently in third place in the Atlantic Division, are right behind them with 98 points.</p><p>The Sabres will take on the <a href=""https://www.foxnews.com/category/sports/nhl/washington-capitals"" rel=""noopener"" target=""_blank"">Washington Capitals</a> at 7 p.m. ET on Saturday night as they look to shore up their seeding for the playoffs.</p><p><strong><em>Follow Fox News Digital’s</em></strong><a href=""https://twitter.com/FoxNewsSports_"" rel=""noopener noreferrer nofollow"" target=""_blank""><strong><em> sports coverage on X</em></strong></a><strong><em>, and subscribe to</em></strong><a href=""https://www.foxnews.com/newsletters"" rel=""noopener"" target=""_blank""><strong><em> the Fox News Sports Huddle newsletter</em></strong></a><strong><em>.</em></strong></p>",https://www.foxnews.com/sports/sabres-end-longest-playoff-drought-nhl-history-clinching-berth-first-time-since-2011,2026-04-04
10,"Golf legend rips Tiger Woods, PGA Tour after DUI arrest","<p>Nick Faldo, a former PGA Tour star who won the Masters and the Open Championship three times each, ripped <a href=""https://www.foxnews.com/category/person/tiger-woods"" rel=""noopener"" target=""_blank"">Tiger Woods</a> and the organization after the legendary golfer’s DUI arrest.</p><p>Woods faced charges in <a href=""https://www.foxnews.com/category/us/us-regions/southeast/florida"" rel=""noopener"" target=""_blank"">Florida</a> over the wreck and for refusing to submit a urine sample to law enforcement. The Martin County Sheriff’s Office released bodycam footage earlier in the week, showing deputies removing two pills from Woods’ pants pocket and issuing him a field sobriety test.</p><p><a href=""https://www.foxnews.com/sports"" rel=""noopener"" target=""_blank""><strong>CLICK HERE FOR MORE SPORTS COVERAGE ON FOXNEWS.COM</strong></a></p><p>But Faldo didn’t mince words when speaking to the media on Friday about Woods.</p><p>""There’s one side that’s like, ‘let’s care for Tiger’ ... there’s got to be a responsibility and accountability side as well,"" he said, <a href=""https://golf.com/news/masters-legend-blasts-tiger-woods-crash-pga-tour-weak/"" rel=""noopener nofollow"" target=""_blank"">via Golf.com</a>. ""This is a serious thing he’s done, you know. The PGA Tour statement was so predictably weak, how they showed that the Tour will look after him, as they always have done, and then you’ve got Jack (Nicklaus) saying it’s tarnished the entire sport. You’ve got your opposites but there has to be some accountability.""</p><p>Faldo was dismayed that Woods had been in tremendous pain, as he battled through back and Achilles injuries. He argued, however, that his injuries were ""self-inflicted.""</p><p>""I feel sorry for Tiger because he’s living in 24-7 pain. I asked him that years ago, even before the L.A. accident (in 2021), but it’s all been self-inflicted,"" Faldo continued. ""The bottom line is I really think that something should be done a little bit more serious than waving him off to a tropical island and saying ‘Welcome back’ in three or four months.""</p><p><a href=""https://www.foxnews.com/sports/tiger-woods-car-crash-bodycam-footage"" rel=""noopener"" target=""_blank""><strong>TIGER WOODS CAR CRASH BODYCAM FOOTAGE RELEASED: 'ALL OF A SUDDEN, BOOM'</strong></a></p><p>The PGA Tour offered support of Woods after the golfer pleaded not guilty to his charges and vowed to <a href=""https://www.foxnews.com/sports/tiger-woods-stepping-away-from-golf-seek-treatment-following-dui-arrest"" rel=""noopener"" target=""_blank"">""seek treatment""</a> for the issues that he’s dealing with.</p><p>""Tiger Woods is a legend of our sport whose impact extends far beyond his achievements on the course,"" the organization said. ""But above all else, Tiger is a person, and our focus is on his health and well-being. Tiger continues to have our full support as he takes this important step.""</p><p>Faldo said that the Tour must be anguished ""behind closed doors"" about paying Woods millions and him being in the negative spotlight.</p><p>Woods was able to seek the treatment that he needed outside of the U.S.</p><p>Faldo lamented that Woods has ""avoided accountability"" for some of the issues he’s been involved in.</p><p><strong><em>Follow Fox News Digital’s</em></strong><a href=""https://twitter.com/FoxNewsSports_"" rel=""noopener noreferrer nofollow"" target=""_blank""><strong><em> </em></strong></a><a href=""https://twitter.com/FoxNewsSports_"" rel=""noopener"" target=""_blank""><strong><em><u>sports coverage on X</u></em></strong></a><strong><em> and subscribe to</em></strong><a href=""https://www.foxnews.com/newsletters"" rel=""noopener"" target=""_blank""><strong><em><u> the Fox News Sports Huddle newsletter</u></em></strong></a><strong><em>.</em></strong></p>",https://www.foxnews.com/sports/golf-legend-rips-tiger-woods-pga-tour-dui-arrest,2026-04-04
11,Luxury hotels launch superyachts for wealthy travelers who have long avoided cruises,"<p><a href=""https://www.foxnews.com/category/travel/general/luxury"" rel=""noopener"" target=""_blank"">Luxury hotels</a> are taking their five-star service offshore, launching a new wave of superyachts designed to lure travelers who have long avoided traditional cruises, according to reports.</p><p>For years, many wealthy travelers avoided traditional cruises, dodging notoriously crowded decks, buffet lines and megaships. Now, some of the world’s most recognizable hospitality brands are betting they can change that perception by offering more intimate super-yachts that feel like floating five-star hotels on water, according to <a href=""https://www.hollywoodreporter.com/lifestyle/lifestyle-news/best-luxury-hotel-yachts-cruises-1236530794/?utm_medium=email&amp;utm_source=exacttarget&amp;utm_campaign=Today+In+Entertainment+March+24+2026&amp;utm_content=672396_3-24-2026&amp;utm_id=672396"" rel=""noopener nofollow"" target=""_blank"">the Hollywood Reporter.</a></p><p>Brands including Four Seasons, The Ritz-Carlton, Aman and Orient Express are among those launching smaller, sleek vessels that emphasize privacy, curated itineraries and high-end service, and often host just a few hundred guests or fewer.</p><p><a href=""https://www.foxnews.com/travel/luxury-cruise-line-goes-adults-only-create-more-tranquil-environment-guests"" rel=""noopener"" target=""_blank""><strong>LUXURY CRUISE LINE GOES 'ADULTS ONLY' TO CREATE MORE 'TRANQUIL ENVIRONMENT' FOR GUESTS</strong></a></p><p>""What these brands have done is remove the psychological barrier that cruising once carried for this audience,"" Jules Maury, the head of travel agency Scott Dunn's private division for top clients, told Town &amp; Country. ""When a guest already trusts a brand on land, the transition to sea feels intuitive rather than experimental.""</p><p>The shift reflects a broader trend in luxury travel, as more travelers prioritize personalization, wellness and unique experiences, according to <a href=""https://www.townandcountrymag.com/leisure/travel-guide/a70641558/rise-of-luxury-cruises-hotels/"" rel=""noopener nofollow"" target=""_blank"">Town &amp; Country.</a> The line between being either a ""cruise person"" or a <a href=""https://www.foxnews.com/category/travel/general/hotels"" rel=""noopener"" target=""_blank"">""hotel person""</a> is beginning to blur.</p><p><a href=""https://www.foxnews.com/travel/cruise-line-abruptly-adds-extra-charges-passengers-travelers-worry-others-may-follow"" rel=""noopener"" target=""_blank""><strong>CRUISE LINE ABRUPTLY ADDS EXTRA CHARGES FOR PASSENGERS AS TRAVELERS WORRY OTHERS MAY FOLLOW</strong></a></p><p>The Ritz-Carlton helped set the tone with the 2022 debut of its yacht Evrima, designed for fewer than 300 guests and outfitted with residential-style suites, an infinity pool and refined dining options such as Maine lobster pasta, seared foie gras and sashimi salads, according to reports. The company has since expanded its fleet, with itineraries spanning the Mediterranean, <a href=""https://www.foxnews.com/category/world/world-regions/caribbean-region"" rel=""noopener"" target=""_blank"">Caribbean and beyond.</a></p><p>Four Seasons is following closely behind, launching its first yacht this year with just 95 suites and a focus on flexible itineraries and secluded destinations.</p><p><a href=""https://www.foxnews.com/newsletters?cmpid=fnfirstnl"" rel=""noopener"" target=""_blank""><strong>CLICK HERE TO SIGN UP FOR OUR LIFESTYLE NEWSLETTER</strong></a></p><p>Meanwhile, Orient Express is debuting the Corinthian, a sailing yacht with only 54 suites, Michelin-level dining and experiences like private concerts and curated shore excursions. Aman is also sailing into the space with a 47-suite vessel emphasizing privacy and wellness-focused amenities.</p><p>The emphasis is as much on what’s missing as what’s included, experts say.</p><p><a href=""https://www.foxnews.com/lifestyle"" rel=""noopener"" target=""_blank""><strong>CLICK HERE FOR MORE LIFESTYLE STORIES</strong></a></p><p>""There is <a href=""https://www.foxnews.com/category/travel/general/cruises"" rel=""noopener"" target=""_blank"">nothing cruise-like about them</a>,"" Mandy McKaskle, founder of Creosote Journeys &amp; Co., told The Hollywood Reporter, noting the absence of themed parties, Broadway-style shows and large crowds.</p><p>Instead, guests can expect features typical at luxury resorts, from spas and chef-driven menus to highly personalized service and even onboard specialists to plan excursions.</p><p>Some vessels even include helipads, 10,000-square-foot suites, private pools and cigar lounges, according to <a href=""https://www.businessinsider.com/hotel-chain-four-seasons-aman-luxury-cruise-ship-yachts-2025-2"" rel=""noopener nofollow"" target=""_blank"">Business Insider.</a></p><p>Another major selling point is access. Smaller ships can reach remote coves, fishing villages and polar regions that larger cruise ships cannot get to, allowing for <a href=""https://www.foxnews.com/travel"" rel=""noopener"" target=""_blank"">exclusive trips</a> to destinations in the Mediterranean and Antarctica.</p><p><a href=""https://www.foxnews.com/category/lifestyle/quizzes"" rel=""noopener"" target=""_blank""><strong>TEST YOURSELF WITH OUR LATEST LIFESTYLE QUIZ</strong></a></p><p>And the strategy appears to be working.</p><p>About half of Ritz-Carlton’s yacht guests are reportedly first-time cruisers, signaling that these offerings are successfully attracting travelers who have long avoided such vacations.</p>",https://www.foxnews.com/travel/luxury-hotels-launch-superyachts-wealthy-travelers-long-avoided-cruises,2026-04-04
