,title,text,link,publish_date
5,Manhunt for Louisiana man wanted in deadly crash who may have fled state or country continues into sixth month,"<p><a href=""https://www.foxnews.com/category/us/crime/manhunt"" rel=""noopener"" target=""_blank"">A manhunt</a> is continuing into its sixth month for a Louisiana man indicted for vehicular manslaughter last fall after he allegedly drove the wrong way on a freeway in St. John the Baptist Parish, killing a recent college graduate.</p><p>Manmeet Singh, 30, had a felony warrant issued in late October, charging him with vehicular homicide, reckless operation of a motor vehicle and driving in the wrong direction, Crime Stoppers of Great New Orleans said this week.</p><p>He is wanted by the Louisiana State Police, U.S. Immigration and Customs Enforcement and the U.S. Marshals Service New Orleans Task Force.</p><p>Singh was last known to be living in <a href=""https://www.foxnews.com/category/us/us-regions/southeast/louisiana"" rel=""noopener"" target=""_blank"">Ponchatoula, Louisiana</a>, and he worked as a ride-share driver in New Orleans.</p><p><a href=""https://www.foxnews.com/us/illegal-immigrant-ran-from-deadly-wrong-way-dui-crash-killed-motorcyclist-records-show"" rel=""noopener"" target=""_blank""><strong>ILLEGAL IMMIGRANT RAN FROM DEADLY WRONG-WAY DUI CRASH THAT KILLED MOTORCYCLIST, RECORDS SHOW</strong></a></p><p>Singh was allegedly driving drunk in September when he hit Patricia Saidu, 21, head-on on Interstate 10.</p><p>Saidu was trapped in her vehicle when it burst into flames and died immediately.</p><p>Singh was taken to a hospital with a blood alcohol level of .21% with serious injuries, but he recovered and was released before police could check back in with him.</p><p>""She wanted to be a physician and medical doctor,"" her father, Dr. Patrick Saidu, told WAFB-TV, adding that Saidu hoped to be a pediatrician. Saidu comes from an immigrant family of doctors from Sierra Leone.</p><p><a href=""https://www.foxnews.com/category/us/crime/police-and-law-enforcement"" rel=""noopener"" target=""_blank"">ICE agents</a> went to Singh’s house Oct. 1 after he was released from the hospital to serve an arrest warrant but determined he ""was unable to be moved due to his injuries,"" according to WAFB.</p><p>Fox News Digital has reached out to ICE for comment. </p><p><a href=""https://www.foxnews.com/us/manhunt-underway-after-missouri-deputy-slain-suspects-truck-spotted-heading-toward-arkansas-border"" rel=""noopener"" target=""_blank""><strong>MANHUNT UNDERWAY AFTER MISSOURI DEPUTY SLAIN, SUSPECT'S TRUCK SPOTTED HEADING TOWARD ARKANSAS BORDER</strong></a></p><p>Louisiana police had also gone to his home days earlier but also decided he was too injured to be moved.</p><p>At some point after that, Singh allegedly fled the state and hasn’t been seen since.</p><p>""We are in the sixth month since this accident took place. Patricia was taken from us in a very tragic manner,"" her father told WAFB.</p><p>""I’m pleading with them,"" her mother, Martha Saidu, added. ""I’m a grieving mother. My daughter did not deserve the way she died.""</p><p>Crimestoppers is offering a reward for information leading to Singh’s arrest.</p><p>Singh is supposed to be <a href=""https://www.foxnews.com/category/entertainment/events/in-court"" rel=""noopener"" target=""_blank"">in court</a> next week.</p><p>""He left family behind in the Ponchatoula area, including a young child and a wife,"" Deputy U.S. Marshal Brian Fair told Crimestoppers Tuesday. </p><p>""He left a wake of destruction behind him with not only his family but definitely with the victim’s family.""</p>",https://www.foxnews.com/us/manhunt-louisiana-man-wanted-deadly-crash-who-may-have-fled-state-country-continues-6th-month,2026-03-13
6,"Trump welcomes PRCA, WPRA champions at White House in return of rodeo tradition","<p>The 2025 world champions of the Professional Rodeo Cowboys Association (PRCA) and the <a href=""https://www.foxnews.com/sports"" rel=""noopener"" target=""_blank"">Women’s Professional Rodeo Association</a> (WPRA) were President Donald Trump's guests at the White House Friday. </p><p>It marked the first time in more than four decades that a group of PRCA champions had been hosted at <a href=""https://www.foxnews.com/category/politics/executive/white-house"" rel=""noopener"" target=""_blank"">1600 Pennsylvania Ave.</a> The last such visit came during Ronald Reagan’s presidency. </p><p>Friday’s visit featured several reigning rodeo champions, including all-around and bull riding champion Stetson Wright, bareback rider Rocker Steiner, steer wrestler Tucker Allen and team ropers Andrew Ward and Jake Long.</p><p><a href=""https://www.foxnews.com/sports"" rel=""noopener"" target=""_blank""><strong>CLICK HERE FOR MORE SPORTS COVERAGE ON FOXNEWS.COM</strong></a></p><p>Barrel racer Kassie Mowry and breakaway roper Taylor Munsell were also among the guests honored by Trump.</p><p>Wright arrived in the nation's captol in the No. 1 position in the all-around race. In individual events, Wright is in the No. 2 spot in the saddle bronc riding and is ranked tenth in the bull riding.</p><p>Allen won the 2025 world championship, while Ward and Long clinched their first-career PRCA world title. The pair also earned their first NFR championship together.</p><p><a href=""https://x.com/MargoMartin47/status/2032561601115504727"" rel=""nofollow noopener"" target=""_blank"">In a video</a> shared by White House communications advisor Margo Martin, several guests in the Oval Office explained the different types of ropes commonly used in rodeo competition. </p><p>In the clip, Trump responded, ""It’s so cool.""</p><p><i><strong>Follow Fox News Digital’s </strong></i><a href=""https://twitter.com/FoxNewsSports_"" rel=""nofollow noopener"" target=""_blank""><i><strong>sports coverage on X</strong></i></a><i><strong>, and subscribe to </strong></i><a href=""https://www.foxnews.com/newsletters"" rel=""noopener"" target=""_blank""><i><strong>the Fox News Sports Huddle newsletter</strong></i></a><i><strong>.</strong></i></p>",https://www.foxnews.com/sports/trump-welcomes-prca-wpra-champions-white-house-return-rodeo-tradition,2026-03-13
7,White House erupts over CNN report claiming Trump team underestimated Iran response on Hormuz,"<p>White House press secretary <a href=""https://www.foxnews.com/category/person/karoline-leavitt"" rel=""noopener"" target=""_blank"">Karoline Leavitt</a> on Friday forcefully rejected a CNN report that said President Donald Trump’s national security team was unprepared for the possibility Iran would move to close the Strait of Hormuz after U.S. strikes.</p><p>""This story is 100% FAKE NEWS,"" Leavitt wrote <a href=""https://x.com/PressSec/status/2032461051493511299"" rel=""nofollow noopener"" target=""_blank"">on X</a>, accusing CNN of relying on anonymous sources and defending the administration’s planning for such a scenario.</p><p>Leavitt said the Pentagon had planned for a possible Iranian closure of the strait for decades and said the threat had been part of the administration’s planning before Operation Epic Fury began.</p><p>""The idea that chairman Cain and Secretary Hegseth weren’t prepared for this possibility is PREPOSTEROUS,"" she continued. </p><p><a href=""https://www.foxnews.com/media/leavitt-lashes-out-cnns-kaitlan-collins-tense-exchange-fallen-soldiers-iran-operation"" rel=""noopener"" target=""_blank""><strong>LEAVITT LASHES OUT AT CNN'S KAITLAN COLLINS IN TENSE EXCHANGE ON FALLEN SOLDIERS FROM IRAN OPERATION</strong></a></p><p>""The President was fully briefed on it, and a goal of the Operation itself, to annihilate the terrorist Iranian regime’s navy, missiles, drone production infrastructure, and other threat capabilities is quite literally intended to deprive them of their ability to close the Strait.""</p><p>The Strait of Hormuz has become a focal point in the conflict because roughly one-fifth of the world’s oil shipments pass through the waterway.</p><p><a href=""https://www.cnn.com/2026/03/12/politics/hormuz-trump-administration-underestimated-iran"" rel=""nofollow noopener"" target=""_blank"">CNN reported</a> Thursday that Trump’s national security team ""failed to fully account for the potential consequences of what some officials have described as a worst-case scenario now facing the administration.""</p><p>The report cited anonymous sources ""familiar with the matter.""</p><p><a href=""https://www.foxnews.com/media/pete-hegseth-criticizes-fake-news-coverage-iran-strikes-says-only-tragedies-make-front-page"" rel=""noopener"" target=""_blank""><strong>PETE HEGSETH CRITICIZES 'FAKE NEWS' COVERAGE OF IRAN STRIKES, SAYS ONLY TRAGEDIES MAKE FRONT PAGE</strong></a></p><p><a href=""https://www.foxnews.com/category/politics/executive/white-house"" rel=""noopener"" target=""_blank"">Leavitt’s criticism</a> was echoed by Republican lawmakers and administration officials who called the CNN report false.</p><p>""As chairman of the Intelligence Committee, let me make clear: whoever leaked this lied,"" Sen. Tom Cotton, chairman of the Senate Intelligence Committee, wrote on X. ""CNN should do some fact-checking.""</p><p>Secretary of War Pete Hegseth also blasted the report during remarks at the <a href=""https://www.foxnews.com/category/tech/topics/pentagon"" rel=""noopener"" target=""_blank"">Pentagon Friday</a>, calling it ""more fake news from CNN"" and ""patently ridiculous.""</p><p><a href=""https://www.foxnews.com/politics/hegseth-announces-pentagon-probe-deadly-strike-iranian-school"" rel=""noopener"" target=""_blank""><strong>HEGSETH ANNOUNCES PENTAGON PROBE INTO DEADLY STRIKE ON IRANIAN SCHOOL</strong></a></p><p>""For decades, Iran has threatened shipping in the Strait of Hormuz. This is always what they do, hold the strait hostage,"" <a href=""https://www.foxnews.com/media/hegseth-scolds-cnns-unserious-report-iran-conflict-suggests-paramount-should-overhaul-network"" rel=""noopener"" target=""_blank"">he added</a>. ""CNN doesn’t think we thought of that.""</p><p>CNN issued a clarification to the story on Friday, which said, ""This story has been updated to reflect additional developments and clarify that top Trump administration officials briefed lawmakers on long-standing military plans to address a major disruption to the Strait, according to one official, but that multiple sources familiar with the session said there was no indication there were any near-term solutions.""</p><p>""We stand by our reporting,"" CNN told Fox News Digital when reached for comment Friday.</p><p>CNN Chairman and CEO Mark Thompson said on X, ""We stand by our journalism.""</p><p>The White House has repeatedly clashed with major news outlets this week over coverage of the Iran conflict.</p><p><a href=""https://www.foxnews.com/media"" rel=""noopener"" target=""_blank""><strong>CLICK HERE FOR MORE COVERAGE OF MEDIA AND CULTURE</strong></a></p><p>Leavitt called for ABC News to <a href=""https://www.foxnews.com/media/karoline-leavitt-demands-retraction-abc-news-story-claiming-fbi-warned-iran-could-attack-california"" rel=""noopener"" target=""_blank"">retract a story</a> Thursday that claimed the FBI had officially warned Iran may try to attack California with drones.</p><p>She called the report ""false information to intentionally alarm the American people,"" adding that the story was based on ""one email that was sent to local law enforcement in California about a single, unverified tip.""</p><p>ABC News has since <a href=""https://abcnews.com/US/fbi-warns-iran-aspired-attack-california-drones-retaliation/story?utm_source=facebook&amp;utm_medium=social&amp;utm_campaign=dhfacebook&amp;utm_content=app.dashsocial.com/abcnews/library/media/649942622&amp;id=130973820"" rel=""nofollow noopener"" target=""_blank""><u>updated its story</u></a> with an editor's note declaring, ""The FBI has posted a fuller version of its alert to California authorities, which includes that the information was unverified. The latest version of this story has been updated with the full statement.""</p><p><i>Fox News' Alexander Hall and Joseph A. Wulfsohn contributed to this report.</i></p>",https://www.foxnews.com/media/white-house-erupts-over-cnn-report-claiming-trump-team-underestimated-iran-response-hormuz,2026-03-13
8,Trump Kennedy Center's new leader revealed as Ric Grenell exits top role,"<p><a href=""https://www.foxnews.com/opinion/china-threatens-our-farmers-food-supply-states-need-step-up"" rel=""noopener"" target=""_blank"">Ric Grenell's</a> successor as the president of the Trump Kennedy Center was revealed Friday afternoon after President Donald Trump took to Truth Social to make the announcement.</p><p>The change will officially be announced Monday when the Trump Kennedy Center’s board meets to officially suspend its activities and launch construction efforts.</p><p>Grenell, who has a background in foreign policy and assumed control of the center in February 2025 in addition to his special envoy role, is being replaced by Matt Floca, the Trump Kennedy Center’s vice president of facilities operations.</p><p><a href=""https://www.foxnews.com/politics/prewritefbi-nabs-suspect-accused-threatening-kill-ric-grenell"" rel=""noopener"" target=""_blank""><strong>US JUDGE ORDERS SUSPECT DETAINED FOR THREATENING TO KILL RICHARD GRENELL</strong></a></p><p>A source familiar with Grenell’s thinking said the transition was a result of the construction-focused shift for the organization and consistent with plans President <a href=""https://www.foxnews.com/category/person/donald-trump"" rel=""noopener"" target=""_blank"">Donald Trump</a> outlined in posts to social media at the beginning of February.</p><p>""I have determined that the fastest way to bring the Trump Kennedy Center to the highest level of success, beauty and grandeur is to cease entertainment operations for an approximately two-year period of time,"" Trump said <a href=""https://truthsocial.com/@realDonaldTrump/posts/115997939705121174"" rel=""nofollow noopener"" target=""_blank"">in a post to Truth Social</a> last month.</p><p>The source added that the change in the Trump Kennedy Center’s leadership is reflective of the organization’s focus for the time being.</p><p>""I mean, the whole thing is turning into a construction zone,"" the source said. ""It’s going to be a construction zone, and [Ric is] not a construction guy.""</p><p><a href=""https://www.foxnews.com/media/washington-national-opera-depart-trump-kennedy-center-amid-reported-financial-strains"" rel=""noopener"" target=""_blank""><strong>WASHINGTON NATIONAL OPERA TO DEPART TRUMP–KENNEDY CENTER AMID REPORTED FINANCIAL DIFFICULTIES</strong></a></p><p>Trump also highlighted Floca’s new appointment online.</p><p>""As Vice President of Operations, Matt has helped us achieve tremendous progress in bringing the Center to the highest level of Excellence! A Complete Reconstruction of THE TRUMP KENNEDY CENTER will begin after the July 4th Celebration,"" <a href=""https://truthsocial.com/@realDonaldTrump/posts/116223780884576729"" rel=""nofollow noopener"" target=""_blank"">Trump wrote.</a></p><p>He went on to praise Grenell's performance in the executive role, saying, ""Ric Grenell has done an excellent job in helping to coordinate various elements of the Center during the transition period, and I want to thank him for the outstanding work he has done."" </p><p>The renovations are slated to cost $257 million, according to figures approved by Congress in <a href=""https://www.foxnews.com/category/person/donald-trump"" rel=""noopener"" target=""_blank"">Trump’s signature One Big Beautiful Bill Act</a> last year.</p><p>Grenell declined to respond to inquiries about what his next role would be.</p>",https://www.foxnews.com/politics/trump-kennedy-centers-new-leader-revealed-after-ric-grenell-exits-top-role,2026-03-13
9,Cuban president reveals talks with Trump admin as fuel blockade chokes domestic energy supply and economy,"<p>The Cuban government is in talks with Trump administration officials, the country's president said Friday, as Havana works to halt a potential regime change as it deals with a widening energy crisis. </p><p>In a 90-minute news conference broadcast by state media, Cuban President Miguel Díaz-Canel said talks with Washington were aimed at finding solutions to the political differences that divide the communist island and the United States, The New York Times reported. </p><p>However, changes to Cuba's political system are off limits, Lianys Torres Rivera, Cuba’s chief of mission in the United States, told Politico in an interview.</p><p><a href=""https://www.foxnews.com/world/millions-lose-power-across-cuba-trump-sanctions-continue-fuel-ongoing-energy-crisis"" rel=""noopener"" target=""_blank""><strong><u>MILLIONS LOSE POWER ACROSS CUBA AS TRUMP SANCTIONS CONTINUE TO FUEL ONGOING ENERGY CRISIS</u></strong></a></p><p>Cuba's economy has struggled since the U.S. capture of Venezuelan President Nicolás Maduro from his home in Caracas at the start of the year. The Trump administration immediately cut off oil exports to the island.</p><p>A number of key sectors across the island are under considerable strain, including its transportation, health and education systems, Torres Rivera said. She noted that as many as 11,000 children are on waiting lists for surgeries and procedures at health clinics.</p><p>""They have no money. They have no anything right now,"" President Donald Trump said in February. ""Maybe we’ll have a friendly takeover of Cuba.""</p><p>Trump has said a deal with Havana ""would be very easily made.""</p><p>In January, Trump <a href=""https://www.foxnews.com/world/trump-declares-national-emergency-cuba-threatens-tariffs-nations-supply-oil-communist-regime"" rel=""noopener"" target=""_blank""><u>declared a national emergency</u></a> via an executive order over Cuba, accusing the communist regime of aligning with hostile foreign powers and terrorist groups.</p><p><a href=""https://www.foxnews.com/us/family-member-american-killed-cuban-forces-boat-shootout-diabolical-mission"" rel=""noopener"" target=""_blank""><strong><u>FAMILY MEMBER OF AMERICAN KILLED BY CUBAN FORCES IN BOAT SHOOTOUT SAYS HE WAS ON 'DIABOLICAL' MISSION</u></strong></a></p><p>Last week, he said Cuba was ""negotiating with [Secretary of State] Marco [Rubio] and myself and some others. And I would think a deal would be made very easily with Cuba.""</p><p>Trump has charged Rubio, the son of Cuban immigrants and someone who has actively championed regime change, with negotiations with Cuba. </p><p>Friday was the first time the Cuban government formally acknowledged talks with Washington. </p><p>Amid talks, Rubio’s main counterpart has been Raúl Rodriguez Castro, the grandson of Raul Castro, the island's de facto leader and its former president. </p><p>Díaz-Canel said the talks with the United States were needed, in part, ""to determine the willingness of both sides to take concrete actions,"" the Times reported. </p><p>He added that he would soon welcome an <a href=""https://www.foxnews.com/category/tech/topics/fbi"" rel=""noopener"" target=""_blank"">FBI team</a> to take part in the investigation into 10 Cubans who lived in the United States who got into a firefight with the Cuban coast guard last month. </p><p>""Agendas are built, negotiations and conversations take place and agreements are reached. Things we are still far from because we are in the initial phases of this process,"" Díaz-Canel said.</p><p>Fox News Digital has reached out to the White House. </p>",https://www.foxnews.com/politics/cuban-president-admits-talks-trump-admin-fuel-blockade-chokes-domestic-energy-supply-economy,2026-03-13
10,FBI busts convenience store clerks for 'staged armed robberies' to apply for immigration benefits,"<p>Federal authorities say 11 Indian nationals were charged in a scheme to stage <a href=""https://www.foxnews.com/category/us/terror/conspiracies-plots"" rel=""noopener"" target=""_blank"">armed robberies</a> at convenience stores and restaurants so participants could falsely claim to be crime victims when applying for immigration benefits.</p><p>The defendants were charged with conspiracy to commit visa fraud, according to the U.S. Attorney’s Office in <a href=""https://www.justice.gov/usao-ma/pr/eleven-indian-nationals-charged-visa-fraud-conspiracy"" rel=""noopener"" target=""_blank"">Massachusetts</a>.</p><p>Prosecutors allege the scheme centered on fake robberies designed to help clerks or store owners seek U visas, a form of immigration relief available to certain victims of serious crimes who assist law enforcement.</p><p><a href=""https://www.foxnews.com/us"" rel=""noopener"" target=""_blank""><strong>CLICK HERE FOR MORE US NEWS</strong></a></p><p>Six defendants were arrested in Massachusetts and released after initial appearances in federal court in Boston. Others were arrested in Kentucky, Missouri and Ohio and are expected to appear later in Boston. </p><p>An 11th defendant had previously been <a href=""https://www.foxnews.com/category/us/immigration/deportation"" rel=""noopener"" target=""_blank"">deported to India</a>, authorities said.</p><p>According to charging documents, the alleged conspiracy began in March 2023 and involved at least six convenience stores, liquor stores and fast-food restaurants in Massachusetts, with additional incidents elsewhere.</p><p>Investigators say the staged robberies followed a script.</p><p>A purported robber would enter a business, threaten clerks or owners with what appeared to be a gun, take cash from the register and flee.</p><p>The encounters were captured on store surveillance video, prosecutors said, helping create the appearance of legitimate crimes.</p><p><a href=""https://x.com/FoxUSNews"" rel=""noopener"" target=""_blank""><strong>FOLLOW US ON X</strong></a></p><p>Authorities allege the clerks or owners then waited five minutes or more before calling police, allowing the supposed robber time to escape and making the incidents appear real.</p><p><a href=""https://www.foxnews.com/newsletters"" rel=""noopener"" target=""_blank""><strong>GET BREAKING NEWS BY EMAIL</strong></a></p><p>Prosecutors say the participants portrayed as victims paid an organizer to take part in the scheme. The organizer, in turn, allegedly paid store owners for the use of their businesses as robbery locations.</p><p><a href=""https://www.foxnews.com/tips"" rel=""noopener"" target=""_blank""><strong>GOT A TIP?</strong></a></p><p>The alleged organizer, along with the purported robber and a getaway driver, had already been charged and convicted in the case, according to federal authorities. The 11 people charged this week are accused of either arranging robberies with the organizer or paying for themselves or relatives to be listed as victims.</p><p>The charge of conspiracy to commit visa fraud carries a potential sentence of up to five years in prison, up to three years of supervised release and a fine of up to $250,000. Any sentence would be determined by a federal judge.</p><p>According to a release from the <a href=""https://www.foxnews.com/category/us/us-regions/northeast/massachusetts"" rel=""noopener"" target=""_blank"">Massachusetts Department of Justice</a>, the following defendants have been charged with one count of conspiracy to commit visa fraud:</p>",https://www.foxnews.com/us/fbi-busts-massachusetts-convenience-store-clerks-staged-armed-robberies-apply-immigration-benefit,2026-03-13
