,title,text,link,publish_date
14,SEN RICK SCOTT: The lesson of Artemis? Purge woke politics and let NASA do its job,"<p>This week, Americans and people around the world have been awed and inspired by an incredible journey that began in my home state of Florida. After a successful launch at Cape Canaveral, <a href=""https://www.foxnews.com/category/science/air-and-space/nasa"" rel=""noopener"" target=""_blank"">NASA has sent </a><a href=""https://www.foxnews.com/us/artemis-ii-launches-astronauts-around-moon-first-deep-space-mission-since-apollo"" rel=""noopener"" target=""_blank"">human beings</a> around the moon for the first time in 54 years. Artemis II has now completed its lunar flyby, traveling more than 250,000 miles from Earth and venturing farther into space than any crewed mission in modern history.</p><p>As exciting as this mission is, it’s only the beginning of America’s new future on the final frontier. And none of it would be possible without sound leadership.</p><p>Under the leadership of <a href=""https://www.foxnews.com/category/politics/elections/presidential"" rel=""noopener"" target=""_blank"">President Trump</a> and NASA Administrator Jared Isaacman, Artemis III is expected to launch next year, entering low Earth orbit to rendezvous with one or both commercial lunar landers before landing Americans on the moon in 2028.</p><p><a href=""https://www.foxnews.com/live-news/artemis-ii-moon-nasa-photos-april-8-2026"" rel=""noopener"" target=""_blank""><strong>ARTEMIS II ASTRONAUTS NOW UNDER EARTH'S GRAVITY AGAIN AFTER LEAVING MOON'S SPHERE OF INFLUENCE</strong></a></p><p>While this achievement belongs first and foremost to our heroic astronauts, NASA’s brilliant workforce and everyone who has worked so hard on Florida’s Space Coast, it is also the result of a long-needed shift in <a href=""https://www.foxnews.com/category/politics/house-of-representatives/leadership"" rel=""noopener"" target=""_blank"">leadership priorities</a>.</p><p>For decades, NASA struggled with inconsistent direction. After <a href=""https://www.foxnews.com/category/person/barack-obama"" rel=""noopener"" target=""_blank"">Barack Obama</a> canceled the Constellation program, the agency drifted, and Florida’s Space Coast began to fall by the wayside.</p><p>Back then, NASA funding reached an all-time low as a percentage of the federal budget. Jobs started to disappear in Florida. That’s why, during my eight years as governor, we worked to invest more than $230 million in spaceport projects to help the Space Coast and create thousands of high-paying aerospace jobs. This included working with the private sector, helping set the stage for Florida as the site of the Blue Origin launch site and the transfer of the Shuttle Landing Facility from NASA to Space Florida.</p><p><a href=""https://www.foxnews.com/tech/nasa-returns-humans-deep-space-after-over-50-years-february-artemis-ii-moon-mission"" rel=""noopener"" target=""_blank""><strong>NASA RETURNS HUMANS TO DEEP SPACE AFTER OVER 50 YEARS WITH ARTEMIS II MOON MISSION</strong></a></p><p>Then things got back on track during President Trump’s first term. By reestablishing the National Space Council, launching the moon-to-Mars program and setting a clear objective to return Americans to the moon, he gave NASA back its focus and purpose.</p><p>That progress once again stalled under <a href=""https://www.foxnews.com/category/person/joe-biden"" rel=""noopener"" target=""_blank"">Joe Biden</a>. While Artemis was allowed to continue, the Biden administration overloaded NASA with political mandates that had little to do with space exploration and everything to do with appeasing the radical left.</p><p>Climate activism and ""DEI"" initiatives took over, draining resources and distracting from the mission.</p><p>In his first 100 days, Biden installed a diversity adviser tasked with embedding ""equity"" into every corner of the agency. NASA was also pulled into the White House Climate Task Force and directed to expand its role in <a href=""https://www.foxnews.com/category/climate-change"" rel=""noopener"" target=""_blank"">climate policy</a>. The administration created a senior climate adviser position, further entrenching political priorities inside what should be a mission-driven space agency.</p><p><a href=""https://www.foxnews.com/politics/trump-hypes-moon-mission-artemis-ii-prepares-lift-off-under-pressure-from-past-failures"" rel=""noopener"" target=""_blank""><strong>TRUMP HYPES MOON MISSION AS ARTEMIS II PREPARES TO LIFT OFF UNDER PRESSURE FROM PAST FAILURES</strong></a></p><p>Reports show that at least $13 million was spent on DEI programs between 2021 and 2024, funding consultants, internal training and identity-based initiatives despite concerns about mission readiness.</p><p>Americans were horrified when NASA astronauts Barry ""Butch"" Wilmore and Sunita ""Sunni"" Williams were left stranded in space for months due to ongoing failures with the Boeing Starliner. What should have been a routine mission turned into a national embarrassment. It underscored what happens when excellence takes a back seat to politics.</p><p><a href=""https://www.foxnews.com/opinion/nasa-crossroads-trumps-plan-refocus-explore-beat-china"" rel=""noopener"" target=""_blank""><strong>NASA AT A CROSSROADS: TRUMP’S PLAN TO REFOCUS, EXPLORE AND BEAT CHINA</strong></a></p><p>At the same time, ideology began creeping into scientific funding. Researchers warned that grant applicants were expected to demonstrate alignment with DEI principles to compete for funding.</p><p>This shift was openly embraced at the highest levels. NASA Administrator Bill Nelson repeatedly declared that NASA was in the climate propaganda business instead of the space business, even stating publicly that ""NASA is a climate agency"" in official communications. Instead of inspiring children to explore the universe, NASA used Americans’ tax dollars to frighten them with hysterical predictions of a <a href=""https://www.foxnews.com/category/science/planet-earth/climate"" rel=""noopener"" target=""_blank"">climate change</a> nightmare.</p><p><a href=""https://www.foxnews.com/opinion"" rel=""noopener"" target=""_blank""><strong>CLICK HERE FOR MORE FOX NEWS OPINION</strong></a></p><p>With China aggressively advancing its own space program, the United States cannot afford politicized mission creep.</p><p>That direction is now changing under the leadership of President Trump. NASA’s focus has been clear: execute the Artemis program, strengthen commercial partnerships and ensure <a href=""https://www.foxnews.com/politics/nasa-says-america-win-the-second-space-race-against-china"" rel=""noopener"" target=""_blank"">America wins the second space race</a>.</p><p>Congress should follow suit and do everything within our power to make sure NASA’s space exploration mission cannot be hijacked by future Democrat administrations that want to use it for woke political propaganda. That’s why Congress needs to take up and <a href=""https://www.foxnews.com/category/politics/state-and-local/legislation"" rel=""noopener"" target=""_blank"">pass my Dismantle DEI Act</a> to codify President Trump’s executive actions terminating DEI programs and initiatives, preventing future administrations from reinstating similar Biden-era DEI policies. This will ensure that NASA — and the rest of our federal government — remain focused on mission and merit.</p><p>As Artemis III approaches, the stakes could not be higher. The United States can lead a new Space Age or fall behind because of distractions and misplaced priorities. Artemis II has opened the door to a Golden Age of space exploration. We in Washington must make sure that door stays open for future generations.</p>",https://www.foxnews.com/opinion/sen-rick-scott-lesson-artemis-purge-woke-politics-let-nasa-job,2026-04-09
15,VA Dem rejects ‘power grab’ claims on Spanberger redistricting as GOP warns 10–1 map would split rural vote,"<p>A top Virginia Democrat is defending support for the redistricting effort critics are calling a ""power grab"" on the part of Gov. <a href=""https://www.foxnews.com/category/person/abigail-spanberger"" rel=""noopener"" target=""_blank"">Abigail Spanberger</a> and Richmond leadership, dismissing claims that rural Virginians will have their voices diluted by an urban-centric map.</p><p>The redistricting referendum, before voters now through April 21, would redraw Virginia’s 6-5 Democrat-majority congressional map to a likely 10-1 spread, leaving only Rep. Morgan Griffith, R-Va., from the Old Dominion’s mountainous far southwest in office for the GOP.</p><p>Rep. Suhas Subramanyam, D-Va., a first-term Loudoun County congressman, told Fox News Digital on Wednesday that the goal of the redistricting remains as stated in its referendum text: to ""restore fairness"" in congressional apportionment. </p><p>When Virginians head to the polls, he argues, issues like the Iran conflict, healthcare funding and unease over the state of immigration enforcement will be on their minds.</p><p><a href=""https://www.foxnews.com/politics/soros-backed-group-among-liberal-orgs-pumping-eye-popping-virginia-gerrymandering-effort"" rel=""noopener"" target=""_blank""><strong>SOROS-BACKED GROUP AMONG LIBERAL ORGS PUMPING EYE-POPPING CASH INTO VIRGINIA GERRYMANDERING EFFORT</strong></a></p><p>""There’s two different things here … there’s the redistricting amendment: the reason the general assembly pushed this forward was to be a response to Texas and other red states who are planning to do this — the idea was to even the playing field going into the midterms,"" he said.</p><p>""The reason I believe people will vote for it is because they are angry at the Trump administration in Virginia,"" he added.</p><p>Subramanyam pushed back on claims from Republicans, including rural Rep. Ben Cline of the Shenandoah Valley, that areas like his, primed to be chopped up by the new map, will suddenly see their next representative ignore their needs. His district's population is centered in Loudoun, outside Washington, D.C., but it extends into rural Washington, Va., Sperryville and Warrenton, which together are geographically larger than the dense suburbs.</p><p>""I spend a lot of time in Fauquier and Rappahannock counties, even though I live in Loudoun County, and they actually get a disproportionate amount of federal funding and appropriations requests from my office because we are working really hard in those counties and know they have a lot of needs.""</p><p><a href=""https://www.foxnews.com/politics/florida-virginia-latest-battlegrounds-redistricting-war-between-trump-democrats"" rel=""noopener"" target=""_blank""><strong>THIS CRUCIAL STATE IS THE LATEST BATTLEGROUND IN REDISTRICTING WAR BETWEEN TRUMP AND DEMOCRATS</strong></a></p><p>Subramanyam said that even if lawmakers hail from Virginia’s cities or suburbs, they will often go ""out of their way"" to support the counties they don’t live in because they need a voice.</p><p>""What I would say to [critics] is they should talk to my constituents in Fauquier and Rappahannock, who may not vote for me in big numbers, but they appreciate that we're working really hard for them anyway.""</p><p>In that regard, Democrats are already lining up to <a href=""https://www.foxnews.com/category/us/congress"" rel=""noopener"" target=""_blank"">run for Congress</a> in a district that includes part of Subramanyam’s current area — a lobster-shaped district that Republicans claim is drawn intentionally to include a tiny slice of Fairfax and Loudoun for population’s sake, then expand far south to Powhatan and west to West Virginia’s state line while remaining blue.</p><p>State Del. Dan Helmer, D-Fairfax, progenitor of the state’s new gun control panoply, along with former first lady Dorothy McAuliffe and Jack Smith prosecutor JP Cooney, are all seeking the drafted seat.</p><p>Cline previously told Fox News Digital he worries for his current constituents, adding that the Shenandoah Valley is Virginia’s top agricultural area and farmers’ voices will have to be divided among five new federal lawmakers.</p><p>Expanding on voter sentiment, Fox News Digital asked Subramanyam about <a href=""https://www.foxnews.com/politics/new-poll-reveals-spanbergers-popularity-amid-backlash-gerrymandering"" rel=""noopener"" target=""_blank"">recent polling showing Gov. Abigail Spanberger’s</a> popularity taking a hit amid her support for redistricting and other liberal priorities moving through the state legislature.</p><p><a href=""https://www.foxnews.com/politics/battle-house-runs-through-virginia-court-oks-high-stakes-redistricting-vote"" rel=""noopener"" target=""_blank""><strong>BATTLE FOR THE HOUSE RUNS THROUGH VIRGINIA AS COURT OKS HIGH-STAKES REDISTRICTING VOTE</strong></a></p><p>""I wouldn't read too much into it,"" he said.</p><p>""She certainly is very early into her administration and has a lot of time to show people what she’s all about.""</p><p>Subramanyam predicted that if there were a repeat election tomorrow, Spanberger would again defeat former Lt. Gov. <a href=""https://www.foxnews.com/category/person/winsome-sears"" rel=""noopener"" target=""_blank"">Winsome Sears</a> by the same 15 points as in November.</p><p>""We’re seeing that all over the country right now -- backlash against the Trump administration is finding its way into school board races and Supreme Court races in Wisconsin and places like Georgia.""</p><p>Just down Leesburg Pike from Subramanyam’s district, Rep. Donald Beyer of Alexandria offered his own comments on the redistricting effort, telling NBC News a ""yes"" vote is crucial for ""those of us who believe that <a href=""https://www.foxnews.com/politics/virginia-dem-admits-redistricting-push-aims-stop-trump-not-about-fairness"" rel=""noopener"" target=""_blank"">taking back the House</a> is the most significant thing we can do to stop Donald Trump.""</p><p>Beyer — whose seat is considered safe with or without a cartographic change — did mention the ""fairness"" aspect, calling the new 10-1 <a href=""https://www.foxnews.com/category/politics"" rel=""noopener"" target=""_blank"">Democrat-friendly map</a> ""totally fair for America"" even if critics found it ""unfair in Virginia.""</p><p>Virginia House Minority Leader Terry Kilgore, R-Gate City, whose rural district is closer to Birmingham than Washington, pushed back on the collective sentiment, telling Fox News Digital that the new map is ""manifestly unfair"" to the rest of Virginia.</p><p>""We’re a 51-49 state, not a 90-10 state. If they’re willing to silence nearly half the Commonwealth’s voters in the name of ‘fairness,’ what else are they willing to do?"" he said.</p><p>Kilgore’s Senate counterpart, Minority Leader Ryan McDougle of Hanover, echoed him in recent comments to Fox News Digital, saying the new map is just the next step in the ""con job"" agenda from Democrats who claim to prioritize affordability but instead are ""trying to shove another partisan power grab down our throats, this time wrapped in the phony label of ‘fairness.'""</p>",https://www.foxnews.com/politics/va-dem-rejects-power-grab-claims-spanberger-redistricting-gop-warns-10-1-map-would-split-rural-vote,2026-04-09
16,Trump’s last-minute delay: Why he was never going to obliterate Iran in the first place,"<p>I’ve been telling anyone who would listen – yes. I can get rather tiresome – that <a href=""https://www.foxnews.com/category/person/donald-trump"" rel=""noopener"" target=""_blank"">President Donald Trump</a> would not bomb Iran back to the Stone Ages.</p><p>Even after he said he would <a href=""https://www.foxnews.com/category/politics/defense/wars/war-with-iran"" rel=""noopener"" target=""_blank"">destroy Iran’s civilization</a> and it would never recover, I knew that he would never go through with it. That was the last thing he wanted to do.</p><p>So I was confident he would find some kind of last-minute off-ramp.</p><p>And, of course, he didn’t want to be seen as backing off his increasingly dire threats.</p><p><a href=""https://www.foxnews.com/media/why-trumps-war-speech-failed-declaring-victory-still-bombing-iran-back-stone-ages"" rel=""noopener"" target=""_blank""><strong>WHY TRUMP’S WAR SPEECH FAILED: DECLARING VICTORY BUT STILL BOMBING IRAN BACK TO THE ‘STONE AGES’</strong></a></p><p>I got the White House email at 6:32 Tuesday night. There it was, another delay, after a series of earlier delays. He would give the Iranians two more weeks.</p><p>I started posting like crazy, beating television by a couple of minutes, and newspapers by more. But that’s just because my phone happened to be right there. If I’d gone to the fridge for a moment, I would have come back to my laptop and discovered that the world had changed. </p><p>I knew in my gut, having covered Trump for 35 years, that he did not want to go down in history as the man who wiped out an ancient civilization. His heart was never in that. It was bluster as a negotiating tactic. </p><p><a href=""https://www.foxnews.com/opinion/trump-fighting-fierce-battles-home-abroad-why-he-casually-dismisses-consequences"" rel=""noopener"" target=""_blank""><strong>TRUMP FIGHTING FIERCE BATTLES, AT HOME AND ABROAD: WHY HE CASUALLY DISMISSES THE CONSEQUENCES</strong></a></p><p>Still, he had boxed himself into a corner. Former allies in conservative media were denouncing him. ""This is a brazen pre-admission of genocide against the Iranian people, which would obviously be a war crime. Madness,"" Piers Morgan declared.</p><p>Some Republican lawmakers said he had gone too far. Even the <a href=""https://www.foxnews.com/category/us/religion/roman-catholic"" rel=""noopener"" target=""_blank"">U.S. Catholic Bishops</a> said ""the threat of destroying a whole civilization and the intentional targeting of civilian infrastructure cannot be morally justified."" </p><p>No American president had ever uttered such words.</p><p>So I figured the only card that Trump had left to play was delay. And that’s precisely what he did. At the request of Pakistan, which has been the intermediary in the so-called talks, the president agreed to a pause in the hostilities.    </p><p>That is, according to the statement I received, ""subject to the Islamic Republic of Iran agreeing to the COMPLETE, IMMEDIATE, and SAFE OPENING of the Strait of Hormuz, I agree to suspend the bombing and attack of Iran for a period of two weeks. This will be a double sided CEASEFIRE! The reason for doing so is that we have already met and exceeded all Military objectives…""</p><p>It’s a shaky ceasefire, to be sure, with Iran launching missiles at Israel minutes  after it was announced, and Israel saying its ground invasion of Lebanon, after rocket fire from Iranian proxy Hezbollah, isn’t covered.</p><p><a href=""https://www.foxnews.com/media/why-trump-iran-seem-light-years-apart-any-possible-deal-end-war"" rel=""noopener"" target=""_blank""><strong>WHY TRUMP, IRAN SEEM LIGHT-YEARS APART ON ANY POSSIBLE DEAL TO END THE WAR</strong></a></p><p>By yesterday, in fact, as The AP confirmed, Iran’s state media said it had closed  Hormuz again, citing the Israeli attacks.</p><p>Iranian Foreign Minister Abbas Araghchi said in a posting that the Trump administration ""must choose between a ceasefire or continued war via Israel, and ""it cannot have both.""</p><p>We learned from New York Times reporters Maggie Haberman and Jonathan Swan that <a href=""https://www.foxnews.com/category/person/benjamin-netanyahu"" rel=""noopener"" target=""_blank"">Bibi Netanyahu</a> talked Trump into the war by saying it would be quick and topple the regime. Gen. Dan Caine, the Joint Chiefs chairman, called that ""farcical."" Marco Rubio said it was BS. JD Vance was against the war.</p><p>And that’s a fascinating sidebar. Trump has been insulting Haberman, who published a biography of him in 2022, for no apparent reason. Yet he granted an hourlong Oval Office interview for their forthcoming book, ""Regime Change,"" from which the Times piece was excerpted.</p><p>As for the president’s current stance, well, he isn’t being held back by murky details. He told Sky News this was a ""complete victory,"" not just in military terms but ""in every other sense as well.""</p><p>Trump was on the phone with Fox opinion host Laura Ingraham shortly before she came on the air, and she quoted him as being ""cautiously optimistic,"" saying: ""It sure looks like Iran blinked.""</p><p>What, peering through the fog of war, did Trump actually accomplish, other than sending the markets soaring by nearly 3 percent?</p><p>On yesterday’s ""Fox &amp; Friends,"" usually a Trump-friendly show, co-host Lawrence Jones said ""we have not reached any of these objectives.""  </p><p>Dismantling nuclear facilities (""that has not happened""), ending uranium enrichment (""they are still enriching""), transferring uranium stockpiles out of Iran (""that hasn’t happened""), accepting international inspections (""they are still not willing to do it"") and suspending the ballistic missile program (""they’re still firing them off""). Jones also criticized Iran for proposals that would never be accepted by the U.S. side.</p><p><a href=""https://www.foxnews.com/media/why-trump-faces-agonizing-decision-obliterating-irans-oil-supply-he-cant-get-deal"" rel=""noopener"" target=""_blank""><strong>WHY TRUMP FACES AN AGONIZING DECISION ON OBLITERATING IRAN’S OIL SUPPLY IF HE CAN’T GET A DEAL</strong></a></p><p>Fox anchor Harris Faulkner said yesterday, ""this is the least ceasefire-like ceasefire I think that anybody might have anticipated."" Fox’s chief foreign correspondent, Trey Yingst, said, ""the Iranians don’t appear very serious about this ceasefire agreement."" </p><p>And therein lies the rub. The two countries remain far apart. This business about a strategic framework just papers that over in a devil’s-in-the-details sense. Iran is never going to agree to give up its nuclear program, regardless of any presidential pronouncements or Mission Accomplished banners.</p><p>The <a href=""https://www.foxnews.com/category/world/conflicts/iran"" rel=""noopener"" target=""_blank"">Iranian pitch</a>, apparently not the one seen by Trump, says the U.S. must leave the region, give Iran sole control of the strait, and recognize its right to nuclear enrichment.</p><p>Don’t take my word for it. Press secretary Karoline Leavitt told reporters yesterday that Iran’s 10-point plan was ""fundamentally unserious, unacceptable and completely discarded."" </p><p>Look, if this somehow all works out, what most people will remember is that Trump made harsh threats that led to a deal in which the Iranian blockade – ""Open the F---in’ Strait, you crazy b------s"" – was lifted. In other words, his Madman routine worked against the world’s leading terror state, which has been killing Americans, Arabs and its own people for 47 years. </p><p>But things could always fall apart faster than a speeding drone. It’s the <a href=""https://www.foxnews.com/category/world/world-regions/middle-east"" rel=""noopener"" target=""_blank"">Middle East</a>.</p><p>No matter what you think of Trump, his war of choice, his apocalyptic rhetoric or his entire presidency, he’s not crazy. He followed a similar path in his tariff crusade, threatening draconian levies before reaching 11th-hour compromises.  As he himself says, he’s a dealmaker. That’s what he does.</p><p><a href=""https://radio.foxnews.com/podcast/the-media-buzzmeter/"" rel=""noopener"" target=""_blank""><strong><u>SUBSCRIBE TO HOWIE'S MEDIA BUZZMETER PODCAST, A RIFF ON THE DAY'S HOTTEST STORIES</u></strong></a></p><p>Most media accounts are portraying Trump as caving in or backing down. That’s fair commentary.</p><p>But what really happened is that Trump found a way to avoid doing what he was never actually going to do in the first place.</p>",https://www.foxnews.com/media/trumps-last-minute-delay-why-never-going-obliterate-iran-first-place,2026-04-09
