,title,text,link,publish_date
18,Ex-NFL star Troy Aikman drops theory about cause of early season injuries,"<p>Former <a href=""https://www.foxnews.com/category/sports/nfl/dallas-cowboys"" rel=""noopener"" target=""_blank"">Dallas Cowboys</a> star Troy Aikman offered his own theory as to why there have been a spate of early-season injuries in the NFL over the last few years.</p><p>The Pro Football Hall of Famer said he believed the NFL’s rules to <a href=""https://www.foxnews.com/category/sports/injuries"" rel=""noopener"" target=""_blank"">help players avoid injuries</a> may actually be the cause of them.</p><p><a href=""https://www.foxnews.com/sports"" rel=""noopener"" target=""_blank""><strong>CLICK HERE FOR MORE SPORTS COVERAGE ON FOXNEWS.COM</strong></a></p><p>On Friday's <a href=""https://www.youtube.com/watch?v=bZh9zn-xAbA"" rel=""nofollow noopener"" target=""_blank"">""Rodeo Time Podcast,""</a> Aikman fondly remembered doing two-a-day practices in Wichita Falls, Texas, where the Cowboys would hold training camp in the summer. He suggested that while players aren’t as ""taxed"" as they were in the 1980s and 1990s during camps, they may not be as prepared for the toll their bodies take at the beginning of the season.</p><p>""I think they only wear pads one day a week or one time a day, and they have a walk-through, and then after, I don’t know how it all reads, but it’s pretty player friendly and favorable,"" Aikman said. ""And a lot of it, whenever they negotiate the CBA, the owners tend to always win on the financial side of things. And then the players say, ‘Well, all right, then we’re not gonna practice as long, or we’re not gonna practice as often.’ So, then they tend to get concessions when it comes to how much time they’re actually at facilities.</p><p><a href=""https://www.foxnews.com/sports/super-bowl-champion-bryce-huff-retires-from-nfl-27"" rel=""noopener"" target=""_blank""><strong>SUPER BOWL CHAMPION BRYCE HUFF RETIRES FROM NFL AT 27</strong></a></p><p>""I think the only ones who don’t have a voice in those negotiations are the coaches. They kind of have to wait till the dust settles and say, ‘All right, just how often do we get them?’ But some of it is that we see, too, is a lot of the reasons I think that we see so many injuries, especially early in the year. A lot of soft tissue injuries, a lot of muscle pulls, and things of that nature is the players, they’re just not able to train the way that we once did, they’re not able to callous their bodies as easily. Not that they’re not training hard and all that, but it’s different training on your own as opposed to being on the football field practicing football movements.""</p><p>Aikman made clear he was a fan of making changes in the name of player safety, but worried they may do more harm than good for some.</p><p>Cincinnati Bengals’ Joe Burrow, Minnesota Vikings’ J.J. McCarthy, San Francisco 49ers’ Brock Purdy and Baltimore Ravens’ <a href=""https://www.foxnews.com/category/person/lamar-jackson"" rel=""noopener"" target=""_blank"">Lamar Jackson</a> were among the quarterbacks to miss time early last season.</p><p>Player safety is set to be thrust back into the spotlight as the <a href=""https://www.foxnews.com/sports/nfl-exploring-potential-thanksgiving-eve-game-season"" rel=""noopener"" target=""_blank"">NFL reportedly eyes a Thanksgiving Eve</a> game with the possibility of expanding to an 18-game schedule in the future.</p><p><i><strong>Follow Fox News Digital’s</strong></i><a href=""https://twitter.com/FoxNewsSports_"" rel=""nofollow noopener"" target=""_blank""><i><strong> <u>sports coverage on X</u></strong></i></a><i><strong> and subscribe to</strong></i><a href=""https://www.foxnews.com/newsletters"" rel=""noopener"" target=""_blank""><i><strong><u> the Fox News Sports Huddle newsletter</u></strong></i></a><i><strong>.</strong></i></p>",https://www.foxnews.com/sports/ex-nfl-star-troy-aikman-drops-theory-about-cause-early-season-injuries,2026-03-15
19,"US could take Iran’s main oil export hub ‘at a time of our choosing,’ Jack Keane says","<p>Retired four-star Army Gen. Jack Keane said the United States could choose to seize Iran’s main oil export hub, warning the regime that its most critical economic lifeline remains vulnerable as U.S. forces continue dismantling<strong> </strong>Tehran’s military capabilities.</p><p>""We can take <a href=""https://www.foxnews.com/category/world/conflicts/iran"" rel=""noopener"" target=""_blank"">Kharg Island</a> at a time of our choosing, and we choose not to take that now,"" Keane told ""Sunday Morning Futures.""</p><p>""Would we take it in the future? Those options are there for the president, likely towards the end of this? Because, if we take Kharg Island, either we occupy it or blockade it, there's a number of things that we can do.""</p><p><a href=""https://www.foxnews.com/media/iran-holds-world-energy-hostage-nightmare-strait-hormuz-sea-mines"" rel=""noopener"" target=""_blank""><strong>IRAN HOLDS WORLD ENERGY HOSTAGE WITH 'NIGHTMARE' STRAIT OF HORMUZ SEA MINES, FORMER CENTCOM OFFICIAL WARNS</strong></a></p><p>Keane said such a move would effectively put the Iranian regime in ""checkmate,"" given how heavily its economy depends on the island.</p><p>""Now we [would] own all of their major assets. It's 50% of their budget, 60% of the revenue, 80, 90% of the distribution points for their oil,"" he said.</p><p><a href=""https://www.foxnews.com/politics/new-satellite-images-reveal-fires-damage-iranian-naval-bases-after-us-israeli-strikes"" rel=""noopener"" target=""_blank""><strong><u>BEFORE-AND-AFTER SATELLITE IMAGERY OFFERS A RARE LOOK AT DAMAGE INSIDE IRAN</u></strong></a></p><p>""So it is clearly a <a href=""https://www.foxnews.com/category/politics/foreign-policy/middle-east"" rel=""noopener"" target=""_blank"">strategic asset</a>, but we will do that at a time of our choosing.""</p><p>Keane’s remarks come as the U.S. and Israel continue their military campaign against Iran, targeting the regime’s offensive capabilities and threatening further action against its energy infrastructure.</p><p>The remarks also come after President <a href=""https://www.foxnews.com/category/person/donald-trump"" rel=""noopener"" target=""_blank"">Donald Trump</a> said Friday that the U.S. had carried out a bombing raid on the island.</p><p>""Moments ago, at my direction, the United States Central Command executed one of the most powerful bombing raids in the history of the Middle East, and totally obliterated every <a href=""https://www.foxnews.com/category/us/military"" rel=""noopener"" target=""_blank"">MILITARY target</a> in Iran’s crown jewel, Kharg Island,"" Trump wrote on <a href=""https://truthsocial.com/@realDonaldTrump/posts/116224324444349237"" rel=""nofollow noopener"" target=""_blank""><u>Truth Social</u></a>.</p><p>The island has a loading capacity of about 7 million barrels per day, and roughly 90% of Iran’s crude oil exports pass through it. Most of those exports are shipped to China and India, underscoring the island’s importance not only to Iran’s <a href=""https://www.foxnews.com/category/energy"" rel=""noopener"" target=""_blank""><u>energy</u></a> trade, but also to broader global oil markets.</p>",https://www.foxnews.com/media/us-could-take-irans-main-oil-export-hub-at-time-our-choosing-keane-says,2026-03-15
20,Top California librarian questioned about missing $650K tied to Dolly Parton child literacy program,"<p><a href=""https://www.foxnews.com/category/us/us-regions/west/california"" rel=""noopener"" target=""_blank"">California</a> state librarian Greg Lucas is facing scrutiny from lawmakers after roughly $650,000 tied to a statewide literacy program connected to Dolly Parton’s Imagination Library could not be accounted for.</p><p>The issue surfaced during a Thursday Senate Budget and Fiscal Review Subcommittee No. 1 on Education hearing, which examined how funds were distributed for California’s participation in the book-gifting program.</p><p>Documents shared by the subcommittee as <a href=""https://sbud.senate.ca.gov/system/files/2026-03/03.12.2026-sub-1-agenda.pdf"" rel=""noopener noreferrer nofollow"" target=""_blank""><u>part of its hearing agenda</u></a> claim that a nonprofit created to help administer the program reported spending roughly $1.2 million, while bank statements provided to Senate budget staff showed $555,000 in expenditures, leaving about $649,000 without supporting documentation.</p><p>""I find this to be incredibly concerning,"" said state Sen. Sasha Renée Pérez, D-Pasadena, chair of the subcommittee. ""There’s $650,000 that’s been unaccounted for in a program, a bipartisan effort that was intended to increase literacy among children. This is incredibly serious.""</p><p><a href=""https://www.foxnews.com/politics/trump-admin-uncovers-staggering-8-6-billion-suspected-california-small-business-fraud"" rel=""noopener"" target=""_blank""><strong>TRUMP ADMIN UNCOVERS 'STAGGERING' $8.6 BILLION IN SUSPECTED CALIFORNIA SMALL BUSINESS FRAUD</strong></a></p><p>State Sen. Shannon Grove, R-Bakersfield, also criticized the lack of documentation, saying the situation raised serious concerns about transparency and oversight.</p><p>""That makes no sense,"" Grove said during the hearing. ""And that reeks of horrific no transparency and potential fraud.""</p><p>The California state library did not immediately respond to Fox News Digital’s request for comment.</p><p>Lawmakers said <a href=""https://www.foxnews.com/politics/trump-backed-affordable-housing-overhaul-clears-senate-while-house-gop-raises-red-flags"" rel=""noopener"" target=""_blank"">Senate budget</a> staff had requested financial records from the Strong Reader Partnership, the nonprofit created to help administer the program, multiple times, including receipts, invoices and bank statements to corroborate expenses.</p><p><a href=""https://www.foxnews.com/us/ex-nonprofit-boss-allegedly-swiped-1-2m-meant-homeless-programs-fund-lavish-lifestyle-da-says"" rel=""noopener"" target=""_blank""><strong>EX-NONPROFIT BOSS ALLEGEDLY SWIPED $1.2M MEANT FOR HOMELESS PROGRAMS TO FUND LAVISH LIFESTYLE, DA SAYS</strong></a></p><p>According to the subcommittee, those requests were made on several occasions between November 2025 and February 2026, but the documentation had not been provided.</p><p>During the hearing, Lucas acknowledged that lawmakers had <a href=""https://www.foxnews.com/politics/state-financial-officers-put-bank-of-america-on-notice-for-allegedly-de-banking-conservatives"" rel=""noopener"" target=""_blank"">received bank statements</a> accounting for roughly $555,000 in spending but disputed the claim that the funds were unaccounted for.</p><p>""I don't believe that's correct,"" he said. ""I mean, we received a final report on the disposition of the money by the Strong Reader Partnership, which has expressed, and we've passed this on to you as well, the difficulty in obtaining some of this information because they no longer have any money or members of the partnership since the money was transferred to the Imagination Library.""</p><p>He added that his agency has repeatedly asked the nonprofit for additional records and pledged to continue requesting the information.</p><p><a href=""https://www.foxnews.com/media/proposed-california-wealth-tax-drives-billionaire-exodus-florida-real-estate-locals-confirm"" rel=""noopener"" target=""_blank""><strong>PROPOSED CALIFORNIA WEALTH TAX DRIVES BILLIONAIRE EXODUS TO FLORIDA REAL ESTATE, LOCALS CONFIRM</strong></a></p><p>A spokesperson for the state library <a href=""https://www.abc10.com/article/news/politics/lawmakers-question-california-state-library-over-missing-funds/103-b13d1e74-8ef1-4770-b4c7-8aa208301cd4"" rel=""noopener noreferrer nofollow"" target=""_blank""><u>told ABC10</u></a> in a statement: ""The California State Library takes seriously its responsibility to ensure transparency and accountability in the taxpayer dollars entrusted to it. The State Library has provided the Legislature with all documentation in its possession and has repeatedly requested additional records from the Strong Reader partnership. The California State Library remains committed to cooperating fully with all legislative oversight and maintaining accountability in the administration of public funds.""</p><p>Pérez gave Lucas seven days to produce the financial records, saying the subcommittee expected invoices and receipts detailing how the money was spent.</p>",https://www.foxnews.com/politics/top-california-librarian-questioned-about-missing-650k-tied-dolly-parton-child-literacy-program,2026-03-15
21,"Mamdani defends wife when confronted on work with anti-Israel author, decries rhetoric","<p>New York City Mayor <a href=""https://www.foxnews.com/category/person/zohran-mamdani"" rel=""noopener"" target=""_blank"">Zohran Mamdani </a>defended his wife, Rama Duwaji, on Friday during a press conference when confronted about her work with an author who called the Oct. 7 Hamas attacks, ""spectacular,"" and described Jewish Israelis as ""rootless, soulless ghouls.""</p><p>During the conference, a reporter asked Mamdani whether his wife was aware of the author's rhetoric before she took the job and whether such rhetoric was acceptable.</p><p>""I think that that rhetoric is patently unacceptable. I think it's reprehensible,"" <a href=""https://www.youtube.com/watch?v=NaBvmx4sBss"" rel=""noopener nofollow"" target=""_blank"">Mamdani stated</a>.</p><p>""As is common for freelance illustrators, the first lady was commissioned to illustrate an excerpt of a book by a third party. She has never engaged with or met with the author, nor has she seen the tweets that you're referring to. And we stand in our administration, and I can tell you our administration, which is separate from the first lady as she doesn't have a role within it, against bigotry of all forms,"" he said.</p><p><a href=""https://www.foxnews.com/politics/nyc-mayor-mamdanis-wife-liked-social-media-post-calling-oct-7-sexual-violence-investigation-hoax-report"" rel=""noopener"" target=""_blank""><strong>NYC MAYOR MAMDANI’S WIFE LIKED SOCIAL MEDIA POST CALLING OCT 7 SEXUAL VIOLENCE INVESTIGATION A ‘HOAX’: REPORT</strong></a></p><p>The Washington Free Beacon <a href=""https://freebeacon.com/democrats/zohran-mamdanis-wife-provided-illustration-for-essay-by-author-who-called-oct-7-spectacular-and-attacked-jewish-supremacist-vampires/"" rel=""noopener nofollow"" target=""_blank"">first reported</a> Thursday that Duwaji provided an illustration for Susan Abulhawa, an author who <a href=""https://everythingispolitical.com/readings/a-trail-of-soap"" rel=""nofollow noopener"" target=""_blank"">compiled several essays</a> for the collection, ""Every Moment Is a Life."" </p><p>Abulhawa wrote an op-ed after the <a href=""https://www.foxnews.com/category/world/hamas"" rel=""noopener"" target=""_blank"">Oct. 7 terrorist attacks</a> that called it ""a spectacular moment that shocked the world,"" according to The Washington Free Beacon.</p><p>In addition, the outlet flagged multiple social media posts, one in which she called Israelis ""rootless, soulless ghouls,"" from December. In September, Abulhawa called Israel a ""cultureless, rootless human aberration in the form of a manufactured 'nation,'"" and said, ""we live in the time of jewish supremacist demons.""</p><p>Abulhawa also called Israelis ""demonic parasite[s]"" in a post in November, according to The Washington Free Beacon.</p><p><a href=""https://www.foxnews.com/media/mamdani-confronted-the-view-over-appointee-who-called-homeownership-weapon-white-supremacy"" rel=""noopener"" target=""_blank""><strong>MAMDANI CONFRONTED ON 'THE VIEW' OVER APPOINTEE WHO CALLED HOMEOWNERSHIP 'WEAPON OF WHITE SUPREMACY'</strong></a></p><p>The mayor's office did not immediately respond to Fox News Digital's request for additional comment.</p><p>Duwaji also faced backlash last week over <a href=""https://www.foxnews.com/media/mamdanis-wife-liked-social-media-posts-cheering-on-hamas-oct-7-massacre-israelis-report"" rel=""noopener"" target=""_blank"">allegedly liking posts</a> that cheered the Oct. 7 attacks. Duwaji allegedly liked a February 2024 Instagram post claiming The New York Times’ investigation into sexual violence during the Oct. 7 attack was ""fabricated,"" according to <a href=""https://www.thefp.com/p/nyc-first-lady-liked-post-oct-7-rape-hoax"" rel=""nofollow noopener"" target=""_blank""><u>The Free Press</u></a>.</p><p><a href=""https://www.foxnews.com/media""><strong>CLICK HERE FOR MORE COVERAGE OF MEDIA AND CULTURE</strong></a></p><p>Duwaji, a Houston-born illustrator who identifies as Syrian and married Mamdani in early 2025, also liked several posts in the immediate aftermath of the Oct. 7 attacks that appeared critical of Israel, <a href=""https://jewishinsider.com/2026/03/zohran-mamdani-wife-rama-duwaji-social-media-oct-7/"" rel=""nofollow noopener"" target=""_blank""><u>Jewish Insider</u></a> first reported.</p><p>Abulhawa issued a response via video posted to X on Saturday.</p><p>""I want to speak about this accusation of antisemitism against me and also about the nature and requisites of racism in general. At the most basic level, I'll start with the word semite. Unlike the White Ashkenazi Jews attacking me, I am an actual Semitic person. Semitism is just another part of our identity that they have stolen,"" Abulhawa said. </p><p>She said she was disappointed by Mamdani's condemnation of her. </p><p>Abulhawa pointed Fox News Digital to her posted video when requested for further comment.  </p>",https://www.foxnews.com/media/mamdani-defends-wife-when-confronted-work-anti-israel-author-decries-rhetoric,2026-03-15
22,California Baptist punches NCAA Tournament ticket as Utah Valley suffers heartbreak,"<p>The Utah Valley Wolverines suffered immense heartbreak in the Western Athletic Conference (WAC) men’s basketball championship game against <a href=""https://www.foxnews.com/category/sports/ncaa/california-baptist-lancers"" rel=""noopener"" target=""_blank"">California Baptist</a> on Saturday.</p><p>The Wolverines were down 63-61 with about 10 seconds left to play. Utah Valley ran a play as they inbounded the ball from the sideline. Trevan Leonhardt got the pass and Isaac Davis set up the pick and roll. Leonhardt got around the defender and Davis had a wide-open opportunity.</p><p><a href=""https://www.foxnews.com/sports"" rel=""noopener"" target=""_blank""><strong>CLICK HERE FOR MORE SPORTS COVERAGE ON FOXNEWS.COM</strong></a></p><p>Davis went up for an alley-oop dunk, but just couldn’t finish it. He sat on the ground in disbelief.</p><p>The Lancers won the game and earned an automatic bid into the NCAA Men’s Basketball Tournament.</p><p>California Baptist star Dominique Daniels Jr. scored 23 points and nailed two 3-pointers in the final two minutes of the game to lift his team to the big dance. Bradey Henige had 11 points and Jonathan Griman added 10.</p><p><a href=""https://www.foxnews.com/sports/march-madness-2026-auto-bids-ncaa-conference-tournament-results"" rel=""noopener"" target=""_blank""><strong>2026 NCAA TOURNAMENT BERTH TRACKER: AUTOMATIC BIDS, CHAMPIONSHIP GAME TIMES, AND DEFENDING CHAMPS</strong></a></p><p>It will be the first tournament berth in California Baptist men’s basketball history. The school transitioned from Division II to Division I in 2018 and became eligible for the postseason during the 2022-23 season.</p><p>Utah Valley saw its seven-game winning streak snap. The school is <a href=""https://www.foxnews.com/category/sports/ncaa"" rel=""noopener"" target=""_blank"">25-7 overall this season</a> and could very well be on the outside looking in to the tournament. The Wolverines were the regular season Western Athletic Conference champions.</p><p>Next season, both teams will be joining the <a href=""https://www.foxnews.com/category/sports/ncaa/uc-irvine-anteaters"" rel=""noopener"" target=""_blank"">Big West Conference</a>. The WAC will rebrand as the United Athletic Conference.</p><p><i>The Associated Press contributed to this report.</i></p><p><i><strong>Follow Fox News Digital’s</strong></i><a href=""https://twitter.com/FoxNewsSports_"" rel=""nofollow noopener"" target=""_blank""><i><strong> <u>sports coverage on X</u></strong></i></a><i><strong> and subscribe to</strong></i><a href=""https://www.foxnews.com/newsletters"" rel=""noopener"" target=""_blank""><i><strong><u> the Fox News Sports Huddle newsletter</u></strong></i></a><i><strong>.</strong></i></p>",https://www.foxnews.com/sports/california-baptist-punches-ncaa-tournament-ticket-utah-valley-suffers-heartbreak,2026-03-15
