,title,text,link,publish_date
3,Spanberger denies ‘deal’ with swing-district Democrat as gerrymandering claims abound statewide,"<p>Virginia Gov. <a href=""https://www.foxnews.com/category/person/abigail-spanberger"" rel=""noopener"" target=""_blank"">Abigail Spanberger</a> flatly denied any deal was made in crafting the new boundaries of the Second Congressional District on the Eastern Shore and Virginia Beach after former Rep. Elaine Luria was followed out of an event by an individual demanding answers.</p><p>Luria, a Democrat who previously represented the Second District, is challenging Rep. Jennifer Kiggans, R-Va., in a race considered ""Even"" under the current map but that would skew Democratic under newly drawn boundaries that pull in <a href=""https://www.vpap.org/redistricting/2026/district-2/"" rel=""noopener nofollow"" target=""_blank"">heavily liberal Newport News</a> and the city of Franklin while carving out more moderate parts of Chesapeake.</p><p>An individual filmed Luria this week as she left an evening event in Hampton Roads and <a href=""https://x.com/greg_price11/status/2037286523087810860?s=20"" rel=""noopener nofollow"" target=""_blank"">asked twice</a>: ""Did you make a backroom deal with your best friend Abigail Spanberger to redraw the district?""</p><p>Luria ignored the man, but the video spread on social media as observers raised questions, given the tone of the redistricting effort led by Senate President L. Louise Lucas, D-Portsmouth.</p><p><a href=""https://www.foxnews.com/politics/virginia-judge-voids-redistricting-push-rules-lawmakers-overstepped-authority"" rel=""noopener"" target=""_blank""><strong>VIRGINIA JUDGE VOIDS REDISTRICTING PUSH, RULES LAWMAKERS OVERSTEPPED AUTHORITY</strong></a></p><p><a href=""https://www.foxnews.com/category/politics/elections/campaigning"" rel=""noopener"" target=""_blank"">Luria’s campaign</a> formally declined comment and Spanberger’s camp flatly denied the allegation.</p><p>""There was no deal,"" Spanberger’s top spokeswoman Libby Wiet told Fox News Digital.</p><p>Meanwhile, Kiggans campaign spokesman Joe Link said the clip of the confrontation ""speaks for itself.""</p><p>""Virginians should keep this in mind when they vote on April 21,"" Link told Fox News Digital, referring to the date of the special election on the Democrats’ redistricting amendment.</p><p><a href=""https://www.foxnews.com/opinion/5-virginia-congressmen-democrats-rejecting-voters-gerrymander-our-state"" rel=""noopener"" target=""_blank""><strong>5 VIRGINIA CONGRESSMEN: DEMOCRATS ARE REJECTING VOTERS TO GERRYMANDER OUR STATE</strong></a></p><p>Lucas did not respond to a request for comment but has been vocal online about the redistricting effort, mocking opponents like former Gov. Glenn Youngkin and Rep. Rob Wittman, R-Va., and swearing at Sen. <a href=""https://www.foxnews.com/category/person/ted-cruz"" rel=""noopener"" target=""_blank"">Ted Cruz</a>, R-Texas, by telling him she is ""f---ing finish[ing]"" what he purportedly started.</p><p>In January, Lucas took aim at Kiggans, suggesting she is intentionally trying to push her out of office. The 82-year-old progressive posted an image of Kiggans wearing a McDonald’s uniform and asking if a customer ""want[s] fries with that.""</p><p>Meanwhile, across the commonwealth, Republicans continue expressing outrage at the new map being put to voters as ""restor[ing] fairness"" on April 21, with the <a href=""https://www.foxnews.com/category/politics/elections/republicans"" rel=""noopener"" target=""_blank"">Prince William County GOP</a> posting an image of their exurban county ""sliced"" into five pieces next to an image of deli salami.</p><p>Prince William, Arlington and Fairfax counties appear to be anchors for most of Virginia’s congressional districts, which critics say will suppress, if not dilute, the reported 45% of the population that votes Republican or lives in rural areas.</p><p>In Rockingham County, which surrounds Harrisonburg and sits in the Shenandoah Valley and is currently represented in whole by GOP Rep. Ben Cline of Botetourt, Fairfax-based Del. Dan Helmer was pictured campaigning for the newly drawn 7th District, according to the local GOP.</p><p>Helmer dismissed claims he also helped draw his own district, saying he is doing what Democratic leaders assigned him to do in ""<a href=""https://www.foxnews.com/category/democrats"" rel=""noopener"" target=""_blank"">electing a Democratic majority</a>"" in his caucus role, according to the Virginia Mercury.</p><p>Del. Joe McNamara, R-Cave Spring, told the outlet he still believes Helmer ""craft[ed] maps for his benefit, and he’s just the next one.""</p><p>""My role was electing a Democratic majority two years ago so we could fight back against what Trump is doing and reelect it this year,"" Helmer told the Mercury in response. Helmer, who authored the state’s new sweeping gun ban, has two previously unsuccessful congressional bids under recent maps.</p><p>The <a href=""https://www.foxnews.com/category/politics"" rel=""noopener"" target=""_blank"">Rockingham County GOP</a> took issue with his previous campaign pledge to be a ""voice for Fairfax,"" hinting, as in Kiggans’ district, that Democrats are intentionally drawing seats for themselves.</p><p><a href=""https://www.foxnews.com/politics/florida-virginia-latest-battlegrounds-redistricting-war-between-trump-democrats"" rel=""noopener"" target=""_blank""><strong>THIS CRUCIAL STATE IS THE LATEST BATTLEGROUND IN REDISTRICTING WAR BETWEEN TRUMP AND DEMOCRATS</strong></a></p><p>""They have no shame,"" the party said in captioning a photo of Helmer campaigning locally.</p><p>Former first lady Dorothy McAuliffe, who also does not live in the majority-rural confines of the newly drawn ""lobster-shaped"" district, <a href=""https://virginiamercury.com/2026/03/11/dorothy-mcauliffe-launches-bid-for-congress-in-anticipated-7th-district/"" rel=""noopener nofollow"" target=""_blank"">is also running for the seat</a>.</p><p>JP Cooney, a prosecutor who worked under much-maligned special counsel Jack Smith, is the third Democrat to seek the newly drawn district, further increasing Republicans’ ire at the process.</p><p>Earlier this week, Rep. Donald Beyer, an Alexandria Democrat, admitted that his party’s redistricting effort is aimed squarely at rebuking President <a href=""https://www.foxnews.com/category/person/donald-trump"" rel=""noopener"" target=""_blank"">Donald Trump</a>.</p><p>That comment led to outrage on the right, including from Virginia House Minority Leader Terry Kilgore.</p><p>Kilgore, of Gate City in <a href=""https://www.foxnews.com/category/us/us-regions/southeast/tennessee"" rel=""noopener"" target=""_blank"">Scott County along the Tennessee line</a>, represents one of the few areas rendered safe under the new map – if not simply because the aforementioned 45% of Republicans had to be collected somewhere.</p><p>""This is manifestly unfair for the Commonwealth of Virginia. We’re a 51-49 state, not a 90-10 state. If they’re willing to silence nearly half of the Commonwealth’s voters in the name of ‘fairness’ what else are they willing to do?"" Kilgore told Fox News Digital.</p><p>His area is represented by Rep. Morgan Griffith, a Republican who collects a swath of mountainous communities from Galax, Martinsville and Independence in the east to Cumberland Gap, Wise and coal-filled Grundy in the west.</p>",https://www.foxnews.com/politics/spanberger-denies-deal-swing-district-democrat-gerrymandering-claims-abound-statewide,2026-03-28
4,Cruz warns ‘radical Democrats’ will ‘burn it down’ if they win back Congress,"<p>Republican Sen. Ted Cruz insists that President <a href=""https://www.foxnews.com/category/person/donald-trump"" rel=""noopener"" target=""_blank"">Donald Trump</a> will be ""impeached over and over and over again"" if the Democrats win back control of the House in this year's midterm elections.</p><p>And the conservative firebrand and three-term senator from Texas, in a sit-down interview this week with Fox News Digital, argued that if Democrats win both the House and Senate majorities in the midterms, ""they will do whatever they can to burn it down,"" as he pointed to the agenda passed by Trump and Republicans in Congress.</p><p>As they fight to hold their slim majorities in both the House and Senate, Republicans are battling stiff political headwinds as the party in power in the nation's capital traditionally loses seats <a href=""https://www.foxnews.com/politics/fox-news-poll-early-look-2026-midterms"" rel=""noopener"" target=""_blank"">in the midterms</a>. And they also face a rough political climate fueled by economic concerns over persistent inflation, an unpopular war with Iran and Trump's underwater approval ratings.</p><p>""I think these midterm elections are unbelievably consequential,"" said Cruz, who won re-election in 2024 and isn't on the ballot this year.</p><p><a href=""https://www.foxnews.com/politics/trump-boosts-gop-war-chest-house-republicans-gear-up-high-stakes-midterm-fight"" rel=""noopener"" target=""_blank""><strong>TRUMP BOOSTS GOP WARCHEST AS HOUSE REPUBLICANS GEAR UP FOR HIGH-STAKES MIDTERM FIGHT</strong></a></p><p>And the senator pledged, ""I am all in fighting for us to win in the midterms, fighting for us to hold the House, fighting for us to hold the Senate and, ideally, grow our majorities in both houses.""</p><p>""If the Democrats take the House, no meaningful legislation will pass for the next two years, and we will see the president impeached over and over and over again. And by the way, it won't matter what for. They will impeach President Trump just because they hate him, because he is Donald Trump,"" <a href=""https://www.foxnews.com/category/person/ted-cruz"" rel=""noopener"" target=""_blank"">Cruz claimed</a>.</p><p><a href=""https://www.foxnews.com/politics/cruz-says-trumps-move-strike-iran-most-consequential-decision-his-presidency"" rel=""noopener"" target=""_blank""><strong>CRUZ: TRUMP'S MOVE TO STRIKE IRAN ‘MOST CONSEQUENTIAL DECISION’ OF HIS PRESIDENCY</strong></a></p><p>And he argued, ""We will see investigations attacking the administration in every House committee if they take the House.""</p><p>Cruz said implications for Trump and the GOP are even worse if Democrats also win back the Senate.</p><p>""If they take the Senate, we would see an almost complete halt of Senate confirmations — Cabinet members. I think these radical Democrats would leave cabinet offices empty, leave them vacant, rather than confirm President Trump's nominees. I think judicial nominations. If the Democrats took the Senate, they would essentially halt judicial nominations,"" he claimed.</p><p>And he charged, ""I think Chuck Schumer and the radicals are so extreme that if they get a majority, they will do whatever they can to burn it down.""</p><p>But Democrats argue it's President Trump who's lighting the match due to what Democratic Senatorial Campaign Committee chair Sen. Kirsten Gillibrand of New York called Trump's ""hurtful and harmful agenda.""</p><p>""President Trump is creating a toxic agenda that's harming people, and they're looking for Democratic leadership to take them out of this nightmare,"" Gillibrand argued in an interview last month with Fox News Digital.</p><p>And Democratic National Committee Rapid Response Director Kendall Witmer told Fox News Digital: ""If Democrats take Congress, the Republicans won’t be able to give massive tax breaks to billionaires, shutter nursing homes and rural hospitals, bomb foreign countries instead of feeding kids, or turn a blind eye to Trump’s open and egregious corruption.""</p><p>Cruz heads back <a href=""https://www.foxnews.com/category/us/us-regions/southwest/texas"" rel=""noopener"" target=""_blank"">home to Texas</a> this weekend, where he'll address the crowd Saturday in Dallas at the annual Conservative Political Action Conference, better known by its acronym CPAC.</p><p>But it's a stop on May 1 <a href=""https://www.foxnews.com/category/us/us-regions/midwest/iowa"" rel=""noopener"" target=""_blank"">in Iowa </a>— the state whose caucuses for half a century have kicked off the race for the Republican presidential nomination — that's sparking speculation that Cruz is gearing up for a second White House run.</p><p>Cruz was runner-up to Trump in the combustible 2016 GOP presidential primaries, and he took a look at making another run in the 2024 cycle before deciding to seek re-election to the Senate.</p><p>""There will be plenty of time to make those decisions. I don't have an announcement for you today,"" Cruz answered when asked by Fox News Digital if seriously considering another White House campaign.</p><p>But he appears to be laying the groundwork for a possible bid, as he positions himself as a conservative alternative to Vice President JD Vance, who is currently the odds on favorite to be Trump's MAGA and America First heir.</p><p>Cruz has grabbed plenty of attention with his clashes with far-right figures, such as Tucker Carlson, and he's enhanced already strong standing among conservative leaders and donors. And he's bolstered his grassroots outreach with his popular and widely downloaded podcast, 'Verdict with Ted Cruz.'</p><p>In his Fox Digital interview, Cruz also shared what seemed to be the beginnings of a possible 2028 stump speech.</p><p>""I look back to the last year with President Trump in the White House and with a Republican Senate in the house, we have accomplished more in the last year than I've seen Congress and the president accomplish in the preceding 13 years that I was here. It is an incredible record of success that we've been able to produce. And so my focus is, number one, keep delivering results, keep delivering big wins for the American people,"" Cruz said.</p><p>Cruz spotlighted that he was ""the author of no tax on tips. I wrote that law."" The cuts were one of the tax provisions in the GOP's massive domestic policy bill that was passed nearly entirely along party lines last summer.</p><p>The senator also pointed to the so-called ""school choice"" provisions in the measure, as well as the Trump Accounts, tax-advantaged, IRA-style investment accounts for children under 18 that were also included in the law.</p><p>""Both of those provisions I wrote, both of them are in the bill,"" he noted.</p><p>And Cruz predicted that in ""10, 20, 30 years from now, those two provisions, school choice and the Trump accounts, will be, by an order of magnitude, the most consequential provisions in the entire bill. So we've got a record of wins, of victories for the American people to run on.""</p>",https://www.foxnews.com/politics/cruz-warns-radical-democrats-burn-down-win-back-congress,2026-03-28
5,WATCH: Travelers reveal who they blame for miles-long Houston airport lines as Trump rescues TSA pay,"<p>Neither party escaped travelers’ ire as some estimated they had to walk miles to reach the back of the security line and wait several hours to catch their flights at <a href=""https://www.foxnews.com/category/us/houston-and-galveston"" rel=""noopener"" target=""_blank"">Houston’s George Bush Intercontinental Airport</a>. </p><p>Fox News Digital asked travelers waiting in line at Bush who they believed was to blame for the massive wait times. One traveler named Tim simply responded: ""The politicians.""</p><p>On Thursday, lines at Bush snaked through check-in, baggage claim, out the doors and through underground subway tunnels. One traveler, who did not share his name, estimated that he and his family had to walk two miles to reach the back of the line. While many arrived several hours ahead of their scheduled departure times, those who did not could be seen frantically searching for terminals with smaller lines.</p><p>When it comes to who bears the blame, another traveler, who did not identify herself, answered: ""<a href=""https://www.foxnews.com/category/us/congress"" rel=""noopener"" target=""_blank"">All congressmen</a>.""</p><p><a href=""https://www.foxnews.com/politics/watch-airport-travelers-reveal-what-truly-think-about-ice-helping-tsa-massive-lines"" rel=""noopener"" target=""_blank""><strong>WATCH: AIRPORT TRAVELERS REVEAL WHAT THEY TRULY THINK ABOUT ICE HELPING TSA WITH MASSIVE LINES</strong></a></p><p>""All of them, regardless of their party,"" she added. ""They just need to do their jobs.""</p><p>Another, named Lancet, singled out the Democrats, who have demanded reinstating funding for the <a href=""https://www.foxnews.com/category/politics/executive/homeland-security"" rel=""noopener"" target=""_blank"">Department of Homeland Security</a> contingent on broad reforms to U.S. Immigration and Customs Enforcement and Border Patrol.</p><p>""I mean, honestly, look, the <a href=""https://www.foxnews.com/category/us/democratic-party"" rel=""noopener"" target=""_blank"">Democrats</a> are not voting on the DHS being reinstated. And they're the ones who pay for TSA from what I know,"" said Lancet. ""So, without paying the people, they obviously can't work.""</p><p>Houston’s George Bush Intercontinental Airport has been among the airports most heavily impacted by the <a href=""https://www.foxnews.com/politics/dhs-shutdown-breakthrough-comes-cost-republicans-funding-fights-nears-end"">partial government shutdown</a>, which has led to TSA agents missing paychecks for more than 40 days. Nearly 500 TSA agents have quit, and as of Friday, the agency has missed out on $1 billion in pay.</p><p>The partial shutdown was caused by disagreements in Congress over ICE and Border Patrol’s enforcement of immigration law in cities across the U.S., with Democrats making funding contingent on major changes in tactics and policy. Late Thursday night, the Senate passed a bill to fund most of DHS, including TSA, but it is not final. The House still needs to approve the measure and send it to the president before funding resumes and workers are paid.</p><p>President Donald Trump <a href=""https://www.foxnews.com/politics/trump-signs-executive-order-ensuring-tsa-workers-paid-during-dhs-shutdown"" rel=""noopener"" target=""_blank"">signed an executive order</a> Friday directing federal officials to ensure TSA employees are paid, calling the ongoing shutdown an ""emergency,"" </p><p>One traveler named Kevin, who was waiting in a security line in an underground subway corridor with hardly functioning air conditioning, did not hold back.</p><p>""Anybody who votes for a Democrat after this should be shipped out of the country,"" said Kevin. ""This is a Democrat mess.""</p><p><a href=""https://www.foxnews.com/media/fetterman-urges-fellow-democrats-do-right-thing-government-shutdown-takes-toll-workers"" rel=""noopener"" target=""_blank""><strong>FETTERMAN URGES FELLOW DEMOCRATS TO 'DO THE RIGHT THING' AS GOVERNMENT SHUTDOWN TAKES TOLL ON WORKERS</strong></a></p><p>At the front of the same line, which stretched halfway across the airport’s subway corridor, a traveler named April answered, ""I have no idea to be honest with you, but also the construction doesn't help either.""</p><p>""Having to go to Terminal A and Terminal E and going back and forth, yeah, it's not been great,"" she added.</p><p>One traveler named Maria, who despite the line bore a large smile and a chipper attitude, told Fox News Digital, ""You know what? I would only blame myself for not getting to the airport sooner.""</p><p>""I've been flying for many, many years, so I know. Got to get to the airports soon, guys. Get your Subway, get your Starbucks, and get to airports,"" she quipped, smiling.</p><p>""I don't know, man, I don't get political about these things,"" answered a traveler named Pinal. ""It is what it is, and we all are just going through the motions right now.""</p><p><a href=""https://www.foxnews.com/politics/democrats-hammer-ice-arresting-2-san-francisco-airport"" rel=""noopener"" target=""_blank""><strong>DEMOCRATS HAMMER ICE FOR ARRESTING 2 AT SAN FRANCISCO AIRPORT</strong></a></p><p>""There's a lot of people to blame,"" said a woman who did not identify herself. ""But at least I think the important part is everybody's working together to try to be as efficient as possible. I got here at 10, and my flight is at 1:30, so I got there in enough time, hopefully.""</p><p><strong>""</strong>It's just the division,"" remarked a young man named Nick. ""Everybody should be unified, working together, instead of just picking teams, fighting against each other, you know?"" </p><p>""People rather be on a team than rather just focus on a solution,"" Nick continued. ""If we could just focus more on the problem and working together rather than focusing on the differences, I think that would be a major change. But it's tough, man.""</p>",https://www.foxnews.com/politics/watch-travelers-reveal-who-blame-miles-long-houston-airport-lines-trump-rescues-tsa-pay,2026-03-28
