,title,text,link,publish_date
5,500 groups with $3B in revenues are behind the #NoKings protests and communist call for 'revolution',"<p>A network of about 500 groups with an estimated $3 billion in combined annual revenues is behind the coordinated nationwide ""No Kings"" protest Saturday, including communist groups who are using the day to call for a ""revolution,"" according to a Fox Digital News investigation. </p><p>According to a copy of the permit for the ""flagship"" march in St. Paul, Minn., Indivisible, a national well-heeled Democratic political advocacy organization funded by billionaire George Soros, is the lead coordinator for the protest.</p><p>But Fox News Digital has also identified key participation by a network of radical socialist and communist organizations funded by Neville Roy Singham, an American tech tycoon and acvowed communist living in China.</p><p>Over nearly a decade, Singham has financed a constellation of activist institutions that promote revolutionary socialist politics and frequently collaborate in protest campaigns, including the People’s Forum in New York, the Party for Socialism and Liberation, the ANSWER Coalition and CodePink, whose co-founder Jodie Evans is married to Singham. These groups work closely with the Freedom Road Socialist Organization.</p><p>They are all sending members to the protests and one group said they plan to bring a message of ""revolution"" to the protests.</p><p>On Friday evening, at the corner of N. Fremont Avenue and N. 37th Avenue in downtown Minneapolis, members of the Twin Cities chapter of the Party for Socialism and Liberation packed a car with stacks of bright red protest signs they had prepared at the Dream Shop for Saturday’s demonstrations. They are part of the Singham network and co-sponsors of the St. Paul protest.</p><p>The posters read ""NO KINGS. NO WAR."" with ""PARTY FOR SOCIALISM AND LIBERATION"" printed at the bottom. Activists stacked the signs upside down with their wooden picket handles attached as they loaded them into the vehicle, preparing to distribute them at the next day's main protest at the state capitol in St. Paul.</p><p>'<a href=""https://www.foxnews.com/politics/no-kings-calls-itself-leaderless-its-own-internal-documents-tell-very-different-story"" rel=""noopener"" target=""_blank"">NO KINGS' CALLS ITSELF LEADERLESS, BUT ITS OWN INTERNAL DOCUMENTS TELL A VERY DIFFERENT STORY</a></p><p>Across the country, similar preparations have been underway among socialist, communist and Marxist activist groups from the Singham network that have openly discussed using the demonstrations to spread what they describe as revolutionary organizing. </p><p>In New York, the People's Forum called on members to join the New York #NoKings protest. It's an organizing hub in the Singham network and sent Americans to Cuba in recent days to defend the communist regime there.</p><p>In Washington, D.C., Party for Socialism and Liberation called on supporters to assemble as part of a ""Socialist Contingent.""</p><p>In Grand Rapids, Mich., the Freedom Road Socialist Organization instructed supporters to gather at the Rosa Parks Circle stage at noon as part of what it described as the ""Anti-Trump Contingent.""</p><p>Freedom Road Socialist Organization activists have previously led aggressive demonstrations targeting Immigration and Customs Enforcement operations in Minneapolis. The group has an image on Instagram, using an upside-down triangle symbol that Hamas used to mark targets during attacks in Israel.</p><p>One message said, ""People everywhere are becoming increasingly hostile to the Trump agenda, and more sympathetic to revolution. Now is not the time to sit on the sidelines, it's the time to go out and join the people, get our revolutionary message in front of them, and turn a day of protest into long-term gains for the people's movements."" Communist leaders talk about ""people's movements.""</p><p><a href=""https://www.foxnews.com/us/power-couple-chaos-how-tycoon-activist-built-revolutionary-base-house-singham"" rel=""noopener"" target=""_blank""><strong><u>POWER COUPLE OF CHAOS: HOW A TYCOON AND ACTIVIST BUILT A 'REVOLUTIONARY BASE' AT THE HOUSE OF SINGHAM</u></strong></a></p><p>Posts circulating among socialist activist networks also explained ""Why socialists should mobilize to the No Kings protests this weekend.""</p><p>""It’s the time to go out and join the people, get out our revolutionary message in front of them and turn a day of protest into long-term gains for the people’s movement,"" one message said.</p><p>In Detroit, activists from Anakbayan, an organization aligned with communist movements in the Philippines, joined other groups within the Singham activist ecosystem.</p><p>Posts circulating from activists associated with the Denver chapter of the Freedom Road Socialist Organization included imagery referencing the Red Army Choir, Soviet symbolism and historical figures including Joseph Stalin and Mao Zedong.</p><p>The Maine chapter of the Party for Socialism and Liberation, working with activists connected to Democratic Socialists of America and the ANSWER Coalition, called on supporters to join what organizers described as a ""Unified Leftist Contingent.""</p><p>The message instructed activists to meet at the southwest corner of Montgomery Park, declaring that the contingent would stand against ""imperialism, capitalism and state violence.""</p><p>""These systems don’t fall without pressure,"" the message said. ""We are here to organize, disrupt and build power to win something new."" </p><p>The network’s messaging for the #NoKings echoes Singham’s own rhetoric describing the United States as a form of ""fascism"" and advocating organizing strategies rooted in Mao Zedong’s doctrine of a ""People’s War,"" which calls for revolutionary movements to embed themselves inside broader political struggles and radicalize them from within.</p><p><a href=""https://www.foxnews.com/us/fox-news-digital-analysis-how-minneapolis-agitator-networks-use-insurgency-tactics-hinder-ice"" rel=""noopener"" target=""_blank""><strong><u>FOX NEWS DIGITAL ANALYSIS: HOW MINNEAPOLIS AGITATOR NETWORKS USE INSURGENCY TACTICS TO HINDER ICE</u></strong></a></p><p>That strategy helps explain why the socialist groups are mobilizing inside the much larger demonstrations organized by mainstream progressive organizations, experts say. Large protests create massive audiences and national media attention, allowing smaller ideological movements to spread their messaging, recruit activists and build momentum for campaigns that extend well beyond a single day of demonstrations.</p><p>CodePink circulated graphics tying the protests to anti-imperialist messaging.</p><p>CodePink called for members to join demonstrations in cities including Washington, D.C., Los Angeles, Chicago, San Francisco and New York, linking the protests to opposition to U.S. policy toward Iran, Cuba, Venezuela and Palestine. Actress Jane Fonda joined a CodePink protest some days ago, protesting the war in Iran, and she will be at the St. Paul demonstration today.</p><p>One CodePink poster reads: ""NO WAR. NO IMPERIALISM. NO KINGS."" </p><p>In recent weeks, the group has supported Venezuelan strongman Nicholas Maduro, the late Iranian Ayatollah Ali Khomeini, President Xi Jinping.</p><p><i>Adriana James-Rodill contributed to this report.</i></p>",https://www.foxnews.com/us/500-groups-3b-revenues-behind-nokings-protests-communist-call-revolution,2026-03-28
6,New York heiress Belle Burden says ex-husband refused to give their 12-year-old a bedroom after divorce,"<p>Belle Burden nearly lost everything in a <a href=""https://www.foxnews.com/category/entertainment/events/divorce"" rel=""noopener"" target=""_blank"">dramatic divorce</a>, but for her, the hardest part was the fallout her children faced.</p><p>Burden, an heiress who shared the story of her split from hedge fund executive Henry Davis in her book, ""Strangers: A Memoir of Marriage,"" made a recent appearance on Molly Sims' podcast, <a href=""https://www.youtube.com/watch?v=dtzGGKjnMP4"" rel=""nofollow noopener"" target=""_blank"">""Lipstick on the Rim</a>,"" where she spoke about just how much her three kids were affected by her ex-husband's actions.</p><p>Two of the children weren't as immediately affected by the aftermath of the divorce — their oldest was staying with friends, and their middle child was in boarding school — but their youngest, Burden said, ""really wanted a bedroom"" at her father's new apartment.</p><p><a href=""https://www.foxnews.com/entertainment/new-york-heiress-belle-burdens-husband-convinced-her-alter-prenup-before-affair-shattered-marriage-memoir"" rel=""noopener"" target=""_blank""><strong>NEW YORK HEIRESS BELLE BURDEN'S HUSBAND CONVINCED HER TO ALTER PRENUP BEFORE AFFAIR SHATTERED MARRIAGE: MEMOIR</strong></a></p><p>""She was sending him links on Pottery Barn for her room,"" Burden explained of their daughter, who was 12 at the time. ""And he just really held firm about he was done with that stage of his life where he would parent a child in that way, with homework and dinners and all that kind of stuff.""</p><p>As she recounted in <a href=""https://www.foxnews.com/category/entertainment/genres/books"" rel=""noopener"" target=""_blank"">her memoir</a>, Davis told her that he wanted a divorce after she discovered he'd been having an affair. They'd been married for 20 years. He eventually moved into a two-bedroom apartment, then turned his spare bedroom into a home office.</p><p>""That's been the hardest part of this, and the most lasting part,"" Burden admitted.</p><p>When Sims and her co-host, Emese Gormley, expressed disbelief at Davis' choice, Burden added, ""I should be clear that it's not a circumstance where he moved across the country and had a whole new family. He lives blocks away from us. He keeps in touch with the kids. He's very kind and sweet with them. But he was very clear that he was not going to do the day-to-day, apply to college, all that kind of thing. And that really was like a switch going off.""</p><p>In her book, Burden explained that when their children were young, she devoted all her time and energy to raising them while Davis focused on his career, often joking, ""I don’t do bath, bed or homework."" While he didn't deal with the daily work of <a href=""https://www.foxnews.com/category/lifestyle/parenting"" rel=""noopener"" target=""_blank""><u>parenting</u></a>, he did pay attention to them, she wrote, taking them on special outings and trips regularly.</p><p>But in one of the conversations they had shortly after he left her, Burden wrote that he told her, ""You can have the house and the apartment. You can have custody of the kids. I don’t want it. I don’t want any of it.""</p><p>Burden had her lawyer send Davis a <a href=""https://www.foxnews.com/entertainment/gisele-bundchens-kids-tom-brady-have-different-rules-homes"" rel=""noopener"" target=""_blank""><u>custody agreement</u></a>, one that gave them each 50/50 custody, assuming he ""would have realized his mistake"" in not seeking more time with their children by then. Instead, she wrote, he ""returned the document stripped of all his time, including vacations, holidays, weeks during the summer. He included only dinner on Thursday nights.""</p><p>She admitted that she believes he genuinely thought he was being ""selfless"" by not formalizing the agreement and that he argued their children were old enough to decide for themselves when they wanted to see him. For bigger moments, like when their son had surgery, she said that he showed up, but ""for everyday issues, he responded with irritation.""</p><p>Sims asked Burden during her podcast whether Davis had ever spoken to her about what happened and why he distanced himself so firmly from her and their children.</p><p><a href=""https://www.foxnews.com/entertainment"" rel=""noopener"" target=""_blank""><strong><u>LIKE WHAT YOU’RE READING? CLICK HERE FOR MORE ENTERTAINMENT NEWS</u></strong></a></p><p>""The only things he's ever said were right at the beginning,"" she answered. ""He said, ‘I felt like a switch went off. I feel like a switch has gone off.'""</p><p>About a year after the split, she said she texted him late one night seeking answers. ""And he said, ‘I wish I had an answer for you. It’s not your fault. Something broke in me.' And that's the most I've gotten. And that's where my head has to rest.""</p><p><a href=""https://www.foxnews.com/entertainment/new-york-heiress-belle-burdens-ex-husband-gave-up-custody-children-after-affair-tears-family-apart-memoir"" rel=""noopener"" target=""_blank""><strong><u>NEW YORK HEIRESS BELLE BURDEN'S EX-HUSBAND GAVE UP CUSTODY OF CHILDREN AFTER AFFAIR TORE FAMILY APART: MEMOIR</u></strong></a></p><p>She said that when she thinks about it, she envisions the switch going off, ""but also like he was playing this role of <a href=""https://www.foxnews.com/category/entertainment/genres/family"" rel=""noopener"" target=""_blank"">husband and father</a>, and he wanted to play it, and he was all in. And then, like an actor on a stage, he just was like, ‘I’m done with this role,' takes off the costume, leaves the stage and can't do it gracefully.""</p><p>Sims asked how the children are coping with not having Davis in their lives as a true father figure, and Burden said, ""They are amazing because they love him, and they're protective of him, and they're actually very good now at reaching out to him to do things that are comfortable for him, like going to a hockey game or something like that.""</p><p><a href=""https://www.foxnews.com/newsletters?cmpid=fnfirstnl"" rel=""noopener"" target=""_blank""><strong><u>CLICK HERE TO SIGN UP FOR THE ENTERTAINMENT NEWSLETTER</u></strong></a></p><p>She said they're ""wonderful in navigating that,"" but added, ""For me as a mother, I think the biggest challenge for me is to acknowledge their reality, to say ‘this is what’s happening, this is unusual, that you do not live with your dad' … So I would say to my 12-year-old, ‘Your dad, I don’t know why, but he can't create a home for you right now. And that has to do with him, and that's not you.'""</p><p>As for Davis' reaction to the book's release, Burden admitted that she's heard he's ""not happy.""</p><p>She first published a snippet of her story in an essay for a column in <a href=""https://www.nytimes.com/2023/06/30/style/modern-love-married-to-a-stranger.html"" rel=""nofollow noopener"" target=""_blank"">The New York Times</a>, which he had to sign off on — she said she thought ""he didn't really see anything wrong with the narrative, like, you're a man, you're allowed to leave in this way."" But now that, as Sims put it, ""the whole world, every woman in America hates you,"" he's ""surprised.""</p><p>""He said, ‘I don’t think I come off well in this,'"" Burden shared.</p>",https://www.foxnews.com/entertainment/new-york-heiress-belle-burden-says-ex-husband-refused-give-12-year-old-bedroom-after-divorce,2026-03-28
7,"Patriots' Super Bowl appearance was no fluke, team legends say: 'They're for real'","<p>The <a href=""https://www.foxnews.com/category/sports/nfl/new-england-patriots"" rel=""noopener"" target=""_blank"">New England Patriots</a> were supposed to be ""mid,"" as Rob Gronkowski told Fox News Digital, but instead, they looked like the Pats of yesteryear.</p><p>New England stunned the football world with a 14-3 record and going all the way to the <a href=""https://www.foxnews.com/category/news-events/super-bowl"" rel=""noopener"" target=""_blank"">Super Bowl</a>, led by second-year quarterback Drake Maye.</p><p>Sure, New England perhaps benefited from an easy schedule in the regular season, and in the playoffs, they faced Jarrett Stidham instead of Bo Nix. The Super Bowl was not pretty, as they took a beating from the Seattle Seahawks.</p><p><a href=""https://www.foxnews.com/sports"" rel=""noopener"" target=""_blank""><strong>CLICK HERE FOR MORE SPORTS COVERAGE ON FOXNEWS.COM</strong></a><i><strong> </strong></i></p><p>But Gronkowski and one of his former teammates do not believe the 2025 Pats were any sort of fluke.</p><p>""What the New England Patriots did this season was incredible. And they're just going to keep on building on that from here on and going into next year, I'm sure they're going to be making the playoffs on a consistent basis now,"" Gronk told Fox News Digital. ""That's the expectation. They got the quarterback, they got the coach, they got the ownership, they got the foundation now, and you're going to see them competing at a high level every single year now, which is great for Patriot fans.""</p><p>The Patriots have simply built the next generation of success, and Gronkowski sees the same in Infiniti and their newly-released QX65. Gronk and <a href=""https://www.foxnews.com/category/person/julian-edelman"" rel=""noopener"" target=""_blank"">Julian Edelman</a> were on hand at Grand Central Terminal in New York for the unveiling.</p><p><a href=""https://www.foxnews.com/sports/kylie-kelce-reveals-her-dos-donts-talking-postpartum-women-oh-im-so-serious"" rel=""noopener"" target=""_blank""><strong>KYLIE KELCE REVEALS HER 'DOS AND DON'TS' OF TALKING TO POSTPARTUM WOMEN: 'OH, I'M SO SERIOUS'</strong></a></p><p>""I've always been about showing up at big moments and putting in the work behind the scenes, and that's what stood out to me with the Infiniti. They're really being intentional about how they move forward and what they're building next. That's how you got to be as a football player, as an athlete, you got to be very intentional and in order to stay at the top of your game and be able to compete at a top level. And that's what Infiniti is doing.""</p><p>""I was fortunate enough in my career to play in a lot of big moments, and that's exactly what you see with the Infiniti,"" Edelman added. ""How they are so detailed and have a purpose for everything that they do. When you look at the design of the car, the back, the interior's spacious, very detailed. I mean, it's just something that's been so cool. It's been a fun experience.""</p><p>Edelman, too, is ""very confident"" that the new-look Pats are here to stay.</p><p>""Anytime you got a head coach, a quarterback, an owner, and a GM working together and unison, it seems like every free agent they signed had a big moment, big role on the team. There was a lot of great things that happened.""</p><p>Edelman did warn Patriots fans to temper expectations just a bit and not expect another 14-win season. However, he does expect a more sound product on the field.</p><p>""it's time on task. You know, time on task with the quarterback. Get him ready with the offensive line, getting that offensive line kind of fixed up and get them working together more. I mean, they're a young group. So I'm really excited for the Patriots this year,"" he said.</p><p>""I think they're for real. They may go out and not have as many wins, but I think they're going to be a better football team this year.""</p><p><i><strong>Follow Fox News Digital’s </strong></i><a href=""https://twitter.com/FoxNewsSports_"" rel=""nofollow noopener"" target=""_blank""><i><strong>sports coverage on X</strong></i></a><i><strong>, and subscribe to </strong></i><a href=""https://www.foxnews.com/newsletters"" rel=""noopener"" target=""_blank""><i><strong>the Fox News Sports Huddle newsletter.</strong></i></a></p>",https://www.foxnews.com/sports/patriots-super-bowl-appearance-no-fluke-teams-legends-say-theyre-real,2026-03-28
8,"Fox News Entertainment Newsletter: David Spade slams Newsom and Bass, Howie Mandel calls out Kelly Ripa","<p><strong>TINSELTOWN TURMOIL</strong> - David Spade slams <a href=""https://www.foxnews.com/entertainment/david-spade-slams-gavin-newsom-karen-bass-over-terrifying-hollywood-downfall"" rel=""noopener"" target=""_blank"">Gavin Newsom and Karen Bass</a> over ‘terrifying’ Hollywood downfall.</p><p><strong>COMEDY CLASH</strong> - Howie Mandel calls out Kelly Ripa’s <a href=""https://www.foxnews.com/entertainment/howie-mandel-kelly-ripas-backhanded-compliment-tense-tv"" rel=""noopener"" target=""_blank"">backhanded compliment</a> in tense live TV moment.</p><p><strong>COMMITMENT PARADOX</strong> - Kurt Russell and Goldie Hawn <a href=""https://www.foxnews.com/entertainment/kurt-russell-goldie-hawn-never-married-deciding-43-years-ago-have-fun"" rel=""noopener"" target=""_blank"">never married</a>, deciding 43 years ago to 'have fun until we don't.'</p><p><strong>FRONT YARD RUMBLE</strong> - 'Reacher' star Alan Ritchson allegedly <a href=""https://www.foxnews.com/entertainment/reacher-star-alan-ritchson-allegedly-caught-video-throwing-punches-neighbor-his-kids-watch"" rel=""noopener"" target=""_blank"">caught on video</a> throwing punches at neighbor as his kids watch.</p><p><strong>ROYAL ISOLATION</strong> - Princess Beatrice 'distraught’ as <a href=""https://www.foxnews.com/entertainment/princess-beatrice-distraught-epstein-files-name-her-parents-fuel-marriage-rumors-expert"" rel=""noopener"" target=""_blank"">Epstein files name her parents</a>, fuel marriage rumors: expert.</p><p><a href=""https://x.com/FoxNewsEnt"" rel=""noopener"" target=""_blank""><strong><u>FOLLOW THE FOX ENTERTAINMENT TEAM ON X</u></strong></a></p><p><strong>SURVIVAL MODE</strong> - Josh Duhamel says he's now 72% <a href=""https://www.foxnews.com/entertainment/josh-duhamel-says-hes-now-72-ready-zombie-apocalypse-his-doomsday-cabin-fears-ai-robots-more"" rel=""noopener"" target=""_blank"">ready for a zombie apocalypse</a> at his 'doomsday' cabin but fears AI robots more.</p><p><strong>VENUE SHOWDOWN</strong> - Rio mayor <a href=""https://www.foxnews.com/entertainment/rio-mayor-bans-chappell-roan-from-performing-city-fan-incident-controversy"" rel=""noopener"" target=""_blank"">bans Chappell Roan</a> from performing in his city after fan incident controversy.</p><p><a href=""https://www.foxnews.com/newsletters?cmpid=fnfirstnl"" rel=""noopener"" target=""_blank""><strong><u>CLICK HERE TO SIGN UP FOR THE ENTERTAINMENT NEWSLETTER</u></strong></a></p><p><strong>INTIMATE RULEBOOK</strong> - Heather Graham slams ‘awkward’ new reality of <a href=""https://www.foxnews.com/entertainment/heather-graham-slams-awkward-new-reality-hollywood-sex-scenes"" rel=""noopener"" target=""_blank"">Hollywood sex scenes</a>.</p><p><strong>BREAKING POINT</strong> - Thomas Rhett admits fame led him to <a href=""https://www.foxnews.com/entertainment/thomas-rhett-admits-fame-led-him-living-double-life-nearly-destroyed-his-marriage"" rel=""noopener"" target=""_blank"">'living a double life'</a> that nearly destroyed his marriage.</p><p><strong>POP CULTURE CHECK </strong>- Think you’re on the pulse? Take the <a href=""https://www.foxnews.com/entertainment/from-hollywood-headlines-heartland-buzz-are-you-on-the-pulse"" rel=""noopener"" target=""_blank"">Entertainment Quiz</a> and find out!</p><p><a href=""https://www.foxnews.com/entertainment"" rel=""noopener"" target=""_blank""><strong><u>LIKE WHAT YOU’RE READING? CLICK HERE FOR MORE ENTERTAINMENT NEWS</u></strong></a></p>",https://www.foxnews.com/entertainment/fox-news-entertainment-newsletter-david-spade-slams-newsom-bass-howie-mandel-calls-out-kelly-ripa,2026-03-28
