,title,text,link,publish_date
0,"Inside Iran’s military: missiles, militias and a force built for survival","<p>Iran’s military is not designed to win a conventional war against the United States or Israel. It is designed to survive one, absorb damage and continue fighting over time, experts say.</p><p>That strategy is reflected both in how the force is built and how it is performing now, after weeks of sustained U.S. and Israeli strikes.</p><p>The scale of the campaign has been significant. More than 9,000 targets have been struck since the launch of <a href=""https://www.foxnews.com/politics/operation-epic-fury-destroys-irans-navy-cuts-missile-attacks-90-ongoing-campaign"" rel=""noopener"" target=""_blank"">Operation Epic Fury</a>, according to a March 23, 2026, fact sheet from U.S. Central Command, alongside more than 9,000 combat flights, hitting missile sites, air defenses, Islamic Revolutionary Guard Corps command centers and weapons production facilities.</p><p><a href=""https://www.foxnews.com/world/next-move-iran-seize-kharg-island-secure-uranium-risk-ground-war-escalation"" rel=""noopener"" target=""_blank""><strong>NEXT MOVE ON IRAN: SEIZE KHARG ISLAND, SECURE URANIUM OR RISK GROUND WAR ESCALATION</strong></a></p><p>U.S. officials say the objective is clear. </p><p>""We are targeting and eliminating Iran’s ballistic missile systems … destroying the Iranian Navy … and ensuring Iran cannot rapidly rebuild,"" Joint Chiefs of Staff Chairman Gen. Dan Caine said during a March <a href=""https://www.foxnews.com/category/tech/topics/pentagon"" rel=""noopener"" target=""_blank"">Pentagon briefing</a>.</p><p>But analysts caution that the picture is more complex.</p><p>""It’s a mixed bag,"" Nicholas Carl, a fellow at the conservative American Enterprise Institute think tank and assistant director of the Critical Threats Project, told Fox News Digital. ""On one hand, (Iran’s military) is badly degraded across the board, but the regime still retains a significant amount of capability."" </p><p><a href=""https://www.foxnews.com/world/inside-israeli-drone-unit-taking-iran-hezbollah"" rel=""noopener"" target=""_blank""><strong>INSIDE THE ISRAELI DRONE UNIT TAKING ON IRAN AND HEZBOLLAH</strong></a></p><p>At the heart of Iran’s military system is a deliberate dual structure: the conventional army, known as the Artesh, and the Islamic Revolutionary Guard Corps, a parallel force created after the 1979 revolution to safeguard the regime.</p><p>According to Carl, Supreme Leader <a href=""https://www.foxnews.com/category/person/ali-khamenei"" rel=""noopener"" target=""_blank"">Ali Khamenei</a> has shaped the armed forces throughout decades around one central objective: preserving the Islamic Republic and exporting its revolutionary ideology.</p><p>""You need to separate between the IRGC and the regular army,"" <a href=""https://www.foxnews.com/category/world/world-regions/middle-east"" rel=""noopener"" target=""_blank"">Middle East</a> intelligence expert Danny Citrinowicz told Fox News Digital. ""The IRGC gets all of the budgets — better salaries, better equipment, better everything.""</p><p>Carl describes the Islamic Revolutionary Guard Corps as a ""deeply ideological praetorian guard,"" while the Artesh remains a more conventional force tasked with defending Iran’s borders.</p><p>But the distinction is not absolute. </p><p>""The IRGC is probably the more dangerous of the two, but we cannot discount the threat that the regular military poses as well,"" Carl said.</p><p><a href=""https://www.foxnews.com/politics/trumps-iran-strategy-showcases-doctrine-unpredictability-amid-strike-threats-sudden-pause"" rel=""noopener"" target=""_blank""><strong>TRUMP’S IRAN STRATEGY SHOWCASES ‘DOCTRINE OF UNPREDICTABILITY’ AMID STRIKE THREATS AND SUDDEN PAUSE</strong></a></p><p>Iran’s missile program remains the backbone of its military power, even after <a href=""https://www.foxnews.com/world/trump-proven-right-irans-long-range-missile-capability-regime-targets-us-uk-base-experts-say"" rel=""noopener"" target=""_blank"">extensive strikes</a>.</p><p>The Islamic Revolutionary Guard Corps Aerospace Force has spent years building what Carl describes as the largest missile inventory in the Middle East.</p><p>U.S. officials say those capabilities have been significantly reduced with recent strikes. </p><p>""Iran’s ballistic missile shots fired are down 86% from the first day of fighting,"" Caine said in a Pentagon briefing earlier in March, adding that drone launches have dropped by roughly 73%.</p><p>Secretary of War <a href=""https://www.foxnews.com/category/person/pete-hegseth"" rel=""noopener"" target=""_blank"">Pete Hegseth</a> said in the same briefing that the campaign has sharply limited Iran’s ability to sustain attacks. </p><p>""The enemy can no longer shoot the volume of missiles they once did, not even close,"" he said. </p><p>But even U.S. officials acknowledge the threat persists. </p><p>""Iran will still be able to shoot some missiles … and launch one-way attack drones,"" Hegseth said.</p><p>Carl said the decline in fire has plateaued.</p><p>""Iranian missile and drone fire has <a href=""https://www.foxnews.com/world/more-than-90-iranian-missiles-intercepted-dangerous-imbalance-emerging"" rel=""noopener"" target=""_blank"">dropped precipitously … about 90%</a> since the war began… but that number has been consistent for weeks,"" he said. ""That means they still retain enough capability to sustain strikes across the region.""</p><p>Citrinowicz offered a similar assessment. </p><p>""They suffered blows, but still hold the ability and still have the capacity to launch missiles for weeks to come,"" he said.</p><p>U.S. estimates cited by Carl suggest roughly a third of Iran’s missile capabilities remain active.</p><p>""The regime still does have a significant capability to threaten targets across the region … especially as it demonstrates the ability to shoot beyond 2,000 kilometers,"" Carl said.</p><p><a href=""https://www.foxnews.com/media/why-trump-iran-seem-light-years-apart-any-possible-deal-end-war"" rel=""noopener"" target=""_blank""><strong>WHY TRUMP, IRAN SEEM LIGHT-YEARS APART ON ANY POSSIBLE DEAL TO END THE WAR</strong></a></p><p>The Pentagon says it has made major gains against <a href=""https://www.foxnews.com/category/us/military/navy"" rel=""noopener"" target=""_blank"">Iran’s naval forces</a>.</p><p>More than 140 Iranian vessels have been damaged or destroyed, according to U.S. Central Command.</p><p>Caine said U.S. forces have ""effectively neutralized"" Iran’s major naval presence in the region.</p><p>But analysts warn that Iran’s naval threat was never dependent on large ships.</p><p>The Islamic Revolutionary Guard Corps Navy is built around ""area denial capabilities,"" including fast attack craft, mines, missiles and drones designed to swarm adversaries and disrupt maritime movement.</p><p>""They still have the capacity — speedboats, drones, surface-to-sea missiles — allowing them to <a href=""https://www.foxnews.com/politics/irans-remaining-weapons-how-tehran-can-still-disrupt-strait-hormuz"" rel=""noopener"" target=""_blank"">block the Strait of Hormuz</a>,"" Citrinowicz said.</p><p>Carl cautioned against a common misconception.</p><p>""It’s not technically accurate to say the Strait of Hormuz is closed … Iran is selectively denying access … firing at some ships while allowing others to pass,"" he said.</p><p>""Iran has to do very, very little to achieve a meaningful effect.""</p><p><a href=""https://www.foxnews.com/world/hezbollah-iran-unleash-coordinated-cluster-bomb-strikes-israel-major-escalation"" rel=""noopener"" target=""_blank""><strong>HEZBOLLAH, IRAN UNLEASH COORDINATED CLUSTER BOMB STRIKES ON ISRAEL IN MAJOR ESCALATION</strong></a></p><p>U.S. officials say the campaign has achieved major progress in the air.</p><p>""We will have complete control of Iranian skies, uncontested airspace,"" Hegseth said.</p><p>Caine added that U.S. forces have already established ""localized <a href=""https://www.foxnews.com/category/us/military/air-force"" rel=""noopener"" target=""_blank"">air superiority</a>"" and are expanding operations deeper into Iranian territory.</p><p>But Iran’s air force was never the centerpiece of its strategy. Years of sanctions have left it reliant on aging aircraft and limited modernization, making it far less capable than its Western or regional adversaries.</p><p>""There is definitely a setback … but Iran was never built on an air force,"" Citrinowicz said.</p><p>Instead, Iran relies on missiles, drones and layered defenses.</p><p><a href=""https://www.foxnews.com/world/who-actually-runs-iran-right-now-key-power-players-trump-claims-talks-top-official"" rel=""noopener"" target=""_blank""><strong>WHO ACTUALLY RUNS IRAN RIGHT NOW? THE KEY POWER PLAYERS AS TRUMP CLAIMS TALKS TO 'TOP' OFFICIAL</strong></a></p><p>On the ground, Iran retains a key advantage: its forces have largely not been directly engaged.</p><p>The Artesh ground forces, which include tens of brigades, are positioned primarily to defend Iran’s borders, according to Carl’s report.</p><p>""The ground troops are still intact, nobody has invaded Iran,"" Citrinowicz said.</p><p>He noted that ground forces are increasingly launching drones, signaling a broader shift in how Iran fights.</p><p>Beyond its borders, Iran’s military power is extended through a network of proxy forces managed by the Islamic Revolutionary Guard Corps’ Quds Force.</p><p>Carl said the Quds Force provides ""leadership, materiel, intelligence, training and funds"" to allied militias across the Middle East, including Hezbollah, Hamas and the Houthis.</p><p>""The ‘Axis of Resistance’ is the central mechanism by which Iran can further regionalize the conflict … to endanger as many actors’ interests as possible,"" Carl said.</p><p><a href=""https://www.foxnews.com/politics/us-moves-airborne-troops-marines-iran-rejects-ceasefire-raising-potential-boots-ground"" rel=""noopener"" target=""_blank""><strong>US MOVES AIRBORNE TROOPS, MARINES AS IRAN REJECTS CEASEFIRE, RAISING GROUND WAR POTENTIAL</strong></a></p><p>Iran’s military is also structured to confront internal threats, reinforcing its core purpose: regime survival.</p><p>The result is a force built on redundancy, asymmetry and endurance.</p><p>Even after <a href=""https://www.foxnews.com/politics/new-satellite-images-reveal-fires-damage-iranian-naval-bases-after-us-israeli-strikes"" rel=""noopener"" target=""_blank"">weeks of sustained strikes</a>, Iran retains enough capability to continue launching missiles, harassing global shipping and leveraging proxy forces across the region.</p><p>It may be weakened, but it remains strategically dangerous. </p><p>""We cannot discount the threat that the Iranian military poses,"" Carl said, ""it remains a force capable of threatening regional and international security.""</p>",https://www.foxnews.com/world/inside-irans-military-missiles-militias-force-built-survival,2026-03-28
1,House GOP rams through new DHS funding plan with shutdown far from over,"<p>The House of Representatives passed a stopgap measure that would temporarily fund the Department of Homeland Security late Friday, but the 43-day shutdown could drag on for several more weeks.</p><p>The two-month funding extension approved by the House is likely dead on arrival in the Senate, where any funding bill needs to overcome a 60-vote threshold, meaning buy-in from a handful of Democrats. That hurdle has not stopped House GOP leadership from arguing that their rejection of a Senate-passed deal — and pitching a subsequent rival DHS funding proposal — is the way out of the shutdown.</p><p>""We're not going to split apart two of the most important agencies in the government and leave them hanging like that,"" <a href=""https://www.foxnews.com/category/person/mike-johnson"" rel=""noopener"" target=""_blank"">House Speaker Mike Johnson, R-La.,</a> told reporters leaving the U.S. Capitol on Friday night. ""We just couldn't do it.""</p><p>""House Republicans will have no part in reopening the border and stopping illegal immigration enforcement,"" Johnson said earlier Friday on ""The Ingraham Angle,"" in a scathing takedown of the Senate-passed deal that stopped short of funding Immigration and Customs Enforcement (ICE) and portions of U.S. Customs and Border Protection (CBP).</p><p><a href=""https://www.foxnews.com/politics/tsa-callouts-hit-houston-atlanta-new-orleans-hardest-450-officers-have-quit-nationwide"" rel=""noopener"" target=""_blank""><strong>TSA CALLOUTS HIT HOUSTON, ATLANTA, NEW ORLEANS HARDEST, 450 OFFICERS HAVE QUIT NATIONWIDE</strong></a></p><p>But the full-court press launched by House Republicans aimed at persuading the Senate to return to Washington to take up their bill is likely to fall on deaf ears in the upper chamber.</p><p>A GOP aide told Fox News Digital that ""the easiest way to end this shutdown is for the House to pass the Senate-passed bill.""</p><p>""We know the Democrats are not going to support a CR, in fact the Senate tried to pass CRs for the last 40 days and Dems have blocked Every. Single. One,"" they said.</p><p>Senators left Washington, D.C., for a two-week Easter recess after unanimously approving a DHS funding measure in the early morning hours Friday with some traveling abroad on congressional delegations.</p><p>""I would suggest that the Senate does come back and at least take a vote,"" House Republican Conference Chairwoman Lisa McClain said Friday. ""That is what they were elected to do. So they're going to stay out on recess for two weeks and not come back while people don't get paid. That's pretty sad.""</p><p>Republican Study Committee Chairman August Pfluger, R-Texas, also called on the Senate to return to Washington ""immediately"" to take up the House-passed measure in a statement late Friday. </p><p><a href=""https://www.foxnews.com/category/politics/house-of-representatives"" rel=""noopener"" target=""_blank"">House lawmakers</a> are also scheduled to be in recess for the next two weeks.</p><p>Left holding the tab in the cross-chamber feud are the tens of thousands of DHS employees working unpaid during the shutdown.</p><p>President Donald Trump moved Friday to shield TSA agents from further financial distress by taking executive action directing DHS to pay those employees with existing funds. </p><p>The roughly 50,000 agents have missed two full paychecks during the ongoing funding lapse, leading hundreds to quit their jobs and forcing others to grapple with mounting financial distress.</p><p>The president’s move is likely to alleviate lengthy wait times at TSA security checkpoints, though senior officials have warned of long-term impacts due to more than 500 agents quitting during the funding lapse.</p><p><a href=""https://www.foxnews.com/politics/dems-block-dhs-funding-after-gop-rejects-counter-thune-says-schumer-going-circles"" rel=""noopener"" target=""_blank""><strong>DEMS BLOCK DHS FUNDING AFTER GOP REJECTS THEIR COUNTER, THUNE SAYS SCHUMER 'GOING IN CIRCLES'</strong></a></p><p>However, other DHS personnel, such as those employed by the Federal Emergency Management Agency, the Cybersecurity and Infrastructure Security Agency, the U.S. Coast Guard and certain support staff working for ICE and CBP will still have their paychecks withheld until the department’s funding is restored. </p><p>""Anybody who shows up to work deserves to get a paycheck, and the Senate needs to come back and at least do their job,"" McClain told Fox News on Friday. </p><p><a href=""https://www.foxnews.com/category/democrats"" rel=""noopener"" target=""_blank"">Democratic lawmakers</a> are sure to spend the next several weeks blaming Republicans for the impasse after Johnson’s decision to reject the Senate deal. </p><p>""We're here dealing with a partisan spending bill that the Senate has already indicated is dead on arrival,"" House Minority Leader Hakeem Jeffries, D-N.Y., said on the House floor Friday. ""And so Republicans have taken the decision to own this shutdown decisively. There is no doubt.""</p><p>The short-term DHS funding patch passed by the House is a clean extension of government funding and has no partisan policy riders.</p><p>Trump also came out against the bill Friday afternoon in an interview with Fox News.</p><p>The bill notably does not include any of the <a href=""https://www.foxnews.com/politics/ship-has-sailed-what-dems-wont-get-dhs-deal-after-shunning-gop"" rel=""noopener"" target=""_blank"">reforms that Democrats have demanded</a> for six weeks to rein in immigration enforcement, including tightening warrant requirements and prohibiting agents from wearing masks.</p><p>Senate Majority Leader John Thune, R-S.D., who warned throughout the funding stalemate that nobody wins in a shutdown, has indicated that Democrats are less likely to get those demands met than when the funding lapse first started.</p><p>""I mean, I think that ship has sailed, and they kind of kissed that opportunity goodbye by failing to provide funding for those agencies,"" Thune said.</p>",https://www.foxnews.com/politics/house-gop-rams-through-new-dhs-funding-plan-shutdowns-end-remains-air,2026-03-28
2,Facial recognition helped crack alleged student murder by illegal migrant – new bill could ban it: ret. cop,"<p>A former Chicago Police Department chief of detectives says that a bill <a href=""https://www.foxnews.com/category/politics/house-of-representatives/legislation"" rel=""noopener"" target=""_blank"">introduced in the Illinois state house</a> just one day before Sheridan Gorman was killed has the potential to be detrimental to police in the state by banning the use of any biometric identification systems.</p><p>Police <a href=""https://www.foxnews.com/us/venezuelan-migrant-arrested-after-loyola-chicago-student-fatally-shot-near-campus"" rel=""noopener"" target=""_blank"">arrested Jose Medina-Medina, 25</a>, on Friday after he allegedly killed Loyola University Chicago student Gorman, who was 18, early on Thursday morning. Medina-Medina is an illegal immigrant from Venezuela who first entered the U.S. in 2023, when he was apprehended by U.S. Border Patrol and released into the U.S. under the Biden administration.</p><p>Medina-Medina allegedly shot and killed Gorman on a pier on Thursday, March 19, at around 1:06 a.m., according to an arrest report.</p><p>Democrat Illinois State Rep. Kelly Cassidy introduced a bill that would ban law enforcement from using biometric identification systems, including fingerprint-matching tools, facial recognition programs, iris scanners, as well as any other software that deals with biometric information, according to the bill's text. DNA isn't included in the biometric identifiers in Cassidy's bill.</p><p><a href=""https://www.foxnews.com/us/illinois-gov-priztker-admits-real-failures-slain-chicago-students-hometown-pays-tribute-lights"" rel=""noopener"" target=""_blank""><strong>ILLINOIS GOV. PRIZTKER ADMITS 'REAL FAILURES' AS SLAIN CHICAGO STUDENT'S HOMETOWN PAYS TRIBUTE IN LIGHTS</strong></a></p><p>If the bill was enacted, law enforcement agencies in the state wouldn't be able to use the Secretary of State's facial-recognition database.</p><p><a href=""https://www.foxnews.com/category/us/us-regions/midwest/illinois"" rel=""noopener"" target=""_blank"">Illinois House Bill 5521</a>, known as the Illinois Biometric Surveillance Act, was introduced on Feb. 6.</p><p><a href=""https://twitter.com/FoxTrueCrime"" rel=""noopener"" target=""_blank""><strong>FOLLOW THE FOX TRUE CRIME TEAM ON X</strong></a></p><p>Notably, Medina-Medina was identified with the help of facial recognition. Images of the suspect were sent to a police database, and U.S. Customs and Border Protection identified the suspect as Medina. He was arrested at his apartment in <a href=""https://www.foxnews.com/category/us/chicago"" rel=""noopener"" target=""_blank"">Rogers Park</a>, according to the arrest report.</p><p>Retired Chicago Police Chief of Detectives Eugene Roy told Fox News Digital that without the help of facial recognition, his identification and arrest would have ""absolutely"" been delayed.</p><p><a href=""https://www.foxnews.com/newsletters"" rel=""noopener"" target=""_blank""><strong>SIGN UP TO GET TRUE CRIME NEWSLETTER</strong></a></p><p>""This case was cracked in large part due to looking at the videos from the cameras in the area surrounding the murder and to run them through different systems until they found a match,"" Roy said.</p><p>Roy said that if passed, the bill's effects would be ""crippling"" <a href=""https://www.foxnews.com/category/us/crime/police-and-law-enforcement"" rel=""noopener"" target=""_blank"">for detectives</a>.</p><p><a href=""https://www.foxnews.com/tips"" rel=""noopener"" target=""_blank""><strong>SEND US A TIP HERE</strong></a></p><p>""It's gonna be just short of crippling detective work,"" Roy said. ""You have to be able to identify people. When you build a case, it's not just based on an identification, it's just not based on a picture, it's based on the combination of a lot of things. It's based on identification. It's based on witness accounts. It's based on physical evidence. It's like building a wall. And if you take away the bricks that are at the foundation of that wall, the wall is going to crumble.""</p><p>Gorman, just 18 when she was killed, was described by loved ones as someone who radiated an ""unmistakable warmth"" and poured her energy into things she cared about, like her family, friends and community.</p><p><a href=""https://link.podtrac.com/cjdr_fnd_article"" rel=""noopener"" target=""_blank""><strong>LISTEN TO THE NEW 'CRIME &amp; JUSTICE WITH DONNA ROTUNNO' PODCAST</strong></a></p><p>While Gorman is from New York, close ones say she brought that same type of energy to Loyola University Chicago, where she ""had begun building the next chapter of her life,"" according to her obituary.</p><p>Fox News Digital obtained an arrest report that shows Medina-Medina was seen unmasked while waiting for an elevator in his apartment building's lobby. An engineer for the building told detectives that he knew the suspect, noting he had a ""very distinct limp and gait.""</p><p><a href=""https://www.foxnews.com/category/us/true-crime"" rel=""noopener"" target=""_blank""><strong>LIKE WHAT YOU'RE READING? FIND MORE ON THE TRUE CRIME HUB</strong></a></p><p>That gait, in addition to a positive identification from facial recognition, resulted in Medina-Medina's arrest.</p><p>Medina-Medina told officials in 2023 that he was living at Leone Beach Park fieldhouse in Rogers Park in 2023, which was being used as a city-sponsored shelter for migrants. The shelter closed in 2024, according to <a href=""https://southsideweekly.com/five-park-district-migrant-shelters-to-close-summer-programming-to-resume/"" rel=""nofollow noopener"" target=""_blank"">South Side Weekly</a>.</p><p>In an earlier statement to Fox News Digital, the Gorman family said they are <a href=""https://www.foxnews.com/category/politics"" rel=""noopener"" target=""_blank"">disappointed with policies</a> that allowed <a href=""https://www.foxnews.com/category/us/immigration"" rel=""noopener"" target=""_blank"">Medina-Medina to remain in the country</a>.</p><p>""When systems fail—whether through <a href=""https://www.foxnews.com/category/us/crime/police-and-law-enforcement"" rel=""noopener"" target=""_blank"">release decisions</a>, lack of coordination, or unwillingness to act—the consequences are not abstract. They are real. And in our case, they are permanent,"" the family wrote.</p><p>In a statement to Fox News Digital, Cassidy said that people shouldn't look at ""anecdotes.""</p><p>""Just as with all bills introduced in our body, HB5521 is a work in progress aimed at curtailing the abuses of biometric data we’ve most recently seen during Operation Midway Blitz. It is tragic that some people want to use individual tragedies to justify the use of flawed technologies that risk the private information of millions in our state,"" Cassidy said. </p><p>""Rather than look at anecdotes, we should know that facial recognition technology is demonstrably inaccurate. It is curious that in discussing this issue, we hear about particularly heinous and troubling crimes, but nothing about people being misidentified by facial recognition technology and held for hours (if not days) based on system errors. House Bill 5521 does not limit state and local police from investigating crimes. It simply protects the privacy of millions of Illinois residents simply because they have an Illinois driver’s license.""</p>",https://www.foxnews.com/us/facial-recognition-helped-crack-alleged-student-murder-illegal-migrant-new-bill-could-ban-it-ret-cop,2026-03-28
