,title,text,link,publish_date
0,Restaurants revive retro pricing for anniversaries — but does the trend make ‘cents’?,"<p>Restaurants are increasingly leaning into nostalgia with limited-time promotions that bring back menu prices from decades ago to help celebrate anniversaries.</p><p>Across the country, eateries marking milestone birthdays are temporarily slashing prices, offering everything <a href=""https://www.foxnews.com/food-drink"" rel=""noopener"" target=""_blank"">from burgers and cocktails</a> priced as they were when the restaurants first opened to specials tied to the anniversary number — such as $1.65 fries for 65 years in business.</p><p>At Burgerville, a Pacific Northwest burger chain that celebrated its 65th anniversary on March 10, customers could purchase items such as $1.65 small fries, a $1.65 fountain drink and a $2.65 original cheeseburger for one day only.</p><p><a href=""https://www.foxnews.com/food-drink/retro-refined-jell-o-salad-savory-gelatin-dishes-make-unexpected-return"" rel=""noopener"" target=""_blank""><strong>FROM RETRO TO REFINED: JELL-O SALAD AND SAVORY GELATIN DISHES MAKE UNEXPECTED RETURN</strong></a></p><p>""Sixty-five is such an incredible milestone for Burgerville,"" CEO Kyle Welch said in a statement. ""We love taking this moment to look back, and also to look ahead, continue innovating, and serving our communities with quality, delicious, local meals for the next 65 to come.""</p><p>Burgerville opened its first location in Vancouver on March 10, 1961, and has since expanded to more than 40 restaurants throughout Oregon and Washington, according to the company.</p><p>Other restaurants are tying anniversary celebrations to nostalgic menu pricing and historic dishes.</p><p><a href=""https://www.foxnews.com/food-drink/americans-split-grandma-candies-caramels-circus-peanuts-spark-online-debate"" rel=""noopener"" target=""_blank""><strong>AMERICANS SPLIT OVER ""GRANDMA CANDIES"" AS CARAMELS AND CIRCUS PEANUTS SPARK DEBATE</strong></a></p><p><a href=""https://www.foxnews.com/category/us/new-orleans"" rel=""noopener"" target=""_blank"">In New Orleans,</a> several long-running restaurants are marking milestone anniversaries with special menus and retro promotions, <a href=""https://www.axios.com/local/new-orleans/2026/03/04/restaurant-anniversaries-special-menu"" rel=""noopener"" target=""_blank"">Axios reported</a> this month. Tujague’s, which dates back to 1856, is celebrating its 170th year with $1.70 Grasshopper cocktails, a drink that was invented at the restaurant.</p><p>Brennan’s, meanwhile, is commemorating its 80th anniversary with $80 multi-course meals featuring signature dishes spanning eight decades.</p><p><a href=""https://www.foxnews.com/category/us/las-vegas"" rel=""noopener"" target=""_blank"">In Las Vegas,</a> Carmine’s Pizza Kitchen celebrated 50 years in business with a promotion last month that recreated prices from its opening era. During the anniversary event, diners could order $3.50 large cheese pizzas, $1.99 meatballs and 95-cent salads, matching prices from the restaurant’s early days.</p><p><a href=""https://www.foxnews.com/newsletters?cmpid=fnfirstnl"" rel=""noopener"" target=""_blank""><strong>CLICK HERE TO SIGN UP FOR OUR LIFESTYLE NEWSLETTER</strong></a></p><p>""Vegas has given me this, so that’s why I’m doing this promotion,"" owner Carmine Vento told <a href=""https://neon.reviewjournal.com/dining-out/vegas-pizzeria-celebrates-50-years-with-50k-giveaway-and-70s-prices-3328946/"" rel=""nofollow noopener"" target=""_blank"">Neon Las Vegas</a> at the time. ""It’s about saying thank you to Las Vegas. I’m very proud of what I’ve accomplished.""</p><p>The promotions, which appeal to budget-conscious consumers and tap into nostalgia, reflect a broader industry tactic known as ""throwback pricing,"" <a href=""https://www.nrn.com/restaurant-operations/restaurants-tap-throwback-pricing-trend-to-entice-budget-conscious-consumers"" rel=""nofollow noopener"" target=""_blank"">Nation's Restaurant News</a> (NRN) reported last year, with even major chains taking part.</p><p>At the time, White Castle had just announced it would offer six Original Sliders for $4 — pricing the burgers at about 67 cents each, roughly what they cost in 2012 — as part of a promotional deal.</p><p><a href=""https://www.foxnews.com/lifestyle"" rel=""noopener"" target=""_blank""><strong>CLICK HERE FOR MORE LIFESTYLE STORIES</strong></a></p><p>""Being able to share an offer that takes us back in time — like our ‘6 Sliders for $4’ deal — helps feed the soul a little bit,"" Jamie Richardson, chief marketing officer at White Castle, told NRN. ""To be able to promote savings that harken back to 2012 is compelling, especially in a day and age where sticker shock for so many daily purchases can be real.""</p><p>Friendly’s previously celebrated its 90th birthday with 90-cent <a href=""https://www.foxnews.com/category/food-drink/recipes/cuisines/american"" rel=""noopener"" target=""_blank"">scoops of ice cream</a> during a limited promotion, while Planet Hollywood introduced a throwback menu at its Times Square location priced at the restaurant’s original 1991 menu prices.</p><p>Industry analysts say such promotions can draw customers in, though they may not always lead to repeat visits.</p><p><a href=""https://www.foxnews.com/category/lifestyle/quizzes"" rel=""noopener"" target=""_blank""><strong>TEST YOURSELF WITH OUR LATEST LIFESTYLE QUIZ</strong></a></p><p><a href=""https://www.foxnews.com/category/deals/trending"" rel=""noopener"" target=""_blank"">""Rollback pricing</a> can incentivize a one-time visit or order, but I am skeptical that it would result in repeat usage unless there is something super special about the occasion or item,"" Robert Byrne, senior director of consumer research at Technomic, told NRN. ""I would also suggest that rollback pricing runs the risk of reminding consumers exactly how expensive their prices have become, which creates another issue.""</p><p>Limited-time deals may be fleeting, but the nostalgic appeal can still be powerful across generations, according to the industry publication <a href=""https://www.restaurantbusinessonline.com/marketing/2023-nostalgia-loyalty-value-took-center-stage-restaurant-marketing"" rel=""nofollow noopener"" target=""_blank"">Restaurant Business.</a></p><p>The restaurant marketing blog <a href=""https://www.gourmetmarketing.net/blog/restaurant-promo-ideas-recapture-glory-days-service"" rel=""nofollow noopener"" target=""_blank"">Gourmet Marketing</a> makes a similar point. </p><p>""Nostalgia for the past is one of the most powerful promotional draws for restaurant customers,"" it argued in a post. ""Nostalgia influences people to spend more money, feel more social and feel better about themselves.""</p>",https://www.foxnews.com/food-drink/retro-pricing-restaurants-does-trend-make-cents,2026-03-15
1,Former college volleyball star Kaylie Ray opens up on viral clash with Arizona Democrat senator,"<p>Former Utah State volleyball star Kaylie Ray became a viral folk hero in the ""save women's sports"" movement after <a href=""https://www.foxnews.com/sports/democrat-state-lawmaker-debates-former-ncaa-volleyball-player-who-forfeited-sjsu-team-trans-athlete"" rel=""noopener"" target=""_blank"">sparring with</a> Arizona state senator Catherine Miranda. </p><p>Ray shared her experience enduring the <a href=""https://www.foxnews.com/sports/former-sjsu-volleyball-star-says-she-shared-beds-trans-teammate-without-knowing-athletes-birth-sex"" rel=""noopener"" target=""_blank"">San Jose State volleyball scandal</a> and leading a team forfeit in protest of a male athlete, at a state education hearing Tuesday, while lobbying for a bill that would provide protections for girls' and women's sports in Arizona. </p><p>Miranda responded by commenting on Ray's body before asking, ""so how competitive do you think you really are?"" </p><p>It did not go over well with Ray, during or after the hearing. </p><p><a href=""https://www.foxnews.com/sports"" rel=""noopener"" target=""_blank""><strong><u>CLICK HERE FOR MORE SPORTS COVERAGE ON FOXNEWS.COM</u></strong></a></p><p>""How could you look me in the eyes and ask me if I'm competitive. Obviously I'm standing in front of you fighting for something right now. I don't know what part of that is not competitive to you. But if you want to go toe-to-toe then we can go toe-to-toe,"" Ray told Fox News Digital. </p><p>Ray fired back in the chamber, reiterating her point in the same tone she began with. But she had to make an effort to keep her composure.</p><p>""I, in the moment, was trying to maintain professionalism, we're in a professional environment. I was just trying to be respectful and courteous,"" she said. ""But inside, I was fuming."" Ray even had to call her parents after the hearing, to vent.</p><p>When Miranda initially began to address Ray, the senator said, ""I mean, you look pretty healthy… You look very much in shape and strong."" </p><p>Ray didn't even know what to make of it.</p><p>""When she started saying those words, the only thing I was thinking is, ‘where could she possibly be going with this?’ she said. ""It was clear to me as she continued speaking that, for whatever reason, my physical appearance or stature should have some type of effect on <a href=""https://www.foxnews.com/category/entertainment/genres/competition"" rel=""noopener"" target=""_blank"">how competitive I am</a> with men. So I was definitely thrown off guard."" </p><p>Miranda and her office have not put out a statement addressing the incident or the backlash. Fox News Digital has reached out to Miranda's office multiple times for a response. </p><p>""They usually tuck their tales and run when they realize that they have lost the plot a little bit. I'm just reminded that common sense is not so common here. And I'm not sure what statement she can put out that can paint her in a good light,"" Ray said. ""It was not a logical argument in the slightest.""</p><p><a href=""https://www.foxnews.com/sports/olympic-legend-kaillie-humphries-speaks-out-against-sjsu-volleyball-scandal-handling-backs-brooke-slusser"" rel=""noopener"" target=""_blank""><strong>OLYMPIC LEGEND KAILLIE HUMPHRIES SPEAKS OUT AGAINST SJSU FOR VOLLEYBALL SCANDAL HANDLING, BACKS BROOKE SLUSSER</strong></a></p><p>During Miranda's response, she cited her own experience competing with ""men."" </p><p>""It's a sports mentality when you're growing up and how much competition that you'll take on. So it's not just a silver bullet for one community of sports players, it's the individual person on how competitive you wanna be. So you grew up one way. I grew up a different way. I would have taken on a man in a heartbeat. I've played in, I was the only girl sometimes in sports. But to have a man on my team, I would have welcomed it,"" Miranda said.</p><p>At no point in Miranda's response did she ever use the word ""transgender"" or even ""male"" or ""female."" She simply referred to male opponents as ""men.""</p><p><a href=""https://www.foxnews.com/sports/how-former-utah-state-volleyball-star-survived-sjsu-title-ix-scandal"" rel=""noopener"" target=""_blank""><strong>FORMER UTAH STATE VOLLEYBALL STAR SAYS SJSU TRANS SCANDAL CAUSED INJURED FINGERS, SHATTERED DREAMS</strong></a></p><p>According to a 2017 post in <a href=""https://hispanicengineer.com/manage-new/catherine-miranda-is-the-senator-representing-arizonas-27th-district/"" rel=""nofollow noopener"" target=""_blank""><u>Hispanic Engineer &amp; Technology</u></a>, Miranda previously spoke about her experience playing sports with her brother. </p><p>""Sports was my life. There were four girls and one boy in my family. My brother turned me into his ‘little brother’ so he could have someone to play sports with. I was a 100% tomboy,"" and claimed she was the only girl to play in a local little league, the website reported.</p><p>Ray says she also has had brothers and competed against them casually, but doesn't believe the experience is applicable to high-level sports, especially at the Division I NCAA level.</p><p>""I have brothers too. I know what it's like to grow up competing with boys. But around the time that puberty hit, there was a drastic difference,"" Ray said. </p><p>""I played volleyball from the time I was eight, and in high school, my brother, my older brother… my mom made him try volleyball."" </p><p>Ray said she refused to even practice with her brother and his male teammates at that level. </p><p>""It was dangerous,"" she said. ""It's silly that I had to explain that to her.""</p><p>Ray said she would accept an apology if Miranda offers one. </p><p>""I think if she were to give me a genuine apology I would accept it. Obviously, she comes from a place of ignorance,"" Ray said. ""I would definitely need to see some action on her end to show that she understands and that she recognizes truth, basic truth."" </p><p><i><strong>Follow Fox News Digital’s </strong></i><a href=""https://twitter.com/FoxNewsSports_"" rel=""nofollow noopener"" target=""_blank""><i><strong><u>sports coverage on X</u></strong></i></a><i><strong>, and subscribe to </strong></i><a href=""https://www.foxnews.com/newsletters"" rel=""noopener"" target=""_blank""><i><strong><u>the Fox News Sports Huddle newsletter</u></strong></i></a><i><strong>.</strong></i></p>",https://www.foxnews.com/sports/kaylie-ray-arizona-senator-womens-sports-hearing,2026-03-15
2,"11-year-old accused of premeditated murder in brother’s death can’t be tried as adult, former DA says","<p>An 11-year-old Colorado boy is facing a <a href=""https://www.foxnews.com/category/us/crime/homicide"" rel=""noopener"" target=""_blank"">first-degree murder charge</a> in the death of his 5-year-old brother — a stunning and highly unusual case that legal experts say is almost unheard of under state law.</p><p>Authorities in Arapahoe County say deputies responded Tuesday evening to a report of a child’s death at a home in Centennial. When they arrived, they found the 5-year-old boy dead. By Wednesday, investigators had identified the child’s 11-year-old brother as the suspect and announced the case was being investigated as a homicide.</p><p>The cause of death has not yet been released.</p><p>The <a href=""https://www.foxnews.com/category/us/us-regions/west/colorado"" rel=""noopener"" target=""_blank"">juvenile suspect is being held</a> at the Marvin W. Foote Youth Services Center in Centennial. Authorities stressed there is no ongoing threat to the community and, because both children are minors, details about the case remain limited.</p><p><a href=""https://www.foxnews.com/us/brother-killed-after-teen-becomes-enraged-over-video-game-stabs-sibling-police"" rel=""noopener"" target=""_blank""><strong>BROTHER KILLED AFTER TEEN BECOMES 'ENRAGED' OVER VIDEO GAME, STABS SIBLING: POLICE</strong></a></p><p>""Our hearts go out to the family of these two young boys and to everyone in our community who is grieving this loss,"" Sheriff Tyler Brown said in a statement. ""Cases involving the homicide of children are among the most difficult <a href=""https://www.foxnews.com/category/us/crime/police-and-law-enforcement"" rel=""noopener"" target=""_blank"">our deputies and investigators</a> face. Our team is fully committed to a thorough investigation.""</p><p>The case is drawing attention because of the suspect’s age.</p><p>Christopher Decker, a legal analyst who spoke <a href=""https://kdvr.com/news/local/11-year-old-facing-first-degree-murder-expert-says-suspect-cannot-be-tried-as-adult/"" rel=""noopener"" target=""_blank"">with FOX31 Denver,</a> described the situation as ""highly unique"" under Colorado law.</p><p><a href=""https://www.foxnews.com/us/alleged-bullying-attack-leaves-12-year-old-girl-dead-after-defending-sister-mom-says"" rel=""noopener"" target=""_blank""><strong>ALLEGED BULLYING ATTACK LEAVES 12-YEAR-OLD GIRL DEAD AFTER DEFENDING SISTER, MOM SAYS</strong></a></p><p>""This is a highly unique case,"" Decker told FOX31. ""I cannot think of another case that comes to mind of an 11-year-old who may be facing a charge of murder in the first degree.""</p><p>Under Colorado law, Decker noted, the minimum age for a juvenile to be <a href=""https://www.foxnews.com/category/politics/executive/law"" rel=""noopener"" target=""_blank"">transferred to adult court</a> is 12 years old — meaning the 11-year-old suspect cannot be prosecuted as an adult.</p><p>""In a situation like this where we have an 11-year-old, the prosecution’s options to transfer the case to adult court are not there,"" he said.</p><p><a href=""https://www.foxnews.com/tips"" rel=""noopener"" target=""_blank""><strong>GOT A TIP?</strong></a></p><p>That means the case would remain in Colorado’s juvenile justice system, where sentencing options differ significantly from adult court proceedings.</p><p>Decker told FOX31 that Colorado’s juvenile law process would allow prosecutors to seek up to a seven-year sentence in custody for certain aggravated crimes.</p><p><a href=""https://x.com/FoxUSNews"" rel=""noopener"" target=""_blank""><strong>FOLLOW US ON X</strong></a></p><p>Because of the suspect’s age and the severity of the allegation, Decker said the case could spark broader discussion about whether existing laws should be revisited.</p><p>""There’s no doubt that a case like this — or what it appears to be — may be the type of case that some would champion for legislative change,"" he added.</p><p>The tragedy has also deeply impacted the <a href=""https://www.foxnews.com/category/us/education/teachers"" rel=""noopener"" target=""_blank"">local school community</a>.</p><p>Mary Bowens, principal of Timberline Elementary School, sent an email to parents Wednesday notifying them of the unexpected death of a kindergartener. The email, obtained by FOX31 did not identify the student by name and noted that the incident remains under investigation.</p><p>""Because this news is sensitive, we want to give parents and guardians an opportunity to speak with their students first,"" Bowens wrote, adding that the school would not initiate classroom discussions but would support students who raise questions or concerns.</p><p><a href=""https://www.foxnews.com/us"" rel=""noopener"" target=""_blank""><strong>CLICK HERE FOR MORE US NEWS</strong></a></p><p>The case is also drawing scrutiny from former 18th Judicial District Attorney George Brauchler, who discussed the legal implications on ""The Jeff and Bill Show"" podcast.</p><p>Brauchler emphasized that because the suspect is 11 years old, Colorado law does not allow prosecutors to pursue the case in adult court under any circumstances.</p><p>""Because this kid is 11, he can never be prosecuted as an adult under Colorado law,"" Brauchler said on the podcast. ""The law says you can’t prosecute him as an adult, which means this has to be resolved in juvenile court under Title 19, which is designed for rehabilitation. It is not designed for punishment.""</p><p>Brauchler explained that if prosecutors designate the child as what’s known as an aggravated juvenile offender, commonly referred to as an AJO, the maximum sentence would be between three and seven years in the Division of Youth Services.</p><p>""That’s it,"" he said. ""It can’t be any more than that amount.""</p><p>He added that parole could potentially be considered after roughly three years, and that in his view, the child would likely enter and leave the system as a juvenile.</p><p>""If they don’t pursue aggravated juvenile offending, the most he could get is two years,"" Brauchler said.</p><p>Brauchler also noted the emotional and legal complexity of the case for the family, since the parents of the victim are also the parents of the accused.</p><p>""The victim, statutorily and constitutionally, are the parents — who are also the parents of the child,"" he said, noting that a court-appointed representative could be assigned to help protect everyone’s interests.</p><p>The former district attorney also addressed the first-degree murder allegation itself, explaining that premeditation under Colorado law does not require long-term planning.</p><p>""Premeditation doesn’t require a specific amount of time,"" Brauchler said. ""It can happen in a matter of seconds.""</p><p>Fox News Digital reached out to the school and district attorney's office for comment. </p>",https://www.foxnews.com/us/11-year-old-accused-premeditated-murder-brothers-death-cant-tried-adult-former-da-says,2026-03-15
3,American Culture Quiz: Test yourself on tipping turmoil and burger buzz,"<p>The American Culture Quiz is a weekly test of our unique national traits, trends, history and people — including current events and <a href=""https://www.foxnews.com/travel"" rel=""noopener noreferrer"" target=""_blank"">the sights and sounds</a> of the United States.</p><p>This week's quiz highlights tipping turmoil, burger buzz — and a lot more.</p><p>Can you get all 8 questions right?</p><p>Give it a try and see how you do!</p><p><a href=""https://www.foxnews.com/lifestyle"" rel=""noopener"" target=""_blank""><strong><u>CLICK HERE FOR MORE LIFESTYLE STORIES</u></strong></a></p><p><i>To try your hand at more quizzes from Fox News Digital, </i><a href=""https://www.foxnews.com/category/lifestyle/quizzes"" rel=""noopener"" target=""_blank""><i><strong><u>click here</u></strong></i></a><i><strong>.</strong> </i></p><p><i>Also, to take our latest News Quiz — published every Friday — </i><a href=""https://www.foxnews.com/lifestyle/fox-news-digital-news-quiz-march-13-2026"" rel=""noopener"" target=""_blank""><i><strong><u>click here.</u></strong></i></a></p>",https://www.foxnews.com/lifestyle/american-culture-quiz-test-yourself-tipping-turmoil-burger-buzz,2026-03-15
