,title,text,link,publish_date
0,Minneapolis considers legalizing adult bathhouses and venues that allow sexual activity,"<p>The <a href=""https://www.foxnews.com/category/us/minneapolis-st-paul"" rel=""noopener"" target=""_blank"">Minneapolis City Council</a> is preparing to consider legalizing and regulating venues, such as bathhouses, where consenting adults can engage in sexual activity, possibly reversing the city's 38-year ban.</p><p>The ordinances in question would remove ""stigmatizing language"" and add ""new definitions to be inclusive of establishments where sexual activity between consenting adults may be facilitated,"" according to <a href=""https://www.startribune.com/minneapolis-ordinance-legalize-bathhouses/601660074"" rel=""noopener nofollow"" target=""_blank"">The Minnesota Star Tribune</a>. The outlet noted that bathhouses and sex clubs operated in the city until a 1988 ordinance banned businesses that facilitate ""high-risk sexual conduct,"" which was defined as fellatio, anal intercourse and vaginal intercourse for pay.</p><p>The language of the 1988 ordinance was changed in 2023 at the behest of activists with the Safer Sex Spaces Coalition, who argued that it targeted same-sex partnerships and <a href=""https://www.foxnews.com/category/health/infectious-disease/hiv-aids"" rel=""noopener"" target=""_blank"">individuals with HIV and AIDS</a>, the Tribune reported. Additionally, the <a href=""https://actionnetwork.org/petitions/repeal-the-ban-on-bathhouses"" rel=""noopener nofollow"" target=""_blank"">Safer Sex Spaces Coalition</a> argued that the ban discouraged outreach to communities and drove sex-related gatherings to ""unsafe and inaccessible spaces.""</p><p>""The Minneapolis Health Department and other public health organizations acknowledge this ordinance is no longer the tool needed to promote public health. Social science research tells us that commercial sex spaces, like gay saunas, are important for promoting safer sex practices, enhancing HIV prevention, and increasing access to testing and treatment. These spaces also enhance feelings of identity, camaraderie, authenticity, and belonging. They are spaces where people overcome isolation and develop a sense of community and pride,"" the coalition said.</p><p><a href=""https://www.foxnews.com/media/washington-city-pursues-polyamory-protections-proposed-civil-rights-ordinance"" rel=""noopener"" target=""_blank""><strong>WASHINGTON CITY PURSUES POLYAMORY PROTECTIONS IN PROPOSED CIVIL RIGHTS ORDINANCE</strong></a></p><p>The Safer Sex Spaces Coalition was formed in response to pushes against the 1988 ordinance, according to its website.</p><p>One proposed ordinance would add a new chapter to the city code specifically for adult sex venues, according to <a href=""https://www.cbsnews.com/minnesota/news/minneapolis-adult-sex-venues-bathhouses-license-proposal/"" rel=""noopener nofollow"" target=""_blank"">CBS News</a>. The ordinance would establish licensing and business regulations for businesses that facilitate sexual activity between consenting adults. The outlet reported that a second ordinance would update definitions and standards in the city's zoning code for sexually oriented uses.</p><p>The third ordinance, according to CBS News, would amend provisions in the city's health and sanitation code related to contagious diseases. Additionally, the fourth ordinance would amend the city's miscellaneous offenses code to create exceptions for licensed venues that are permitted to facilitate consensual sexual activity between adults.</p><p>A spokesperson for Minneapolis Mayor Jacob Frey told Fox News Digital that the mayor is in favor of continuing to explore the issue.</p><p><a href=""https://www.foxnews.com/politics/colorado-house-advances-conversion-therapy-lawsuit-bill-gop-lawmaker-calls-slap-face-scotus"" rel=""noopener"" target=""_blank""><strong>COLORADO HOUSE ADVANCES CONVERSION THERAPY LAWSUIT BILL; GOP LAWMAKER CALLS IT ‘SLAP IN THE FACE’ TO SCOTUS</strong></a></p><p>While LGBTQ+ advocates are pushing for the 1988 ordinance to be reversed, the first openly gay member of the Minneapolis City Council, Brian Coyle, helped pass the law, the Tribune reported. The outlet noted that Coyle said at the time that many members of the LGBTQ+ community supported the ban. Coyle was diagnosed with HIV in 1986 but did not publicly acknowledge it until 1991, the same year that he died of AIDS-related complications at age 47, the Tribune reported.</p><p>The last adult bathhouse in Minneapolis, the 315 Health Club, closed in 1988 before the ban was passed, according to the Tribune, which said the club closed its so-called ""orgy rooms"" two years before shutting its doors. Additionally, prior to its closure, the club handed out free condoms and information on AIDS prevention, according to the outlet.</p><p>Minneapolis City Council President Elliott Payne said that the plan to regulate bathhouses would be modeled after San Francisco, which has placed extensive regulations focused on safety and public health, such as requirements for condoms, staff training and more, the Tribune reported.</p>",https://www.foxnews.com/media/minneapolis-considers-legalizing-adult-bathhouses-venues-allow-sexual-ac,2026-04-07
1,Popular cruise line selling tree house suite for jaw-dropping price: 'Rather buy a house',"<p>Vacationers can soon merge land and sea with a startling new tree house suite on the Royal Caribbean — as long as they cough up six figures. Online debate is already robust about the offering.</p><p>The <a href=""https://www.foxnews.com/category/travel/general/cruises"" rel=""noopener"" target=""_blank"">Hero of the Seas vessel</a> is rolling out the ""Ultimate Family Treehouse"" suite, which has a private whirlpool, game room and rooftop terrace.</p><p>The triple-deck suite can sleep up to 12 guests with four full bathrooms, according to the Royal Caribbean website.</p><p><a href=""https://www.foxnews.com/travel/cruise-line-jacks-up-mandatory-gratuities-travelers-9-10-americans-blast-tipping"" rel=""noopener noreferrer nofollow"" target=""_blank""><strong>CRUISE LINE JACKS UP MANDATORY GRATUITIES FOR TRAVELERS AS 9 IN 10 AMERICANS BLAST TIPPING</strong></a></p><p>The tree house can cost families over $200,000 for a week’s stay, according to the Royal Caribbean blog.</p><p>In the ""r/royalcaribbean"" forum on Reddit, one user shared a post about ""tree house suite pricing"" — sparking lots of discussion.</p><p><a href=""https://www.foxnews.com/category/odd-news"" rel=""noopener"" target=""_blank"">""Shocking to me,""</a> said one user in response. ""I feel like people with this kind of money would charter a yacht instead of doing this.""</p><p>Another person wrote, ""Clearly, this isn’t meant for 99.99% of cruisers.""</p><p><a href=""https://www.foxnews.com/newsletters?cmpid=fnfirstnl"" rel=""noopener"" target=""_blank""><strong>CLICK HERE TO SIGN UP FOR OUR LIFESTYLE NEWSLETTER</strong></a></p><p>Another user said, ""I’m wondering how often it will sit empty [and] what their break-even is for providing the elevated services/cleaning time, etc., vs. just letting it sit empty for a sailing.""</p><p>A different Redditor added, ""I am sure it will still be booked. Absolutely bananas, though. There's more and more of the travel industry taking aim at fat wallets. Everything is <a href=""https://www.foxnews.com/category/travel/general/luxury"" rel=""noopener"" target=""_blank"">pay to play now</a>.""</p><p>Said another person, ""Good on you if you can afford this. But I’d like to travel the world [for] that price.""</p><p>One person chimed in with this comment: ""I would rather buy an actual house.""</p><p>""<a href=""https://www.foxnews.com/category/lifestyle/real-estate/luxury"" rel=""noopener"" target=""_blank"">That pricing feels correct,</a> and honestly, if I could afford it, I would potentially book this over a yacht, especially with family of all ages,"" said another person. ""I could also potentially see it as worthwhile for a bucket list trip. … Doesn't matter because I can't, but someone out there can, and good for them.""</p><p>This year, 21.7 million Americans are expected to go on an ocean cruise, according to AAA.</p><p>Stewart Chiron, a <a href=""https://www.foxnews.com/category/us/miami"" rel=""noopener"" target=""_blank"">Miami-based cruise industry expert</a> known as ""The Cruise Guy,"" told Fox News Digital that cruising continues to gain in popularity.</p><p><a href=""https://www.foxnews.com/lifestyle"" rel=""noopener"" target=""_blank""><strong>CLICK HERE FOR MORE LIFESTYLE STORIES</strong></a></p><p>""Cruise lines are constantly desiring to push the limits of ship designs to increase interest in cruising and wanting to come up with <a href=""https://www.foxnews.com/category/tech/topics/innovation"" rel=""noopener"" target=""_blank"">new features</a>,"" he said. ""Constant tweaking of cabin and suite designs is always being considered.""</p><p><a href=""https://www.foxnews.com/category/lifestyle/quizzes"" rel=""noopener"" target=""_blank""><strong>TEST YOURSELF WITH OUR LATEST LIFESTYLE QUIZ</strong></a></p><p>He added, ""Royal Caribbean's upcoming three-story tree house will be talked about for years to come. What will they think of next?""</p>",https://www.foxnews.com/travel/popular-cruise-line-selling-tree-house-suite-jaw-dropping-price-rather-buy-house,2026-04-07
2,WWE star suffers giant bump on her head before WrestleMania 42 match,"<p>WWE star Liv Morgan was banged up on ""Monday Night Raw"" after a segment that involved her getting pushed into stablemate Roxanne Perez and then thrown into a TV by her <a href=""https://www.foxnews.com/category/wrestlemania"" rel=""noopener"" target=""_blank"">WrestleMania 42</a> nemesis Stephanie Vaquer.</p><p>The promo happened quickly. Morgan and Perez were backstage as the <a href=""https://www.foxnews.com/category/sports/pro-wrestling"" rel=""noopener"" target=""_blank"">Women’s World Championship</a> title contender wanted to thank ""The Prodigy"" for her help fending off Vaquer the week prior. But Vaquer got her revenge.</p><p><a href=""https://www.foxnews.com/sports"" rel=""noopener"" target=""_blank""><strong>CLICK HERE FOR MORE SPORTS COVERAGE ON FOXNEWS.COM</strong></a></p><p>The champion rushed into the scene, pushing Morgan into Perez and then into the television. WWE fans quickly noticed that it appeared Morgan and Perez bumped heads when the shove occurred. Morgan showed the aftermath on social media.</p><p>""You’re mine now b---h,"" Morgan wrote on X showing off photos of the bump.</p><p><a href=""https://www.foxnews.com/sports/randy-orton-rhea-ripley-enter-wrestlemania-42-title-picture-elimination-chamber-wins"" rel=""noopener"" target=""_blank""><strong>RANDY ORTON, RHEA RIPLEY ENTER WRESTLEMANIA 42 TITLE PICTURE WITH ELIMINATION CHAMBER WINS</strong></a></p><p>Perez also posted photos of herself needing to ice her head because of the bump that was left on the top of her forehead. The photos showed the bump and her icing her head.</p><p>Vaquer is set to defend the Women’s World Championship against Morgan at <a href=""https://www.foxnews.com/sports/wrestlemania-42-card-revealed-main-events-major-matches-set"" rel=""noopener"" target=""_blank"">WrestleMania 42</a>, and as of now, the match is still on despite the bump.</p><p><a href=""https://www.f4wonline.com/news/wwe/liv-morgan-roxanne-perez-in-concussion-protocol-following-wwe-raw-angle/"" rel=""noopener nofollow"" target=""_blank"">Wrestling Observer </a>reported Tuesday that both competitors were in concussion protocol after the segment.</p><p>Vaquer has been the champion for nearly 200 days after winning the vacated belt at Wrestlepalooza back in September. She defeated Iyo Sky to start her first title reign.</p><p>Morgan held the title from May 2024 to January 2025, losing it to Rhea Ripley on ""Monday Night Raw’s"" Netflix premiere.</p><p><i><strong>Follow Fox News Digital’s</strong></i><a href=""https://twitter.com/FoxNewsSports_"" rel=""noopener noreferrer nofollow"" target=""_blank""><i><strong> </strong></i></a><a href=""https://twitter.com/FoxNewsSports_"" rel=""noopener"" target=""_blank""><i><strong><u>sports coverage on X</u></strong></i></a><i><strong> and subscribe to</strong></i><a href=""https://www.foxnews.com/newsletters"" rel=""noopener"" target=""_blank""><i><strong><u> the Fox News Sports Huddle newsletter</u></strong></i></a><i><strong>.</strong></i></p>",https://www.foxnews.com/sports/wwe-star-suffers-giant-bump-head-wrestlemania-42-match,2026-04-07
3,"Country star Ray Stevens, 87, breaks neck after serious fall in Nashville","<p>Legendary country singer Ray Stevens is on the mend after suffering a <a href=""https://www.foxnews.com/category/health/nervous-system-health/head-injury"" rel=""noopener"" target=""_blank"">broken neck</a> in a serious fall late last month. </p><p>According to a press release obtained by Fox News Digital, the 87-year-old two-time Grammy Award winner was taken to the hospital following his fall on Sunday, March 29. </p><p>""He was briefly hospitalized in the Nashville area and is now recovering at home,"" the press release read.</p><p>Stevens will wear a neck brace for ""approximately four weeks"" per the advice of his doctors.</p><p><a href=""https://www.foxnews.com/entertainment/dead-kennedys-frontman-jello-biafra-hospitalized-after-suffering-hemorrhagic-stroke"" rel=""noopener"" target=""_blank""><strong>DEAD KENNEDYS FRONTMAN JELLO BIAFRA HOSPITALIZED AFTER SUFFERING HEMORRHAGIC STROKE</strong></a></p><p>""Despite the injury, he remains fully mobile and in good spirits as he continues his recovery,"" the press release added.</p><p>Meanwhile, Stevens’ <a href=""https://www.foxnews.com/category/entertainment/music"" rel=""noopener"" target=""_blank"">upcoming album</a>, ""Favorites Old &amp; New,"" is still set for release this Friday through Curb Records. ""Favorites Old &amp; New,"" which includes 13 tracks, ""features a curated mix of beloved standards alongside new selections from a range of talented songwriters, offering both nostalgia and discovery in one cohesive project.""</p><p><a href=""https://www.foxnews.com/entertainment/country-singer-jd-graham-barely-alive-after-breaking-neck-semi-truck-crash"" rel=""noopener"" target=""_blank""><strong>COUNTRY SINGER J.D. GRAHAM 'BARELY ALIVE' AFTER BREAKING NECK IN SEMI-TRUCK CRASH</strong></a></p><p>""Favorites Old &amp; New"" combines Stevens’ renditions of classics such as ""The Look of Love,"" ""It Had To Be You"" and ""Come Rain or Come Shine"" with new songs including ""I Guess You’ve Never Been in Love With the Moon,"" ""Moving Out is Easier Than Moving On"" and ""Time Machine.""</p><p>""I had a lot of fun creating this album, ‘Favorites Old &amp; New,’"" Stevens said in a statement. ""It really does contain a few of my favorite old songs as well as favorite new ones penned by some talented writers. I just hope Ray Stevens fans enjoy it as much as Ray Stevens!""</p><p>""Stevens appreciates any thoughts and prayers during his recovery,"" the press release concluded. </p><p>The ""Everything is Beautiful"" singer previously experienced a health scare in July 2025.</p><p><a href=""https://www.foxnews.com/newsletters?cmpid=fnfirstnl"" rel=""noopener"" target=""_blank""><strong>CLICK HERE TO SIGN UP FOR THE ENTERTAINMENT NEWSLETTER</strong></a></p><p>After complaining of chest pains on July 4, Stevens was admitted to a hospital in Nashville.  Doctors performed a heart catheterization procedure, and it was determined he had suffered a <a href=""https://www.foxnews.com/category/health/heart-health"" rel=""noopener"" target=""_blank"">mild heart attack</a>.</p><p>Stevens underwent <a href=""https://www.foxnews.com/category/health/medical-research/surgery"" rel=""noopener"" target=""_blank"">minimally invasive heart surgery</a> a few days later, and he was released from the hospital on July 10.</p><p><a href=""https://www.foxnews.com/entertainment"" rel=""noopener"" target=""_blank""><strong>LIKE WHAT YOU’RE READING? CLICK HERE FOR MORE ENTERTAINMENT NEWS</strong></a></p><p>""Ray has been discharged from the hospital and is on his way home right now,"" a representative for the musician told Fox News Digital at the time. ""He will be recovering for a few weeks at home. There will be a few additional procedures to perform once he’s recovered but things went really well.""</p><p>Due to his health issues, Stevens canceled his performances at <a href=""https://www.foxnews.com/category/us/nashville"" rel=""noopener"" target=""_blank"">Nashville's CabaRay Showroom</a> for the remainder of the month.</p><p>Prior to his release from the hospital, Stevens' official Instagram account provided a <a href=""https://www.foxnews.com/category/health/health-care"" rel=""noopener"" target=""_blank"">positive update on the singer's health</a>. </p><p>""Ray is out of ICU and beginning to walk the halls as therapy with a nurse’s assistance as he is working towards recovering from this surgery,"" the caption read. ""Ray is very grateful for all of the cards and get well messages. Everything Is Still Beautiful!!!""</p>",https://www.foxnews.com/entertainment/country-star-ray-stevens-87-breaks-neck-after-serious-fall-nashville,2026-04-07
4,WATCH: Tybee Island teen takeover erupts in panic after police say gunfire broke out along the pier,"<p>A mass of teens participating in a takeover in <a href=""https://www.foxnews.com/category/us/us-regions/southeast/georgia"" rel=""noopener"" target=""_blank"">Tybee Island, Georgia</a> was interrupted in panic after police say gunfire broke out along the pier.</p><p>According to the Tybee Island Police Department, authorities responded around 6:30 p.m. Saturday when hundreds of people gathered near the Tybee Island Pier and Pavilion area, a popular spot in the laid-back beach community.</p><p>During the course of the ""<a href=""https://www.foxnews.com/category/news-events"" rel=""noopener"" target=""_blank"">unpermitted, pop-up event,</a>"" officers said they heard a single gunshot ring out, and the crowd began to scatter.</p><p>Video shared by the department captured hoards of teens running away.</p><p><a href=""https://www.foxnews.com/tips"" rel=""noopener"" target=""_blank""><strong>GOT A TIP?</strong></a></p><p>Visitors on the island who were nearby when it happened said the scene turned chaotic.</p><p><a href=""https://x.com/FoxUSNews"" rel=""noopener"" target=""_blank""><strong>FOLLOW US ON X</strong></a></p><p>""Out there were like 15 girls. Came out yelling at us two last night for no reason,"" the visitors, who asked not to be identified, told <a href=""https://www.wtoc.com/2026/04/06/tybee-island-police-seek-2-people-seen-pier-video-after-suspected-gunshot-saturday-night/"" rel=""noopener nofollow"" target=""_blank"">WTOC-TV</a>.</p><p>""We were here, but, like, it was like, drunk white girls. Just a cloud of white girls just walking around.""</p><p><a href=""https://www.foxnews.com/newsletters"" rel=""noopener"" target=""_blank""><strong>GET BREAKING NEWS BY EMAIL</strong></a></p><p>After reviewing 911 calls and video, Tybee Island detectives said that they believe that the gunshot may have originated from the beach below.</p><p><a href=""https://www.foxnews.com/us"" rel=""noopener"" target=""_blank""><strong>CLICK HERE FOR MORE US NEWS</strong></a></p><p>Now, the department is looking for two individuals who they say were captured emerging from the darkness beneath the pier and pavilion at the end of the video.</p><p>""We believe they may have pertinent information to share about <a href=""https://www.foxnews.com/category/us/crime/police-and-law-enforcement"" rel=""noopener"" target=""_blank"">this investigation</a>,"" police said. ""If you know who these individuals are, or if one of them is YOU, it is important to contact Detective Sam Stuber at (912)786-5600 or sstuber@cityoftybee.gov.""</p><p>Tybee Island is a barrier island on Georgia’s Atlantic coast, about 18 miles east of downtown Savannah.</p><p>Fox News Digital has reached out to the Tybee Island Police Department for additional information.</p>",https://www.foxnews.com/us/watch-tybee-island-teen-takeover-erupts-panic-police-say-gunfire-broke-along-pier,2026-04-07
5,"First-ever photo of Earth from moon’s far side unveiled as Artemis II begins journey home, Trump weighs in","<p>NASA unveiled the first-ever photo of Earth from the far side of the moon after a flyby Tuesday, taken by the Artemis II astronauts that President <a href=""https://www.foxnews.com/category/person/donald-trump"" rel=""noopener"" target=""_blank"">Donald Trump</a> hailed in a phone call as ""modern-day pioneers.""</p><p>The historic image, taken for the very first time by human beings from this exact perspective, was compared by NASA to the iconic ""Earthrise"" photo taken by astronaut Bill Anders from the Apollo 8 mission nearly 60 years ago.</p><p><a href=""https://www.foxnews.com/category/science/air-and-space/nasa"" rel=""noopener"" target=""_blank"">NASA dubbed</a> the photo ""Earthset,"" as a callback to the 1968 photo.</p><p>""Humanity, from the other side,"" The White House wrote in a post sharing the photo on X. ""First photo from the far side of the Moon. Captured from Orion as Earth dips beyond the lunar horizon.""</p><p><a href=""https://www.foxnews.com/science/nasa-chief-jared-isaacman-says-artemis-ii-would-possible-wasnt-president-trump"" rel=""noopener"" target=""_blank""><strong>NASA CHIEF JARED ISAACMAN SAYS ARTEMIS II WOULD NOT BE POSSIBLE 'IF IT WASN'T FOR PRESIDENT TRUMP'</strong></a></p><p>Trump took a call with the astronauts on the <a href=""https://www.foxnews.com/category/science/air-and-space/spaceflight"" rel=""noopener"" target=""_blank"">Artemis II mission</a> late Monday, saying: ""Today you’ve made history and made all of America really proud. Incredibly proud.""</p><p><i>""</i>Humans have really never seen anything quite like what you're doing in a manned spacecraft. It's really special,"" Trump added. ""I want to personally salute and congratulate Commander Reid Weissman, Pilot Victor Glover, Mission Specialists Christina Koch and Jeremy Hansen.<i>""</i></p><p>NASA reported that the Earthset photo was captured through the window of the Orion spacecraft around 7 p.m. ET on Monday during a flyby of the moon, without giving any of the four Artemis II crew members specific photographer's credit.</p><p><a href=""https://www.foxnews.com/politics/artemis-ii-astronaut-tells-trump-communication-blackout-like-said-little-prayer"" rel=""noopener"" target=""_blank""><strong>ARTEMIS II ASTRONAUT TELLS TRUMP WHAT COMMUNICATION BLACKOUT WAS LIKE: 'I SAID A LITTLE PRAYER'</strong></a></p><p>NASA described the view from the photo as a ""muted blue Earth with bright white clouds sets behind the cratered lunar surface.""</p><p>""The dark portion of Earth is experiencing nighttime,"" NASA wrote. ""On Earth’s day side, swirling clouds are visible over the <a href=""https://www.foxnews.com/category/world/world-regions/australia"" rel=""noopener"" target=""_blank"">Australia and Oceania region</a>.""</p><p>The Orion holds 32 cameras, according to NASA. Fifteen cameras are fixed to the spacecraft, and 17 are handheld by crew members.</p><p><a href=""https://www.foxnews.com/media/astronaut-victor-glover-praised-saying-moon-mission-human-history-not-black-history"" rel=""noopener"" target=""_blank""><strong>ASTRONAUT VICTOR GLOVER PRAISED FOR SAYING MOON MISSION IS 'HUMAN HISTORY,' NOT 'BLACK HISTORY'</strong></a></p><p>Artemis II Mission Specialist Christina Koch remarked upon the <a href=""https://www.foxnews.com/category/science/planet-earth"" rel=""noopener"" target=""_blank"">beauty of the Earth</a> from the crew's unique vantage point, calling it ""special.""</p><p>""The thing that changed for me, looking back at Earth, was that I found myself noticing not only the beauty of the Earth, but how much blackness there was around it and how it just made it even more special,"" Koch recalled.</p><p>The <a href=""https://www.foxnews.com/us/nasas-artemis-ii-crew-commits-moon-trajectory-after-critical-burn-sends-orion-deep-space"" rel=""noopener"" target=""_blank"">Artemis II astronauts begin</a> their journey back to Earth Tuesday, with the crew expected to travel a total of 695,081 miles total from launch to splashdown. Their mission is projected to be over 4,000 miles further from the Earth than Apollo 13.</p><p>The Artemis II capsule is projected to make its West Coast splashdown early Friday evening off the coast near <a href=""https://www.foxnews.com/category/us/san-diego"" rel=""noopener"" target=""_blank"">San Diego</a>.</p><p>""Your mission paves the way for America's return to the lunar surface very soon,"" Trump told the Artemis II crew.</p><p><i>Fox News Digital's Stephen Sorace and Landon Mion contributed to this reporting.</i></p>",https://www.foxnews.com/us/first-ever-photo-earth-moons-far-side-unveiled-artemis-ii-begins-journey-home-trump-weighs,2026-04-07
