,title,text,link,publish_date
4,"Former Jets, Falcons QB Browning Nagle dead at 57 after cancer diagnosis","<p>Former <a href=""https://www.foxnews.com/category/sports/nfl"" rel=""noopener"" target=""_blank"">NFL</a> quarterback Browning Nagle, a Louisville standout in the 1991 Fiesta Bowl, has died, his alma mater announced Friday. He was 57.</p><p>Nagle was diagnosed with colon cancer earlier this year.</p><p>He made his pro football debut in 1991 after the <a href=""https://www.foxnews.com/category/sports/nfl/new-york-jets"" rel=""noopener"" target=""_blank"">New York Jets</a> selected the strong-armed quarterback in the second round. Nagle saw limited action in his rookie season, attempting just one pass, but he moved into the starting role in 1992.</p><p>Nagle finished his time as the Jets’ starter with a 3-10 record and seven touchdown passes.</p><p><a href=""https://www.foxnews.com/sports"" rel=""noopener"" target=""_blank""><strong>CLICK HERE FOR MORE SPORTS COVERAGE ON FOXNEWS.COM</strong></a></p><p>Boomer Esiason, the 1988 NFL MVP, was traded from the Cincinnati Bengals to the Jets in 1993, relegating Nagle to a reserve role. Nagle joined the Indianapolis Colts in 1994 before ending his NFL career with the Atlanta Falcons.</p><p>Nagle was long linked to Brett Favre, whom the Jets had targeted in the 1991 <a href=""https://www.foxnews.com/category/sports/nfl-draft"" rel=""noopener"" target=""_blank"">NFL Draft.</a> After failing to trade up, New York selected Nagle after Atlanta took Favre one pick earlier at No. 33 overall.</p><p>Months before entering the NFL, Nagle etched his name into <a href=""https://www.foxnews.com/category/sports/ncaa-fb"" rel=""noopener"" target=""_blank"">college football</a> lore, throwing for 451 yards and three touchdowns in Louisville’s upset win over Alabama in the 1991 Fiesta Bowl.</p><p><a href=""https://www.foxnews.com/sports/former-raiders-all-pro-center-barret-robbins-dead-52-deeply-saddened"" rel=""noopener"" target=""_blank""><strong>FORMER RAIDERS ALL-PRO CENTER BARRET ROBBINS DEAD AT 52: 'DEEPLY SADDENED'</strong></a></p><p>""We are saddened by the passing of Browning Nagle, former Fiesta Bowl MVP quarterback and Louisville great,"" the Louisville football program <a href=""https://x.com/LouisvilleFB/status/2042631014577504370"" rel=""nofollow noopener"" target=""_blank"">said in a statement.</a> </p><p>""His leadership on the field and passion for the game left a lasting mark on our program.</p><p>""Our thoughts are with his loved ones and teammates during this difficult time.""</p><p>Nagle had a stint in the Arena League after stepping away from the NFL. After he hung up his cleats, Nagle pursued a career in medical sales.</p><p><i><strong>Follow Fox News Digital’s </strong></i><a href=""https://twitter.com/FoxNewsSports_"" rel=""noopener"" target=""_blank""><i><strong>sports coverage on X</strong></i></a><i><strong>, and subscribe to</strong></i><a href=""https://www.foxnews.com/newsletters"" rel=""noopener"" target=""_blank""><i><strong> the Fox News Sports Huddle newsletter</strong></i></a><i><strong>.</strong></i></p>",https://www.foxnews.com/sports/former-jets-falcons-qb-browning-nagle-dead-57-cancer-diagnosis,2026-04-10
5,New York Times investigating NFL reporter Dianna Russini after photos with Patriots coach Mike Vrabel emerge,"<p>Photographs emerged showing New England <a href=""https://www.foxnews.com/category/sports/nfl"" rel=""noopener"" target=""_blank"">Patriots head coach Mike Vrabel</a> with The Athletic/New York Times NFL reporter Dianna Russini at a resort in Arizona earlier this week, and now that reporter is the subject of an internal investigation.</p><p>Athletic executive editor Steven Ginsberg initially gave a statement to the New York Post's <a href=""https://pagesix.com/2026/04/07/celebrity-news/new-england-patriots-mike-vrabel-and-top-ny-times-nfl-reporter-dianna-russini-hold-hands-and-hug-at-luxury-hotel/"" rel=""noopener"" target=""_blank"">Page Six</a> April 7, calling the photos ""misleading.""</p><p>""These photos are misleading and lack essential context,"" Ginsberg initially said. ""These were public interactions in front of many people. Dianna is a premier journalist covering the NFL, and we’re proud to have her at The Athletic.""</p><p><a href=""https://www.foxnews.com/sports"" rel=""noopener"" target=""_blank""><strong>CLICK HERE FOR MORE SPORTS COVERAGE ON FOXNEWS.COM</strong></a></p><p>Now, sources at The Athletic familiar with the controversy told Fox News Digital Russini is being investigated, while standing by Ginsberg's initial statement.</p><p>The sources responded to Fox News Digital after Page Six and Front Office Sports reported on the internal investigation into Russini.</p><p>""After Page Six reached out to Dianna for comment on Tuesday, The Athletic immediately <a href=""https://www.foxnews.com/category/politics/finance/investigations"" rel=""noopener"" target=""_blank"">began an investigation</a>. While the apparent conduct in the photos raised questions for Steven and leadership at The Athletic, an initial review suggested the images provided lacked context, specifically the presence of a larger group of friends,"" a source said.</p><p>""New details from the Page Six report and information from the investigation raised additional concerns that are now being further reviewed. The investigation is ongoing.""</p><p>The source added Russini's coverage is being reviewed, which is expected to take time, and she will not be reporting for the outlet in the meantime.</p><p><a href=""https://www.foxnews.com/sports/emmitt-smith-gives-advice-nfl-hopeful-son-admitted-feeling-pressure-living-family-name"" rel=""noopener"" target=""_blank""><strong><u>EMMITT SMITH GIVES ADVICE TO NFL HOPEFUL SON WHO ONCE ADMITTED TO FEELING PRESSURE OF LIVING UP TO FAMILY NAME</u></strong></a></p><p><a href=""https://www.foxnews.com/category/media"" rel=""noopener"" target=""_blank"">The New York Times</a> declined to comment.</p><p>The photos, <a href=""https://pagesix.com/2026/04/07/celebrity-news/new-england-patriots-mike-vrabel-and-top-ny-times-nfl-reporter-dianna-russini-hold-hands-and-hug-at-luxury-hotel/"" rel=""noopener"" target=""_blank""><u>originally published</u></a> by Page Six, show the coach and journalist holding hands and hugging on the roof of a resort bungalow in Sedona, Arizona.</p><p>Vrabel addressed the photos, telling Page Six, ""These photos show a completely innocent interaction, and any suggestion otherwise is laughable. This doesn’t deserve any further response.""</p><p>Russini told the outlet, ""The photos don’t represent the group of six people who were hanging out during the day. Like most journalists in the NFL, reporters interact with sources away from stadiums and other venues.""</p><p>The photographs and <a href=""https://www.foxnews.com/sports/super-bowl-champion-defends-mike-vrabel-new-york-times-reporter-over-leaked-photos"" rel=""noopener"" target=""_blank"">subsequent responses became</a> the topic of immense national debate in the sports world this week.</p><p><i><strong>Follow Fox News Digital’s </strong></i><a href=""https://twitter.com/FoxNewsSports_"" rel=""noopener"" target=""_blank""><i><strong><u>sports coverage on X</u></strong></i></a><i><strong>, and subscribe to</strong></i><a href=""https://www.foxnews.com/newsletters"" rel=""noopener"" target=""_blank""><i><strong><u> the Fox News Sports Huddle newsletter</u></strong></i></a><i><strong>.</strong></i></p>",https://www.foxnews.com/sports/new-york-times-investigating-nfl-reporter-dianna-russini-amid-photographs-patriots-coach-mike-vrabel,2026-04-10
6,Artemis II astronauts splash down after first moon mission in more than 50 years,"<p>The four Artemis II astronauts <a href=""https://www.foxnews.com/us/artemis-ii-nears-end-historic-mission-splashdown-off-california-coast"" rel=""noopener"" target=""_blank"">splashed down off</a><a href=""https://www.foxnews.com/category/us/san-diego"" rel=""noopener"" target=""_blank""> the coast of San Diego</a> Friday evening following a 10-day mission that marked the first manned moon mission in more than 50 years at 5:07 p.m. Pacific Time.</p><p>The crew <a href=""https://www.foxnews.com/us/artemis-ii-launches-astronauts-around-moon-first-deep-space-mission-since-apollo"" rel=""noopener"" target=""_blank"">launched from the Kennedy Space</a> Center April 1 and traveled around the moon, 252,000 miles from Earth, flying farther from Earth than any previous mission.</p><p>After NASA Administrator Jared Isaacman landed on the <a href=""https://www.foxnews.com/category/tech/topics/us-navy"" rel=""noopener"" target=""_blank"">USS John P. Murtha</a> ahead of the splashdown, he shared a massage for those helping with the recovery of the astronauts.</p><p><strong>""</strong>I have no doubt that you're all going to execute this flawlessly as we get these astronauts who will just complete an absolute <a href=""https://www.foxnews.com/category/science/air-and-space/spaceflight"" rel=""noopener"" target=""_blank"">historic mission</a>, traveling further into space than any humans have gone before,"" he said.</p><p><a href=""https://www.foxnews.com/us/artemis-ii-nears-end-historic-mission-splashdown-off-california-coast"" rel=""noopener"" target=""_blank""><strong>ARTEMIS II NEARS END OF HISTORIC MISSION WITH SPLASHDOWN OFF CALIFORNIA COAST</strong></a></p><p>""For the first time, we've gone into the lunar environment in more than half a century,"" he added. ""We are back in the business of sending astronauts to the moon again.""</p><p>Isaacman added that once <a href=""https://www.foxnews.com/category/science/air-and-space/nasa"" rel=""noopener"" target=""_blank"">Artemis III launches in 2028</a> for the first moon landing in decades, NASA plans to stay and build a moon base.</p><p><a href=""https://www.foxnews.com/video/6392819501112"" rel=""noopener"" target=""_blank""><strong><u>ARTEMIS II ASTRONAUTS SHOW OFF APOLLO 18 FLAG FROM SPACE</u></strong></a></p><p>After being helped out of the Orion crew module, the four astronauts — Commander Reid Wiseman, pilot Victor Glover, mission specialist Christina Koch and mission specialist Jeremy Hansen were taken aboard the USS John P. Murtha for <a href=""https://www.foxnews.com/us/artemis-ii-crew-closes-earth-mission-ends-pacific-splashdown-more-top-headlines"" rel=""noopener"" target=""_blank"">medical evaluation after the mission</a>.</p><p>The Orion spacecraft reentered the Earth’s atmosphere Friday at around 25,000 mph, slowing to about 20 mph using an 11-parachute sequence before landing in the ocean about 60 miles off the coast at 5:07 p.m. local time.</p><p>During its reentry, the temperatures outside the spacecraft got as high as 5,000 degrees Fahrenheit.</p><p>Astronauts last went to the moon in December 1972 for the Apollo 17 mission, three years after humans first landed on the moon in the <a href=""https://www.foxnews.com/category/topic/apollo-11"" rel=""noopener"" target=""_blank"">Apollo 11 mission</a> in 1969.</p>",https://www.foxnews.com/science/artemis-ii-astronauts-splashdown-first-moon-mission-50-years,2026-04-10
7,Outraged passengers say parents ditched rowdy kids in coach while they upgraded to first class,"<p>Outraged flight passengers are complaining this week that three rambunctious children were left unsupervised in coach while the parents sat comfortably in first class, according to a viral Reddit post.</p><p>""United is now offering free babysitting,"" a passenger joked in the social media post, describing an apparently chaotic <a href=""https://www.foxnews.com/category/travel/general/airlines"" rel=""noopener"" target=""_blank"">United Airlines flight</a> from Houston to Fort Lauderdale.</p><p>The children — whose estimated ages were 7, 9 and 10 — sat in row 8, according to the post. The observer speculated that the parents were ""upgraded to first class,"" leaving the little ones behind as the adults relaxed on their own up front.</p><p><a href=""https://www.foxnews.com/travel/actor-former-snl-star-slams-major-airline-seat-downgrade-i-paid-first-class"" rel=""noopener"" target=""_blank""><strong>ACTOR AND FORMER 'SNL' STAR SLAMS MAJOR AIRLINE FOR HIS SEAT DOWNGRADE: ‘I PAID FOR FIRST CLASS’</strong></a></p><p>""Thirty minutes before landing — the boys start pounding on each other — punches, choking each other, super-loud talking to the point of almost screaming. The little girl ends up with as much slack in her seat belt as possible,"" the poster on Reddit wrote.</p><p>""Parents are upgraded, so [they] had a nice, relaxing flight while a select few of us kept an eye on the misbehaved children,"" the United passenger suggested to others on Reddit.</p><p>""At what point should the flight attendant have stepped in and requested the parents realign to supervise their children?"" the user added.</p><p>Fox News Digital reached out to United Airlines for comment.</p><p><a href=""https://www.foxnews.com/travel/family-outraged-after-major-airline-seats-toddler-apart-from-parents-sparking-viral-debate"" rel=""noopener"" target=""_blank""><strong>FAMILY OUTRAGED AFTER MAJOR AIRLINE SEATS TODDLER APART FROM PARENTS, SPARKING VIRAL DEBATE</strong></a></p><p>Several commenters on Reddit weighed in on the flight drama.</p><p>""There are <a href=""https://www.foxnews.com/category/lifestyle/parenting"" rel=""noopener"" target=""_blank"">two types of parents</a>: Those who actually parent, and then those who are nothing more than bad camp counselors who want to clock out when their shift is done,"" one person said.</p><p>Another said, ""If that happened, one parent has to stay with the children, and one child gets upgraded or nobody is upgraded. Some people can be so selfish.""</p><p><a href=""https://www.foxnews.com/lifestyle"" rel=""noopener"" target=""_blank""><strong><u>CLICK HERE FOR MORE LIFESTYLE STORIES</u></strong></a></p><p>""I would have gone up to first and — loudly — fetched the dad,"" yet another person wrote. </p><p>Others felt the angry passengers should have spoken up about the issue to flight attendants.</p><p>""Why didn’t someone just push the call button?"" one Reddit user wrote.</p><p>""Just ring your call bell, and when the flight attendant arrives, point over to them and put your headphones back on,"" another quipped.</p><p><a href=""https://www.foxnews.com/category/lifestyle/social-etiquette"" rel=""noopener"" target=""_blank"">Etiquette expert Jacqueline Whitmore</a> of Florida told Fox News Digital that children under age 12 should generally not be left unsupervised on a flight.</p><p>""I think a parent should have stayed back with them because of their age,"" she said. </p><p><a href=""https://www.foxnews.com/category/lifestyle/quizzes"" rel=""noopener"" target=""_blank""><strong><u>TEST YOURSELF WITH OUR LATEST LIFESTYLE QUIZ</u></strong></a></p><p>Whitmore said, in these cases, a flight attendant should ask the children where the parents are, and a parent should be notified.</p><p>""That's what flight attendants are there for — safety and to <a href=""https://www.foxnews.com/category/travel/general/travel-safety"" rel=""noopener"" target=""_blank"">keep peace in the cabin</a>,"" she said.</p><p>She also noted that many children struggle to stay in their seats on long flights.</p><p>""Some children listen, some don't,"" she said. ""Most children in a confined area are very uncomfortable. They want to run up and down the aisles. That's just what children do.""</p><p>The U.S. Department of Transportation encourages airlines to seat young children next to a parent or accompanying adult at no additional charge, according to the agency’s website.</p><p><a href=""https://www.foxnews.com/newsletters?cmpid=fnfirstnl"" rel=""noopener"" target=""_blank""><strong><u>CLICK HERE TO SIGN UP FOR OUR LIFESTYLE NEWSLETTER</u></strong></a></p><p>Federal regulations, however, do not currently require airlines to guarantee adjacent seating.</p><p>The department maintains an online dashboard that outlines which carriers commit to seating children age 13 and under next to an accompanying adult without an added fee.</p><p>Some major carriers do not commit to providing fee-free guaranteed adjacent seating, including Delta, Spirit, Allegiant and United, according to the DOT dashboard.</p><p>Several airlines, however, state that they will seat children ages 13 and under next to an accompanying adult at no additional cost under certain conditions. </p><p>Those carriers include Alaska Airlines, <a href=""https://www.foxbusiness.com/category/american-airlines"" rel=""noopener"" target=""_blank"">American Airlines</a>, Frontier, Hawaiian Airlines and JetBlue.</p><p><i>Kelly McGreal of Fox News Digital contributed reporting.</i></p>",https://www.foxnews.com/travel/outraged-passengers-say-parents-ditched-rowdy-kids-coach-upgraded-first-class,2026-04-10
8,Ex-Washington Post staffer pleads guilty to child pornography possession,"<p>A former Washington Post staffer <a href=""https://www.justice.gov/usao-dc/pr/journalist-pleads-guilty-possession-child-pornography"" rel=""nofollow noopener"" target=""_blank"">pleaded guilty</a> to one count of child pornography possession Friday, according to the office of U.S. Attorney Jeanine Pirro in Washington, D.C.</p><p>Thomas LeGro, 48, an award-winning journalist who served as the Post's deputy director of video, was arrested in June after the FBI executed a search warrant at his home and seized multiple devices.</p><p>""During the execution of the warrant, agents observed what appeared to be fractured pieces of a hard drive hidden under a rug in the basement of the residence,"" Pirro's office wrote. </p><p>""A review of LeGro's laptop revealed a folder that contained 11 videos depicting child <a href=""https://www.foxnews.com/category/us/crime/sex-crimes"" rel=""noopener"" target=""_blank"">sexual abuse</a>. These videos depicted adult men sexually abusing prepubescent children and forcing them to engage in sex acts.""  </p><p><a href=""https://www.foxnews.com/media/washington-post-editor-leave-after-doj-charges-him-possessing-child-pornography"" rel=""noopener"" target=""_blank""><strong>WASHINGTON POST EDITOR ON LEAVE AFTER DOJ CHARGES HIM WITH POSSESSING CHILD PORNOGRAPHY</strong></a></p><p>The investigation was spearheaded by the FBI Washington Field Office’s Child Exploitation and Human Trafficking Task Force, according to Pirro.</p><p>LeGro' sentencing is scheduled for Sept. 3, 2026. </p><p>At the time of his arrest, a Washington Post spokesperson told <a href=""https://www.foxnews.com/media"" rel=""noopener"" target=""_blank"">Fox News Digital</a> LeGro had been placed on leave. The paper has since severed ties with him. </p><p>LeGro began working for the Post in 2000 and left in 2006 for a stint at ""PBS NewsHour"" before returning to the Post in 2013, according to his LinkedIn page. </p><p>Notably, LeGro was among the Washington Post journalists who earned the paper a <a href=""https://www.foxnews.com/category/media"" rel=""noopener"" target=""_blank"">Pulitzer Prize</a> in 2018 for its investigative reporting of failed Republican Alabama Senate candidate Roy Moore, who was accused of sexual misconduct by multiple women, several of whom said they were minors at the time. </p><p>Moore denied the allegations mentioned in the Post's reporting. </p>",https://www.foxnews.com/media/ex-washington-post-staffer-pleads-guilty-child-pornography-possession,2026-04-10
9,Meghan Markle's failed Martha Stewart dreams mocked by comedian: 'She was slinging jam',"<p>Comedian Tim Dillon took aim at <a href=""https://www.foxnews.com/category/entertainment/celebrity-news/meghan-markle"" rel=""noopener"" target=""_blank"">Meghan </a><a href=""https://www.foxnews.com/category/entertainment/celebrity-news/meghan-markle"" rel=""noopener"" target=""_blank"">Markle’s</a> post-royal reinvention, arguing the Duchess of Sussex fell short of building the kind of lifestyle empire she appeared to be chasing.</p><p>Dillon weighed in on what Markle's next act may be during a recent podcast appearance. David Spade brought up the Duchess of Sussex's past success on ""Suits"" and wondered why she didn't revive her role in ""Suits LA"" and make ""big money"" after stepping back from her job as a working royal.</p><p>""I think Meghan will eventually find her way into some type of talk show,"" Dillon said on the ""<a href=""https://www.youtube.com/watch?app=desktop&amp;v=tuASsnMz1E4"" rel=""nofollow noopener"" target=""_blank"">Fly on the Wall with Dana Carvey and David Spade</a>"" podcast. ""Because she's failed at the Martha Stewart route, which she wanted. She was slinging jam in Target. She wanted to have a lifestyle brand.""</p><p>""Jam was an interesting choice,"" Spade added. ""It's probably an uncrowded market. Other than Welch's, I can't think of too many.""</p><p><a href=""https://www.foxnews.com/entertainment/meghan-markle-returns-acting-despite-claiming-she-done-after-royal-exit-report"" rel=""noopener"" target=""_blank""><strong>MEGHAN MARKLE RETURNS TO ACTING DESPITE CLAIMING SHE WAS 'DONE' AFTER ROYAL EXIT: REPORT</strong></a></p><p>""She definitely needs to adjust her strategy,"" Dillon explained. ""I could also see her going back to the U.K. and saying, 'Let's give it another go.""</p><p>Carvey chimed in, ""I think they do have to go back and stir the brand again.""</p><p>But the critique didn’t end with her lifestyle push. Dillon argued her overall approach alienated some viewers.</p><p>""I think we're all a little tired of her shtick here. I don't think it worked as well as she thought it would,"" he said. ""I think her idea was to come back to America and say, 'Listen, the British are really racist. But they do know a lot about dinner parties, and I've learned that. So I'm here to tell you how to live like a human being and what fork to use. You pig, you American pig.' And I think that it felt a little condescending.</p><p>""She had that show on Netflix where she was basically like, 'Now this is a, this is what they call a saucer. You put your coffee cup on it so it doesn't spill all over your illegitimate children, you animals.' I think people got a little turned off by that.""</p><p><strong>WATCH: MEGHAN MARKLE PULLED OFF BECOMING A 'VICTIM' WHILE LIVING IN A CASTLE</strong></p><p><a href=""https://www.foxnews.com/newsletters?cmpid=fnfirstnl"" rel=""noopener"" target=""_blank""><strong>CLICK HERE TO SIGN UP FOR THE ENTERTAINMENT NEWSLETTER</strong></a></p><p>Dillon previously explained why the former ""Suits"" actress has become one of his favorite comedic targets in an interview with Fox News Digital.</p><p>""I think it's just that she came to prominence at a time when there was a real cultural cachet to being a victim,"" Dillon said. ""And I thought it was a very funny way to be a victim, and she found a way to be a victim while living in a castle.</p><p><a href=""https://www.foxnews.com/entertainment"" rel=""noopener"" target=""_blank""><strong>LIKE WHAT YOU’RE READING? CLICK HERE FOR MORE ENTERTAINMENT NEWS</strong></a></p><p>""And I always found that very funny,"" he continued. ""I think she's a great comedic actress. I think that there was real currency in being a victim when she rose to prominence, and she became a victim living in a castle <a href=""https://www.foxnews.com/category/person/prince-harry"" rel=""noopener"" target=""_blank""><u>married to a prince</u></a> with the royal wedding, and I thought that was very funny.</p><p>""It's hard to pull it off,"" Dillon added. ""She did it, to her credit. You know, most people that you know were putting out that they were victims during that era were, to their credit, not members of the royal family.""</p><p>Dillon also took aim at <a href=""https://www.foxnews.com/category/person/prince-harry"" rel=""noopener"" target=""_blank"">Prince Harry</a>.</p><p>""Harry seems like he's kind of been led around and he kind of doesn't know what's going on,"" he said. ""It's probably all an adventure for him, right?""</p>",https://www.foxnews.com/entertainment/meghan-markles-failed-martha-stewart-dreams-mocked-comedian-slinging-jam,2026-04-10
