,title,text,link,publish_date
0,"Carville unloads on Maher, tells him to ‘get your head out of Bari Weiss’s a--’ in heated Trump rant","<p>Democratic strategist James Carville criticized President Donald Trump and comedian Bill Maher during a recent episode of the ""Politics War Room"" podcast, where he responded to Trump's remarks about former FBI Director Robert Mueller and pushed back on Maher's comments about ""Trump Derangement Syndrome.""</p><p>""Do me a favor, Bill. Try to get your head out of Bari Weiss’s a--,"" Carville said, addressing Maher directly during the segment.</p><p><a href=""https://www.foxnews.com/category/politics"" rel=""noopener"" target=""_blank"">Carville's remarks</a> came after Maher criticized him as acting like a ""crazy old man"" with ""Trump Derangement Syndrome,"" arguing that Carville represents a small segment of political media disconnected from everyday Americans.</p><p><a href=""https://www.foxnews.com/media/carville-predicts-trump-leave-office-next-year-out-frustration-after-midterms"" rel=""noopener"" target=""_blank""><strong>CARVILLE PREDICTS TRUMP WILL LEAVE OFFICE NEXT YEAR OUT OF FRUSTRATION AFTER MIDTERMS</strong></a></p><p>Carville pushed back on that characterization, summarizing Maher's critique before responding.</p><p>""The argument is basically myself and people like me are crazy... we're just blind rage, crazy, we can't stand Trump,"" Carville said.</p><p>He followed up by embracing the labels, calling himself and those like-minded crazy.</p><p>""I’m going to agree with you. I’m crazy… a lot of people like me, we’re crazy,"" Carville said.</p><p><a href=""https://www.foxnews.com/media/james-carville-tells-stephen-a-smith-democrats-do-not-know-how-talk-young-men"" rel=""noopener"" target=""_blank""><strong>JAMES CARVILLE TELLS STEPHEN A SMITH DEMOCRATS 'DO NOT KNOW HOW TO TALK TO YOUNG MEN'</strong></a></p><p>Carville described his reaction to the current <a href=""https://www.foxnews.com/category/politics"" rel=""noopener"" target=""_blank"">political climate</a>, claiming he and like-minded people wake up early, in a rage, over the state of the country.</p><p>""We wake up at 2 o’clock in the morning, throwing s--- against the wall. I can’t believe this motherf----- is the President of the United States,"" Carville said.</p><p> ""Maybe our craziness is evidence of our sanity,"" he added.</p><p><a href=""https://www.foxnews.com/media/sen-fetterman-condemned-carville-supporting-iran-war-says-hes-always-wring-side-issues"" rel=""noopener"" target=""_blank""><strong>FETTERMAN CONDEMNED BY CARVILLE FOR SUPPORTING IRAN WAR, SAYS HE'S ALWAYS ON WRONG SIDE OF ISSUES</strong></a></p><p>Carville also pointed to <a href=""https://www.foxnews.com/category/person/donald-trump"" rel=""noopener"" target=""_blank"">Trump's</a> response to Mueller's death, noting Trump reacted by saying he was ""glad,"" and questioned whether that should change how critics view the situation.</p><p>""<a href=""https://www.foxnews.com/category/person/robert-mueller"" rel=""noopener"" target=""_blank"">Robert Mueller</a> dies and Trump says, ‘I’m glad,'"" Carville said. ""Will you be stuck with being insane about this?""</p><p><a href=""https://www.foxnews.com/media"" rel=""noopener"" target=""_blank""><strong><u>CLICK HERE FOR MORE COVERAGE OF MEDIA AND CULTURE</u></strong></a></p><p>Carville closed by reiterating his message to critics, saying they can ""mock us"" and ""make fun of us,"" but his position remains unchanged.</p><p>""We’re not going to change… we’re not going to back off, not one iota,"" Carville noted.</p><p>""James Carville is a stone-cold loser who clearly suffers from a severe and debilitating case of Trump Derangement Syndrome that has rotted his peanut-sized brain,"" White House spokesperson, Davis Ingle, told Fox News Digital.</p>",https://www.foxnews.com/media/carville-unloads-maher-tells-him-get-your-head-out-bari-weisss-a-heated-trump-rant,2026-03-23
1,Department of Education under Trump just took its 'largest' step closer to shutting down,"<p><a href=""https://www.foxnews.com/category/us/education/dept-of-education"" rel=""noopener"" target=""_blank"">The Department of Education</a> (ED) just took a big step closer to shutting down.</p><p>The Trump <a href=""https://www.foxnews.com/category/us/education/administration"" rel=""noopener"" target=""_blank"">administration</a> announced on Thursday an interagency agreement between the ED and the Treasury to move student lending operations to the Treasury, which will ""assume operational responsibility for collecting on defaulted Federal student loan debt and provide operational support to ED’s efforts to return borrowers to repayment,"" the ED <a href=""https://www.ed.gov/about/news/press-release/us-department-of-education-and-us-department-of-treasury-announce-historic-federal-student-assistance-partnership"" rel=""nofollow noopener"" target=""_blank"">said in a release</a>. </p><p>""I think we've been very clear about this last week that this is a multiphase process,"" Nicholas Kent, Undersecretary of Education, told Fox News Digital on Monday.</p><p><a href=""https://www.foxnews.com/media/department-education-pull-back-race-based-criteria-federal-grants"" rel=""noopener"" target=""_blank""><strong>DEPARTMENT OF EDUCATION TO PULL BACK RACE-BASED CRITERIA IN FEDERAL GRANTS</strong></a></p><p>Throughout the 2024 campaign, then-candidate Donald Trump promised to eliminate the Department of Education and signed an executive order directing his administration to <a href=""https://www.foxnews.com/politics/trump-sign-executive-order-abolish-department-education"" rel=""noopener"" target=""_blank""><u>start disbanding it</u></a>. </p><p>""The Secretary has been on the record saying that these interagency agreements are proof of concept, that we want to show Congress, that we want to show families, we want to show moms and dads and families that the Department of Education does not need to be here for federal grant aid and federal student loans to continue flowing to borrowers,"" Kent said.</p><p>Andrew Gillen of the Cato Institute told Fox News Digital that this particular shift in responsibilities is significant because <a href=""https://www.foxnews.com/politics/power-stripped-from-education-department-latest-trump-administration-move-dismantle"" rel=""noopener"" target=""_blank"">previous interagency agreements</a> have been ""relatively small.""</p><p>""Whereas this student loan move–this is the biggest staffing and the biggest budgetary component of the Department of Education. So, if it's sent over to Treasury, this really does indicate that this is moving a substantial portion of the Department of Education elsewhere,"" Gillen said.</p><p>""I think that that's absolutely right,"" Kent said in agreement with Gillen's analysis. ""Characterizing it as the next and largest step toward winding down the Department of Education is absolutely the right way to think about it.""</p><p>This interagency agreement follows the Trump administration’s effort to shift power from a handful of its offices and programs to other federal agencies as it works to dissolve the federal department completely.</p><p><a href=""https://www.foxnews.com/media/trump-admin-cuts-red-tape-iowa-joins-effort-return-education-states"" rel=""noopener"" target=""_blank""><strong>TRUMP ADMIN CUTS RED TAPE AS IOWA JOINS EFFORT TO RETURN EDUCATION TO STATES</strong></a></p><p>""Cutting through layers of red tape in Washington is one essential piece of our final mission,"" Secretary of Education Linda McMahon said in a press release. ""As we partner with these agencies to improve federal programs, we will continue to gather best practices in each state through our 50-state tour, empower local leaders in K-12 <a href=""https://www.foxnews.com/category/us/education"" rel=""noopener"" target=""_blank"">education</a>, restore excellence to higher education, and work with Congress to codify these reforms.""</p><p>The department added that shifting student loan responsibilities to the Treasury will ""mitigate the continuing fallout and cost to taxpayers from the Biden Administration’s mismanagement of the Federal student loan portfolio, and facilitate the return of defaulted borrowers to repayment.""</p><p>The total of student loans owed is at nearly $1.7 trillion, according to the department. It said less than 40% of borrowers arrange a repayment plan and almost 25% of them are in default.</p><p>""This will benefit students by streamlining the aid application and student loan repayment processes and save taxpayers money by reducing losses on student loans,"" Gillen told Fox News Digital. ""Once the move is complete, Education’s biggest budgetary and staffing requirements will be handled elsewhere, which will make it much more feasible to shut down the Department of Education.""</p><p><a href=""https://www.foxnews.com/media/mcmahon-recounts-story-reassuring-parent-special-needs-funding-continue-department-shrinks"" rel=""noopener"" target=""_blank""><strong>MCMAHON RECOUNTS STORY OF REASSURING PARENT OF SPECIAL NEEDS THAT FUNDING WILL CONTINUE AS DEPARTMENT SHRINKS</strong></a></p><p>The ED has made ""historic progress in such a short period of time,"" according to Kent. </p><p>""In over a year, we have reduced the size of the department by over 40%. We have entered into 10 interagency agreements. We have done multiple staff details for other agencies where staff who are in the department are literally physically sitting at other agencies,"" he said. ""We are showing Congress and others that this proof of concept works and that we want to continue to work with Congress to memorialize these changes in legislation and with the ultimate goal of closing down the department and putting ourselves out of a job.""</p>",https://www.foxnews.com/media/department-education-under-trump-just-took-big-step-closer-shutting-down-expert-says,2026-03-23
2,Park Police officer shot in Southeast DC suffers non life-threatening injuries as probe unfolds,"<p>A United States Park Police officer was shot in <a href=""https://www.foxnews.com/category/us/washington-dc"" rel=""noopener"" target=""_blank"">Southeast Washington, D.C.</a>, the D.C. Police Union confirmed Monday.</p><p>""We can confirm that a member of US Park Police was shot in the 5000 blk of Queens Stroll Place SE,"" the union posted on X. ""We’re all sending prayers for the officer and @1791FOP at this time.""</p><p>U.S. Park Police also confirmed that the officer was shot, adding the injured officer is suffering from non life-threatening injuries. Park police also said the incident happened at about 7:30 p.m.</p><p>Fox News Digital has reached out to the Metropolitan <a href=""https://www.foxnews.com/category/us/crime/police-and-law-enforcement"" rel=""noopener"" target=""_blank"">Police Department</a> for additional information.</p><p><a href=""https://www.foxnews.com/us/florida-officer-shot-face-during-service-call-tied-mental-health-dispute-suspect-killed"" rel=""noopener"" target=""_blank""><strong>FLORIDA OFFICER SHOT IN FACE DURING SERVICE CALL TIED TO MENTAL HEALTH DISPUTE; SUSPECT KILLED</strong></a></p><p>Authorities shut down multiple blocks in the area, restricting both vehicle and pedestrian access as police responded to the incident, FOX 5 in D.C. reported.</p><p>The closures include areas along Benning Road SE as well as nearby residential streets, including the 5000 through 5100 block of Queens Stroll Place SE and the 4600 block of Hillside Road SE.</p><p><a href=""https://www.foxnews.com/media/white-house-blasts-ms-now-correspondents-beyond-sick-reaction-dc-shooting-national-guardsmen"" rel=""noopener"" target=""_blank""><strong><u>WHITE HOUSE BLASTS MS NOW CORRESPONDENT'S 'BEYOND SICK' REACTION TO DC SHOOTING OF NATIONAL GUARDSMEN</u></strong></a></p><p>Officials said no vehicular or pedestrian traffic is allowed in the affected zones and are urging the public to avoid the area and follow police directions. Closures remain subject to change.</p><p>The station also reported a heavy law enforcement presence remains as investigators work to determine what led to the shooting.</p><p><a href=""https://www.foxnews.com/us/new-video-emerges-dc-national-guard-shooting"" rel=""noopener"" target=""_blank""><strong>NEW VIDEO EMERGES OF DC NATIONAL GUARD SHOOTING AS SOLDIER CLINGS TO LIFE</strong></a></p><p>FBI Director <a href=""https://www.foxnews.com/category/person/kash-patel"" rel=""noopener"" target=""_blank"">Kash Patel</a> wrote on X that he is praying for the injured officer.</p><p>""Praying for the Park Police officer shot in Washington, D.C. The FBI is actively supporting the investigation alongside our law enforcement partners and will bring those responsible to justice,"" Patel wrote.</p><p>""We will provide updates as we are able - please keep <a href=""https://www.foxnews.com/category/us/military/heroism"" rel=""noopener"" target=""_blank"">the officer and their family</a> in your prayers,"" he added.</p><p><i>This is a developing story.</i></p>",https://www.foxnews.com/us/federal-officer-critical-condition-dc-shooting-authorities-search-answers,2026-03-23
3,Obama adviser reveals private conversations urging Biden not to run in 2016,"<p>A top strategist for former President Barack Obama said he discouraged then-Vice President <a href=""https://millercenter.org/the-presidency/presidential-oral-histories/david-plouffe-oral-history"" rel=""noopener"" target=""_blank"">Joe Biden</a> from running in the 2016 presidential election. </p><p>The University of Virginia’s Miller Center on Monday <a href=""https://millercenter.org/the-presidency/presidential-oral-histories/david-plouffe-oral-history"" rel=""nofollow noopener"" target=""_blank"">published an interview</a> with Obama strategist David Plouffe, who was tasked with informing Biden that he should not run for president because he ""could not win."" At the time, Biden was grieving the death of his son Beau Biden and was well behind Hillary Clinton and <a href=""https://www.foxnews.com/category/person/bernie-sanders"" rel=""noopener"" target=""_blank"">Bernie Sanders</a>. </p><p>""What I would say is: ‘Listen, sir, first of all, I’m concerned about you as a human being. I’m not sure you’re in a state to run. But if this was six, seven months ago, it’s a different conversation. There’s no room. There’s just no room for you,’"" Plouffe said.</p><p><a href=""https://www.foxnews.com/media/former-clinton-aide-warns-democratic-party-has-become-faculty-lounge-intellectual-elitism"" rel=""noopener"" target=""_blank""><strong>FORMER CLINTON AIDE PAUL BEGALA WARNS DEMOCRATIC PARTY HAS BECOME A ‘FACULTY LOUNGE’ OF INTELLECTUAL ELITISM</strong></a></p><p>""Iowa is a tough state for you. New Hampshire is a tough state for you, Bernie’s going to win. And South Carolina, Hillary’s going to clean up there. There’s just no room for you,"" he continued. ""And by the way, Hillary’s not going to implode."" </p><p>Plouffe told Biden that Sanders wouldn’t implode, either. </p><p>""I think he ultimately accepted it, but I think it was more a couple of people around him. They really got him stirred up because part of it was, ‘Well, donors are telling us to run.’ I’m like, ‘Well, I know these donors. Let’s talk about them.’ It was a couple guys in California. I’m like, ‘That’s not a campaign. I get that Hillary is struggling in this campaign vis-a-vis Bernie. That’s true. But there’s no room for you in part because of that. Bernie and Hillary both are guaranteed 80 percent of this electorate,’"" Plouffe said, adding that Clinton was better with Black voters than Biden at the time. </p><p><a href=""https://www.foxnews.com/media/far-left-ex-msnbc-host-argues-kamala-harris-shouldnt-run-2028-cites-biden-policy-stain"" rel=""noopener"" target=""_blank""><strong>FAR-LEFT EX-MSNBC HOST ARGUES KAMALA HARRIS SHOULDN'T RUN IN 2028, CITES BIDEN POLICY 'STAIN'</strong></a></p><p>Plouffe explained that he felt Biden would have struggled against now-<a href=""https://www.foxnews.com/category/person/donald-trump"" rel=""noopener"" target=""_blank"">President Donald</a> Trump but ""didn’t have the trust and character issues that Hillary"" had with the electorate. He suggested Biden may have performed better than Clinton in some areas during the general election, but there was simply no path for him to get there. </p><p>""It’s like, Poor Joe. And my view is, listen, Biden’s career was over. Obama picked him to be vice president. And Biden was very clear he wasn’t going to run even before Beau [died]. But once Beau happened, of course you’re like, there’s no way it’s to going run,"" Plouffe said. </p><p>""By the time he [Biden] kind of kicked the tires on this, we were just fully developed, two incredibly strong, vote-getting candidates,"" he continued. ""And Biden’s natural lane, White working-class, working union guys were kind of split between Sanders and Clinton, but they both had strong support.""</p><p><a href=""https://www.foxnews.com/media/carville-claims-democrats-dont-want-associate-anyone-from-failed-2024-harris-campaign-2028"" rel=""noopener"" target=""_blank""><strong><u>CARVILLE CLAIMS DEMOCRATS DON'T WANT TO ASSOCIATE WITH ANYONE FROM FAILED 2024 HARRIS CAMPAIGN IN 2028</u></strong></a></p><p>Plouffe then shifted gears and said that many Democratic voters objected to former Vice President <a href=""https://www.foxnews.com/category/person/kamala-harris"" rel=""noopener"" target=""_blank"">Kamala Harris</a> receiving the 2024 nomination without the party holding a primary after Biden was essentially forced out of the race.</p><p><a href=""https://www.foxnews.com/media"" rel=""noopener noreferrer nofollow"" target=""_blank""><strong><u>CLICK HERE FOR MORE COVERAGE OF MEDIA AND CULTURE</u></strong></a></p><p>""It really bothered voters more than I thought it would and kind of undercut any kind of authority around the danger Trump posed,"" he said.</p><p>""And by the way, all these Democrats, as they saw it, had covered up Biden. And so, you put that together, which is Kamala kind of being installed in there and then the cover-up on Biden, as voters saw it. I mean, I don’t think the party has fully come to a full reckoning on that,"" Plouffe added. ""I don’t think we should belabor it, but I think every Democrat should obviously say, ‘Of course he shouldn’t have run. We know that now. A good president shouldn’t have run.’ And we should never again have a nominee that isn’t fully vetted by the voters and chosen by the voters."" </p>",https://www.foxnews.com/media/obama-adviser-reveals-private-conversations-urging-biden-not-run-2016,2026-03-23
4,Mullin confirmed as DHS chief as lawmakers near solution on shutdown standoff,"<p>The Senate confirmed Sen. Markwayne Mullin, R-Okla., as the ninth Homeland Security secretary, capping a sprint to replace embattled outgoing Secretary <a href=""https://www.foxnews.com/category/person/kristi-noem"" rel=""noopener"" target=""_blank"">Kristi Noem.</a></p><p>It also caps off a 13-year career in Congress that began in the House and saw Mullin score a seat in the Senate in 2021 where he became the de facto bridge between both chambers, helping to build trust between the House and Senate during last year's push to pass the ""big, beautiful bill."" Ahead of the vote he arrived flanked by his family, and was excited to cast his final vote on himself.  </p><p>Mullin, who was picked by President <a href=""https://www.foxnews.com/category/person/donald-trump"" rel=""noopener"" target=""_blank"">Donald Trump</a> earlier this month to lead the Department of Homeland Security, was confirmed on a largely party-line vote. Sens. John Fetterman, D-Pa., and Martin Heinrich, D-N.M., joined nearly every Republican to clinch his nomination.</p><p>Heinrich said he bucked his party because he has seen that Mullin — who co-chairs the Senate Legislative Branch spending committee with him — ""is not someone who can simply be bullied into changing his views.""</p><p><a href=""https://www.foxnews.com/politics/mullins-confirmation-survives-key-test-vote-dhs-remains-shutdown"" rel=""noopener"" target=""_blank""><strong>MULLIN'S CONFIRMATION SURVIVES KEY TEST VOTE AS DHS REMAINS SHUT DOWN</strong></a></p><p>""And I look forward to having a secretary who doesn’t take their orders from Stephen Miller,"" Heinrich said.</p><p>Sen. <a href=""https://www.foxnews.com/category/person/rand-paul"" rel=""noopener"" target=""_blank"">Rand Paul,</a> R-Ky., was the only Republican to vote against Mullin, citing their chilly relationship and Mullin’s past comments that his 2017 assault was ""justified.""</p><p>Mullin’s confirmation also saw the close of a whirlwind month in which Noem was reassigned after an explosive pair of hearings on Capitol Hill, as well as the deaths of Renee Nicole Good and Alex Pretti, who were fatally shot by Immigration and Customs Enforcement agents.</p><p><a href=""https://www.foxnews.com/politics/schumer-gambit-fails-dhs-shutdown-hits-36-days-airport-lines-grow"" rel=""noopener"" target=""_blank""><strong><u>SCHUMER GAMBIT FAILS AS DHS SHUTDOWN HITS 36 DAYS AND AIRPORT LINES GROW</u></strong></a></p><p>Still, Noem’s ousting and Mullin’s ascension have done little to shift Senate Democrats from their position. They continue to demand sweeping reforms to ICE and have so far blocked funding to the agency five times, along with several GOP attempts to temporarily extend funding to DHS.</p><p>The path to ending the shutdown appeared to become more complicated over the weekend.</p><p>Both sides began meeting for the first time during the shutdown, with Senate Majority Leader John Thune, R-S.D., and Senate Minority Leader <a href=""https://www.foxnews.com/category/person/chuck-schumer"" rel=""noopener"" target=""_blank"">Chuck Schumer,</a> D-N.Y., characterizing the talks as ""productive.""</p><p>However, Trump threw a wrench into negotiations Sunday night, writing on Truth Social: ""I don’t think we should make any deal with the Crazy, Country Destroying, Radical Left Democrats unless, and until, they vote with Republicans to pass ‘THE SAVE AMERICA ACT.’""</p><p><a href=""https://www.foxnews.com/politics/gop-senators-gambit-exposes-false-dem-claims-about-supporting-voter-id"" rel=""noopener"" target=""_blank""><strong><u>GOP SENATOR’S GAMBIT EXPOSES FALSE DEM CLAIMS ABOUT SUPPORTING VOTER ID</u></strong></a></p><p>""In other words, lump everything together as one, and VOTE!!! Kill the Filibuster, and stay in D.C. for Easter, if necessary,"" Trump said.</p><p>That comes after Thune suggested to the president that Republicans could carve out ICE and Customs and Border Protection funding from a <a href=""https://www.foxnews.com/category/topic/government-shutdown"" rel=""noopener"" target=""_blank"">broader DHS package</a> and instead fund those agencies through budget reconciliation.</p><p>Canceling recess may be a hard sell in the upper chamber, given that votes this past weekend were plagued by absences. When asked if he would cancel the upcoming two-week break, Thune said, ""We'll see."" </p><p>A cohort of Senate Republicans met with Trump ahead of Mullin's confirmation vote. Sen. Katie Britt, R-Ala., told reporters after that the meeting went ""really well."" </p><p>When asked if Republicans had a solution to end the closure, she said, ""We do."" </p><p>Still, Senate Democrats remain unified in their opposition to the Safeguarding American Voter Eligibility (SAVE) Act.</p><p>""We're ready to meet with the White House today to keep talking,"" Schumer said. ""In fact, we were going to meet this morning with Tom Homan. But apparently the White House pulled that meeting because of Donald Trump's temper tantrum. They're all scrambling around there in the White House. They don't know what to do.""<i> </i></p>",https://www.foxnews.com/politics/mullin-confirmed-dhs-chief-shutdown-tensions-continue-escalate,2026-03-23
