,title,text,link,publish_date
17,"Senate Dem accuses Trump of being 'unfit for office,' joins growing call to impeach, oust president","<p>Another Senate Democrat has called for President <a href=""https://www.foxnews.com/category/person/donald-trump"" rel=""noopener"" target=""_blank"">Donald Trump</a> to be removed from office over the Iran war.</p><p>""I certainly think the president should be removed,"" Sen. Andy Kim, D-N.J., said. ""I mean, he's unfit for office. I think the 25th Amendment, and if not, then impeachment.""</p><p>Congressional Democrats, particularly in the House, have recently escalated their position against Trump’s war in Iran, shifting from pushing for Congress to reassert its authority in declaring war to demanding that the president be ousted from office.</p><p><a href=""https://www.foxnews.com/politics/rogue-dem-bucks-party-trump-war-powers-calls-iran-47-year-old-war-crime"" rel=""noopener"" target=""_blank""><strong>ROGUE DEM BUCKS PARTY ON TRUMP WAR POWERS, CALLS IRAN ‘47-YEAR-OLD WAR CRIME’</strong></a></p><p>Trump’s comments in the past few days, particularly his <a href=""https://www.foxnews.com/politics/trumps-threat-end-iranian-civilization-sparks-uproar-capitol-hill"" rel=""noopener"" target=""_blank"">threat against Iran</a> that a ""whole civilization will die"" unless the Strait of Hormuz was reopened, sparked the latest growing push to have him removed from office.</p><p>While there is growing sentiment among House Democrats to jettison Trump from office, it’s not as widespread in the Senate. Still, Kim on Thursday joined a small group of <a href=""https://www.foxnews.com/category/democrats"" rel=""noopener"" target=""_blank"">Senate Democrats</a> echoing the desires of their counterparts in the House.</p><p>So far, Sens. Chris Murphy, D-Conn.; Ed Markey, D-Mass.; and Ron Wyden, D-Ore., have all either demanded that Trump be impeached or removed through the 25th Amendment.</p><p><a href=""https://www.foxnews.com/politics/schumer-blasts-trumps-iran-war-failure-moves-rein-war-powers-amid-ceasefire"" rel=""noopener"" target=""_blank""><strong><u>SCHUMER BLASTS TRUMP’S IRAN WAR AS FAILURE, MOVES TO REIN IN HIS WAR POWERS AMID CEASEFIRE</u></strong></a></p><p>Senate Minority Leader <a href=""https://www.foxnews.com/category/person/chuck-schumer"" rel=""noopener"" target=""_blank"">Chuck Schumer,</a> D-N.Y., has stopped short of calling for impeachment, but instead is teeing up another war powers resolution — the fourth since the war began in February — to rein in Trump’s war authority in the region as a fragile two-week ceasefire continues.</p><p>But their calls for removal likely aren’t going to go anywhere now given the political reality in Washington, D.C. Republicans control both chambers of Congress, meaning impeachment is all but a moot point.</p><p>And invoking the 25th Amendment, which has never been used to remove a sitting president, is even more unlikely, given that it would require Vice President <a href=""https://www.foxnews.com/category/person/jd-vance"" rel=""noopener"" target=""_blank"">JD Vance,</a> a majority of Trump’s Cabinet and then a two-thirds majority vote in Congress to remove him.</p><p><a href=""https://www.foxnews.com/politics/top-gop-hawk-graham-warns-iran-deal-troubling-aspects-ceasefire-begins"" rel=""noopener"" target=""_blank""><strong><u>TOP GOP HAWK GRAHAM WARNS IRAN DEAL HAS ‘TROUBLING ASPECTS’ AS CEASEFIRE BEGINS</u></strong></a></p><p>It’s also a desire that Sen. Sheldon Whitehouse, D-R.I., contended was ""not realistic right now, given his oddball Cabinet of sycophants and eccentrics.""</p><p>""We’re going to have to buckle down and win this the old-fashioned way,"" Whitehouse said.</p><p>Democrats’ position does provide foreshadowing of what could happen if they win big in the <a href=""https://www.foxnews.com/category/politics/elections"" rel=""noopener"" target=""_blank"">midterm elections this fall,</a> however.</p><p>Congressional Republicans are still backing Trump’s actions in Iran despite some straying from the party line over his recent apocalyptic comments.</p><p>Senate Majority Whip John Barrasso, R-Wyo., said, ""<a href=""https://www.foxnews.com/category/world/conflicts/iran"" rel=""noopener"" target=""_blank"">Iran has been at war</a> with the United States for 47 years, and it's time for Iran to choose peace.""</p><p>""They haven’t done it yet,"" Barrasso added. ""What we have seen is <a href=""https://www.foxnews.com/category/politics/defense"" rel=""noopener"" target=""_blank"">American peace through strength,</a> and with this operation that is going on now, incredible success by the United States. </p><p>""We have done what we have talked about doing. Eliminate their missiles and eliminate their missile production and eliminate their missile firing capacity, undermine their ability to ever get a nuclear weapon, and sink the navy.""</p><p>Fox News Digital reached out to the White House for comment and has not yet received a reply. </p>",https://www.foxnews.com/politics/senate-dem-accuses-trump-being-unfit-office-joins-growing-call-impeach-oust-president,2026-04-09
18,Angel mom rips sanctuary state after daughter's alleged killer walked free,"<p>Jennifer Bos, whose daughter was allegedly killed and <a href=""https://www.foxnews.com/politics/mother-woman-found-dead-illegals-dumpster-reveals-trumps-three-word-message-her"" rel=""noopener"" target=""_blank"">stuffed in a garbage can</a> by an illegal immigrant, criticized the system that allowed her daughter’s alleged killer to walk free.</p><p>Megan Bos’ decomposing body was found in Waukegan, Ill., in April 2025. Luis Mendoza-Gonzalez, an illegal immigrant from Mexico, is charged with multiple felonies in connection to her death.</p><p>The felonies are not detainable offenses under <a href=""https://www.foxnews.com/category/topic/sanctuary-cities"" rel=""noopener"" target=""_blank"">sanctuary law in Illinois</a>, so Mendoza-Gonzalez walked free after his court appearance, according to the Department of Homeland Security (DHS).</p><p>""It's absolutely insane,"" Jennifer Bos told ""<a href=""https://www.foxnews.com/shows/america-reports"" rel=""noopener"" target=""_blank"">America Reports</a>"" on Thursday. ""I can't even understand how they justified this and argued it in Congress to agree to have this happen.""</p><p><a href=""https://www.foxnews.com/politics/watch-senate-hearing-goes-silent-after-angel-father-confronts-top-dem-over-daughters-death"" rel=""noopener"" target=""_blank""><strong>WATCH: SENATE HEARING GOES SILENT AFTER ANGEL FATHER CONFRONTS TOP DEM OVER DAUGHTER’S DEATH</strong></a></p><p>""I mean, he was found with a body in his yard that he had in his possession for 51 days, hidden in a garbage can while everybody was looking for her,"" she continued.</p><p>Immigration and Customs Enforcement (ICE) arrested him on July 19, 2025.</p><p>Megan Bos was allegedly visiting the home of Mendoza-Gonzalez when he said he found her unresponsive from what he believed was a drug overdose, <a href=""https://www.dhs.gov/news/2026/01/28/why-we-fight-dhs-releases-video-honoring-life-megan-bos-victim-illegal-alien-crime"" rel=""noopener noreferrer nofollow"" target=""_blank"">according to DHS</a>. He allegedly left her body in a basement for several days before placing it in a garbage can in his yard, leaving her there for almost two months.</p><p><a href=""https://www.foxnews.com/media/sanctuary-policies-lead-preventable-deaths-says-father-woman-killed-undocumented-drunk-driver"" rel=""noopener"" target=""_blank""><strong>ANGEL FATHER SLAMS PRITZKER'S SANCTUARY POLICIES, SAYING THEY LEAD TO 'PREVENTABLE' DEATHS</strong></a></p><p>Mendoza-Gonzalez is <a href=""https://www.foxnews.com/category/us/crime/homicide"" rel=""noopener"" target=""_blank"">charged with abuse of a corpse</a>, concealing the death of a person and obstructing justice, but the investigation remains ongoing.</p><p>On Thursday, <a href=""https://www.foxnews.com/category/us/immigration/enforcement"" rel=""noopener"" target=""_blank"">ICE celebrated</a> the one-year anniversary of the relaunch of its Victims of Immigration Crime Engagement (VOICE) office, which provides support to angel families.</p><p>""After she was found, I spent a few months trying to get him [Mendoza-Gonzalez] arrested to no avail because it just wasn't possible in Illinois with those charges,"" Jennifer Bos told Fox News. ""And after ICE came and picked him up, it was shortly after that that I was contacted by the VOICE office.""</p><p><a href=""https://www.foxnews.com/us/illinois-gov-priztker-admits-real-failures-slain-chicago-students-hometown-pays-tribute-lights"" rel=""noopener"" target=""_blank""><strong>ILLINOIS GOV. PRITZKER ADMITS 'REAL FAILURES' AS SLAIN CHICAGO STUDENT'S HOMETOWN PAYS TRIBUTE IN LIGHTS</strong></a></p><p>Bos said the office brought comfort to her after her daughter's slaying, especially during the period when her alleged killer was free.</p><p>""When he was free, when I kind of was standing there — stunned — I did feel incredibly alone and it was such a comfort to have them call me and say, ‘We're here for you. You tell us what you need, and we'll figure it out.’ And that's what they did,"" she said.</p><p>VOICE tracks angel families’ perpetrators should they move to be held in different facilities, which Jennifer Bos said was helpful.</p><p><a href=""https://www.foxnews.com/us/wave-alleged-migrant-murders-ignites-fury-across-us-officials-warn-carnage-crackdown-needed"" rel=""noopener"" target=""_blank""><strong>WAVE OF ALLEGED MIGRANT MURDERS IGNITES FURY ACROSS US AS OFFICIALS WARN OF MORE CARNAGE, CRACKDOWN NEEDED</strong></a></p><p>The VOICE office was established during President <a href=""https://www.foxnews.com/category/person/donald-trump"" rel=""noopener"" target=""_blank"">Donald Trump</a>’s first term, but was dismantled during the Biden administration. Former DHS Secretary <a href=""https://www.foxnews.com/category/person/kristi-noem"" rel=""noopener"" target=""_blank"">Kristi Noem</a> relaunched it in April 2025.</p><p>Acting ICE Director Todd Lyons said since <a href=""https://www.foxnews.com/category/us/immigration/immigrant-rights"" rel=""noopener"" target=""_blank"">VOICE’s relaunch</a>, the group has fielded nearly 900 calls from victims, their family members or advocates who needed ""real help.""</p><p>Jennifer Bos criticized claims that immigrants commit crimes at a much lower rate than American-born citizens.</p><p>""If it's a crime, if they've murdered somebody, if they altered somebody's life permanently with violence, why does it matter what the percentage of crime they commit as a whole is? It doesn't matter,"" she said.</p><p>Megan Bos would have celebrated her 38th birthday in January.</p>",https://www.foxnews.com/media/angel-mom-rips-sanctuary-state-daughters-alleged-killer-walked-free,2026-04-09
19,Unearthed clip exposes shocking claim by Newsom's wife about inmates at violent California prison,"<p>California Governor Gavin Newsom's wife, <a href=""https://www.foxnews.com/media/gavin-newsoms-wife-scolds-reporters-planned-parenthood-funding-bill-signing-ceremony"" rel=""noopener"" target=""_blank"">Jennifer Siebel Newsom,</a> is getting raked over the coals for comments she made several years ago, suggesting criminals housed in a notorious California prison, which was known for housing violent criminals and death row prisoners, got there by ""accident.""</p><p>Siebel Newsom's comments came as she was discussing a tragedy in her younger life at an event in 2016. A few days before her seventh birthday, Siebel Newsom was involved in a fatal golf cart accident that ultimately killed her sister.  </p><p>""I had to be very raw when we interviewed the young men who were juvenile offenders at <a href=""https://www.foxnews.com/us/blue-state-prioritizing-criminals-239m-taxpayer-funded-prison-project-prosecutor-says"" rel=""noopener"" target=""_blank"">San Quentin.</a> I told them about my own loss, where I lost my older sister a few days before my seventh birthday and I blame myself for her death and I share that because they ultimately were accused of committing these violent crimes and sentenced for life, and I think it shocked them that this blonde lady, who was interviewing them, had a similar story – was perhaps in the wrong place at the wrong time – but wasn't punished the way they were because clearly it was an accident, but theirs was probably an accident too,"" Siebel Newsom said when discussing ways to connect with others. </p><p><a href=""https://www.foxnews.com/video/6392646958112"" rel=""noopener"" target=""_blank""><strong>NEWSOM'S WIFE SLAMS TRUMP FIRINGS OF BONDI, NOEM, SPARKING PANEL DEBATE</strong></a> </p><p>""Anyways, I share that – I guess – I quite enjoy spending time with people and being real and unmasking and showing them that it's safe to unmask themselves.""</p><p>A spokesperson for Governor Newsom's wife clarified that the remarks in the 2016 interview with the first partner, were referring to incarcerated individuals for her 2015 documentary ""The Mask You Live In."" </p><p>The spokesperson did not provide an on-the-record statement but did point Fox News Digital to a social media post from <a href=""https://www.foxnews.com/category/person/gavin-newsom"" rel=""noopener"" target=""_blank"">Gov. Newsom's press office</a> calling out the media for being ""focused on running nonstop hit pieces on California’s First Partner,"" while the president is ""threatening to obliterate a civilization tonight."" </p><p>On Tuesday, the same day the clip began going viral on social media, President Donald Trump issued an ominous message on his social media platform Truth Social, indicating ""a whole civilization will die tonight,"" amid his threat of a looming U.S. attack against Iranian bridges and power plants.</p><p>""This is the MAGA distraction machine — in full force,"" concluded the social media post, which included news segments criticizing Siebel Newsom on Tuesday.</p><p><a href=""https://www.foxnews.com/media/gavin-newsoms-wife-says-she-gave-her-boys-dolls-play-resurfaced-clip"" rel=""noopener"" target=""_blank""><strong>GAVIN NEWSOM'S WIFE SAYS SHE GAVE HER BOYS DOLLS TO PLAY WITH IN RESURFACED CLIP</strong></a></p><p>However, Siebel Newsom's resurfaced comments still garnered attention on Tuesday from conservative critics who called the California governor's spouse out for virtue signaling.</p><p>In direct response to Siebel Newsom's claims that San Quentin inmates got in their position by ""accident,"" Rep. Tim Burchett, R-Tenn., shot back sarcastically: ""Yeah, like the time that guy accidentally stabbed that dude 27 times.""</p><p>""What the…"" commented Assistant Attorney General for Civil Rights at the <a href=""https://www.foxnews.com/category/politics/justice-department"" rel=""noopener"" target=""_blank"">U.S. Department of Justice,</a> Harmeet Dhillon, in a social media post responding to the 2016 remarks.</p><p>""She represents everything that is wrong with California,"" <a href=""https://x.com/mazemoore/status/2041525612968399124?s=20"" rel=""nofollow noopener"" target=""_blank"">comedian Adam Carolla added</a>. </p><p>""Newsom’s wife’s latest virtue signal is telling San Quentin lifers that she faced zero consequences when her sister was killed because it was an accident, then telling them their life sentences are probably for ‘accidents’ too,"" wrote conservative women's sports activist Riley Gaines. ""Peak elite tone-deafness.""</p>",https://www.foxnews.com/politics/unearthed-clip-exposes-shocking-claim-newsoms-wife-inmates-violent-california-prison,2026-04-09
20,Biden-appointed judge at center of repeated clashes with Trump administration issues new immigration block,"<p>A Biden-appointed federal judge twice rebuked by the <a href=""https://www.foxnews.com/category/politics/judiciary/supreme-court"" rel=""noopener"" target=""_blank"">Supreme Court</a> temporarily blocked another Trump administration immigration priority, postponing the termination of temporary protected status for Ethiopians living in the U.S.</p><p>Judge Brian Murphy of Massachusetts, who has become a frequent legal hurdle for the Trump administration, found that the Department of Homeland Security did not follow proper protocols when it decided to cancel the temporary protected status (TPS) of more than 5,000 Ethiopians in the United States. </p><p>DHS' decision would have made the migrants eligible for deportation in 60 days and aligned with the Trump administration's goal of dramatically narrowing the government's use of TPS as part of its immigration crackdown.</p><p>Conservatives lashed out at Murphy on social media for dealing another loss to the president they perceived as unjust. Sen. Eric Schmitt, R-Mo., said the ruling was not subject to judicial review under federal immigration law. Murphy had found that DHS did not meet the necessary conditions under the law to legally cancel TPS.</p><p><a href=""https://www.foxnews.com/politics/dc-court-rulings-stall-trump-agenda-across-immigration-policing-fed-raising-stakes-executive-power"" rel=""noopener"" target=""_blank""><strong>DC COURT RULINGS STALL TRUMP AGENDA ACROSS IMMIGRATION, POLICING, FED — RAISING STAKES ON EXECUTIVE POWER</strong></a></p><p>""This Rogue Judge lacks the subject matter jurisdiction to issue this order,"" <a href=""https://x.com/SenEricSchmitt/status/2042016418846130383?s=20"" rel=""nofollow noopener"" target=""_blank"">Schmitt</a> said. ""The assault on the rule of law continues.""</p><p>George Washington University law professor <a href=""https://x.com/JonathanTurley/status/2042214742102540416?s=20"" rel=""nofollow noopener"" target=""_blank"">Jonathan Turley</a> pointed to his writings on Murphy, saying ""this system cannot function with such rogue operators at the trial level.""</p><p>Murphy emerged as a thorn to the government when he issued a series of rulings last year blocking DHS from deporting migrants to countries other than their nations of origin, leading the Supreme Court to twice reverse his rulings, including by issuing a rare 7-2 clarification saying that Murphy had flouted the high court's order. </p><p>His recent order doubling down on his prior rulings in the <a href=""https://www.foxnews.com/politics/top-us-court-hands-trump-win-deportations-scotus-challenge-looms"" rel=""noopener"" target=""_blank"">case was blocked</a> by an appeals court last month.</p><p>Murphy noted that he was not bucking the Supreme Court with his TPS opinion after the justices issued a string of emergency rulings green-lighting the cancellation of TPS for some countries, while holding off on addressing it for others.</p><p>""Note that the Supreme Court gave no explanation for its recent stays of related, but not identical, district court orders. … Nor did the Supreme Court explain its subsequent decision not to stay the district court orders in two consolidated,"" Murphy wrote, saying, therefore, that there was ""no reason to assume"" the Supreme Court’s opinion on TPS.</p><p>Iowa Solicitor General <a href=""https://x.com/EWess92/status/2042130040826044660?s=20"" rel=""nofollow noopener"" target=""_blank"">Eric Wessan</a> said the law did not permit judges to weigh in on TPS and noted the Supreme Court's position.</p><p>""One big problem for Murphy is the statute: It explains TPS determinations aren't reviewable. Another is the Supreme Court, which has stopped similar orders twice!"" Wessan said. ""He finds neither statute nor SCOTUS stops him. I'm unconvinced.""</p><p>Last month, Murphy also temporarily blocked Health and Human Services Secretary Robert F. Kennedy Jr.'s vaccine overhaul, finding Kennedy's revised immunization plan reducing the number of vaccines required for children likely violated the law. The move prompted <a href=""https://www.foxnews.com/politics/biden-appointed-judge-twice-shut-down-scotus-faces-activist-fire-after-latest-trump-policy-block"" rel=""noopener"" target=""_blank"">fierce criticism</a> from conservatives, who accused Murphy of activism and selectively weighing ""science"" in the case.</p><p><a href=""https://www.foxnews.com/politics/biden-appointed-judge-twice-shut-down-scotus-faces-activist-fire-after-latest-trump-policy-block"" rel=""noopener"" target=""_blank""><strong>BIDEN-APPOINTED JUDGE TWICE SHUT DOWN BY SCOTUS FACES 'ACTIVIST' FIRE AFTER LATEST TRUMP POLICY BLOCK</strong></a></p><p>The TPS lawsuit, brought this year by an immigration advocacy group and three Ethiopians with protected status, alleged that DHS violated immigration laws and acted with animus by unconstitutionally discriminating against Ethiopian migrants. </p><p>DHS canceled TPS for a string of countries, ""the apparent goal of which is to significantly reduce the number of non-white and non-European immigrants in the United States,"" the plaintiffs' lawyers wrote in the complaint.</p><p>""That animus and related rhetoric have been particularly stark for the nationals of majority Black countries,"" the lawyers wrote.</p><p>The <a href=""https://www.foxnews.com/category/politics/justice-department"" rel=""noopener"" target=""_blank"">Department of Justice</a> could appeal Murphy's ruling, leading to another legal escalation of a prominent case before him. Fox News Digital reached out to the DOJ and Murphy's chambers for comment.</p>",https://www.foxnews.com/politics/biden-appointed-judge-center-repeated-clashes-trump-admin-issues-new-immigration-block,2026-04-09
