,title,text,link,publish_date
12,"Sheriff shrugs off missteps in Nancy Guthrie case, calls for captor to ‘let her go’ as family pleads for help","<p>As the search for <a href=""https://www.foxnews.com/category/person/nancy-guthrie"" rel=""noopener"" target=""_blank"">Nancy Guthrie</a> nears two months, the sheriff leading the investigation is delivering a blunt message to whoever may be responsible while her family pleads for renewed attention to the case.</p><p><a href=""https://www.kvoa.com/news/nancy-guthrie/bring-her-home-the-disappearance-of-nancy-guthrie---a-news-4-tucson-special/article_5e1a1c93-2893-405b-b809-8f494f11d927.html"" rel=""nofollow noopener"" target=""_blank"">In a new interview with News 4 Tucson</a>, Pima County Sheriff Chris Nanos defended his department’s handling of the investigation and insisted he has no regrets about decisions made early on, even as the case remains unsolved.</p><p>""Look, I have no regrets about my team and their efforts,"" Nanos said. ""I don’t regret we let the crime scene go too soon or any of that.""</p><p>Guthrie, 84, the mother of ""Today"" co-host <a href=""https://www.foxnews.com/category/person/savannah-guthrie"" rel=""noopener"" target=""_blank"">Savannah Guthrie</a>, disappeared the night of Jan. 31 after returning home from dinner with family and was reported missing Feb. 1 after she failed to show up for church.</p><p><a href=""https://www.foxnews.com/us/savannah-guthrie-returns-today-show-studio-first-time-since-mother-went-missing"" rel=""noopener"" target=""_blank""><strong>SAVANNAH GUTHRIE RETURNS TO 'TODAY' SHOW STUDIO FOR FIRST TIME SINCE MOTHER WENT MISSING</strong></a></p><p>Authorities have released <a href=""https://www.foxnews.com/us/new-security-images-uncovered-nancy-guthrie-abduction-case-fbi-investigation-continues"" rel=""noopener"" target=""_blank"">doorbell camera images showing</a> a masked suspect outside her Catalina Foothills home the night she vanished. Investigators say they continue to rely heavily on digital evidence, including cellphone data, surveillance video and other forensic analysis, but have not announced any arrests.</p><p>When asked what he would say to the person or people behind Guthrie’s disappearance, Nanos issued a direct appeal.</p><p>""Just give her up. Let her go,"" he said. ""Take her to a clinic, a hospital. Drop her off. Just let her go.""</p><p><a href=""https://www.foxnews.com/us/nancy-guthrie-disappearance-sheriff-says-authorities-looking-car-caught-ring-cam-havent-made-id-yet"" rel=""noopener"" target=""_blank""><strong>NANCY GUTHRIE DISAPPEARANCE: SHERIFF SAYS AUTHORITIES LOOKING INTO CAR CAUGHT ON RING CAM, HAVEN'T MADE ID YET</strong></a></p><p>As <a href=""https://www.foxnews.com/category/us/crime/cold-case"" rel=""noopener"" target=""_blank"">investigators continue their work</a>, Guthrie’s family is urging the public to take a fresh look at anything that could help break the case.</p><p>""We desperately ask this community for renewed attention to our mom’s case,"" the family wrote in an Instagram post shared over the weekend. ""Please consult camera footage, journal notes, text messages, observations, or conversations that in retrospect may hold significance.""</p><p>""No detail is too small. It may be the key.""</p><p><a href=""https://www.foxnews.com/us/nancy-guthrie-disappearance-forensic-scientist-encourages-new-investigative-approach-case-isnt-cold-yet"" rel=""noopener"" target=""_blank""><strong>NANCY GUTHRIE MISSING: FORENSIC SCIENTIST ENCOURAGES NEW INVESTIGATIVE APPROACH SINCE CASE 'ISN'T COLD YET'</strong></a></p><p>The family pointed to several critical timelines, including the evening of Jan. 31, the early morning hours of Feb. 1 and the late evening of Jan. 11, suggesting <a href=""https://www.foxnews.com/us/masked-suspect-seen-nancy-guthries-home-three-weeks-before-her-abduction-sources-say"" rel=""noopener"" target=""_blank"">previously released video of</a> a masked man at Guthrie’s doorstep weeks before her disappearance could be significant.</p><p>""We continue to believe it is Tucsonans, and the greater <a href=""https://www.foxnews.com/category/us/us-regions/southwest/arizona"" rel=""noopener"" target=""_blank"">Southern Arizona community</a>, that hold the key to finding resolution in this case,"" the statement said. ""Someone knows something. It’s possible a member of this community has information that they do not even realize is significant.""</p><p><a href=""https://www.foxnews.com/us/sheriff-warns-nancy-guthrie-suspect-could-absolutely-strike-again-hints-motive"" rel=""noopener"" target=""_blank""><strong>SHERIFF WARNS NANCY GUTHRIE SUSPECT COULD 'ABSOLUTELY' STRIKE AGAIN, HINTS AT MOTIVE</strong></a></p><p>""Someone knows something,"" the family wrote. ""It’s possible a member of this community has information that they do not even realize is significant.""</p><p>News 4 Tucson's special also highlighted the deep toll Guthrie’s disappearance has taken on Tucson, where colleagues, neighbors and strangers alike have rallied around her family with vigils, tips, flowers and handwritten messages of hope.</p><p>Former colleagues described Guthrie as a quiet but powerful force in southern Arizona, someone whose work left a lasting mark on public health, education and journalism. Jacqueline Sharkey, a former University of Arizona professor who worked with Guthrie for decades, remembered her as ""this quiet leader who was so effective without ever working at it,"" according to the outlet.</p><p>Others recalled Guthrie’s role in helping save the poison information center at the University of Arizona, gathering more than 20,000 signatures before the internet era to keep the program alive — work that one colleague said went on to benefit thousands of Arizonans.</p><p><a href=""https://www.foxnews.com/us/nancy-guthrie-update-retired-k9-officer-says-decision-cadaver-dogs-defies-logic"" rel=""noopener"" target=""_blank""><strong>NANCY GUTHRIE UPDATE: RETIRED K9 OFFICER SAYS DECISION NOT TO USE CADAVER DOGS ‘DEFIES LOGIC’</strong></a></p><p>Dave Cuillier, who worked with Guthrie on the journalism school’s advisory council, called her ""a huge champion of journalism and the University of Arizona"" and said ""she had a quiet power,"" according to News 4 Tucson.</p><p>The special also showed how support for Guthrie has spread well beyond her neighborhood.</p><p>One moment highlighted Melanie, who began making yellow ribbons of hope to keep attention on the case — something she and a friend had previously done for other missing women, including Laci Peterson and Natalee Holloway. This time, compelled by Guthrie’s story, she began making them again and sending them to Tucson.</p><p>The ribbons are now being worn by employees at El Charro, the Tucson restaurant where Guthrie had lunch with her daughters just months before her disappearance.</p><p>Ray Flores, president of Flores Concepts, said the case hit hard after staff realized ""it wasn’t just a simple lost person issue."" Though he said he did not know Nancy personally, he recalled seeing the closeness between Guthrie and her daughters during that visit and said the pain has been felt across the city.</p><p>""You could tell they were a very loving family,"" Flores said, according to News 4 Tucson. ""Whenever you have that kind of pain hit, it affects you because you can feel it in your own community and your own heart.""</p><p>El Charro workers have embraced the <a href=""https://www.foxnews.com/category/topic/missing-persons"" rel=""noopener"" target=""_blank"">ribbon campaign</a> as a way to keep awareness alive as the weeks drag on.</p><p><a href=""https://twitter.com/FoxTrueCrime"" rel=""noopener"" target=""_blank""><strong>FOLLOW THE FOX TRUE CRIME TEAM ON X</strong></a></p><p>""We’re still supporting them, and we’re still thinking about them every single day,"" one employee said.</p><p>Beyond the ribbons and tributes, the special showed how Guthrie’s disappearance has left a lasting mark on her own neighborhood.</p><p><a href=""https://www.foxnews.com/newsletters"" rel=""noopener"" target=""_blank""><strong>SIGN UP TO GET TRUE CRIME NEWSLETTER</strong></a></p><p>At the same time, neighbors in the Catalina Foothills have quietly organized their own efforts — <a href=""https://www.foxnews.com/us/nancy-guthries-neighbors-flag-camera-glitching-experts-explain-wi-fi-jamming"" rel=""noopener"" target=""_blank"">gathering surveillance footage, cross-referencing</a> video from nearby homes and passing potentially useful material on to <a href=""https://www.foxnews.com/category/us/crime/police-and-law-enforcement"" rel=""noopener"" target=""_blank"">law enforcement</a>.</p><p>One neighbor told the station the group’s goal is simple: to help investigators by being ""targeted and useful.""</p><p><a href=""https://www.foxnews.com/tips"" rel=""noopener"" target=""_blank""><strong>SEND US A TIP HERE</strong></a></p><p>Residents say they are also checking in more often, taking extra security measures and even considering reviving a neighborhood watch.</p><p>The special described the case as ""a community united with one plea"" — bring her home.</p><p><a href=""https://link.podtrac.com/cjdr_fnd_article"" rel=""noopener"" target=""_blank""><strong>LISTEN TO THE NEW 'CRIME &amp; JUSTICE WITH DONNA ROTUNNO' PODCAST</strong></a></p><p>That support has only deepened as the investigation has stretched on. Outside Guthrie’s home, a growing shrine of flowers, candles and handwritten notes has become a symbol of the community’s heartbreak and resolve. Savannah Guthrie and family members returned to the site earlier this month, visibly emotional as they took in the tributes left behind.</p><p>In their latest message, the family made clear that their focus remains singular.</p><p><a href=""https://www.foxnews.com/category/us/true-crime"" rel=""noopener"" target=""_blank""><strong>LIKE WHAT YOU'RE READING? FIND MORE ON THE TRUE CRIME HUB</strong></a></p><p>""We miss our mom with every breath, and we cannot be in peace until she is home,"" they wrote. ""We cannot grieve. We can only ache and wonder.""</p><p><a href=""https://www.foxnews.com/us/savannah-guthrie-offers-1-million-family-reward-for-recovery-of-nancy-guthrie"" rel=""noopener"" target=""_blank"">A reward of more than</a> $1 million is being offered for information leading to Guthrie’s recovery.</p><p>Anyone with information is urged to <a href=""https://www.foxnews.com/category/tech/topics/fbi"" rel=""noopener"" target=""_blank"">contact the FBI</a> at 1-800-CALL-FBI or submit a tip through law enforcement.</p><p><i>Fox News Digital's Eric Mack contributed to this report. </i></p>",https://www.foxnews.com/us/sheriff-shrugs-off-missteps-nancy-guthrie-case-calls-captor-let-her-go-family-pleads-help,2026-03-23
13,'Supernatural' actress Carrie Anne Fleming dead at 51,"<p>Carrie Anne Fleming, best known for her roles in ""Supernatural"" and ""iZombie,"" has died following a courageous battle with <a href=""https://www.foxnews.com/category/health/cancer"" rel=""noopener"" target=""_blank"">cancer</a>. She was 51.</p><p>""She died peacefully with her loved ones by her side,"" a representative for Fleming told Fox News Digital in a statement. ""She is survived by her daughter. It was a great privilege to have known Carrie. She was a beautiful soul, inspiring, and above all, kind. She will be greatly missed.""</p><p>Fleming died in Canada, her rep confirmed.</p><p><a href=""https://www.foxnews.com/entertainment/hollywood-stars-who-died-2026-photos"" rel=""noopener"" target=""_blank""><strong>HOLLYWOOD STARS WHO DIED IN 2026</strong></a></p><p>Earlier this month, Jim Beaver — who portrayed Fleming's onscreen husband Bobby Singer on ""Supernatural"" — paid tribute to his late co-star on social media.</p><p><a href=""https://www.foxnews.com/newsletters?cmpid=fnfirstnl"" rel=""noopener"" target=""_blank""><strong>CLICK HERE TO SIGN UP FOR THE ENTERTAINMENT NEWSLETTER</strong></a></p><p>""She was a powerhouse of vitality and goodwill and amazingly good nature, with a rapturous laugh and an utterly adorable personality that didn't seem to have an off switch,"" Beaver wrote on <a href=""https://www.facebook.com/jim.beaver.7731/posts/pfbid02TjRnWuezHHpzEFET6gndRBWxNzQGt2AXSkYCvXHNherXLfzvtKs4hsmA41Yx3vegl"" rel=""nofollow noopener"" target=""_blank"">Facebook.</a></p><p>Beaver told <a href=""https://variety.com/2026/tv/news/carrie-anne-fleming-dead-izombie-supernatural-1236696349/"" rel=""nofollow noopener"" target=""_blank"">Variety</a> that Fleming died of breast cancer complications. </p><p>Fleming was born on Aug. 16, 1974, in <a href=""https://www.foxnews.com/category/world/world-regions/canada"" rel=""noopener"" target=""_blank"">Nova Scotia, Canada</a>.</p><p><a href=""https://www.foxnews.com/entertainment"" rel=""noopener"" target=""_blank""><strong>LIKE WHAT YOU’RE READING? CLICK HERE FOR MORE ENTERTAINMENT NEWS</strong></a></p><p>The actress landed her first onscreen role in the 1994 TV movie ""Viper,"" according to <a href=""https://www.hollywoodreporter.com/tv/tv-news/carrie-anne-fleming-dead-izombie-supernatural-actress-1236544023/"" rel=""nofollow noopener"" target=""_blank"">The Hollywood Reporter</a>. She later received an uncredited appearance in the 1996 comedy ""Happy Gilmore."" </p><p>However, Fleming's most notable onscreen appearances include her <a href=""https://www.foxnews.com/category/entertainment/tv"" rel=""noopener"" target=""_blank"">role as Candy in ""iZombie""</a> from 2015 to 2019, and her role as Karen Singer in ""Supernatural"" for three episodes. </p><p>Fleming also appeared in several British Columbia stage productions, including ""Noises Off,"" ""Romeo and Juliet,"" ""Steel Magnolias"" and ""Fame,"" according to Variety. </p>",https://www.foxnews.com/entertainment/supernatural-actress-carrie-anne-fleming-dead-51,2026-03-23
14,"Johnson turns up heat on Schumer as DHS shutdown drags on, airport delays mount","<p>Speaker <a href=""https://www.foxnews.com/category/person/mike-johnson"" rel=""noopener"" target=""_blank"">Mike Johnson, R-La.,</a> is ratcheting up pressure on Senate Minority Leader Chuck Schumer, D-N.Y., and Democrats in the upper chamber as the Department of Homeland Security (DHS) shutdown creeps into a sixth week with no end in sight.</p><p>House GOP leaders are poised to hold votes Thursday on a pair of bills aimed at putting Democrats on the spot for the shutdown, Fox News Digital has learned.</p><p>Johnson is having the House vote for a third time on <a href=""https://www.foxnews.com/category/politics/executive/homeland-security"" rel=""noopener"" target=""_blank"">funding DHS</a> through the end of the fiscal year on Sept. 30. The bill is based on a bipartisan deal struck earlier this year, but Democrats walked away from it en masse in protest of President Donald Trump's strategy to crack down on illegal immigration.</p><p>The second measure is a nonbinding resolution led by Rep. Ryan Mackenzie, R-Pa., expressing support for all agencies under DHS's purview.</p><p><a href=""https://www.foxnews.com/politics/dhs-shutdown-tied-second-longest-ever-dems-again-block-funding-amid-airport-chaos-terrorism-concerns"" rel=""noopener"" target=""_blank""><strong>DHS SHUTDOWN TIED FOR SECOND-LONGEST EVER AS DEMS AGAIN BLOCK FUNDING AMID AIRPORT CHAOS, TERRORISM CONCERNS</strong></a></p><p>It comes as the DHS shutdown, now in its 38th<strong> </strong>day, is wreaking havoc for airline travelers across the country. Major airports in Houston, New Orleans, New York City, and other areas are seeing hours-long delays caused by Transportation Security Administration (TSA) staffing shortages, with scores of <a href=""https://www.foxnews.com/politics/tsa-pay-bill-unveiled-shutdown-leaves-agents-unpaid-strains-airport-security"" rel=""noopener"" target=""_blank"">TSA agents calling out</a> of work amid missed paychecks due to the shutdown.</p><p>TSA agents are poised to miss their paychecks this Friday, the second full pay period missed of the ongoing shutdown. </p><p>The TSA is one of several agencies that operate under DHS, along with Immigrations and Customs Enforcement (ICE), Customs and Border Patrol (CBP), the Cybersecurity and Infrastructure Security Agency (CISA), and the Federal Emergency Management Agency (FEMA), among others.</p><p><a href=""https://www.foxnews.com/politics/exclusive-house-republicans-hold-hearing-dhs-shutdown-risks-amid-travel-surge"" rel=""noopener"" target=""_blank""><strong>EXCLUSIVE: HOUSE REPUBLICANS TO HOLD HEARING ON DHS SHUTDOWN RISKS AMID TRAVEL SURGE</strong></a></p><p>""Anyone waiting for hours just to miss their flights will not soon forget, and Republicans are going to continue reminding Americans that it’s the Democrats putting their safety at risk just to protect criminal illegal aliens,"" a House GOP leadership aide told Fox News Digital on Monday.</p><p>""The problem for Democrats in their latest shutdown is they are hurting American citizens in an effort to protect criminal illegals and reopen our border, as evidenced by their own words and bills they are pushing to defund Customs and Border Patrol.""</p><p>Negotiations on <a href=""https://www.foxnews.com/politics/dems-unmoved-white-house-reveals-dhs-concessions-shutdown-battle"" rel=""noopener"" target=""_blank"">funding DHS have ground</a> to a halt with Republicans rejecting key demands from Democrats for ICE and CBP reforms — specifically requiring judicial warrants for immigration operations and banning agents from wearing face masks — as non-starters.</p><p>Trump also recently threw a wrench in the talks by demanding Republicans not accept any offer from Democrats until left-wing lawmakers agree to advance an unrelated election integrity measure called the SAVE America Act.</p><p>In the Senate, at least a handful of Democrats are needed to overcome a filibuster and advance any DHS funding legislation. </p><p>The House, which operates on a simple majority, passed congressional negotiators' initial DHS funding bill twice — and will likely do so a third time on Thursday.</p><p>The third iteration of the bill is being led by Rep. Juan Ciscomani, R-Ariz.</p><p>""This standoff has gone on long enough,"" Ciscomani told Fox News Digital on Monday. ""The men and women who keep our country safe here at home are a critical part of our national security—they need to get paid, now. These professionals should never be caught in the middle of political games, yet that’s exactly what has happened. It’s shameful.""</p><p>The nonbinding resolution honoring DHS is also likely to pass, but it's unclear how much Democratic support it would get. </p><p>""Instead of joining the bipartisan majority in supporting full funding for DHS, including commonsense reforms like body cameras and de-escalation training, Democratic leadership is afraid of the radical ‘Defund ICE’ movement and unwilling to compromise in order to protect the American people,"" Mackenzie told Fox News Digital. ""This situation is unacceptable, and it must end immediately.""</p><p>Democrats have tried to push <a href=""https://www.foxnews.com/media/sen-john-kennedy-says-he-would-accept-democrats-offer-open-everything-ice-fund-agency-reconciliation"" rel=""noopener"" target=""_blank"">legislation to fund DHS</a> except for agencies related to Trump's immigration crackdown, efforts that have been shunned by the GOP.</p><p>Both Schumer and House Minority Leader Hakeem Jeffries, D-N.Y., have argued that ICE's controversial operations in Minneapolis and other blue cities are reason enough to block any proposal that funds further immigration operations.</p>",https://www.foxnews.com/politics/johnson-turns-up-heat-schumer-dhs-shutdown-drags-on-airport-delays-mount,2026-03-23
15,"Cole Hauser, Kelly Reilly seen for first time as Beth and Rip return in 'Dutton Ranch'","<p>Beth Dutton and Rip Wheeler are returning to the small screen for the ""Yellowstone"" spinoff, ""Dutton Ranch.""</p><p><a href=""https://www.foxnews.com/entertainment/yellowstone-stars-cole-hauser-kelly-reilly-confirmed-spin-off-series-alongside-major-casting-addition"" rel=""noopener"" target=""_blank"">Kelly Reilly and Cole Hauser</a> will be reprising their roles in the new series focused on their romantic relationship. Paramount+ released a teaser trailer as well as first images of Hauser and Reilly in the new series.</p><p>According to a press release, Beth and Rip leave Montana behind for life in Texas. In some of the stills, Hauser and Reilly are seen riding horses and dancing. However, it doesn't seem like it will be smooth sailing for Rip and Beth.</p><p>""As Beth and Rip fight to build a future together — far from the ghosts of Yellowstone — they collide with brutal new realities and a ruthless rival ranch that will stop at nothing to protect its empire,"" a press release states. ""In South Texas, blood runs deeper, forgiveness is fleeting, and the cost of survival might just be your soul.""</p><p><a href=""https://www.foxnews.com/entertainment/michelle-pfeiffer-kurt-russell-revealed-first-images-from-yellowstone-spinoff-the-madison"" rel=""noopener"" target=""_blank""><strong>MICHELLE PFEIFFER AND KURT RUSSELL REVEALED IN FIRST IMAGES FROM 'YELLOWSTONE' SPINOFF 'THE MADISON'</strong></a></p><p>Alongside Hauser and Reilly, ""Dutton Ranch"" stars Juan Pablo Raba, Jai Courtney, J.R. Villarreal, Marc Menchaca, Natalie Alyn Lind, and Ed Harris.</p><p>Fans cannot wait for the ""Yellowstone"" sequel to release.</p><p>""Excuse me ???!!!!! This is what we’ve been waiting for!!!! So exciting!!!"" one user commented on the ""Dutton Ranch"" official <a href=""https://www.instagram.com/reel/DWOzO84jczL/?utm_source=ig_web_copy_link&amp;igsh=MzRlODBiNWFlZA=="" rel=""nofollow noopener"" target=""_blank"">Instagram page</a>. Another added, ""WELCOME TO TEXAS BABY.""</p><p>A third user commented, ""Never been so excited for a series to launch."" Another user wrote, ""This show is about to break ALL the records.""</p><p>Annette Bening will be joining the cast as Beulah Jackson, ""the powerful, cunning and charming head of a major ranch in Texas."" Finn Little will also be returning in his role as Carter, the young boy Beth and Rip took under their wing.</p><p>The show will premiere globally on Paramount+ on May 15.</p><p><a href=""https://www.foxnews.com/entertainment/landman-star-andy-garcia-says-maverick-taylor-sheridan-has-refreshing-approach-hollywood"" rel=""noopener"" target=""_blank""><strong>'LANDMAN' STAR ANDY GARCIA SAYS 'MAVERICK' TAYLOR SHERIDAN HAS REFRESHING APPROACH TO HOLLYWOOD</strong></a></p><p>Other first-look shots show Harris reading a bible in church and Courtney sitting on chair, smoking a cigarette indoors. Reilly was seen standing in the middle of the road at night time in one of the images and Benning was seen deplaning a private jet in another shot.</p><p>It appears that Reilly's Beth will become friendly with Harris's character as one still shows them sitting at the bar together.</p><p><a href=""https://www.foxnews.com/newsletters?cmpid=fnfirstnl"" rel=""noopener"" target=""_blank""><strong>CLICK HERE TO SIGN UP FOR THE ENTERTAINMENT NEWSLETTER</strong></a></p><p>In April 2024, Hauser told <a href=""https://www.countryliving.com/life/entertainment/a60574841/cole-hauser-free-rein-interview/"" rel=""nofollow noopener"" target=""_blank""><u>Country Living</u></a> that he knew Sheridan had a few things up his sleeve for Beth and Rip's love story.</p><p>""But I know that there’s some stuff on the horizon when it comes to Taylor’s ideas for Kelly Reilly and myself, and some of the other cast. I’m excited to see where he goes creatively with that. But right now, it’s just: Let’s finish strong; let’s do the best we can,"" Hauser said at the time.</p><p><a href=""https://www.foxnews.com/entertainment"" rel=""noopener"" target=""_blank""><strong>LIKE WHAT YOU’RE READING? CLICK HERE FOR MORE ENTERTAINMENT NEWS</strong></a></p><p>In an interview with <a href=""https://www.radiotimes.com/tv/drama/kelly-reilly-nonsense-yellowstone-spin-off-rumours-exclusive-newsupdate/"" rel=""nofollow noopener"" target=""_blank""><u>Radio Times</u></a> in March 2024, Reilly advised ""Yellowstone"" fans not to pay attention to everything they read ahead of the finale and also made a subtle hint that Beth Dutton's story was not over.</p><p>""I just care about finishing [the main show] with as much care and as much passion and as much love as I can muster to put into it,"" she told the outlet. ""That’s what I care about. I’m sort of prepping for that now [and] that’s my tunnel vision thing that I care about most. And what goes on beyond that? There are discussions, you know. Don’t believe everything you read. It’s just nonsense. But we’re gonna, you know, let’s wait and see. I don’t have an answer right now. But we’ll see.""</p><p>In August, Fox News Digital confirmed that Hauser and Reilly would star in a ""Yellowstone"" spin-off. Aside from ""Yellowstone,"" Taylor Sheridan already has ""1883"" and <a href=""https://www.foxnews.com/entertainment/1923-star-harrison-ford-embraces-old-fashioned-movie-making-hit-western-show"" rel=""noopener"" target=""_blank""><u>""1923""</u></a> as prequels to the main show. ""The Madison,"" starring Michelle Pfeiffer and Kurt Russell, released earlier this month.</p><p>""Dutton Ranch"" will premiere globally on Paramount+ on May 15, at 8pm ET/PT, with two episodes, and then weekly throughout the series' nine-episode first season.</p>",https://www.foxnews.com/entertainment/cole-hauser-kelly-reilly-seen-first-time-beth-rip-return-dutton-ranch,2026-03-23
