,title,text,link,publish_date
15,Sportscaster Jim Gray says Tiger Woods' DUI arrest is 'another cry for help',"<p>Tiger Woods was taken into custody after a <a href=""https://www.foxnews.com/sports/tiger-woods-crash-florida-masters"" rel=""noopener"" target=""_blank"">rollover crash</a> on Jupiter Island, Florida, Friday, the Martin County Sheriff's Office confirmed.</p><p>At a press conference, Sheriff John Budensiek said the five-time <a href=""https://www.foxnews.com/category/sports/golf/the-masters"" rel=""noopener"" target=""_blank"">Masters winner</a> was traveling at ""a high rate of speed"" when his vehicle collided with another car, causing it to roll over onto the driver's side. </p><p>Budensiek added that Woods appeared to have exited the vehicle by ""crawling"" out of the passenger side.</p><p>Fox News contributor Jim Gray said Woods’ crash and subsequent arrest mark the latest chapter in what he called an ongoing ""sad story.""</p><p><a href=""https://www.foxnews.com/sports"" rel=""noopener"" target=""_blank""><strong>CLICK HERE FOR MORE SPORTS COVERAGE ON FOXNEWS.COM</strong></a></p><p>""It is a sad story, and it continues to be a sad story. We've all been thrilled with him watching him playing golf. He's a national treasure (and) an international icon, perhaps the greatest ever. Jack Nicklaus has more majors, but Tiger (is) widely acclaimed, is the greatest golfer ever,"" Gray said Friday on ""Special Report.""</p><p><a href=""https://www.foxnews.com/sports/tiger-woods-stepping-back-competitive-golf-masters-loom"" rel=""noopener"" target=""_blank""><strong>TIGER WOODS STEPPING BACK INTO COMPETITIVE GOLF AS MASTERS LOOM</strong></a></p><p>""To see this happen, not only once but twice, now the third time … and to have been able to survive the last time and to now go through it again, it just leads you to wonder who is surrounding him. Why does he keep getting in these circumstances? And he's been so great with his driver on the course, perhaps he should get a driver to drive him.""</p><p>Authorities <a href=""https://www.foxnews.com/category/person/tiger-woods"" rel=""noopener"" target=""_blank"">said Woods</a> ""exemplified signs of impairment."" He blew ""triple-zeroes"" for alcohol but refused a urine test.</p><p>""DUI investigators came to the scene here, and Mr. Woods did exemplify signs of impairment. They did several tests on him. Of course, he did explain the injuries and the surgeries that he had. We did take that into account, but they did do some in-depth roadside tests,"" Budensiek added.</p><p>""We really weren't suspicious of alcohol being involved in this case, and that proved to be true at the jail. … But when it came time for us to ask for a urinalysis test, he refused. And, so, he's been charged with DUI, with property damage and refusal to submit to a lawful test.""</p><p>Gray described the incident as a troubling pattern.</p><p>""It's just another cry for help, it's screaming out. At some point, somehow, some way, somebody has to get to him to get him this help. Get him a driver, get out from behind the wheel. When you've had this many surgeries, obviously we see this with professional sports all the time, numerous surgeries leads to just tremendous pain. </p><p>""And with that pain you've got to somehow try to curtail it, and it leads people down this path. I can't speak to whether or not he's gone down that path. I haven't spoken to his doctor, and I haven't spoken to him about it. </p><p>""But we do know from habits and from the patterns that we see from others and his own pattern, that something is drastically off here. Thankfully, he hasn't hurt himself as bad as he did the last time, and he didn't hurt anybody else.""</p><p>The Masters begins April 9 at Augusta National, and Woods recently said he has <a href=""https://www.foxnews.com/sports/tiger-woods-eyes-masters-return-future-ryder-cup-captain-role-amid-back-surgery-rehab"" rel=""noopener"" target=""_blank"">not ruled out playing</a> in the season’s first major.</p><p>In the 14 majors since he won the green jacket in 2019, Woods has failed to muster a top 20 finish. It’s his longest such streak since failing to finish in the top 20 in the first six majors of his career in 1995 and 1996. In his last 26 majors, he has only four top 20 finishes.</p><p>Since finishing tied for ninth at the 2020 Farmers Insurance Open, his best finish in his 18 official events since then has been a tie for 37th at the 2020 PGA Championship.</p><p>""He's given us so many thrills and so much joy. I think it would be a joy for all of us for us to see him get himself back together. To get through the pain. He's had surgeries on his back, his neck, his Achilles, his knee … so on and so forth. </p><p>""They've all added up. Just to be able to see him smile and to be a part of the game and to be around his children and to be able to function normally would be a great joy for us going forward. He doesn't have to live up to himself and what he's done on the golf course in the past. That's set in stone, and it's set forever.""</p><p>Woods has not competed in a professional golf tournament since 2024, when he competed in just five events — the Genesis Invitational and the four majors. He withdrew from the Genesis, finished dead last in the Masters and missed the cut in the other majors.</p><p><i>Fox News' Ryan Morik contributed to this report.</i></p><p><i><strong>Follow Fox News Digital’s </strong></i><a href=""https://twitter.com/FoxNewsSports_"" rel=""nofollow noopener"" target=""_blank""><i><strong>sports coverage on X</strong></i></a><i><strong>, and subscribe to</strong></i><a href=""https://www.foxnews.com/newsletters"" rel=""noopener"" target=""_blank""><i><strong> the Fox News Sports Huddle newsletter</strong></i></a><i><strong>.</strong></i></p>",https://www.foxnews.com/sports/sportscaster-jim-gray-says-tiger-woods-dui-arrest-a-cry-help,2026-03-27
16,"Carville doubles down on theory Trump will 'walk away' from office after midterms, get pardon from JD Vance","<p>Veteran Democratic strategist James Carville doubled down on his theory that President Trump will resign in frustration after losing in the midterms. </p><p>Earlier this month, Carville released a video, <a href=""https://www.foxnews.com/media/carville-doubles-down-getting-called-predicting-trump-admin-collapse-happening-now"" rel=""noopener"" target=""_blank"">""Trump Will Be Gone, Sooner Than You Think!""</a> </p><p>He followed up again Thursday with a video titled <strong>""</strong>Trump Will Chicken Out of the Presidency,"" appearing to reference the phrase ""Trump Always Chickens Out,"" which is often used to mock his half-measures in policy.</p><p>As Carville and his ""Politics War Room"" co-host Al Hunt took questions during their podcast, one listener said that politicians, if they did their jobs, <a href=""https://www.foxnews.com/politics/trump-says-democrats-meaner-than-republicans-warns-impeachment-gop-loses-midterms"" rel=""noopener"" target=""_blank"">would impeach Trump.</a> </p><p><a href=""https://www.foxnews.com/media/james-carville-tells-ex-cnn-host-hes-worried-trump-tamper-2026-midterm-elections"" rel=""noopener"" target=""_blank""><strong><u>JAMES CARVILLE TELLS EX-CNN HOST HE'S WORRIED TRUMP WILL TAMPER WITH 2026 MIDTERM ELECTIONS</u></strong></a></p><p>Hunt politely chided the listener, urging him to ""strike the word ‘impeachment’ from your vocabulary,"" warning that any discussion of impeachment is a distraction that Trump, ironically, wants to be the focus of the national conversation. </p><p>Carville agreed and argued that, if anything, Trump will be <a href=""https://www.foxnews.com/media/carville-predicts-trump-leave-office-next-year-out-frustration-after-midterms"" rel=""noopener"" target=""_blank"">removing himself from power.</a></p><p>""What I'm going to talk about is the possibility of resignation, because he doesn't know how much his life is getting ready to change post November,"" Carville said. </p><p>""He'll still be president,"" <a href=""https://www.youtube.com/watch?v=0f3KuUhuvNY"" rel=""nofollow noopener"" target=""_blank"">Carville said.</a> ""His power is going to just ebb out.</p><p>""This guy's got two years to go. He's lost the whole public opinion. He's lost the whole Senate. He's lost the House. The lobbyists are going to start cutting deals on the other side.</p><p>""You've seen this a thousand times before. The guest list for every cocktail party for everything is going to change, the Christmas part is coming up, and he’s just going to see that seeping out,"" he said, imagining a scenario where it takes the chancellor of Germany 72 hours to return his call.</p><p>""And I think the guy is just soft, and it's horrible when you get hit like he's going to get hit. I think, I think he just gets JD Vance to pardon him, and I think there's a good chance he just says ‘s---' and just walks away. ‘It ain't worth it. That's the best I can do,’"" Carville suggested. ""I don't think he's tough enough to tough this out.""</p><p><a href=""https://www.foxnews.com/politics/trump-says-jd-vance-would-probably-favored-2028-republican-presidential-nomination"" rel=""noopener"" target=""_blank""><strong><u>TRUMP SAYS JD VANCE WOULD BE 'PROBABLY FAVORED' FOR 2028 REPUBLICAN PRESIDENTIAL NOMINATION</u></strong></a></p><p>Hunt agreed, speculating that if Trump does so, he would get some sort of deal from Vance to ensure he will not face prosecution after he leaves power.</p><p>Carville reiterated his argument, saying, ""After being where he is. I don't think he's physically or mentally capable of doing it — of sticking it out. I just think he's fat, lazy and deteriorating. And to the extent that he can see where he is, he might just walk away.""</p><p>""Donald, we hardly knew you, but we sure as hell won't miss you,"" Hunt replied.</p><p><a href=""http://www.foxnews.com/media"" rel=""noopener"" target=""_blank""><strong><u>CLICK HERE FOR MORE COVERAGE OF MEDIA AND CULTURE</u></strong></a></p><p><a href=""https://www.foxnews.com/download"" rel=""noopener"" target=""_blank""><strong><u>CLICK HERE TO GET THE FOX NEWS APP</u></strong></a></p>",https://www.foxnews.com/media/carville-doubles-down-theory-trump-walk-away-from-office-after-midterms-get-pardon-from-jd-vance,2026-03-27
17,"Captain hauls in nearly 500-pound sea giant after grueling battle, feeds most of town","<p>A Florida fisherman changed his luck recently in a big way.</p><p>Captain Jose Rodriguez Jr. of Cudjoe Key, Florida, takes clients out four to five times a week on a Florida Keys <a href=""https://www.foxnews.com/category/great-outdoors/fishing"" rel=""noopener"" target=""_blank"">fishing charter</a> to reel in trophy fish. </p><p>But he'd never come close to catching a monster 500-pound swordfish.</p><p>On Feb. 18, Rodriguez, along with a Pennsylvania family, landed a giant 480-pound swordfish, one of the largest of its kind caught in <a href=""https://www.foxnews.com/category/travel/vacation-destinations/the-florida-keys"" rel=""noopener"" target=""_blank"">the Keys</a> in recent years.</p><p><a href=""https://www.foxnews.com/travel/older-travelers-who-skip-step-popular-vacation-activity-could-risking-health"" rel=""noopener"" target=""_blank""><strong><u>OLDER TRAVELERS WHO SKIP KEY STEP BEFORE POPULAR VACATION ACTIVITY COULD BE RISKING THEIR HEALTH</u></strong></a></p><p>""It was definitely a fight and a struggle,"" Rodriguez, who helps run the family business, Above &amp; Below Fishing Adventures, told Fox News Digital in an interview.</p><p>""We <a href=""https://www.foxnews.com/travel/odd-looking-deep-sea-fish-washes-up-beach-surprising-locals-would-not-expect-run-across"" rel=""noopener"" target=""_blank"">fought the fish</a> for five hours, and it took us at least another half hour to control the fish on the side of the boat before we could pull it over the side,"" he said.</p><p><a href=""https://www.foxnews.com/travel"" rel=""noopener"" target=""_blank"">The Florida Keys</a> are known for drawing large species like swordfish, but landing one of this size requires specialized deep-sea techniques and is considered rare.</p><p>""Everyone's in search of a nickel, which is 500 pounds, but it rarely happens in the Keys,"" said Rodriguez, 25.</p><p><a href=""https://www.foxnews.com/lifestyle"" rel=""noopener"" target=""_blank""><strong><u>CLICK HERE FOR MORE LIFESTYLE STORIES</u></strong></a></p><p>When he started the fishing trip, it seemed like a ""normal"" day, he said. A Pennsylvania couple had <a href=""https://www.foxnews.com/travel/diver-drops-one-knee-100-feet-underwater-breathtaking-fiji-shipwreck-proposal"" rel=""noopener"" target=""_blank"">chartered the boat</a> to celebrate their son's high school graduation.</p><p>As Rodriguez first spotted the swordfish, he knew it was large, but he wasn't sure how massive it would be.</p><p>""Then my mate and I got a really good eye on it, and we basically sealed the deal,"" he said.</p><p>At first, the Pennsylvania family didn't realize the <a href=""https://www.foxnews.com/category/great-outdoors/boating"" rel=""noopener"" target=""_blank"">importance of what was happening,</a> he said. But the two children aboard were big supporters.</p><p>Once the swordfish was caught, there was plenty of work to be done. For starters, there was no simple way to store a fish that huge.</p><p>""A fish that big actually lies on the back deck with ice bags on top of it with towels,"" Rodriguez said. ""There's really no other spot"" for it.</p><p>Then he and his mate <a href=""https://www.foxnews.com/travel/sharks-surround-snorkeling-tourist-during-wild-encounter-they-looked-terrifying"" rel=""noopener"" target=""_blank"">sprayed it with saltwater</a> to bring its core temperature down.</p><p><a href=""https://www.foxnews.com/lifestyle"" rel=""noopener"" target=""_blank""><strong><u>CLICK HERE FOR MORE LIFESTYLE STORIES</u></strong></a></p><p>When they were ready to filet the fish, they completed the process on the boat. </p><p>They didn't have a crane to lift the fish.</p><p>""Not everyone's prepared to catch a <a href=""https://www.foxnews.com/category/science/planet-earth/water"" rel=""noopener"" target=""_blank"">500-pound fish</a>,"" the captain said.</p><p>Only a few such accomplishments have been documented in the last decade, according to available material.</p><p><a href=""https://www.foxnews.com/category/lifestyle/quizzes"" rel=""noopener"" target=""_blank""><strong><u>TEST YOURSELF WITH OUR LATEST LIFESTYLE QUIZ</u></strong></a></p><p>In 2019, Captain Nick Stanczyk landed a legendary 757.8-pound broadbill off Islamorada, one of the largest recreational swordfish ever caught in the U.S., Pelagic Gear noted.</p><p>In 2018, Patrick Vincent, along with Captain Stanczyk, caught a massive 600-pound swordfish off Islamorada, Wild Open Spaces reported.</p><p><a href=""https://www.foxnews.com/newsletters?cmpid=fnfirstnl"" rel=""noopener"" target=""_blank""><strong><u>CLICK HERE TO SIGN UP FOR OUR LIFESTYLE NEWSLETTER</u></strong></a></p><p>After <a href=""https://www.foxnews.com/category/great-outdoors/hunting"" rel=""noopener"" target=""_blank"">Rodriguez's catch,</a> there were about 50-70 people in his community who turned out to admire the fish. </p><p>""We had well over 200 pounds of meat to use,"" he said.</p><p>The Pennsylvania family took 20-30 pounds of it. </p><p>The family decided to donate the rest to people in the town.</p><p>""The whole community was eating swordfish that day,"" Rodriguez said, chuckling.</p><p>When asked if he felt like a local celebrity, he said, ""Almost, yeah. Everybody knows about it. … It's just about being in the right place at the right time, and it <a href=""https://www.foxnews.com/category/good-news"" rel=""noopener"" target=""_blank"">ended up happening</a> to me.""</p>",https://www.foxnews.com/travel/captain-hauls-nearly-500-pound-sea-giant-after-grueling-battle-feeds-most-town,2026-03-27
18,"Watchdog blasts BBC, CNN, NYT for applying 'war crime' label almost exclusively to US, Israel in Iran conflict","<p>Mainstream media outlets reportedly used the phrase ""<a href=""https://www.foxnews.com/category/politics/defense/wars"" rel=""noopener"" target=""_blank"">war crime</a>"" nearly three dozen times in the first three weeks of the Iran conflict, but 88% of that usage was directed toward the U.S. or Israel, according to an analysis released by a U.S.-based, Mideast-focused media watchdog.</p><p>CAMERA, the Committee for Accuracy in Middle East Reporting and Analysis, and its research manager, David Litman, released a study Wednesday counting 32 uses of the term ""war crime"" from the BBC, CNN, NBC News, The New York Times and The Washington Post.</p><p>In his review, Litman asked readers to consider how the term ""war crime"" has been applied in reporting on the conflict, noting that simple internet searches return usages ""almost exclusively"" against the U.S. and Israel.</p><p><a href=""https://www.foxnews.com/media/media-under-fire-journalists-keep-questioning-iran-war-hegseth-calls-them-unpatriotic-anti-trump"" rel=""noopener"" target=""_blank""><strong>MEDIA UNDER FIRE: JOURNALISTS KEEP QUESTIONING IRAN WAR AS HEGSETH CALLS THEM ‘UNPATRIOTIC’ AND ‘ANTI-TRUMP’</strong></a></p><p>""CAMERA found 32 total applications of the phrase ‘war crime’ during the first three weeks of the war (Feb. 28-Mar. 21). Of those, 28 (88 percent) were directed solely toward the actions of the United States and/or Israel,"" Litman wrote on CAMERA’s website. </p><p>""Zero were directed solely toward the actions of the Islamic Republic of Iran. Four (12 percent) were unattributed or directed at both sides.""</p><p>CAMERA found nearly all references stemmed from an airstrike early in the conflict that allegedly <a href=""https://www.foxnews.com/politics/hegseth-announces-pentagon-probe-deadly-strike-iranian-school"" rel=""noopener"" target=""_blank"">destroyed a school in Minab</a>, Iran. The Pentagon is continuing to investigate the incident, according to CAMERA.</p><p>""Several of the other allegations refer to the sinking of an Iranian warship in the Indian Ocean in what can assuredly be classified as a lawful attack,"" Litman wrote.</p><p>The analysis also contrasted that usage with events that have not been labeled ""war crimes"" in CAMERA’s findings.</p><p>The group cited cluster bombs fired by Iran, many of which hit populated areas in Israel and elsewhere.</p><p>""While cluster munitions are not universally banned, using them to target populated areas almost certainly constitutes a war crime,"" the analysis found.</p><p>CAMERA also pointed to <a href=""https://www.foxnews.com/category/politics/defense/wars/war-with-iran"" rel=""noopener"" target=""_blank"">Iranian strikes</a> that hit energy and other key installations in nations not officially engaged in the conflict, such as Kuwait and Bahrain.</p><p><a href=""https://www.foxnews.com/media/pete-hegseth-criticizes-fake-news-coverage-iran-strikes-says-only-tragedies-make-front-page"" rel=""noopener"" target=""_blank""><strong>PETE HEGSETH CRITICIZES 'FAKE NEWS' COVERAGE OF IRAN STRIKES, SAYS ONLY TRAGEDIES MAKE FRONT PAGE</strong></a></p><p>The analysis found that, among the mainstream media sources examined, the term ""war crime"" was not applied to these strikes, and if Iran was cited in a war crimes discussion, it was paired with equal criticism of the West.</p><p>""This journalistic malpractice inverts reality,"" Litman wrote.</p><p>George Mason law professor Adam Mossoff commented on the analysis, writing on X that ""data analytics confirm huge bias in favor of pro-Islamic regime of Iran by BBC, CNN, NBC and NY Times.""</p><p>""These media orgs used ‘war crime’ 32 times in <a href=""https://www.foxnews.com/category/news-events"" rel=""noopener"" target=""_blank"">news reports</a> in the first 3 weeks of the U.S./Israel-Iran war. Zero references solely to crimes by Islamic regime, and 88% media uses referred solely to U.S. or Israel.</p><p>""Islamic regime uses cluster bombs against Israeli civilians, shoots missiles and suicide drones at civilian targets in numerous Arab countries not involved in war, fires missiles at holy sites in Old Jerusalem, [but] zero identification of these war crimes as standalone crimes by major Western media organizations. This is shameful.""</p><p><a href=""https://www.foxnews.com/tag/fox-news"" rel=""noopener"" target=""_blank"">Fox News Digital</a> reached out to communications officials at CNN, the BBC, The Washington Post, The New York Times and NBC News for comment but did not hear back by deadline.</p><p>CAMERA was founded in Washington in 1982 by social worker Winifred Meiselman in response to The Washington Post’s coverage of Israel’s incursion into Lebanon and allegations of <a href=""https://www.foxnews.com/category/columns/bias-alert"" rel=""noopener"" target=""_blank"">anti-Israel bias</a>.</p><p>Early advisors included Sen. Charles Grassley, R-Iowa; former Sen. Rudy Boschwitz, R-Minn.; and former Rep. Tom Lantos, D-Calif., according to its website.</p>",https://www.foxnews.com/politics/watchdog-blasts-bbc-cnn-nyt-applying-war-crime-label-almost-exclusively-us-israel-iran-conflict,2026-03-27
19,LA United School District scandal leads to charges as $22M scheme allegedly drained funds meant for students,"<p>A former <a href=""https://www.foxnews.com/category/us/los-angeles"" rel=""noopener"" target=""_blank"">Los Angeles</a> Unified School District (LAUSD) IT employee and a tech company owner are facing felony charges in what prosecutors describe as one of the ""largest"" alleged money laundering schemes in the district's history.</p><p>Hong ""Grace"" Peng, a former LAUSD technical project manager, and Gautham Sampath, owner of the tech firm Innive, are accused of orchestrating a years-long ""pay-to-play"" scheme that allegedly steered more than $22 million in school district contracts to Sampath’s company.</p><p>""This case involves a blatant abuse of <a href=""https://www.foxnews.com/category/corruption"" rel=""noopener"" target=""_blank"">public trust</a> — funneling taxpayer dollars intended for students into personal coffers,"" Los Angeles County District Attorney Nathan Hochman said in a statement. </p><p>""This vendor, working with an LAUSD project manager, allegedly carried out a multi-year, multi-contract pay-to-play arrangement that siphoned millions of dollars from our schools.""</p><p><a href=""https://www.foxnews.com/politics/dem-la-councilman-stand-trial-felony-corruption-charges-judge-rules"" rel=""noopener"" target=""_blank""><strong>DEM LA COUNCILMAN TO STAND TRIAL ON FELONY CORRUPTION CHARGES, JUDGE RULES</strong></a></p><p>According to prosecutors, Peng played a role in awarding contracts tied to LAUSD’s My Integrated Student Information System (MiSiS) between 2018 and 2022. </p><p>Authorities allege those contracts — totaling $22 million — were largely directed to Innive.</p><p>Investigators say Sampath then funneled more than $3 million back to Peng through intermediaries.</p><p>Prosecutors say messages between the two show discussions about deleting chats, securing contracts and moving money.</p><p>Peng, a Pasadena resident, was charged with <a href=""https://www.foxnews.com/category/crime"" rel=""noopener"" target=""_blank"">felony counts</a> of money laundering and illegally holding a financial interest in government contracts.</p><p><a href=""https://www.foxnews.com/us/los-angeles-hospice-fraud-reaches-billions-medicare-providers-scam-federal-system-fake-companies"" rel=""noopener"" target=""_blank""><strong>LOS ANGELES HOSPICE FRAUD REACHES BILLIONS AS MEDICARE PROVIDERS SCAM FEDERAL SYSTEM WITH FAKE COMPANIES</strong></a></p><p>Sampath, of Flower Mound, Texas, faces similar charges, along with an additional count of aiding and abetting a public official.</p><p>An arrest warrant has been issued for Peng, while Sampath faces <a href=""https://www.foxnews.com/category/us/us-regions/west/california"" rel=""noopener"" target=""_blank"">extradition to California</a>. Court dates have not yet been set.</p><p>Peng resigned from LAUSD in late 2022 after investigators <a href=""https://www.foxnews.com/us/fbi-raids-home-offices-major-los-angeles-school-district-superintendent"" rel=""noopener"" target=""_blank"">executed search warrants</a> at her home and workplace. </p><p>Authorities say Sampath and his company continue to hold government contracts in California and nationwide.</p><p>If convicted, both defendants could face up to seven years in county jail.</p><p><a href=""https://www.foxnews.com/us/former-gavin-newsom-chief-staff-charged-225k-fraud-corruption-scheme-doj-says"" rel=""noopener"" target=""_blank""><strong>FORMER GAVIN NEWSOM CHIEF OF STAFF CHARGED IN $225K FRAUD AND CORRUPTION SCHEME, DOJ SAYS</strong></a></p><p>""We will not tolerate public officials who sell out their responsibilities or contractors who line their pockets by gaming the system,"" Hochman added. ""Both will be held fully accountable.""</p><p>In a statement, LAUSD said it was aware of the charges against Peng.</p><p>""LAUSD is committed to full compliance with all applicable laws, and we expect our employees and business partners to comply with the highest standards of ethics and integrity,"" the school district said in a statement. ""The district will continue to cooperate fully with relevant authorities.""</p><p>Innive did not immediately respond to Fox News Digital's request for comment.</p>",https://www.foxnews.com/us/la-united-school-district-scandal-leads-charges-22m-scheme-allegedly-drained-funds-meant-students,2026-03-27
