,title,text,link,publish_date
0,House avoids unprecedented four-member expulsion week as Swalwell and Gonzales resign instead,"<p>It may have been possible to bequeath this as ""expulsion week.""</p><p>Instead, this might be ""resignation week.""</p><p>The House has only expelled six Members in the history of the republic. But it was possible as recently as Monday that the House was primed to wrestle with a mind-boggling four expulsions.</p><p>It takes a two-thirds vote to expel a Member. The House last expelled one of its own in late 2023: former Rep. <a href=""https://www.foxnews.com/category/person/george-santos"" rel=""noopener"" target=""_blank"">George Santos</a> (R-N.Y.). Before that, you have to go back to 2002 when the House kicked out late Rep. Jim Traficant (D-Ohio).</p><p><a href=""https://www.foxnews.com/politics/5th-accuser-comes-forward-against-rep-eric-swalwell-ahead-expected-resignation"" rel=""noopener"" target=""_blank""><strong>5TH ACCUSER COMES FORWARD AGAINST REP ERIC SWALWELL AHEAD OF EXPECTED RESIGNATION</strong></a></p><p>Here was the chopping block:</p><p>Calls to expel former Rep. <a href=""https://www.foxnews.com/category/person/eric-swalwell"" rel=""noopener"" target=""_blank"">Eric Swalwell</a> (D-Calif.) piled up after reports surfaced that he sexually assaulted a former aide and several other women. Swalwell initially said he would fight the allegations. Then he dropped his bid to become governor of California after a host of once close allies abandoned their support. Swalwell has now resigned, avoiding the ignominious scene of an expulsion.</p><p>Then there was former Rep. Tony Gonzales (R-Texas). At first, Gonzales denied an affair with an aide who committed suicide by setting herself on fire. Gonzales was locked in a tough primary runoff against Republican Congressional candidate Brandon Herrera. But after pressure, Gonzales finally dropped out of the runoff and isn’t standing for re-election. However, Gonzales intended to stay on until his term expired on January 3 next year. But now Gonzales is out the door, too.</p><p><a href=""https://www.foxnews.com/media/top-democrats-call-swalwell-exit-congress-controversy-swirls-around-his-bid-ca-governor"" rel=""noopener"" target=""_blank""><strong>TWO DEMOCRATIC REPS CALL FOR SWALWELL TO EXIT CONGRESS AS CONTROVERSY SWIRLS AROUND HIS BID FOR CA GOVERNOR</strong></a></p><p>So two down, two to go.</p><p>This is where things grow complicated.</p><p>Rep. Sheila Cherfilus-McCormick (D-Fla.) could face expulsion soon. In late March, the House <a href=""https://www.foxnews.com/category/us/congress"" rel=""noopener"" target=""_blank"">Ethics Committee</a> held a rare ""trial,"" declaring she improperly obtained an astonishing $5 million in COVID relief funds. The Ethics panel will likely recommend a punishment for Cherfilus-McCormick next week. The full House doesn’t have to consider or adhere to the prescribed discipline. The congresswoman proclaims her innocence. She faces a criminal trial in Florida in February 2027.</p><p><a href=""https://www.foxnews.com/opinion/why-eric-swalwell-forced-quit-california-governors-race-after-sexual-misconduct-allegations"" rel=""noopener"" target=""_blank""><strong>WHY ERIC SWALWELL WAS FORCED TO QUIT CALIFORNIA GOVERNOR’S RACE AFTER SEXUAL MISCONDUCT ALLEGATIONS</strong></a></p><p>""The facts are indisputable at this point and so I believe it will be the consensus of this body that she should be expelled,"" forecast House Speaker <a href=""https://www.foxnews.com/category/person/mike-johnson"" rel=""noopener"" target=""_blank"">Mike Johnson</a> (R-La.).</p><p>Rep. Greg Stuebe (R-Fla.) filed a resolution to bounce Cherfilus-McCormick from the body a few months ago. </p><p>And for the Republicans, there’s Rep. Cory Mills (R-Fla.). Mills is accused of ""stolen valor"" and exaggeration of his military record. But what triggered the current expulsion push is an allegation that the congressman struck his girlfriend in early 2025. A judge imposed a restraining order against Mills. However, police never charged the congressman. The Ethics Committee is also investigating whether he violated federal campaign rules. But the formal ethics probe of the <a href=""https://www.foxnews.com/category/us/us-regions/southeast/florida"" rel=""noopener"" target=""_blank"">Florida Republican</a> isn’t as far along as the Cherfilus-McCormick inquiry.</p><p><a href=""https://www.foxnews.com/politics/swalwell-resignation-collides-china-linked-scandal-critics-demand-file-release"" rel=""noopener"" target=""_blank""><strong>SWALWELL RESIGNATION COLLIDES WITH CHINA-LINKED SCANDAL AS CRITICS DEMAND FILE RELEASE</strong></a></p><p>Johnson is mindful of that fact.</p><p>""With regard to Mills, I'm not sure the status of the Ethics Committee investigation and that's one of the things I'll be looking into today,"" said Johnson.</p><p>Four troubled Members. Two Democrats and two Republicans. It was that parity which may have primed the House to take the unprecedented step of expelling those four Members before Swalwell and Gonzales announced their resignations. But a push to expel Cherfiulus-McCormick and not Mills creates a host of problems in the House.</p><p><a href=""https://www.foxnews.com/politics/gonzales-hit-expulsion-vote-threat-ahead-expected-resignation"" rel=""noopener"" target=""_blank""><strong>GONZALES HIT WITH EXPULSION VOTE THREAT AHEAD OF EXPECTED RESIGNATION</strong></a></p><p>It’s about the math.</p><p>The House swore-in Rep. Clay Fuller (R-Ga.) on Monday night. Fuller won a special election last week to succeed former Rep. Marjorie Taylor Greene (R-Ga.) who resigned. That GOP gain is likely offset by an anticipated victory by Democratic Congressional candidate Analilia Mejia in a Thursday special election in New Jersey. This is a Democratic seat which has been vacant since New Jersey Gov. and former Congresswoman Mikie Sherill (D) resigned from the House last fall.</p><p>With Swalwell and Gonzales out and Fuller in, the current breakdown is 431 Members: 217 Republicans and 213 Democrats. Rep. Kevin Kiley (I-Calif.) dropped his affiliation with the GOP. The addition of Fuller and presumed win by Meija would make the breakdown 217 to 214 and one independent – with one vacancy, covering 432 Members. After the Swalwell and Gonzales resignations, the remaining open seat is a solidly Republican district in northern California, long held by late Rep. Doug LaMalfa (R-Calif.). He died in January.</p><p><a href=""https://www.foxnews.com/media/eric-swalwell-cable-news-star-years-before-rapid-fall-from-grace"" rel=""noopener"" target=""_blank""><strong>ERIC SWALWELL WAS CABLE NEWS STAR FOR YEARS BEFORE RAPID FALL FROM GRACE</strong></a></p><p>But what happens if the House moves against Cherfilus-McCormick and not Mills? That creates an imbalance between the parties – something which was lost when the potential expulsion of four Members was on the table.</p><p>""What about this issue of parity,"" yours truly asked House Minority Leader Hakeem Jeffries (D-N.Y.).</p><p>""The issue of parity hasn't been something that we've had a conversation about. We've been working through what's in front of us today and that's what we're going to continue to do,"" replied Jeffries.</p><p><a href=""https://www.foxnews.com/politics/lawmakers-put-expulsion-threats-atop-house-agenda-return-sets-up-high-stakes-week"" rel=""noopener"" target=""_blank""><strong>LAWMAKERS PUT EXPULSION THREATS ATOP HOUSE AGENDA AS RETURN SETS UP HIGH-STAKES WEEK</strong></a></p><p>I followed up.</p><p>""But isn't that a concern, though, if they take action against Cherfilus-McCormick? Her ethics process is further along than Mr. Mills,"" I asked.</p><p>""The ethics process is still incomplete and we'll see what the Ethics Committee has to recommend next week,"" replied Jeffries.</p><p><a href=""https://www.foxnews.com/politics/smart-decision-swalwells-resignation-spurs-praise-both-parties-bombshell-allegations"" rel=""noopener"" target=""_blank""><strong>'SMART DECISION': SWALWELL'S RESIGNATION SPURS PRAISE FROM BOTH PARTIES AFTER BOMBSHELL ALLEGATIONS EMERGE</strong></a></p><p>That’s in reference to the upcoming ethics panel meeting, recommending punishment for the Florida Democrat.</p><p>It was one thing if the House may have bounced four Members, two Republicans and two Democrats, all at once. But it’s dicier now that Gonzales and Swalwell stepped aside. It’s further complicated considering the uneven status of the ethics inquiries regarding Cherfilus-McCormick and Mills.</p><p>It seems that Congress is now in a period of establishing new precedents on a regular basis. A record-breaking government shutdown – only superseded by another record-breaking government shutdown. In addition, the House is experiencing a dramatic increase in the raw number of ""censures"" which it doles out to Members. Censure is the second-highest mode of punishment in the House, just below expulsion.</p><p><a href=""https://www.foxnews.com/opinion/jonathan-turley-eric-swalwells-enablers-knew-truth-protected-anyway"" rel=""noopener"" target=""_blank""><strong>JONATHAN TURLEY: ERIC SWALWELL'S ENABLERS KNEW THE TRUTH — AND PROTECTED HIM ANYWAY</strong></a></p><p>The House censured late Rep. Charlie Rangel (D-N.Y.) in late 2010. Prior to that, the House last reprimanded late Reps. Gerry Studds (D-Mass.) and Daniel Crane (R-Ill.) in 1983. But since 2021, the House has censured five Members: Rep. Paul Gosar (R-Ariz.), Sen. <a href=""https://www.foxnews.com/category/person/adam-schiff"" rel=""noopener"" target=""_blank"">Adam Schiff</a> (D-Calif.) – when he served in the House – Rep. <a href=""https://www.foxnews.com/category/person/rashida-tlaib"" rel=""noopener"" target=""_blank"">Rashida Tlaib</a> (D-Mich.), former Rep. Jamaal Bowman (D-N.Y.) and Rep. Al Green (D-Texas).</p><p>House Speaker Mike Johnson (R-La.) recently characterized the censure explosion as the ""political"" weaponization of the ethics process.</p><p>It’s possible the House might not take any immediate action regarding Cherfilus-McCormick and Mills. Lawmakers from both sides may be more willing to expel one of their own – and maybe take one for the team on their side – if a similar outcome is guaranteed across the aisle.</p><p><a href=""https://www.foxnews.com/politics/swalwells-fall-grace-sparks-democrat-rush-return-campaign-contributions-amid-scrutiny"" rel=""noopener"" target=""_blank""><strong>SWALWELL'S FALL FROM GRACE SPARKS DEMOCRAT RUSH TO RETURN CAMPAIGN CONTRIBUTIONS AMID SCRUTINY</strong></a></p><p>With such a tight majority, Republicans may not want to cede power to Democrats if the House expels a GOP Member as they try to cling to the majority. By the same token, it’s doubtful Democrats are willing to absorb a hit when they are within sneezing distance of the majority – if they don’t see a political equilibrium and document consequences for the Republican majority.</p><p>Moreover, tracking where the votes lie for disciplinary action is nearly impossible. What further complicates this is whether any expulsion motion actually comes to a true, up/down vote. There are often motions ""to table"" or kill any resolution to impose discipline against a Member. The same with motions ""to refer"" or dispatch allegations against a Member to the Ethics Committee for additional scrutiny. For instance, the Ethics panel is all but done probing Cherfilus-McCormick and is investigating Mills. So it’s unclear what would happen with any possible motion ""to refer.""</p><p>And let’s be frank: some lawmakers either really want to be on the record voting to discipline one of their colleagues or want no part of it at all. Resolutions to sit in judgment of a colleague is one of the hardest votes lawmakers take. Right up with a vote to go to war. That’s why some prefer the political fig leaf of a ""motion to refer"" or ""motion to table"" to an actual up/down vote to punish one of their own.</p><p>So this could have been ""expulsion week"" on Capitol Hill. It’s certainly ""resignation week."" And if there’s no other disciplinary action, some lawmakers will be resigned to that outcome.</p>",https://www.foxnews.com/politics/house-avoids-unprecedented-four-member-expulsion-week-swalwell-gonzales-resign-instead,2026-04-15
1,New video shows Oklahoma high school principal tackling gunman who opened fire inside the school,"<p>Newly released video shows the moment an Oklahoma <a href=""https://www.foxnews.com/category/us/education/high-school"" rel=""noopener"" target=""_blank"">high school</a> principal confronted and tackled a gunman after he opened fire inside the school.</p><p>The footage shows Pauls Valley High School Principal Kirk Moore <a href=""https://www.foxnews.com/us/oklahoma-principal-shot-leg-praised-tackling-school-shooter-hero"" rel=""noopener"" target=""_blank"">confronting the suspect</a> — identified as 20-year-old former student Victor Hawkins — after he walked into the building on April 7.</p><p>Moore was shot in the leg during the confrontation and was airlifted to a hospital in stable condition, authorities said.</p><p>The video also shows someone opening a door and allowing the suspected shooter into the building.</p><p><a href=""https://www.foxnews.com/us/army-rotc-cadets-recount-taking-down-pro-isis-shooter-old-dominion-university-i-could-have-been-next"" rel=""noopener"" target=""_blank""><strong>ARMY ROTC CADETS RECOUNT TAKING DOWN PRO-ISIS SHOOTER AT OLD DOMINION UNIVERSITY: 'I COULD HAVE BEEN NEXT'</strong></a></p><p>The Oklahoma State Bureau of Investigation (OSBI) told <a href=""https://kfor.com/news/local/dramatic-video-shows-principal-tackling-armed-former-student/"" rel=""noopener"" target=""_blank"">KFOR-TV</a> it does not believe the individual was working with the suspect. Investigators have not determined whether the person who opened the door was a student or staff member, a spokesperson said. </p><p>An OSBI spokesperson told Fox News Digital there are no other suspects in the incident.</p><p>Authorities said the shooting unfolded around 2:21 p.m., prompting a lockdown until officers cleared the scene. Moore and other staff subdued the gunman until law enforcement arrived and arrested Hawkins.</p><p>According to an arrest affidavit obtained by the outlet, Hawkins entered the school carrying two loaded semi-automatic pistols.</p><p><a href=""https://www.foxnews.com/us/texas-man-tackled-church-security-bringing-loaded-gun-ammo-houston-service"" rel=""noopener"" target=""_blank""><strong>TEXAS MAN TACKLED BY CHURCH SECURITY AFTER BRINGING LOADED GUN, AMMO TO HOUSTON SERVICE</strong></a></p><p>The affidavit states Moore ran to the lobby after hearing gunfire, where Hawkins allegedly fired at him, striking him in the leg.</p><p>Moore then ""wrestled with Hawkins on a bench in the foyer and was able to remove Hawkins’ pistol from his hand,"" according to the affidavit. Moore and other staff held the suspect down until officers arrived.</p><p>Hawkins was charged last week with one count of shooting with intent to kill, one count of carrying a weapon into a public assembly, and two counts of feloniously pointing a firearm.</p><p><a href=""https://www.foxnews.com/world/gunman-opens-fire-high-school-turkey-wounding-least-16"" rel=""noopener"" target=""_blank""><strong>GUNMAN OPENS FIRE AT HIGH SCHOOL IN TURKEY, WOUNDING AT LEAST 16</strong></a></p><p>Court documents reviewed by the outlet show Hawkins studied the <a href=""https://www.foxnews.com/category/us/mass-shootings"" rel=""noopener"" target=""_blank"">Columbine school shooting</a> and told investigators he ""wanted to conduct his own school shooting like the Columbine shooters did.""</p><p>After entering the school, Hawkins allegedly pointed a gun and yelled for people to ""get on the ground,<strong>""</strong> KFOR reported.</p><p>He then pointed a gun at a student and attempted to fire, but the weapon malfunctioned, according to the affidavit.</p><p><a href=""https://www.foxnews.com/us/shooting-old-dominion-university-hall-injures-two-gunman-dead"" rel=""noopener"" target=""_blank""><strong>SHOOTING IN OLD DOMINION UNIVERSITY HALL INJURES TWO; GUNMAN DEAD</strong></a></p><p>Hawkins attempted to clear the malfunction before later firing at another student, who raised his hands and pleaded not to be shot, the affidavit states.</p><p>According to investigators, Hawkins lowered his weapon and told the students to leave.</p><p>The OSBI said Moore and school staff acted quickly to stop the attack.</p><p><a href=""https://www.foxnews.com/us/good-samaritan-describes-tackling-trans-shooter-rhode-island-ice-rink-went-gun"" rel=""noopener"" target=""_blank""><strong>‘GOOD SAMARITAN’ DESCRIBES TACKLING TRANS SHOOTER AT RHODE ISLAND ICE RINK: ‘WENT FOR THE GUN’</strong></a></p><p>""The principal of the school had noticed that an adult male subject, 20 years old, had stepped foot into the school with a gun,"" OSBI spokesperson Hunter McKee told <a href=""https://www.koco.com/article/pauls-valley-shooting-high-school-kirk-moore-principal-hero-oklahoma/70956687"" rel=""noopener nofollow"" target=""_blank""><u>KOCO-TV</u></a>. ""When the principal noticed this, he quickly stepped in, as well as other staff. The subject was able to fire multiple rounds, where the principal was hurt, but no one else was.""</p><p>""The actions of the staff and the principal stepping in as soon as they saw a subject with a firearm saved lives today,"" McKee added.</p><p><i>Fox News Digital's Stephen Sorace contributed to this report.</i></p>",https://www.foxnews.com/us/new-video-shows-oklahoma-high-school-principal-tackling-gunman-opened-fire-inside-school,2026-04-15
2,‘Bachelorette’ star Taylor Frankie Paul won’t face new domestic violence charges,"<p><a href=""https://www.foxnews.com/category/us/us-regions/west/utah"" rel=""noopener"" target=""_blank"">Utah reality star</a> Taylor Frankie Paul will not face new domestic violence charges, according to the Salt Lake County District Attorney's office.</p><p>According to <a href=""https://https://people.com/taylor-frankie-paul-wont-face-charges-over-domestic-violence-incidents-dakota-mortensen-11938167"" rel=""noopener nofollow"" target=""_blank"">People</a>, prosecutors claimed on Tuesday that they will not be pressing additional charges against Paul. In February, two Utah police departments opened separate domestic violence investigations involving Paul and her ex-boyfriend, Dakota Mortensen.</p><p>Per the outlet, the press release stated that the incident happened more than two years ago, placing them outside the statute of limitations.</p><p>Mortensen had also reported to police that Paul had scratched him during an explosive fight in February, while Paul claimed she was not the aggressor during that incident. The District Attorney's office noted that any additional domestic violence claims lacked ""sufficient evidence to support filing criminal charges.""</p><p><a href=""https://www.foxnews.com/entertainment/taylor-frankie-paul-says-shes-leaving-mormon-church-amid-hell-earth-domestic-violence-scandal"" rel=""noopener"" target=""_blank""><strong>TAYLOR FRANKIE PAUL SAYS SHE'S LEAVING THE MORMON CHURCH AMID ‘HELL ON EARTH’ DOMESTIC VIOLENCE SCANDAL</strong></a></p><p>Paul previously pleaded guilty to assaulting Mortensen in 2023, which meant any new charges would have violated her parole.</p><p>Fox News Digital has reached out to Paul and Mortensen for comment, but did not immediately receive a response.</p><p>On March 25, authorities in West Jordan, Utah, told Fox News Digital that they were investigating allegations of domestic violence against Paul stemming from an incident in 2024, brought by her ex-boyfriend.</p><p><a href=""https://www.foxnews.com/entertainment/bachelorette-casting-disaster-taylor-frankie-paul-suitor-drove-car-wreck-paralyzed-gop-congressman"" rel=""noopener"" target=""_blank""><strong>'BACHELORETTE' CASTING DISASTER: TAYLOR FRANKIE PAUL SUITOR DROVE CAR IN WRECK THAT PARALYZED GOP CONGRESSMAN</strong></a></p><p>""The West Jordan Police Department is currently investigating an incident involving Taylor Frankie Paul and Dakota Mortensen. The allegations were reported at the end of February 2026, and detectives have reviewed video believed to have been recorded in early to mid-2024,"" authorities confirmed.</p><p>Police were reviewing multiple videos tied to the alleged altercation to determine details and timelines.</p><p>""Investigators are actively working to gather and verify information and are in the process of interviewing those involved. At this time, no charges have been filed, as the investigation remains ongoing.""</p><p>Police in Draper, Utah, confirmed with Fox News Digital that a separate domestic violence investigation involving both Paul and Mortensen had been opened, with allegations on both sides having been reported on Feb. 24 and Feb. 25.</p><p><a href=""https://www.foxnews.com/newsletters?cmpid=fnfirstnl"" rel=""noopener"" target=""_blank""><strong>CLICK HERE TO SIGN UP FOR THE ENTERTAINMENT NEWSLETTER</strong></a></p><p>Due to the domestic violence incident resurfacing, Paul's season of ""The Bachelorette"" was canceled.</p><p>A spokesperson for Paul previously told Fox News Digital, following the cancellation of her season of ""<a href=""https://www.foxnews.com/category/entertainment/the-bachelorette"" rel=""noopener"" target=""_blank""><u>The Bachelorette</u></a>,"" ""Taylor is very grateful for ABC’s support as she prioritizes her family’s safety and security. After years of silently suffering extensive mental and physical abuse as well as threats of retaliation, Taylor is finally gaining the strength to face her accuser and taking steps to ensure that she and her children are protected from any further harm.""</p><p><a href=""https://www.foxnews.com/entertainment"" rel=""noopener"" target=""_blank""><strong>LIKE WHAT YOU’RE READING? CLICK HERE FOR MORE ENTERTAINMENT NEWS</strong></a></p><p>""There are too many women who are suffering in silence as they survive aggressive, jealous ex-partners who refuse to let them move on with their lives,"" the spokesperson continued. ""Taylor has remained silent out of fear of further abuse, retaliation, and public shaming. She is currently exploring all of her options, seeking support, and preparing to own and share her story.""</p><p>The first domestic violence incident resulted in charges against Paul, who pleaded guilty to aggravated assault in August 2023. Video of the incident was shared earlier this month by <a href=""https://www.tmz.com/2026/03/19/video-of-taylor-frankie-paul-beating-dakota-mortensen/"" rel=""nofollow noopener"" target=""_blank"">TMZ</a>, and soon after, ABC announced that it would not be airing Paul's season of ""The Bachelorette.""</p><p>Production on Season 5 of ""<a href=""https://www.foxnews.com/category/entertainment/tv"" rel=""noopener"" target=""_blank"">The Secret Lives of Mormon Wives</a>"" has also reportedly been halted following the resurfaced incident.</p><p><i>Fox News Digital's Stephanie Giang-Paunon contributed to this report.</i></p>",https://www.foxnews.com/entertainment/bachelorette-star-taylor-frankie-paul-wont-face-new-domestic-violence-charges,2026-04-14
