,title,text,link,publish_date
9,Top United Nations Human Rights official points to reparations as the 'key to dismantling systemic racism',"<p>A top United Nations (UN) official on Tuesday pointed to <a href=""https://www.foxnews.com/media/san-francisco-sued-over-reparations-fund-grounds-unlawful-use-taxpayer-money"" rel=""noopener"" target=""_blank"">reparations</a> as the ""key to dismantling systemic racism.""</p><p>The UN High Commissioner for Human Rights, Volker Türk, <a href=""https://news.un.org/en/story/2026/04/1167297"" rel=""nofollow noopener"" target=""_blank"">applauded reparations</a> efforts across the world while speaking at the fifth session of the UN Permanent Forum on People of African Descent. </p><p>The efforts that Türk lauded during his speech were ""anti-discrimination laws, the creation of independent human rights and equality institutions and steps towards reparations.""</p><p><a href=""https://www.foxnews.com/media/chicago-suburb-locals-hope-reparations-program-address-affordability-pressures-black-population-dwindles"" rel=""noopener"" target=""_blank""><strong>CHICAGO SUBURB LOCALS HOPE REPARATIONS ADDRESSES 'AFFORDABILITY PRESSURES' AS BLACK POPULATION DWINDLES</strong></a></p><p>Highlighting the ""daily discrimination"" people of African descent are facing in the workplace, hospitals, classrooms, and interactions with law enforcement, Türk claimed that the situations are ""the direct legacy of colonialism and enslavement.""</p><p>Türk called on Member States to take action, claiming that ""Racism and dehumanising rhetoric"" persists. Member States were asked to adopt ""anti-racism laws, policies, and practices"" to create more inclusive societies. The official reportedly also called on young people of African descent and members of civil society to ""be included at all levels of decision-making and that ""momentum towards reparatory justice should be maintained.""</p><p>Türk’s comments came after the UN <a href=""https://news.un.org/en/story/2026/03/1167199"" rel=""nofollow noopener"" target=""_blank"">adopted a resolution</a> declaring the transatlantic slave trade the gravest crime against humanity and for member states to pursue reparations to rectify ""historical wrongs""</p><p><a href=""https://www.foxnews.com/media/what-first-federal-challenge-local-reparations-program-means-other-cities"" rel=""noopener"" target=""_blank""><strong>WHAT THE FIRST FEDERAL CHALLENGE TO A LOCAL REPARATIONS PROGRAM MEANS FOR OTHER CITIES</strong></a></p><p>""The slave trade and slavery stand among the gravest violations of human rights in human history – an affront to the very principles enshrined in the Charter of our United Nations and the <a href=""http://www.un.org/en/universal-declaration-human-rights/"">Universal Declaration of Human Rights</a>, themselves born, in part, from these injustices of the past,"" Assembly President Annalena Baerbock said. </p><p>The implementation of reparations has been a growing trend in the United States, spanning from <a href=""https://www.foxnews.com/media/president-bidens-hometown-releases-reparations-recommendations-after-similar-efforts-sweep-country"" rel=""noopener"" target=""_blank"">the east to west coast.</a></p><p>Evanston, Illinois was the first local municipality to pass a reparations plan and then issue direct cash payments of $25,000 to local residents to address past racial <a href=""https://www.foxnews.com/category/us/economy/housing"" rel=""noopener"" target=""_blank"">housing</a> discrimination.</p><p><a href=""https://www.foxnews.com/media/cincinnati-may-next-city-fund-reparations-program-marijuana-tax-money"" rel=""noopener"" target=""_blank""><strong>CINCINNATI MAY BE THE NEXT CITY TO FUND REPARATIONS PROGRAM WITH MARIJUANA TAX MONEY</strong></a></p><p>Not too far from Evanston, <a href=""https://www.foxnews.com/media/chicago-moves-toward-reparations-bus-tours-town-halls-150m-deficit-looms"" rel=""noopener"" target=""_blank""><u>Chicago Mayor Brandon Johnson</u></a> is gearing up to issue reparations in some form after launching a community engagement effort called ""Repair Chicago"" to gather experiences of harm of Black residents. On the state level, the Illinois state commission is looking to implement reparations for Black residents after releasing a report that lays out what it called the state's history of harms against them <a href=""https://www.illinois.gov/content/dam/soi/en/web/illinois/iisnewsattachments/32249-022726-adcrc-harms-report-press-release-260227-1.pdf.pdf"" rel=""nofollow noopener"" target=""_blank"">in March.</a></p><p><a href=""https://www.foxnews.com/media/reparations-advocates-pushing-effort-forward-despite-pushback"" rel=""noopener"" target=""_blank"">Despite efforts to issue reparations</a>, some of these programs are facing obstacles due to budgetary or legal pressures.</p>",https://www.foxnews.com/media/top-united-nations-human-rights-official-points-reparations-key-dismantling-systemic-racism,2026-04-14
10,Former Swalwell ally says longtime friendship with him 'clouded my judgement' as rumors swirled in DC,"<p>One of former Rep. <a href=""https://www.foxnews.com/category/person/eric-swalwell"" rel=""noopener"" target=""_blank"">Eric Swalwell's</a>, D-Calif., closest friends in Congress said their tight-knit relationship ""clouded my judgment"" regarding rumors that swirled about the ex-lawmaker for years in Washington, D.C.</p><p>""Eric Swalwell lied to all of us,"" Sen. Ruben Gallego, D-Ariz., said at an impromptu press conference in his office. ""He lied to the most powerful people in this country and they trusted him. They trusted him with some of the most sensitive spots in our government, whether it was on Judiciary Committee, Intel Committee, impeaching <a href=""https://www.foxnews.com/category/person/donald-trump"" rel=""noopener"" target=""_blank"">Donald Trump.""</a></p><p>""And that clouded my judgment, my <a href=""https://www.foxnews.com/category/politics"" rel=""noopener"" target=""_blank"">friendship with him,""</a> he continued. ""Our family's friendship together with him clouded my judgment. And I was wrong. I deeply, deeply regret that.""</p><p><a href=""https://www.foxnews.com/politics/swalwell-out-amid-sexual-assault-allegations-after-13-years-congress"" rel=""noopener"" target=""_blank""><strong><u>SWALWELL OUT AMID SEXUAL ASSAULT ALLEGATIONS AFTER 13 YEARS IN CONGRESS</u></strong></a></p><p>It’s a sharp pivot for Gallego, given that the two had a familial-like relationship. Just last week, Gallego defended Swalwell online against allegations of misconduct, which he later said he regretted.</p><p>Their kids went to baseball camp together, they babysat one another’s children, and Gallego even jumped on board as national chair for Swalwell’s failed 2020 presidential bid.</p><p>But after a bombshell report from the San Francisco Chronicle alleged that Swalwell sexually assaulted a former staffer, his former friend is no longer sticking up for him.</p><p><a href=""https://www.foxnews.com/politics/swalwells-best-friend-congress-turns-on-him-after-bombshell-allegations-torpedo-political-career"" rel=""noopener"" target=""_blank""><strong>SWALWELL'S 'BEST FRIEND' IN CONGRESS TURNS ON HIM AFTER BOMBSHELL ALLEGATIONS TORPEDO HIS POLITICAL CAREER</strong></a></p><p>In the days since that report surfaced, five people in total have accused Swalwell of <a href=""https://www.foxnews.com/category/us/crime/sex-crimes"" rel=""noopener"" target=""_blank"">sexual misconduct</a> or rape.</p><p>Gallego, while heaping blame on Swalwell and apologizing to his alleged victims, maintained that he had no knowledge of the alleged behavior. He noted, however, that rumors had circulated about Swalwell — and other past lawmakers — in the nation’s capital for years.</p><p>When pressed on the nature of those rumors, Gallego said Swalwell was ""flirty,"" but nothing along the lines of the allegations that sank his gubernatorial bid and congressional career — nor activity that ""I would say would rise to the occasion that I would be able to, you know, not talk to his wife the next day and be able to look her in the eye.""</p><p>When allegations began to surface online at the onset of Swalwell’s gubernatorial run, Gallego said Swalwell ""manipulated"" him into believing it was a smear campaign similar to the one used against him during his 2024 Senate race against <a href=""https://www.foxnews.com/category/person/kari-lake"" rel=""noopener"" target=""_blank"">Kari Lake.</a></p><p><a href=""https://www.foxnews.com/politics/pelosi-california-dems-slam-swalwell-bombshell-sexual-assault-allegations-indefensible"" rel=""noopener"" target=""_blank""><strong><u>PELOSI, CALIFORNIA DEMS SLAM SWALWELL OVER BOMBSHELL SEXUAL ASSAULT ALLEGATIONS: 'INDEFENSIBLE'</u></strong></a></p><p>""He knew I came off a horrible race where I had to answer to my family. I have to answer accusations to best friends, to my kids. And he fed into that,"" Gallego said. ""He fed into it and I fell for it like everyone else. I fell for the lies. I regret it, but that's what happened.""</p><p>The two spent significant time together — on official and private trips, on each other’s campaigns, and <a href=""https://www.foxnews.com/category/us/congress"" rel=""noopener"" target=""_blank"">within the halls of Congress.</a></p><p>When asked how it was possible that neither he nor other lawmakers who had known Swalwell for years — including former House Speaker <a href=""https://www.foxnews.com/category/person/nancy-pelosi"" rel=""noopener"" target=""_blank"">Nancy Pelosi,</a> D-Calif. — were aware, Gallego said ""he became very good at being a predator.""</p><p>""And he clearly preyed on these women in different positions. And he became extremely proficient at lying to us, lying to his family, lying to his community,"" Gallego said. ""You know, the nature of his job allowed him to travel. And we just did not fully understand … There's just no way we could have seen any of this.""</p><p>Facing expulsion and a <a href=""https://www.foxnews.com/category/politics/finance/investigations"" rel=""noopener"" target=""_blank"">House Ethics Committee investigation</a> into allegations of his conduct, Swalwell officially resigned from Congress on Tuesday.</p><p>While he apologized to his family and constituents, he doubled down against the accusations leveled against him.</p><p>""I will fight the serious false allegations made against me,"" Swalwell wrote in his resignation letter. ""However, I must take responsibility and ownership for the mistakes I did make.""</p>",https://www.foxnews.com/politics/former-swalwell-ally-says-longtime-friendship-clouded-judgement-rumors-swirled-dc,2026-04-14
11,DOJ seeks to vacate Jan 6 convictions in sweeping move tied to Trump order,"<p>The <a href=""https://www.foxnews.com/category/politics/justice-department"" rel=""noopener"" target=""_blank"">Department of Justice</a> on Tuesday filed motions to vacate the convictions of several high-profile defendants involved in the Jan. 6 Capitol breach.</p><p>The filings, submitted to the Court of Appeals by the United States, specifically seek to vacate criminal judgments against identified members of the Oath Keepers and Proud Boys organizations, most of whom were convicted of seditious conspiracy.</p><p>""In the Executive Branch’s view, it is not in the interests of justice to continue to prosecute this case or the cases of other, similarly situated defendants,"" federal prosecutors in the U.S. Attorney’s Office for the District of Columbia wrote in one filing.</p><p>The move follows a presidential proclamation on Jan. 20, 2025, when President Donald Trump commuted the prison sentences of the defendants to ""time served,"" allowing them to be released without serving additional time.  </p><p><a href=""https://www.foxnews.com/politics/dems-who-praised-cop-killing-j6-protester-now-condemn-ice-shooting-mn-agitator"" rel=""noopener"" target=""_blank""><strong>DEMS WHO PRAISED COP FOR KILLING J6 PROTESTER NOW CONDEMN ICE FOR SHOOTING MN AGITATOR</strong></a></p><p>Tuesday’s filings — which mark an attempt to clear some of the final charges still standing in the probe — also asked to dismiss the indictments ""with prejudice,"" meaning the charges would be permanently dismissed and could not be brought again by the government. </p><p><a href=""https://www.foxnews.com/politics/virginia-dems-mandate-jan-6-taught-violent-insurrection-ban-election-fraud-claims-schools"" rel=""noopener"" target=""_blank""><strong>VIRGINIA DEMS MANDATE JAN. 6 BE TAUGHT AS ‘VIOLENT INSURRECTION,’ BAN ELECTION FRAUD CLAIMS IN SCHOOLS</strong></a></p><p>At least eight primary defendants were named in two similar appeals filed Tuesday.  </p><p>A major high-profile defendant referenced in the filings is Oath Keepers founder Stewart Rhodes, whom prosecutors previously said plotted to ""oppose by force the lawful transfer of presidential power"" when <a href=""https://www.foxnews.com/category/person/donald-trump"" rel=""noopener"" target=""_blank"">Trump lost the 2020 election</a>. Rhodes was sentenced to 18 years in prison for seditious conspiracy and other charges.</p><p><a href=""https://www.foxnews.com/politics/doj-moves-wipe-steve-bannon-contempt-conviction-tied-jan-6-probe"" rel=""noopener"" target=""_blank""><strong>DOJ MOVES TO WIPE STEVE BANNON’S CONTEMPT CONVICTION TIED TO JAN. 6 PROBE</strong></a></p><p>Other mentioned Oath Keepers members include Kelly Meggs, the leader of the Florida chapter of the organization, as well as Kenneth Harrelson and Jessica Watkins.</p><p>Among the Proud Boys members mentioned, Ethan Nordean, one of the group’s leaders, was sentenced to 18 years in prison after being convicted of seditious conspiracy alongside Joseph Biggs and Zachary Rehl, who are also named.</p><p>The Justice Department is also seeking to vacate the conviction of Proud Boys member Dominic Pezzola, who was caught on camera smashing a Capitol window with a riot shield. He was sentenced to 10 years in prison.</p><p>Officials noted that they are also filing similar motions for other related defendants in related cases.</p><p>Hours after returning to office in January, Trump either pardoned or commuted the sentences of nearly all individuals convicted in connection with the Jan. 6, 2021, <a href=""https://www.foxnews.com/category/us/capitol-protests"" rel=""noopener"" target=""_blank"">Capitol breach</a>. More than 1,500 people were arrested in connection with the protest. </p>",https://www.foxnews.com/us/doj-seeks-vacate-jan-6-convictions-sweeping-move-trump-order,2026-04-14
12,Kylie Jenner goes topless on Instagram for latest fashion launch,"<p><a href=""https://www.foxnews.com/category/person/kylie-jenner"" rel=""noopener"" target=""_blank"">Kylie Jenner</a> is stripping back the layers to reveal her most personal project yet.</p><p>The 28-year-old reality icon took to <a href=""https://www.instagram.com/p/DXFTbKKjy2X/?hl=en"" rel=""nofollow noopener"" target=""_blank"">Instagram</a> on Monday to announce the latest drop for her fashion label, Khy. Posing topless in a minimalist portrait, Jenner used her hands to cover her chest while showcasing a sparkling rhinestone tattoo on her upper arm that read, ""I Heart LA.""</p><p>With her long, dark hair cascading down and a soft, bronzed makeup look, the mogul used the bold imagery to signal a ""wiped clean"" era for the brand’s social media.</p><p><a href=""https://www.foxnews.com/newsletters?cmpid=fnfirstnl"" rel=""noopener"" target=""_blank""><strong>CLICK HERE TO SIGN UP FOR THE ENTERTAINMENT NEWSLETTER</strong></a></p><p>The Kylie Cosmetics founder revealed in her caption that the upcoming collection is a tribute to her roots.</p><p>""Born in LA &lt;3 this new collection for @khy is very personal to me,"" she wrote to her 390 million followers. ""It’s inspired, designed, and almost all of it made here in Los Angeles. i can’t wait for this and everything we have coming this year and beyond! .. from LA to wherever you are. xx ky""</p><p>Since its debut in November 2023, Khy has aimed to bridge the gap between high-end luxury and everyday streetwear by partnering with emerging designers. <a href=""https://people.com/kylie-jenner-fashion-brand-khy-hits-one-million-dollars-within-first-hour-of-launch-exclusive-8387010"" rel=""noopener nofollow"" target=""_blank"">People</a> was the first to report the brand’s massive commercial appeal at launch, noting that the label netted over $1 million in sales within its very first hour. This latest ""Born in LA"" collection marks a shift toward domestic production, with Jenner emphasizing that the pieces are manufactured locally.</p><p><a href=""https://www.foxnews.com/entertainment/kim-kardashian-faces-parenting-police-praising-sons-dangerous-e-bike-trick"" rel=""noopener"" target=""_blank""><strong>KIM KARDASHIAN FACES PARENTING POLICE OVER PRAISING SON'S 'DANGEROUS' E-BIKE TRICK</strong></a></p><p>The topless announcement comes on the heels of a busy festival season for the star. Jenner spent the weekend at Coachella, where she was spotted alongside longtime friend Hailey Bieber.</p><p>In a photo shared from the Indio, California, festival, Jenner leaned into the lingerie-as-outerwear trend, sporting a sequined bra top with long fringe paired with baggy, light-wash denim. Bieber stood beside her in a coordinating casual look as the duo enjoyed the desert performances.</p><p><a href=""https://www.foxnews.com/entertainment/kylie-jenner-dazzles-daring-white-string-bikini-poolside-photos"" rel=""noopener"" target=""_blank""><strong>KYLIE JENNER DAZZLES IN DARING WHITE STRING BIKINI FOR POOLSIDE PHOTOS</strong></a></p><p>While her fashion remains on the cutting edge, Jenner recently admitted that her personal life is becoming increasingly centered on family. Speaking on the April 1 debut episode of <a href=""https://https://www.youtube.com/watch?v=hZ5g_PA65fw"" rel=""noopener nofollow"" target=""_blank"">Kid Cudi’s Big Bro podcast</a>, she revealed that she recently sat down with her 8-year-old daughter, Stormi, to watch Keeping Up with the Kardashians for the first time.</p><p>""I sat her down, and I'm like, 'We started a television show when I was a year older than you, and that's why we're all in this together because we were all on the show together,'"" Jenner recalled.</p><p><a href=""https://www.foxnews.com/entertainment"" rel=""noopener"" target=""_blank""><strong>LIKE WHAT YOU’RE READING? CLICK HERE FOR MORE ENTERTAINMENT NEWS</strong></a></p><p><a href=""https://www.foxnews.com/category/media/influencers"" rel=""noopener"" target=""_blank"">The star</a> confessed that watching the early footage left her deeply affected.</p><p>""I was so emotional after,"" she reflected in the interview. ""I don't know what hit me, but I was like weeping in my bed. Like I don't know why that happened to me. I was just like maybe it's like <a href=""https://www.foxnews.com/category/lifestyle/parenting"" rel=""noopener"" target=""_blank"">my daughter being the same age</a> as I was and just seeing like my family, and I'm like, you know, just feeling so grateful for all that we've built and like but also mourning like that closeness when we were all kind of living under the same roof.""</p><p><a href=""https://https://www.foxnews.com/entertainment/justin-bieber-10m-coachella-comeback-draws-backlash-plays-youtube-videos-set"" rel=""noopener"" target=""_blank""><strong>JUSTIN BIEBER'S $10M COACHELLA COMEBACK DRAWS BACKLASH AFTER HE PLAYS YOUTUBE VIDEOS DURING HIS SET</strong></a></p><p>Jenner added that it was a ""very emotional"" experience that allowed her to travel back in time. ""I didn't know it was going to hit me like that,"" she said, noting that she fast-forwarded through ""inappropriate"" parts of the show for her daughter.</p><p>Beyond the nostalgia, Jenner noted that her children remain the primary force that keeps her centered. ""I have my family. I have my kids that I go home to that love me so much and have no idea what's going on in this world,"" she said. ""They definitely keep me grounded.""</p>",https://www.foxnews.com/entertainment/kylie-jenner-goes-topless-instagram-latest-fashion-launch,2026-04-14
