,title,text,link,publish_date
0,Veteran '60 Minutes' reporter says the network 'crumbled' under Trump's pressure,"<p>A veteran ""60 Minutes"" journalist slammed the previous owners of his parent network, CBS, for settling an election interference lawsuit with President <a href=""https://www.foxnews.com/category/person/donald-trump"" rel=""noopener"" target=""_blank"">Donald Trump</a>.</p><p>""Our previous owners at CBS faced political pressure and crumbled‚"" Scott Pelley said, according to The Guardian’s Jeremy Barr, referencing the fallout over the <a href=""https://www.foxnews.com/media/former-60-minutes-producer-says-he-pressured-apologize-over-harris-interview"" rel=""noopener"" target=""_blank"">legal dispute between Trump</a> and CBS. Pelley was introducing former ""60 Minutes"" executive producer Bill Owens at the National Press Foundation Annual Journalism Awards Dinner last week. </p><p>Pelley was referencing former CBS parent company, Paramount Global, before it was merged with Skydance Media, run by David Ellison, the son of billionaire Oracle founder and Trump ally Larry Ellison.</p><p><a href=""https://www.foxnews.com/media/cbs-news-transition-whos-whos-out-after-tumultuous-year-network"" rel=""noopener"" target=""_blank""><strong>CBS NEWS IN TRANSITION: WHO'S IN AND WHO'S OUT AFTER A TUMULTUOUS YEAR AT THE NETWORK</strong></a></p><p>In the days leading up to the 2024 presidential election, CBS News aired its ""60 Minutes"" interview featuring then-Vice President <a href=""https://www.foxnews.com/category/person/kamala-harris"" rel=""noopener"" target=""_blank""><u>Kamala Harris</u></a>. Critics at the time noticed that an answer she gave to a question about Israel that first aired in a preview clip on ""Face the Nation,"" which was mocked by conservatives for her ""word salad"" comments, appeared to have been swapped with a different answer that aired during the primetime election special the next evening.</p><p>Trump accused the network of election interference and filed a $20 billion lawsuit against the company. </p><p>After months of contentious mediation, Paramount and CBS settled Trump's lawsuit for a sum expected to be north of $30 million, including $16 million upfront for Trump's presidential library.</p><p><a href=""https://www.foxnews.com/media/cbs-news-correspondent-announces-sudden-exit-from-network-says-hes-seeking-some-independence"" rel=""noopener"" target=""_blank""><strong>CBS NEWS CORRESPONDENT ANNOUNCES SUDDEN EXIT FROM NETWORK, SAYS HE’S SEEKING ‘SOME INDEPENDENCE’</strong></a></p><p>Barr also posted on X that <a href=""https://www.foxnews.com/media/cbs-news-transition-whos-whos-out-after-tumultuous-year-network"" rel=""noopener"" target=""_blank"">veteran ""60 Minutes"" journalist</a> Lesley Stahl claimed she would have followed former executive producer of the show Bill Owens in resigning during the company's contentious legal battle with Trump. </p><p>""We would have followed him off the cliff, but he urged us not to,"" Stahl reportedly said. </p><p>Owens, who told his colleagues in April of last year that corporate overreach impacted his ability to maintain an independent newsroom. </p><p>When he resigned, <a href=""https://www.nytimes.com/2025/04/22/business/media/cbs-60-minutes-trump-bill-owens.html"" rel=""nofollow noopener"" target=""_blank"">he told his colleagues in a memo</a>, ""over the past months, it has become clear that I would not be allowed to run the show as I have always run it, to make independent decisions based on what was right for 60 Minutes, right for the audience."" </p><p><a href=""https://www.foxnews.com/media/cronkite-era-producer-exits-cbs-news-dramatic-fashion-after-46-years-network"" rel=""noopener"" target=""_blank""><strong>CRONKITE-ERA PRODUCER EXITS CBS NEWS IN DRAMATIC FASHION AFTER 46 YEARS AT NETWORK</strong></a></p><p>A representative from CBS did not respond to <a href=""https://www.foxnews.com/media"" rel=""noopener"" target=""_blank""><u>Fox News Digital's </u></a>request for comment.</p><p><i>Fox News' Joseph Wulfsohn contributed to this report. </i></p>",https://www.foxnews.com/media/veteran-60-minutes-reporter-says-network-crumbled-under-trumps-pressure,2026-03-15
1,Team USA Paralympic sled hockey completes clean sweep of Canada at Winter Games,"<p>The <a href=""https://www.foxnews.com/us"" rel=""noopener"" target=""_blank"">United States</a> has defeated Canada on Olympic ice yet again to secure gold, this time in the Paralympic Games. </p><p>After a 6-2 victory over <a href=""https://www.foxnews.com/category/world/world-regions/canada"" rel=""noopener"" target=""_blank"">Canada</a> on Sunday, the U.S. took home gold in men’s Paralympics sled hockey. </p><p>In doing so, they became the first country to ever win five consecutive Paralympic titles. They were also the first to sweep all three Paralympic and Olympic hockey events at a single tournament. </p><p><a href=""https://www.foxnews.com/sports"" rel=""noopener"" target=""_blank""><strong>CLICK HERE FOR MORE SPORTS COVERAGE ON FOXNEWS.COM</strong></a></p><p>Of course, the men’s and women’s ice hockey teams also won gold, doing so in overtime in both gold-medal games at the <a href=""https://www.foxnews.com/category/sports/olympics"" rel=""noopener"" target=""_blank"">Milan Cortina Games</a> last month. </p><p>But this contest between the sporting rivals didn’t need any extra time, as the U.S. saw Jack Wallace score a hat trick, while notching an assist, to help the Stars and Stripes’ cause over Canada. </p><p>""This team is so special,"" Wallace, who completed his third Paralympic Games, told NBC after the win. ""We love each other. This team grinded it out, a gritty f---ing game. It was unbelievable. I love these guys so much.""</p><p><a href=""https://www.foxnews.com/sports/team-usa-mens-hockey-wins-gold-medal-overtime-against-canada-winter-olympics"" rel=""noopener"" target=""_blank""><strong>TEAM USA MEN'S HOCKEY WINS GOLD MEDAL IN OVERTIME AGAINST CANADA AT WINTER OLYMPICS</strong></a></p><p>Other than Wallace’s goals, Kayden Beasley, Declan Farmer and Brody Roybal each found the back of the net. </p><p>Only Canada’s Liam Hickey could score, tallying two goals that weren’t enough in the end. </p><p>While hockey is usually a sport dominated by the Canadians, the Paralympic Games has seen Team USA in that position for quite some time now. And they showcased why throughout the tournament, going through Italy, Germany, China and Czechia before facing Canada in the gold-medal game. </p><p>Canada is one of the top teams in the world, too, having seen the U.S. in three straight Paralympic gold-medal games as well as eight straight world championship finals. </p><p>But it’s been the U.S. having success at the Olympics, and they continued the trend on Sunday to finish what’s been an exciting time for everyone back home watching the red, white and blue on ice. </p><p>With the Paralympics at an end, Team USA’s gold marked the 13th total since the event began on March 6. The U.S. finished with a tally of 24 total medals, including five silver and six bronze. </p><p>China was the medal leader at the end, notching 44 with 15 gold in the bank.</p><p><i><strong>Follow Fox News Digital’s</strong></i><a href=""https://twitter.com/FoxNewsSports_"" rel=""noopener"" target=""_blank""><i><strong> sports coverage on X</strong></i></a><i><strong> and subscribe to</strong></i><a href=""https://www.foxnews.com/newsletters"" rel=""noopener"" target=""_blank""><i><strong> the Fox News Sports Huddle newsletter</strong></i></a><i><strong>.</strong></i></p>",https://www.foxnews.com/sports/team-usa-paralympic-sled-hockey-completes-clean-sweep-canada-winter-games,2026-03-15
2,Oscars 2026 brings star-studded red-carpet fashion led by Heidi Klum and Rose Byrne,"<p>The <a href=""https://www.foxnews.com/category/entertainment/events/oscars"" rel=""noopener"" target=""_blank"">Oscars red carpet</a> delivered the night’s first winners as Hollywood’s biggest stars stepped out in dazzling looks ahead of the 2026 Academy Awards.</p><p>On Sunday, celebrities arrived in style for the 98th edition of the film industry's most prestigious awards ceremony, which was held at the Dolby Theater in <a href=""https://www.foxnews.com/category/us/us-regions/west/california"" rel=""noopener"" target=""_blank"">Hollywood, California</a> and hosted by comedian and former late night host Conan O’Brien.</p><p>Heidi Klum wowed in a strapless champagne column gown featuring shimmering crystal embellishments and intricate vertical beadwork. The supermodel paired the gown with a stacked diamond choker necklace along with diamond rings and bracelets. </p><p>Klum wore her hair down in loose waves with a center part and rocked a neutral smoky eye and a light pink lipstick. </p><p><a href=""https://www.foxnews.com/category/entertainment/events/oscars"" rel=""noopener"" target=""_blank""><strong>THE OSCARS 2025 | 97TH ACADEMY AWARDS</strong></a></p><p>Rose Byrne stunned in a strapless black mermaid gown that featured delicate embroidered floral appliqués with shimmering beadwork running diagonally across the bodice and down the skirt, which flowed into a train. </p><p>Byrne, who earned her first best actress Oscar nomination for ""If I Had Legs I’d Kick You,"" wore her hair styled into a low, polished bun and accessorized with a gold necklace that wrapped around her neck and ruby stud earrings.</p><p><a href=""https://www.foxnews.com/newsletters?cmpid=fnfirstnl"" rel=""noopener"" target=""_blank""><strong>CLICK HERE TO SIGN UP FOR THE ENTERTAINMENT NEWSLETTER</strong></a></p><p>Felicity Jones stepped onto the red carpet in a <a href=""https://www.foxnews.com/category/style-and-beauty/modeling"" rel=""noopener"" target=""_blank"">pale yellow gown</a> with a sleek bodice and airy tulle skirt that featured subtle sparkling embellishments. Jones, a previous Oscar nominee for ""The Theory of Everything,"" wore her hair in soft waves and sported delicate jewelry including diamond drop earrings and a bracelet. </p><p>Alicia Silverstone donned an elegant Christian Siriano evening gown that featured a strapless black velvet bodice with a sweetheart neckline and a floor-length white draped skirt. The ""Bugonia"" star accessorized with a delicate diamond necklace that had a small pendant and matching drop earrings.</p><p><a href=""https://www.foxnews.com/entertainment"" rel=""noopener"" target=""_blank""><strong>LIKE WHAT YOU’RE READING? CLICK HERE FOR MORE ENTERTAINMENT NEWS</strong></a></p><p><a href=""https://www.foxnews.com/category/person/bella-thorne"" rel=""noopener"" target=""_blank"">Bella Thorne</a> embraced edgy glamour in a sheer black form-fitting floor-length gown featuring a transparent mesh neckline and sleeves with dramatic feathered cuffs. ""The DUFF"" star wore her hair pulled back in a half updo and rocked a bold dark manicure. She accessorized simply with diamond drop earrings.</p><p><a href=""https://www.foxnews.com/category/person/kevin-oleary"" rel=""noopener"" target=""_blank"">Kevin O'Leary</a> commanded attention as he hit the red carpet in a black jacket adorned with intricate silver embroidery that had a sash-style belt, black trousers and red velvet loafers. The ""Shark Tank"" star known as ""Mr. Wonderful,"" completed his look with a statement necklace that had a large pendant which appeared to be a framed collectible card.</p><p>O'Leary, who made his acting debut in Josh Safdie’s ""Marty Supreme,"" has been known to wear a rare <a href=""https://www.foxnews.com/category/person/michael-jordan"" rel=""noopener"" target=""_blank"">Michael Jordan</a>–Kobe Bryant trading card set in gold and diamonds as a necklace on red carpets, a piece reportedly valued at up to $20 million.</p><p>Ariana Greenblatt channeled Old Hollywood in an off-the-shoulder ivory satin gown that featured a draped neckline with floral  appliques and a sleek fitted skirt that flowed into a long train. The ""Barbie"" star's hair was styled in voluminous curls, and she completed her look with delicate diamond drop earrings. </p>",https://www.foxnews.com/entertainment/oscars-2026-brings-star-studded-red-carpet-fashion-led-heidi-klum-rose-byrne,2026-03-15
3,Ex-NBA star says Kobe Bryant gave him mysterious message about afterlife in 'vivid' dream,"<p>The late <a href=""https://www.foxnews.com/category/sports/nba/los-angeles-lakers"" rel=""noopener"" target=""_blank"">Los Angeles Lakers</a> legend Kobe Bryant recently came into a ""vivid"" dream that one of his former teammates had. </p><p>Lamar Odom, who won back-to-back NBA titles <a href=""https://www.foxnews.com/category/person/kobe-bryant"" rel=""noopener"" target=""_blank"">alongside Bryant</a> during this time together with the Lakers, recently revealed to the ""Doubl3 Coverage Podcast"" that he was competing against Bryant in a three-point contest and actor Billy Crystal was hosting it. </p><p>But as they were competing in the dream, Odom said Bryant stopped and looked at him. </p><p><a href=""https://www.foxnews.com/sports"" rel=""noopener"" target=""_blank""><strong>CLICK HERE FOR MORE SPORTS COVERAGE ON FOXNEWS.COM</strong></a></p><p>""He just stopped and he looked back at me. He said, ‘Hello, the afterlife is not what people make it up to be.’ And then I woke up shortly after that,"" Odom said <a href=""https://www.youtube.com/watch?v=CWXV9QXPH1M&amp;t=1s"" rel=""nofollow noopener"" target=""_blank"">on the podcast</a>. </p><p>Though a dream, Odom got thinking after that, believing his old teammate was trying to send him a message. </p><p>""Could be he [misses] everybody, that can mean a [multitude] of things. Maybe he’s still traveling, to wherever he has to go or have to get. I don’t know what it meant, but I just take it as live your best life now. Don’t sell yourself short,"" Odom explained. </p><p><a href=""https://www.foxnews.com/entertainment/lamar-odom-arrested-charged-dui-las-vegas"" rel=""noopener"" target=""_blank""><strong>LAMAR ODOM ARRESTED AND CHARGED WITH DUI IN LAS VEGAS</strong></a></p><p>Odom’s own life experiences also brought about the afterlife conversation with himself. </p><p>Odom discussed it after nearly dying from a drug overdose in 2015, touching on it in a Netflix documentary, ""The Death &amp; Life of Lamar Odom."" Doctors said he had 12 strokes and six heart attacks after being found unresponsive in a brothel near <a href=""https://www.foxnews.com/category/us/las-vegas"" rel=""noopener"" target=""_blank"">Las Vegas</a> in October 2015. He was placed in a medically induced coma, and would later wake up. </p><p>In the documentary, he said the afterlife was not what he had expected, and then heard Bryant now in his dream. </p><p>""I died and I couldn’t tell you where we go, you know what I mean?"" he said on the podcast. ""I think there’s a lot in life that we all live for, whether it’s your friends or family, money, whatever you fall in love with. You love it now because we’ve seen from his accident, nobody is promised tomorrow. I think that’s the biggest lesson I learned from his life.""</p><p>Bryant and eight others, including his 13-year-old daughter Gianna, died in a helicopter crash in Calabasas, California, on Jan. 26, 2020. </p><p>Odom and Bryant played together on the Lakers from 2004 until 2011, winning two NBA titles while the former won Sixth Man of the Year during the 2010-11 season. </p><p>Odom played 14 NBA seasons, which included five seasons with the Los Angeles Clippers and one season each with the Miami Heat and Dallas Mavericks. </p><p><i><strong>Follow Fox News Digital’s</strong></i><a href=""https://twitter.com/FoxNewsSports_"" rel=""noopener"" target=""_blank""><i><strong> sports coverage on X</strong></i></a><i><strong> and subscribe to</strong></i><a href=""https://www.foxnews.com/newsletters"" rel=""noopener"" target=""_blank""><i><strong> the Fox News Sports Huddle newsletter</strong></i></a><i><strong>.</strong></i></p>",https://www.foxnews.com/sports/ex-nba-star-says-kobe-bryant-gave-him-mysterious-message-about-afterlife-vivid-dream,2026-03-15
4,"Schiff, Booker deflect on shutdown blame amid terror concerns, thousands of DHS workers without pay","<p>Sens. <a href=""https://www.foxnews.com/category/person/adam-schiff"" rel=""noopener"" target=""_blank"">Adam Schiff</a>, D-Calif., and Cory Booker, D-N.J., deflected blame when pressed whether their party should vote to end the Department of Homeland Security (DHS) shutdown on Sunday, which has left workers without paychecks for weeks.</p><p>""We saw terror attacks in West Bloomfield, Michigan, in Norfolk, Virginia. This morning, the <a href=""https://www.foxnews.com/politics/airline-ceos-torch-lawmakers-turning-air-travel-political-football"" rel=""noopener"" target=""_blank"">CEOs of the nation's major airlines</a> and cargo carriers have written a letter to Congress calling for them to end the shutdown, talking about the importance of American security in the airways,"" NBC's Kristen Welker asked Schiff during ""Meet the Press"" on Sunday. ""Is it responsible for Democrats to hold up <a href=""https://www.foxnews.com/category/politics/executive/homeland-security"" rel=""noopener"" target=""_blank"">DHS funding</a> with the threat of terror attacks looming during this conflict?""</p><p>Schiff said the <a href=""https://www.foxnews.com/politics/dems-continue-reject-gop-efforts-fund-ice-dhs-fight-terror-concerns"" rel=""noopener"" target=""_blank"">Democrats wanted to separate</a> ICE from the rest of the funding, and offered to do so multiple times to fund the other agencies affected by the shutdown.</p><p>""We offered vote after vote, resolution after resolution—even as recently as this week—to reopen those agencies, to fund them, and the Republicans voted it down. We said, 'Let's <a href=""https://www.foxnews.com/politics/dems-continue-reject-gop-efforts-fund-ice-dhs-fight-terror-concerns"" rel=""noopener"" target=""_blank"">wall off ICE funding</a>, let's fund these other agencies that protect the country,' and the Republicans, one after another, voted them down. Voted down funding TSA, voted down funding the Coast Guard, voted down funding FEMA. So, Republicans are controlling both houses and the presidency; they can't very well blame the minority party for their own inability to govern, particularly when they're voting down Democratic motions to reopen these agencies,"" Schiff responded.</p><p><a href=""https://www.foxnews.com/politics/two-shootings-intensify-dhs-standoff-gop-warns-rising-terror-threats"" rel=""noopener"" target=""_blank""><strong>TWO SHOOTINGS INTENSIFY DHS STANDOFF AS GOP WARNS OF RISING TERROR THREATS</strong></a></p><p>CNN's Jake Tapper confronted Booker with similar questioning and asked, ""Isn't it time for Democrats to reopen and refund DHS?""</p><p>Tapper said that Democrats ""won the debate"" on ICE in some ways, pointing to <a href=""https://www.foxnews.com/category/person/kristi-noem"" rel=""noopener"" target=""_blank"">Kristi Noem</a>'s firing and Border Czar Tom Homan taking over in Minnesota.</p><p>""Democrats have tried multiple times to try to get TSA, CISA, the Coast Guard funded. Republicans have refused, time and time and time again, to fund,"" Booker began.</p><p>Booker argued that ICE was still doing ""reckless things,"" and added, ""I will not approve another dollar for ICE given all that they're doing. But we should be funding those TSA agents that keep us safe, CISA, Coast Guard, and for Republicans to refuse to do it is unacceptable.""</p><p><a href=""https://www.foxnews.com/politics/dems-vote-keep-dhs-closed-despite-airport-chaos-iranian-sleeper-cell-threat"" rel=""noopener"" target=""_blank""><strong><u>DEMS VOTE TO KEEP DHS CLOSED DESPITE AIRPORT CHAOS, IRANIAN SLEEPER CELL THREAT</u></strong></a></p><p>Former Transportation Secretary Pete Buttigieg also put blame on Republicans during an interview with Tapper on Sunday. </p><p>""I think Republicans should stop blocking the Democratic proposals to fund all of DHS, including TSA and other parts, except for the parts that should be negotiated over, which is ICE and Customs and Border Patrol,"" he said. </p><p><a href=""https://www.foxnews.com/politics/dems-continue-reject-gop-efforts-fund-ice-dhs-fight-terror-concerns"" rel=""noopener"" target=""_blank"">Democrats on Capitol Hill are</a> accusing Republicans of walking away from attempts to shrink the size of a partial government shutdown that began on Feb. 14, arguing that the impasse over funding for Immigration and Customs Enforcement (ICE) doesn’t need to hold up funding for other agencies.</p><p>Sen. Sheldon Whitehouse, D-R.I., said last week that the Democrats were ""totally ready to fund FEMA, TSA, Coast Guard, other elements,"" but that ICE was continuing to ""misbehave.""</p><p>Sen. John Cornyn, R-Texas, scoffed at what they view as Democratic calls to avoid the heart of the gridlock.</p><p><a href=""https://www.foxnews.com/media"" rel=""noopener noreferrer nofollow"" target=""_blank""><strong>CLICK HERE FOR MORE COVERAGE OF MEDIA AND CULTURE</strong></a></p><p>""That’s extremely hypocritical because we’ve already funded ICE,"" Sen. John Cornyn, R-Texas, said, noting that the agency had already received allocations through Trump’s Big Beautiful Bill last year.</p><p>""So, the only thing they’re doing is hurting the air-traveling public through TSA. They’re hurting them and not accomplishing what they’re saying they’re trying to accomplish. It’s shameful,"" Cornyn said.</p>",https://www.foxnews.com/media/schiff-booker-deflect-blame-dhs-shutdown-workers-go-weeks-without-pay,2026-03-15
