,title,text,link,publish_date
0,Olympians react to the IOC's policy change to protect women's sports,"<p>It was a day of <a href=""https://www.foxnews.com/category/sports/olympics"" rel=""noopener"" target=""_blank"">Olympic history</a>. </p><p>After the International Olympic Committee <a href=""https://www.foxnews.com/sports/ioc-announces-new-policy-ensure-only-females-compete-womens-competitions"" rel=""noopener"" target=""_blank"">updated its policies</a> to prevent biological males from competing in women's sports, multiple Olympians have come forward to give their reactions to the change. </p><p>Several Olympians, including gold medalists, have shared their thoughts on the new policy with Fox News Digital. </p><p><a href=""https://www.foxnews.com/sports"" rel=""noopener"" target=""_blank""><strong><u>CLICK HERE FOR MORE SPORTS COVERAGE ON FOXNEWS.COM</u></strong></a></p><p>""Today is a great day for women’s sports, and a big win in the Olympic world. By implementing the sex testing, it will allow for fair competition. It used to happen years ago, and by bringing it back it will protect the women’s category. I think it’s very fitting that <a href=""https://www.foxnews.com/category/us/los-angeles"" rel=""noopener"" target=""_blank"">LA28</a> will be the games to protect women’s sports, as it’s something that our president has advocated for,"" Humphries told Fox News Digital. </p><p>""With the election of Christie Coventry and Olympic Champion and her decision to appoint another woman to lead the medical commission. It was informative that the IOC decided to go outside to reach researchers to base this opinion on science and fairness. And it's the right decision,"" de Varona told Fox News Digital. </p><p>""Really science and research is how this decision was based. I mean, I basically think everyone should have an opportunity in sport but in the Olympic arena, it's a zero-sum game."" </p><p>""The best news! About time!"" Skinner told Fox News Digital.</p><p>""This is huge for women’s sport. For years, female athletes have asked for clarity, consistency, and fairness in competition. Not politics. Not ambiguity. Just clear standards that protect the integrity of the category we train our entire lives to compete in. Sport only works when rules are applied consistently and athletes can trust them,"" Uhlaender told Fox News Digital. </p><p>""Progress doesn’t come from avoiding hard conversations, it comes from addressing them with courage. Thank you to everyone who helped to make this happen, who protected women’s sport.""</p><p>""This is a long-overdue return to common sense, and the IOC deserves credit for taking a clear stand. At the elite level, fairness matters—and protecting the women’s category based on biological reality is essential to preserving it,"" Clary told Fox News Digital. </p><p>""As an Olympian, I didn’t dedicate my life to competing on a manipulated playing field—one tilted and disguised as inclusion. Women’s sport exists because biological differences matter—strength, power, and muscle developed through male puberty aren’t erased, and pretending otherwise erases us. Fairness isn’t controversial. Let little girls dream of gold — not allow those dreams to be lost or tarnished.""</p><p>""Better late than never. This decision by the IOC is a big step in the right direction. After all, it has long been known that one cannot change one’s sex, and if someone was born a man, then even if they start wearing women’s clothing, they will still remain a man. Besides, there are significant differences between the two sexes in terms of strength and speed, which puts female athletes at a disadvantage right from the start,""Czyzowicz told Fox News Digital. </p><p>""So, it is absolutely clear that it would not be fair for biological males to compete in the female category. In addition, in some sports it would simply not be safe.I believe this decision protects women’s sports, specifically by preventing transgender athletes from competing against biological women.""</p><p><a href=""https://www.foxnews.com/sports/department-education-celebrates-progress-after-year-trump-admins-fight-save-womens-sports"" rel=""noopener"" target=""_blank""><strong><u>DEPARTMENT OF EDUCATION CELEBRATES PROGRESS AFTER A YEAR OF TRUMP ADMIN'S FIGHT TO SAVE WOMEN'S SPORTS</u></strong></a></p><p>""If men are allowed to compete in women’s sports, in time, women will be erased from ever having opportunities to even compete at the Olympic level.  You will have two categories in the Olympics. DSD/trans and the men’s category.  Sex testing worked very well and was non-intrusive.  A simple buccal cheek swab once in your lifetime,"" Thompson told Fox News Digital. </p><p>""Playing sport is a human right. Today’s IOC announcement affirms that principle of inclusion and diversity. All athletes are to compete in their category; their weight, age, ability category, and now, their sex category. On behalf of women in sport, thank you for your leadership, IOC,"" Hogshead said in a statement. </p><p>""Welcome news today from the IOC. People who adopt different gender identities, such as transgender, gender non-conforming, or others should be afforded the same human rights as other citizens and protected from discrimination, so long as no sex-based rights are compromised,"" Navratilova said in a statement.</p><p>""It’s what the gay, lesbian, and bisexual community fought for over decades. Today’s IOC decision recognizes that in Olympic sports, sex matters, and women’s sex-based rights must take precedence over gender-based identities.""</p><p>""There really is little to be lauded over the IOC’s woefully slow decision. It should have always been a most simple and basic logical conclusion that is unequivocally founded in God’s design of male and female,"" Massie told Fox News Digital. </p><p>""Our female Olympic and Paralympic athletes work too hard to have their dreams of achievement under-minded by a man’s self deception of reality. Sadly, the battlegrounds remain extensive amongst the grassroots and recreational sporting arenas and those must continue to be contested for the sake of young ladies everywhere, now and into the future.""</p><p>""Finally, the International Olympic Committee showed some balls and chose fairness over fear. As an Olympian, I didn’t dedicate my life to competing on a manipulated playing field—one tilted and disguised as inclusion,"" Zimmerman told Fox News Digital.<br /><br />""Women’s sport exists because biological differences matter—strength, power, and muscle developed through male puberty aren’t erased, and pretending otherwise erases us. Fairness isn’t controversial. Let little girls dream of gold — not allow those dreams to be lost or tarnished.""</p><p><i><strong>Follow Fox News Digital’s </strong></i><a href=""https://twitter.com/FoxNewsSports_"" rel=""nofollow noopener"" target=""_blank""><i><strong><u>sports coverage on X</u></strong></i></a><i><strong><u>,</u> and subscribe to </strong></i><a href=""https://www.foxnews.com/newsletters"" rel=""noopener"" target=""_blank""><i><strong><u>the Fox News Sports Huddle newsletter</u></strong></i></a><i><strong>.</strong></i></p>",https://www.foxnews.com/sports/olympians-react-ioc-policy-change-protect-womens-sports,2026-03-26
1,North Carolina woman who vanished 24 years ago tearfully reunites with daughter outside court,"<p>A North Carolina woman who <a href=""https://www.foxnews.com/category/topic/missing-persons"" rel=""noopener"" target=""_blank"">vanished more than two decades ago</a>, and was <a href=""https://www.foxnews.com/us/missing-mom-found-alive-after-vanishing-24-years-ago"" rel=""noopener"" target=""_blank""><u>found alive earlier this year</u></a>, tearfully reunited with her daughter on Thursday.</p><p>Michele Hundley Smith appeared before a Rockingham, North Carolina County judge on Thursday related to a <a href=""https://www.foxnews.com/category/crime"" rel=""noopener"" target=""_blank"">DWI charge</a> in November 2001.</p><p>Following her initial appearance, Smith was seen quickening her pace to tearfully embrace her daughter, Amanda Hundley, outside of court.</p><p>The pair had not been together since the now gray-haired 63-year-old <a href=""https://www.foxnews.com/us/missing-mom-found-alive-after-vanishing-24-years-ago"" rel=""noopener"" target=""_blank"">vanished from her husband</a> and three children 24 years ago.</p><p><a href=""https://www.foxnews.com/us/missing-north-carolina-mom-found-alive-after-24-years-reportedly-reveals-why-she-left"" rel=""noopener"" target=""_blank""><strong><u>MISSING NORTH CAROLINA MOM FOUND ALIVE AFTER 24 YEARS REVEALS WHY SHE LEFT</u></strong></a></p><p>""Amanda?"" Hundley Smith could be heard saying. ""Your hair wasn’t this length. We walked right by you. I didn’t recognize you.""</p><p>Hundley Smith was located on Feb. 20 in an undisclosed location within North Carolina after detectives received new information about her case, the Rockingham County Sheriff’s Office previously confirmed to Fox News Digital.</p><p><a href=""https://twitter.com/FoxTrueCrime"" rel=""noopener"" target=""_blank""><strong>FOLLOW THE FOX TRUE CRIME TEAM ON X</strong></a></p><p>Sheriff Sam Page said Smith told investigators she left her family of her own accord and cited ""<a href=""https://www.foxnews.com/us/missing-north-carolina-mom-found-alive-after-24-years-reportedly-reveals-why-she-left"" rel=""noopener"" target=""_blank"">ongoing domestic issues</a>"" as the reason for her disappearance. Page did not elaborate on those issues, and investigators have said there is no evidence of foul play.</p><p>Smith was 38 when she <a href=""https://www.foxnews.com/us/daughter-detailed-family-turmoil-before-north-carolina-mom-vanished-24-years-before-turning-up-alive"" rel=""noopener"" target=""_blank"">disappeared after leaving</a> her three children at an <a href=""https://www.foxnews.com/category/us/us-regions/southeast/north-carolina"" rel=""noopener"" target=""_blank""><u>Eden, North Carolina</u></a>, home on Dec. 9, 2001, to go Christmas shopping at a K-Mart in Martinsville, Virginia. Her vehicle was never found, and she did not return home. Her husband reported her missing later that month.</p><p>Over the ensuing decades, local, state and federal agencies participated in efforts to locate her. Despite periodic appeals and flyers distributed in the region, her whereabouts remained unknown for 24 years.</p><p><a href=""https://www.foxnews.com/tips"" rel=""noopener"" target=""_blank""><strong>SEND US A TIP HERE</strong></a></p><p>The New York Post <a href=""https://nypost.com/2026/02/26/us-news/nc-mom-who-ran-away-from-family-24-years-ago-makes-extraordinary-claim-as-she-resurfaces-for-first-time/"" rel=""noopener"" target=""_blank""><u>reported</u></a> it had located Smith in a trailer in a rural community near the <a href=""https://www.foxnews.com/category/us/us-regions/southeast/south-carolina"" rel=""noopener"" target=""_blank"">South Carolina state line</a>. Smith told the outlet she is trying to make amends with her daughter and the family she walked out on decades ago.</p><p><a href=""https://link.podtrac.com/cjdr_fnd_article"" rel=""noopener"" target=""_blank""><strong>LISTEN TO THE NEW 'CRIME &amp; JUSTICE WITH DONNA ROTUNNO' PODCAST</strong></a></p><p>""My daughter is forgiving me. We are in contact, so leave me alone,"" she told the outlet.</p><p>Smith's neighbors said she had ""been here for years and years"" and mostly keeps to herself.</p><p><a href=""https://www.foxnews.com/category/us/true-crime"" rel=""noopener"" target=""_blank""><strong>LIKE WHAT YOU'RE READING? FIND MORE ON THE TRUE CRIME HUB</strong></a></p><p>Smith appeared in court Thursday to answer to a <a href=""https://www.foxnews.com/us/alleged-criminal-history-missing-mom-found-after-24-years-catches-up-her"" rel=""noopener"" target=""_blank"">DWI charge from November</a> 2001.</p><p>On Nov. 11, 2001, the <a href=""https://www.foxnews.com/category/us/crime/police-and-law-enforcement"" rel=""noopener"" target=""_blank"">Eden Police Department</a> issued a DWI charge. Smith failed to appear in court Dec. 27, 2001, for that charge, the statement said.</p><p>On Feb. 25, 2026, Smith was taken into custody by the Robeson County Sheriff’s Office at the request of Rockingham County authorities. She later posted a $2,000 bond. Her next hearing is April 23. </p><p><a href=""https://www.foxnews.com/newsletters"" rel=""noopener"" target=""_blank""><strong>SIGN UP TO GET TRUE CRIME NEWSLETTER</strong></a></p>",https://www.foxnews.com/us/north-carolina-woman-who-vanished-24-years-ago-tearfully-reunites-daughter-outside-court,2026-03-26
2,'Orwellian' Biden-era censorship reined in as red states celebrate 'historic' settlement,"<p><a href=""https://www.foxnews.com/category/politics/elections/republicans"" rel=""noopener"" target=""_blank"">Republican</a> attorneys general are hailing a First Amendment victory in a censorship lawsuit against the Biden administration after two red states secured a settlement restricting federal government agencies from influencing social media companies’ moderation practices.</p><p>Louisiana Attorney General Liz Murrill told Fox News Digital the settlement, a 10-year consent decree blocking several agencies from pressuring social media companies over their content, was ""simply historic in nature.""</p><p>""Being able to set a precedent like this will help everybody in the future be able to show that this conduct is wrong,"" Murrill said in a phone interview. ""It was Orwellian in nature from the beginning. It still is, and I'm grateful that the government is acknowledging that it shouldn't have been doing it.""</p><p>Missouri, Louisiana and several individual plaintiffs brought the high-profile jawboning lawsuit in 2022, alleging the Biden administration and officials in the first Trump administration inappropriately pressured social media companies to censor conservative viewpoints about COVID-19, election security and <a href=""https://www.foxnews.com/category/person/hunter-biden"" rel=""noopener"" target=""_blank"">Hunter Biden</a>'s laptop.</p><p><a href=""https://www.foxnews.com/media/federal-judge-rules-pentagon-policy-restricting-press-access-unconstitutional-hands-victory-new-york-times"" rel=""noopener"" target=""_blank""><strong>FEDERAL JUDGE RULES PENTAGON POLICY RESTRICTING PRESS ACCESS UNCONSTITUTIONAL, HANDS VICTORY TO NEW YORK TIMES</strong></a></p><p>Under the settlement, the Office of the Surgeon General, the Centers for Disease Control and Prevention and the Cybersecurity and Infrastructure Security Agency are barred for the next decade from threatening or coercing social media companies to remove or suppress protected speech. The agreement also blocks officials from giving directions on or vetoing platforms' content moderation decisions.</p><p>""This is the first real, operational restraint on the federal censorship machine,"" said Sen. Eric Schmitt, R-Mo., who brought the lawsuit when he served as his state's attorney general. ""The deep state just got checked,"" Schmitt added.</p><p>Murrill and now-U.S. Solicitor General John Sauer helped with the case when they were solicitors general of Louisiana and Missouri, respectively. Murrill reflected on conversations she had at the time about ""the line between coercion and government speech.""</p><p>""It was so clear to me that what the government was doing went way beyond appropriate boundaries in terms of deliberately throttling people's speech, taking down protected, truthful speech and forcing these corporations to bend to the White House's will,"" Murrill said. ""That was a very scary precedent, and I think that's why this agreement is so important.""</p><p><a href=""https://www.foxnews.com/politics/google-reinstate-banned-youtube-accounts-censored-political-speech"" rel=""noopener"" target=""_blank""><strong>GOOGLE TO REINSTATE BANNED YOUTUBE ACCOUNTS CENSORED FOR POLITICAL SPEECH</strong></a></p><p>The lawsuit alleged that federal government agencies and officials pressured YouTube; Twitter, now X; Facebook, now Meta; and other platforms to censor content, arguing the actions amounted to coercing the companies to remove constitutionally-protected speech.</p><p>Republicans' outrage about social media censorship gained momentum in 2020 after Twitter fully restricted and Facebook suppressed the New York Post's bombshell report about the Biden family and Ukraine that was based on contents from Hunter Biden’s laptop. </p><p>Discovery in the lawsuit and subsequent <a href=""https://judiciary.house.gov/media/press-releases/testimony-reveals-fbi-employees-who-warned-social-media-companies-about-hack"" rel=""noopener nofollow"" target=""_blank"">congressional investigations</a> revealed that FBI officials during the first Trump administration met with social media companies and warned them just before the story was published of a possible Russian ""hack and leak"" operation designed to interfere with the 2020 election, which the companies later said influenced their decision to block out the story.</p><p>President Donald Trump told <a href=""https://www.foxbusiness.com/politics/trump-twitter-facebook-third-arm-dnc-hunter-biden-story"" rel=""noopener"" target=""_blank"">Fox Business</a> in October 2020 the censorship efforts were ""out of control"" and intended to derail his election prospects.</p><p>""It’s like a third arm, maybe a first arm, of the DNC — Twitter, and Facebook, they’re all — like really, it’s a massive campaign contribution,"" Trump said at the time.</p><p>An infamous open letter signed by 51 former top intelligence officials in the weeks before the election fueled the fire by alleging the New York Post's story had ""all the classic earmarks of a Russian information operation."" Trump, when he took office in 2025, revoked their security clearances in an <a href=""https://www.whitehouse.gov/presidential-actions/2025/01/holding-former-government-officials-accountablefor-election-interference-and-improper-disclosure-of-sensitive-governmental-information/"" rel=""noopener"" target=""_blank"">executive order</a> and accused them of using their powerful former job titles to help discredit the story to swing the election for Joe Biden.</p><p>Judge Terry Doughty, a Louisiana-based federal judge appointed by Trump, initially issued an injunction against the Biden administration in 2023, saying evidence in the case ""depicts an almost dystopian scenario"" in which the federal government ""seems to have assumed a role similar to an Orwellian ‘Ministry of Truth.’"" Biden administration officials were found, for instance, to have aggressively demanded in emails to social media companies that they remove anti-vaccine content, which they said was disinformation.</p><p>One Biden White House official told Facebook that ""internally we have been considering our options on what to do about it,"" while another warned Twitter to take down content ""ASAP"" and ""immediately.""</p><p>The injunction limited the government from having certain interactions with social media companies, but the U.S. Court of Appeals for the 5th Circuit narrowed that injunction and the Supreme Court fully vacated it on appeal, finding the plaintiffs did not show they had standing. The high court punted on addressing the underlying merits of the case, leading to this week's consent decree.</p><p><a href=""https://www.foxnews.com/media/googles-decision-walk-back-biden-era-youtube-account-bans-hailed-huge-development-free-speech"" rel=""noopener"" target=""_blank""><strong>GOOGLE'S DECISION TO WALK BACK BIDEN-ERA YOUTUBE ACCOUNT BANS HAILED AS 'HUGE DEVELOPMENT' FOR FREE SPEECH</strong></a></p><p>The settlement allows government officials to continue communicating with social media companies, including by flagging content or expressing disagreement, so long as the communication does not involve threats, such as implying that the companies will suffer regulatory or legal consequences.</p><p>In the settlement, the federal government did not admit any wrongdoing, and the agreement noted that the government still had authority to address criminal activity or national security threats on the platforms.</p><p>Missouri Attorney General Catherine Hanaway applauded the consent decree in a statement, saying her state ""will NOT allow politicians to police speech.""</p><p>Attorney John Vecchione of the New Civil Liberties Alliance, which represented individuals who were named as plaintiffs in the case alongside the two states, emphasized their winding path to the consent decree.</p><p>""This case began with a suspicion, that blossomed into fact, that led to Congressional hearings and an Executive Order that government censorship of Americans’ social media posts should end,"" Vecchione said. ""Freedom of speech has been powerfully preserved by our clients, past and present, who initiated this suit.""</p>",https://www.foxnews.com/politics/orwellian-biden-era-censorship-reined-red-states-celebrate-historic-settlement,2026-03-26
