,title,text,link,publish_date
7,CNN boss Mark Thompson insists he's ‘really committed’ to network amid looming ownership changes,"<p>CNN CEO <a href=""https://www.foxnews.com/media/new-cnn-boss-mark-thompson-supportive-christiane-amanpour-left-wing-anchor-launches-weekend-show"" rel=""noopener"" target=""_blank"">Mark Thompson</a> insisted on Wednesday that he’s committed to the network despite a looming ownership change that has employees concerned for their future. </p><p>Netflix dropped its bid to buy Warner Bros. Discovery last month after the company announced Paramount's latest bid to buy all of its assets, including CNN, was ""superior."" The sale to Paramount would put media mogul David Ellison — who has a close relationship with President Donald Trump and has angered liberals for installing <a href=""https://www.foxnews.com/media/60-minutes-host-scott-pelley-reportedly-said-cbs-chief-bari-weiss-needed-take-job-more-seriously"" rel=""noopener"" target=""_blank"">Bari Weiss</a> as editor-in-chief of CBS News — in charge of CNN. As a result, CNN staffers have been on edge about what the future holds for the struggling network, but Thompson suggested he plans to stick around to find out. </p><p>""I’m really committed to CNN,"" Thompson said in a Zoom meeting with international staffers, a network insider told <a href=""https://www.foxnews.com/media"" rel=""noopener"" target=""_blank"">Fox News Digital</a>. </p><p><a href=""https://www.foxnews.com/media/mood-horrific-inside-cnn-staffers-brace-change-amid-potential-paramount-takeover-insiders-say"" rel=""noopener"" target=""_blank""><strong>MOOD IS ‘HORRIFIC’ INSIDE CNN AS STAFFERS BRACE FOR CHANGE AMID POTENTIAL PARAMOUNT TAKEOVER, INSIDERS SAY</strong></a></p><p>""I’m in the middle of something exciting and interesting with all of you,"" he continued. ""And I’d like to continue it.""</p><p>The Status newsletter, which first reported Thompson’s comments, added that ""several anchors and on-air journalists hammered him with questions about ensuring editorial independence under incoming Paramount ownership.""</p><p>A CNN insider recently told Fox News Digital that staffers feel ""a mix of despair, apprehension and curiosity"" as the sale to Paramount looms. </p><p><a href=""https://www.foxbusiness.com/media/netflix-backs-out-warner-bros-bidding-war-after-paramount-made-supperior-offer"" rel=""noopener"" target=""_blank""><strong><u>NETFLIX BACKS OUT OF WARNER BROS BIDDING WAR AFTER PARAMOUNT MADE 'SUPERIOR' OFFER</u></strong></a></p><p>""Look, I think this is a place that has gone through a lot. A lot of mergers in the past decade. A lot of ‘fresh’ starts,"" the CNN insider said. </p><p>""I think there is an underlying fear of mixing two news divisions,"" they continued. ""Who is gonna get canned?""</p><p>CNN has struggled in the ratings department in recent years, and Ellison has shown, with significant changes to CBS, that he isn’t afraid of shaking up a legacy organization. CNN staffers famously turned on <a href=""https://www.foxnews.com/media/ex-cnn-boss-sheds-light-his-ouster-from-liberal-network-there-those-didnt-want-change"" rel=""noopener"" target=""_blank"">former CEO Chris Licht</a> when he tried to tamp down CNN's partisanship that marked the Jeff Zucker era. Thompson replaced Licht in 2023. </p><p>While Thompson said he is committed to CNN, it’s unclear if Paramount feels the same way about the current network boss. Paramount did not immediately respond when asked for comment. </p><p>Thompson previously attempted to subdue concerns last month with an encouraging memo to CNN employees. </p><p><a href=""https://www.foxnews.com/media/bari-weiss-tells-cbs-news-staff-theyre-not-producing-product-enough-people-want"" rel=""noopener"" target=""_blank""><strong><u>BARI WEISS TELLS CBS NEWS STAFF THEY'RE 'NOT PRODUCING A PRODUCT THAT ENOUGH PEOPLE WANT'</u></strong></a></p><p>""Despite all the speculation you’ve read during this process, I’d suggest that you don’t jump to conclusions about the future until we know more. And secondly, let’s not forget our duty to our audience,"" Thompson wrote in the memo obtained by Fox News Digital. </p><p>""We’re still near the start of what is already an incredibly newsy year at home and abroad, one that will culminate with critical U.S. midterm elections and who knows what else,"" he continued. ""Let’s continue to focus on delivering the best possible journalism to the millions of people who rely on us all around the world.""</p><p><i>Fox News Digital’s Joseph A. Wulfsohn contributed to this report. </i></p>",https://www.foxnews.com/media/cnn-boss-mark-thompson-insists-he-really-committed-network-amid-looming-ownership-changes,2026-03-26
8,LAPD honors Bruce Willis' 90-year-old mother for decades of service to her 'second family',"<p>Icons recognize icons, and <a href=""https://www.foxnews.com/category/person/bruce-willis"" rel=""noopener"" target=""_blank"">Bruce Willis</a> learned from the best — his mother.</p><p>Marlene Willis was recognized Wednesday by the <a href=""https://www.foxnews.com/category/us/crime/police-and-law-enforcement"" rel=""noopener"" target=""_blank"">Los Angeles Police Department</a> for decades of volunteer service to the organization.</p><p>Known around the station as ""Mrs. Willis,"" the 90-year-old became a pillar at one of the department's 21 stations serving the city.</p><p><a href=""https://www.foxnews.com/entertainment/bruce-willis-demi-moores-daughter-denies-living-off-parents-money-says-works-4-jobs-single-mom"" rel=""noopener"" target=""_blank""><strong>BRUCE WILLIS AND DEMI MOORE'S DAUGHTER DENIES LIVING OFF PARENTS' MONEY, SAYS SHE WORKS 4 JOBS AS SINGLE MOM</strong></a></p><p><a href=""https://www.foxnews.com/entertainment"" rel=""noopener"" target=""_blank""><strong><u>LIKE WHAT YOU’RE READING? CLICK HERE FOR MORE ENTERTAINMENT NEWS</u></strong></a></p><p>""At 90 years old, Marlene ‘Mrs. Willis’ (Yes, Bruce’s mom) has quietly become a cornerstone of the LAPD’s West LA station, dedicating more than two decades of volunteer service to supporting officers and staff,"" the Los Angeles Protective League stated.</p><p>""Known for her warmth and consistency, she spends several days each week reviewing reports, <a href=""https://www.foxnews.com/category/us/education/administration"" rel=""noopener"" target=""_blank"">assisting with administrative work</a>, and offering something just as valuable: genuine care for those returning from difficult calls.</p><p>""Despite being Bruce Willis's mother, she never draws attention to it, instead choosing to focus entirely on serving what she calls her second family: the LAPD.""</p><p><a href=""https://www.facebook.com/protectiveleague/posts/pfbid029dV3QdqE8kmcVuU4hEhi3RD3W8LUY7EvEjFP8hHYE3FG6EvuHnNQPf1V1zbRj9o8l"" rel=""nofollow noopener"" target=""_blank""><strong>APP USERS CLICK HERE TO VIEW POST</strong></a></p><p>Representatives for the Willis family and the LAPD did not immediately respond to Fox News Digital's request for comment.</p><p>Former LAPD Chief Michel Moore previously presented Marlene with the LAPD Volunteer of the Year award, in addition to another surprising honor.</p><p>""While I can't make her a cop, I can at least give her the greatest symbol of what it means to be a cop,"" Moore told <a href=""https://www.nbclosangeles.com/news/local/mrs-willis-lapd-west-la/3866227/"" rel=""nofollow noopener"" target=""_blank"">NBC Los Angeles</a>. ""And that is a badge of the law center police department.</p><p><a href=""https://www.foxnews.com/newsletters?cmpid=fnfirstnl"" rel=""noopener"" target=""_blank""><strong><u>CLICK HERE TO SIGN UP FOR THE ENTERTAINMENT NEWSLETTER</u></strong></a></p><p>""Marlene, there are people in our lives that, when you cross their path; they leave a lasting impression. You are one that has risen to the top of one of the best impressions. To you and the work you do, we will be forever grateful.""</p><p>Marlene keeps her famous family close and doesn't discuss her affiliation but reportedly has a screensaver featuring the ""Die Hard"" star in a warm embrace. </p><p>""She was never one to wear her identity as his mother on her sleeve or even involve him in even passing references of her life, which impressed me,"" Moore told NBC Los Angeles.</p>",https://www.foxnews.com/entertainment/lapd-honors-bruce-willis-90-year-old-mother-decades-service-her-second-family,2026-03-26
9,Louisville to pay $800K after Christian photographer beats law forcing her to shoot same-sex weddings,"<p>The city of Louisville, <a href=""https://www.foxnews.com/category/us/us-regions/southeast/kentucky"" rel=""noopener"" target=""_blank"">Kentucky</a>, has agreed to pay $800,000 in attorney fees as part of a settlement with a Christian photographer after years of litigation over a nondiscrimination provision in a local law she was concerned would make her violate her faith. </p><p>""I am thrilled to see this case come to a close and celebrate that <a href=""https://www.foxnews.com/category/us/personal-freedoms/first-amendment"" rel=""noopener"" target=""_blank"">free speech</a> is for everyone and the government cannot force you to create anything you don't believe in,"" Chelsey Nelson, an Alliance Defending Freedom client and Louisville-based photographer, said in a statement to <a href=""https://www.foxnews.com/media"" rel=""noopener"" target=""_blank"">Fox News Digital</a>.  </p><p>""Artists like me should have the right to decide what messages we express,"" Nelson added. ""You shouldn't lose your freedom of speech when you choose to make a living. I am grateful that I can continue photographing and creating consistent with my religious beliefs and ensure that all artists in Louisville can do the same."" </p><p><a href=""https://www.foxnews.com/media/federal-appeals-court-sides-washington-professor-punished-mocking-university-land-acknowledgment"" rel=""noopener"" target=""_blank""><strong>FEDERAL APPEALS COURT SIDES WITH WASHINGTON PROFESSOR PUNISHED FOR MOCKING UNIVERSITY LAND ACKNOWLEDGMENT</strong></a></p><p>The <a href=""https://adfmedia.org/wp-content/uploads/2026/03/chelseynelsonsettlement.pdf"" rel=""nofollow noopener"" target=""_blank""><u>settlement</u></a>, filed Tuesday in the U.S. District Court for the Western District of Kentucky, Louisville Division, follows a <a href=""https://adfmedia.org/wp-content/uploads/2025/10/chelsey-nelson-district-msj-order.pdf"" rel=""nofollow noopener"" target=""_blank""><u>Sept. 30, 2025, ruling</u></a> in which the court sided with Nelson over a <a href=""https://codelibrary.amlegal.com/codes/louisvillemetro/latest/loukymetro/0-0-0-7850"" rel=""nofollow noopener"" target=""_blank""><u>prohibition</u></a> from the city of Louisville on discrimination.</p><p>In the <a href=""https://adfmedia.org/wp-content/uploads/2025/10/chelsey-nelson-district-msj-order.pdf"" rel=""nofollow noopener"" target=""_blank""><u>September ruling</u></a>, the court cited 303 Creative LLC v. Elenis, which said that a Colorado website designer’s First Amendment rights permit her to refuse to make custom wedding websites for couples of the same sex. </p><p>""That 2023 decision confirmed this Court’s 2022 interpretation of the First Amendment to bar the City of Louisville from enforcing an ordinance prohibiting wedding photographer Chelsey Nelson from stating her traditional (now dissenting) views on traditional marriage or declining to participate in those ceremonies,"" the September ruling said.</p><p><a href=""https://www.foxnews.com/media/chicago-public-schools-now-allow-bible-college-students-its-teaching-program-after-lawsuit"" rel=""noopener"" target=""_blank""><strong>CHICAGO PUBLIC SCHOOLS WILL NOW ALLOW BIBLE COLLEGE STUDENTS INTO ITS TEACHING PROGRAM, AFTER LAWSUIT</strong></a></p><p><a href=""https://www.foxnews.com/opinion/us-government-targeted-me-my-political-speech-could-happen-you-too"" rel=""noopener"" target=""_blank""><strong><u>THE US GOVERNMENT TARGETED ME FOR MY POLITICAL SPEECH. IT COULD HAPPEN TO YOU, TOO</u></strong></a></p><p>""These disputes, no less than those from earlier but equally fraught moments in our nation’s history, posed profound questions about the meaning of speech, the government’s authority to demand as well as forbid expression, and the tension in a system of ordered liberty between the common good and <a href=""https://www.foxnews.com/category/politics/judiciary/individual-rights"" rel=""noopener"" target=""_blank"">individual freedom</a>."" </p><p>Tuesday's settlement <a href=""https://adfmedia.org/case/chelsey-nelson-photography-v-louisville-jefferson-county-metro-government/"" rel=""nofollow noopener"" target=""_blank""><u>was announced</u></a> by Alliance Defending Freedom, which represented Nelson and filed the lawsuit, Chelsey Nelson Photography v. Louisville-Jefferson County Metro Government in 2019. </p><p>""Louisville’s law threatened to compel Nelson to create photographs and blogs celebrating a message about marriage she does not believe and prohibited her from expressing her views on marriage on her studio’s website,"" according to the legal group. </p><p>""The government cannot force Americans to say things they don’t believe,"" Bryan Neihart, senior counsel at Alliance Defending Freedom, said in a statement. </p><p>""For almost six years, <a href=""https://www.foxnews.com/category/politics/judiciary/state-and-local"" rel=""noopener"" target=""_blank"">Louisville officials</a> tried to do just that by threatening to force Chelsey to promote views about marriage that violated her religious beliefs,"" Neihart added. ""Louisville’s threats contradicted bedrock First Amendment principles which leave decisions about what to say with the people, not the government. This settlement should teach Louisville that violating the U.S. Constitution can be expensive.""</p><p>Fox News Digital reached out to the office of Louisville Mayor Craig Greenberg for comment. </p>",https://www.foxnews.com/media/louisville-pay-800k-after-christian-photographer-beats-law-forcing-her-shoot-same-sex-weddings,2026-03-26
10,Long Island woman missing after jumping from moving vehicle in panicked state,"<p>A Long Island, New York, woman could be in danger as <a href=""https://www.foxnews.com/category/topic/missing-persons"" rel=""noopener"" target=""_blank"">she vanished</a> after suddenly jumping out of a moving vehicle and running off last week, her loved ones said.  </p><p>Brittany Kritis-Garip, 32, was last seen on surveillance footage in Oyster Bay around 8 p.m. Friday before she was reported missing, <a href=""https://longisland.news12.com/nassau-pd-seeks-publics-help-in-finding-missing-woman-last-seen-in-oyster-bay"" rel=""nofollow noopener"" target=""_blank"">News 12 Long Island reported</a>.</p><p>Her husband, Fernando Garip, said she was in a panicked state, jumped out of a moving car, threw her phone into a bush and ran off. </p><p><a href=""https://www.foxnews.com/us/metal-detector-scans-front-yard-savannah-guthries-missing-mother-sister-get-car-back"" rel=""noopener"" target=""_blank""><strong>METAL DETECTOR SCANS FRONT YARD OF SAVANNAH GUTHRIE’S MISSING MOTHER AS SISTER TO GET CAR BACK</strong></a></p><p>That was the last time her family saw her. Garip <a href=""https://patch.com/new-york/oysterbay/brother-vulnerable-missing-oyster-bay-woman-speaks-out-search-continues-we-just"" rel=""nofollow noopener"" target=""_blank"">told Patch</a> that volunteers have searched wooded areas, as well as rural and suburban areas. </p><p>Niko Kritis, told Patch that his sister was ""vulnerable"" and asked that residents check their properties for spaces where someone could seek shelter. </p><p>""Those small, careful actions could be what brings Brittany home,"" he said. ""We believe Brittany may be trying to isolate or avoid contact, and it’s possible she could be sheltering in secluded or hidden areas.""</p><p><a href=""https://www.foxnews.com/us/k-9-hailed-hero-tracking-missing-boy-during-snowstorm-north-carolina"" rel=""noopener"" target=""_blank""><strong>K-9 HAILED A HERO FOR TRACKING MISSING BOY DURING SNOWSTORM IN NORTH CAROLINA</strong></a></p><p>He also asked homeowners to check their security cameras.</p><p>""We believe she was disoriented and frightened, and may think she is in danger,"" search organizer Sarah Castor wrote on an online crowdfunding page. ""She is not dangerous — she needs help.""</p><p>Volunteers have searched a one-mile stretch of shoreline near <a href=""https://www.foxnews.com/category/us/us-regions/northeast/new-york"" rel=""noopener"" target=""_blank"">Oyster Bay Harbor</a> after Kritis-Garip’s wallet was discovered on a road leading down to the water, Castor wrote on Facebook Wednesday.</p><p>""Brittany is an incredible, kind person and any efforts are appreciated by all who know her,"" she wrote. </p><p>The <a href=""https://www.foxnews.com/category/us/crime/police-and-law-enforcement"" rel=""noopener"" target=""_blank"">Nassau County Police Department</a> has used its helicopter and drones several times since Friday as part of the ongoing search.</p><p>Fox News Digital has reached out to Fernando Garip.</p><p>Kritis-Garip is described as a White woman with brown hair and brown eyes, standing 5 feet 7 inches tall and weighing around 140 pounds.</p>",https://www.foxnews.com/us/long-island-woman-missing-after-jumping-from-moving-vehicle-panicked-state,2026-03-26
11,Los Angeles schools accused of quietly funding race-based programming for Black students only,"<p>An education watchdog is asking the Department of Education's Office of Civil Rights to investigate the <a href=""https://www.foxnews.com/category/us/education"" rel=""noopener"" target=""_blank"">Los Angeles Unified School District (LAUSD)</a> over allegations that the district has allocated tens of millions of dollars for services that only Black students can use.</p><p>Defending Education says LAUSD launched the ""<a href=""https://www.foxnews.com/category/us/education/achievement"" rel=""noopener"" target=""_blank"">Black Student Achievement Plan</a>"" (BSAP) in 2021 to ""address the long-standing disparities in educational outcomes between Black students and their non-Black peers."" The district also mentioned that the program is meant to help achieve ""racial equity"" and ""[r]esources are allocated to different schools"" according to ""a race-based tiered system.""</p><p>The group says LAUSD has allocated $50 million for the program in the 2025-2026 school year, on top of $125 million previously spent on BSAP.</p><p>An example of the BSAP resource allocation in question is staffing support specifically dedicated to addressing the academic and social-emotional needs of Black students.</p><p><a href=""https://www.foxnews.com/us/minnesota-school-districts-use-taxpayer-money-race-based-teacher-incentives-layoff-protections"" rel=""noopener"" target=""_blank""><strong>MINNESOTA SCHOOL DISTRICTS USE TAXPAYER MONEY FOR RACE-BASED TEACHER INCENTIVES AND LAYOFF PROTECTIONS</strong></a></p><p>On July 11, 2023, Defending Education filed a complaint with the Office of Civil Rights over the policy, saying it violated Title VI of the Civil Rights Act of 1964 and the equal protection clause of the 14th Amendment to the Constitution.</p><p>But that <a href=""https://www.foxnews.com/category/controversies"" rel=""noopener"" target=""_blank"">complaint was dismissed</a> exactly a year later, after LAUSD represented that it had ""substantially changed its criteria for resource allocation to a race-neutral standard and that BSAP’s resources would be available to all students regardless of race,"" and the Office of Civil Rights agreed that any potential violation had been rectified.</p><p>However, Defending Education alleges that only months after the complaint was dismissed, LAUSD Board of Education members said the program had not changed.</p><p><a href=""https://www.foxnews.com/politics/justice-department-sues-public-school-district-over-allegedly-discriminatory-policies"" rel=""noopener"" target=""_blank""><strong>JUSTICE DEPARTMENT SUES PUBLIC SCHOOL DISTRICT OVER ALLEGEDLY DISCRIMINATORY POLICIES</strong></a></p><p>In a <a href=""https://www.youtube.com/watch?v=vJqtZZj5zpw"" rel=""noopener nofollow"" target=""_blank"">board meeting on Oct. 22, 2024</a>, activists who opposed LAUSD's changes to BSAP caused a ruckus, chanting slogans in opposition to the board's announcement.</p><p>During those chants, according to Defending Education, board President Jackie Goldberg and LAUSD Superintendent Alberto Carvalho were caught on a hot mic agreeing that ""nothing has changed.""</p><p><a href=""https://www.foxnews.com/us/illinois-district-where-faculty-celebrated-charlie-kirks-death-exposed-over-racial-segregation-plan"" rel=""noopener"" target=""_blank""><strong>ILLINOIS DISTRICT WHERE FACULTY CELEBRATED CHARLIE KIRK'S DEATH EXPOSED OVER RACIAL 'SEGREGATION' PLAN</strong></a></p><p>""Do they not know that nothing has changed?"" Goldberg asked Carvalho in reference to the protesters.</p><p>""Nothing has changed,"" Carvalho agreed.</p><p>""How do they not know that?"" Goldberg replied.</p><p><a href=""https://www.foxnews.com/media/department-education-pull-back-race-based-criteria-federal-grants"" rel=""noopener"" target=""_blank""><strong>DEPARTMENT OF EDUCATION TO PULL BACK RACE-BASED CRITERIA IN FEDERAL GRANTS</strong></a></p><p>Armed with this exchange, Defending Education has filed a new complaint.</p><p>""It's concerning when a board of education member and the superintendent both promise in a public meeting that nothing has changed in the context of a race-based program that the district knows is in violation of federal law. It's an admission that they have knowingly lied to the federal government about what is actually going on in the district as it relates to race-based programming,"" said Erika Sanzi, senior communications director for Defending Education.</p><p>""It is also worth noting that LAUSD’s school board added $50 million more to the <a href=""https://www.foxnews.com/category/us/education/diversity"" rel=""noopener"" target=""_blank"">BSAP program</a> in its 2025-26 budget, bringing the total for the program to $175 million,"" she said. ""Not sure what it's going to take for public school districts to accept the fact that it is against the law to include and exclude students in programs on the basis of race—hopefully reopening the civil rights investigation can help with that.""</p><p>LAUSD did not return a request for comment.</p>",https://www.foxnews.com/us/los-angeles-schools-accused-quietly-funding-race-based-programming-black-students-only,2026-03-26
