,title,text,link,publish_date
0,Trump administration says Colorado school district may have put up to 61 male students on girls sports teams,"<p>The U.S. Department of <a href=""https://www.foxnews.com/category/us/education/dept-of-education"" rel=""noopener"" target=""_blank"">Education’s Office for Civil Rights</a> (OCR) concluded that a Colorado school district violated federal civil rights law by allowing male students to access female bathrooms, locker rooms and overnight accommodations and to compete in girls sports.</p><p>In findings released Friday, OCR determined that <a href=""https://www.foxnews.com/category/us/us-regions/west/colorado"" rel=""noopener"" target=""_blank"">Jefferson County Public Schools</a> violated Title IX. </p><p>The announcement said OCR received athletic rosters from Jefferson County, and the rosters indicate ""male students may occupy up to 61 roster positions on girls’ sports teams in the district.""</p><p><a href=""https://www.foxnews.com/sports"" rel=""noopener"" target=""_blank""><strong><u>CLICK HERE FOR MORE SPORTS COVERAGE ON FOXNEWS.COM</u></strong></a></p><p>OCR said the policies deny girls ""safety, dignity and equal access"" to educational programs and activities.</p><p>Federal investigators also obtained athletic rosters from Jefferson County indicating that male students could occupy up to 61 roster spots on girls sports teams across the district, the agency said.</p><p>""Today’s findings reveal sweeping Title IX violations by Jefferson County Public Schools — denying fairness and equality to female students by allowing males into their private facilities, overnight accommodations, and athletics,"" Assistant Secretary for Civil Rights Kimberly Richey said in a statement.</p><p><a href=""https://www.foxnews.com/sports/jake-paul-praises-trumps-leadership-says-america-healing-slowly-under-second-term-administration"" rel=""noopener"" target=""_blank""><strong><u>JAKE PAUL PRAISES TRUMP’S LEADERSHIP, SAYS AMERICA IS 'HEALING SLOWLY' UNDER SECOND-TERM ADMINISTRATION</u></strong></a></p><p>""The district’s decision to prioritize ‘gender identity’ over ensuring equal access for its female students is unconscionable,""<strong> </strong>Richey said. ""The district must act now to end these violations and protect future generations of girls from sex discrimination. The Trump administration will not relent until female athletes’ safety, opportunities and equal protection under the law are fully restored."" </p><p>The Office for Civil Rights has issued the district a <a href=""https://www.foxnews.com/category/us/environment/regulation"" rel=""noopener"" target=""_blank"">proposed resolution agreement</a>, giving officials 10 days to voluntarily comply or face potential federal enforcement action.</p><p>The investigation began in June 2025, when OCR launched a probe into allegations that Jefferson County Public Schools had removed safeguards requiring single-sex overnight accommodations on district-sponsored trips.</p><p>Federal investigators said their review uncovered broader violations, concluding the district also allowed male students to access female-only facilities and compete on girls teams.</p><p>Title IX, enacted in 1972, bars discrimination based on sex in education programs or activities that receive federal funding.</p><p><i><strong>Follow Fox News Digital’s </strong></i><a href=""https://twitter.com/FoxNewsSports_"" rel=""nofollow noopener"" target=""_blank""><i><strong><u>sports coverage on X</u></strong></i></a><i><strong>, and subscribe to </strong></i><a href=""https://www.foxnews.com/newsletters"" rel=""noopener"" target=""_blank""><i><strong><u>the Fox News Sports Huddle newsletter</u></strong></i></a><i><strong>.</strong></i></p>",https://www.foxnews.com/sports/trump-admin-says-colorado-school-district-may-have-put-up-61-male-students-girls-sports-teams,2026-03-13
1,PR exec demands Senate Dems apologize for spreading 'falsehoods' about him during heated Noem hearing,"<p>The top executive of a public relations and political consulting firm, who is married to a former top Department of Homeland Security (DHS) spokesperson, is demanding an apology from Senate Democrats for their allegations that he used his wife to improperly secure lucrative contracts from the agency.</p><p>In a Thursday letter addressed to Sens. Peter Welch, D-Vt., and Richard Blumenthal, D-Conn., Benjamin Yoho took aim at a figure mentioned by Sen. <a href=""https://www.foxnews.com/category/person/adam-schiff"" rel=""noopener"" target=""_blank"">Adam Schiff,</a> D-Calif., claiming his company, The Strategy Group for Media, had secured $143 million in subcontracts.</p><p>Yoho clarified that The Strategy Group for Media had been hired in relation to <a href=""https://www.foxnews.com/category/politics/executive/homeland-security"" rel=""noopener"" target=""_blank"">media work at DHS,</a> but not to the degree Schiff had outlined.</p><p>""We provided limited production services, for which we received $226,137.17 for video and audio production, a sum representing approximately one-tenth of one percent of the contract value [Schiff] referenced,"" Yoho wrote in his letter.</p><p><a href=""https://www.foxnews.com/media/hakeem-jeffries-says-dems-not-back-funding-bill-killing-machine-dhs-even-noem-fired"" rel=""noopener"" target=""_blank""><strong>HAKEEM JEFFRIES SAYS DEMS WILL NOT BACK FUNDING BILL FOR 'KILLING MACHINE' DHS EVEN IF NOEM IS FIRED</strong></a></p><p>He also noted that the services didn’t directly go to DHS.</p><p>""The facts are The Strategy Group for Media was hired by Safe America Media LLC to serve as a subcontractor to them for production work,"" Yoho explained, referring to a separate company partnering with the agency.</p><p>Yoho is married to Tricia McLaughlin, the former assistant secretary for Public Affairs at DHS who recently departed last month.</p><p><a href=""https://www.foxnews.com/politics/dhs-defends-mclaughlin-allegations-husbands-company-profited-millions-ad-contracts"" rel=""noopener"" target=""_blank""><strong>DHS DEFENDS MCLAUGHLIN AFTER ALLEGATIONS HUSBAND'S COMPANY PROFITED MILLIONS FROM AD CONTRACTS: 'BASELESS'</strong></a></p><p>The pair’s connection to DHS came under scrutiny in the Senate when former DHS Secretary Kristi Noem was probed by lawmakers about <a href=""https://www.foxnews.com/politics/newsom-rips-noem-kosplay-barbie-over-220m-ad-campaign-demands-dhs-release-500m-la-wildfires"" rel=""noopener"" target=""_blank"">a $220 million ad campaign</a> she had used to highlight the agency’s work. Democrats like Schiff hinted that some of that $220 million figure had ended up lining the pockets of those with close ties to the agency’s workings.</p><p><a href=""https://www.foxnews.com/politics/house-gop-leader-launches-senate-bid-trump-taps-markwayne-mullin-dhs"" rel=""noopener"" target=""_blank""><strong>HOUSE GOP LEADER LAUNCHES SENATE BID AS TRUMP TAPS MARKWAYNE MULLIN FOR DHS</strong></a></p><p>""This statement is factually incorrect, and I respectfully request that you have your colleague correct the official record and issue an apology,"" Yoho wrote.</p><p>Yoho is demanding that the <a href=""https://www.foxnews.com/category/democrats"" rel=""noopener"" target=""_blank"">Democratic lawmakers</a> strike their remarks about his company from the record.</p><p>Noem was removed as head of DHS shortly after President <a href=""https://www.foxnews.com/category/person/donald-trump"" rel=""noopener"" target=""_blank"">Donald Trump</a> learned that she told senators that he had approved the $220M DHS ad campaign that featured her prominently throughout them. </p><p>Reports surfaced after the hearings saying that Trump was ""furious"" with Noem over her performance in bicameral Judiciary Committee hearings earlier this month, particularly over a <a href=""https://www.foxnews.com/politics/dhs-defends-ad-blitz-senate-scrutiny-campaign-drove-self-deportations-taxpayers-billions"" rel=""noopener"" target=""_blank""><u>contract for an advertisement</u> </a>that Sen. John Kennedy, R-La., and others grilled her on.</p><p>Trump reportedly took issue with her suggesting to Kennedy that he approved a taxpayer-funded ad subcontracted to a firm connected with her inner circle, according to <a href=""https://www.nationalreview.com/news/exclusive-trump-privately-furious-with-noem-over-senate-testimony-considering-mullin-as-replacement/"" rel=""nofollow noopener"" target=""_blank""><u>National Review.</u></a></p><p>Fox News Digital reached out to the offices of Sens. Adam Schiff, D-Calif., Richard Blumenthal, D-Conn., and Peter Welch, D-Vt., for comment.</p>",https://www.foxnews.com/politics/pr-exec-demands-senate-democrats-apologize-falsehoods-heated-noem-hearing,2026-03-13
2,"Vance reveals $19B fraud uncovered in Minneapolis, hints California is next target","<p><strong>ROCKY MOUNT, N.C. —</strong> Vice President <a href=""https://www.foxnews.com/category/person/jd-vance"" rel=""noopener"" target=""_blank"">JD Vance</a> hinted at targeting California as the next state where major fraud investigations will take place and revealed that fraud discovered in the Minneapolis area has ""probably been $19 billion at least"" since the administration began investigating in the Twin Cities.  </p><p>In January, Vance announced an interagency task force within the Department of Justice that specifically targets fraud, and reports suggest the vice president will soon lead a new task force established through a Trump executive order. </p><p>""We know there's a lot of fraud in California, and we're trying to get to the bottom of exactly what it looks like and what we've done in the Trump administration,"" Vance said in response to a question by <a href=""https://www.foxnews.com/category/news-events/fox-news-investigates"" rel=""noopener"" target=""_blank"">Fox News Digital</a> following his speech Friday afternoon at the Power House event center that focused on the economy, public safety and election integrity. </p><p>""And the president has really empowered us to do this, is to take the first national look at the way the American people have been defrauded over many, many years.""</p><p>In January, President <a href=""https://www.foxnews.com/category/person/donald-trump"" rel=""noopener"" target=""_blank"">Donald Trump</a> was critical of California, announcing that the ""fraud investigation of California has begun,"" and said that the state was ""more corrupt than Minnesota.""</p><p><a href=""https://www.foxnews.com/politics/comer-say-tim-walz-enabled-fraud-failed-whistleblowers-bombshell-minnesota-hearing"" rel=""noopener"" target=""_blank""><strong>COMER TO SAY TIM WALZ 'ENABLED FRAUD,' FAILED WHISTLEBLOWERS IN BOMBSHELL MINNESOTA HEARING</strong></a></p><p>Democratic California Gov. <a href=""https://www.foxnews.com/category/person/gavin-newsom"" rel=""noopener"" target=""_blank"">Gavin Newsom</a> defended the Golden State's fraud protection in February, saying that California's Franchise Tax Board has blocked billions in fraud in recent years.</p><p>""In the actual world where adults govern — Gavin Newsom has been cleaning house,"" a spokesperson for Newsom told Fox News Digital. ""Since taking office, he’s blocked over $125 BILLION in fraud, arrested criminal parasites leaching off of taxpayers, and protected taxpayers from the exact kind of scam artists Trump celebrates, excuses, and pardons.</p><p>""Gavin Newsom runs a state,"" the spokesperson added. ""Donald Trump runs his mouth. Again and again, we’ve shown that the programs they are attempting to call out are programs the FEDERAL GOVERNMENT is administering, not the state. We suggest they get their house in order.""</p><p>Vance on Friday pointed to fraud that has occurred <a href=""https://www.foxnews.com/category/us/us-regions/midwest/minnesota"" rel=""noopener"" target=""_blank"">in Minnesota</a>, telling Fox News Digital and reporters that taxpayer dollars are footing the bill for the illegal misuse of funds.</p><p><a href=""https://www.foxnews.com/media/jd-vance-spearheads-war-fraud-promises-root-out-taxpayer-money-stolen-illegal-immigrants"" rel=""noopener"" target=""_blank""><strong>JD VANCE SPEARHEADS 'WAR ON FRAUD,' PROMISES TO ROOT OUT TAXPAYER MONEY 'STOLEN' BY ILLEGAL IMMIGRANTS</strong></a></p><p>""You asked about Minnesota, [and] we think that there's probably been $19 billion at least to fraud just committed in Minneapolis in the surrounding areas,"" Vance explained. ""Let me give you an example of this, because it's not just the American people being defrauded. It's not just your tax dollars that are being stolen out of your wallet and given to fraudsters.</p><p>""It's the fact that the services we need to deliver to needy people are not getting delivered because they're going to fraudsters,"" he added.</p><p>Federal <a href=""https://www.foxnews.com/category/politics/minnesota-fraud-exposed"" rel=""noopener"" target=""_blank"">investigators in Minnesota</a> launched a probe in 2022 into the nonprofit <a href=""https://www.foxnews.com/category/politics/minnesota-fraud-exposed"" rel=""noopener"" target=""_blank"">Feeding Our Future</a>, which prosecutors later identified as a key player in what became one of the largest COVID-19 relief fraud cases uncovered.</p><p><a href=""https://www.foxnews.com/politics/report-exposes-billions-in-uncovered-fraud-waste-as-watchdog-coalition-offers-support-to-trumps-crackdown"" rel=""noopener"" target=""_blank""><strong>REPORT EXPOSES BILLIONS IN UNCOVERED FRAUD, WASTE AS WATCHDOG COALITION OFFERS SUPPORT TO TRUMP'S CRACKDOWN</strong></a></p><p>As the investigation progressed, authorities said they uncovered roughly $250 million in fraudulent claims, with 78 people ultimately charged in connection with the scheme.</p><p>Prosecutors have also suggested the broader fraud linked to related programs could total as much as $9 billion.</p><p>Independent journalist Nick Shirley took to the streets of <a href=""https://www.foxnews.com/category/us/minneapolis-st-paul"" rel=""noopener"" target=""_blank"">Minneapolis</a> in late Dec. 2025, and discovered one organization that claimed to be a type of daycare where the word ""learning"" was misspelled on the front door of the facility. </p><p>Vance poked fun at the organization, which has since shut its doors, during his response to Fox News Digital reporter's question on Friday.</p><p>""When you have a Somali fraudster come into the United States illegally and then set up a school to collect tax dollars, and the name of the school is the Quality Learning Center, but when they put the sign up, they take the ‘n’ out. So it says ‘quality learing center,’"" Vance explained.</p><p>""I don't know about you, but I don't want to send my kids to a school where they can't spell ‘learn.’ That group was getting millions of dollars from the American taxpayer.""</p>",https://www.foxnews.com/politics/vance-reveals-19b-fraud-uncovered-minneapolis-hints-california-next-target,2026-03-13
3,"Man accused of attacking TSA officers, seriously injuring Dallas cop at airport","<p>A California man was federally charged after allegedly attacking two Transportation Security Administration (TSA) officers and seriously injuring a Dallas police officer at <a href=""https://www.foxnews.com/category/us/dallas-fort-worth"" rel=""noopener"" target=""_blank"">Dallas Love Field Airport</a>, officials said.</p><p>Idress Vinay Solomon, 33, of Oakland, California, faces up to 20 years in prison after being accused of assaulting a federal officer and inflicting bodily injury.</p><p>According to a federal complaint filed Wednesday, Solomon had a ticket for a <a href=""https://www.foxnews.com/category/travel/general/airlines"" rel=""noopener"" target=""_blank"">Southwest Airlines flight</a> to Oakland International Airport March 10.</p><p><a href=""https://www.foxnews.com/travel/new-tsa-policy-charges-passengers-who-do-not-have-acceptable-ids-checkpoints"" rel=""noopener"" target=""_blank""><strong>NEW TSA POLICY CHARGES PASSENGERS WHO DO NOT HAVE ACCEPTABLE IDS AT CHECKPOINTS</strong></a></p><p>Prosecutors said Solomon approached the <a href=""https://www.foxnews.com/category/tech/topics/security"" rel=""noopener"" target=""_blank"">airport security checkpoint</a> without identification and was directed by a TSA officer to a different lane to be identified through the agency’s ConfirmID process.</p><p>Solomon allegedly became ""verbally disruptive and aggressive"" after the process failed to verify his identity, according to the complaint.</p><p>""Violent conduct perpetrated against TSA and law enforcement officers will never be tolerated in the <a href=""https://www.foxnews.com/category/politics/judiciary/federal-courts"" rel=""noopener"" target=""_blank"">Northern District of Texas</a>,"" U.S. Attorney for the Northern District of Texas Ryan Raybould said in a statement.  </p><p>""We will prosecute such offenses to the fullest extent to seek justice for the victims here and to deter others from resorting to aggressive attacks against officers responsible for ensuring the public’s safety while traveling.""</p><p><a href=""https://www.foxnews.com/politics/illegal-aliens-violent-tussle-federal-officer-leads-multiple-charges-after-suspected-biden-era-entry"" rel=""noopener"" target=""_blank""><strong>ILLEGAL ALIEN'S VIOLENT TUSSLE WITH FEDERAL OFFICER LEADS TO MULTIPLE CHARGES AFTER SUSPECTED BIDEN-ERA ENTRY</strong></a></p><p>Solomon allegedly punched a TSA officer in the back of the neck after the officer called for a supervisor.</p><p>According to a complaint, the Dallas Police Department responded to the incident, and Solomon allegedly punched one of the officers multiple times in the face, causing a serious orbital blowout fracture to the officer’s left eye that required hospital treatment.</p><p>After he was arrested, Solomon ""deliberately spit saliva"" onto a police officer’s right arm as officers attempted to place him into a police vehicle, the complaint states.</p><p>Prosecutors alleged that Solomon refused to follow lawful verbal commands and continued to yell and pull away from officers.</p>",https://www.foxnews.com/us/man-accused-attacking-tsa-officers-seriously-injuring-dallas-cop-airport,2026-03-13
4,High school senior charged with 'random' murder after 68-year-old woman found dead in Massachusetts home,"<p>A <a href=""https://www.foxnews.com/category/us/us-regions/northeast/massachusetts"" rel=""noopener"" target=""_blank"">Massachusetts teenager</a> was charged with murder after a 68-year-old woman was found dead in her home Thursday in what authorities believe to be a ""random"" attack.</p><p>Essex County District Attorney Paul Tucker announced during a news conference Thursday evening that 18-year-old Anthony DeMayo of Lynn was charged with murder in the death of Janet Swallow, 68, who was discovered inside her Danvers home.</p><p>""What we can say and what we believe at this point is this was random. There was no connection between the defendant and the resident who was the victim here, Ms. Swallow,"" Tucker told reporters.</p><p>The investigation began earlier Thursday afternoon when the <a href=""https://www.foxnews.com/category/us/crime/police-and-law-enforcement"" rel=""noopener"" target=""_blank"">Lynn Police Department</a> received a 911 call about a man walking along Standish Road carrying a knife, according to Tucker.</p><p><a href=""https://www.foxnews.com/us/high-school-senior-facing-300-felony-charges-alleged-sextortion-scheme-targeting-minors-reports"" rel=""noopener"" target=""_blank""><strong>HIGH SCHOOL SENIOR FACING MORE THAN 300 FELONY CHARGES IN ALLEGED SEXTORTION SCHEME TARGETING MINORS: REPORTS</strong></a></p><p>When officers arrived, they encountered the individual, later identified as DeMayo, who was reportedly behaving erratically and holding a knife with what authorities described as reddish-brown stains consistent with blood.</p><p>Police transported DeMayo to <a href=""https://www.foxnews.com/category/health/health-care"" rel=""noopener"" target=""_blank"">Salem Hospital</a> due to his behavior.</p><p>As officers continued investigating, information developed that led Lynn police and Massachusetts State Police to execute a search warrant at DeMayo’s home in Lynn. </p><p>Evidence recovered there led investigators to contact the Danvers Police Department.</p><p>Authorities then conducted a well-being check at a single-family home on Amherst Street in Danvers, where they found Swallow dead inside with ""<a href=""https://www.foxnews.com/category/us/crime/homicide"" rel=""noopener"" target=""_blank"">wounds consistent with a homicide</a>,"" Tucker said.</p><p><a href=""https://www.foxnews.com/us/teen-accused-stabbing-pregnant-woman-70-times-tries-nap-police-cruiser-arrest"" rel=""noopener"" target=""_blank""><strong>TEEN ACCUSED OF STABBING PREGNANT WOMAN 70 TIMES TRIES TO NAP IN BACK OF POLICE CRUISER AFTER ARREST</strong></a></p><p>DeMayo was taken into custody while at Salem Hospital and formally charged with murder. </p><p>Authorities said he is a <a href=""https://www.foxnews.com/category/us/education/high-school"" rel=""noopener"" target=""_blank"">senior at Bishop Fenwick High School</a> in nearby Peabody.</p><p>Danvers Police Chief James Lovell said investigators notified Swallow’s family and described the victim as a longtime Danvers resident.</p><p>""Our thoughts and prayers are with her and her family,"" Lovell said.</p><p>Lovell also reassured residents there is no ongoing threat to the public.</p><p>Investigators said, at this stage of the investigation, there appears to be no known connection between DeMayo and Swallow.</p><p>""As of now, the investigation has not found any connection between the defendant and the victim,"" Tucker said. ""We also believe, as of this point, that DeMayo acted alone.""</p><p><a href=""https://www.foxnews.com/us/fox-news-true-crime-newsletter-nancy-guthrie-glitch-death-row-inmates-message-alex-murdaugh-witness"" rel=""noopener"" target=""_blank""><strong>FOX NEWS TRUE CRIME NEWSLETTER: NANCY GUTHRIE GLITCH, DEATH ROW INMATE'S MESSAGE, ALEX MURDAUGH WITNESS</strong></a></p><p>The investigation remains ongoing.</p><p>""This terrible tragedy has struck the Swallow family, the town of Danvers and the Bishop Fenwick community. They are all in our thoughts as we continue to investigate,"" Tucker said.</p><p>Anthony DeMayo was arraigned Friday afternoon in Salem District Court, where he pleaded not guilty to a murder charge and was ordered held without bail, according to <a href=""https://www.nbcboston.com/news/local/bishop-fenwick-student-charged-danvers-woman-murdered-amherst-street-home/3915286/"" rel=""nofollow noopener"" target=""_blank"">NBC10 Boston</a>.</p><p>A court psychologist who interviewed DeMayo said he showed depressive symptoms, the outlet reported.</p><p>The judge ordered DeMayo sent to Bridgewater State Hospital for further evaluation and scheduled a pretrial hearing for April 1. His attorney did not object, according to NBC10 Boston.</p><p>The Danvers Police Department and Tucker could not be immediately reached by Fox News Digital for comment.</p>",https://www.foxnews.com/us/high-school-senior-charged-random-murder-68-year-old-woman-found-dead-massachusetts-home,2026-03-13
