,title,text,link,publish_date
5,Pope Leo urges war leaders to halt fighting after deadly strike on school sparks outrage,"<p><a href=""https://www.foxnews.com/category/person/pope-leo-xiv"" rel=""noopener"" target=""_blank"">Pope Leo XIV</a> on Sunday called for an immediate ceasefire in the war involving Iran, delivering his strongest remarks yet on the conflict and urging leaders responsible for the fighting to halt violence after deadly strikes that hit schools and civilian areas.</p><p>The Associated Press reported <a href=""https://www.foxnews.com/category/us/religion/roman-catholic"" rel=""noopener"" target=""_blank"">the pope</a> made the remarks at the end of his Sunday noon blessing at the Vatican, where he appealed to leaders involved in the conflict to halt the fighting and pursue dialogue instead of continued military escalation.</p><p>""On behalf of the Christians of the Middle East and all women and men of good will, I appeal to those responsible for this conflict,"" Leo said. ""Cease fire so that avenues for dialogue may be reopened. Violence can never lead to the justice, stability, and peace that the people are waiting for.""</p><p>Leo did not cite the U.S. or Israel by name, though he appeared to reference an attack in the opening days of the war that struck a school in Iran and killed more than 165 people, many of them children.</p><p><a href=""https://www.foxnews.com/politics/iran-war-11-days-in-us-controls-skies-oil-surges-region-braces-whats-next"" rel=""noopener"" target=""_blank""><strong>IRAN WAR, 11 DAYS IN: US CONTROLS SKIES, OIL SURGES AND THE REGION BRACES FOR WHAT’S NEXT</strong></a></p><p>U.S. officials said the strike may have been based on outdated intelligence, and an investigation into the incident is underway.</p><p>The pope said he was particularly close to the families of victims killed in attacks that have struck schools, hospitals and residential areas during the conflict.</p><p>He also expressed concern about the impact of the <a href=""https://www.foxnews.com/category/world/world-regions/middle-east/lebanon"" rel=""noopener"" target=""_blank"">fighting in Lebanon</a>, where aid groups have warned the escalating conflict could trigger a humanitarian crisis.</p><p><a href=""https://www.foxnews.com/politics/iran-vows-decisive-self-defense-u-n-trump-kills-supreme-leader-operation-epic-fury"" rel=""noopener"" target=""_blank""><strong>IRAN VOWS 'DECISIVE' SELF DEFENSE AT UN AFTER TRUMP KILLS SUPREME LEADER IN OPERATION EPIC FURY</strong></a></p><p>Christian communities in southern Lebanon are of particular concern to the Vatican, as they have long been seen as an important presence for Christians across a largely Muslim region.</p><p>For much of the two weeks since the conflict began, Leo has limited his public comments to broader appeals for peace and dialogue while avoiding direct references to the U.S. or Israel – a stance consistent with the <a href=""https://www.foxnews.com/category/world/religion/vatican"" rel=""noopener"" target=""_blank"">Vatican’s longstanding tradition of diplomatic neutrality</a>.</p><p>Some Catholic leaders, however, have taken a more direct stance on the conflict.</p><p><a href=""https://www.foxnews.com/world/red-cross-shares-audio-iranian-civilian-explaining-situation-ground-tehran-no-respite"" rel=""noopener"" target=""_blank""><strong>RED CROSS SHARES AUDIO OF IRANIAN CIVILIAN EXPLAINING SITUATION ON THE GROUND IN TEHRAN: 'NO RESPITE'</strong></a></p><p>Cardinal Robert McElroy, the archbishop of Washington, described <a href=""https://www.foxnews.com/category/world/conflicts/iran"" rel=""noopener"" target=""_blank"">the war</a> as morally unjustifiable, while Chicago Cardinal Blase Cupich criticized the White House for sharing social media posts about the war that included video game-style imagery.</p><p>Meanwhile, Vatican Secretary of State Cardinal Pietro Parolin rejected Washington’s characterization of the fighting as a ""preventive war,"" but said the Holy See continues to keep lines of communication open with all sides.</p><p>""The Holy See speaks with everyone,"" Parolin said. ""When necessary we speak also with the Americans, with the Israelis and show them what to us are the solutions.""</p><p><i>The Associated Press contributed to this report.</i></p>",https://www.foxnews.com/world/pope-leo-urges-war-leaders-halt-fighting-after-deadly-strike-school-sparks-outrage,2026-03-15
6,Spring break crackdown: Southern towns roll out alcohol bans and new restrictions,"<p>Certain popular spring break destinations are introducing stricter rules ahead of the busy travel season.</p><p>In Panama City Beach, Florida, officials have approved temporary overnight <a href=""https://www.foxnews.com/category/travel/general/beach"" rel=""noopener"" target=""_blank"">beach closures</a> as part of the city’s spring break safety plan.</p><p>The closures will run from March 12 through April 30, with certain sections of the beach closed nightly between 10 p.m. and 4 a.m., according to the Panama City Beach official website.</p><p><a href=""https://www.foxnews.com/travel/vacation-hot-spot-may-ban-alcohol-sales-key-hours-sweeping-new-crackdown"" rel=""noopener"" target=""_blank""><strong>VACATION HOT SPOT MAY BAN ALCOHOL SALES DURING KEY HOURS IN SWEEPING NEW CRACKDOWN</strong></a></p><p>The measure is intended to prevent large crowds from gathering late at night and to allow officers to patrol other areas during the <a href=""https://https://www.foxnews.com/category/travel"" rel=""noopener"" target=""_blank"">peak tourism</a> period, the website noted.</p><p>Police Chief J.R. Talamantez said the rules are meant to help maintain order while welcoming visitors to the <a href=""https://www.foxnews.com/category/travel/vacation-destinations"" rel=""noopener"" target=""_blank"">popular Gulf Coast destination.</a></p><p>""Panama City Beach is a world-class destination, and our job is to ensure it remains safe for our residents and visitors alike,"" Talamantez said on the city’s website.</p><p><a href=""https://www.foxnews.com/newsletters?cmpid=fnfirstnl"" rel=""noopener"" target=""_blank""><strong><u>CLICK HERE TO SIGN UP FOR OUR LIFESTYLE NEWSLETTER</u></strong></a></p><p>The city is also enforcing several additional ordinances during spring break, including a <a href=""https://www.foxnews.com/category/us/environment/regulation"" rel=""noopener"" target=""_blank"">ban on alcohol</a> on the beach throughout March and restrictions on alcohol sales between 2 a.m. and 7 a.m.</p><p>Violating the rules could result in fines, arrest or jail time, the city warned.</p><p><a href=""https://www.foxnews.com/category/us/us-regions/southeast/alabama"" rel=""noopener"" target=""_blank"">Gulf Shores, Alabama</a>, is also enforcing seasonal restrictions as spring break visitors arrive.</p><p><a href=""https://www.foxnews.com/lifestyle"" rel=""noopener"" target=""_blank""><strong><u>CLICK HERE FOR MORE LIFESTYLE STORIES</u></strong></a></p><p>City officials have renewed a ban on alcohol on public beaches for the 2026 spring break season, television station <a href=""https://www.wjhg.com/2026/02/10/gulf-shores-approves-alcohol-ban-spring-break-2026/"" rel=""nofollow noopener"" target=""_blank"">WJHG</a> reported.</p><p>The policy prohibits the possession or consumption of alcohol on public beaches from March 1 through April 28, according to the report.</p><p>Fox News Digital previously reported that <a href=""https://www.foxnews.com/category/us/miami"" rel=""noopener"" target=""_blank"">Miami Beach</a> is taking a different approach to spring break this year, easing some restrictions that had been implemented during the city’s earlier crackdown on large crowds.</p><p><a href=""https://www.foxnews.com/category/lifestyle/quizzes"" rel=""noopener"" target=""_blank""><strong><u>TEST YOURSELF WITH OUR LATEST LIFESTYLE QUIZ</u></strong></a></p><p>Christopher Bess, public information officer with the Miami Beach Police Department, said the city is working to shift the atmosphere away from the chaotic party scene that once defined the season.</p><p>""We are divorced with <a href=""https://https://www.foxnews.com/category/travel/spring-break-nation"" rel=""noopener"" target=""_blank"">spring break</a>,"" Bess said. ""The last two years, there were no fatalities, no shootings, no chaos.""</p><p>Despite some restrictions being relaxed, Bess said officers will continue to monitor crowds closely and enforce city laws throughout the spring break period.</p><p><i>Amy Galo of Fox News contributed reporting.</i></p>",https://www.foxnews.com/travel/spring-break-crackdown-southern-towns-roll-out-alcohol-bans-new-restrictions,2026-03-15
7,Illegal immigrant released under Biden charged with groping female students at Virginia high school,"<p>An <a href=""https://www.foxnews.com/category/us/immigration/illegal-immigrants"" rel=""noopener"" target=""_blank"">illegal immigrant</a> released during the Biden administration has been charged with multiple counts of assault and battery after allegedly groping female classmates in the hallways of a <a href=""https://www.foxnews.com/category/us/us-regions/southeast/virginia"" rel=""noopener"" target=""_blank"">Virginia high school</a>, according to parents and school officials.</p><p>""I think this entire horrifying situation is the direct consequence of policy with really dysfunctional priorities, and that's to shield adult illegal immigrants at the expense of children's safety, even in their public schools,"" Stephanie Lundquist-Arora, the mother of 3 students in the Fairfax County School System, told <a href=""https://www.foxnews.com/tag/fox-news"" rel=""noopener"" target=""_blank"">Fox News</a>.</p><p>Lundquist-Arora joined ""Fox &amp; Friends Weekend"" to discuss the arrest of an 18-year-old student accused of touching several female classmates inappropriately while they were walking through the halls of <a href=""https://www.foxnews.com/category/us/education/high-school"" rel=""noopener"" target=""_blank"">Fairfax High School</a>.</p><p><a href=""https://www.foxnews.com/politics/illegal-immigrant-nj-sexual-assault-teen-ice-warning"" rel=""noopener"" target=""_blank""><strong>ILLEGAL IMMIGRANT ACCUSED OF ASSAULTING NJ TEEN COULD BE RELEASED UNDER SANCTUARY POLICIES, ICE WARNS</strong></a></p><p>The student, identified as 18-year-old Israel Flores Ortiz, was arrested and charged with nine counts of assault and battery after allegedly touching female students while they were walking through the hallways between classes, according to a letter sent to parents by Fairfax High School officials.</p><p>Lundquist-Arora claims officials at the high school waited two weeks to inform parents and the move only came after parental pressure.</p><p><a href=""https://www.foxnews.com/us/high-school-senior-charged-random-murder-68-year-old-woman-found-dead-massachusetts-home"" rel=""noopener"" target=""_blank""><strong><u>HIGH SCHOOL SENIOR CHARGED WITH ‘RANDOM’ MURDER AFTER 68-YEAR-OLD WOMAN FOUND DEAD IN MASSACHUSETTS HOME</u></strong></a></p><p>Fox News reached out to both Fairfax High School and the school district (FCPS) and did not receive a comment.</p><p>Neither entity immediately returned Fox News Digital's requests for comment.</p><p>FCPS provided local outlet 7News with the following statement, however:</p><p>""While Fairfax County Public Schools is unable to comment on specifics due to federal and state privacy laws, we prioritize student and staff safety. We fully investigate. Anytime someone shares. That an incident has occurred at school or that they do not feel safe at school.""</p>",https://www.foxnews.com/media/illegal-immigrant-released-under-biden-charged-groping-female-students-virginia-high-school,2026-03-15
8,CarGurus breach linked to ShinyHunters exposes 12.4M records,"<p>If you've ever searched for a car on CarGurus, your personal information could now be circulating online. A <a href=""https://www.foxnews.com/category/tech/topics/hackers"" rel=""noopener"" target=""_blank"">hacking group</a> known as ShinyHunters has published what it claims are 12.4 million records taken from CarGurus, a popular auto shopping platform used by millions of people each month.</p><p>The leaked data includes names, phone numbers, email addresses, physical addresses and even finance pre-qualification details. While most of the records were already exposed in past incidents, about 3.7 million are newly added to the pile. That means fresh data is now freely available for criminals to download.</p><p><strong>Sign up for my FREE CyberGuy Report</strong><br />Get my best tech tips, urgent security alerts and exclusive deals delivered straight to your inbox. Plus, you'll get instant access to my Ultimate Scam Survival Guide – free when you join my <i><strong>CYBERGUY.COM</strong></i> newsletter.</p><p><a href=""https://www.foxnews.com/tech/149-million-passwords-exposed-massive-credential-leak"" rel=""noopener"" target=""_blank""><strong>149 MILLION PASSWORDS EXPOSED IN MASSIVE CREDENTIAL LEAK</strong></a></p><p>The group behind the leak, ShinyHunters, published a 6.1GB file on Feb. 21, claiming it came from CarGurus. The file allegedly contains 12.4 million user records tied to the U.S.-based auto research and shopping platform CarGurus.</p><p>CarGurus operates in the U.S., Canada and the U.K., and its website attracts an estimated 40 million monthly visitors. It allows you to compare vehicles, contact sellers, and, in some cases, apply for financing.</p><p>According to Have I Been Pwned, which later added the dataset to its breach database, the exposed information includes email addresses, IP addresses, full names, phone numbers, physical addresses, account IDs, dealer details, subscription information and finance pre-qualification application data, along with outcomes.</p><p>Have I Been Pwned reports that about 70% of the data had already appeared in previous breaches. Roughly 3.7 million records are new. CarGurus has not released an official statement confirming the incident and did not respond to media requests for comment. ShinyHunters is known for leaking company data when ransom negotiations fail. The group has recently claimed attacks on major brands across telecom, retail, finance, and tech.</p><p>ShinyHunters typically gains access by tricking employees, not by smashing through firewalls. In past cases, the group used phone calls or fake login pages to convince staff to hand over credentials. Once inside, attackers can quietly access cloud systems that store customer data.</p><p>In some campaigns, they also convinced employees to install malicious apps that granted access to customer databases. That means attackers could read stored information without triggering obvious alarms. If this dataset is legitimate, criminals now have detailed personal profiles tied to car shopping and financing activity, which is valuable.</p><p><a href=""https://www.foxnews.com/category/finance"" rel=""noopener"" target=""_blank"">Finance pre-qualification data</a> is especially sensitive. Even if it does not include full Social Security numbers, it signals that you were actively sharing financial details. That makes you a prime target for follow-up scams, identity theft attempts and fake loan offers. Because the data is publicly available for download, it does not take much skill for criminals to start using it.</p><p>""We recently experienced a cybersecurity incident,"" a CarGurus spokesperson told CyberGuy. ""We promptly responded by securing the affected environment, and we are currently working with a leading cybersecurity firm to investigate. Based on the investigation to date, we believe the activity has been contained and limited in scope. Also, at this time, there are no indications that dealer data feeds, APIs, or core systems or products used by our consumers or dealer partners have been compromised. We remain fully operational, and our services continue without interruption. We will notify any affected individuals in accordance with applicable laws.""</p><p><a href=""https://www.foxnews.com/tech/data-breach-exposes-400k-bank-customers-info"" rel=""noopener"" target=""_blank""><strong>DATA BREACH EXPOSES 400,000 BANK CUSTOMERS’ INFO</strong></a></p><p>Here's what you can do right now to reduce your risk and stay ahead of potential scams tied to this leak.</p><p>To see if your email was affected, visit <i>Have I Been Pwned at <strong>haveibeenpwned.com</strong></i>. Enter your email address to find out if your information appears in the CarGurus leak. When done, come back here for Step 2.</p><p>Start with your most important accounts, such as email, medical and banking. Use strong, unique passwords with letters, numbers and symbols. Avoid predictable choices like names or birthdays. Never reuse passwords. One stolen password can unlock multiple accounts.  A password manager makes this simple. It stores complex passwords securely and helps you create new ones. Many managers also scan for breaches to see if your current passwords have been exposed. Use a password manager to generate strong, unique passwords for every account and store them securely. That way, if one account is exposed, criminals can’t use the same password to access the rest of your accounts. Check out the best expert-reviewed password managers of 2026 at <i><strong>Cyberguy.com.</strong></i></p><p>You can also consider a <a href=""https://www.foxnews.com/category/us/personal-freedoms/privacy"" rel=""noopener"" target=""_blank"">personal data removal service</a>. While no service can guarantee the complete removal of your data from the internet, a data removal service is really a smart choice. They aren't cheap, and neither is your privacy. These services do all the work for you by actively monitoring and systematically erasing your personal information from hundreds of websites. It's what gives me peace of mind and has proven to be the most effective way to erase your personal data from the internet. By limiting the information available, you reduce the risk of scammers cross-referencing data from breaches with information they might find on the dark web, making it harder for them to target you.</p><p>Check out my top picks for data removal services and get a free scan to find out if your personal information is already out on the web by visiting <i><strong>Cyberguy.com.</strong></i></p><p>Get a<strong> free scan</strong> to find out if your personal information is already out on the web:<strong> </strong><i><strong>Cyberguy.com.</strong></i></p><p>If CarGurus or your email provider offers two-factor authentication (<a href=""https://www.foxnews.com/tech/what-two-factor-authentication-should-enable-it"" rel=""noopener noreferrer nofollow"" target=""_blank""><u>2FA)</u></a>, enable it. This adds a second step, like a code sent to your phone, making it much harder for someone to access your account even if they have your password.</p><p>Be extra cautious with emails or texts about car loans, financing approvals, or dealership follow-ups. Do not click links in unsolicited messages. Instead, contact the company directly using the official contact details you find on their website. Also, use strong <a href=""https://www.foxnews.com/category/tech/topics/virus"" rel=""noopener"" target=""_blank"">antivirus software</a> to block malicious links and downloads that often follow phishing campaigns. If attackers use this leaked data to target you with infected attachments, antivirus protection adds another layer of defense.</p><p>Get my picks for the best 2026 antivirus protection winners for your Windows, Mac, Android and iOS devices at <strong>Cyberguy.com.</strong></p><p>If you applied for financing, check your credit reports for unfamiliar inquiries or new accounts. Early detection can help you stop identity theft before it spirals. Consider placing a credit freeze if you see suspicious activity.</p><p>Identity theft protection services can monitor for unusual activity tied to your name, Social Security number, or financial accounts. They can alert you quickly if someone tries to open a new credit card in your name.</p><p>See my tips and best picks on Best Identity Theft Protection at <i><strong>Cyberguy.com.</strong></i></p><p>This incident highlights a bigger issue than just one company. When platforms collect detailed financial and personal data, they become high-value targets. If the leaked dataset is authentic, millions of people who were simply shopping for a car now face increased risk of scams. CarGurus has not publicly confirmed a breach. Customers deserve clarity when sensitive financial application data may be involved. Silence only increases uncertainty.</p><p>Should companies that collect financing data be required to publicly confirm or deny breaches within a set timeframe?  Let us know by writing to us at <i><strong>Cyberguy.com.</strong></i></p><p><strong>Sign up for my FREE CyberGuy Report</strong> <br />Get my best tech tips, urgent security alerts and exclusive deals delivered straight to your inbox. Plus, you’ll get instant access to my Ultimate Scam Survival Guide – free when you join my <i><strong>CYBERGUY.COM</strong></i> newsletter.</p><p>Copyright 2026 CyberGuy.com. All rights reserved. </p>",https://www.foxnews.com/tech/cargurus-breach-linked-shinyhunters-exposes-12-4m-records,2026-03-15
