,title,text,link,publish_date
15,"Daughters’ relentless search shatters ‘overdose’ claim, leads to arrest in mom’s 1992 murder","<p>More than three decades after a Washington mother was found dead inside her home, investigators have made an arrest in a case that had long gone cold.</p><p>In November 1992, Janice Randle was found dead on her bed inside her Graham, Washington home, with her young daughter nearby in a crib. At the time, her husband, James Randle, told authorities she may have died from a drug overdose, citing a past history of painkiller use.</p><p>The couple had been separated and were going through a divorce. The case was initially treated as a death investigation and possible overdose. However, autopsy results later revealed there were no drugs in Randle’s system, prompting investigators to <a href=""https://www.foxnews.com/category/us/crime/homicide"" rel=""noopener"" target=""_blank"">reclassify the case as a homicide</a>.</p><p>Despite that shift, only limited evidence was available, and detectives were unable to establish probable cause for an arrest. The case remained unsolved for decades.</p><p><a href=""https://www.foxnews.com/us/realtors-cold-case-murder-finally-solved-after-15-years-police-say"" rel=""noopener"" target=""_blank""><strong>REALTOR'S COLD CASE MURDER FINALLY SOLVED AFTER 15 YEARS, POLICE SAY</strong></a></p><p>The investigation was revived in recent years after family members came forward with new information, including accounts of alleged confessions made by James Randle. Those leads gave investigators a fresh perspective—and a new path forward.</p><p>Authorities say the renewed investigation ultimately established probable cause to arrest the now 68-year-old suspect, who was living in a care facility in Everett, Washington. He was taken into custody on April 1.</p><p>Investigators now believe Janice Randle died as the result of a violent struggle with her husband, with newly uncovered evidence contradicting the original account from 1992.</p><p><a href=""https://www.foxnews.com/us/yale-professors-father-charged-mothers-decades-old-murder-says-he-used-me-bait-report"" rel=""noopener"" target=""_blank""><strong>YALE PROFESSOR’S FATHER CHARGED IN MOTHER’S DECADES-OLD MURDER, SAYS HE ‘USED ME AS BAIT’: REPORT</strong></a></p><p>""This case stands as a powerful example of how advancements in technology and investigative practices can bring justice—even decades later,"" the Pierce County Sheriff’s Office said.</p><p>""Most importantly, it is a testament to the unwavering commitment of the detectives and investigators who refused to let Janice’s story be forgotten,"" officials added. ""Their diligence, compassion, and determination have given Janice’s family the closure they have sought for so many years.""</p><p>Court documents <a href=""https://www.fox13seattle.com/news/man-arrested-1992-murder-estranged-wife-graham"" rel=""noopener"" target=""_blank"">obtained by Fox 13 Seattle</a> indicate the suspect allegedly admitted to two family members in the years after Janice’s death that he killed her and staged the scene to appear as a drug overdose. Investigators also noted Janice had visible bruising and signs of a struggle, though her death was initially ruled undetermined.</p><p><a href=""https://twitter.com/FoxTrueCrime"" rel=""noopener"" target=""_blank""><strong>FOLLOW THE FOX TRUE CRIME TEAM ON X</strong></a></p><p>The records show the couple had been in a contentious divorce and custody battle at the time, and that the suspect had a prior domestic violence conviction and made threats in the weeks leading up to her death.</p><p><a href=""https://www.foxnews.com/category/us/crime/police-and-law-enforcement"" rel=""noopener"" target=""_blank"">Jail records</a> show James Robert Randle was booked into the Pierce County Jail on April 1 on a first-degree murder charge, with bail set at $1 million.</p><p><a href=""https://www.foxnews.com/newsletters"" rel=""noopener"" target=""_blank""><strong>SIGN UP TO GET TRUE CRIME NEWSLETTER</strong></a></p><p>The break in the case was driven in part by Randle’s daughters, one of whom was just 18 months old and in a crib next to her mother the night she died, who helped bring renewed attention to the investigation decades later.</p><p>Janice’s oldest daughter, Katie Wakin, credited both her family and investigators for finally <a href=""https://www.foxnews.com/category/us/crime/cold-case"" rel=""noopener"" target=""_blank"">bringing the case back to light</a>.</p><p><a href=""https://www.foxnews.com/tips"" rel=""noopener"" target=""_blank""><strong>SEND US A TIP HERE</strong></a></p><p>""The blessing of having a lot of my mom’s best friends fill in the gaps for us as kids because she was gone,"" Wakin told Fox 13 Seattle. ""I’ve had the pleasure of bonding with my siblings and we’re very, very close… we all do, because of this loss.""</p><p>Wakin was 14 years old when her mother was killed and said she never expected to see an arrest.</p><p><a href=""https://link.podtrac.com/cjdr_fnd_article"" rel=""noopener"" target=""_blank""><strong>LISTEN TO THE NEW 'CRIME &amp; JUSTICE WITH DONNA ROTUNNO' PODCAST</strong></a></p><p>""I don’t want to say I gave up hope, but I never thought I would see this in my lifetime,"" she said. ""I accepted that. I was at peace with that—until about a year ago.""</p><p>That shift came when her younger half-sister, Kourtney Lewis, who was just 18 months old at the time of the killing, began digging into the case in 2025 while trying to learn more about her mother for her own children.</p><p><a href=""https://www.foxnews.com/category/us/true-crime"" rel=""noopener"" target=""_blank""><strong>LIKE WHAT YOU'RE READING? FIND MORE ON THE TRUE CRIME HUB</strong></a></p><p>""I never looked at some of the documents… just the basic documents when someone dies,"" Lewis told Fox 13 Seattle. ""When I looked at them, I knew. I knew exactly what was happening. And so, I said I need to figure this out.""</p><p>Together, the sisters gathered information and pushed for answers—efforts that ultimately helped investigators reexamine evidence and zero in on the suspect.</p><p>For Randle’s family, the arrest marks a long-awaited step toward closure after more than 30 years.</p><p>Fox News Digital reached out to the Pierce County Sheriff's Office for comment. </p>",https://www.foxnews.com/us/daughters-relentless-search-shatters-overdose-claim-leads-arrest-moms-1992-murder,2026-04-04
16,Geno Auriemma releases statement after shouting match with Dawn Staley: 'Unlike what I do',"<p><a href=""https://www.foxnews.com/category/sports/ncaa/connecticut-huskies"" rel=""noopener"" target=""_blank"">UConn women's basketball</a> coach Geno Auriemma showed regret for his action at the end of Friday's Final Four game against South Carolina where he and Dawn Staley got into a heated discussion.</p><p>He began to speak to her aggressively, before the conversation devolved and quickly escalated into a <a href=""https://www.foxnews.com/sports/legendary-womens-basketball-coaches-dawn-staley-geno-auriemma-get-heated-shouting-match"" rel=""noopener"" target=""_blank"">visible shouting match</a>. Auriemma said after the game he was upset that Staley had apparently not shaken his hand before the game (the two were seen shaking hands pregame, but Auriemma said he waited several minutes before seeing Staley).</p><p><a href=""https://www.foxnews.com/sports"" rel=""noopener"" target=""_blank""><strong>CLICK HERE FOR MORE SPORTS COVERAGE ON FOXNEWS.COM</strong></a></p><p>""There’s no excuse for how I handled the end of the game vs. South Carolina,"" Auriemma said in a statement posted to social media.</p><p>""It’s unlike what I do and what our standard is here at Connecticut. I want to apologize to the staff and the team at South Carolina. It was uncalled for in how I reacted. The story should be how well South Carolina played, and I don’t want my actions to detract from that. I’ve had a great relationship with their staff, and I sincerely want to apologize to them.""</p><p>Staley addressed the incident in an interview with ESPN immediately afterward.</p><p><a href=""https://www.foxnews.com/sports/knicks-broadcasters-joke-comparing-bulls-obliterated-defense-iran-leaves-partner-stunned"" rel=""noopener"" target=""_blank""><strong>KNICKS BROADCASTER'S JOKE COMPARING BULLS' 'OBLITERATED' DEFENSE TO IRAN LEAVES PARTNER STUNNED</strong></a></p><p>""I have no idea, but I'm going to let you know this: I'm of integrity. I'm of integrity,"" Staley said. ""So if I did something wrong to Geno, I had no idea what I did. I guess he thought I didn't shake his hand at the beginning of the game. I didn't know. I went down there pregame, shook everybody on his staff's hand. I don't know what we came with after the game, but hey, sometimes things get heated. We move on.""</p><p>Meanwhile, Auriemma expressed displeasure with Staley and the referees during an in-game interview on ESPN.</p><p>""Their coach rants and raves on the sideline and calls the referee some names you don’t want to hear. And now we get 6 to 0, and I got a kid with a ripped jersey, and they go, ‘I didn’t see it.’ Come on, man. It’s for a national championship,"" he said to Holly Rowe.</p><p>After the game, Auriemma declined to elaborate on the incident.</p><p>""I said what I had to say and... nothing... nothing,"" he said when asked what happened with Staley, refusing to tell reporters what he said. ""Why would I say it? I said what I said, and obviously she didn't like it. I just told the truth.""</p><p><a href=""https://www.foxnews.com/sports/uconns-undefeated-season-crumbles-south-carolina-gets-sweet-revenge-reigning-champs"" rel=""noopener"" target=""_blank"">South Carolina ended UConn's</a> perfect season in what was a rematch from last year's national championship that the Huskies won. The loss ended UConn's 54-game winning streak dating back to last season.</p><p><em>Fox News' Jackson Thompson contributed to this report.</em></p><p><strong><em>Follow Fox News Digital’s </em></strong><a href=""https://twitter.com/FoxNewsSports_"" rel=""noopener noreferrer nofollow"" target=""_blank""><strong><em>sports coverage on X</em></strong></a><strong><em>, and subscribe to </em></strong><a href=""https://www.foxnews.com/newsletters"" rel=""noopener noreferrer nofollow"" target=""_blank""><strong><em>the Fox News Sports Huddle newsletter.</em></strong></a></p>",https://www.foxnews.com/sports/geno-auriemma-releases-statement-shouting-match-dawn-staley-unlike,2026-04-04
17,Three people hospitalized after city bus crashes into popular DC restaurant: officials,"<p>A city bus crashed into a popular <a href=""https://www.foxnews.com/category/us/washington-dc"" rel=""noopener nofollow"" target=""_blank"">Washington, D.C.,</a> restaurant Saturday morning, smashing into the empty dining room and sending three people to the hospital.</p><p>D.C. Fire and EMS crews responded to the scene at 7th and Q streets NW after a crash involving a bus and another vehicle, according to the D.C. Fire and EMS Department.</p><p>The Washington Metropolitan Area Transit Authority (WMATA) Metrobus crashed into the dining room of the AMBAR Restaurant in the Shaw neighborhood, breaching the building and coming to rest inside, which was unoccupied at the time, <a href=""https://https://www.fox5dc.com/news/bus-crashes-unoccupied-restaurant-northwest-dc-injuries-unclear"" rel=""noopener"" target=""_blank"">FOX 5 reported</a>.</p><p><a href=""https://www.foxnews.com/us/least-2-students-killed-several-injured-school-bus-crash-tennessee-parents-worst-nightmare"" rel=""noopener"" target=""_blank""><strong>AT LEAST 2 STUDENTS KILLED, SEVERAL INJURED IN SCHOOL BUS CRASH IN TENNESSEE: 'A PARENT'S WORST NIGHTMARE'</strong></a></p><p>""Crash with vehicle into a building 7th &amp; Q Sts MW. Bus into unoccupied restaurant,"" the department wrote on X.</p><p>Four people were evaluated following the incident, with three adult women transported to the hospital with <a href=""https://www.foxnews.com/category/health/nervous-system-health/head-injury"" rel=""noopener"" target=""_blank"">minor injuries</a>, officials said.</p><p><a href=""https://https://www.foxnews.com/us/columbia-university-student-among-5-killed-new-york-tour-bus-crash-after-niagara-falls-visit"" rel=""noopener"" target=""_blank""><strong>COLUMBIA UNIVERSITY STUDENT AMONG 5 KILLED IN NEW YORK TOUR BUS CRASH AFTER NIAGARA FALLS VISIT</strong></a></p><p>Firefighters secured utilities and searched the structure, while a specialized collapse team was deployed to assess the <a href=""https://www.foxnews.com/category/aftermath"" rel=""noopener"" target=""_blank"">building’s stability</a>.</p><p>Officials later said the bus had been removed from the building, with no major structural damage reported. Fire crews determined no shoring was needed and began clearing the scene.</p><p><a href=""https://https://www.foxnews.com/us/semi-truck-driver-held-ice-detainer-after-4-killed-head-on-crash"" rel=""noopener"" target=""_blank""><strong>SEMI-TRUCK DRIVER HELD ON ICE DETAINER AFTER 4 KILLED IN HEAD-ON CRASH</strong></a></p><p>Authorities have not released details on what <a href=""https://www.foxnews.com/us/viral-surveillance-video-shows-suspects-killing-7-month-old-flung-from-moped-frenzied-getaway-crash"" rel=""noopener"" target=""_blank"">caused the crash</a>.</p><p>It remains unclear how many people were on the bus at the time of the incident.</p><p>AMBAR in D.C.’s Shaw neighborhood is a Michelin-recognized Balkan restaurant known for its <a href=""https://www.foxnews.com/category/food-drink/recipes/meals/brunch"" rel=""noopener"" target=""_blank"">popular unlimited brunch</a> and dinner service, according to its website.</p><p>The WMATA and D.C. Fire and EMS Department did not immediately respond to Fox News Digital's request for comment.</p>",https://www.foxnews.com/us/three-people-hospitalized-city-bus-crashes-popular-dc-restaurant-officials,2026-04-04
18,One dead and dozens injured during pregame event in Peru soccer stadium,"<p>At least one person is dead and 60 others were injured at the <a href=""https://www.foxnews.com/sports"" rel=""noopener"" target=""_blank"">Alejandro Villanueva Stadium</a> on Friday in Lima, Peru, authorities reported.</p><p>There seemed to be a crush of fans, as police said officers rescued people who were trapped as a result of the influx of fans in the south stands right before <a href=""https://www.foxnews.com/category/sports/soccer"" rel=""noopener"" target=""_blank"">Alianza Lima</a> played their biggest rival, Universitario, on Saturday. Fans attended a pregame ""flag-waving event"" at the stadium.</p><p>""We deeply regret the passing of our fan, Freddy Rony Cornetero Cueva. One of our own has left us, one of those who feel these colors in their soul. We accompany his family and loved ones with all our hearts,"" Alianza Lima said in a statement on X on Saturday, which was translated to English.</p><p><a href=""https://www.foxnews.com/sports"" rel=""noopener"" target=""_blank""><strong>CLICK HERE FOR MORE SPORTS COVERAGE ON FOXNEWS.COM</strong></a></p><p>The Ministry of Health initially reported the collapse of a wall inside the stadium, but both the team and the police denied that in separate statements. Fire brigadier Marcos Pajuelo said that dozens of injured people were taken to the hospital, in addition to the fatality.</p><p>He said the cause is currently unknown. Officials are investigating the cause of the incident.</p><p><a href=""https://www.foxnews.com/sports/knicks-broadcasters-joke-comparing-bulls-obliterated-defense-iran-leaves-partner-stunned"" rel=""noopener"" target=""_blank""><strong>KNICKS BROADCASTER'S JOKE COMPARING BULLS' 'OBLITERATED' DEFENSE TO IRAN LEAVES PARTNER STUNNED</strong></a></p><p>In the club’s statement, they promised full transparency to the authorities.</p><p>Videos broadcast by local television stations showed a large crowd of fans in the south stands amid an explosion of fireworks. Other videos showed apparently injured people sitting in the stands inside the stadium.</p><p>Despite the incident on Friday night, the <a href=""https://www.foxnews.com/category/travel/regions/south-america"" rel=""noopener"" target=""_blank"">Peruvian professional soccer league</a> said the team’s match on Saturday will proceed as planned.</p><p><i>The Associated Press contributed to this report.</i></p><p><i><strong>Follow Fox News Digital’s </strong></i><a href=""https://twitter.com/FoxNewsSports_"" rel=""noopener"" target=""_blank""><i><strong>sports coverage on X</strong></i></a><i><strong>, and subscribe to</strong></i><a href=""https://www.foxnews.com/newsletters"" rel=""noopener"" target=""_blank""><i><strong> the Fox News Sports Huddle newsletter</strong></i></a><i><strong>.</strong></i></p>",https://www.foxnews.com/sports/one-dead-dozens-injured-pregame-event-peru-soccer-stadium-,2026-04-04
19,Michael Landon’s ‘Little House’ co-star exposes actor’s wild on-set pranks,"<p>On ""Little House on the Prairie,"" Michael Landon was the boss, but behind the scenes, he was the class clown.</p><p>Patrick Labyorteaux, who starred as Andy Garvey in the hit series, recently posted a video on <a href=""https://www.youtube.com/watch?v=75GYtE5bNao"" rel=""nofollow noopener"" target=""_blank"">his YouTube channel</a> about how the beloved TV patriarch let loose and became a prankster when cameras stopped rolling.</p><p>""Everybody knows that Michael Landon is an amazing actor,"" said Labyorteaux. ""When people think of Michael, they think of 'Pa,' and they think of the good, strong family man who would never play a practical joke on anybody. But that wasn’t Michael.</p><p><a href=""https://www.foxnews.com/entertainment/little-house-prairie-star-reveals-wild-friendship-jim-morrison-before-wholesome-tv-fame"" rel=""noopener"" target=""_blank""><strong>'LITTLE HOUSE ON THE PRAIRIE' STAR REVEALS WILD FRIENDSHIP WITH JIM MORRISON BEFORE WHOLESOME TV FAME</strong></a></p><p>""On the set, Michael was always telling jokes, doing these crazy things,"" the 60-year-old shared. ""And one of his favorite targets was our script supervisor, Mary [Yerke]. And Mary was this delightful woman who stood about 2 feet tall, and she had this huge script.""</p><p>Labyorteaux said Landon would quietly put rocks in saddlebags on her chair. When she carried her chair between filming locations, she thought it suddenly weighed a ton.</p><p>""She’s dragging her chair,"" Labyorteaux recalled. ""She’s got about 10 pounds of rocks in her chair with her scripts, which are really heavy. And I remember her saying, 'Man, I must be getting old. These chairs are getting so heavy.' And Michael would just laugh and laugh and laugh.""</p><p><strong>WATCH: ‘LITTLE HOUSE ON THE PRAIRIE’ CHILD STAR SAYS SET WAS LIKE ‘MAD MEN’</strong></p><p>""She would drag the chair along with her,"" he said. ""<a href=""https://www.foxnews.com/category/entertainment/genres/comedy"" rel=""noopener"" target=""_blank"">Michael thought this was hysterical</a>.""</p><p>Landon then took his jokes to the next level.</p><p>""Michael, this one time, had a real stern look on his face,"" said Labyorteaux.</p><p>""He looked over at Mary and called her over. He wasn’t saying anything. Mary went over with her script and said, 'Yeah, boss.' </p><p>""He leaned in and opened his mouth. Out flew this tiny frog. We had thousands of them <a href=""https://www.foxnews.com/category/us/us-regions/west/california"" rel=""noopener"" target=""_blank"">in Simi Valley</a>. He’d put it in his mouth and just about scared the life out of her.""</p><p>""It was like the best kids' joke ever,"" he gushed. ""Frogs jumping out of Michael Landon’s mouth? Yes, please. I’ll have some more.""</p><p><a href=""https://www.foxnews.com/newsletters"" rel=""noopener"" target=""_blank""><strong><u>CLICK HERE TO SIGN UP FOR THE ENTERTAINMENT NEWSLETTER</u></strong></a></p><p>""Little House on the Prairie"" chronicled the adventures of the Ingalls family in the 19th-century Midwest. Despite its wholesome storytelling, life was different on set.</p><p>""It was the '70s,"" Alison Arngrim, who played mean girl Nellie Oleson, told Fox News Digital in 2024.</p><p>""People drank, people smoked. [Landon] did all of these things. It was kind of strange. You're on set, and people are standing around with cigarettes and glasses of gin. It seemed odd, but that was TV in the '70s. <a href=""https://www.foxnews.com/category/entertainment/tv"" rel=""noopener"" target=""_blank"">It was like 'Mad Men.'""</a></p><p>""[Landon] was so not Pa,"" she insisted at the time. ""But then, if you think about it, what a brilliant performance. Here was this man who came to work in his unbuttoned shirt, gold chains and Ferrari with his Marlboros, and then he turned into Pa Ingalls in a matter of minutes.""</p><p>Landon died at age 54 from <a href=""https://www.foxnews.com/category/health/cancer/pancreatic-cancer"" rel=""noopener"" target=""_blank"">pancreatic cancer</a> in 1991. The actress described her late co-star as a straight shooter who smoked heavily and battled insecurities.</p><p>""Michael was in many ways a Hollywood person,"" the 64-year-old explained. ""Yes, he owned a Ferrari. He had fast cars. But the show was therapy for people. And I believe it was therapy for Michael in a lot of ways. [What surprised me] was that insecurity because he was so powerful.</p><p><a href=""https://www.foxnews.com/entertainment"" rel=""noopener"" target=""_blank""><strong><u>LIKE WHAT YOU’RE READING? CLICK HERE FOR MORE ENTERTAINMENT NEWS</u></strong></a></p><p>""He was the executive director. He was the producer. He was the writer and star of the show. He was everything. He was loved by millions, absolutely gorgeous, very much in charge. He’d be cracking jokes. He had a wonderfully twisted, warped sense of humor. He was hilarious.</p><p>""But you could see that there were moments when he was trying so hard, 'Will this be good enough?'"" Arngrim continued. </p><p>""He wanted it to be good enough to be perfect. And you could see that there were times when he’d get that look like, 'Oh, my God, maybe this isn’t going to be perfect.' And I think that was maybe the thing that drove him — maybe scared him. That it wouldn’t be perfect.""</p><p>Decades later, Arngrim still views the beloved patriarch as ""complicated and fascinating.""</p><p>""That was the most fun you could have on a set without getting arrested,"" she said. ""[He was all about] the jokes, the foolishness, always wanting to make the kids laugh ... and then being very supportive and respectful at the same time. </p><p>""And then being an absolute taskmaster ... all at the same time, all day long. I don't think I've met anybody [else] quite like him.""</p>",https://www.foxnews.com/entertainment/michael-landons-little-house-co-star-exposes-actors-wild-on-set-pranks,2026-04-04
