,title,text,link,publish_date
18,Massachusetts mom offers to admit killing 3 children as prosecutors push back on move that could dodge prison,"<p>A <a href=""https://www.foxnews.com/category/us/us-regions/northeast/massachusetts"" rel=""noopener"" target=""_blank"">Massachusetts mother</a> accused of strangling her three young children is offering to formally admit she killed them in a dramatic legal move that could shift the focus of her trial to her mental state — and potentially keep her out of prison.</p><p>Lindsay Clancy, who was a Duxbury labor and delivery nurse, is willing to formally admit in writing to her role in the killings, according to a new motion filed by defense attorney Kevin Reddington.</p><p>The filing, <a href=""https://www.wcvb.com/article/lindsay-clancy-trial-stipulate-murder-defense-offer/70952741"" rel=""nofollow noopener"" target=""_blank"">obtained by WCVB5,</a> comes just one week after a judge denied Clancy’s request to split her trial into separate phases that would have divided the question of whether she committed the acts from her mental state at the time.</p><p>In asking the court to reconsider, Reddington argued that Clancy’s admission would leave her mental condition as the central issue for a jury to decide. The filing states that she is willing to formally acknowledge her involvement in the conduct that led to the deaths of her three children.</p><p><a href=""https://www.foxnews.com/us/utah-childrens-book-author-kouri-richins-husbands-murder"" rel=""noopener"" target=""_blank""><strong>UTAH CHILDREN’S BOOK AUTHOR KOURI RICHINS CONVICTED IN HUSBAND’S MURDER</strong></a></p><p>If she is ultimately deemed mentally unfit <a href=""https://www.foxnews.com/category/us/crime/trials"" rel=""noopener"" target=""_blank"">to stand trial,</a> she could be committed to a secure mental health facility rather than face prison under Massachusetts law.</p><p>Prosecutors have not agreed to the proposal. They previously opposed the idea of separating the trial, arguing that the evidence presented in each phase would be nearly identical.</p><p>Clancy was indicted in September 2023 on three counts of murder and strangulation in connection with the deaths of her children, 5-year-old Cora, 3-year-old Dawson and 8-month-old Callan.</p><p>Prosecutors allege that Clancy used exercise bands to strangle the children inside the family’s Duxbury home on Jan. 24, 2023, before attempting to take her own life.</p><p><a href=""https://www.foxnews.com/us/massachusetts-mother-accused-strangling-3-children-seeks-insanity-defense"" rel=""noopener noreferrer nofollow"" target=""_blank""><strong>MASSACHUSETTS MOTHER ACCUSED OF STRANGLING HER 3 CHILDREN SEEKS INSANITY DEFENSE</strong></a></p><p>Her husband, Patrick Clancy, returned home to what court documents describe as silence. He found blood on the floor and an open window before discovering his wife outside with cuts to her wrists and neck. She survived the apparent suicide attempt.</p><p>Previously unsealed records, spanning nearly 300 pages, detail Clancy’s actions in the hours leading up to the killings.</p><p><a href=""https://twitter.com/FoxTrueCrime"" rel=""noopener"" target=""_blank""><strong>FOLLOW THE FOX TRUE CRIME TEAM ON X</strong></a></p><p>According to court documents, she had taken one of her children to a pediatrician appointment earlier that day and contacted a CVS pharmacy about a prescription. She also ordered takeout from a local restaurant and used Apple Maps to calculate travel time from her home.</p><p><a href=""https://www.foxnews.com/newsletters"" rel=""noopener"" target=""_blank""><strong>SIGN UP TO GET TRUE CRIME NEWSLETTER</strong></a></p><p>Investigators say she then asked her husband to pick up the food and medication, leaving her alone with the children.</p><p><a href=""https://www.foxnews.com/category/us/crime/police-and-law-enforcement"" rel=""noopener"" target=""_blank"">Authorities later executed</a> multiple search warrants and collected items from the home, including exercise bands, medications, electronic devices, notebooks, clothing and a knife.</p><p><a href=""https://www.foxnews.com/tips"" rel=""noopener"" target=""_blank""><strong>SEND US A TIP HERE</strong></a></p><p>Clancy’s defense team has indicated it will argue she was suffering from <a href=""https://www.foxnews.com/category/health/mental-health/depression"" rel=""noopener"" target=""_blank"">severe postpartum depression</a> and was overmedicated at the time of the killings.</p><p>Court records show she had been prescribed a number of psychiatric medications, including Zoloft, Prozac, Valium, Ativan, Klonopin, Trazodone and Seroquel.</p><p><a href=""https://link.podtrac.com/cjdr_fnd_article"" rel=""noopener"" target=""_blank""><strong>LISTEN TO THE NEW 'CRIME &amp; JUSTICE WITH DONNA ROTUNNO' PODCAST</strong></a></p><p>Her husband previously told a family friend he was concerned she may have been experiencing <a href=""https://www.foxnews.com/category/health/mental-health/stress-and-anxiety"" rel=""noopener"" target=""_blank"">withdrawal from an anxiety medication</a> in the weeks before the tragedy.</p><p>Clancy has also filed a lawsuit against her medical providers, alleging a catastrophic failure in diagnosing and treating her mental health condition.</p><p><a href=""https://www.foxnews.com/category/us/true-crime"" rel=""noopener"" target=""_blank""><strong>LIKE WHAT YOU'RE READING? FIND MORE ON THE TRUE CRIME HUB</strong></a></p><p>Clancy remains paralyzed from the chest down following her suicide attempt, her attorney has said, and is being held at Tewksbury State Hospital where she continues to receive psychiatric care under constant supervision. </p><p>She is expected to undergo a court-ordered forensic mental health evaluation between April 10 and April 12, with a status hearing scheduled for April 23, <a href=""https://www.nbcboston.com/news/local/lindsay-clancy-murder-trial/3929250/"" rel=""nofollow noopener"" target=""_blank"">according to NBC10 Boston.</a> Clancy’s trial is scheduled to begin July 20 after being delayed several times.</p><p><i>Fox News Digital's Sarah Whitten-Rumpf and Greg Wehner contributed to this report. </i></p>",https://www.foxnews.com/us/massachusetts-mom-offers-admit-killing-3-children-prosecutors-push-back-move-could-dodge-prison,2026-04-07
19,Spanberger dodges questions on whether she would reverse sanctuary policy as DHS turns up heat,"<p>RICHMOND, VA — Virginia's Democratic Governor <a href=""https://www.foxnews.com/category/person/abigail-spanberger"" rel=""noopener"" target=""_blank"">Abigail Spanberger</a> on Tuesday ignored questions on whether she would entertain calls from the Department of Homeland Security to end sanctuary policies in the state.</p><p>""Governor Spanberger must end her sanctuary policies that allow these illegal aliens onto our streets and work with DHS to protect the citizens of the commonwealth,"" the agency said in a <a href=""https://www.facebook.com/homelandsecurity/photos/of-the-four-defendants-in-fairfax-county-murder-trials-this-year-three-are-illeg/1433748215463019/"" rel=""noopener noreferrer nofollow"" target=""_blank"">post to social media.</a></p><p>Virginia — and in particular Fairfax County — has made headlines in recent weeks for a string of deadly attacks carried out by illegal aliens.</p><p><a href=""https://www.foxnews.com/politics/dhs-blasts-spanberger-over-potential-release-illegal-migrant-30-arrests-currently-charged-murder"" rel=""noopener"" target=""_blank""><strong>DHS BLASTS SPANBERGER ON POTENTIAL RELEASE OF ILLEGAL MIGRANT WITH 30+ ARRESTS CURRENTLY CHARGED WITH MURDER</strong></a></p><p>Earlier this month, authorities <a href=""https://www.foxnews.com/politics/virginia-father-charged-murdering-infant-daughter-illegal-alien-says-dhs"" rel=""noopener"" target=""_blank"">charged 28-year-old Guatemala native</a> Misael Lopez Gomez with the murder of his 3-month-old daughter. His arrest comes on the heels of an attack by Anibal Armando Chavarria Muy, 38, another Guatemalan charged with fatally stabbing a man in his home. The county was also where repeat offender and Sierra Leone national Abdul Jalloh, 32, stabbed a victim to death at a bus stop in February.</p><p>DHS noted that three of the four suspects charged with murders in Fairfax County so far in 2026 are illegal aliens.</p><p>Spanberger did not comment on the figure.</p><p><a href=""https://www.foxnews.com/politics/trump-admin-asks-spanberger-virginia-officials-not-release-illegal-charged-groping-high-school-girls"" rel=""noopener"" target=""_blank""><strong>MIGRANT ACCUSED OF GROPING MULTIPLE HIGH SCHOOL GIRLS FACES CHARGES AS DHS WARNS SPANBERGER AGAINST RELEASE </strong></a></p><p>At the beginning of her term, Spanberger joined a handful of Democratic governors like California Governor Gavin Newsom and Illinois Governor J.B. Pritzker who have made it harder for <a href=""https://www.foxnews.com/category/controversies"" rel=""noopener"" target=""_blank"">local law enforcement</a> to cooperate with federal immigration enforcement efforts.</p><p>On Jan. 17, Spanberger <a href=""https://www.foxnews.com/category/politics/judiciary/state-and-local"" rel=""noopener"" target=""_blank"">rescinded local-federal coordination requirements,</a> arguing that Virginia’s resources would be better spent enforcing its own laws.</p><p>""Virginians have been deprived of critical public safety and local law enforcement to divert their limited resources for use in enforcing federal civil immigration laws,"" Spanberger said in <a href=""https://www.governor.virginia.gov/media/governorvirginiagov/governor-of-virginia/pdf/eo/EO-10-RESCISSION-OF-EXECUTIVE-ORDER-NO.-FORTY-SEVEN.pdf"" rel=""noopener noreferrer nofollow"" target=""_blank"">a press release.</a></p><p>""Federal authorities should enforce federal civil immigration laws — law enforcement in the Commonwealth should prioritize the safety and security of all residents in Virginia, the enforcement of local and state laws and coordination with federal entities on criminal matters,"" she added.</p><p>Another illegal alien who has gotten attention in Virginia is Israel Flores Ortiz, 19, who is <a href=""https://www.foxnews.com/politics/trump-admin-asks-spanberger-virginia-officials-not-release-illegal-charged-groping-high-school-girls"" rel=""noopener"" target=""_blank"">facing nine counts</a> of assault and battery for groping girls at a Fairfax County high school he was attending. Victims and parents have alleged that Ortiz approached about 12 girls from behind in crowded hallways, grabbed them between the legs and groped their private areas, according to <a href=""https://wjla.com/news/local/illegal-immigrant-student-groping-girls-fairfax-county-high-school-assault-battery-crime"" rel=""noopener"" target=""_blank""><u>7News</u></a>.</p><p>DHS Deputy Assistant Secretary Lauren Bis said last month that the agency is ""calling on Fairfax County sanctuary politicians to NOT release this predator from jail back into our communities to assault more teenage women.""</p><p>She went on to slam Spanberger for ending former Republican Gov. Glenn Youngkin’s policy of cooperation with ICE, saying it is ""siding with criminal illegal aliens over American citizens.""</p><p><a href=""https://www.foxnews.com/politics/new-poll-reveals-spanbergers-popularity-amid-backlash-gerrymandering""><strong>NEW POLL REVEALS SPANBGERGER’S POPULARITY IS PLUMMETING AMID BACKLASH OVER GERRYMANDERING</strong></a></p><p>DHS explained in a statement to Fox News Digital that it depends on partnerships to coordinate detention and removal of illegal aliens like Gomez, Muy and Jalloh.</p><p>""ICE can only detain illegals for the purpose of removal,"" a DHS spokesperson said when asked how the agency coordinates handovers of suspects.</p><p><i>Fox News' Peter Pinedo contributed to this report.</i></p>",https://www.foxnews.com/politics/spanberger-dodges-questions-whether-she-would-reverse-sanctuary-policy-dhs-turns-up-heat,2026-04-07
20,ICE nabs 5 illegal immigrants wanted for murder abroad in New England crackdown,"<p>Immigration and Customs Enforcement (ICE) Boston announced the arrests of <a href=""https://www.foxnews.com/category/us/immigration/illegal-immigrants"" rel=""noopener"" target=""_blank"">five illegal immigrants</a> over the past month who are wanted for murder and other violent crimes in their home countries, including several subjects of Interpol Red Notices.</p><p>The agency said in a series of <a href=""https://x.com/EROBoston/status/2041492701984551040"" rel=""noopener"" target=""_blank"">posts on X</a> that ‘‘each illegally entered the United States during the Biden administration's disastrous open border policy.’’</p><p>ICE said the migrants were apprehended in New England and are wanted overseas for serious violent offenses, including <a href=""https://www.foxnews.com/category/us/crime/homicide"" rel=""noopener"" target=""_blank"">homicide and attempted homicide</a>.</p><p>‘‘ERO Boston has always been—and will continue to be—strongly committed to targeted enforcement actions against the most dangerous criminal aliens, ensuring the safety and security of our New England communities,’’ ICE Boston said.</p><p><a href=""https://www.foxnews.com/us/illegal-immigrant-accused-fatal-hit-run-killed-north-carolina-motorcyclist"" rel=""noopener"" target=""_blank""><strong>ILLEGAL IMMIGRANT ACCUSED OF FATAL HIT AND RUN THAT KILLED NORTH CAROLINA MOTORCYCLIST</strong></a></p><p>The arrests underscore ICE’s focus on detaining foreign nationals accused of serious crimes abroad and highlight ongoing concerns about public safety tied to illegal border crossings.</p><p>Officials identified the suspects as Magno Jose Dos Santos, who was arrested on March 22 in <a href=""https://www.foxnews.com/category/us/us-regions/northeast/massachusetts"" rel=""noopener"" target=""_blank"">Worcester, Massachusetts</a>, and is wanted in Brazil on charges of homicide and attempted homicide tied to a May 12, 2021, incident.</p><p><a href=""https://www.foxnews.com/politics/ice-seeking-detention-3-alleged-ms-13-members-accused-murdering-14-year-old-boy"" rel=""noopener"" target=""_blank""><strong>ICE SEEKING DETENTION OF 3 ALLEGED MS-13 MEMBERS ACCUSED OF MURDERING 14-YEAR-OLD BOY</strong></a></p><p>Bryan Rafael Gomez was arrested on April 4 in Worcester, Massachusetts, and is the subject of an Interpol Red Notice for homicide, wanted by authorities in the Dominican Republic. An Interpol Red Notice is an international request to locate and provisionally arrest a person pending extradition.</p><p>Altieris Chaves Paiva was arrested on April 5 in Falmouth, Massachusetts, and is also the subject of an Interpol Red Notice for homicide, wanted by authorities in Brazil.</p><p>Kele Cristian Alves-Pereira was arrested on March 13 in Everett, Massachusetts, and is wanted in Brazil for murder, with Interpol issuing a Red Notice for her arrest. She has a ‘‘777’’ tattoo on her neck and a teardrop tattoo beneath her eye, an image released by ICE shows.</p><p>Danny Granados-Garcia was arrested on March 10 in <a href=""https://www.foxnews.com/category/us/us-regions/northeast/connecticut"" rel=""noopener"" target=""_blank"">Waterbury, Connecticut</a>, and is a wanted fugitive in El Salvador, facing an arrest warrant issued Feb. 11, 2026, for aggravated homicide and alleged membership in a terrorist organization.</p>",https://www.foxnews.com/us/ice-nabs-5-illegal-immigrants-wanted-murder-abroad-new-england-crackdown,2026-04-07
21,Livvy Dunne says she auditioned for HBO's 'White Lotus' but got rejected for a role,"<p>Former <a href=""https://www.foxnews.com/category/sports/ncaa/lsu-tigers"" rel=""noopener"" target=""_blank"">LSU gymnast</a> and social media sensation Livvy Dunne claims she recently auditioned for the fourth season of the HBO drama ""The White Lotus.""</p><p>In an <a href=""https://www.youtube.com/watch?v=Q4E5N0ohkxI"" rel=""noopener nofollow"" target=""_blank"">interview with Boardroom</a> on Tuesday, Dunne claims her first audition for an acting role was for the HBO hit series, but she did not get the part.</p><p>""My first audition ever was in person for a big show. Am I allowed to even say? I don't know. I didn't get it, but it was for ‘White Lotus’ Season 4. So, that was my first audition ever,"" she said.</p><p><a href=""https://www.foxnews.com/sports"" rel=""noopener"" target=""_blank""><strong>CLICK HERE FOR MORE SPORTS COVERAGE ON FOXNEWS.COM</strong></a></p><p>Dunne admitted she felt ""nervous"" going into the audition.</p><p>""I was obviously a bit nervous at first. I was like, 'Oh man, like what if I forget the lines?'"" she added.</p><p>""I've done things way harder than this in my life. I flipped on a beam in front of 13,500 people. I can do this. It's different. I think I would have rather have done a back flip in front of the casting director. But I mean, I went there, I put it all out there. It was my first audition. I mean, like, I didn't know what to expect. And it was honestly really fun.""</p><p><a href=""https://www.foxnews.com/sports/livvy-dunne-celebrates-paul-skenes-cy-young-award-honor"" rel=""noopener"" target=""_blank""><strong><u>LIVVY DUNNE CELEBRATES PAUL SKENES' CY YOUNG AWARD HONOR</u></strong></a></p><p>Fox News Digital has reached out to HBO for comment.</p><p>Dunne, who has more than 7.9 million followers on TikTok and another 5.2 million on Instagram, has pushed back on being labeled an ""influencer"" since the end of her <a href=""https://www.foxnews.com/category/sports/ncaa"" rel=""noopener"" target=""_blank"">college gymnastics</a> career.</p><p><a href=""https://www.foxnews.com/sports/livvy-dunne-bristles-certain-title-she-focuses-post-gymnastics-career"" rel=""noopener"" target=""_blank"">Dunne bristled at the term</a> ""influencer"" during an interview with Maxim. She was then asked what she wanted to be referred to as.</p><p>""A former athlete, and honestly, right now: model,"" she said.</p><p>When she’s not working on her brand or the Livvy Fund, Dunne can be seen cheering on her boyfriend, Paul Skenes, as he pitches for the Pittsburgh Pirates.</p><p><i>Fox News Digital's Ryan Gaydos contributed to this report.</i></p><p><i><strong>Follow Fox News Digital’s</strong></i><a href=""https://twitter.com/FoxNewsSports_"" rel=""noopener"" target=""_blank""><i><strong><u> sports coverage on X</u></strong></i></a><i><strong>, and subscribe to</strong></i><a href=""https://www.foxnews.com/newsletters"" rel=""noopener"" target=""_blank""><i><strong><u> the Fox News Sports Huddle newsletter.</u></strong></i></a></p>",https://www.foxnews.com/sports/livvy-dunne-says-auditioned-hbos-white-lotus-got-rejected-role,2026-04-07
22,Second choke point crisis looms as Houthis threaten key Red Sea shipping lane,"<p><a href=""https://www.foxnews.com/category/world/conflicts/iran"" rel=""noopener"" target=""_blank"">Iran-backed Houthi forces</a> are raising the prospect of a second global shipping choke point in the Red Sea, threatening to deepen pressure on energy markets and global trade as the conflict with Iran intensifies.</p><p>The Houthis entered the conflict in early April with missile and drone strikes on Israel and have since warned they could target shipping in the Bab al-Mandeb — a narrow corridor linking the Red Sea to the Gulf of Aden — raising concerns the war could expand beyond the Strait of Hormuz and further disrupt global trade.</p><p>Analysts warn that if Houthi forces begin targeting vessels again, it could open a second maritime front in a conflict that has already choked off traffic through the Strait of Hormuz, adding pressure to global energy markets and supply chains.</p><p>The Bab al-Mandeb is one of the world’s most <a href=""https://www.foxnews.com/category/world/trade"" rel=""noopener"" target=""_blank"">critical shipping choke points</a>, handling roughly 12% of global seaborne oil trade and serving as a key gateway for cargo moving between Europe and Asia through the Suez Canal.</p><p><a href=""https://www.foxnews.com/world/trump-seeks-warships-from-other-countries-help-secure-strait-hormuz"" rel=""noopener"" target=""_blank""><strong>TRUMP SEEKS WARSHIPS FROM OTHER COUNTRIES TO HELP SECURE STRAIT OF HORMUZ</strong></a></p><p>The Houthis, formally known as Ansar Allah, are an Iran-backed armed group that controls much of northern Yemen and has been fighting a yearslong civil war against the country’s internationally recognized government.</p><p>Houthi leaders, in coordination with Iran, have framed the potential escalation as part of their response to U.S. and Israeli military operations against Iran and its allies, warning they could target shipping or restrict access to the Red Sea if the conflict intensifies.</p><p>Iranian official Aliakbar Velayati posted on X on Sunday: ""Today, the unified command of the Resistance front views Bab al-Mandeb as it does Hormuz. If the White House dares to repeat its foolish mistakes, it will soon realize that the flow of global energy and trade can be disrupted with a single move.""</p><p>The Red Sea has taken on added importance as the conflict disrupts shipping through the Strait of Hormuz, pushing more cargo and energy flows toward alternative routes. That shift has increased reliance on the Bab al-Mandeb — a choke point that handles roughly $1 trillion in goods annually — raising the stakes of any renewed disruption.</p><p>Traffic through the Bab al-Mandeb is already running well below normal levels after earlier Houthi attacks pushed major shipping lines to reroute vessels around Africa. Ship-tracking data shows daily transits have fallen to roughly half of typical levels, underscoring that the route is already under strain even before any renewed escalation.</p><p>""It’s less about what they can actually do and more about the threat,"" former Fifth Fleet commander Vice Adm. Kevin Donegan told Fox News Digital. ""Once that risk is there, shipping companies decide not to take it.""</p><p>Even limited attacks or threats can drive up insurance costs and push major carriers to reroute vessels around Africa, effectively reducing traffic through the strait without a formal blockade.</p><p>The U.S. launched a <a href=""https://www.foxnews.com/category/politics/defense"" rel=""noopener"" target=""_blank"">major air and naval campaign</a> in 2025 — known as Operation Rough Rider — to counter Houthi attacks on Red Sea shipping, after the group began targeting commercial vessels in opposition to Israel’s war in Gaza.</p><p>U.S. and allied forces carried out hundreds of strikes on missile launchers, drones, radar systems and other Houthi infrastructure across Yemen in an effort to restore freedom of navigation through the Red Sea.</p><p><a href=""https://www.foxnews.com/world/russia-china-veto-un-resolution-aimed-reopening-strait-hormuz-hours-trump-deadline"" rel=""noopener"" target=""_blank""><strong>RUSSIA, CHINA VETO UN RESOLUTION AIMED AT REOPENING STRAIT OF HORMUZ, HOURS BEFORE TRUMP DEADLINE</strong></a></p><p>The campaign degraded parts of the group’s capabilities but failed to fully eliminate the threat, as shipping companies continued to avoid the route due to ongoing security risks.</p><p>Both U.S. and regional experts say the Houthis lack the capability to fully shut down the Bab al-Mandeb, but retain the ability to harass vessels with missiles, drones and small boats — tactics that have previously disrupted shipping across the Red Sea.</p><p>The Houthis field a growing arsenal of ballistic and cruise missiles, anti-ship weapons and drones, much of it derived from Iranian designs. While Iran has long supplied key components through smuggling networks, the group has also developed the ability to assemble and produce weapons inside Yemen — though analysts say those supply lines may now be constrained by the broader conflict.</p><p>""They do have the ability to pester international maritime traffic,"" Middle East analyst Gregg Roman said, warning that broader attacks could trigger ""a severe international response"" from the U.S., Israel and Gulf allies.</p><p>So far, the Houthis have limited their involvement to strikes on Israel, avoiding the kind of sustained maritime attacks that disrupted global shipping in previous years — a sign analysts say reflects both strategic restraint and pressure from regional actors.</p><p>Officials and analysts say Iran could still encourage the group to escalate attacks on Red Sea shipping if the conflict deepens, positioning the Houthis as a secondary pressure point in the broader war.</p><p>That dynamic has raised concerns the conflict could evolve into a multi-chokepoint crisis, testing the ability of the U.S. and its allies to keep critical global trade routes open.</p><p>Beyond the immediate threat to shipping, Donegan warned that efforts by Iran or its proxies to influence who can safely transit key waterways could challenge long-standing norms of free passage — raising concerns about how similar tactics could play out in other global choke points.</p>",https://www.foxnews.com/politics/second-choke-point-crisis-looms-houthis-threaten-key-red-sea-shipping-lane,2026-04-07
