,title,text,link,publish_date
6,Iranian athletes respond to Trump's warning that 'a whole civilization will die tonight',"<p>President <a href=""https://www.foxnews.com/category/person/donald-trump"" rel=""noopener"" target=""_blank"">Donald Trump's</a> threat against Iran on Tuesday has prompted reactions from three Iranian athletes.</p><p>Trump wrote on Truth Social, <a href=""https://www.foxnews.com/media/trumps-whole-civilization-die-tonight-iran-threat-polarizes-social-media"" rel=""noopener"" target=""_blank"">""A whole civilization will die tonight</a>, never to be brought back again"" in reference to Iran amid his threats to target the nation's power plants and bridges.</p><p>Former Iranian youth wrestling champion Sardar Pashaei, who now lives in the U.S., responded to Trump's threat in a statement to Fox News Digital.</p><p>""The Iranian regime still has a chance—and all the means necessary—to stop sacrificing its own people and bring an end to this 47-year catastrophe. It has had many opportunities in the past. Instead, it chose repression at home and conflict abroad. Today, the regime is effectively holding the Iranian people hostage, placing civilians in danger while claiming to act in their interest,"" Pashaei said.</p><p><a href=""https://www.foxnews.com/sports"" rel=""noopener"" target=""_blank""><strong>CLICK HERE FOR MORE SPORTS COVERAGE ON FOXNEWS.COM</strong></a></p><p>""For decades, it has destroyed Iran’s natural resources, built tunnels deep into mountains for missiles, and spent the country’s wealth on drones and war—not on the wellbeing of its people. Above all, we must be clear: the Iranian people must never be the target of pressure or punishment. They have already suffered for decades under this regime.</p><p>""Responsibility for this crisis lies with the clerical establishment and the IRGC. For decades, chants of 'Death to America' and 'Death to Israel' have been driven by the regime—not by the Iranian people, who have instead sought dignity, opportunity, and a normal life, yet have never been given a real choice through free and fair elections. The regime has already lost—both at home and on the global stage. The only remaining question is how much more suffering it will impose before it finally steps aside.""</p><p><a href=""https://www.foxnews.com/politics/trump-reveals-iran-made-significant-proposal-ultimatum-not-good-enough"" rel=""noopener"" target=""_blank""><strong>TRUMP REVEALS IRAN MADE 'SIGNIFICANT PROPOSAL' AFTER ULTIMATUM, BUT 'NOT GOOD ENOUGH'</strong></a></p><p>Iranian competition climber Elnaz Rakabi, who won bronze at the 2021 IFSC Climbing World Championship, shared a different perspective in a statement provided to Fox News Digital.</p><p>""As an Iranian athlete, I cannot stay silent when language is used that speaks of the destruction of a nation as if millions of innocent lives are disposable. Any statement that suggests the collapse or destruction of Iran without recognizing the human cost is deeply dangerous. Iran is not just a regime. Iran is a people, a history, a civilization, and millions of human beings who have already endured decades of repression, fear, and suffering,"" Rakabi said.</p><p>""At the same time, the world must not ignore the truth that the Islamic Republic has spent decades oppressing its own people, crushing peaceful protests, and investing the country’s wealth in ideology, militarization, and nuclear ambition instead of the wellbeing of its citizens.</p><p>""The people of Iran have repeatedly gone into the streets to demand freedom, dignity, justice, and the right to live a normal life, only to be met with bullets, prisons, executions, and fear. The Iranian people are not asking for violence. They are not asking for war. They are asking to be heard. They are asking for their country’s resources to be spent on life, not destruction. They are asking for peace, dignity, and the right to determine their own future.</p><p>""That is why the destruction of a nation can never be the answer. The people of Iran are not collateral damage. They are not bargaining chips in political rhetoric or international conflict. They are human beings. A peaceful and democratic change in Iran would not only serve the Iranian people, but also the cause of human rights, regional stability, and global peace. So I ask: Is it really so difficult for those in power to choose peace over ideology, human dignity over political interest, and innocent lives over yet another cycle of violence?""</p><p>Trump has given Iran until 8 p.m. ET Tuesday to reopen the Strait of Hormuz or face strikes against its power plants and bridges. Amir-Saeid Iravani, Iran's permanent representative to the United Nations has responded, rejecting a temporary ceasefire proposal and vowing ""reciprocal measures.""</p><p>""Iran will not stand idle in the face of such egregious war crimes,"" Iravani said. ""It will exercise without hesitation its inherent right of self-defense, and will take immediate and proportionate reciprocal measures.""</p><p>Afsoon Roshanzamir Johnston, an Iranian women's wrestler who competed for the U.S. and won a silver medal in the 1990 freestyle wrestling championships, later serving as a coach for Team USA at the 2016 Rio Olympics, said her ""heart is heavy"" after Trump's threat. </p><p>""My heart is heavy for the beautiful people of Iran. Having fled my homeland as a child of war, I know the brave people of Iran have endured decades of corruption and oppression under the Islamic regime. War is complicated, but I hope for a regime change, not the destruction of the beautiful Persian civilization and heritage,"" she said. </p><p>Iran has reportedly threatened to target energy facilities in <a href=""https://www.foxnews.com/category/world/world-regions/saudi-arabia"" rel=""noopener"" target=""_blank"">Saudi Arabia</a> and the United Arab Emirates.</p><p>Tehran will add Saudi Aramco oil facilities, as well as Yanbu and the UAE’s Fujairah pipeline, to its target list should Trump follow through with his threats to attack Iran's energy infrastructure, Iran International reported.</p><p>The threats from Iran were first reported by the IRGC-affiliated Tasnim news agency, citing a military source.</p><p><i>Fox News Digital's Louis Casiano contributed to this report.</i></p><p><i><strong>Follow Fox News Digital’s</strong></i><a href=""https://twitter.com/FoxNewsSports_"" rel=""noopener"" target=""_blank""><i><strong><u> sports coverage on X</u></strong></i></a><i><strong>, and subscribe to</strong></i><a href=""https://www.foxnews.com/newsletters"" rel=""noopener"" target=""_blank""><i><strong><u> the Fox News Sports Huddle newsletter.</u></strong></i></a></p>",https://www.foxnews.com/sports/iranian-athletes-respond-trumps-warning-whole-civilization-die-tonight,2026-04-07
7,"Former Prince Andrew refuses to leave temporary home, demands upgrades meet ‘royal standards’: expert","<p>Andrew Mountbatten-Windsor is reportedly in no rush to leave his temporary home, deepening frustrations for his brother, King Charles III.</p><p><a href=""https://www.thesun.co.uk/royals/38734431/edward-sophie-holiday-let-andrew-sandringham-farm/"" rel=""nofollow noopener"" target=""_blank"">The Sun</a> reported that their younger brother, Prince Edward, paid Andrew a visit for a ""quiet word,"" urging him to speed up his move over concerns he is ""deliberately dragging his heels.""</p><p>Fox News Digital reached out to Buckingham Palace for comment. A spokesperson for the palace previously told Fox News Digital it does not speak for Andrew, 66, because he is no longer a working royal.</p><p><a href=""https://www.foxnews.com/entertainment/former-prince-andrews-daughters-torn-between-loyalty-legacy-after-fathers-birthday-arrest-experts"" rel=""noopener"" target=""_blank""><strong>FORMER PRINCE ANDREW’S DAUGHTERS TORN BETWEEN LOYALTY AND LEGACY AFTER FATHER’S BIRTHDAY ARREST: EXPERTS</strong></a></p><p>""There is some dismay from King Charles that Andrew refuses to move to Marsh Farm, his final destination, until all the <a href=""https://www.foxnews.com/category/home-improvement"" rel=""noopener"" target=""_blank"">extensive renovations</a> have been completed to his satisfaction,"" royal broadcaster Ian Pelham Turner claimed to Fox News Digital.</p><p>""The king likes to use Wood Farm, where Andrew is currently staying, as a home for guests visiting Sandringham,"" Turner said.</p><p>""Prince Edward has been tasked with spending more time with his brother Andrew in an attempt to persuade him to move into Marsh Farm, as renovations are well ahead. But Andrew, who many see as the epitome of pomposity, refuses until it meets his personal royal standards.""</p><p><strong>WATCH: PRINCE WILLIAM SAW FORMER PRINCE ANDREW AS ENTITLED, URGED EXILE: AUTHOR</strong></p><p>The outlet reported that Edward and his wife, Sophie, Duchess of Edinburgh, wanted to stay at Wood Farm over the Easter holiday. However, they were unable to because of <a href=""https://www.foxnews.com/category/person/prince-andrew"" rel=""noopener"" target=""_blank"">Andrew’s presence</a>. Edward and Sophie ended up staying in the estate’s Gardens House, the former residence of the head gardener.</p><p>Over the last couple of weeks, hundreds of boxes with Andrew’s belongings have been delivered, the outlet reported. Many of them have ""HRH"" (His Royal Highness) written on the side. Andrew was expected to move into Marsh Farm by Easter.</p><p>""There is a veiled threat from Charles,"" Turner claimed. ""If Andrew does not move out of Wood Farm soon, he will turf his erstwhile brother and put him in a caravan.""</p><p>In October, the former royal was ordered to surrender his home, Royal Lodge, a 30-room mansion. That month, the king, 77, stripped his brother of his royal titles over renewed scrutiny of Andrew’s ties to late convicted sex offender <a href=""https://www.foxnews.com/category/person/jeffrey-epstein"" rel=""noopener"" target=""_blank"">Jeffrey Epstein</a>.</p><p>Andrew relocated to Wood Farm, where their father, Prince Philip, lived following his retirement from royal life in 2017 until his death in 2021. Marsh Farm is a few miles from Sandringham House, one of the king’s private residences.</p><p>On Feb. 19 — Andrew’s birthday — he was arrested at Wood Farm on suspicion of misconduct in public office. Authorities are investigating an allegation that Andrew shared confidential information with Epstein while he was Britain’s special envoy for international trade. After spending about 11 hours in custody, Andrew was released under investigation, meaning he has neither been charged nor exonerated.</p><p><a href=""https://www.foxnews.com/newsletters"" rel=""noopener"" target=""_blank""><strong><u>CLICK HERE TO SIGN UP FOR THE ENTERTAINMENT NEWSLETTER</u></strong></a></p><p>Correspondence between the two men was previously released by the U.S. Justice Department, along with millions of pages of documents from the American investigation into Epstein.</p><p>The <a href=""https://www.foxnews.com/category/world/scandals"" rel=""noopener"" target=""_blank"">allegations being investigated</a> are separate from those made by Virginia Roberts Giuffre, an American woman who claimed she was trafficked to Britain to have sex with the ex-prince three times, including in 2001, when she was 17 years old. Giuffre died by suicide in 2025 at age 41.</p><p>Andrew’s ex-wife, Sarah Ferguson, was forced out of Royal Lodge after his titles were stripped. While the 66-year-old has sparked scrutiny over her relationship with Epstein, she has not been accused of any wrongdoing.</p><p>Russell Myers, royal editor of the Daily Mirror and author of the new book, ""<a href=""https://www.amazon.com/William-Catherine-Monarchys-Inside-Story/dp/B0FPXNP2WN/ref=tmm_hrd_swatch_0"" rel=""nofollow noopener"" target=""_blank"">William and Catherine</a>,"" recently told Fox News Digital that <a href=""https://www.foxnews.com/category/world/personalities/will"" rel=""noopener"" target=""_blank"">Prince William</a> reportedly had a few choice words about his uncle. He noted that palace aides had sounded the alarm about Andrew’s behavior before his relationship with Epstein came to light.</p><p>""It was very clear to me, made by several people I’d spoken to for the book, how William thought his uncle was always a bit of an ignoramus,"" said Myers.</p><p>""He had a real issue with the way that Andrew treated his staff,"" he shared. ""He didn’t like his attitude of entitlement and privilege. This is very alien to both William and Catherine.""</p><p><a href=""https://www.foxnews.com/entertainment"" rel=""noopener"" target=""_blank""><strong><u>LIKE WHAT YOU’RE READING? CLICK HERE FOR MORE ENTERTAINMENT NEWS</u></strong></a></p><p>""They are very centered on producing really sound and enjoyable working environments for the people who are employed by them. They’re very respectful of the people that they work with.""</p><p>Myers noted that tensions between William and Charles intensified after Andrew gave a bombshell interview to the BBC in 2019, when he attempted to explain his friendship with Epstein.</p><p>""After that disastrous 2019 interview Andrew gave to the BBC’s ‘Newsnight,’ in which he failed to apologize for his relationship with Jeffrey Epstein, … William had the foresight to say, ‘This man must not have any place within the institution, any place within the family. He must be banished because he got himself into this mess, and he must be banished before the rot sets in.’""</p><p>""That’s what he told the late queen and his father at the time,"" Myers claimed.</p><p>""... [Andrew] failed to apologize for his relationship with Jeffrey Epstein. He failed to acknowledge the real impact on Jeffrey Epstein’s victims and really gave a very bad account of himself. ... I think it was six years later before King Charles finally took that action of stripping his title, stripping his honors and exiling him from public life.""</p><p>""I think if William had had his way, then certainly the royal family would've been able to be on the front foot many years ago,"" Myers added.</p><p>Fox News Digital reached out to Kensington Palace for comment. A spokesperson for Buckingham Palace previously told Fox News Digital, ""<a href=""https://www.foxnews.com/category/entertainment/genres/books"" rel=""noopener"" target=""_blank"">We don't comment on such books</a>.""</p>",https://www.foxnews.com/entertainment/former-prince-andrew-refuses-leave-temporary-home-demands-upgrades-meet-royal-standards-expert,2026-04-07
8,Drug-soaked paper is killing inmates amid reports of prison smuggling trends,"<p>A dangerous drug smuggling trend has been reported among U.S. jails and prisons, highlighting a growing health risk.</p><p><a href=""https://www.foxnews.com/category/health/mental-health/drug-and-substance-abuse"" rel=""noopener"" target=""_blank"">Synthetic cannabinoids</a> have been increasingly detected in fatal overdoses among incarcerated individuals, according to a recent alert from The Center for Forensic Science Research &amp; Education (CFSRE).</p><p>These man-made psychoactive substances are designed to mimic the effects of THC, the primary active component of cannabis.</p><p><a href=""https://www.foxnews.com/health/fatal-drug-combination-sparks-alert-rhino-tranq-spreads-across-us"" rel=""noopener"" target=""_blank""><strong>FATAL DRUG COMBINATION SPARKS ALERT AS 'RHINO TRANQ’ SPREADS ACROSS US</strong></a></p><p>Reports have also revealed that <a href=""https://www.foxnews.com/category/us/crime/drugs"" rel=""noopener"" target=""_blank"">synthetic cannabinoids</a> are increasingly being smuggled into correctional facilities on common paper items, such as letters, greeting cards, books, postcards and magazines.</p><p>The CFSRE has previously warned of ""drug-soaked paper strips"" causing overdoses among incarcerated individuals.</p><p>In many cases, the papers are laced with a ""potpourri"" of synthetic cannabinoids mixed with other <a href=""https://www.foxnews.com/category/health/mental-health/addiction"" rel=""noopener"" target=""_blank"">dangerous drugs</a>, officials noted.</p><p>""While it’s impossible to know exactly why people are cooking up these combinations, I suspect they are simply ordering these substances from China or India and mixing them with very little understanding of how different substances interact or what constitutes a lethal dose,"" Alex Krotulski, director of toxicology and chemistry for the CFSRE, told a local outlet.</p><p><a href=""https://www.foxnews.com/health/gas-station-heroin-banned-another-state-amid-nationwide-crackdowns"" rel=""noopener noreferrer nofollow"" target=""_blank""><strong><u>'GAS STATION HEROIN' BANNED IN ANOTHER STATE AMID NATIONWIDE CRACKDOWNS</u></strong></a></p><p>In a December 2024 study, the CFSRE found that the paper strips it examined primarily contained ""synthetic cannabinoid receptor agonists, nitazene opioids, and other novel psychoactive substances.""</p><p>The drug-laced papers have been found to cause ""severe health outcomes,"" including <a href=""https://www.foxnews.com/category/health/nervous-system-health"" rel=""noopener"" target=""_blank"">central nervous system</a> depression (slowed brain activity) and bradycardia (slowed heart rate), the agency stated.</p><p>Cook County Jail in Chicago, which houses nearly 5,000 detainees, has reported increasing cases of smugglers soaking paper with synthetic drugs and sending them into the jail through mail or visitors.</p><p>In 2023, the jail’s administration confirmed 18 total deaths of prisoners in custody. Five of those were caused by overdose, with three involving <a href=""https://www.foxnews.com/category/topic/opioid-crisis"" rel=""noopener"" target=""_blank"">synthetic cannabinoids</a>, according to Cook County Medical Examiner records.</p><p>""I cannot stress how serious this is,"" Dr. Priscilla Ware, who oversees Cook County Correctional Health and is medical director of Cermak Health Services, told a local outlet in November 2023. ""People are dying from this product every single day when they use it.""</p><p>To address the growing trend of soaking paper with cannabinoids, the jail’s administrators reportedly implemented a ban on paper in April 2023.</p><p>In 2024, Cook County Sheriff Tom Dart told a local outlet that while <a href=""https://www.foxnews.com/health"" rel=""noopener"" target=""_blank"">overdose deaths</a> were lower that year, drug-soaked paper smuggling continues to be an issue.</p><p><a href=""https://www.foxnews.com/health"" rel=""noopener"" target=""_blank""><strong>CLICK HERE FOR MORE HEALTH STORIES</strong></a></p><p>""Unfortunately, it has been common to see test results for drug-soaked paper come back with two or three dangerous drugs, and we know that the people who produce this paper often included toxic chemicals, such as insecticides and rat poison, in their ‘recipes,’"" Dart told the outlet. </p><p>""That was alarming enough. But to see these results come back with a half dozen or more dangerous synthetic drugs – any one of which could be fatal on its own – is terrifying.""</p><p>In July 2024, Cook County reportedly seized three pieces of paper that were suspected to be <a href=""https://www.foxnews.com/category/us/crime/drugs"" rel=""noopener"" target=""_blank"">laced with drugs</a>. Testing by CFSRE found that the papers contained up to 10 separate dangerous synthetic drugs, including protonitazene (a synthetic opioid up to three times more powerful than fentanyl) and xylazine (a powerful animal sedative known as ""tranq"" or ""zombie drug"").</p><p><a href=""https://www.foxnews.com/newsletters?cmpid=fnfirstnl"" rel=""noopener"" target=""_blank""><strong>CLICK HERE TO SIGN UP FOR OUR HEALTH NEWSLETTER</strong></a></p><p>Cook County noted in an August 2024 press release that drug-laced papers have been known to sell for $10,000 per page.</p><p>The issue appears to extend beyond Chicago, as The New York Times has reported that at least 16 states have prosecuted people for smuggling drug-laced papers into jails and prisons.</p><p>""Drug‑soaked paper allows extremely powerful substances — <a href=""https://www.foxnews.com/category/health/cannabis"" rel=""noopener"" target=""_blank"">synthetic cannabinoids</a>, opioids and other novel compounds — to be delivered invisibly, without smell or obvious residue, making detection difficult in many environments,"" Dr. Adam Scioli, chief medical officer of Caron Treatment Centers in Pennsylvania, told Fox News Digital.</p><p>Scioli said the ""drug‑impregnated paper"" should not be viewed as a problem limited to prisons. </p><p>""It represents a broader and very troubling shift in how highly potent synthetic drugs are being distributed, concealed and consumed across multiple settings,"" he said. ""The same delivery method can easily affect schools, mail rooms, shelters, <a href=""https://www.foxnews.com/category/health/health-care"" rel=""noopener"" target=""_blank"">treatment centers</a> and private homes — any place where paper moves freely and inspection is limited.""</p><p>The fact that paper can be handled or shared unintentionally raises the risk not only of overdose, but of accidental exposure to staff, family members or bystanders, Scioli cautioned.</p><p>To reduce accidental exposure and to protect both the public and frontline workers, Scioli calls for early detection and screening tools.</p><p>""Expanding access to evidence‑based addiction treatment, including medications for opioid and <a href=""https://www.foxnews.com/category/beer"" rel=""noopener"" target=""_blank"">alcohol use disorder</a>, directly lowers demand for illicit and high‑risk substances,"" he added.</p><p><a href=""https://www.foxnews.com/category/lifestyle/quizzes"" rel=""noopener"" target=""_blank""><strong>TEST YOURSELF WITH OUR LATEST LIFESTYLE QUIZ</strong></a></p><p>""A coordinated response that includes healthcare, public safety, mail systems and community education is essential — this cannot be solved by enforcement alone.""</p><p>Fox News Digital reached out to Cook County Jail requesting comment.</p>",https://www.foxnews.com/health/drug-soaked-paper-killing-inmates-amid-reports-prison-smuggling-trends,2026-04-07
