,title,text,link,publish_date
17,Dangerous water warnings hit trendy vacation spot after powerful storm pounds area,"<p>Hawaii health officials have issued multiple brown water advisories across the islands as the state deals with the aftermath of a Kona Low storm.</p><p>The storm moved <a href=""https://www.foxnews.com/category/travel/vacation-destinations"" rel=""noopener"" target=""_blank"">through the islands</a> earlier last week, bringing heavy rainfall and runoff that has kept coastal waters contaminated in several areas, the Hawaii Department of Health Clean Water Branch said. </p><p>Officials say the advisories are layered on top of lingering impacts from an already wet March.</p><p><a href=""https://www.foxnews.com/travel/coast-guard-rescues-family-stranded-days-pacific-boat-engine-sets-them-adrift"" rel=""noopener"" target=""_blank""><strong>COAST GUARD RESCUES STRANDED FAMILY FOR DAYS IN PACIFIC AFTER BOAT FAILURE SETS THEM ADRIFT</strong></a></p><p>This was the third Kona Low storm in a month, <a href=""https://foxweather.com/weather-news/hawaii-braces-flash-flooding-third-kona-low-month-begins-soak-islands-torrential-rains"" rel=""nofollow noopener"" target=""_blank"">Fox Weather</a> reported.</p><p>Advisories remain in place across several islands, including an island-wide <a href=""https://www.foxnews.com/category/us/us-regions/west/hawaii"" rel=""noopener"" target=""_blank"">warning on Kaua‘i</a> and multiple affected areas on O‘ahu, Maui and the Big Island, the department says.</p><p>The warnings come as visitors continue to arrive in Hawaii during the spring travel season, when <a href=""https://www.foxnews.com/category/travel/general/beach"" rel=""noopener"" target=""_blank"">beaches are a major draw</a> for tourists.</p><p>Health officials warn that brown water conditions can pose serious risks to swimmers and surfers.</p><p><a href=""https://https://www.foxnews.com/travel/famous-volcano-blasts-lava-1000-feet-high-triggering-emergency-closures-national-park"" rel=""noopener"" target=""_blank""><strong>FAMOUS VOLCANO BLASTS LAVA 1,000 FEET HIGH, TRIGGERING EMERGENCY CLOSURES AT NATIONAL PARK</strong></a></p><p>""If the water is brown, turn around,"" the department said.</p><p>Runoff from heavy rain can carry sewage, pesticides and animal waste <a href=""https://www.foxnews.com/category/science/planet-earth/oceans"" rel=""noopener"" target=""_blank"">into the ocean</a>, increasing the risk of exposure to bacteria such as E. coli and salmonella.</p><p>Storm conditions can also wash debris into coastal waters, while murky conditions may attract marine life, including sharks.</p><p><a href=""https://www.foxnews.com/newsletters?cmpid=fnfirstnl"" rel=""noopener"" target=""_blank""><strong><u>CLICK HERE TO SIGN UP FOR OUR LIFESTYLE NEWSLETTER</u></strong></a></p><p>Officials recommend staying out of the ocean for at least 48 to 72 hours after rainfall ends, though that timeline may be extended due to continued unsettled weather and saturated ground conditions.</p><p>With recent heavy rainfall, conditions may remain unsafe as runoff continues to affect coastal waters, according to Fox Weather.</p><p>Authorities advise avoiding the water if it appears brown or murky, even if advisories are lifted.</p><p>Officials say travelers should monitor local updates, as advisories are lifted on a beach-by-beach basis once water quality improves.</p><p><a href=""https://www.foxnews.com/lifestyle"" rel=""noopener"" target=""_blank""><strong><u>CLICK HERE FOR MORE LIFESTYLE STORIES</u></strong></a></p><p>The advisories come as Hawaii recovers from severe flooding caused by back-to-back Kona Low storm systems that drenched the state in recent weeks. The storms triggered evacuations across parts of O‘ahu, where residents were forced from their homes amid rising floodwaters.</p><p><a href=""https://www.foxnews.com/category/travel/general/resorts"" rel=""noopener"" target=""_blank"">Some travelers</a> expressed frustration on social media over the advisories, particularly those visiting affected areas during their trips.</p><p>""We are staying in Kīhei, a little bummed,"" one user wrote on Reddit. ""I hope the storm passes quickly.""</p><p><a href=""https://www.foxnews.com/category/lifestyle/quizzes"" rel=""noopener"" target=""_blank""><strong><u>TEST YOURSELF WITH OUR LATEST LIFESTYLE QUIZ</u></strong></a></p><p>Others turned to locals for guidance, asking whether it was safe to enter the water under current conditions.</p><p>Many residents strongly advised against it, warning the risks can be serious even if conditions appear calm.</p><p>""Local, and I am absolutely not going in the water,"" one user wrote.</p><p>""<a href=""https://www.foxnews.com/category/health"" rel=""noopener"" target=""_blank"">Never swim in storm water</a>,"" another added.</p>",https://www.foxnews.com/travel/dangerous-water-warnings-hit-trendy-vacation-spot-after-powerful-storm-pounds-area,2026-04-14
18,Marvel star Vincent D’Onofrio says he ‘can’t do’ Kingpin transformation anymore,"<p>Vincent D'Onofrio's body went through a lot in order for him to play an iconic comic book villain.</p><p>During a recent appearance on the ""<a href=""https://www.youtube.com/watch?v=ZDTqvLem5Dc"" rel=""nofollow noopener"" target=""_blank"">Inside of You with Michael Rosenbaum</a>"" podcast, the 66-year-old actor discussed his time playing Kingpin in a few Marvel television shows.</p><p>""One thing is that I don’t have to have the weight on for the Marvel role anymore, which is a big deal, just for health reasons and stuff,"" he said. ""Taking it on, putting it back on and blah, blah, blah. It’s just, I can’t do that kind of stuff anymore. So yeah, it’s easier to stay fit now that I can wear this like, big fat suit, muscle suit thingy.""</p><p>When it comes to the suit, D'Onofrio explained that ""it's more than heavy, it's hot and tight,"" and covers his entire body, going down to his ankles and wrists.</p><p><a href=""https://www.foxnews.com/entertainment/jennifer-lopez-reflects-life-changing-divorce-from-ben-affleck-her-path-forward"" rel=""noopener"" target=""_blank""><strong>JENNIFER LOPEZ REFLECTS ON LIFE-CHANGING DIVORCE FROM BEN AFFLECK AND HER PATH FORWARD</strong></a></p><p>The actor first played the role <a href=""https://www.foxnews.com/category/organization/netflix"" rel=""noopener"" target=""_blank"">in the Netflix series</a>, ""Daredevil,"" from 2015 to 2018, later reprising the role in a couple of episodes of ""Hawkeye,"" and again in the 2023 miniseries, ""Echo."" Most recently, D'Onofrio played the role in two seasons of ""Daredevil: Born Again.""</p><p>Kingpin, also known by his real name, Wilson Fisk, is a powerful crime boss in Marvel's version of New York City. In the new Daredevil series, the character is trying to legitimize himself by running for mayor of New York City.</p><p>""He's a very manipulative person, Wilson Fisk. He's sort of a genius at manipulating, and he's a incredible, you might say, chess player when it comes to life. And he's also a monster. And he's also a big baby,"" D'Onofrio told <a href=""https://www.youtube.com/watch?v=5SNEcTp4j6Q"" rel=""noopener nofollow"" target=""_blank"">GQ</a> in April. ""He's an interesting character to play. That's why it's still fun to play him.""</p><p>D'Onofrio stars in the show alongside Charlie Cox, with both of them reprising the roles they played in the 2015 Netflix series.</p><p><a href=""https://www.foxnews.com/newsletters?cmpid=fnfirstnl"" rel=""noopener"" target=""_blank""><strong>CLICK HERE TO SIGN UP FOR THE ENTERTAINMENT NEWSLETTER</strong></a></p><p>The second season of the show promises a big blow up fight scene between Kingpin and Daredevil, with D'Onofrio calling the scene ""very reminiscent of the original series on Netflix.""</p><p>'ll speak for myself: I love those scenes. We hardly ever get to do scenes together, [Cox] and I, and he's just become so good at playing this character that it's a thrill to join him in scenes,"" he told <a href=""https://ew.com/vincent-donofrio-daredevil-born-again-season-2-interview-matthew-lillard-reunion-11940378"" rel=""nofollow noopener"" target=""_blank"">Entertainment Weekly</a> in April. ""Charlie and I have been doing these characters for a long time now, and the fact that we both still get excited, it says something about our love for these characters and getting them right for the show.""</p><p>Prior to the 2015 Netflix show, <a href=""https://www.foxnews.com/category/person/ben-affleck"" rel=""noopener"" target=""_blank"">Ben Affleck</a> starred as the titular character in the 2003 movie, ""Daredevil,"" which also starred his future wife, Jennifer Garner, as Elektra.</p><p>The former couple first met while filming ""Pearl Harbor"" in 2000 while both of them were in other relationships, reconnecting when they were both single while filming ""Daredevil.""</p><p><a href=""https://www.foxnews.com/entertainment"" rel=""noopener"" target=""_blank""><strong>LIKE WHAT YOU’RE READING? CLICK HERE FOR MORE ENTERTAINMENT NEWS</strong></a></p><p>After reconnecting on set, Affleck and Garner got married in June 2005 and welcomed three children over the course of their marriage. The two were married for 10 years before getting a <a href=""https://www.foxnews.com/category/entertainment/events/divorce"" rel=""noopener"" target=""_blank"">divorce in 2015</a>.</p><p>""I’m really lucky that I have a really good co-parent and partner in Jennifer Garner, the kids’ mom, who’s wonderful and great and we work together well,"" Affleck told <a href=""https://www.gq.com/story/inside-ben-afflecks-plan-to-remake-hollywood"" rel=""nofollow noopener"" target=""_blank"">GQ</a> in March 2025.</p>",https://www.foxnews.com/entertainment/marvel-star-vincent-donofrio-says-he-cant-do-kingpin-transformation-anymore,2026-04-14
19,Ruby Rose says she filed a police report against Katy Perry over alleged sexual assault two decades ago,"<p>Ruby Rose finalized a police report against <a href=""https://www.foxnews.com/category/person/katy-perry"" rel=""noopener"" target=""_blank"">Katy Perry</a> stemming from an alleged sexual assault which occurred more than two decades ago.</p><p>Rose, 40, publicly made the claims against the ""Firework"" singer over the weekend in response to a Perry clip fawning over Justin Bieber's Coachella performance.</p><p>""As of this afternoon, I have finalized all of my reports,"" Rose wrote on Threads. ""This means I am no longer able to comment, repost, or talk publicly about any of those cases, or the individuals involved.""</p><p><a href=""https://https://www.foxnews.com/entertainment/katy-perry-fights-back-ruby-roses-categorically-false-sexual-assault-allegations"" rel=""noopener"" target=""_blank""><strong>KATY PERRY FIGHTS BACK AGAINST RUBY ROSE'S 'CATEGORICALLY FALSE' SEXUAL ASSAULT ALLEGATIONS</strong></a></p><p>""It's going to look like I am ignoring everything from supportive messages, to other people's experiences, but I'm not,"" the ""Orange is the New Black"" actress said.</p><p>""This is a <a href=""https://www.foxnews.com/category/us/crime/police-and-law-enforcement"" rel=""noopener"" target=""_blank"">standard request from the police</a> and in many ways, quite the relief.""</p><p>She added, ""I can start the healing process now. And temporary move forward. I love you all so much.""</p><p><a href=""https://www.foxnews.com/entertainment/ruby-rose-fired-workplace-behavior-batwoman"" rel=""noopener"" target=""_blank""><strong>RUBY ROSE WAS FIRED FROM 'BATWOMAN' BECAUSE OF 'MULTIPLE COMPLAINTS ABOUT WORKPLACE BEHAVIOR,' WBTV SAYS</strong></a></p><p>The ""Wide Awake"" singer appeared to send a message Tuesday on Instagram stories, and shared a clip of her song, ""By the Grace of God,"" with the message, ""I love you.""</p><p>Lyrics to the hit from her 2013 ""Prism"" album include, ""It was not about me / Now I have to rise above / Let the universe call the bluff / Yeah the truth will set you free.""</p><p>Over the weekend, the Australian actress accused Perry of sexual assault, claims which the ""Dark Horse"" singer strongly denied.</p><p>""Katy Perry sexual assaulted me at spice market nightclub in Melbourne. Who gives a s--- what she thinks,"" <a href=""https://www.threads.com/@rubyrose/post/DXDLHt5E4wv?hl=en"" rel=""nofollow noopener"" target=""_blank""><u>she wrote</u></a> on Threads.</p><p>After a user asked her to expand on the claim, Rose wrote: ""After it I threw up on her. I told the story publicly but changed it to be a ‘funny little drunk story’ because I didn’t know how else to handle it.</p><p>""Later she agreed to help me get my US visa. So I kept it a secret. But I DID tell yall she wasn’t a good person. Instead I got attacked by... everyone.""</p><p><a href=""https://www.foxnews.com/entertainment"" rel=""noopener"" target=""_blank""><strong>LIKE WHAT YOU’RE READING? CLICK HERE FOR MORE ENTERTAINMENT NEWS</strong></a></p><p>A representative for Perry immediately shut down the ""categorically false"" claims.</p><p>""The allegations being circulated on social media by Ruby Rose about Katy Perry are not only categorically false, they are dangerous, reckless lies,"" <a href=""https://www.foxnews.com/category/entertainment/events/scandal"" rel=""noopener"" target=""_blank""><u>a representative for Perry</u></a> told Fox News Digital in a statement. </p><p>""Ms. Rose has a well-documented history of making serious public allegations on social media against various individuals, claims that have repeatedly been denied by those named.""</p><p><a href=""https://www.foxnews.com/newsletters?cmpid=fnfirstnl"" rel=""noopener"" target=""_blank""><strong>CLICK HERE TO SIGN UP FOR THE ENTERTAINMENT NEWSLETTER</strong></a></p><p>In another post, Rose said it had taken her almost 20 years to <a href=""https://www.foxnews.com/category/us/crime/sex-crimes"" rel=""noopener"" target=""_blank""><u>come forward with the claims</u></a>.</p><p>""I was only in my early 20s. I’m now 40. It has taken almost 2 decades to say this publicly,"" she wrote. ""Though I am so grateful to have made it long enough to find my voice, it just shows how much of an impact trauma and sexual assault takes. Thank you for seeing me.""</p><p>Rose also went on to detail the alleged incident and wrote that ""as a woman, for a myriad of reasons, opening up about W on W [women-on-women] violence and sexual abuse, seems to be 100 times harder than speaking about the male predators, at least for me.""</p><p>While Rose initially claimed she's not interested in filing a report, she welcomed legal action from Perry.</p><p>""[Katy] is more than welcome to sue me (she won’t, because it happened, I have photos and it was literally in public and witnessed by multiple people). Plus there is so much more that happened in the years leading up to her silly song she won’t want me discussing. The psychological manipulation was strong with that one,"" she wrote.</p>",https://www.foxnews.com/entertainment/ruby-rose-says-she-filed-police-report-against-katy-perry-over-alleged-sexual-assault-two-decades-ago,2026-04-14
20,Orioles' Craig Albernaz says he must eat baby food for weeks after foul ball to face leads to 7 fractures,"<p><a href=""https://www.foxnews.com/category/sports/mlb/baltimore-orioles"" rel=""noopener"" target=""_blank"">Baltimore Orioles</a> manager Craig Albernaz has seven fractures in his orbital area as well as a broken jaw after taking a foul ball to the face, but he remains in the dugout with his squad.</p><p>However, Albernaz has one big change to his daily routine over the next month or so. He needs to eat baby food.</p><p>The injury occurred on Monday night against the <a href=""https://www.foxnews.com/category/sports/mlb/arizona-diamondbacks"" rel=""noopener"" target=""_blank"">Arizona Diamondbacks</a>, as the foul ball came whipping toward the Orioles’ dugout and hit Albernaz square on the right side of his face. But he was back at Camden Yards on Tuesday, less than 24 hours after suffering his multiple facial injuries.</p><p><a href=""https://www.foxnews.com/sports"" rel=""noopener"" target=""_blank""><strong>CLICK HERE FOR MORE SPORTS COVERAGE ON FOXNEWS.COM</strong></a></p><p>Reports from Baltimore state that he has a visible bruise on the right side of his face, and that he will need to consume baby food for the next six weeks as his face heals.</p><p>""This is what we’re here for,"" Albernaz said to reporters, per the <a href=""https://x.com/afkostka/status/2044150628042121698"" rel=""noopener nofollow"" target=""_blank"">Baltimore Banner</a>. ""We’re here for the players. We have a game. I’m physically able to be here, so let’s go.… If my jaw was wired shut, I’d still be here.""</p><p><a href=""https://www.foxnews.com/sports/orioles-manager-craig-albernaz-takes-line-drive-face-terrifying-scene"" rel=""noopener"" target=""_blank""><strong>ORIOLES MANAGER CRAIG ALBERNAZ TAKES LINE DRIVE TO FACE IN TERRIFYING SCENE</strong></a></p><p>Albernaz said he felt ""pretty good"" considering the circumstances from Monday night’s foul ball off the bat of one of his own, Jeremiah Jackson.</p><p>""Ball hit me pretty flush in the cheek, but I feel good,"" he added. ""Luckily, no surgery. I think all in all, it was at least seven fractures in my cheek area, orbital, and then a broken jaw. But luckily, it doesn’t have to be wired. No surgery. I just have to eat baby food for six weeks.""</p><p>Albernaz, like many managers, was standing at the top of the dugout steps when Jackson was late to a pitch that shot immediately toward his teammates and coaches. It’s an unfortunate situation for Albernaz, but the first-time MLB manager is clearly showing his grit and resilience for his squad.</p><p>They also showed it for him on Monday night, as they were trailing at that point in the game. However, the Orioles rallied to win the game 9-7.</p><p>A lot of that had to do with Jackson, who bashed two home runs, including a grand slam in the victory.</p><p>""I hit, and then I kind of saw Alby holding his face,"" Jackson told reporters. ""My heart kind of dropped. I was able to see him afterward and see he was doing OK.… Knowing he was OK helped. It made me feel a little bit better. I’m just happy he’s doing OK and in good spirits.""</p><p>The Orioles’ win keeps them tied with the <a href=""https://www.foxnews.com/category/sports/mlb/new-york-yankees"" rel=""noopener"" target=""_blank"">New York Yankees</a> atop the AL East standings at 9-7.</p><p>Albernaz will continue to lead the way in the dugout moving forward, even if his diet does have to change.</p><p><i><strong>Follow Fox News Digital’s</strong></i><a href=""https://twitter.com/FoxNewsSports_"" rel=""noopener noreferrer nofollow"" target=""_blank""><i><strong> sports coverage on X</strong></i></a><i><strong> and subscribe to</strong></i><a href=""https://www.foxnews.com/newsletters"" rel=""noopener noreferrer nofollow"" target=""_blank""><i><strong> the Fox News Sports Huddle newsletter</strong></i></a><i><strong>.</strong></i></p>",https://www.foxnews.com/sports/orioles-craig-albernaz-says-must-eat-baby-food-weeks-foul-ball-face-leads-7-fractures,2026-04-14
21,Dem fundraising giant in the hot seat as GOP lawmakers demand answers over dodged subpoena,"<p>House Republicans are demanding ActBlue, a top Democratic campaign fundraising apparatus, turn over international communications, probing whether the organization knowingly <a href=""https://www.foxnews.com/politics/dem-fundraising-giant-actblue-rocked-allegations-misled-congress-about-foreign-donations"" rel=""noopener"" target=""_blank"">misled lawmakers and dodged</a> subpoenas to hide weaknesses in its screening process to weed out illegal, overseas donations.</p><p>House Administration Committee Chairman Bryan Steil, R-Wis., House Judiciary Committee Chairman Jim Jordan, R-Ohio, and House Oversight Committee Chairman James Comer, R-Ky., collectively laid out their demands in a <a href=""https://https://cha.house.gov/_cache/files/3/3/334c22c4-7253-4b02-b416-f5e34e1dbc56/669477D8908DF6E10F05F3BB16BCD17EB6438E926897D31544C8C297692E87BB.2026-04-14-signed-letter-to-actblue---wallace-jones-re-compliance.pdf.pdf"" rel=""noopener"" target=""_blank"">letter published on Tuesday.</a></p><p>""For more than a year, the Committees have conducted oversight regarding ActBlue’s 'fundamentally unserious approach to fraud prevention,’"" the letter reads.</p><p>""Recent reporting … strongly suggests that ActBlue deliberately obstructed the Committees’ investigation, including through misleading statements and noncompliance with our subpoenas.""</p><p><a href=""https://www.foxnews.com/politics/breaking-fourth-wall-left-wing-groups-defiant-gop-sheds-light-groups-tied-china"" rel=""noopener"" target=""_blank""><strong>BREAKING THE FOURTH WALL: LEFT-WING GROUPS DEFIANT AS GOP SHEDS LIGHT ON GROUPS TIED TO CHINA</strong></a></p><p>The letter is addressed to Regina Wallace-Jones, the CEO and president of ActBlue, and is the most recent entry in investigations that began in 2023 when Republicans originally raised concerns about foreign donations possibly influencing American elections.</p><p>It also follows<a href=""https://www.nytimes.com/2026/04/02/us/politics/actblue-democrat-fundraising-foreign-donations.html"" rel=""noopener noreferrer nofollow"" target=""_blank""> New York Times</a> reporting on a memo from Covington &amp; Burling, a law firm, warning that gaps in its screening armor could present ""a substantial risk for ActBlue.""</p><p>The memo, on its own, does not implicate wrongdoing or indicate that ActBlue accepted international donations. Even so, the reporting caught the eye of Republicans in Congress.</p><p>Steil, Jordan and Comer are collectively asking ActBlue to produce two internal documents to examine the internal understanding ActBlue may have had about its own weaknesses.</p><p>The first is a resignation letter from General Counsel Aaron Ting — a document Republicans contend centers on liabilities created by ActBlue’s donation security.</p><p>Republicans believe the second, a message from ActBlue’s former legal counsel Zain Ahmad, relates to an ignored whistleblower complaint about those practices.</p><p><a href=""https://www.foxnews.com/politics/house-hearing-raises-red-flags-former-tech-moguls-ccp-network-allegedly-funding-far-left-groups"" rel=""noopener"" target=""_blank""><strong>HOUSE HEARING RAISES RED FLAGS OVER FORMER TECH MOGUL'S ‘CCP NETWORK’ ALLEGEDLY FUNDING OF FAR-LEFT GROUPS</strong></a></p><p><a href=""https://www.foxnews.com/category/politics/house-of-representatives/republicans"" rel=""noopener"" target=""_blank"">Republicans have already requested</a> those documents before, but haven’t received them.</p><p>""There is considerable reason to believe that ActBlue may have deliberately withheld this responsive material to impede our investigation,"" the letter states.</p><p>For its own part, ActBlue has claimed it makes every effort to ensure its <a href=""https://www.foxnews.com/category/politics/elections/fundraising"" rel=""noopener"" target=""_blank"">fundraising complies with legal requirements.</a></p><p>In ActBlue’s own letter published in Nov. 2023, Wallace-Jones, the CEO, affirmed that the organization maintained the highest standards for scrutiny of its fundraising.</p><p>""Our approach is multilayered, with checks and confirmations occurring throughout the donation process to verify donors and donor information,"" Wallace-Jones wrote.</p><p>""These measures, which include compliance measures, technological tools, and manual reviews, help to ensure the identity of donors, root out potential foreign contributions, and protect donors from financial fraud.""</p><p><a href=""https://www.foxnews.com/politics/oversight-demands-doj-answers-foreign-funding-agitator-groups-iran-anti-ice-protests-continue"" rel=""noopener"" target=""_blank""><strong>OVERSIGHT DEMANDS DOJ ANSWERS ON FOREIGN FUNDING OF AGITATOR GROUPS AS IRAN, ANTI-ICE PROTESTS CONTINUE</strong></a></p><p>Republican lawmakers have given ActBlue two weeks to produce the requested documentation, setting a deadline for April 28, 2026.</p><p>""Absent these steps, the Committees are prepared to use available mechanisms to enforce our subpoenas,"" the letter reads.</p>",https://www.foxnews.com/politics/dem-fundraising-giant-hot-seat-gop-lawmakers-demand-answers-dodged-subpoena,2026-04-14
