,title,text,link,publish_date
0,"Newsom's California rail project now expected to cost $126B, official admits, with still no tracks laid","<p>California's delayed, over-budget high-speed train from Los Angeles to San Francisco is running fast only in one direction: Rising costs to even get rolling, which are now estimated to be $126 billion.</p><p>""Today, we estimate with the right optimization just over $125 billion,"" California High Speed Rail Authority board member Anthony Williams told <a href=""https://www.cbsnews.com/news/why-high-speed-rail-not-tracked-in-us-60-minutes-transcript/?ftag=CNM-00-10aab7d&amp;linkId=926767611"" rel=""noopener nofollow"" target=""_blank"">CBS's ""60 Minutes""</a> on Sunday. ""I think $126 billion is the current estimate for that.""</p><p>That is nearly four times the $33 billion price tag presented to voters in 2008, making the long-delayed project a black eye for Democrat-run California, derided as the latest political example of ""waste"" in deep-blue America and a ""train to nowhere.""</p><p>""We’re now in 2026: There are no trains; there’s no track laid; it was a complete bait and switch,"" Rep. Vince Fong, R-Calif., told ""60 Minutes,"" saying the project ""needs to stop.""</p><p><a href=""https://www.foxnews.com/politics/newsom-touts-californias-numerous-legal-fights-trump-administration-final-state-state"" rel=""noopener"" target=""_blank""><strong>NEWSOM TOUTS CALIFORNIA’S NUMEROUS LEGAL FIGHTS WITH TRUMP ADMINISTRATION IN FINAL STATE OF THE STATE</strong></a></p><p>""The California High-Speed Rail nightmare is the probably quintessential example of government waste and mismanagement.""</p><p>California’s <a href=""https://www.foxnews.com/opinion/jonathan-turley-grandstanding-newsom-stop-nothing-ride-rails-glory-2028"" rel=""noopener"" target=""_blank"">long-troubled high-speed rail project</a> is facing renewed scrutiny after state Transportation Secretary Toks Omishakin acknowledged that many of its critics have a point.</p><p>""There were mistakes made,"" Omishakin told CBS. ""Some of the criticism on this project I think are very fair.""</p><p><a href=""https://www.foxnews.com/politics/trump-admin-uncovers-staggering-8-6-billion-suspected-california-small-business-fraud"" rel=""noopener"" target=""_blank""><strong>TRUMP ADMIN UNCOVERS 'STAGGERING' $8.6 BILLION IN SUSPECTED CALIFORNIA SMALL BUSINESS FRAUD</strong></a></p><p>""I don't think the voters fully understood and neither did we in the public sector what it was going to take to actually get this project delivered,"" Omishakin added.</p><p>Taking aim at California Democrat Gov. <a href=""https://www.foxnews.com/category/person/gavin-newsom"" rel=""noopener"" target=""_blank"">Gavin Newsom</a>, President Donald Trump called California's project ""the worst cost overrun, I've ever seen,"" a statement he he has in the past reserved for Federal Reserve Board Chair Jerome Powell's Federal Reserve Building in Washington, D.C.</p><p>""This administration is working to usher in a Golden Age of Transportation,"" Transportation Secretary Sean Duffy <a href=""https://www.cbsnews.com/news/sean-duffy-high-speed-rail-statement-60-minutes/"" rel=""noopener nofollow"" target=""_blank"">told CBS in a statement</a>. ""That vision includes high speed rail and we're exploring opportunities to efficiently build that infrastructure in America.</p><p><a href=""https://www.foxnews.com/opinion/newsoms-failed-leadership-has-let-california-become-land-fraud-scams"" rel=""noopener"" target=""_blank""><strong>NEWSOM’S FAILED LEADERSHIP HAS LET CALIFORNIA BECOME A LAND OF FRAUD AND SCAMS</strong></a></p><p>""What this administration won't stand for is boondoggle projects like Newsom's Train to Nowhere that wasted billions in taxpayer dollars yet delivered nothing to the American people,"" Duffy said. ""Under President Trump, America is building again. We <a href=""https://www.foxnews.com/category/politics/state-and-local/federal-relations"" rel=""noopener"" target=""_blank"">defunded Newsom's disaster</a> and created the first Trump Infrastructure Dividend. Those dollars will now actually fund critical projects that enhance safety on rail networks across America.""</p><p>Newsom himself cast doubt on the full San Francisco-to-Los Angeles plan in 2019, and the project now faces a funding gap of roughly $90 billion.</p><p>""For $10 billion, Elon Musk put 300 rockets in orbit; for $11 billion, the state of California has built 1,600 feet of elevated rail with no rail,"" Palantir CTO Shyam Sankar said in 2024.</p><p>State officials say they remain confident more money can be found to dump into the project, but for now California’s high-speed rail stands as a costly symbol of ambition, delay, and deep public skepticism.</p><p><a href=""https://www.foxnews.com/media/the-daily-show-roasts-gavin-newsom-homelessness-high-speed-rail-satirical-leading-man-video"" rel=""noopener"" target=""_blank""><strong>'THE DAILY SHOW' ROASTS GAVIN NEWSOM ON HOMELESSNESS, HIGH-SPEED RAIL IN SATIRICAL 'LEADING MAN' VIDEO</strong></a></p><p>""The ultimate 494 miles of building this out without the federal government's help will be challenging: There's no doubt about that,"" Omishakin said.</p><p>Nearly two decades since the start of the project, no track has been laid, and the only major visible progress is on a Central Valley segment between Bakersfield and Merced, according to the report.</p><p>The project’s earliest projected opening is now 2033, far later than originally promised. Critics, including Bakersfield's Fong, a member of the House Transportation Committee.</p><p><a href=""https://www.foxnews.com/opinion/california-broke-its-not-too-late-rest-us"" rel=""noopener"" target=""_blank""><strong>CALIFORNIA IS BROKE, BUT IT’S NOT TOO LATE FOR THE REST OF US</strong></a></p><p>""The business plan that was put out in 2008 was very theoretical,"" Fong said. ""You know, 'This is what we think is gonna happen.'</p><p>""And it became very clear that they didn't have the specifics worked out.""</p><p>Fong has sought oversight and accountability on the waste, including 597 change orders that have cost more than $2.3 billion alone as of November 2025, which is nearly 7% of the initial $33 billion project estimate.</p><p>""Taxpayers deserve full transparency and accountability,"" Fong <a href=""https://fong.house.gov/media/press-releases/congressman-vince-fong-demands-transparency-537-million-high-speed-rail"" rel=""noopener nofollow"" target=""_blank"">wrote in a statement in February</a>. ""The high-speed rail nightmare is a glaring example of structural mismanagement.</p><p>""Reckless, repeated contract amendments have squandered resources and precious tax dollars. Hardworking California taxpayers cannot afford to let this continue. This project should be canceled before even more money and time are wasted.""</p>",https://www.foxnews.com/politics/newsoms-california-rail-project-expected-cost-126b-official-admits-still-tracks-laid,2026-04-06
1,"'Credible intelligence' reveals North Korea's successor to Kim Jong Un, South Korea says","<p>South Korea's National Intelligence Service (NIS) thinks that North Korean leader <a href=""https://www.foxnews.com/category/person/kim-jong-un"" rel=""noopener"" target=""_blank"">Kim Jong Un's</a> daughter has been lined up to be her father's eventual successor, lawmakers noted on Monday, according to Reuters.</p><p>The NIS indicated to lawmakers that its analysis stems from what it characterized as ""credible intelligence"" that it had gathered, Reuters reported, citing briefings by ruling and opposition party members following a closed-door parliamentary meeting.</p><p><a href=""https://www.youtube.com/watch?v=P4fACbFeEUY"" rel=""nofollow noopener"" target=""_blank"">Video footage</a> posted last month showed Kim and his daughter on a tank.</p><p><a href=""https://www.foxnews.com/world/kim-jong-un-appears-teenage-daughter-live-fire-rocket-test-north-korea"" rel=""noopener"" target=""_blank""><strong>KIM JONG UN APPEARS WITH TEENAGE DAUGHTER AT LIVE-FIRE ROCKET TEST IN NORTH KOREA</strong></a></p><p>The <a href=""https://www.foxnews.com/category/world/world-regions/south-korea"" rel=""noopener"" target=""_blank"">South Korean</a> agency indicated that the scene of the girl driving a tank was meant to emphasize her supposed military aptitude and counter doubts concerning a female successor, lawmakers noted, according to the outlet.</p><p><a href=""https://www.foxnews.com/category/world/conflicts/north-korea"" rel=""noopener"" target=""_blank"">North Korean</a> state-run media KCNA published photos of the North Korean leader and his daughter with a tank last month, following prior images of the girl utilizing firearms, Reuters reported.</p><p>The daughter is thought to be about 13 years old and named Ju Ae.</p><p><a href=""https://www.foxnews.com/world/irans-war-against-us-israel-being-fueled-north-korean-weapons-expert-warns"" rel=""noopener"" target=""_blank""><strong>IRAN'S WAR AGAINST THE US AND ISRAEL IS BEING FUELED BY NORTH KOREAN WEAPONS, EXPERT WARNS</strong></a></p><p>The outlet reported that ruling Democratic Party lawmaker Park Sun-won indicated that the scenes are meant to pay ""homage"" to the North Korean leader's military appearances years ago when he was being set up to succeed his father as regime leader.</p><p>​Korea Institute for National Unification analyst Hong Min said the tank scene is not enough to determine that she has been established as her father's successor, pointing out that she appeared with her father rather than independently, unlike her father's independent military appearances as he was being groomed to take the helm.</p><p><a href=""https://www.foxnews.com/world/north-korea-tests-solid-fuel-missile-engine-kim-boosts-threat-us-mainland"" rel=""noopener"" target=""_blank""><strong>NORTH KOREA TESTS SOLID-FUEL MISSILE ENGINE AS KIM BOOSTS THREAT TO US MAINLAND</strong></a></p><p>North Korea is one of the world's only <a href=""https://www.foxnews.com/category/politics/foreign-policy/nuclear-proliferation"" rel=""noopener"" target=""_blank"">nuclear-armed</a> nations.</p>",https://www.foxnews.com/world/credible-intelligence-reveals-north-koreas-successor-kim-jong-un-south-korea-says,2026-04-06
2,America's cult-favorite mineral water vanishes from shelves as demand explodes,"<p>A high-profile shortage of one of the hottest mineral water brands — combined with surging demand — is reshaping the beverage aisle.</p><p>Topo Chico, the cult-favorite sparkling mineral water <a href=""https://www.foxnews.com/category/food-drink/drinks/soft-drinks"" rel=""noopener"" target=""_blank"">owned by Coca-Cola,</a> has been largely unavailable nationwide since February as the company upgrades facilities at its source in Mexico, with supply not expected to return until late 2026.</p><p>The disruption has left some shelves empty, with consumers turning to alternatives as other brands step in to fill the gap. </p><p><a href=""https://www.foxnews.com/food-drink/heavy-soda-trend-flows-through-us-super-sweet-fountain-drinks-spark-buzz-online"" rel=""noopener"" target=""_blank""><strong>HEAVY SODA TREND FLOWS THROUGH US AS SUPER SWEET FOUNTAIN DRINKS SPARK BUZZ ONLINE</strong></a></p><p>Demand for mineral water has been rising for years, and recent shortages are accelerating that trend, <a href=""https://www.forbes.com/sites/claudiaalarcon/2026/03/26/how-the-topo-chico-shortage-is-redrawing-the-sparkling-water-market/"" rel=""nofollow noopener"" target=""_blank"">Forbes reported.</a></p><p>Unlike seltzer, which is typically made by adding carbonation to purified water and can be produced almost anywhere, mineral water must come from specific natural sources, making it harder to scale production when demand surges.</p><p>This distinction helps set mineral water apart from seltzer. It contains naturally occurring electrolytes such as calcium, magnesium and potassium, giving it a more complex taste, a slightly salty edge and stronger, longer-lasting carbonation.</p><p>As people cut back <a href=""https://www.foxnews.com/category/beer"" rel=""noopener"" target=""_blank"">on alcohol,</a> mineral water is increasingly filling a role once occupied by wine and other alcoholic drinks, according to Ben Tannenbaum, an alcohol industry analyst in New York and vice president of partnerships at LineLeap, a nightlife technology platform.</p><p>""Mineral water is filling a slot that wine used to own — <a href=""https://www.foxnews.com/category/food-drink/drinks"" rel=""noopener"" target=""_blank"">a drink</a> that signals you're paying attention without requiring explanation,"" Tannenbaum told Fox News Digital. </p><p><a href=""https://www.foxnews.com/food-drink/bloodbath-hits-wine-country-millennials-boomers-abandon-alcohol"" rel=""noopener"" target=""_blank""><strong>'BLOODBATH' HITS WINE COUNTRY AS MILLENNIALS AND BOOMERS ABANDON ALCOHOL</strong></a></p><p>""The bottle matters. A Topo Chico or San Pellegrino on the table communicates something that tap water, or even a generic seltzer, can't.""</p><p>He added that branding tied to origin — similar to <a href=""https://www.foxnews.com/category/food-drink/drinks/wine"" rel=""noopener"" target=""_blank"">wine's ""terroir""</a> — is resonating with consumers. </p><p>""People are ordering a place, not just a drink,"" Tannenbaum said.</p><p>That positioning may help explain why premium bottled water has become a growing category, as <a href=""https://www.foxnews.com/food-drink/inside-booming-business-luxury-water-what-people-pay"" rel=""noopener"" target=""_blank"">Fox News Digital previously reported.</a></p><p>For years, flavored seltzers dominated the sparkling water boom as healthier, low-calorie alternatives to soda and alcohol. </p><p><a href=""https://www.foxnews.com/food-drink/americans-zebra-striping-instead-quitting-drinking-michelob-ultra-zero-cashing"" rel=""noopener"" target=""_blank""><strong>WITH AMERICANS 'ZEBRA STRIPING' INSTEAD OF QUITTING DRINKING, MICHELOB ULTRA ZERO IS CASHING IN</strong></a></p><p>But the category is now shifting toward simpler, more ""ingredient-forward"" options tied to natural sources.</p><p>Cocktail writer and educator Camper English said <a href=""https://www.foxnews.com/category/health/wellness"" rel=""noopener"" target=""_blank"">growing interest in hydration</a>, along with confusion about water quality, is also fueling demand.</p><p>""People are bombarded with messaging about the need to hydrate and drink lots of water, and always carry water with them to work and the gym and everywhere else — often in huge fancy insulated water bottles,"" English, based in San Francisco, told Fox News Digital.</p><p>He added that consumers are becoming more aware that even unflavored water can have distinct taste profiles, which he highlights in water-tasting classes.</p><p><a href=""https://www.foxnews.com/newsletters?cmpid=fnfirstnl"" rel=""noopener"" target=""_blank""><strong>CLICK HERE TO SIGN UP FOR OUR LIFESTYLE NEWSLETTER</strong></a></p><p>""There is a lot of pressure to know more about the 'right' water to drink,"" he said. ""That may mean the safest or trendiest or supposedly healthiest.""</p><p>He also said the shift away from alcohol is creating more opportunity for premium water.</p><p><a href=""https://www.foxnews.com/lifestyle"" rel=""noopener"" target=""_blank""><strong>CLICK HERE FOR MORE LIFESTYLE STORIES</strong></a></p><p>Topo Chico's rapid growth in the U.S. following Coca-Cola's 2017 acquisition has helped drive demand, potentially adding pressure on supply.</p><p>Coca-Cola said in a statement to Fox News Digital that updates to facilities at the water source and production sites <a href=""https://www.foxnews.com/category/world/world-regions/location-mexico"" rel=""noopener"" target=""_blank"">in Mexico</a> are tied to the company's priorities of safety and quality.</p><p><a href=""https://www.foxnews.com/category/lifestyle/quizzes"" rel=""noopener"" target=""_blank""><strong>TEST YOURSELF WITH OUR LATEST LIFESTYLE QUIZ</strong></a></p><p>""We aim to have Topo Chico Mineral Water back later this year,"" the company said. </p><p>The company added that the change only involves Topo Chico Mineral Water, and that other Topo Chico drinks remain available in the U.S.</p><p>Even after the brand returns to shelves, analysts say the shift toward mineral water is likely to persist.</p><p>""The consumers driving this trend aren't making trade-offs,"" Tannenbaum said. ""They're not switching to tap because Topo Chico is out of stock. They're looking for the next bottle that signals the same thing.""</p>",https://www.foxnews.com/food-drink/americas-cult-favorite-mineral-water-vanishes-shelves-demand-explodes,2026-04-06
3,BYU women's basketball star explains religious reason why team didn't practice before tourney win,"<p>The <a href=""https://www.foxnews.com/category/sports/ncaa/byu-cougars"" rel=""noopener"" target=""_blank"">BYU Cougars women’s basketball team</a> was on the outside looking into the NCAA Tournament this season despite going 26-12 under head coach Lee Cummard.</p><p>The Cougars played well enough to earn an invitation to the Women’s Basketball Invitational Tournament, where the team was able to knock out the <a href=""https://www.foxnews.com/category/sports/ncaa/kansas-jayhawks"" rel=""noopener"" target=""_blank"">Kansas Jayhawks</a> last week before losing to the Columbia Lions on Wednesday.</p><p><a href=""https://www.foxnews.com/sports"" rel=""noopener"" target=""_blank""><strong>CLICK HERE FOR MORE SPORTS COVERAGE ON FOXNEWS.COM</strong></a></p><p>BYU drew attention for an interesting and faith-based, decision ahead of their 70-67 win over Kansas. The team didn’t practice because it was a Sunday.</p><p>Delaney Gibb, who led the team in scoring, explained it was for religious reasons that the team doesn’t practice on Sundays.</p><p>""When you look at it from a perspective of our team and our culture we’ve built and the faith that we have it’s a day that we get to have a different perspective on life,"" Gibb said, via the <a href=""https://universe.byu.edu/sports/byu-womens-basketball-team-explains-why-it-doesnt-practice-on-sundays"" rel=""noopener nofollow"" target=""_blank"">school’s website</a>. ""There’s things that are bigger than basketball and Jesus Christ and having faith in Him is something that’s bigger than basketball.""</p><p><a href=""https://www.foxnews.com/sports/sophie-cunningham-posts-jesus-king-message-wnba-negotiations-heat-up-ahead-cba-deadline"" rel=""noopener"" target=""_blank""><strong>SOPHIE CUNNINGHAM POSTS 'JESUS IS KING' MESSAGE AS WNBA NEGOTIATIONS HEAT UP AHEAD OF CBA DEADLINE</strong></a></p><p>Gibb scored 12 points in the three-point victory. Sydney Benally added 15.</p><p>The sophomore’s remarks went viral during the week.</p><p>Unfortunately, for the Cougars, BYU lost to the Lions in their next game.</p><p>Gibb is likely to return for her junior season. She was named to the <a href=""https://www.foxnews.com/category/sports/ncaa-bk"" rel=""noopener"" target=""_blank"">All-Big 12 Conference</a> First Team after being named the 2025 Big 12 Conference Freshman of the Year.</p><p>During the 2025-26 season, Gibb averaged a team-leading 18.3 points per game. She also averaged 5.1 rebounds.</p><p><i><strong>Follow Fox News Digital’s</strong></i><a href=""https://twitter.com/FoxNewsSports_"" rel=""noopener noreferrer nofollow"" target=""_blank""><i><strong> </strong></i></a><a href=""https://twitter.com/FoxNewsSports_"" rel=""noopener"" target=""_blank""><i><strong><u>sports coverage on X</u></strong></i></a><i><strong> and subscribe to</strong></i><a href=""https://www.foxnews.com/newsletters"" rel=""noopener"" target=""_blank""><i><strong><u> the Fox News Sports Huddle newsletter</u></strong></i></a><i><strong>.</strong></i></p>",https://www.foxnews.com/sports/byu-womens-basketball-star-explains-religious-reason-team-didnt-practice-tourney-win,2026-04-06
