,title,text,link,publish_date
19,"With dogs, dance and uncovered hair, Iranians defy 'unholy alliance' of socialists, radicals: ‘Hypocrites!’","<p>""You’re hypocrites!""</p><p>The shout cut across H Street NW last week as about 500 Iranian Americans supporting regime change in Iran marched toward a smaller group of pro-China socialists gathered two blocks away across from the White House, backing the radical clerics leading Iran.</p><p>""We are here for freedom of Iran,"" Jay Gorbani, an Iranian American, explained as he held his Labradoodle puppy, Bella, while other members of a fledgling group, the <a href=""https://www.facebook.com/p/National-Solidarity-Group-of-Iran-100071015453518/"" rel=""nofollow noopener"" target=""_blank""><u>National Solidarity Group for Iran,</u></a> marched by. </p><p>""We are against the religious mafia regime of Iran.""</p><p>The far-left activists they confronted had assembled under bright green and yellow signs pulled out again this weekend that said, ""STOP WAR IN IRAN."" But the organizers aren’t simply ""peace"" activists, a Fox News Digital analysis of scores of pages of communications by protest organizers revealed. </p><p>Fox News Digital has identified at least 75 organizations that have protested in support of the regime in Iran since the war began, including 50 organizations that are far-left, Marxist, socialist or communist; 22 that are Muslim organizations that support Islamism, or political theocracy; and the remaining three that are socialist-Islamist adjacent.</p><p>They parrot the pro-regime messages that the Chinese Communist Party has expressed in recent days as China sends military equipment to Iran, according to national security experts.</p><p>Last weekend, they coordinated demonstrations in 63 cities across 29 states and Washington, D.C., using identical signs, chants and protest infrastructure, which are available now in a <a href=""https://stoptrumpswars.org/"" rel=""nofollow noopener"" target=""_blank""><u>digital toolkit,</u></a> and they are replicating the protests this weekend and in the coming days. </p><p>The main organizers are funded by an American-born tech tycoon Neville Roy Singham, who is based in Shanghai, and lawmakers in the House Ways and Means Committee and House Oversight Committee have accused the network of promoting the interests of the People’s Republic of China. </p><p>Singham didn’t respond to repeated requests for comment.</p><p>The <a href=""https://www.foxnews.com/us/network-funded-pro-ccp-tech-tycoon-targets-palantir-amid-anti-us-protests-support-regime-iran"" rel=""noopener"" target=""_blank"">Singham-funded network</a> includes the People’s Forum Inc., the ANSWER Coalition, the Party for Socialism and Liberation, CodePink Women for Peace and the Palestinian Youth Movement, which has helped organize these protests. </p><p>The Democratic Socialists of America, which helped elect Zohran Mamdani as mayor of New York City, also co-sponsored the protests. The organizations didn’t respond to requests for comment.</p><p>The confrontation in the nation’s capital reflects a broader struggle unfolding not only in Iran but also in the West.</p><p>From <a href=""https://www.fox10phoenix.com/news/protesters-clash-arizona-capitol-over-u-s-actions-iran"" rel=""noopener"" target=""_blank""><u>Phoenix</u></a> to <a href=""https://www.fox4news.com/news/north-texas-protestors-clash-over-us-involvement-israel-iran-conflict"" rel=""noopener"" target=""_blank""><u>Dallas</u></a>, <a href=""https://www.instagram.com/p/DVaK-7Zig0K/"" rel=""nofollow noopener"" target=""_blank""><u>Indianapolis</u></a>, <a href=""https://youtu.be/RwiUpTRzamk?si=n7a4gI1TS87NtaE0&amp;t=282"" rel=""nofollow noopener"" target=""_blank""><u>Toronto</u></a> and <a href=""https://www.youtube.com/watch?v=tPp2Jq4qR84"" rel=""nofollow noopener"" target=""_blank""><u>Manchester in the U.K.</u></a>, members of the diaspora are increasingly challenging far-left activists they accuse of amplifying propaganda that favors the clerical rulers Islamic Republic.</p><p>This weekend, Gorbani and other Iranian Americans took to the streets again. They argue their advocacy for a secular democracy — and rejection of Islamism, or theocracy — offers the strongest response to rising acts of extremism by Muslim ideologues. </p><p>In recent days, incidents of violence in Austin, Texas; New York; and Norfolk, Virginia, have been punctuated by shouts of ""Allahu Akbar,"" or ""God is great.""</p><p>These tensions reflect a political dynamic with deep historical roots.</p><p>In 1965, Time magazine <a href=""https://time.com/archive/6633314/iran-unholy-alliance/"" rel=""nofollow noopener"" target=""_blank""><u>published</u></a> an article, ""Unholy Alliance,"" bluntly describing ""the Communists and fanatical Moslems"" working together to oppose ​​Iranian leader Shah Reza Pahlavi’s efforts to ""modernize and Westernize Iran"" as a secular democracy.</p><p>Time quoted Pahlavi warning of ""an unholy alliance between two extremist wings,"" communist revolutionaries that he called ""unpatriotic, destructive Reds,"" and <a href=""https://www.foxnews.com/category/islam"" rel=""noopener"" target=""_blank"">radical Muslims</a>, many wearing black robes, turbans and headscarves.</p><p>""This is the very familiar, what we call, unholy alliance between the black and the red that is the communists and the very reactionary people or strata. We always see it because they are both against the progress and happiness of the country,"" Pahlavi said years later.</p><p>It's an alliance now called the ""red-green alliance,"" with green symbolizing the color of Islam.</p><p><a href=""https://www.foxnews.com/video/6390867402112"" rel=""noopener"" target=""_blank""><strong><u>PROTESTERS HOST QUDS DAY RALLY IN NYC: ""SHAME, SHAME USA!""</u></strong></a></p><p>Last weekend, an Iranian American woman with another nascent group, <a href=""https://dcprotests4iran.org/"" rel=""nofollow noopener"" target=""_blank""><u>DCProtests4Iran,</u></a> faced off against women in black robes from the Manassas Mosque in northern Virginia, where mosque leaders support the Iranian theocracy. Her hair loose in the wind, she flashed a ""V"" for victory and shouted, ""Down with the Islamic regime!""</p><p>Staring down H Street NW at the socialists, Reza Rezavi, an engineer from Rockville, Maryland, and a volunteer with DCProtests4Iran, said his group supports Pahlavi’s son, Reza Pahlavi, as the leader of a new transitional government that would realize a ""democratic Iran.""</p><p>""Freedom for Iran!"" screamed another Iranian American woman, holding her Lhasa Apso dog, Cocoa, rescued in 2019 from Tehran, where the regime has ruled dog walking illegal in many cities.</p><p>At protests from London to Washington, D.C., Iranian diaspora activists say they are confronting far-left groups they accuse of stealing democracy from them dating back to 1979, when they defended radical clerics who came to power in 1979, overthrowing Pahlavi.</p><p>""It’s cultural warfare,"" said Paul Mauro, an attorney, former New York Police Department counterterrorism inspector and a current Fox News contributor.</p><p>""Marxism is probably the most malevolent single idea ever devised,"" Mauro said. ""And our culture has now become infected with a tolerance for Marxism that is being translated into a very dangerous political energy that is working with Islamists to undermine America as we know it.""</p><p>LIke clockwork, members of the Party for Socialism and Liberation, the ANSWER Coalition and other socialist organizations had arrived at 2:28 p.m. last weekend at the corner of 16th and H Street NW. One woman sipped an iced coffee, while another pulled a red wagon piled with megaphones. A third pushed a grocery cart filled with a marching drum and fluorescent yellow signs that said, ""STOP THE WAR ON IRAN!"" </p><p>A young woman dragged a dozen or so signs, asking, ""Would you like a sign? Sign? Anyone like a sign?""</p><p>Tourists looked away as far-left activists, including CodePink co-founder Medea Benjamin and DC coordinator Olivia DiNucci arrived with a new protest banner. Ignoring the approaching crowd of Iranian Americans, Benjamin posed for a photo with Korean Americans who support China, Iran and North Korea’s communism. </p><p>Soon, the group broke into familiar anti-American chants heard at protests for years, but this time they were muffled by the chants of the Iranian protesters, chanting, ""USA! USA!""</p><p>Asked about Singham’s funding of the protest's socialist sponsors, Benjamin said, ""I’d rather not talk about it.""</p><p>Minutes later, the Iranian American groups rounded the corner from L Street NW and stopped about 200 yards from the far-left activists on 16th Street NW. They blasted Iranian music and danced.</p><p>In defiance of strict interpretations of Islam, families walked pet dogs near Bella and Cocoa as women shouted with their hair in the wind, and men and women freely danced beside each other to Iranian pop music, acts mostly banned in Iran. The scene stood in defiance of the strict religious rules imposed by Iran’s clerics, who have barred pet dogs, forced women to cover their hair and suppressed music, dancing and dissent.</p><p>An Iranian American woman smiled and slowly raised her middle finger at the socialist activists, their chants of ""Down, down with the USA,"" drowned out by music blaring in Farsi.</p><p>Across the police line, field marshals from the Party for Socialism and Liberation corralled elementary-aged girls swaddled in black headscarves to the microphone, filming them close up as the children stumbled over their words, reading chants from a phone as activists egged them on.</p><p>When a girl got in the shot, the field marshal filming the canned chanting tried to shoo her away. </p><p>""Those people are supporting terrorists,"" said one Iranian American with the reform-era Iranian flag draped over his shoulder like a cape that featured a lion emblem. ""We are against them.""</p><p>""We do not support the regime,"" said Siamak Aran, an organizer with the National Solidarity Group for Iran, as Iranian Americans marched behind him, chanting, ""USA! USA!""</p><p><i>Fox News Digital's Azziana Solomon contributed to this report.</i></p>",https://www.foxnews.com/us/with-dogs-dancing-and-hair-iranians-defy-unholy-alliance-of-socialists-and-radicals-youre-hypocrites,2026-03-14
20,"Cigarette smoking in America plummets to historic single-digit low, new study finds","<p>The percentage of American adults who smoke cigarettes has dropped to the lowest level ever recorded, according to a new study.</p><p>About 9.9% of U.S. adults reported smoking cigarettes in 2024, a drop from 10.8% in 2023, according to an analysis of National Health Interview Survey data published Tuesday in the journal NEJM Evidence. </p><p>The findings mark the first time the <a href=""https://www.foxnews.com/category/health"" rel=""noopener"" target=""_blank"">adult smoking rate</a> in the U.S. has fallen to the single digits, a milestone public health officials have pursued for decades. </p><p>The decline suggests the U.S. may be moving closer to the Healthy People 2030 goal — a national public health target — of reducing adult smoking to 6.1%.</p><p><a href=""https://www.foxnews.com/health/smoking-just-two-cigarettes-day-can-wreak-havoc-your-heart-study-shows"" rel=""noopener"" target=""_blank""><strong>SMOKING JUST TWO CIGARETTES A DAY CAN WREAK HAVOC ON YOUR HEART, STUDY SHOWS</strong></a></p><p>""If this decline continues, the target might be met or exceeded by 2030,"" the researchers, led by Israel Agaku, an Atlanta-based public health researcher and professor, wrote in the paper.</p><p>But the milestone does not mean tobacco use has disappeared. About 25.2 million adults still smoke cigarettes — the most commonly used tobacco product in the United States — while nearly 47.7 million adults, or 18.8% of the population, use at least one tobacco product, including cigarettes, cigars or e-cigarettes, according to the researchers.</p><p>The study analyzed responses from more than 29,500 adults in 2023 and 32,600 adults in 2024 who participated in the National Health Interview Survey, a nationally representative household survey and the most recent national data available on adult tobacco use.</p><p><a href=""https://www.foxnews.com/health/doctors-reveal-what-reasonable-drinking-looks-like-who-should-avoid-alcohol"" rel=""noopener"" target=""_blank""><strong>DOCTORS REVEAL WHAT ‘REASONABLE’ DRINKING LOOKS LIKE — AND WHO SHOULD AVOID ALCOHOL</strong></a></p><p>The <a href=""https://www.foxnews.com/category/health/healthy-living"" rel=""noopener"" target=""_blank"">drop in cigarette smoking</a> helped drive a decline in overall combustible tobacco use, which includes cigarettes and cigars. About 12.6% of adults used combustible tobacco in 2024, down from 13.5% the year prior, according to the study.</p><p>However, the prevalence of other tobacco products — including e-cigarettes and cigars — did not significantly change between 2023 and 2024, according to the study.</p><p><a href=""https://www.foxnews.com/health/study-challenges-negative-cannabis-stereotypes-claiming-link-brain-benefits"" rel=""noopener"" target=""_blank""><strong>STUDY CHALLENGES NEGATIVE CANNABIS STEREOTYPES, CLAIMING LINK TO BRAIN BENEFITS</strong></a></p><p>""The lack of change in cigar and e-cigarette use calls for intensified implementation of comprehensive tobacco control policies addressing all products,"" the researchers wrote.</p><p>The study also found that tobacco use was not evenly distributed across the population.</p><p>Men reported significantly higher tobacco use than women, with just over 24% of men <a href=""https://www.foxnews.com/lifestyle"" rel=""noopener"" target=""_blank"">using at least one tobacco product</a> compared with nearly 14% of women, according to the study.</p><p><a href=""https://www.foxnews.com/health/nearly-40-cancers-can-prevented-3-lifestyle-changes-study-finds"" rel=""noopener"" target=""_blank""><strong>NEARLY 40% OF CANCERS CAN BE PREVENTED WITH 3 LIFESTYLE CHANGES, STUDY FINDS</strong></a></p><p>Tobacco use was also higher among certain demographic and occupational groups, particularly adults in industries such as agriculture, construction and manufacturing.</p><p>The highest tobacco use was reported among people with a general educational development certificate at 42.8%, as well as rural residents, low-income individuals and people with disabilities.</p><p>Young adults were more likely to use e-cigarettes than traditional cigarettes. Nearly 15% of adults ages 18 to 24 reported using e-cigarettes, compared with 3.4% who smoked cigarettes, according to the study.</p><p><a href=""https://www.foxnews.com/newsletters?cmpid=fnfirstnl"" rel=""noopener"" target=""_blank""><strong>CLICK HERE TO SIGN UP FOR OUR LIFESTYLE NEWSLETTER</strong></a></p><p>Some experts note the findings reflect a shift in nicotine use rather than a <a href=""https://www.foxnews.com/category/health/mental-health/addiction"" rel=""noopener"" target=""_blank"">disappearance of addiction.</a></p><p>John Puls, a psychotherapist and addiction specialist who runs Full Life Comprehensive Care in <a href=""https://www.foxnews.com/category/us/us-regions/southeast/florida"" rel=""noopener"" target=""_blank"">Boca Raton, Florida,</a> said the trend away from cigarettes but continued use of tobacco and e-cigarettes mirrors what he sees with patients.</p><p>""Most of my patients use e-cigarettes and various vape products,"" Puls, who was not involved in the study, told Fox News Digital. ""They’re easier to conceal, can be used almost anywhere and deliver a much more powerful nicotine dose.""</p><p><a href=""https://www.foxnews.com/lifestyle"" rel=""noopener"" target=""_blank""><strong>CLICK HERE FOR MORE LIFESTYLE STORIES</strong></a></p><p>Cigarette smoking, on the other hand, is ""more socially unacceptable than it has ever been,"" he added. ""I work with many patients who are <a href=""https://www.foxnews.com/category/health/mental-health/drug-and-substance-abuse"" rel=""noopener"" target=""_blank"">addicted to nicotine,</a> and the vast majority have never smoked a cigarette.""</p><p>Puls said this pattern is especially common among adolescents and young adults and is concerning because cigarettes typically deliver about 1 to 2 milligrams of nicotine, while some vape products can contain 20 to 60 milligrams.</p><p>""There’s also a perception that e-cigarettes are a safer form of smoking, which is contributing to the decline in cigarette smoking,"" Puls added.</p><p><a href=""https://www.foxnews.com/category/lifestyle/quizzes"" rel=""noopener"" target=""_blank""><strong>TEST YOURSELF WITH OUR LATEST LIFESTYLE QUIZ</strong></a></p><p>Health officials stress that no tobacco product is safe, including e-cigarettes, according to the Centers for Disease Control and Prevention.</p><p>Cigarette smoking is the leading cause of preventable disease and death in the U.S. and is responsible for about one in three cancer deaths, the agency says.</p><p>Overall, sustained public health measures — including smoke-free laws, tobacco taxes and <a href=""https://www.foxnews.com/category/health/respiratory-health/stop-smoking"" rel=""noopener"" target=""_blank"">access to quitting support</a> — remain critical to further reducing tobacco use, the researchers noted.</p><p>The study had several limitations, including changes to how smokeless tobacco has been defined over the survey years, reliance on self-reported data and less reliable estimates for some smaller subgroups.</p><p>Fox News Digital has reached out to Agaku for comment.</p>",https://www.foxnews.com/health/smoking-rate-america-has-plummeted-record-low,2026-03-14
21,Zach Braff shuts down rumors he has an AI chatbot girlfriend: 'Please update all gossip sites',"<p><a href=""https://www.foxnews.com/entertainment/florence-pugh-reveals-thinks-relationship-zach-braff-bugs-people"" rel=""noopener"" target=""_blank"">Zach Braff</a> is responding to rumors he has an AI Chatbot girlfriend.</p><p>The 50-year-old actor took to his Instagram stories March 12 to dispel rumors he has a romantic relationship with an AI Chatbot, which first surfaced in December 2025 after an episode of the ""<a href=""https://www.youtube.com/watch?v=uDt31d1Qa3c"" rel=""nofollow noopener"" target=""_blank"">I Need You Guys</a>"" podcast<i>.</i></p><p>""I'm not dating a chatbot,"" Braff wrote on his story alongside a screenshot from the podcast. ""I can't believe I have to type these words. It is a storyline in an upcoming ep of 'Scrubs.' Maybe it came from that? Not sure. But not me. Love, The guy not dating his chatbot. Please update all gossip sites.""</p><p>In another slide in his stories, Braff added that he ""had no idea until tonight"" that the podcast was where the rumor started since he doesn't have a TikTok account.</p><p><a href=""https://www.foxnews.com/tech/ai-companions-reshaping-teen-emotional-bonds"" rel=""noopener"" target=""_blank""><strong>AI COMPANIONS ARE RESHAPING TEEN EMOTIONAL BONDS</strong></a></p><p>In the Dec. 16 episode of the podcast, hosted by Max Silvestri, Jenny Slate and Gabe Liedman, the trio were speaking to actor Kumail Nanjiani when Silvestri brought up that he knows of an actor who has an AI girlfriend.</p><p>""There's a well-known actor who is currently <a href=""https://www.foxnews.com/category/entertainment/events/couples"" rel=""noopener"" target=""_blank"">in a romantic relationship</a> with his AI chatbot,"" Silvestri said. ""And [he] brings the chatbot with him places and talks to the chatbot. I think on the phone or computer or whatever.""</p><p>When pressed for more details, Silvestri said the actor is as ""near A-list as TV can get you,"" before adding that he's ""also done films."" When Silvestri later texted the group the actor's name, Nanjiani responded by saying, ""Perfect! I will say, good description, not A-list.""</p><p>After further discussion, Slate jumped in, saying, ""We can't put this on our podcast. It's not nice."" Braff took a screenshot of that portion and added the caption, ""I feel like now is a good time to be kind to people.""</p><p><a href=""https://www.foxnews.com/newsletters?cmpid=fnfirstnl"" rel=""noopener"" target=""_blank""><strong>CLICK HERE TO SIGN UP FOR THE ENTERTAINMENT NEWSLETTER</strong></a></p><p>Silvestri defended himself on his Instagram story in response to Braff's social media post, saying he has ""never mentioned this man's name in my life.""</p><p>""Aren't there more important stories in the world right now? Between tariffs and energy prices, the average American can barely afford to charge their girlfriend,"" he said.</p><p>Fans originally linked Braff to the story after a different but similar story was brought up on a February episode of Caleb Hearon's podcast, ""<a href=""https://www.youtube.com/watch?v=oS3sdM2uRO4"" rel=""nofollow noopener"" target=""_blank"">So True</a>,"" in conversation with Chris Fleming. While he didn't name the actor, Fleming referred to him as ""Mr. Tumnus,"" a term he has used in reference to Braff in the past.</p><p>Braff's last public relationship was with actress <a href=""https://www.foxnews.com/entertainment/florence-pugh-completely-inappropriate-requests-sex-scenes-movie-sets"" rel=""noopener"" target=""_blank"">Florence Pugh</a>. The two began dating in 2019 after they met on social media in 2018. They later worked together on Braff’s short film, ""In the Time It Takes to Get There.""</p><p><a href=""https://www.foxnews.com/entertainment"" rel=""noopener"" target=""_blank""><strong>LIKE WHAT YOU’RE READING? CLICK HERE FOR MORE ENTERTAINMENT NEWS</strong></a></p><p>The two dated for a few years before quietly calling it quits in early 2022. The two dealt with scrutiny during their relationship due to their 21-year age gap. </p><p>Pugh was 24 years old and Braff was 45 years old when they first got together.</p><p>""I am 24 years old. I do not need you to tell me who I <a href=""https://www.foxnews.com/entertainment/florence-pugh-says-she-had-defend-age-gap-romance-zach-braff-against-nasty-trolls"" rel=""noopener"" target=""_blank"">should and should not love, and</a> I would never in my life tell anyone who they can and cannot love. It is not your place,"" Pugh said in an April 2020 Instagram reel addressing the scrutiny.</p><p>In the past, Braff has dated actresses Mandy Moore, Shiri Appleby and Taylor Bagley.</p>",https://www.foxnews.com/entertainment/zach-braff-shuts-down-rumors-ai-chatbot-girlfriend-update-gossip-sites,2026-03-14
