,title,text,link,publish_date
9,"China cries foul after college researcher’s fatal fall — claims US questioning, feds stay tight-lipped","<p>Chinese government officials are alleging that a University of Michigan researcher was questioned by <a href=""https://www.foxnews.com/category/us/crime/police-and-law-enforcement"" rel=""noopener"" target=""_blank"">U.S. law enforcement</a> shortly before his death on campus last month — a claim U.S. authorities have not confirmed.</p><p>Danhao Wang, a research assistant in electrical and computer engineering, died in March after an incident inside the George G. Brown Building, according to the university.</p><p><a href=""https://www.foxnews.com/category/us/us-regions/midwest/michigan"" rel=""noopener"" target=""_blank"">The University of Michigan Police Department</a> said officers responded around 11 p.m. on March 19 to a report of a person who fell inside the building. An assistant research scientist was found after falling from an upper level and was later pronounced dead.</p><p>Police said the case is being investigated as a possible act of self-harm and that there is no indication of an ongoing threat to the campus community.</p><p><a href=""https://www.foxnews.com/us/feds-charge-3-2-5b-scheme-smuggle-us-ai-tech-china-using-dummy-servers"" rel=""noopener"" target=""_blank""><strong>FEDS CHARGE 3 IN $2.5B SCHEME TO SMUGGLE US AI TECH TO CHINA USING DUMMY SERVERS</strong></a></p><p>Chinese officials, however, have publicly raised concerns about the circumstances leading up to Wang’s death.</p><p>In a statement issued March 30, the <a href=""https://x.com/ChinaConsulate/status/2038826073480212632"" rel=""nofollow noopener"" target=""_blank"">Chinese Consulate</a> in Chicago said a Chinese scholar died ""the day after being questioned by U.S. law enforcement personnel,"" adding that officials, acting under instructions from Beijing, had protested multiple times to U.S. government agencies and the university.</p><p>The consulate said it had contacted the scholar’s family ""at the earliest opportunity"" and was assisting them, while accusing the United States of ""overstretching"" <a href=""https://www.foxnews.com/category/politics/executive/national-security"" rel=""noopener"" target=""_blank"">national security concerns</a> to ""groundlessly interrogate and harass Chinese students and scholars.""</p><p><a href=""https://www.foxnews.com/us/authorities-reveal-cause-death-killing-retired-college-professor"" rel=""noopener noreferrer nofollow"" target=""_blank""><strong>AUTHORITIES REVEAL CAUSE OF DEATH IN KILLING OF RETIRED COLLEGE PROFESSOR</strong></a></p><p>It also warned of a ""serious chilling effect"" and advised <a href=""https://www.foxnews.com/category/world/world-regions/china"" rel=""noopener"" target=""_blank"">Chinese nationals</a> in the U.S. to exercise caution in interactions with law enforcement and contact Chinese diplomatic missions if they encounter similar situations.</p><p>The consulate did not identify the individual.</p><p>During a March 27 press briefing, Chinese Foreign Ministry spokesperson Lin Jian said China had protested the case and accused the United States of ""groundlessly interrogat[ing] and harass[ing] Chinese scholars and students,"" calling for a full investigation.</p><p>U.S. officials have not confirmed that any such questioning took place.</p><p><a href=""https://www.foxnews.com/tips"" rel=""noopener"" target=""_blank""><strong>GOT A TIP?</strong></a></p><p>In a statement to Fox News Digital, the <a href=""https://www.foxnews.com/category/tech/topics/fbi"" rel=""noopener"" target=""_blank"">FBI’s Detroit field office</a> declined to say whether it had any contact with Wang.</p><p><a href=""https://x.com/FoxUSNews"" rel=""noopener"" target=""_blank""><strong>FOLLOW US ON X</strong></a></p><p>""As a matter of longstanding policy, the FBI neither confirms nor denies the existence of any investigation or investigative activity involving specific individuals,"" the bureau said.</p><p>University of Michigan police told Fox News Digital they would not be releasing additional information beyond their public statement, citing the <a href=""https://www.foxnews.com/politics/stefanik-grills-university-michigan-leader-lack-audit-after-string-chinese-national-arrests"" rel=""noopener"" target=""_blank"">ongoing investigation</a>.</p><p><a href=""https://www.foxnews.com/newsletters"" rel=""noopener"" target=""_blank""><strong>GET BREAKING NEWS BY EMAIL</strong></a></p><p>The allegations were first <a href=""https://michiganadvance.com/briefs/university-of-michigan-researchers-death-draws-scrutiny-diplomatic-tension-with-china/"" rel=""nofollow noopener"" target=""_blank"">reported by Michigan Advance,</a> which said federal agencies declined to comment on whether Wang had been questioned prior to his death.</p><p><a href=""https://www.foxnews.com/us"" rel=""noopener"" target=""_blank""><strong>CLICK HERE FOR MORE US NEWS</strong></a></p><p>Wang’s death remains under investigation, and an autopsy report has been requested.</p><p>In a message to the university community, Engineering Dean Karen Thole described Wang as a ""promising and brilliant young mind,"" noting his research into advanced semiconductor materials had been published in ""Nature.""</p><p>The case comes amid <a href=""https://www.foxnews.com/category/politics/executive/homeland-security"" rel=""noopener"" target=""_blank"">heightened scrutiny</a> of Chinese nationals at U.S. universities. As previously reported by Michigan Advance, federal authorities have brought charges in recent months against individuals with ties to the University of Michigan accused of <a href=""https://www.foxnews.com/us/chinese-researcher-us-visa-charged-smuggling-e-coli-country-fbi-director-kash-patel-says"" rel=""noopener"" target=""_blank"">attempting to smuggle biological materials</a> into the United States.</p>",https://www.foxnews.com/us/china-cries-foul-college-researchers-fatal-fall-claims-us-questioning-feds-stay-tight-lipped,2026-04-07
10,Democrat swing candidate called Biden's border handling 'a huge misstep' after backing his approach as mayor,"<p>A Democratic candidate is facing scrutiny over an apparent reversal on the <a href=""https://www.foxnews.com/category/us/immigration"" rel=""noopener"" target=""_blank"">southern border</a> as she seeks to flip a battleground House seat this year.</p><p>Scranton Mayor Paige Cognetti recently criticized <a href=""https://www.foxnews.com/category/person/joe-biden"" rel=""noopener"" target=""_blank"">former President Joe Biden's</a> handling of the southern border, calling it ""a huge misstep"" and ""really terrible"" during a March podcast appearance.</p><p>The House hopeful, however, did not appear to publicly criticize the administration’s border policies when Biden was president.</p><p>Cognetti, who has served as the mayor of Biden’s hometown since 2020, is vying to unseat freshman Rep. Rob Bresnahan in November’s midterm elections. The Northeastern Pennsylvania contest promises to be one of the most competitive House elections this year.</p><p><a href=""https://www.foxnews.com/media/james-talarico-says-biden-administration-convinced-border-security-racist"" rel=""noopener"" target=""_blank""><strong>JAMES TALARICO SAYS BIDEN ADMINISTRATION WAS CONVINCED BORDER SECURITY WAS 'RACIST'</strong></a></p><p>Cognetti’s recent messaging criticizing Biden comes as some Democrats have largely pivoted toward the center on border security after the party’s messaging fell flat in 2024.</p><p>When Cognetti called for ""better control at our borders"" during a September 2021 interview with a local outlet, she did not appear to hold the Biden administration responsible for the problem.</p><p>In August 2023, Cognetti co-signed a letter with a handful of Pennsylvania mayors appearing to approve of the Biden administration’s approach to the border.</p><p>""You are working to bring more order to the southern border with a combination of strategies,"" the group wrote to Biden, adding that he had ""rightfully promised"" to tie border security with expanding pathways to citizenship for illegal immigrants living in the United States. </p><p>A spokesperson for Cognetti said the mayor had been consistent in urging Biden to secure the border during his presidency.</p><p>""Like a lot of Northeastern Pennsylvanians, she has seen what the scourge of Fentanyl has done to our community and has said that President Biden didn’t do enough to secure the southern border,"" the spokeswoman said, adding that Cognetti is ""no stranger to calling out politicians from either political party when they get it wrong.""</p><p><a href=""https://www.foxnews.com/politics/shapiro-slams-biden-harris-broadband-rollout-zero-pennsylvanians-connected"" rel=""noopener"" target=""_blank""><strong>JOSH SHAPIRO KNOCKS BIDEN RECORD, SAYS DEMOCRATS FAILED TO DELIVER RESULTS AMERICANS COULD ‘SEE OR FEEL’</strong></a></p><p>Cognetti also advocated for a more lenient approach to immigration when Biden was president, arguing immigrants, including those who entered the U.S. illegally, ""contribute greatly to our cultural and economic growth.""</p><p>The 2023 letter to Biden that Cognetti signed urged the president to grant and expand <a href=""https://www.foxnews.com/category/us/immigration/immigrant-rights"" rel=""noopener"" target=""_blank"">legal protections</a> to Venezuelan, Honduran, Salvadoran and Nicaraguan nationals living in the United States.</p><p>Cognetti, who became mayor in 2020, also called for mass amnesty for millions of illegal immigrants during the onset of Biden’s presidency in July 2021. She warned that failure to deliver pathways to citizenship could become a ""national security issue,"" <a href=""https://www.thecentersquare.com/pennsylvania/article_00234f78-ee4d-11eb-9ced-7fb447c4240a.html"" rel=""noopener nofollow"" target=""_blank""><u>The Center Square reported</u></a>.</p><p>""If we don’t do this now, we will start to erode in our strength and that becomes a national security issue,"" Cognetti told reporters.</p><p>Bresnahan said Cognetti’s support for mass amnesty would make the district less safe and accused her mayoral tenure of resulting in a <a href=""https://www.foxnews.com/politics/scranton-crime-spike-dogs-dem-mayor-challenges-gop-rep-bidens-hometown"" rel=""noopener"" target=""_blank"">Scranton crime spike</a> in a statement to Fox News Digital. </p><p>""Mayor Paige Cognetti’s soft-on-crime policies have already led to a spike in violence in Scranton, and her support for legalizing every illegal immigrant in the country will only make things worse, especially in her city where she downplays homicides and gang violence and wants to disarm the police,"" Bresnahan said.</p><p>A spokesperson for Cognetti fired back that the mayor has a ""proven track record"" of investing in local law enforcement and said she has overseen a decrease in violent crime. </p><p>The nonpartisan Cook Political Report rates the swing contest as ""Lean Republican.""</p>",https://www.foxnews.com/politics/democrat-swing-candidate-called-bidens-border-handling-a-huge-misstep-after-backing-his-approach-mayor,2026-04-07
11,'Charlie's Angels' star Cheryl Ladd opens up for first time about ‘aggressive’ breast cancer battle,"<p>Cheryl Ladd is opening up about her <a href=""https://www.foxnews.com/category/health/cancer/breast-cancer"" rel=""noopener"" target=""_blank"">breast cancer diagnosis</a> for the first time.</p><p>On Monday, Ladd, 74, got candid about her bout with cancer during an appearance at the PaleyFest 50th anniversary <a href=""https://www.foxnews.com/entertainment/charlies-angels-star-jaclyn-smith-marks-80th-birthday-fans-praise-her-youthful-appearance"" rel=""noopener"" target=""_blank"">celebration of ""Charlie's Angels.""</a></p><p>""Mine was an aggressive form,"" Ladd, who was accompanied by fellow costars Kate Jackson and Jaclyn Smith, said. ""I had wonderful doctors. But I was bald for quite a while. It was a humbling experience.""</p><p>""I have a wonderful husband. All through it, he was there for me at every turn, and that makes a difference,"" said Ladd, referring to her husband Brian Russell. ""Eventually, I started to get little sprouts of hair. It was like, 'Oh, I'm getting hair!' It was a long, long, hard road. But you just get through. You just get on with it."" </p><p><a href=""https://www.foxnews.com/entertainment/charlies-angels-star-cheryl-ladd-reflects-on-her-friendship-with-jaclyn-smith-enduring-faith-in-god"" rel=""noopener"" target=""_blank""><strong>'CHARLIE'S ANGELS' STAR CHERYL LADD REFLECTS ON HER FRIENDSHIP WITH JACLYN SMITH, ENDURING FAITH IN GOD</strong></a></p><p>Not only do the three women share an unbreakable bond through their experience on the show, but they're all three cancer survivors.</p><p>""It just connects you because you know what they’re going through,"" Smith, who was also diagnosed with breast cancer and underwent radiation treatment in 2002, said during an interview on the ""Today Show"". ""And that’s when I talk about the power of girlfriends.""</p><p><a href=""https://www.foxnews.com/entertainment"" rel=""noopener"" target=""_blank""><strong><u>LIKE WHAT YOU’RE READING? CLICK HERE FOR MORE ENTERTAINMENT NEWS</u></strong></a></p><p>When Ladd disclosed her diagnosis to her friends, Smith said she immediately empathized.</p><p><a href=""https://www.foxnews.com/entertainment/cameron-mathison-says-noticing-subtle-body-changes-saved-my-life-after-cancer-diagnosis"" rel=""noopener"" target=""_blank""><strong>CAMERON MATHISON SAYS NOTICING SUBTLE BODY CHANGES ‘SAVED MY LIFE’ AFTER CANCER DIAGNOSIS</strong></a></p><p>""The first thing I did was send her my wigs,"" she said during the PaleyFest panel. ""She was so brave. She did have a very aggressive form [of cancer].""</p><p>""It’s really important to understand and embrace not being afraid of getting a mammogram,"" Jackson, a two-time breast cancer survivor, added. ""Early detection is key. Find it early enough and you’ll probably be all right.""</p><p>Ladd, Jackson and Smith reunited on Monday to celebrate the show's milestone anniversary and pay tribute to Farrah Fawcett, who appeared as one of the main angels in the first season of the series.</p><p><a href=""https://www.foxnews.com/entertainment/teddi-mellencamp-hospitalized-after-painful-sores-erupt-across-her-entire-body"" rel=""noopener"" target=""_blank""><strong>TEDDI MELLENCAMP HOSPITALIZED AFTER PAINFUL SORES ERUPT ACROSS HER ENTIRE BODY</strong></a></p><p>""Oh, I feel so proud. I feel appreciative. I feel we did something right,"" Smith told Fox News Digital ahead of the panel. ""And I feel I'm still standing here. And life has been interesting. It's been a beautiful journey. Truly, I have two beautiful kids, a great husband, and three granddaughters. So I'm riding high. And you know, I think things are, 'Charlie's Angels' was meant to be. I have no regrets.""</p><p>In 2021, Ladd opened up to Fox News Digital about her meaningful friendships with her former costars.</p><p>""It’s really interesting because when you do something so specific, so iconic and you are in it when it was huge – it is something you can explain to people, but until you’ve done it, it is different,"" she continued. ""We think back often about how crazy that time was. We had to go into restaurants through the back door. We weren’t prepared for how much people would love the show. It was wonderful, but it was wild.""</p><p><a href=""https://www.foxnews.com/newsletters?cmpid=fnfirstnl"" rel=""noopener"" target=""_blank""><strong>CLICK HERE TO SIGN UP FOR THE ENTERTAINMENT NEWSLETTER</strong></a></p><p>In 1977, Ladd took on the role of Kris Munroe (the younger sister of Fawcett's character) in the iconic series, which aired until 1981. Ladd, who was chosen by <a href=""https://www.foxnews.com/entertainment/aaron-spelling-son-randy-pressure-hollywood"" rel=""noopener noreferrer nofollow"" target=""_blank""><u>Aaron Spelling</u></a> to play Fawcett’s younger sister, initially said no to the role. But with enough convincing, she took the plunge – a decision she’s still grateful for.</p><p>""It was nerve-wracking!"" Ladd admitted about appearing in ""Charlie’s Angels.""</p><p><a href=""https://www.foxnews.com/entertainment"" rel=""noopener"" target=""_blank""><strong>LIKE WHAT YOU’RE READING? CLICK HERE FOR MORE ENTERTAINMENT NEWS</strong></a></p><p>""Because the year and season was all about Farrah,"" she said. ""When Farrah decided to leave the show [in 1980], I think it was very shocking for her fans and everyone that loved the show.""</p><p>Despite achieving fame in Hollywood, Ladd said <a href=""https://www.foxnews.com/category/entertainment/genres/faith"" rel=""noopener noreferrer nofollow"" target=""_blank""><u>her </u></a><a href=""https://www.foxnews.com/category/faith-values"" rel=""noopener"" target=""_blank"">faith in God</a> has always played a significant role in her life.</p><p>""It has been all of it,"" she said. ""I knew who I was as a young girl. I would climb up the top of the tree and talk to God all the time. It has been an interesting path – a lot of good, a lot of bumps, a lot of tough, learning moments. He [God] was with me the whole time. He lets us trip ourselves so we remember that he is in charge. I think that is a good thing, especially in our youth! When we aren’t exactly thinking everything through.""</p><p><i>Fox News Digital's Stephanie Nolasco contributed to this post.</i></p>",https://www.foxnews.com/entertainment/charlies-angels-star-cheryl-ladd-opens-up-first-time-about-aggressive-breast-cancer-battle,2026-04-07
12,Autopsy reveals Colorado QB's blood-alcohol level was double the legal limit during fatal crash: report,"<p><a href=""https://www.foxnews.com/category/sports/ncaa/colorado-buffaloes"" rel=""noopener noreferrer nofollow"" target=""_blank"">Colorado sophomore quarterback</a> Dominiq Ponder, the 23-year-old who died in a car accident last month, reportedly had double the legal limit of alcohol in his system when he crashed.</p><p>Ponder’s blood-alcohol content was 0.167 g/100 mL, according to an autopsy report obtained by <a href=""https://www.usatoday.com/story/sports/ncaaf/big12/2026/04/06/dominiq-ponder-colorado-football-quarterback-autopsy-deion-sanders/89490416007/"" rel=""noopener noreferrer nofollow"" target=""_blank"">USA TODAY Sports.</a> The Boulder County Coroner’s report stated Ponder’s cause of death of was multiple blunt force injuries in an accident.</p><p>Ponder’s mother said that she hopes conversations about decision-making can come from his tragic loss.</p><p><a href=""https://www.foxnews.com/sports"" rel=""noopener"" target=""_blank""><strong>CLICK HERE FOR MORE SPORTS COVERAGE ON FOXNEWS.COM</strong></a></p><p>""If anything good can come from this loss, it’s the conversations it can start about responsible decision-making, supporting young adults, and making good choices even in ordinary moments,"" Catrina Hughes, told USA TODAY Sports. </p><p>""A big part of his legacy will be to encourage young people to please make responsible choices and to have the courage to step in for their friends when one of them isn’t thinking clearly for themselves. Kids need to know that it’s OK to step in, take keys, call a ride, call a parent, speak up, do anything you can do, one small decision can save a life. Don’t be afraid even if it’s uncomfortable. A difficult conversation is easier than a lifetime of loss.""</p><p>Hughes began a foundation in his honor, the Dominiq Ponder 722 Foundation.</p><p><a href=""https://www.foxnews.com/sports/super-bowl-champion-steve-mcmichael-died-last-year-revealed-cte"" rel=""noopener"" target=""_blank""><strong>SUPER BOWL CHAMPION STEVE MCMICHAEL, WHO DIED LAST YEAR, REVEALED TO HAVE CTE</strong></a></p><p>""Funds raised will go directly toward scholarships for student athletes who demonstrate resilience and character, community awareness initiatives about responsible decision-making, and support for children’s hospitals,"" the GoFundMe said of the foundation.</p><p>Ponder’s fatal crash happened at 3 a.m. when he lost control of his 2023 Tesla going around a right-hand curve. Ponder went through a guardrail, hit an electrical pole and rolled at least once, according to the Colorado State Patrol.</p><p>Colorado head coach Deion Sanders delivered an <a href=""https://www.foxnews.com/sports/deion-sanders-delivers-heartbreaking-eulogy-colorado-player-who-died-tragically-23"" rel=""noopener"" target=""_blank"">emotional eulogy</a> at Ponder’s funeral.</p><p>Ponder had been a walk-on quarterback with Colorado in Sanders’ <a href=""https://www.foxnews.com/category/sports/ncaa-fb"" rel=""noopener"" target=""_blank"">first season</a> as head coach and appeared in two games last season.</p><p><i><strong>Follow Fox News Digital’s</strong></i><a href=""https://twitter.com/FoxNewsSports_"" rel=""noopener noreferrer nofollow"" target=""_blank""><i><strong> sports coverage on X</strong></i></a><i><strong>, and subscribe to</strong></i><a href=""https://www.foxnews.com/newsletters"" rel=""noopener"" target=""_blank""><i><strong> the Fox News Sports Huddle newsletter</strong></i></a><i><strong>.</strong></i></p>",https://www.foxnews.com/sports/autopsy-reveals-colorado-qbs-blood-alcohol-level-double-legal-limit-fatal-crash,2026-04-07
13,Rod Stewart's wife Penny Lancaster says she 'deserves a medal' for 26-year relationship,"<p>After 26 years of partnership and <a href=""https://www.foxnews.com/category/entertainment/events/marriage"" rel=""noopener"" target=""_blank"">18 years of marriage</a> to Rod Stewart, Penny Lancaster says she deserves a medal.</p><p>In a new interview with Best Magazine, the 55-year-old mother of two opened up about her relationship with the rock legend and revealed how they manage to ""keep the intimacy alive"" after nearly two decades of marriage.</p><p>""Yes, 26 years! I deserve a medal, don't I?"" she told the publication, per the <a href=""https://www.dailymail.co.uk/tvshowbiz/article-15712339/Penny-Lancaster-55-jokes-deserve-medal-marks-26-years-Rod-Stewart-81-reveals-intimacy-alive.html?ns_mchannel=rss&amp;amp%3Bns_campaign=1490&amp;amp%3Bito=1490"" rel=""noopener nofollow"" target=""_blank"">Daily Mail</a>. ""Only joking.""</p><p>The couple met back in 1999 when Penny was a student at Barking College. The pair married in 2007 and eventually welcomed two sons, Alastair Wallace and Aiden Patrick. <a href=""https://www.foxnews.com/entertainment/rod-stewarts-wife-gave-own-breast-milk-help-feed-granddaughter"" rel=""noopener"" target=""_blank"">Stewart was already a father</a> of six at the time of his marriage to Lancaster.</p><p><a href=""https://www.foxnews.com/entertainment/rod-stewarts-wife-says-would-have-left-refused-have-children"" rel=""noopener"" target=""_blank""><strong>ROD STEWART'S WIFE SAYS SHE WOULD HAVE LEFT HIM IF HE REFUSED TO HAVE CHILDREN</strong></a></p><p>With a <a href=""https://www.foxnews.com/category/entertainment/genres/family"" rel=""noopener"" target=""_blank"">blended family</a> and hectic schedules, Lancaster said it's important that she and her husband find time for each other.</p><p>""We don't take each other for granted and make sure we have date nights together ... dinner, the theatre or whatever, doing the school run together and having an 'a deux' coffee on the way home, long romantic walks together,"" she said. ""We flirt with each other and make each other laugh.""</p><p><a href=""https://www.foxnews.com/entertainment"" rel=""noopener"" target=""_blank""><strong>LIKE WHAT YOU’RE READING? CLICK HERE FOR MORE ENTERTAINMENT NEWS</strong></a></p><p>Lancaster said they ""keep the intimacy alive"" by celebrating each other and the big milestones they reach in their relationship.</p><p><a href=""https://www.foxnews.com/newsletters?cmpid=fnfirstnl"" rel=""noopener"" target=""_blank""><strong>CLICK HERE TO SIGN UP FOR THE ENTERTAINMENT NEWSLETTER</strong></a></p><p>""We're big on celebrating our anniversaries and really spoil each other,"" she said. ""For instance, for our last wedding anniversary, we took a very romantic train trip from Paris to Portofino because Rod proposed to me in Paris and we got married in Portofino. We love reminiscing about our life together and also making plans for the future — more romantic trips.""</p><p>But the biggest secret to their success? Having ""time apart,"" says Lancaster.</p><p>Lancaster said that really ""keeps the spark alive.""</p>",https://www.foxnews.com/entertainment/rod-stewarts-wife-penny-lancaster-says-deserves-medal-26-year-relationship,2026-04-07
