,title,text,link,publish_date
8,"Unexplained shoulder pain could signal dangerous health condition, doctor warns","<p>Unexplained shoulder pain could signal a more serious problem, experts warn.</p><p>While shoulder pain is often the result of rotator cuff problems, injuries, arthritis, nerve problems, or other orthopedic and muscular issues, it can also be a phenomenon called ""referred pain"" stemming from <a href=""https://www.foxnews.com/category/health/cancer"" rel=""noopener"" target=""_blank"">liver cancer</a>. </p><p>Pain in the right shoulder blade has been linked to early signs of the disease, according to the American Cancer Society.</p><p><a href=""https://www.foxnews.com/health/common-drinking-habit-may-quietly-triple-risk-advanced-liver-condition"" rel=""noopener"" target=""_blank""><strong>COMMON DRINKING HABIT MAY QUIETLY TRIPLE RISK OF ADVANCED LIVER CONDITION</strong></a></p><p>Published case reports have shown that shoulder pain can be a symptom of hepatocellular carcinoma (HCC), the most common type of primary <a href=""https://www.foxnews.com/category/health/medical-research/cancer-research"" rel=""noopener"" target=""_blank"">liver cancer</a>.</p><p>Mark Ashamalla, MD, chief of radiation oncology at Episcopal Health Services in New York, confirmed that liver cancer can sometimes cause pain that is felt in the right shoulder, even though the shoulder itself is completely normal.</p><p>""The liver sits high in the right upper abdomen, just under the diaphragm, which is the muscle that helps us breathe,"" he told Fox News Digital. ""If a liver tumor grows large enough or is positioned in a way that stretches the liver’s outer covering or irritates the diaphragm, it can trigger nerves in that area.""</p><p><a href=""https://www.foxnews.com/health/red-flags-colorectal-cancer-warrant-screenings-before-45-years-age"" rel=""noopener"" target=""_blank""><strong>RED FLAGS FOR COLORECTAL CANCER THAT WARRANT SCREENINGS BEFORE 45 YEARS OF AGE</strong></a></p><p>The brain can then misinterpret those signals and ""feel"" the pain in the right shoulder or right shoulder blade, even though the problem lies in the liver. ""It’s a real symptom, but it is not because anything is wrong with the shoulder joint itself,"" Ashamalla noted.</p><p>This is not true ""phantom pain,"" which usually refers to pain felt in a body part that has been amputated or removed, the doctor clarified. </p><p>""Most <a href=""https://www.foxnews.com/category/health/pain-management"" rel=""noopener"" target=""_blank"">shoulder pain</a> is caused by far more ordinary things, like muscle strain, arthritis, tendon problems or poor posture,"" Ashamalla said.</p><p>Typical orthopedic shoulder pain usually occurs after an injury, overuse, sleeping awkwardly, lifting something heavy or repetitive motion, according to the doctor.</p><p>""It tends to worsen with certain arm movements, and the shoulder may feel tender, stiff, weak or have a limited range of motion,"" he said. ""By contrast, referred pain from the liver often does not behave like a shoulder problem.""</p><p>The doctor listed the following clues that may indicate referred shoulder pain linked to <a href=""https://www.foxnews.com/category/health/cancer"" rel=""noopener"" target=""_blank"">liver cancer</a>. </p><p><a href=""https://www.foxnews.com/health"" rel=""noopener"" target=""_blank""><strong>CLICK HERE FOR MORE HEALTH STORIES</strong></a></p><p>""That said, these are warning signs, not proof. There’s no single pain pattern that automatically means cancer,"" Ashamalla emphasized. </p><p>""What matters most is when the pain does not fit the usual orthopedic pattern or is accompanied by other concerning symptoms.""</p><p>One of the challenges with liver cancer is that it often causes no early symptoms at all, or only very vague ones, according to Ashamalla.</p><p>""Liver cancer often does not present with one obvious, dramatic symptom,"" he said. ""Instead, it may show up as a cluster of vague changes that are easy to brush off one by one.""</p><p>Ashamalla shared the following liver cancer symptoms that can be subtle and easy to overlook.</p><p><a href=""https://www.foxnews.com/newsletters?cmpid=fnfirstnl"" rel=""noopener"" target=""_blank""><strong>CLICK HERE TO SIGN UP FOR OUR HEALTH NEWSLETTER</strong></a></p><p>Ashamalla stressed that people shouldn’t be frightened by every ache or pain.</p><p>""Shoulder pain is extremely common, and in most cases the cause is benign,"" he said. ""Don’t panic about ordinary shoulder pain, but don’t ignore it if it's persistent, unexplained, or comes with other red-flag symptoms.""</p><p>For those who already have liver disease or risk factors for liver cancer, such as cirrhosis or chronic hepatitis, unexplained symptoms may warrant a <a href=""https://www.foxnews.com/health"" rel=""noopener"" target=""_blank"">greater concern</a>.</p><p>People should seek <a href=""https://www.foxnews.com/category/health/health-care"" rel=""noopener"" target=""_blank"">medical attention</a> if their pain meets any of the following criteria, according to the doctor.</p><p><a href=""https://www.foxnews.com/category/lifestyle/quizzes"" rel=""noopener"" target=""_blank""><strong>TEST YOURSELF WITH OUR LATEST LIFESTYLE QUIZ</strong></a></p>",https://www.foxnews.com/health/unexplained-shoulder-pain-could-signal-dangerous-health-condition-doctor-warns,2026-04-06
9,Government says 'eat better' but makes it harder to feed your family,"<p>Years ago, in my pediatrics practice, I was speaking with the mother of one of my patients. As I was going over the latest nutrition guidelines for her child, she stopped me cold:  </p><p>""I know what’s in the guidance. I know what I’m supposed to do,"" she said. ""But <a href=""https://www.foxnews.com/category/food-drink/food/fast-food"" rel=""noopener"" target=""_blank"">apart from McDonald’s</a>, where am I going to feed my family for $10?"" </p><p>I’d like to ask Secretary of Health and Human Services <a href=""https://www.foxnews.com/category/person/robert-f-kennedy-jr"" rel=""noopener"" target=""_blank"">Robert F. Kennedy Jr.</a> that question as he promotes his ""Eat Real Food"" campaign. I couldn’t agree more with the message, but most people already know we should eat real food. The real issue is that slogans offer no help if you’re a parent trying to feed kids on a tight budget while grocery prices skyrocket. You expect government leaders to understand your circumstances and offer policy solutions to match.  </p><p>But this administration is making it harder, not easier, for families to put real food on the table.</p><p><a href=""https://www.foxnews.com/politics/trump-admins-new-nutrition-guidelines-target-ultra-processed-foods-ease-up-red-meat-saturated-fats"" rel=""noopener"" target=""_blank""><strong>TRUMP ADMIN'S NEW NUTRITION GUIDELINES TARGET ULTRA-PROCESSED FOODS, EASE UP ON RED MEAT AND SATURATED FATS</strong></a></p><p>As a doctor and a dad, I join the millions of parents who are demanding healthier foods. Our country’s food supply is overrun by ultraprocessed products filled with ingredients that belong in a chemistry lab, not our bodies. Food and beverage corporations market these products to children relentlessly and rake in billions of dollars. At the same time, our kids are paying the price: on any given day, most children don’t even eat a single vegetable. Something is very wrong here. So I welcome the movement to make our food supply healthier. </p><p>Secretary Kennedy has embraced this movement, too, but not nearly as much as he’d like you to believe. For instance, he talks a lot about the administration’s <a href=""https://www.foxnews.com/category/health/nutrition-and-fitness/diet-trends"" rel=""noopener"" target=""_blank"">new Dietary Guidelines for Americans</a>. Some of the new guidelines are smart, including recommendations that Americans eat more fruits, vegetables, and whole grains, and fewer ultraprocessed products. But if it’s too expensive to follow that advice, does it really mean anything? What good are words on paper if the administration makes it harder for you to afford your grocery bill? </p><p>Consider the Supplemental Nutrition Assistance Program (SNAP), which helps more than 40 million Americans afford groceries. During last year’s government shutdown, the administration ordered states to stop distributing SNAP benefits, and then <a href=""https://www.foxnews.com/politics/federal-appeals-court-denies-trump-administration-request-block-snap-funding-order-government-shutdown"" rel=""noopener"" target=""_blank"">fought court rulings</a> striking down that order. President Trump signed a bill that will kick millions of people off SNAP, including families with children, veterans, people experiencing homelessness, and young adults previously in foster care. The administration will soon propose even bigger cuts to the program.</p><p>How does any of that make real food more affordable?   </p><p>Or take the <a href=""https://www.foxnews.com/category/health/healthy-living/childrens-health"" rel=""noopener"" target=""_blank"">National School Lunch Program</a>, which serves about 30 million children. No other federal nutrition program in the country reaches as many children. For many of them, a school lunch is their best shot at a healthy meal during the week. But the administration has canceled programs that help schools buy healthy produce directly from local farmers and ranchers. The administration has even proposed eliminating grants to help schools upgrade their cafeterias. Without a working kitchen, schools can’t prepare, serve, and store fresh foods. </p><p>Does any of that help children grow up healthy or learn in the classroom?</p><p><a href=""https://www.foxnews.com/opinion/snap-trump-blamed-blocking-food-assistance-low-income-families"" rel=""noopener"" target=""_blank""><strong>IN A SNAP, TRUMP BLAMED FOR BLOCKING FOOD ASSISTANCE TO LOW-INCOME FAMILIES</strong></a></p><p>These policies make real food more expensive and less accessible. None of it makes sense. </p><p>When families can’t afford real, healthy food, the consequences are severe. I’ll never forget this 4-year-old boy I took care of <a href=""https://www.foxnews.com/category/us/atlanta"" rel=""noopener"" target=""_blank"">in Atlanta</a> who wasn’t growing properly. Tests didn’t show any underlying diseases, but something was clearly wrong with his development; he looked much younger than he was. Our staff eventually figured out the cause: he wasn’t getting enough food to eat because his family couldn’t afford it. He was literally starving in the wealthiest country on Earth. My ""prescription"" in this case was not medication, but connecting his family to a faith-based organization that ran a food bank. With more to eat, his health improved.  </p><p><a href=""https://www.foxnews.com/opinion"" rel=""noopener"" target=""_blank""><strong><u>CLICK HERE FOR MORE FOX NEWS OPINION</u></strong></a></p><p>Imagine how many more doctors are having this same conversation with families now amid the <a href=""https://www.foxnews.com/category/us/education/administration"" rel=""noopener"" target=""_blank"">administration’s massive funding cuts</a>.  </p><p>In medical terms, a child who isn’t growing properly is suffering from a ""failure to thrive."" Our country is experiencing a similar fate. Nearly 48 million Americans don't get enough food. Charities do incredible work across our country, but there’s no way they can make up for massive cuts to federal programs: for every meal provided by a food bank, SNAP provides nine. So why cut a program that is clearly working?</p><p>If the administration truly believes in ""Eat Real Food,"" it should focus less on catchphrases and more on making real food more affordable. That means protecting programs that help families buy groceries, giving schools the ability to serve <a href=""https://www.foxnews.com/category/health/nutrition-and-fitness/nutrition"" rel=""noopener"" target=""_blank"">healthy meals</a> to all children, and making sure parents are never priced out of the real food aisle at the grocery store. </p><p>Politicians are experts at talking a big game, but true leaders make a real difference in people’s lives. The next time Secretary Kennedy tells you to ""Eat Real Food,"" ask yourself why the administration is making it so hard for families to actually do it. At the end of the day, it’s an empty soundbite. And like an empty calorie, it doesn’t nourish anyone.   </p><p><a href=""https://www.foxnews.com/person/b/dr-richard-besser"" rel=""noopener"" target=""_blank""><strong>CLICK HERE TO READ MORE FROM RICHARD BESSER </strong></a></p>",https://www.foxnews.com/opinion/government-says-eat-better-but-makes-it-harder-to-feed-your-family,2026-04-06
10,"Harvard alum praises Trump admin targeting university admissions policies, handling of antisemitism","<p>The Trump administration has launched two new probes into <a href=""https://www.foxnews.com/politics/trump-administration-sues-harvard-over-alleged-failure-protect-jewish-israeli-students-seeks-billions"" rel=""noopener"" target=""_blank"">Harvard University</a> as it continues to hold the institution accountable for alleged violations of Title VI of the Civil Rights Act. One probe is focused on the handling of antisemitism on campus, while the other alleges that the university has used ""illegal race-based preferences in admissions"" in violation of the Supreme Court's ruling on Students for Fair Admissions v. Harvard.</p><p>In addition to the probes, the Department of Education's <a href=""https://www.foxnews.com/category/us/education/dept-of-education"" rel=""noopener"" target=""_blank"">Office for Civil Rights</a> (OCR) issued a Letter of Impending Enforcement Action to Harvard over the university's refusal to provide the government with requested information on its admissions process. This follows a review that the OCR opened in May 2025 to determine if the university was still using racial preferences in its undergraduate admissions process.</p><p>""Harvard University should know better. Its name will always be tied to the landmark Supreme Court case that found sweeping racial discrimination in admissions and the campus has been in the spotlight for tolerating egregious antisemitic harassment for years now,"" Education Secretary Linda McMahon said in a statement.</p><p>Harvard has been given 20 calendar days to comply with the OCR's information requests. If it fails to do so, the university could face enforcement actions, including a DOJ referral, according to the Education Department.</p><p><a href=""https://www.foxnews.com/us/harvard-student-says-jewish-classmates-feel-unwelcome-multibillion-dollar-doj-lawsuit-looms"" rel=""noopener"" target=""_blank""><strong>HARVARD STUDENT SAYS JEWISH CLASSMATES FEEL 'UNWELCOME' AS MULTIBILLION DOLLAR DOJ LAWSUIT LOOMS</strong></a></p><p>Alexander Kestenbaum, also known as ""Shabbos,"" commended the Trump administration for launching the probe, saying that to him, it represented ""promises made, promises kept.""</p><p>""I think it's quite astounding that Harvard University knew that the Trump administration was going to investigate them for their civil rights violations and rather than cooperating to reach some sort of settlement negotiation or understanding, they dug deeper, and they refuse to cooperate with the federal government to ensure that no student is having their civil rights violated,"" Kestenbaum told Fox News Digital.</p><p>""I've got to say, Harvard is fighting the Trump administration far greater and with more alacrity than they ever fought against antisemitism, against anti-Asian discrimination, against the discrimination against White Christian men. So, I think it sort of underscores their priorities and their values,"" the Harvard alumnus added.</p><p><a href=""https://www.foxnews.com/media/harvard-kennedy-school-announces-layoffs-after-trump-cuts-billions-funding"" rel=""noopener"" target=""_blank""><strong>HARVARD KENNEDY SCHOOL ANNOUNCES LAYOFFS AFTER TRUMP CUTS BILLIONS IN FUNDING</strong></a></p><p>Kestenbaum is no stranger to <a href=""https://www.foxnews.com/category/us/campus-controversy"" rel=""noopener"" target=""_blank"">legal entanglements with Harvard</a>. He and other students sued the university over its alleged lack of action against antisemitism. Harvard and Kestenbaum reached a confidential settlement in May 2025.</p><p>""I'm very proud that we play a small role in this. I'm proud of the fact that <a href=""https://www.foxnews.com/category/politics/justice-department"" rel=""noopener"" target=""_blank"">the DOJ</a> has constantly cited Kestenbaum v. Harvard,"" he told Fox News Digital. ""I'm honored that we can have these conversations with the DOJ, with the Department of Education, the members of the White House who are seriously concerned about the treatment of American students at the hands of these far-left institutions like Harvard and Columbia and elsewhere.""</p><p>Following Hamas' Oct. 7 massacre and the launch of the resulting war, anti-Israel agitators began demonstrating on university campuses across the U.S., including Harvard. The university's then-President Claudine Gay, was grilled by a congressional committee about rising antisemitism on campus.</p><p>In an infamous moment during the <a href=""https://www.youtube.com/watch?v=5VtAZBvmzcQ"" rel=""noopener nofollow"" target=""_blank"">December 2023 hearing</a>, Gay was asked by Rep. Elise Stefanik whether calling for the genocide of Jews violated Harvard's rules on bullying and harassment, and answered that ""it can be, depending upon the context."" Gay later apologized in an interview with <a href=""https://www.thecrimson.com/article/2023/12/8/gay-apology-congressional-remarks/"" rel=""noopener nofollow"" target=""_blank"">The Harvard Crimson</a>, saying that ""when words amplify distress and pain, I don’t know how you could feel anything but regret.""</p><p>Gay resigned from her post in January 2024 following the tense hearing. At the time, she also faced allegations of plagiarism.</p><p>When asked about Harvard's seemingly unchanged conduct, Kestenbaum said ""poor leadership"" was to blame. He said that no one from the university had been able to explain why the university had asked Gay to return to the classroom. He also claimed that university faculty had been adamantly against Harvard President Alan Garber negotiating with the Trump administration.</p><p><a href=""https://www.foxnews.com/politics/us-judge-says-trump-unlawfully-axed-more-than-2-billion-harvard-funds"" rel=""noopener"" target=""_blank""><strong>US BLOCKS TRUMP ATTEMPT TO FREEZE MORE THAN $2 BILLION IN HARVARD FUNDS</strong></a></p><p>Recently, Harvard University earned a ""C"" on the Anti-Defamation League's (ADL) Campus Antisemitism Report Card. The ADL gave the prestigious university good marks on ""publicly disclosed administrative actions"" and ""Jewish life on campus."" However, Harvard received a ""medium"" score for ""campus conduct and climate concerns.""</p><p>Kestenbaum told Fox News Digital that, while he has graduated and left campus, students who are still there have told him that they are thankful for the Trump administration's actions, but cannot express that sentiment on campus. He said that this is not new, and that when he filed his lawsuit, there were students who wanted to tell their stories, but decided not to out of fear of professional blowback and social isolation.</p><p>""A lot of students will self-censor, and so they don't publicly admit how they really feel politically, but many are tremendously grateful to the administration for getting this university in check,"" he said.</p><p>Kestenbaum called for the government to ""withhold every last penny from Harvard University,"" saying that it was ""an embarrassment that billions of dollars in American taxpayer funds are still being used to fund an institution that also discriminates against said American taxpayers.""</p><p>Fox News Digital reached out to Harvard for comment.</p>",https://www.foxnews.com/media/harvard-alum-praises-trump-admin-targeting-university-admissions-policies-handling-antisemitism,2026-04-06
