,title,text,link,publish_date
9,Political traffic signals: waiting for the light to change on the Hill,"<p>A phalanx of reporters and photographers trailed House Budget Committee Chairman Jodey Arrington, R-Texas, out of the Capitol and across the Capitol grounds last Thursday morning.</p><p>The <a href=""https://www.foxnews.com/category/person/donald-trump"" rel=""noopener"" target=""_blank"">Trump administration</a> planned to ask Congress for an additional $200 billion to cover the cost of the war in Iran. Passing such a plan might be dicey. Especially vaulting the 60 vote barricade in the Senate. But House Speaker Mike Johnson, R-La., and Arrington were already touting a ""reconciliation"" bill for this year to approve some of the GOP’s domestic policy priorities ahead of the midterms. Reconciliation is inoculated from a Senate filibuster. And other Republicans may be on board with the extra $200 billion if it’s tucked into a reconciliation package which tackles other subjects.</p><p>""I think reconciliation is probably going to be the only vehicle that we put anything in because <a href=""https://www.foxnews.com/category/us/democratic-party"" rel=""noopener"" target=""_blank"">the Democrats</a> aren't going to support it,"" said Arrington, briskly traversing a set of congressional steps near the plaza, bound for Independence Avenue. ""I don't think they'll support the supplemental for the operating needs for our military while they're in conflict.""</p><p>""The Senate seems kind of suspect of trying to do this,"" yours truly followed up as the gaggle of reporters and photographers trekked the Capitol grounds toward the street.</p><p><a href=""https://www.foxnews.com/politics/pentagon-seeks-least-200b-from-congress-iran-war"" rel=""noopener"" target=""_blank""><strong>PENTAGON SEEKS AT LEAST $200B FROM CONGRESS FOR IRAN WAR</strong></a></p><p>""The Senate is going to be suspect and slow to be motivated. Which is why the House is the little engine that can. And when the little engine that can, does, then the Senate and other people follow. The House has to lead,"" replied Arrington. ""We led in the first reconciliation bill. It wouldn't have been as big or beautiful if we didn't do our job on the tax cuts. On the spending cuts. On the energy reforms. On the generational welfare reforms.""</p><p>The scrum edged closer to Independence Avenue in the shadow of the Longworth House Office Building.</p><p>""I’ve got to walk across here. I'm late for a meeting. Y'all can follow me,"" instructed Arrington, to the press, pivoting into the crosswalk just as the traffic light changed to green.</p><p><a href=""https://www.foxnews.com/politics/hitchhikers-guide-congress-options-hamstringing-trumps-war-powers-iran"" rel=""noopener"" target=""_blank""><strong>THE HITCHHIKER'S GUIDE TO CONGRESS' OPTIONS ON HAMSTRINGING TRUMP'S WAR POWERS IN IRAN</strong></a></p><p>Three journalists followed the <a href=""https://www.foxnews.com/category/us/us-regions/southwest/texas"" rel=""noopener"" target=""_blank"">Texas Republican</a> into the street. However, your trusty journalist (and Wayne Elementary School Safety Town participant) remained on the corner.</p><p>Two cars and a bus accelerated.</p><p>""Wait! Careful! Careful! Careful! Careful! Careful! Careful!"" I hollered.</p><p>Arrington and the others scurried back to the curb.</p><p>""See, you lead. They follow. But they may die,"" observed Arrington.</p><p>""Are you going to lead the Senate right into a crosswalk with traffic?"" I inquired.</p><p>Arrington pivoted – both back to the curb and to policy – as cars and scooters whizzed by.</p><p>""I think my counterpart, (Senate Budget Committee Chairman) Lindsey Graham, R-S.C., understands that the only train leaving the station for the bigger vision for our military will be a reconciliation bill,"" said Arrington.</p><p>It’s unclear whether Arrington switching to railroads and locomotives was the best rhetorical shift considering the close call on the street. But Arrington may be right. It will be challenging to pass anything substantial for the rest of this Congress. And perhaps zippering the $200 billion for the war into a reconciliation measure with other policy sweeteners could be the most palatable option to Republicans.</p><p>""We have to continue to look at offsetting,"" said Rep. Tony Wied, R-Wis.</p><p>""I think it should be offset,"" said Rep. Tim Burchett, R-Tenn.</p><p>""It is expensive,"" conceded House Veterans’ Affairs Committee Chairman Mike Bost, R-Ill., about the spending request.</p><p><a href=""https://www.foxnews.com/politics/reporters-notebook-gop-pushes-election-security-bill-despite-slim-odds-trump-pressure-looms"" rel=""noopener"" target=""_blank""><strong>REPORTER'S NOTEBOOK: GOP PUSHES ELECTION SECURITY BILL DESPITE SLIM ODDS, AS TRUMP PRESSURE LOOMS</strong></a></p><p>But offsets come from cuts. And lawmakers don’t like to slash programs important to their jurisdiction, state or district.</p><p>""A lot of the VA stuff, that’s like the third rail in politics. You don't cut that,"" said Bost.</p><p>What could contribute to an offset? Arrington suggested Republicans should turn to the time-tested Washington law firm of ""Waste, Fraud and Abuse"" to mitigate the cost of the war.</p><p><a href=""https://www.foxnews.com/category/person/alexandria-ocasio-cortez"" rel=""noopener"" target=""_blank"">Rep. Alexandria Ocasio-Cortez</a>, D-N.Y., replied ""no"" when asked about the supplemental spending request.</p><p>""It is skyrocketing prices of everything across the board, and Congress didn't even approve. And so to have the audacity to come to Congress to fund a war that we have not even voted for it – not only is it illegal, it is insulting,"" said Ocasio-Cortez.</p><p>I asked about whether it was dangerous for lawmakers to leave American troops in the lurch when they’re exposed to hostilities abroad.</p><p>""They should have thought about that before they entered a conflict without Congress,"" said Ocasio-Cortez. ""They told everybody that it was just a quick in and out strike and now they have found themselves in a disaster. And we cannot enable this kind of reckless and illegal behavior.""</p><p>Ocasio-Cortez is hinting at the ultimate Congressional authority: power of the purse. Lawmakers are charged with approving 12 spending bills to run the government each year. A supplemental spending package – say for war, terrorism, recovery from natural disasters or economic stimulus – is a ""13th"" spending bill. It’s plopped on top of the customary 12. Lawmakers could really hamstring the war in Iran if they decide to pull the funding.</p><p>The <a href=""https://www.foxnews.com/category/politics/executive/white-house"" rel=""noopener"" target=""_blank"">White House</a> scored about $1 trillion from Congress in Fiscal Year 2026 for the military. President Trump’s request for the Pentagon for Fiscal Year 2027 – still unapproved – is $1.5 trillion. That’s a 50 percent increase. That particular ask of Congress came before the $200 billion ask for the war in Iran.</p><p><a href=""https://www.foxnews.com/politics/dems-potential-2028-hopefuls-come-out-against-us-strikes-iran"" rel=""noopener"" target=""_blank""><strong>DEMS' POTENTIAL 2028 HOPEFULS COME OUT AGAINST US STRIKES ON IRAN</strong></a></p><p>The president has sent mixed signals as to whether the war is ""ending."" A reporter asked President Trump if he still needed the $200 billion.</p><p>""It's always nice to have. It's a very inflamed world. And the Democrats inflame it,"" replied the president.</p><p>But it’s generally believed that the Pentagon needs the money because it’s burned through so many munitions in Iran.</p><p>So this supplemental spending request must navigate the Congressional traffic.</p><p>Regular traffic and pedestrian signals switch on a regular basis. But not necessarily political signals. There’s no way right now for lawmakers to greenlight an extra $200 billion for the war. That’s because the ""don’t walk"" light is flashing.</p><p>The question now is how long it takes for the light to change. Or, if it will <i>ever</i> cycle through. Otherwise, Congressional leaders could put the bill on the floor – and get mowed down by a political bus.</p>",https://www.foxnews.com/politics/political-traffic-signals-waiting-light-change-hill,2026-03-23
10,Macaulay Culkin’s fiancée Brenda Song’s airline nightmare sparks debate after first-class seats given away,"<p>Macaulay Culkin's fiancée Brenda Song called out <a href=""https://www.foxnews.com/category/controversies"" rel=""noopener"" target=""_blank"">Alaska Air</a><a href=""https://www.foxnews.com/category/travel/general/airlines"" rel=""noopener"" target=""_blank"">lines</a> following a bad travel experience with their family.</p><p>The 37-year-old actress, who shares sons Dakota, 4, and Carson, 3, with the 45-year-old ""Home Alone"" star took to social media on Saturday to blast the airline, which she claimed gave away their pre-booked first-class seats unexpectedly on the day of their flight. Song said that due to the seat change, she and Culkin were <a href=""https://www.foxnews.com/travel/family-outraged-after-major-airline-seats-toddler-apart-from-parents-sparking-viral-debate"" rel=""noopener"" target=""_blank"">separated from their two young</a> children during the trip.</p><p>""I didn’t know when you book your first class tickets 6 months in advance for your family … @alaskaair can just give away your seats the morning of with no warning splitting up you and your 3 and 4 year old kids,"" Song wrote in a post shared on her Instagram Story.</p><p>""We will never fly @alaskaair again and neither should you,"" ""The Suite Life of Zack &amp; Cody"" alum declared, tagging her fiancé.</p><p><a href=""https://www.foxnews.com/entertainment/macaulay-culkin-keeps-his-home-alone-identity-secret-from-his-kids-adorable-reason"" rel=""noopener"" target=""_blank""><strong>MACAULAY CULKIN KEEPS HIS 'HOME ALONE' IDENTITY SECRET FROM HIS KIDS FOR ADORABLE REASON</strong></a></p><p>Culkin expressed his support for his fiancée's frustration, reposting her message on his Instagram Story and jokingly writing, ""Hell hath no fury like a Brenda scorned…""</p><p>Fox News Digital has reached out to representatives for Song and Culkin for comment. </p><p>In a statement to Fox News Digital, a representative for Alaska Airlines said, ""The experience these guests had today was unacceptable and not reflective of the care we strive to deliver. We have reached out to the family to make it right."" </p><p>""Traveling can be stressful, especially with young children, and we pride ourselves on being a top airline for families,"" the spokesperson continued. ""We are deeply sorry for adding friction to the experience. We appreciate that guests have a choice in the airline they select and we take our responsibility seriously to deliver a safe, reliable, and caring experience every single time.""</p><p><a href=""https://www.foxnews.com/travel/budget-airline-blasted-viral-video-perfect-honeymoon-week-ends-travel-chaos"" rel=""noopener"" target=""_blank""><strong>BUDGET AIRLINE BLASTED IN VIRAL VIDEO AS ‘PERFECT HONEYMOON WEEK’ ENDS IN TRAVEL CHAOS</strong></a></p><p>Song's post sparked a divided reaction online, with many fans supporting the actress's frustration while others dismissed the situation as overblown.</p><p>""Brenda has a reason to be upset, these are the tickets she paid for and most of all she didn’t want to be apart from her kids,"" one social media user wrote on X, formerly Twitter.</p><p>""If you’ve paid for them, how can they give them away? I’d be angry too,"" another added.</p><p>""Every parent felt that Instagram Story,"" one fan wrote. ""Booking 6 months in advance for your kid's birthday just to be split up is a nightmare. Brenda's right to call it out, and Mac’s 'Brenda scorned' joke was the perfect touch of humor to a stressful situation.""</p><p>""Apologies after the fact from Alaska Air means c--p,"" another chimed in. ""What they did was cruel and unusual punishment to those people. Seriously? They purchased them six months in advance and then just ripped away?""</p><p><a href=""https://www.foxnews.com/travel/flyers-warn-air-travel-becoming-unbearable-passenger-seats-keep-shrinking"" rel=""noopener"" target=""_blank""><strong>FLYERS WARN AIR TRAVEL IS BECOMING UNBEARABLE AS PASSENGER SEATS KEEP SHRINKING</strong></a></p><p>Meanwhile, several critics mocked Song's complaint as out of touch.</p><p>""It's absolutely astounding to me that celebrities think we give AF about their everyday problems,"" one X user wrote. ""Whether she's right to be unhappy or not, its not worth broadcasting when you live a life of luxury. STFU""</p><p>""Boo f---ing hoo seriously get over yourself and this #nothingburger,"" another commented.</p><p>""OMG. How did they survive!"" one critic added.</p><p><a href=""https://www.foxnews.com/category/entertainment/events/couples"" rel=""noopener"" target=""_blank"">Culkin and Song</a> first met in 2014 at a mutual friend's house, but reconnected and began a romantic relationship in 2017 when they were both cast in the 2019 comedy ""Changeland.""</p><p>The pair <a href=""https://www.foxnews.com/category/entertainment/genres/family"" rel=""noopener"" target=""_blank"">welcomed Dakota in April</a> 2021 and Carson in December 2022. They later went on to get engaged in January 2022, with a source telling <a href=""https://people.com/movies/macaulay-culkin-brenda-song-engaged/"" rel=""nofollow noopener"" target=""_blank""><u>People</u></a> at the time the couple was ""excited for their future together."" </p><p>After years in the entertainment industry, Culkin was honored with a star on <a href=""https://www.foxnews.com/entertainment/home-alone-star-macaulay-culkin-reflects-child-stardom-walk-of-fame-ceremony"" rel=""noopener"" target=""_blank""><u>the Hollywood Walk of Fame</u></a> in December 2023.</p><p><a href=""https://www.foxnews.com/newsletters?cmpid=fnfirstnl"" rel=""noopener"" target=""_blank""><strong>CLICK HERE TO SIGN UP FOR THE ENTERTAINMENT NEWSLETTER</strong></a></p><p>While accepting the honor on stage, he thanked Song for being her ""champion,"" adding, ""You're the only person happier for me today than I am.""</p><p>""You're the best woman I've ever known. You're the best person I've ever known,"" he said. ""You've given me all my purpose. You've given me family. And after the birth of our two boys, you've become one of my three favorite people.""</p><p><a href=""https://www.foxnews.com/entertainment"" rel=""noopener"" target=""_blank""><strong>LIKE WHAT YOU’RE READING? CLICK HERE FOR MORE ENTERTAINMENT NEWS</strong></a></p><p>During a 2025 interview with<a href=""https://people.com/brenda-song-reveals-her-biggest-vacation-splurge-citi-exclusive-11855549"" rel=""nofollow noopener"" target=""_blank""> People magazine</a>, Song said that she, Culkin and their children have come to really enjoy <a href=""https://www.foxnews.com/category/travel/general/family-travel"" rel=""noopener"" target=""_blank"">traveling together as a family</a>, especially since her sons are older now. </p><p>""We went on a trip to Hawaii this past summer, and it was just so much fun, simply because I think my boys are at an age now where they can actually enjoy it,"" the ""Running Point"" actress said. ""They were at the beach every day, riding bikes, doing all of the activities, and it was really special. My parents were there, and so to me that felt like our first family vacay, a proper one.""</p><p>Song also shared that she loves planning future trips and would love to <a href=""https://www.foxnews.com/category/world/world-regions/japan"" rel=""noopener"" target=""_blank"">visit Fiji or Japan</a>. She explained that and that one of her favorite parts of traveling is simply trying different foods wherever she goes.</p><p>""I spend a lot of time in Paris and I love French cuisine, and so we had an incredible, I almost want to call it omakase, but it's a tasting menu that just blew my mind,"" she said. ""It was at Joël Robuchon's restaurant and it was just the first time that I had French food.""</p>",https://www.foxnews.com/entertainment/macaulay-culkins-fiancee-brenda-songs-airline-nightmare-sparks-debate-after-first-class-seats-given-away,2026-03-23
11,"Trump's death will be 'like Mardi Gras in New Orleans,' Charlamagne warns after Mueller post","<p>Radio host Charlamagne Tha God warned President Donald Trump on Monday that people would celebrate his death ""like Mardi Gras in New Orleans"" after his post on former FBI director <a href=""https://truthsocial.com/@realDonaldTrump/posts/114963263700328714"" rel=""noopener"" target=""_blank"">Robert Mueller's death</a>.</p><p>""<a href=""https://www.youtube.com/watch?v=MHhYuyKasb4"" rel=""nofollow noopener"" target=""_blank"">The Breakfast Club</a>"" co-host reacted to Trump's controversial Truth Social post after learning about Mueller's death on Saturday.</p><p>""Good, I’m glad he’s dead. He can no longer hurt innocent people!"" <a href=""https://truthsocial.com/@realDonaldTrump/posts/116268334535345382"" rel=""nofollow noopener"" target=""_blank"">Trump wrote</a>.</p><p>Charlamagne accused Trump of hypocrisy after previously cracking down on foreign nationals who openly <a href=""https://www.foxnews.com/politics/trump-admin-cracks-down-foreigners-who-celebrated-charlie-kirks-killing-dangerous-practice"" rel=""noopener"" target=""_blank"">celebrated the death</a> of Charlie Kirk in September and predicted the president's post could further tarnish his legacy.</p><p><a href=""https://www.foxnews.com/media/charlamagne-fires-back-after-trumps-social-media-attack-calls-him-racist-sleazebag"" rel=""noopener"" target=""_blank""><strong>CHARLAMAGNE FIRES BACK AFTER TRUMP'S SOCIAL MEDIA ATTACK CALLS HIM A 'RACIST SLEAZEBAG'</strong></a></p><p>""I mean, you’ve already ruined yours because you’re, you know, going to go down as the worst president of all time because you don’t give a damn about democracy, wiping your a-- with the Constitution, and on pace to lead this country into the worst financial crisis of all time,"" Charlamagne said. ""But you are also putting yourself into a position that when you pass, people are going to treat it like Mardi Gras in New Orleans.""</p><p>He continued, ""The celebrations folks are going to have, the things people are going to say about you when you pass. Mr. President, I don’t care about how many buildings you put your name on, bridges, tunnels, they can create holidays. None of that will matter because you have hurt way too many people. And more importantly, you get back the energy you put out. Do you care? Do you care what Barron sees about you after you pass? Do you care what Melania sees about you after you pass? What about your grandkids?""</p><p><a href=""https://www.foxnews.com/media/maddow-rebukes-robert-muellers-legacy-wildly-outmaneuvered-following-his-death-81"" rel=""noopener"" target=""_blank""><strong>MADDOW REBUKES ROBERT MUELLER’S LEGACY AS 'WILDLY OUTMANEUVERED' FOLLOWING HIS DEATH AT 81</strong></a></p><p>In a comment to <a href=""https://www.foxnews.com/media"" rel=""noopener"" target=""_blank"">Fox News Digital</a>, White House spokesperson Davis R. Ingle pointed to a Truth Social post from Trump in August calling Charlamagne a ""racist sleazebag"" and a ""low-IQ individual.""</p><p>""He’s a low-IQ individual, has no idea what words are coming out of his mouth, and knows nothing about me or what I have done - like just ending 5 Wars, including a 31 year bloodbath between Republic of the Congo and Rwanda, where Seven Million people have died, and there was no end in sight. He didn’t know that, or India and Pakistan or, wiping out Iran’s nuclear capabilities, or closing the horrendous open Border, or creating the greatest economy, where prices and Inflation have come way down, and where STUPID and CORRUPT JOE BIDEN set the record for doing the Worst Job as President, EVER,"" <a href=""https://truthsocial.com/@realDonaldTrump/posts/114963263700328714"" rel=""nofollow noopener"" target=""_blank"">Trump wrote</a>.</p><p>Mueller led the FBI from 2001 to 2013 and later served as special counsel investigating Russian interference in the 2016 election, a probe that overshadowed much of Trump’s first term.</p><p><a href=""https://www.foxnews.com/media/maine-high-school-teacher-calls-deaths-trump-his-supporters-facebook-posts"" rel=""noopener"" target=""_blank""><strong>MAINE HIGH SCHOOL TEACHER CALLS FOR DEATHS OF TRUMP AND HIS SUPPORTERS IN FACEBOOK POSTS</strong></a></p><p>Mueller brought charges against multiple Trump associates during the <a href=""https://www.foxnews.com/politics/doj-subpoenas-ex-fbi-director-james-comey-over-role-2017-russia-intel-assessment"" rel=""noopener"" target=""_blank""><u>Russia investigation</u></a>, including former campaign chairman Paul Manafort and former national security advisor Michael Flynn.</p><p>His final report detailed extensive contacts between the Trump campaign and Russian individuals but did not establish a criminal conspiracy.</p>",https://www.foxnews.com/media/trumps-death-like-mardi-gras-new-orleans-charlamagne-warns-after-mueller-post,2026-03-23
