,title,text,link,publish_date
12,Blake Lively breaks silence after judge dismisses sexual harassment claims in Baldoni lawsuit,"<p><a href=""https://www.foxnews.com/category/person/blake-lively"" rel=""noopener"" target=""_blank"">Blake Lively</a> is breaking her silence after a New York City judge tossed out her sexual harassment claims against Justin Baldoni on Thursday.</p><p>Judge Lewis J. Liman dismissed Lively's sexual harassment, defamation, conspiracy and Title VII claims against Baldoni. Two retaliation claims and a breach of contract claim still remain as the former co-stars prepare for trial.</p><p>The ""Gossip Girl"" star shared her reaction to the judge's decision in a lengthy post on her Instagram stories.</p><p>""I'm grateful for the Court's ruling, which allows the heart of my case to be presented to a jury next month, and for the ability to finally tell my story in full at trial, for my own sake, but also for those who don't have the same opportunity to... many of whom I have known and loved deeply in my life, and the countless I'll never know,"" she wrote.</p><p><a href=""https://www.foxnews.com/entertainment/justin-baldonis-400m-lawsuit-against-blake-lively-ends-financial-fight-still-looms"" rel=""noopener"" target=""_blank""><strong>JUSTIN BALDONI'S $400M LAWSUIT AGAINST BLAKE LIVELY ENDS AS FINANCIAL FIGHT STILL LOOMS</strong></a></p><p>She went on to say that a lawsuit was ""last thing I wanted in my life,"" but that she decided to move forward with it due to ""the pervasive RETALIATION"" she experienced and continues to face for ""privately and professionally asking for a safe working environment for myself and others.""</p><p>In her lawsuit, Lively alleges Baldoni executed and participated in a ""social manipulation"" campaign in an effort to ""destroy"" her career and reputation. </p><p>Lively added that she ""hopes the court's decision"" will help show others, that no matter how ""unfathomably painful"" it may be, ""you can speak up.""</p><p>""Don't be distracted by the digital soap opera. The constant packaging of this lawsuit as a 'celebrity drama' is not only irresponsible, but it is by design: to keep you from seeing yourselves in my story,"" she said. ""The physical pain from <a href=""https://www.foxnews.com/category/health/education/bullying"" rel=""noopener"" target=""_blank"">digital violence</a> is very real. It is abuse. And it's everywhere. Not just in the news, but in your communities and schools.""</p><p><a href=""https://www.foxnews.com/entertainment/blake-livelys-private-voice-message-justin-baldoni-emerges-legal-fight-escalates"" rel=""noopener"" target=""_blank""><strong>BLAKE LIVELY'S PRIVATE VOICE MESSAGE TO JUSTIN BALDONI EMERGES AS LEGAL FIGHT ESCALATES</strong></a></p><p>The ""A Simple Favor"" star warned her followers that ""digital warfare"" is not only a problem celebrities will have to face, saying ""my claims won't be the first or last time you'll see,"" something like this occur, adding that ""often won't be directed at celebrities,"" but is something that ""affects us all.""</p><p>Having said that, she urged her followers to ""pay attention to all the ways we can be manipulated online,"" especially ""if you have kids on phones,"" saying they are the ""most vulnerable"" and need to be protected.</p><p>""So much critical work has already been done to expose systems, tactics, and players who harm,"" she said. ""The work to create more safety is in part at trial, but it [will also] continue far after this trial is over. This is the work I'm most proud of.""</p><p>""I couldn't begin to stand up if not for the countless who've gone before me — and the masses who are still around us all — creating laws, social change, sparking conversations, rallying, working privately and publicly, risking and sometimes losing everything for the safety of others in all spaces. Some whose names we know, most we don't. Thank you. All of you.""</p><p><a href=""https://www.foxnews.com/entertainment/blake-lively-admits-suffering-lowest-lows-her-life-she-battles-justin-baldoni-lawsuit"" rel=""noopener"" target=""_blank""><strong>BLAKE LIVELY ADMITS TO SUFFERING 'LOWEST LOWS' OF HER LIFE AS SHE BATTLES JUSTIN BALDONI LAWSUIT</strong></a></p><p>Lively ended her statement by ensuring her followers that she ""will never stop doing my part in fighting to expose the systems and people who seek to harm, shame, silence, and retaliate against victims.""</p><p>""I know it's a privilege to be able to stand up. I will not waste it. Your support keeps me going,"" she concluded.</p><p>Baldoni and Lively became embroiled in a <a href=""https://www.foxnews.com/entertainment/justin-baldonis-lawsuit-against-blake-lively-dismissed"" rel=""noopener"" target=""_blank"">legal back-and-forth after</a> filming the Colleen Hoover-adapted film, ""It Ends With Us."" </p><p>Lively claimed she experienced sexual harassment on set and sued Baldoni in December 2024.</p><p>Baldoni and Lively are still headed to trial, with the legal battle kicking off May 18.</p><p><a href=""https://www.foxnews.com/entertainment/blake-lively-details-pain-lawsuit-battle-after-judge-dismisses-justin-baldonis-claims-against-her"" rel=""noopener"" target=""_blank""><strong>JUSTIN BALDONI'S ATTORNEY CALLS BLAKE LIVELY'S VICTORY CLAIMS 'FALSE' AFTER COURT DISMISSES LAWSUIT</strong></a></p><p>Following the judge's decision on Thursday, Sigrid McCawley, a member of Lively’s legal team, told Fox News Digital, that ""this case has always been and will remain focused on the devastating retaliation"" Lively faced.</p><p><a href=""https://www.foxnews.com/newsletters?cmpid=fnfirstnl"" rel=""noopener"" target=""_blank""><strong>CLICK HERE TO SIGN UP FOR THE ENTERTAINMENT NEWSLETTER</strong></a></p><p>""For Blake Lively, the greatest measure of justice is that the people and the playbook behind these coordinated digital attacks have been exposed and are already being held accountable by other women they’ve targeted. She looks forward to <a href=""https://www.foxnews.com/category/entertainment/events/in-court"" rel=""noopener"" target=""_blank""><u>testifying at trial</u></a> and continuing to shine a light on this vicious form of online retaliation so that it becomes easier to detect and fight,"" she continued.</p><p>""Sexual harassment isn’t going forward not because the defendants did nothing wrong but because the court determined Blake Lively was an independent contractor, not an employee,"" McCawley concluded.</p><p><a href=""https://www.foxnews.com/entertainment"" rel=""noopener"" target=""_blank""><strong>LIKE WHAT YOU’RE READING? CLICK HERE FOR MORE ENTERTAINMENT NEWS</strong></a></p><p>Wayfarer Studios also shared a statement with Fox News Digital after the judge's ruling.</p><p>""We’re very pleased the Court dismissed all sexual harassment claims and every claim brought against the individual defendants: <a href=""https://www.foxnews.com/entertainment/justin-baldoni-calls-blake-livelys-claims-false-destructive-lawyer-says-new-lawsuit-expose-truth"" rel=""noopener"" target=""_blank"">Justin Baldoni</a>, Jamey Heath, Steve Sarowitz, Melissa Nathan and Jennifer Abel. These were very serious allegations, and we are grateful to the Court for its careful review of the facts, law and voluminous evidence that was provided,"" a statement provided by Alexandra Shapiro and Jonathan Bach of Shapiro Arato Bach said.</p>",https://www.foxnews.com/entertainment/blake-lively-breaks-silence-judge-dismisses-sexual-harassment-claims-baldoni-lawsuit,2026-04-04
13,"HBO star Hannah Einbinder lashes out at AI creators in Hollywood, says 'I want to put your head in the toilet’","<p>HBO star Hannah Einbinder lashed out at Hollywood <a href=""https://www.foxnews.com/category/tech/artificial-intelligence"" rel=""noopener"" target=""_blank"">AI creators</a> during a recent press conference discussing the final season of the show ""Hacks.""</p><p>""The people who make this stuff are losers. They’re not artists. They’re not creative,"" Einbinder said, according to <a href=""https://variety.com/2026/tv/news/hannah-einbinder-ai-creators-losers-1236706302/"" rel=""nofollow noopener"" target=""_blank"">Variety Magazine</a>.</p><p>""And they’ve wanted their whole lives to be special. And they’re not special. So, they’re trying to rob real creative people of our gifts. And you can’t. And even if you try, you will never be cool,"" her takedown continued.</p><p><a href=""https://www.foxnews.com/media/far-left-podcaster-goes-profane-anti-ice-anti-trump-rant-after-winning-glaad-award"" rel=""noopener"" target=""_blank""><strong>FAR-LEFT PODCASTER GOES ON PROFANE ANTI-ICE, ANTI-TRUMP RANT AFTER WINNING GLAAD AWARD</strong></a></p><p>""You guys suck. No one likes you. Anyone who’s near you is because they crave power and access over any ethical standard. You are a loser. You will never be cool."" She added, ""I want to put your head in the toilet and flush."" </p><p><a href=""https://www.foxnews.com/media/south-park-responds-dhs-after-department-uses-show-recruit-ice-agents"" rel=""noopener"" target=""_blank""><strong><u>SOUTH PARK RESPONDS TO DHS AFTER DEPARTMENT USES SHOW TO RECRUIT ICE AGENTS</u></strong></a></p><p>Einbinder has a history of outspokenness, recently warning Americans that ""none of us are safe"" after the <a href=""https://www.foxnews.com/entertainment/comedian-minnesota-venue-cancels-shows-mocked-renee-good"" rel=""noopener"" target=""_blank"">fatal shooting of Renee Nicole Good</a> by an <a href=""https://www.foxnews.com/category/us/immigration/enforcement"" rel=""noopener"" target=""_blank""><u>Immigration and Customs Enforcement</u></a> (ICE) officer in <a href=""https://www.foxnews.com/category/us/minneapolis-st-paul"" rel=""noopener"" target=""_blank"">Minneapolis in January</a>.</p><p>As <a href=""https://deadline.com/2026/01/hannah-einbinder-abolish-ice-renee-good-killing-1236678374/"" rel=""nofollow noopener"" target=""_blank""><u>reported by Deadline</u></a>, Einbinder attacked the <a href=""https://www.foxnews.com/category/politics"" rel=""noopener"" target=""_blank"">federal agency</a> in a since-deleted Instagram post, asserting that carrying on ""business as usual"" after Good's death would be a ""collective death sentence"" for the country.</p><p><a href=""https://www.foxnews.com/media/colbert-wins-emmy-late-show-after-cancellation-says-loves-country-more-ever"" rel=""noopener"" target=""_blank""><strong><u>COLBERT WINS EMMY FOR 'LATE SHOW' AFTER CANCELLATION, SAYS HE LOVES HIS COUNTRY MORE THAN EVER</u></strong></a></p><p>She also used to post to make broader commentary about issues she believed were negatively affecting the country and make a call to action to fight what she views as injustice.</p><p><a href=""https://www.foxnews.com/media"" rel=""noopener"" target=""_blank""><strong>CLICK HERE FOR MORE COVERAGE OF MEDIA AND CULTURE</strong></a></p><p>Einbinder additionally denigrated ICE officers at last year's Emmys Awards, concluding her speech for Best Supporting Actress in a Comedy Series by saying, ""F--- ICE and free Palestine!""</p><p><i>Fox News' Marc Tamasco and Lindsay Kornick contributed to this report.</i></p>",https://www.foxnews.com/media/hbo-star-hannah-einbinder-lashes-ai-creators-hollywood-says-want-put-head-toilet,2026-04-04
14,TEVI TROY: Trump faces the burdens of a wartime presidency,"<p>America’s war with the mullahs of Tehran is into its second month and it has already changed <a href=""https://www.foxnews.com/category/person/donald-trump"" rel=""noopener"" target=""_blank"">Donald Trump</a>’s presidency in important ways. As the president considers how to navigate these new dynamics, it’s worth considering the experience of some previous presidents who entered office not expecting to be wartime presidents.</p><p>Woodrow Wilson ended a four-cycle Republican winning streak by winning the three-way election of 1912. He did so because his two opponents, former president Teddy Roosevelt and incumbent president William Howard Taft, split the Republican vote. As president, Wilson embarked on an aggressive progressive domestic policy agenda. Things changed when World War One broke out in Europe midway through Wilson’s first term. Wilson then ran for reelection in 1916 promising to keep America out of the conflict, even using the slogan ""He kept us out of war."" He did not keep that promise, though, as America entered the war in 1917, during the first year of his second term.</p><p>Franklin Roosevelt was elected in 1932 to rescue the economy from the Great Depression. In his third term, he gained a new mission: fighting the Axis Powers and presiding over the <a href=""https://www.foxnews.com/category/topic/world-war-two"" rel=""noopener"" target=""_blank"">largest military mobilization</a> in American history. Roosevelt addressed this shift at a 1943 press conference where he explained the transition from ""Dr. New Deal"" to ""Dr. Win-the-War."" FDR’s quip highlighted the way his administration had to reorder itself to face the new challenge.</p><p>Lyndon Johnson came to office unexpectedly after the tragic assassination of John F. Kennedy. He took over in peacetime and began pursuing his dream of a Great Society — a sweeping domestic agenda to rival Roosevelt's New Deal.</p><p><a href=""https://www.foxnews.com/media/why-trump-iran-seem-light-years-apart-any-possible-deal-end-war"" rel=""noopener"" target=""_blank""><strong>WHY TRUMP, IRAN SEEM LIGHT-YEARS APART ON ANY POSSIBLE DEAL TO END THE WAR</strong></a></p><p>As he managed to pass his ambitious — and costly — domestic agenda, he soon found himself and his administration consumed by the conflict in Vietnam. The experience was so draining that by 1968, Johnson, who had spent his whole life pursuing the presidency, shocked the world by refusing to seek re-election.</p><p>In 2000, <a href=""https://www.foxnews.com/category/person/george-w-bush"" rel=""noopener"" target=""_blank"">George W. Bush</a> explicitly campaigned on pursuing a humble foreign policy, rejecting the nation-building missions of the <a href=""https://www.foxnews.com/category/person/bill-clinton"" rel=""noopener"" target=""_blank"">Bill Clinton</a> era. His ambition was to be the ""Education President."" Then, 19 militant jihadis from Al Qaeda struck America on September 11.  In response, Bush ordered the invasions of terror-supporting countries Afghanistan and then Iraq. As someone who served in that administration, the shift I saw was palpable. Bush had entered office with one kind of vision for his presidency, but history had a different idea entirely.</p><p>War reshapes more than just the man sitting behind the Resolute Desk. It changes <a href=""https://www.foxnews.com/category/us/education/administration"" rel=""noopener"" target=""_blank"">the teams around the president</a>. We saw this with the resignation of Trump’s counterterrorism director, Joe Kent. As the Kent episode showed, advisors who were in alignment before the shooting starts are not necessarily in alignment once fighting begins.</p><p><a href=""https://www.foxnews.com/opinion/destroy-regimes-power-without-occupying-iran-smarter-war-plan"" rel=""noopener"" target=""_blank""><strong>DESTROY THE REGIME’S POWER WITHOUT OCCUPYING IRAN: A SMARTER WAR PLAN</strong></a></p><p>This sort of thing has also happened in previous presidencies. In the early years of Wilson’s administration, Wilson was reliant on the advice of Texan political operative Colonel Edward House, who was so close to the president that he even lived in the White House. Things changed during the war, however, as internal critics in the State Department and the White House pushed back against House’s broad mandate managing the war.  Wilson and House also clashed over the Versailles Treaty, which led to a permanent end to their once close relationship.</p><p>As for Johnson, he was famously intolerant of internal dissent, and he drove away or silenced advisors who questioned his Vietnam strategy. Johnson pushed aside his defense secretary Robert McNamara — initially the face of the <a href=""https://www.foxnews.com/category/politics/defense/wars"" rel=""noopener"" target=""_blank"">Vietnam War</a>—after Johnson noticed and didn’t appreciate McNamara’s increasing skepticism of Johnson’s Vietnam policy. Johnson wanted — and got — an echo chamber, to his administration and to our nation’s detriment.</p><p>In the Bush administration, the Iraq war set off a bureaucratic civil war inside Bush’s national security team. This internal struggle led to the Valerie Plame affair, which brought about the indictment of Vice President Cheney’s top aide Scooter Libby after the exposure of the name of a covert CIA operative. Libby, however, had not leaked her name; his bureaucratic nemesis Dick Armitage was the leaker, and Armitage shamefully stayed silent about his role during the investigation. The episode showed the degree to which the higher stakes brought about by war can roil an administration, not to mention innocent lives.</p><p><a href=""https://www.foxnews.com/media/why-trump-faces-agonizing-decision-obliterating-irans-oil-supply-he-cant-get-deal"" rel=""noopener"" target=""_blank""><strong>WHY TRUMP FACES AN AGONIZING DECISION ON OBLITERATING IRAN’S OIL SUPPLY IF HE CAN’T GET A DEAL</strong></a></p><p>War also takes a personal toll on presidents. Sometimes it leads to behavioral changes. In 2003, Bush gave up playing golf, one of his few outlets for escaping the pressures of the presidency. He said years later that he was unwilling to be seen on the links while American soldiers were dying in Iraq. As he explained in 2008, ""I don’t want some mom whose son may have recently died to see the commander-in-chief playing golf."" It was a quietly devastating admission about the weight a wartime president carries every day.</p><p>In other cases, the toll of <a href=""https://www.foxnews.com/category/politics/elections/presidential"" rel=""noopener"" target=""_blank"">being president in wartime</a> has been even heavier. Wilson suffered a stroke while in Europe and was incapacitated for much of the rest of the administration; his team kept the American people in the dark as his wife Edith secretly managed things in the White House. Roosevelt died during his fourth term at 63. Those who saw him in his final days found him to be pale and depleted beyond his years. A visibly thinned Johnson, who left office at 60, died less than four years after exiting the White House.</p><p>While these examples may seem harrowing, there is one also instructive counterexample.</p><p>George H.W. Bush entered the Gulf War with a limited objective, built a broad international coalition for expelling Saddam Hussein from Kuwait, achieved that objective, and got out. Bush’s national security team was extraordinarily disciplined and cohesive. The war did not appear to fundamentally damage Bush’s presidency or his person. Yet even Bush could not escape the political gravity of wartime leadership — he was perceived as so focused on foreign affairs that he lost touch with a domestic economy in recession, leading to what many believed was highly improbable when Bush had a 91% approval rating on the way: His defeat at the hands of Bill Clinton in 1992.  </p><p>The lesson here is not that presidents should shrink from the use of force. President Trump has shown courage in taking on one of the most murderous and predatory regimes in the past half century. The decision to go to war is the most difficult decision a president must make. It costs lives and changes the world in unpredictable ways. And even before the end is reached, it changes the president, his staff, and his agenda, testing his character and taxing his body and soul in ways that cannot be fully anticipated.</p><p><a href=""https://www.foxnews.com/person/t/tevi-troy"" rel=""noopener"" target=""_blank""><strong><u>CLICK HERE TO READ MORE FROM TEVI TROY</u></strong></a></p>",https://www.foxnews.com/politics/tevi-troy-trump-faces-burdens-wartime-presidency,2026-04-04
