,title,text,link,publish_date
16,'Access Hollywood' canceled after 30 years,"<p>NBCUniversal is pulling the plug on ""Access Hollywood"" after nearly 30 years as part of its broader plan to tamp down its syndicated programming.</p><p>""NBCUniversal is making changes to our first-run syndication division to better align with the programming preferences of local stations,"" NBCUniversal executive Frances Berwick said in a statement. </p><p>""The company will remain active in the distribution of our existing program library and other off-network titles, while winding down production of our first-run shows. These shows have provided audiences with great talk and entertainment content for many years, and we’re very proud of the teams behind them.""</p><p>Mario Lopez, Kit Hoover, Scott Evans and Zuri Hall were the show's hosts.</p><p><a href=""https://www.foxnews.com/entertainment/mario-lopez-not-ashamed-faith-builds-spiritual-muscle-hollywood"" rel=""noopener"" target=""_blank""><strong>MARIO LOPEZ ‘NOT ASHAMED’ OF HIS FAITH AS HE BUILDS MORE ‘SPIRITUAL MUSCLE’ IN HOLLYWOOD</strong></a></p><p>""Access Hollywood"" first launched in 1996 and had a notable roster of anchors and correspondents throughout its decades-long run, including Pat O'Brien, Nancy O'Dell, Billy Bush, Jeff Probst, Shauna Robinson, Maria Menounos and Natalie Morales.</p><p>While the program covered the latest <a href=""https://www.foxnews.com/category/entertainment"" rel=""noopener"" target=""_blank"">entertainment news</a> and gossip about Hollywood's biggest stars, perhaps ""Access Hollywood"" is best known for being swept up in presidential politics during the 2016 election.</p><p><a href=""https://www.foxnews.com/media/billy-bush-rips-nbc-access-hollywood-sacrificed"" rel=""noopener"" target=""_blank""><strong>BILLY BUSH RIPS NBC OVER ‘ACCESS HOLLYWOOD TAPE FIRING: THEY ‘SACRIFICED ME’ FOR POLITICAL GAIN</strong></a></p><p>In what was widely dubbed an October surprise, The Washington Post published the now-infamous ""'Access Hollywood' tape"" from 2006 that captured a crass hot mic conversation between <a href=""https://www.foxnews.com/category/person/donald-trump"" rel=""noopener"" target=""_blank"">Donald Trump</a>, who at the time was host of NBC's ""The Apprentice,"" and Billy Bush while on a bus.</p><p>On the leaked tape, Trump was caught bragging about his ability to seduce women, telling Bush, ""When you're a star, they let you do it. You can do anything. ... Grab 'em by the p----. You can do anything.""</p><p>The tape caused panic within the Republican Party, sparking condemnation from members of Trump's own party, and calls for him to drop out of the the presidential race grew. Trump famously chalked up the conversation as ""locker room talk"" but issued an apology. </p><p>While many thought the tape would upend his candidacy, Trump persevered and defeated <a href=""https://www.foxnews.com/category/person/hillary-clinton"" rel=""noopener"" target=""_blank"">Hillary Clinton</a> in the election just days later. Notably, Bush was fired as co-host of ""Today"" as a result of the explosive leak.</p><p><a href=""https://www.foxnews.com/media"" rel=""noopener"" target=""_blank""><strong>CLICK HERE FOR THE LATEST MEDIA AND CULTURE NEWS</strong></a></p><p>Other programs being canceled in addition to ""Access Hollywood"" are ""Karamo"" and ""The Steve Wilkos Show.""</p><p>The cancellation comes just weeks after NBCUniversal announced ""<a href=""https://www.foxnews.com/entertainment/kelly-clarkson-ends-emmy-winning-talk-show-focus-kids-after-ex-husbands-death"" rel=""noopener"" target=""_blank"">The Kelly Clarkson Show</a>"" will end later this year.</p>",https://www.foxnews.com/media/access-hollywood-canceled-after-30-years,2026-03-13
17,"Formula 1 drops Bahrain, Saudi Arabia races amid escalating Iran war tensions: reports","<p>The fourth round of races in <a href=""https://www.foxnews.com/category/auto/formula-one"" rel=""noopener"" target=""_blank"">Formula 1’s</a> new season, scheduled for next month in Bahrain and Saudi Arabia, are no longer expected to proceed as planned.</p><p>ESPN, citing sources, reported that F1 officials agreed to cancel the events amid the ongoing conflict involving Iran. </p><p><a href=""https://x.com/SkyNews/status/2032486086463647756"" rel=""nofollow noopener"" target=""_blank"">Sky News</a> was first to report the cancellation.</p><p>The Bahrain race had been scheduled for April 12, while the event in Saudi Arabia was slated to begin on April 19 in the city of Jeddah. Bahrain and Saudi Arabia have both been hit by missile strikes during Iran’s retaliation after a series of U.S. and Israeli attacks on Iran. </p><p><a href=""https://www.foxnews.com/sports"" rel=""noopener"" target=""_blank""><strong>CLICK HERE FOR MORE SPORTS COVERAGE ON FOXNEWS.COM</strong></a></p><p>Although it remains unclear what state the conflict will be in around the dates the races were scheduled to begin, F1 teams would soon need to start sending freight to the region in preparation for both events. The condensed timeline likely prompted decision-makers to reach a conclusion now.</p><p>There is no word on whether the <a href=""https://www.foxnews.com/category/world/world-regions/middle-east"" rel=""noopener"" target=""_blank"">Middle East</a> races will be rescheduled for a later date. However, there is little room on the rest of this year’s calendar to move the events.</p><p>Given the uncertainty, F1 reportedly made the decision to avoid any disruption to the championship should a race be canceled later in the calendar.</p><p><a href=""https://www.foxnews.com/sports/liv-golfers-deal-terrifying-experience-middle-east-conflict-broke-out-iran"" rel=""noopener"" target=""_blank""><strong>LIV GOLFERS DEAL WITH 'TERRIFYING' EXPERIENCE IN MIDDLE EAST AS CONFLICT BROKE OUT IN IRAN</strong></a></p><p>The reduced 2026 schedule of 22 races also creates a five-week gap between the season’s third round in Japan and the Miami Grand Prix, scheduled for May 3.</p><p>A request for comment from Fox News Digital to Formula 1 was not immediately returned.</p><p>On Thursday, seven-time champion <a href=""https://www.foxnews.com/sports/lewis-hamilton-switch-gear-2025-race-ferrari-shock-move"" rel=""noopener"" target=""_blank"">Lewis Hamilton</a> said he was confident F1 would make the best decision. </p><p>""I know that [F1 CEO] Stefano [Domenicali] will do what is right for all of us and the sport,"" Hamilton said in the lead up to the Chinese Grand Prix. ""That is the great thing about having a great leader like him.""</p><p><i><strong>Follow Fox News Digital’s </strong></i><a href=""https://twitter.com/FoxNewsSports_"" rel=""nofollow noopener"" target=""_blank""><i><strong>sports coverage on X</strong></i></a><i><strong>, and subscribe to</strong></i><a href=""https://www.foxnews.com/newsletters"" rel=""noopener"" target=""_blank""><i><strong> the Fox News Sports Huddle newsletter</strong></i></a><i><strong>.</strong></i></p>",https://www.foxnews.com/sports/formula-1-drops-bahrain-saudi-arabia-races-amid-escalating-iran-war-tensions-reports,2026-03-13
18,Texas judge who played victim card booted from rodeo grounds a second time following VIP seating dispute,"<p>The judge who oversees the administration of Texas' largest county was escorted out of a popular rodeo venue Thursday for a second time after holding a news conference that was sparked by her removal <a href=""https://www.foxnews.com/us/texas-judge-tried-access-vip-area-houston-rodeo-concert-claims-racism-sexism-play"" rel=""noopener"" target=""_blank"">from a concert</a> earlier this week after attempting to access a VIP seating area without tickets. </p><p>Harris County Judge Lina Hidalgo held a brief news conference outside NRG Stadium, where she attempted to secure security camera footage of the incident, before she was once again escorted out of the Houston Livestock Show and Rodeo grounds, as she was Tuesday night, the Houston Chronicle reported. </p><p>The judge was escorted to her vehicle by a police detail Thursday after a rodeo spokesperson said she didn't have access to the rodeo grounds and was only permitted to briefly address reporters, the newspaper reported. </p><p><a href=""https://www.foxnews.com/media/jasmine-crockett-faces-criticism-from-black-democrats-after-losing-texas-senate-primary-race"" rel=""noopener"" target=""_blank""><strong>JASMINE CROCKETT FACES CRITICISM FROM BLACK DEMOCRATS AFTER LOSING TEXAS SENATE PRIMARY RACE</strong></a></p><p>Thursday's removal came after Hidalgo was escorted from the venue while attending a Megan Moroney concert while trying to access a premium seating area, despite not having tickets. </p><p>Hidalgo has since had her ""ex-officio director"" status removed by the Rodeo Houston executive committee, meaning she will have to pay to access rodeo grounds like everyone else, a spokesperson told Fox News Digital. </p><p>The move came after Hidalgo posted video and audio clips and a letter to rodeo leaders about what unfolded Tuesday night. She said she was manhandled and threatened <a href=""https://www.foxnews.com/category/crime"" rel=""noopener"" target=""_blank"">with arrest</a> after trying to access the concert's chute area. </p><p>Staffers told her she and her guests could not access the area because wristbands were sold out and that they would have to return to their suite. Hidalgo was then asked to leave and escorted out of the venue after being asked several times to return to her seating area, rodeo officials said. </p><p>Rodeo officials deny Hidalgo's mistreatment claims.</p><p><a href=""https://www.foxnews.com/politics/god-non-binary-texas-dem-nominee-talaricos-past-remarks-abortion-race-gender-draw-scrutiny"" rel=""noopener"" target=""_blank""><strong><u>‘GOD IS NON-BINARY’: TEXAS DEM NOMINEE TALARICO’S PAST REMARKS ON ABORTION, RACE AND GENDER DRAW SCRUTINY</u></strong></a></p><p>In a one-page letter to board officials, Hidalgo suggested that her treatment stemmed from her being a Hispanic woman. She claimed that White men have ""felt emboldened to treat others, particularly Hispanics, with physical force.""</p><p>""I don't travel without my passport anymore,"" she wrote. ""Many of us do, especially those of us who are not white-passing.""</p><p>Houston Livestock Show and Rodeo Chairwoman Pat Phillips and rodeo President Chris Boleman pushed back with their own letter.  </p><p>""We are very disappointed in Judge Hidalgo’s actions Tuesday night and since. But we must enforce the same access policies for everyone,"" they said. ""The Judge is the only elected official to request, even demand, these seats night after night. As Chairwoman of the Board, the idea that she was treated this way because she’s a woman or Hispanic is absolutely false and insulting.""</p><p>In addition, Rodeo officials said Hidalgo requested and was given $9,000 in floor access tickets for herself and her guests for three previous nights for concerts to see J Balvin, <a href=""https://www.foxnews.com/entertainment"" rel=""noopener"" target=""_blank""><u>Dwight Yoakam</u></a> and Luke Bryan.</p><p>On Thursday, Hidalgo called on officials to install more cameras at NRG Stadium.</p><p>""You can't really make things out because it's very dark and it's from a distance,"" she said.</p><p>Fox News Digital has reached out to Hidalgo. As the county judge, Hidalgo serves as its chief executive and presiding officer of the Commissioners Court, the county's governing body, managing a budget over $4 billion.</p>",https://www.foxnews.com/us/texas-judge-who-played-victim-card-booted-rodeo-grounds-second-time-vip-seating-dispute,2026-03-13
19,Brooks Nader addresses Kevin Costner dating speculation,"<p>Brooks Nader is addressing romance rumors with <a href=""https://www.foxnews.com/category/person/kevin-costner"" rel=""noopener"" target=""_blank"">Kevin Costner</a> after photos of the pair went viral online.</p><p>Earlier this month, Nader, 29, and Costner, 71, were spotted at the Las Vegas opening of the social club Zero Bond.</p><p>According <a href=""https://www.tmz.com/2026/03/07/kevin-costner-with-brooks-nader-in-las-vegas/"" rel=""nofollow noopener"" target=""_blank"">to TMZ</a>, the model and actor were both in attendance at Scott Sartiano’s VIP dinner on March 7.  The outlet also noted that Nader and Costner's conversation seemed more platonic than romantic.</p><p>Speaking to <a href=""https://www.etonline.com/media/videos/brooks-nader-reveals-relationship-status-amid-kevin-costner-dating-rumors-exclusive"" rel=""nofollow noopener"" target=""_blank"">Entertainment Tonight</a>, Nader shut down those rumors after being asked about their interaction.</p><p><a href=""https://www.foxnews.com/entertainment/brooks-nader-flaunts-bikini-body-steamy-dominican-republic-photo-shoot-sisters"" rel=""noopener"" target=""_blank""><strong>BROOKS NADER AND SISTERS POSE FOR BIKINI PHOTO SHOOT DURING DOMINICAN REPUBLIC GETAWAY</strong></a></p><p>""Oh my gosh. I am single. As of right now, I am single,"" she told the outlet before covering her face with her hands. Nader then shifted the conversation to her role in the upcoming ""Baywatch"" reboot, sharing that she's fully investing her time into preparing for the show.</p><p>Fox is gearing up to reboot the iconic lifeguard show with a slew of new, young cast members. Including Nader, the ""Baywatch"" reboot cast will include gymnast Livvy Dunne, Stephen Amell, Shay Mitchell, Jessica Belkin and Noah Beck.</p><p>Per the <a href=""https://www.hollywoodreporter.com/tv/tv-news/brooks-nader-fox-baywatch-reboot-1236525182/"" rel=""nofollow noopener"" target=""_blank"">Hollywood Reporter</a>, the <a href=""https://www.foxnews.com/category/entertainment/tv"" rel=""noopener"" target=""_blank"">new ""Baywatch""</a> is set to launch during the 2026-2027 season. Filming will take place in Venice Beach and Fox’s Century City backlot this spring.</p><p><a href=""https://www.foxnews.com/entertainment"" rel=""noopener"" target=""_blank""><strong>LIKE WHAT YOU’RE READING? CLICK HERE FOR MORE ENTERTAINMENT NEWS</strong></a></p><p>The new show's synopsis reads: ""The wild child Hobie Buchannon we all loved from the original series is now a Baywatch Captain, following in the footsteps of his legendary father, Mitch. Hobie’s world is turned upside down when Charlie, the daughter he never knew, shows up on his doorstep, eager to carry on the Buchannon family legacy and become a Baywatch lifeguard alongside her dad.""</p><p>""OG heartthrob Cody Madison now runs The Shoreline, the unofficially official Baywatch bar-and-grill, and still puts on the red trunks for the occasional shift saving lives. He’s a mentor to and a friend, providing a second home for his fellow lifeguards… and always offering free wings after a big save,"" the synopsis concluded.</p><p><a href=""https://www.foxnews.com/newsletters?cmpid=fnfirstnl"" rel=""noopener"" target=""_blank""><strong>CLICK HERE TO SIGN UP FOR THE ENTERTAINMENT NEWSLETTER</strong></a></p><p>Nader rose to fame on the <a href=""https://www.foxnews.com/category/entertainment/genres/reality"" rel=""noopener"" target=""_blank"">reality series</a> ""Love Thy Nader,"" in which she stars alongside her three sisters.</p><p>The show documents the sisters living <a href=""https://www.foxnews.com/category/us/us-regions/northeast/new-york"" rel=""noopener"" target=""_blank""><u>under one roof in New York</u></a>, something Brooks has admitted ""is a struggle"" at times, while capturing both the high-profile moments and the blowups that come with four strong personalities sharing a space.</p>",https://www.foxnews.com/entertainment/brooks-nader-addresses-kevin-costner-dating-speculation,2026-03-13
20,Sleep remedy dubbed ‘nature’s Valium’ sparks debate among experts,"<p>→ Ancient herb known as ""nature’s Valium"" touted for <a href=""https://www.foxnews.com/health/ancient-herb-known-natures-valium-touted-improving-sleep-anxiety"" rel=""noopener"" target=""_blank"">improving sleep and anxiety</a></p><p>→ <a href=""https://www.foxnews.com/health/cannabis-compounds-could-reverse-disease-affecting-one-third-adults"" rel=""noopener"" target=""_blank"">Cannabis compounds</a> could reverse disease affecting one-third of adults</p><p>→ Highly contagious virus with no treatment spreading rapidly through <a href=""https://www.foxnews.com/health/highly-contagious-virus-no-treatment-spreading-rapidly-through-western-state"" rel=""noopener"" target=""_blank"">western state</a></p><p>→ GLP-1 drugs linked to <a href=""https://www.foxnews.com/health/glp-1-drugs-tied-fracture-risk-older-adults-new-studies-suggest"" rel=""noopener"" target=""_blank"">higher fracture risk</a>, osteoporosis and gout</p><p>→ Report reveals what’s driving <a href=""https://www.foxnews.com/health/alarming-report-reveals-whats-driving-deadly-cancer-surge-young-adults"" rel=""noopener"" target=""_blank"">deadly cancer surge</a> in young adults</p><p>→ ""<a href=""https://www.foxnews.com/health/fire-breathing-trend-linked-severe-burns-teens-officials-warn"" rel=""noopener"" target=""_blank"">Fire-breathing</a>"" trend linked to severe burns in teens</p><p>→ Toxic people in your life may have a <a href=""https://www.foxnews.com/health/toxic-people-your-life-may-have-hidden-health-impact-study-suggests"" rel=""noopener"" target=""_blank"">hidden health impact</a></p><p>→ Nearly half of seniors improve with age — and researchers think <a href=""https://www.foxnews.com/health/nearly-half-seniors-improve-age-researchers-think-know-why"" rel=""noopener"" target=""_blank"">they know why</a></p><p>→ What's healthier to drink, <a href=""https://www.foxnews.com/health/whats-healthier-drink-cold-hot-water-heres-what-expert-says"" rel=""noopener"" target=""_blank"">cold or hot water</a>? Experts spill the truth</p><p><strong>""When we run into burning buildings, it's really the invisible exposures over decades that threaten our lives. Being strong doesn't cancel out toxic exposures or sleep deprivation.""</strong></p><p>→ A <a href=""https://www.foxnews.com/health/firefighter-credits-strict-home-routine-medical-tests-stay-alive-well-past-retirement"" rel=""noopener"" target=""_blank"">California firefighter</a> credits his ""strict"" home routine and wellness checks for keeping him alive well past retirement.</p><p><a href=""https://www.foxnews.com/health"" rel=""noopener"" target=""_blank""><strong><u>CLICK HERE FOR MORE HEALTH STORIES</u></strong></a></p>",https://www.foxnews.com/health/sleep-remedy-dubbed-natures-valium-sparks-debate-among-experts,2026-03-13
21,Boxer Jake Paul hints at future run for office in interview with Trump,"<p>Popular YouTuber-turned-professional boxer <a href=""https://www.foxnews.com/category/person/jake-paul"" rel=""noopener"" target=""_blank"">Jake Paul</a> indicated he is planning to run for office in a recent sit-down interview with President Donald Trump. </p><p>During an <a href=""https://www.youtube.com/watch?v=PsOW9x2sOKY"" rel=""nofollow noopener"" target=""_blank"">interview posted</a> to Paul's YouTube channel Friday, Trump asked him if he would run for office. The president endorsed Paul for a potential office run during a speech at a packaging plant in Boone County, Kentucky, Thursday.</p><p>""I think so,"" Paul answered. ""I see myself as wanting to get more into this world. I believe it's the biggest way to create impact and change in America.""</p><p><a href=""https://www.foxnews.com/sports"" rel=""noopener"" target=""_blank""><strong><u>CLICK HERE FOR MORE SPORTS COVERAGE ON FOXNEWS.COM</u></strong></a></p><p>If and when Paul does <a href=""https://www.foxnews.com/politics"" rel=""noopener"" target=""_blank"">get into politics</a>, he will have Trump as a high-profile ally. Trump shared his own experience getting into politics as an outsider in the interview. </p><p>""It's hard. A lot of people talk about it. You had to do it. And I had one shot left because you get to a certain age. You have a few years left. You know, the timing was good, but if I waited longer, it wouldn't have been good because of the clock. You know, the famous clock. Father time,"" Trump said. </p><p>At a rally Wednesday, Trump gave Paul his ""complete and total endorsement"" should the boxer choose to pursue political office.</p><p><a href=""https://www.foxnews.com/sports/jake-paul-praises-trumps-leadership-says-america-healing-slowly-under-second-term-administration"" rel=""noopener"" target=""_blank""><strong>JAKE PAUL PRAISES TRUMP’S LEADERSHIP, SAYS AMERICA IS 'HEALING SLOWLY' UNDER SECOND-TERM ADMINISTRATION</strong></a></p><p>Trump delivered the initial comments at a political rally at a logistics and transportation plant in <a href=""https://www.foxnews.com/category/us/us-regions/southeast/kentucky"" rel=""noopener"" target=""_blank"">Kentucky</a>.</p><p>""I’m going to make a prediction that you will be, in the not-too-distant future, running for political office,"" Trump said. ""You have my complete and total endorsement.""</p><p>During the rally, Paul praised Trump for his ""courage.""</p><p>""What Mr. Trump has taught me is courage. We never back down from a fight, even if they’re much bigger than you, much, much bigger than you,"" Paul said. ""I feel all the local Kentuckians feel the same way. You guys have that fight. You guys have that swag.""</p><p>The two later did Trump's signature dance in a TikTok video posted by Paul. </p><p><i><strong>Follow Fox News Digital’s </strong></i><a href=""https://twitter.com/FoxNewsSports_"" rel=""nofollow noopener"" target=""_blank""><i><strong><u>sports coverage on X</u></strong></i></a><i><strong>, and subscribe to </strong></i><a href=""https://www.foxnews.com/newsletters"" rel=""noopener"" target=""_blank""><i><strong><u>the Fox News Sports Huddle newsletter</u></strong></i></a><i><strong>.</strong></i></p>",https://www.foxnews.com/sports/boxer-jake-paul-hints-future-run-office-interview-trump,2026-03-13
