,title,text,link,publish_date
6,'No Kings' calls itself leaderless but its own internal documents tell a very different story,"<p>""No Kings,"" a decentralized protest movement that crystallized in opposition to President <a href=""https://www.foxnews.com/category/person/donald-trump"" rel=""noopener"" target=""_blank"">Donald Trump's</a> second term, will hold thousands of events on Saturday morning, according to Sarah Parker, an organizer for one of the events in Minneapolis, Minnesota.</p><p>The protests mark the most recent development for the amorphous group, which has prompted similar events in the past.</p><p>""Tomorrow we’re going to have over 3,500 events across the country,"" Parker said. ""I think it’s important to be out in the streets at this moment in time to save our country. The events will be overwhelmingly peaceful and there are going to be millions of Americans from different affiliations, different ages and different ethnic backgrounds coming together to be in community.""</p><p>Parker did not describe how ""No Kings"" works with local figures to organize events but said the protests aim to build on local displeasure with the administration.</p><p><a href=""https://www.foxnews.com/opinion/liz-peek-democrat-fury-fuels-no-kings-protests-endgame-elusive"" rel=""noopener"" target=""_blank""><strong>LIZ PEEK: DEMOCRAT FURY FUELS 'NO KINGS' PROTESTS BUT ENDGAME IS ELUSIVE</strong></a></p><p>""I think this is organic. This is a <a href=""https://www.foxnews.com/category/world/world-protests"" rel=""noopener"" target=""_blank"">people-powered movement.</a> We have different local hosts that are volunteers who have stepped up to host an event in their areas, even in rural areas. We have hundreds of events in rural and deep-red states,"" Parker said.</p><p>Unlike other organized organizations, ""No Kings"" is not a non-profit, a business, or a formal organization, making its structure a mystery. Because of its lack of centralization, it has little to no financial reporting requirements and no easily identifiable leadership.</p><p>""No Kings"" first burst onto the scene through ""No Kings Day"" in June 2025, an event that, in the words of their website, inspired ""a nationwide uprising 14 times larger than both of Trump’s inaugurations combined.""</p><p><a href=""https://www.foxnews.com/politics/no-kings-protesters-filmed-having-children-stab-trump-pinata"" rel=""noopener"" target=""_blank""><strong>'NO KINGS' PROTESTERS FILMED HAVING CHILDREN BASH TRUMP PIÑATA</strong></a></p><p>Almost a year later, the protests scheduled for Saturday hope to continue their opposition, touting opposition to <a href=""https://www.foxnews.com/category/politics/defense/wars/war-with-iran"" rel=""noopener"" target=""_blank"">Trump’s recent actions in Iran</a> and debates over immigration enforcement.</p><p>""Masked secret police terrorizing our communities. An illegal, catastrophic war putting us in danger and driving up our costs. Attacks on our freedom of speech, our civil rights, our freedom to vote. Costs pushing families to the brink,"" their website’s description reads.</p><p>Despite Parker’s framing of a decentralized movement, No Kings <a href=""https://docs.google.com/document/d/1OcSWCTKcSHKh8UYdYLxpDnjgQk3a29fLVdiHyedxET0/edit?tab=t.0#heading=h.mon1hs975o57"" rel=""noopener noreferrer nofollow"" target=""_blank"">provides a highly-structured document for organizers</a> titled ""March 28 Toolkit,"" instructing viewers on how to recruit their own speakers, delegate roles, register their event and use No Kings branded media materials. It also lays out best practices for logistics as well as how to avoid permitting and insurance requirements for event-holders.</p><p><a href=""https://www.foxnews.com/media/bruce-springsteen-doubles-down-anti-trump-anti-ice-stance-says-blowback-just-part-it"" rel=""noopener"" target=""_blank""><strong>BRUCE SPRINGSTEEN DOUBLES DOWN ON ANTI-TRUMP, ANTI-ICE STANCE, SAYS 'BLOWBACK IS JUST PART OF IT'</strong></a></p><p>Notably, the document also includes a ""host hotline,"" providing a number with a <a href=""https://www.foxnews.com/category/shows/the-five"" rel=""noopener"" target=""_blank"">Maryland area code.</a></p><p>A map of events scheduled for Saturday shows organizational activity in the vast majority of urban centers across the country. Parker said that no one center will play a lead role, but that Minneapolis will act as a ""flagship."" </p><p>Parker isn’t affiliated with No Kings directly. Instead, she described herself as a part of 50501 — another decentralized organization that partners with No Kings. She did not describe the nature of the partnership or how they interacted amid their similarly decentralized structures.</p><p><a href=""https://www.foxnews.com/us/revolutionary-tourism-inside-600m-marriage-dark-money-far-left-agitprop"" rel=""noopener"" target=""_blank""><strong>REVOLUTIONARY TOURISM: INSIDE THE $600M MARRIAGE OF DARK MONEY AND FAR-LEFT AGITPROP</strong></a></p><p>Asked what 50501 meant, Parker said the name originally stood for ""50 states, 50 capitols, one day.""</p><p>It, too, is not registered as a non-profit or as a business.</p><p>When asked who should be listening to No Kings’ messaging, Parker said she believes <a href=""https://www.foxnews.com/category/politics/house-of-representatives/leadership"" rel=""noopener"" target=""_blank"">its lawmakers</a> that should pay attention.</p><p>""I think it's for any elected official that is not listening to their constituents again. It should be a message for any, any <a href=""https://www.foxnews.com/category/politics/elections"" rel=""noopener"" target=""_blank"">elected officials,</a> regardless of their political affiliation,"" Parker said.</p>",https://www.foxnews.com/politics/no-kings-calls-itself-leaderless-its-own-internal-documents-tell-very-different-story,2026-03-28
7,"DC court rulings stall Trump agenda across immigration, policing, Fed — raising stakes on executive power","<p>President <a href=""https://www.foxnews.com/category/person/donald-trump"" rel=""noopener"" target=""_blank"">Donald Trump's</a> second-term agenda is hitting repeated roadblocks in Washington, D.C., federal court, where judges have halted major policies — fueling a growing clash over whether the judiciary is checking executive power or overstepping into it.</p><p>The rulings have halted key parts of Trump’s agenda on immigration, policing and federal authority, intensifying debate over whether courts are acting as a constitutional check or obstructing elected leadership.</p><p>Here are some of the biggest court clashes Trump is facing in D.C. federal court.</p><p>One of the biggest fights is also one of the earliest lawsuits filed against the Trump administration in D.C. federal court  — centered on the Trump administration's use of the <a href=""https://www.foxnews.com/politics/detained-migrants-given-12-hours-contest-deportation-under-alien-enemies-act-ice-document"" rel=""noopener"" target=""_blank""><u>Alien Enemies Act</u></a>, a 1798 wartime law, to deport certain migrants to El Salvador's CECOT prison.</p><p>Civil rights groups and immigration advocates have argued the Trump administration is stretching the law beyond its intended use case, including the three previous times it was used in U.S. history — most recently, during World War II. The Trump administration has defended the move as a lawful exercise of executive authority over national security and immigration enforcement.</p><p>The case quickly landed in D.C. federal court and has since moved up on appeal, with higher courts now weighing the scope of the president’s authority under the centuries-old statute. The outcome could have sweeping implications for how rarely used emergency powers are applied in modern immigration policy.</p><p><a href=""https://www.foxnews.com/politics/ex-judges-blast-top-trump-doj-official-declaring-war-courts"" rel=""noopener"" target=""_blank""><strong><u>EX-JUDGES BLAST TOP TRUMP DOJ OFFICIAL FOR DECLARING ‘WAR’ ON COURTS</u></strong></a><br /> </p><p>The scope of federal power over states and localities has also been tested. Courts have imposed limits on Trump’s efforts to assert control over National Guard units, raising federalism concerns about the balance between state and federal authority.</p><p>The standoff began in August 2025. Trump moved to expand federal control over policing in Washington, D.C., including deploying National Guard troops to <a href=""https://www.foxnews.com/politics/trump-takes-control-metro-police-deploys-national-guard-take-washington-crime"" rel=""noopener"" target=""_blank"">respond to crime</a>. </p><p>A related lawsuit, District of Columbia v. Trump, challenges what city officials describe as an<a href=""https://www.foxnews.com/politics"" rel=""noopener"" target=""_blank""> unprecedented federal intrusion </a>into local policing. The case remains a key test of presidential authority over the nation’s capital.</p><p>The Supreme Court agreed to hear a pair of appeals from the <a href=""https://www.foxnews.com/category/person/donald-trump"" rel=""noopener"" target=""_blank""><u>Trump administration</u></a> seeking to immediately halt Temporary Protected Status (TPS) designations for Haitian migrants. Haitians were first granted TPS status in 2010 after a devastating earthquake. Previously, a lower court judge in D.C., U.S. District Judge Ana Reyes, had blocked the Trump administration from lifting the TPS designation.</p><p>U.S. Solicitor General D. John Sauer urged the high court to take up the broader issue of whether the Trump administration can revoke TPS protections for other migrants living in the U.S. — citing the Justice Department's appeal of a similar case centered on TPS protections for Syrian migrants that was kicked to the high court earlier this year.</p><p>""Unless the court resolves the merits of these challenges — issues that have now been ventilated in courts nationwide — this unsustainable cycle will repeat again and again, spawning more competing rulings and competing views of what to make of this court’s interim orders,"" Sauer said last week. ""This court should break that cycle.""</p><p>The appeal comes as the Trump administration has sought to wind down most TPS designations, arguing the programs have been extended for too long under Democratic presidents.</p><p>""Haiti’s TPS was granted following an earthquake that took place over 15 years ago,"" said then-spokesperson for DHS Tricia McLaughlin. ""It was never intended to be a <a href=""https://www.foxnews.com/politics/trump-administration-blocked-ending-temporary-protected-status-haitians"" rel=""noopener"" target=""_blank"">de facto amnesty program</a>, yet that’s how previous administrations have used it for decades.""</p><p><a href=""https://www.foxnews.com/politics/scotus-review-trump-executive-order-birthright-citizenship""><strong><u>SCOTUS TO REVIEW TRUMP EXECUTIVE ORDER ON BIRTHRIGHT CITIZENSHIP</u></strong></a></p><p>Early in the term, the administration’s effort to rapidly scale back the U.S. Agency for International Development was halted by a federal judge, who blocked mass leave orders and the dismantling of the agency’s workforce.<br /><br />The Supreme Court eventually intervened in the case. Last March, the high court denied the Trump administration's request to block a lower court's order for the administration to pay nearly $2 billion in foreign aid money for previously completed projects, and leaving to the lower court judge the details of how those contracts should be paid out. That suit was eventually appealed to a higher court, where litigation remains pending.</p><p><a href=""https://www.foxnews.com/politics/federal-judge-rules-trumps-third-country-deportation-policy-unconstitutional"" rel=""noopener"" target=""_blank""><strong><u>BIDEN-APPOINTED FEDERAL JUDGE RULES TRUMP'S 'THIRD COUNTRY' DEPORTATION POLICY IS UNCONSTITUTIONAL</u></strong></a></p><p>The independence of the Federal Reserve is also an issue before the courts.</p><p>Lawyers for the <a href=""https://www.foxnews.com/category/person/donald-trump"" rel=""noopener"" target=""_blank""><u>Trump administration</u></a> asked U.S. District Judge James Boasberg earlier this month to reconsider an earlier order that quashed grand jury subpoenas of Federal Reserve Chair Jerome Powell, appearing to make good on a vow from U.S. Attorney for D.C. Jeanine Pirro to appeal the order to a higher court.</p><p>In the Justice Department's motion for reconsideration that was submitted Monday, prosecutors argued that the court ""applied an incorrect legal standard, erred with respect to certain facts, and overlooked other relevant facts."" </p><p>They argued that a subpoena should be allowed when there is even a ""reasonable possibility"" that the category of materials the government seeks will produce information ""relevant to the general subject of the grand jury’s investigation,"" and even where a subpoena recipient ""proposes a plausible theory of an ulterior motive.""</p><p>The Supreme Court heard oral arguments in a separate case, Trump v. Cook, earlier this year. That case centered on whether Trump has the power to fire Lisa Cook from the Fed's board of governors — without notice and largely without the ability for courts to challenge the ""for cause"" provision underpinning her removal.</p><p>Cook remains in her position for now, following an order from U.S. District Court Judge Jia Cobb. </p><p>Meanwhile, White House officials have railed against the ""activist"" judges who they have accused of overstepping their agenda or acting with a political agenda to halt or pause Trump's policies from taking force.  </p>",https://www.foxnews.com/politics/dc-court-rulings-stall-trump-agenda-across-immigration-policing-fed-raising-stakes-executive-power,2026-03-28
8,Dem senators dodge crucial question on illegal alien accused of killing Chicago college student,"<p>While Republican senators, like Texas' Ted Cruz and Florida's Rick Scott, were quick to condemn the policies that kept the <a href=""https://www.foxnews.com/category/us/immigration/migrant-crime"" rel=""noopener"" target=""_blank"">illegal immigrant killer</a> of 18-year-old Sheridan Gorman from being deported, Democratic senators dodged questions on whether Gorman's killer should have previously been deported prior to this month's murder.</p><p>Gorman, who was a student at Loyola University of Chicago at the time of her death, was allegedly killed by an illegal immigrant from Venezuela, Jose Medina, 25. Medina was apprehended by U.S. Border Patrol on May 9, 2023, but was subsequently released into the U.S. under the Biden administration, according to Trump's <a href=""https://www.foxnews.com/category/politics/executive/homeland-security"" rel=""noopener"" target=""_blank"">Department of Homeland Security.</a> </p><p>A short time later, Medina was arrested for shoplifting in Chicago, but was again released on June 19, 2023, DHS said. A judge put a warrant out on Medina after he failed to appear in court for his shoplifting charge, which was still active at the time of Gorman's killing, according to the Chicago Sun Times. </p><p>""Shoplifting in and of itself is not a violent crime. It's not an indicator of a person that's leaning toward violent crime,"" said Sen. Dick Durbin, D-Ill., when asked about Medina's case and whether he should've been deported prior to Gorman's murder. </p><p><a href=""https://www.foxnews.com/us/illegal-immigrant-accused-killing-chicago-college-student-face-court-after-tuberculosis-delay"" rel=""noopener"" target=""_blank""><strong><u>ILLEGAL IMMIGRANT ACCUSED OF KILLING CHICAGO COLLEGE STUDENT TO FACE COURT AFTER TUBERCULOSIS DELAY</u></strong></a></p><p>""You're asking me to speculate on a bunch of things and I can't answer that,"" said Sen. Catherine Cortez-Masto, D-Nev., when asked if Gorman's killer, and other illegal immigrant murderers who had significant criminal records at the time of their arrests, should have been deported before people got hurt. ""I don't know the cases. I trust our justice system to do the right thing and hold people accountable.""</p><p>Sen. Tammy Duckworth, D-Ill., responded that the Trump administration's broad deportation crackdowns have prevented federal law enforcement from targeting genuinely dangerous people, an argument pushed by other top Democrats in Congress. ""I think that if Trump cleared out Chicago and if ICE did their job, he wouldn't be here, right?"" Duckworth said as she got onto an elevator on Capitol Hill. ""But they deported people who are not… [unintelligible].""</p><p>Meanwhile, Sen. Elissa Slotkin, D-Mich., offered a more judicious response, but also suggested the style by which the <a href=""https://www.foxnews.com/category/person/donald-trump"" rel=""noopener"" target=""_blank"">Trump administration</a> is deporting people is problematic. </p><p>""Do I think violent criminals should be deported? Yes,"" Slotkin said, adding it is an ""easy"" call to deport someone who has been ""accused and properly prosecuted."" But, Slotkin added, ""Innocent civilians who are protesting their government and using their freedom of speech should not be fingered and booted out."" </p><p>Democrats who spoke with Fox News Digital did quickly agree that violent criminals who entered and are residing in the country unlawfully should be deported.</p><p><a href=""https://www.foxnews.com/us/sheridan-gorman-university-newspaper-touts-ice-tracker-after-freshman-allegedly-murdered-illegal-alien"" rel=""noopener"" target=""_blank""><strong><u>SHERIDAN GORMAN'S UNIVERSITY NEWSPAPER TOUTS ICE TRACKER AFTER FRESHMAN ALLEGEDLY MURDERED BY ILLEGAL ALIEN</u></strong></a></p><p>""Anybody who violates, or creates crime in this country – particularly kills somebody – should not only be held accountable in the United States, but, yes, there should be immigration enforcement against that individual,"" Cortez-Masto said. </p><p>""Every community deserves to feel safe, and I think people who commit <a href=""https://www.foxnews.com/category/crime"" rel=""noopener"" target=""_blank"">violent crimes</a> should not be allowed to either be in our country, or to be among our communities,"" added Sen. Angela Alsobrooks, D-Md. </p><p>Durbin, meanwhile, qualified his comments about Medina's shoplifting charge by admitting ""We ought to do a careful examination of people coming into this country and those who want to stay in this country,"" adding that, ""If they are dangerous to the community, they need to be denied entry or taken out of the country later.""</p><p>But Republican Senators Cruz and Scott were quick to bash Democrats for allegedly caring more about illegal immigrants than American citizens.</p><p>""It's tragic and it was avoidable,"" Cruz said when approached about Gorman's death and Medina not being deported. ""The Democrats are so radical they prioritize <a href=""https://www.foxnews.com/us/dhs-arrests-5-illegal-immigrants-convicted-violent-crimes-including-manslaughter-child-assault"" rel=""noopener"" target=""_blank"">illegal immigrants</a> over American citizens.""</p><p>""It's disgusting that these people say, ‘Oh, they act like they care about Americans.’ But then you look at their actions – they care about people who are here violently hurting Americans,"" Scott complained.</p>",https://www.foxnews.com/politics/dem-senators-dodge-crucial-question-illegal-alien-accused-killing-chicago-college-student,2026-03-28
9,Too loud? Ticket’s in the mail,"<p>You already know about speed cameras. Red light cameras. Toll cameras that photograph your plate and bill you later.</p><p>Now meet their cousin. Noise cameras are the newest automated enforcement technology spreading through American cities. A pole-mounted device contains sensitive microphones paired with a <a href=""https://www.foxnews.com/category/tech/technologies/cameras"" rel=""noopener"" target=""_blank"">license plate camera</a>.</p><p><a href=""https://www.foxnews.com/tech/someone-gets-your-email-they-own-every-account-you-have-these-3-moves-lock-them-out"" rel=""noopener"" target=""_blank""><strong>IF SOMEONE GETS INTO YOUR EMAIL, THEY OWN EVERY ACCOUNT YOU HAVE. THESE 3 MOVES LOCK THEM OUT FOR GOOD</strong></a></p><p>Your car drives past. If your exhaust tips over the legal decibel limit, a ticket arrives in your mailbox days later. No warning. No officer pulling you over. No flashing lights in your rearview mirror. Just a microphone that never blinks, never takes a break and never misses a shift.</p><p><a href=""https://www.foxnews.com/category/us/new-york-city"" rel=""noopener"" target=""_blank"">New York City</a> has been running these since 2021. The cameras have issued more than 1,600 violations and collected nearly $2 million in fines. Get caught once, and you're looking at $800. Get caught repeatedly, and the fine climbs to $2,500.</p><p><a href=""https://www.foxnews.com/category/us/us-regions/northeast/rhode-island"" rel=""noopener"" target=""_blank"">Newport, Rhode Island</a>, put two cameras on scenic Ocean Avenue. Within days, a Mustang GT got nailed at 85 decibels. Two decibels over the limit. $250 fine. Providence approved $180,000 to add cameras in 2026. Connecticut passed statewide legislation.</p><p>California has six cities running a five-year pilot program with fines up to $1,105. Chicago, Miami, Philadelphia, Sacramento and Washington, D.C., are all deploying or testing. Colorado, New Jersey and Hawaii have introduced similar legislation. This is not a local story anymore. It's a national one moving fast, and most drivers have absolutely no idea it's coming for them.</p><p><a href=""https://www.foxnews.com/tech/5-simple-tech-tips-take-back-control-your-social-media"" rel=""noopener"" target=""_blank""><strong>5 SIMPLE TECH TIPS TO TAKE BACK CONTROL OF YOUR SOCIAL MEDIA</strong></a></p><p>Here's how the technology actually works. </p><p>The microphone detects sound above the legal threshold, typically between 75 and 95 decibels depending on the city. To put that in plain English, a normal conversation runs about 60 decibels. A lawnmower hits around 90. Most cities are drawing the line somewhere in between. The camera cross-references the sound spike with the exact moment a vehicle passes, photographs the plate, and generates the ticket automatically. No officer involved. No human review in most cases. Just math, a microphone and a camera pointed at your plate.</p><p>When I'm in my Porsche and flip into manual mode, rowing through the gears with that beautiful exhaust note singing, I'm not doing the math on that out loud. Let's just say I'm watching the camera location maps very carefully. You probably should too.</p><p>Here's what should concern drivers with completely stock vehicles. That Mustang GT wasn't a tuned track car. It's a car you buy at a dealership. Two decibels over the limit. $250 gone. Motorcycles are even more exposed. A stock Harley-Davidson idles around 75 decibels and can hit 90 under acceleration. Well inside the danger zone in several cities already running cameras. You don't need a modified exhaust to get a ticket. You just need bad timing.</p><p><a href=""https://www.foxnews.com/category/tech/artificial-intelligence"" rel=""noopener"" target=""_blank"">AI is being used</a> to pinpoint which specific vehicle in a group triggered the alert. Not just the loudest car in the frame. Your car. The tech is getting smarter every single month.</p><p><a href=""https://www.foxnews.com/tech/drone-food-delivery-launches-new-jersey"" rel=""noopener"" target=""_blank""><strong>DRONE FOOD DELIVERY LAUNCHES IN NEW JERSEY</strong></a></p><p>There are two valid sides here.</p><p>If someone with a straight-pipe exhaust does a flyby past your bedroom at midnight, you're probably delighted they got caught. <a href=""https://www.foxnews.com/category/science/planet-earth/pollution"" rel=""noopener"" target=""_blank"">Noise pollution</a> is a real health issue linked to sleep disorders, elevated blood pressure and anxiety. Cities have tried everything and nothing worked at scale until now.</p><p>But this is also another layer of always-on surveillance that never forgets and never gives you the benefit of the doubt. Critics have raised legitimate questions about whether <a href=""https://www.foxnews.com/category/us/immigration/enforcement"" rel=""noopener"" target=""_blank"">cameras get placed</a> disproportionately in lower-income neighborhoods, turning a public health tool into a revenue machine aimed at the wrong zip codes. Fair questions worth asking out loud.</p><p>These cameras are spreading faster than most drivers realize. Search <a href=""https://www.foxnews.com/category/cities"" rel=""noopener"" target=""_blank"">your city name</a> plus ""noise camera ordinance"" to find the exact decibel limits where you live. Know the number before the camera does.</p><p>Send this to someone who is a car enthusiast, a motorcycle rider or anyone with a loud vehicle. Forward this before they find out the hard way. Consider it your good deed for the week.</p><p><i>Copyright 2026, WestStar Multimedia Entertainment. All rights reserved.</i></p>",https://www.foxnews.com/tech/too-loud-tickets-mail,2026-03-28
